rank,caption,mean,precision,votes,not_funny,somewhat_funny,funny
1445,"I don't know, Officer. I came out of nowhere.",1.268041237113402,0.057726589097362,97,77,14,6
1446,One of your tail lights isn't working.,1.268041237113402,0.0518462071120777,97,74,20,3
1447,Great Salt Flats? Take the next left...,1.268041237113402,0.0558353154957798,97,76,16,5
1448,"Well, if we're getting technical, you violated a traffic theory.",1.268041237113402,0.0558353154957798,97,76,16,5
1449,"Aw, hell's bells Mr. Musk. How many times are we gonna have to do this?",1.268041237113402,0.057726589097362,97,77,14,6
1450,"Officer, I couldnt hear the siren!",1.268041237113402,0.0497318063175474,97,73,22,2
1451,Any idea?..any?.....a wild guess then.,1.268041237113402,0.0558353154957798,97,76,16,5
1452,Your orbit's a little low.,1.268041237113402,0.0538776931968218,97,75,18,4
1453,"I've never heard of the Mach America Great Again Tour, sir",1.268041237113402,0.0558353154957798,97,76,16,5
1454,"No, YOU call NASA, while I run your rocket scientist license.",1.268041237113402,0.057726589097362,97,77,14,6
1455,Did you know you have a right tail light out?,1.268041237113402,0.0613344304075654,97,79,10,8
1456,"Officer, I'll gladly take the ticket if you can explain how you caught me.",1.268041237113402,0.0538776931968218,97,75,18,4
1457,"You can't pull a fast one on me, pal.",1.268041237113402,0.0538776931968218,97,75,18,4
1458,You've got a broken rear gimbal stabilizer.,1.268041237113402,0.0538776931968218,97,75,18,4
1459,"Officer, I'm just trying to get to Canada before they build the wall.",1.268041237113402,0.0613344304075654,97,79,10,8
1460,Did you know your afterburner is out?,1.268041237113402,0.0538776931968218,97,75,18,4
1461,I'm going to have to fine you for obvious over compensation.,1.268041237113402,0.0558353154957798,97,76,16,5
1462,Sounds like you have a hole in your muffler.,1.268041237113402,0.0558353154957798,97,76,16,5
1463,"I'm not disputing you hit an asteroid, but your tail light is out.",1.268041237113402,0.0595578350942852,97,78,12,7
1464,"Son, I'm affraid delivering a pizza under 30 minutes is not the law.",1.268041237113402,0.0538776931968218,97,75,18,4
1465,"In two minutes you'll be across the state line, do YOU have any idea what the emission fines are in California?",1.268041237113402,0.0538776931968218,97,75,18,4
1466,"Exactly what sort of name is ""Elon""?",1.268041237113402,0.057726589097362,97,77,14,6
1467,You were doing Mach 3 in a Mach 1 zone.,1.268041237113402,0.0538776931968218,97,75,18,4
1468,You don't want to know how fast I was going.,1.268041237113402,0.057726589097362,97,77,14,6
1469,"Sorry, son, this here's a fly-over state.",1.268041237113402,0.0558353154957798,97,76,16,5
1470,Do you realize you were doing Mach 3 in a 45 mile per hour zone?,1.2653061224489797,0.0590103893261588,98,79,12,7
1471,Save that relativity nonsense for the judge. Do you know how fast you were going in THIS reference frame?,1.2653061224489797,0.0553302736029312,98,77,16,5
1472,Where's your front license plate?,1.2653061224489797,0.0513872776621375,98,75,20,3
1473,"Officer, you must understand I'm trying to move to Canada by the fastest means possible.",1.2653061224489797,0.0553302736029312,98,77,16,5
1474,"Try the speed of sound, wise guy.",1.2653061224489797,0.0553302736029312,98,77,16,5
1475,"Well, your registration says this is a 2013 VW Jetta, but I'm going to assume that's just a DMV screw-up.",1.2653061224489797,0.0492976558246009,98,74,22,2
1476,"Did you not see the ""Rockets Must Exit"" sign?",1.2626262626262623,0.058472726087604,99,80,12,7
1477,"""Breaking the sound barrier"" isn't on here as an option under posted speed. I'm gonna have to let you go on a technicality.",1.2608695652173914,0.055447545442538,92,72,16,4
1478,". . .and you, sir, are no Elon Musk.",1.2604166666666667,0.0538939660446639,96,75,17,4
1479,I'm sorry sir. You can't park here.,1.2604166666666667,0.0578200317126466,96,77,13,6
1480,I hope it was a blast.,1.2604166666666667,0.0538939660446639,96,75,17,4
1481,It's refreshing to see dual exhaust on a hybrid.,1.2604166666666667,0.0558914825500042,96,76,15,5
1482,"I'm sorry Officer, was I speeding?",1.2604166666666667,0.0578200317126466,96,77,13,6
1483,"Yes it is an impressive phallic symbol, Mr Weiner, but texting while driving is still a ticketable offence.",1.2604166666666667,0.0578200317126466,96,77,13,6
1484,Breaking the sound limit gets you a ticket in these parts.,1.2604166666666667,0.0538939660446639,96,75,17,4
1485,I'm citing you for a dangerous hood ornament.,1.2604166666666667,0.0538939660446639,96,75,17,4
1486,So just how small is it?,1.2604166666666667,0.0538939660446639,96,75,17,4
1487,"It wasn't your speed, I saw you texting.",1.2604166666666667,0.0578200317126466,96,77,13,6
1488,I clocked you doing Mach 7 in a Mach 5 zone.,1.2604166666666667,0.0518195072381951,96,74,19,3
1489,"We've been over this, Mrs. Musk. You still need to wear a seatbelt.",1.2604166666666667,0.0518195072381951,96,74,19,3
1490,Your tail light is broken - got any idea how dangerous that is?,1.2604166666666667,0.0538939660446639,96,75,17,4
1491,"No, sir, I don't consider the relative time dilation as you approach the speed of light to be a mitigating factor.",1.2604166666666667,0.0558914825500042,96,76,15,5
1492,Mach 1 in a school zone and you didn't use your right turn signal.,1.2604166666666667,0.0518195072381951,96,74,19,3
1493,Sorry officer. I didn't realize I had entered a no-fly zone.,1.2604166666666667,0.0538939660446639,96,75,17,4
1494,"Nice try, this is Bonneville Louisiana.",1.2604166666666667,0.0538939660446639,96,75,17,4
1495,"I'm letting you off with a warning this time, but get that muffler fixed pronto.",1.2604166666666667,0.0538939660446639,96,75,17,4
1496,Your tail lights are burnt out,1.2604166666666667,0.0596862992056426,96,78,11,7
1497,"Buddy, it's the carbon footprint that troubles me most.",1.2604166666666667,0.0558914825500042,96,76,15,5
1498,Next time signal when you change lanes,1.2604166666666667,0.0558914825500042,96,76,15,5
1499,"You know, the speed limit is 55 miles per *hour*.",1.2604166666666667,0.0538939660446639,96,75,17,4
1500,I stopped you because your tail lights have incinerated a few cars.,1.2604166666666667,0.0538939660446639,96,75,17,4
1501,"Sir, you were traveling at 1,345,698 mph in a 60 zone.",1.2604166666666667,0.0558914825500042,96,76,15,5
1502,You had a rear thruster out.,1.2604166666666667,0.0473989961832662,96,72,23,1
1503,"I don't care what they let you get away with in California, Mr. Musk.",1.2604166666666667,0.0538939660446639,96,75,17,4
1504,"That's very interesting about the Klingons, sir, but I still need to see your license and registration.",1.2604166666666667,0.0538939660446639,96,75,17,4
1505,"You broke the sound barrier, along with a bunch of laws.",1.2604166666666667,0.0578200317126466,96,77,13,6
1506,"Do you know why I pulled you over, Sir?",1.2604166666666667,0.0578200317126466,96,77,13,6
1507,"I want to make sure your license says ""organ donor""",1.2604166666666667,0.0538939660446639,96,75,17,4
1508,"License and destination, please.",1.2604166666666667,0.0538939660446639,96,75,17,4
1509,"You weren't on a cell-phone, were you?",1.2604166666666667,0.0558914825500042,96,76,15,5
1510,"Don't tell me you didn't know I was behind you, I turned on my lights and siren over two-and-a-half states ago.",1.2604166666666667,0.0538939660446639,96,75,17,4
1511,"Ok buddy, so where's the Supernova?",1.2604166666666667,0.0518195072381951,96,74,19,3
1512,Faster than a speeding bullet is still speeding.,1.2604166666666667,0.0578200317126466,96,77,13,6
1513,License and country of origin,1.2604166666666667,0.0558914825500042,96,76,15,5
1514,That'll be $100 for speeding and $200 for way overcompensating.,1.2604166666666667,0.0518195072381951,96,74,19,3
1515,"Next time, get lost in space, not on earth.",1.2604166666666667,0.0538939660446639,96,75,17,4
1516,how did you catch me ?,1.2604166666666667,0.0558914825500042,96,76,15,5
1517,"It's not rocket science sir, your right tail light is out.",1.2604166666666667,0.0596862992056426,96,78,11,7
1518,The sign definitely does not say 555!,1.2604166666666667,0.0518195072381951,96,74,19,3
1519,"Ayup, I remember *my* first twin paradox solution, just like it was tomorrow.",1.2604166666666667,0.0518195072381951,96,74,19,3
1520,Did you know your left tail light is out?,1.2604166666666667,0.0578200317126466,96,77,13,6
1521,Are you aware of the speed of sound in these parts?,1.2604166666666667,0.0558914825500042,96,76,15,5
1522,"I'm pulling you over since you just violated Einstein's ""Theory of Special Relativity.""",1.2604166666666667,0.0578200317126466,96,77,13,6
1523,Should I cite you for over the speed limit or under the radar?,1.2604166666666667,0.0538939660446639,96,75,17,4
1524,We've had some reports of cows gittin singed. You know anythin about that?,1.2604166666666667,0.0538939660446639,96,75,17,4
1525,"I'm going to let you off with a warning, but let's try to keep it under 600.",1.2604166666666667,0.0558914825500042,96,76,15,5
1526,"Sir, are you aware that you were going Mach 5 in a 30mph zone?",1.2604166666666667,0.0596862992056426,96,78,11,7
1527,"License and advanced degree in aeronautical engineering, please.",1.2604166666666667,0.0558914825500042,96,76,15,5
1528,"Yeah, a lot of folks don't know that the new troopers can reach mach 1",1.2604166666666667,0.0518195072381951,96,74,19,3
1529,I'm going to let you blast off with a warning this time.,1.2604166666666667,0.0538939660446639,96,75,17,4
1530,"When you see the ticket I'm writing, you might want to park this in the Smithsonian",1.2604166666666667,0.0578200317126466,96,77,13,6
1531,Where' your seat belt?,1.2604166666666667,0.0538939660446639,96,75,17,4
1532,35? Are you sure? I could have sworn it said 350....,1.2604166666666667,0.0596862992056426,96,78,11,7
1533,"Sir, your tail light is out-of-this-world.",1.2604166666666667,0.0596862992056426,96,78,11,7
1534,"Sir, do you know what happens if you break the speed of sound?",1.2604166666666667,0.0496584643821707,96,73,21,2
1535,Just wanted to warn you there's a slight turn six miles from here.,1.2604166666666667,0.0473989961832662,96,72,23,1
1536,"I'm going to let you off with a warning this time, but don't let me catch you going over Mach 2 again.",1.2604166666666667,0.0538939660446639,96,75,17,4
1537,Just wanted to tell you that your taillights are on fire.,1.2604166666666667,0.0558914825500042,96,76,15,5
1538,We have a problem?,1.2604166666666667,0.0558914825500042,96,76,15,5
1539,"Having trouble getting airborne, sir?",1.2604166666666667,0.0538939660446639,96,75,17,4
1540,Your rear tail light was smoking.,1.2604166666666667,0.0558914825500042,96,76,15,5
1541,"Are you aware, sir, of the law that says you can't travel faster than the speed of light?",1.2604166666666667,0.0558914825500042,96,76,15,5
1542,I know I was speeding. I don't know how you caught up.,1.2604166666666667,0.0596862992056426,96,78,11,7
1543,I'll let you go with a warning but next time signal when you change altitude.,1.2604166666666667,0.0578200317126466,96,77,13,6
1544,Did you know you were going 800 miles per hour?,1.2604166666666667,0.0614959556270128,96,79,9,8
1545,"Sir, did you know your left brake light is out?",1.2604166666666667,0.0596862992056426,96,78,11,7
1546,I said step out of the fucking rocket.,1.2604166666666667,0.0596862992056426,96,78,11,7
1547,You broke my radar gun.,1.2604166666666667,0.0538939660446639,96,75,17,4
1548,You realize that you just coasted through that red state?,1.2604166666666667,0.0518195072381951,96,74,19,3
1549,I'm sorry officer. My speedometer only measures to the nearest 100 mph.,1.2604166666666667,0.0558914825500042,96,76,15,5
1550,"No, I stopped you for driving without a parachute.",1.2604166666666667,0.0538939660446639,96,75,17,4
1551,I won't give you a ticket if you give me a ride.,1.2604166666666667,0.0558914825500042,96,76,15,5
1552,"Its not so bad at $10 for every mph over 60; about $99,400 should cover it.",1.2604166666666667,0.0558914825500042,96,76,15,5
1553,You failed to signal turning out of the salt flats.,1.2604166666666667,0.0538939660446639,96,75,17,4
1554,One of your brake lights isn't working.,1.2604166666666667,0.0578200317126466,96,77,13,6
1555,"Uh huh, you didn't pull over because my lights looked green to you? Well that answers how fast you were going!",1.2604166666666667,0.0558914825500042,96,76,15,5
1556,do not restart your engines until a I have time to pull around you,1.2604166666666667,0.0496584643821707,96,73,21,2
1557,"Well, officer, maybe you can suggest where the front license plate can go.",1.2604166666666667,0.0596862992056426,96,78,11,7
1558,"Sir, 299,792,458 m/s is not only the speed limit, it's the law.",1.2604166666666667,0.0558914825500042,96,76,15,5
1559,"Well, buddy, as I think about it, flying at Mach 1 IS a good reason for not hearing my siren!",1.2577319587628866,0.0492171326027577,97,74,21,2
1560,I don't care how inventive it is -- I'm citing you for a loud muffler.,1.2577319587628866,0.0534029906114091,97,76,17,4
1561,Your left rear intergalactic sensor probe light is out.,1.2577319587628866,0.0553773964587055,97,77,15,5
1562,"I'm giving you a warning, but only because you've got such a boss ride!",1.2577319587628866,0.0534029906114091,97,76,17,4
1563,You do realize he's not the actual President until January.,1.2577319587628866,0.0572837906466311,97,78,13,6
1564,I couldn't help but notice that you left your blinker on after you broke the sound barrier...,1.2577319587628866,0.0572837906466311,97,78,13,6
1565,Did you know your tail lights are on fire?,1.2577319587628866,0.0572837906466311,97,78,13,6
1566,Canada's the other way.,1.2577319587628866,0.0553773964587055,97,77,15,5
1567,Do you know your tail lights are out?,1.2577319587628866,0.0534029906114091,97,76,17,4
1568,"Next time, go a little easier on the liquid hydrogen pedal.",1.2577319587628866,0.0553773964587055,97,77,15,5
1569,You were driving under the influence of your Inner Child.,1.2577319587628866,0.0492171326027577,97,74,21,2
1570,"You were going 2,550 in a 2,500 MPH zone.",1.2577319587628866,0.0553773964587055,97,77,15,5
1571,"You were only going 700 miles per hour, so the it-was-impossible-to-hear-the-siren excuse won't work.",1.2577319587628866,0.0534029906114091,97,76,17,4
1572,"I don't know what the fine is for travelling at 8 times the speed limit, but yes, I'm pretty sure there will be points.",1.2577319587628866,0.0513527289824001,97,75,19,3
1573,Do you know you went through the speed of light?,1.2577319587628866,0.0626559060883671,97,81,7,9
1574,"Sir, there's still some time left before Jan. 20.",1.2577319587628866,0.0572837906466311,97,78,13,6
1575,"""Did you know you were going Mach 2 in a Mach 1 zone",1.2577319587628866,0.0553773964587055,97,77,15,5
1576,Could you please step out of the cockpit?,1.2577319587628866,0.0553773964587055,97,77,15,5
1577,Didn't you see the 'No Sonic Booms' sign?,1.2577319587628866,0.0553773964587055,97,77,15,5
1578,I pulled you over because you should really wait until the recount is over.,1.2577319587628866,0.0513527289824001,97,75,19,3
1579,Did you know you had a tail light out?,1.2577319587628866,0.0609178622035595,97,80,9,8
1580,"I got you going mach 4 in a 35, plus you got a tail light out.",1.2577319587628866,0.0572837906466311,97,78,13,6
1581,Your tags have expired.,1.2577319587628866,0.0572837906466311,97,78,13,6
1582,"""Speed of sound"" is still over the speed limit, sir.",1.2577319587628866,0.0553773964587055,97,77,15,5
1583,Thanks for not taking off.,1.2577319587628866,0.0534029906114091,97,76,17,4
1584,May I please see your pilot's license?,1.2577319587628866,0.0553773964587055,97,77,15,5
1585,Your left tail light is out.,1.2577319587628866,0.0609178622035595,97,80,9,8
1586,Wile E. Coyote called - he wants his car back.,1.2551020408163265,0.0567572121017403,98,79,13,6
1587,"I pulled you over because I thought you were black, but never mind.",1.2526315789473683,0.0538930570846854,95,75,16,4
1588,"Officer, before you say anything, I have been planning to fix that broken tail light.",1.2526315789473683,0.0559323320420903,95,76,14,5
1589,You were doing the speed of light in a 40 mph zone.,1.2526315789473683,0.0559323320420903,95,76,14,5
1590,I clocked you going Mach 4 in a Mach 2 speed zone.,1.2526315789473683,0.0538930570846854,95,75,16,4
1591,But when you determined my position you couldn't have possibly clocked my momentum,1.2526315789473683,0.0598026261892704,95,78,10,7
1592,Your path to glory is at odds with the road to Grandmother’s house.,1.2526315789473683,0.0538930570846854,95,75,16,4
1593,I hate jet setters.,1.2526315789473683,0.0517735206085087,95,74,18,3
1594,I'm gonna let you blast off with a warning.,1.2526315789473683,0.0538930570846854,95,75,16,4
1595,I can't drive 55...,1.2526315789473683,0.0598026261892704,95,78,10,7
1596,You have a taillight out.,1.2526315789473683,0.0598026261892704,95,78,10,7
1597,I'm heading to Canada.,1.2526315789473683,0.0559323320420903,95,76,14,5
1598,It's not rocket science to know not to pass a police car in a no passing zone.,1.2526315789473683,0.0517735206085087,95,74,18,3
1599,"Look, we all want to get out of this country as fast as possible. But you were going 17,000 miles per hour in a school zone.",1.2526315789473683,0.0559323320420903,95,76,14,5
1600,It has tail lights?,1.2526315789473683,0.0538930570846854,95,75,16,4
1601,"That's miles per hour, not mach.",1.2526315789473683,0.0559323320420903,95,76,14,5
1602,I really shouldn't have been able to catch you.,1.2526315789473683,0.0559323320420903,95,76,14,5
1603,I'll make it a warning this time but no more sonic booms.,1.2526315789473683,0.0472500698912998,95,72,22,1
1604,Save the excuses. Nobody Machs me.,1.2526315789473683,0.0598026261892704,95,78,10,7
1605,You forgot to signal.,1.2526315789473683,0.0559323320420903,95,76,14,5
1606,And --- lastly --- one of your tail lights is out.,1.2526315789473683,0.0578998267130406,95,77,12,6
1607,"No, officer, I don't know why you stopped me from fleeing this planet, but can you blame me?",1.2526315789473683,0.0578998267130406,95,77,12,6
1608,"Confusing or not, the sign was for Highway 186, not the speed limit.",1.2526315789473683,0.0495634267425709,95,73,20,2
1609,Are you aware both your tail lights are out?,1.2526315789473683,0.0578998267130406,95,77,12,6
1610,"You may be anxious to get there, but they'll tell you the same thing in Canada.",1.2526315789473683,0.0495634267425709,95,73,20,2
1611,Would you believe my wife is in the hospital?,1.2526315789473683,0.0538930570846854,95,75,16,4
1612,"No, sir, there are no illegal aliens in here.",1.2526315789473683,0.0559323320420903,95,76,14,5
1613,"You have until January 20th to reach Canada buddy, you don't have to travel at the speed of sound.",1.2526315789473683,0.0538930570846854,95,75,16,4
1614,Lets see your pilots license.,1.2526315789473683,0.0538930570846854,95,75,16,4
1615,how did you catch me ?,1.2526315789473683,0.0578998267130406,95,77,12,6
1616,"I’m going to give you a warning, but if you don’t get that afterburner fixed the next time it will be a ticket.",1.2526315789473683,0.0517735206085087,95,74,18,3
1617,You don't need brake lights if you don't have brakes.,1.2526315789473683,0.0495634267425709,95,73,20,2
1618,Who knew! Uber pick-ups now go to Mars?,1.2526315789473683,0.0517735206085087,95,74,18,3
1619,"I don't care if you started in Utah, this vehicle isn't street legal in Kansas.",1.2526315789473683,0.0538930570846854,95,75,16,4
1620,"No, Officer, I have no idea why you pulled me over.",1.2526315789473683,0.0517735206085087,95,74,18,3
1621,Is that all you got?,1.2526315789473683,0.0559323320420903,95,76,14,5
1622,You broke the sound barrier and now you will have to pay to get it fixed.,1.2526315789473683,0.0598026261892704,95,78,10,7
1623,"But, Officer, I did have my lights on. I was going the speed of light so they don't work at that speed.",1.2526315789473683,0.0578998267130406,95,77,12,6
1624,"I'm taking your license, and I think it's gonna be a long, long time.",1.2526315789473683,0.0598026261892704,95,78,10,7
1625,"I’m willing to go with a warning on the vaporized taillights, but save the breaking the sound barrier excuse for the judge.",1.2526315789473683,0.0538930570846854,95,75,16,4
1626,I have a lady who says you rear ended her and drove her to Pittsburgh.,1.2526315789473683,0.0598026261892704,95,78,10,7
1627,"OK mister, let's see your pilots license",1.2526315789473683,0.0578998267130406,95,77,12,6
1628,"Do I know how fast I was driving, Officer? Do you know how fast you had to go to catch me?",1.2526315789473683,0.0495634267425709,95,73,20,2
1629,"I'm still going to need to see your license, Mr. Musk.",1.2526315789473683,0.0578998267130406,95,77,12,6
1630,"No, I don't know how fast you were going. Wait. That's my question, not yours.",1.2526315789473683,0.0598026261892704,95,78,10,7
1631,I'm sorry. Rocket science is prohibited in a school zone.,1.2526315789473683,0.0559323320420903,95,76,14,5
1632,"NASA cut the budget again, Bob?",1.2526315789473683,0.0578998267130406,95,77,12,6
1633,Why aren't you wearing your seat belt?,1.2526315789473683,0.0578998267130406,95,77,12,6
1634,You can slow down now. You crossed into Canada fifty miles back.,1.2526315789473683,0.0538930570846854,95,75,16,4
1635,Spatial profiling?,1.2526315789473683,0.0538930570846854,95,75,16,4
1636,Did you know that one of your tail lights is busted?,1.2526315789473683,0.0472500698912998,95,72,22,1
1637,You do realize you were doing Mach 1 in a 35?,1.2526315789473683,0.0559323320420903,95,76,14,5
1638,450 in a 25 mph zone?,1.2526315789473683,0.0578998267130406,95,77,12,6
1639,You broke the sound barrier in a 50 mph zone.,1.2526315789473683,0.0538930570846854,95,75,16,4
1640,You failed to use your turn signal... Two hundred miles ago in Albuquerque.,1.2526315789473683,0.0538930570846854,95,75,16,4
1641,"Sir, I have you going 700 in a 35.",1.2526315789473683,0.0559323320420903,95,76,14,5
1642,You're under arrest for the theft of one side of Madonna's undergarment.,1.2526315789473683,0.0578998267130406,95,77,12,6
1643,NORAD called. They're not happy.,1.2526315789473683,0.0578998267130406,95,77,12,6
1644,What stop sign?,1.2526315789473683,0.0517735206085087,95,74,18,3
1645,"Registration, proof of insurance and pilot's license, please.",1.2526315789473683,0.0559323320420903,95,76,14,5
1646,"Did you really say ""you're no rocket scientist?""",1.2526315789473683,0.0559323320420903,95,76,14,5
1647,Your tail light isn't working.,1.2526315789473683,0.0559323320420903,95,76,14,5
1648,"I'll give you a warning this time, but try to keep it under Mach 1.",1.2526315789473683,0.0559323320420903,95,76,14,5
1649,"You could be in a heap of trouble ... speeding, no license, and melting a stretch of a public road.",1.2526315789473683,0.0517735206085087,95,74,18,3
1650,"It's because I'm an astronaut, isn't it?",1.2526315789473683,0.0559323320420903,95,76,14,5
1651,"Speed limit hereabouts is Mach 2, sonny.",1.2526315789473683,0.0517735206085087,95,74,18,3
1652,"Sir, do you realize you failed to make a complete stop at the stratosphere?",1.2526315789473683,0.0559323320420903,95,76,14,5
1653,You rolled through that stop sign.,1.2526315789473683,0.0578998267130406,95,77,12,6
1654,What's seems to be the problem officer...,1.2526315789473683,0.0559323320420903,95,76,14,5
1655,"No, making America great again is not a good excuse.",1.2526315789473683,0.0559323320420903,95,76,14,5
1656,Your right afterburner is out.,1.2526315789473683,0.0538930570846854,95,75,16,4
1657,"You might be able to get away with this sort of thing in your galaxy, but not here buddy.",1.2526315789473683,0.0559323320420903,95,76,14,5
1658,Not gonna ask you where the fire is.,1.2526315789473683,0.0495634267425709,95,73,20,2
1659,Your sticker's expired.,1.2526315789473683,0.0538930570846854,95,75,16,4
1660,"So you're saying that you are not the man they think you are at home, oh no no no?",1.2526315789473683,0.0495634267425709,95,73,20,2
1661,"Ain't got no illegal aliens in there, do ya?",1.2526315789473683,0.0538930570846854,95,75,16,4
1662,"And I think it's gonna be a long, long time.Till touch down brings me 'round again to find I'm not the man they think I am at home. Oh, no, no, no, I'm a rocket man. Hello how are you today officer?",1.2526315789473683,0.0578998267130406,95,77,12,6
1663,"Okay, deal. No ticket if you drive my kid and his date to the prom in that thing.",1.2526315789473683,0.0538930570846854,95,75,16,4
1664,Built for speed? You don't say.,1.2526315789473683,0.0538930570846854,95,75,16,4
1665,"That was the most fun I've had in my entire life. License and registration, please?",1.2526315789473683,0.0578998267130406,95,77,12,6
1666,I'll bet you're wondering what's under my hood.,1.2526315789473683,0.0559323320420903,95,76,14,5
1667,Hello officer I'm from Houston.,1.2526315789473683,0.0538930570846854,95,75,16,4
1668,I Caught You Doing Warp Speed in a 55.,1.2526315789473683,0.0517735206085087,95,74,18,3
1669,This is a No Breaking Sound Barrier zone.,1.2526315789473683,0.0517735206085087,95,74,18,3
1670,"Not signalling, running a red light, and now I see you're not even wearing your seat belt.",1.2526315789473683,0.0559323320420903,95,76,14,5
1671,How much is the fine for breaking the sound barrier?,1.2526315789473683,0.0598026261892704,95,78,10,7
1672,"I'm with NASA, we don't do license plates.",1.2526315789473683,0.0538930570846854,95,75,16,4
1673,Seat belt! Seat belt! Seat belt!,1.25,0.0573539334676404,96,78,12,6
1674,Didn't you see that red planet back there?,1.25,0.055409163850364,96,77,14,5
1675,You blasted right through that stop sign.,1.25,0.0533936062930989,96,76,16,4
1676,Bring me back a few cases of Mars Bars and we'll call it even.,1.25,0.0491149743128751,96,74,20,2
1677,You didn’t know you were flying? What kind of rocket scientist are you?,1.25,0.055409163850364,96,77,14,5
