rank,caption,mean,precision,votes,not_funny,somewhat_funny,funny
4076,I only use it to travel with the wife and kids.,1.131578947368421,0.0471730865254342,76,68,6,2
4077,Are you aware that your right brake taillight is out?,1.131578947368421,0.0390326236162929,76,66,10,0
4078,You wonder why I stopped you? It's your left rear parking light.,1.131578947368421,0.0390326236162929,76,66,10,0
4079,"I understand it was out of this world, it's still considered reckless driving.",1.12987012987013,0.0465877682142021,77,69,6,2
4080,But officer I thought it was a mach per hour,1.125,0.0439514421205464,72,64,7,1
4081,Your tail lights have burned out.,1.125,0.0481971531441952,72,65,5,2
4082,So I get a ticket even though I just broke the world land speed record.,1.125,0.0392491141014224,72,63,9,0
4083,It's the new Presidential Limousine. He does not pay tickets.,1.125,0.0439514421205464,72,64,7,1
4084,The only way you aren't getting a speeding ticket is if you take me to the moon and back home before sunset.,1.125,0.0557264585691889,72,67,1,4
4085,did you know you were doing 35 in a 25 m.p.h. zone?,1.125,0.0481971531441952,72,65,5,2
4086,"Sir, do you know how fast you were going?",1.125,0.0439514421205464,72,64,7,1
4087,Do you know you were breaking the speed record back there?,1.125,0.0392491141014224,72,63,9,0
4088,"Given that I caught up with you, you might want to submit this ticket I'm writing along with a refund request for your poky rocket.",1.125,0.0481971531441952,72,65,5,2
4089,Here's a ticket for climate changing lanes.,1.125,0.0481971531441952,72,65,5,2
4090,It's a ticket for not taking me with you.,1.125,0.0439514421205464,72,64,7,1
4091,Superman just came out of nowhere!,1.125,0.0439514421205464,72,64,7,1
4092,"Did you know you had a taillight out? I see... Well, did you know that taillight was one word?",1.125,0.0520980026290286,72,66,3,3
4093,I pulled you over because your break lights aren't working.,1.125,0.0520980026290286,72,66,3,3
4094,"Well, you must have been speeding too.",1.125,0.0520980026290286,72,66,3,3
4095,Highway 265?? Oh I thought...,1.125,0.0481971531441952,72,65,5,2
4096,Warp drive comes standard in all the new police cruisers!,1.125,0.0481971531441952,72,65,5,2
4097,Sir one of your booster rockets is out. Please step out of the vehicle.,1.125,0.0392491141014224,72,63,9,0
4098,I won't be able to pay the fine. I'm on a one way trip to Mars.,1.125,0.0392491141014224,72,63,9,0
4099,Your after-burners took out two joggers....,1.125,0.0439514421205464,72,64,7,1
4100,I'm going to have to write you a ticket for broken tail lights.,1.125,0.0439514421205464,72,64,7,1
4101,I don't care if you are lost; this is not a flyover!,1.125,0.0439514421205464,72,64,7,1
4102,"Barron, not again! What's your father gonna say this time?",1.125,0.0520980026290286,72,66,3,3
4103,You exceeded the speed of sound.,1.125,0.0392491141014224,72,63,9,0
4104,- Where are you going sir? - To Canada.,1.125,0.0439514421205464,72,64,7,1
4105,"Did you see that sign back there that said ""No sonic booms""?",1.125,0.0439514421205464,72,64,7,1
4106,"What do you think this is, the Autobahn?",1.125,0.0392491141014224,72,63,9,0
4107,No. There are no fill up hydrogen peroxide stations near here.,1.125,0.0481971531441952,72,65,5,2
4108,License and registration. I don't care that she lost the election and you want to get out of the country. You still have to stay within the speed limit,1.125,0.0439514421205464,72,64,7,1
4109,"jest curious, what kind a mileage ya get",1.125,0.0439514421205464,72,64,7,1
4110,"Sorry, I wasn't briefed on the seatbelt laws of this era.",1.125,0.0481971531441952,72,65,5,2
4111,You're pointed in the wrong direction.,1.125,0.0439514421205464,72,64,7,1
4112,You almost hit a drone back there.,1.125,0.0439514421205464,72,64,7,1
4113,"I don't care what the limit is on planet Nimsovi, you're speeding HERE.",1.125,0.0392491141014224,72,63,9,0
4114,You didn't signal before you went straight up back there.,1.125,0.0392491141014224,72,63,9,0
4115,"Officer, please don't bust up my mid-life dream.",1.125,0.0439514421205464,72,64,7,1
4116,I'm gonna have to write you up for creating a sonic boom in a work zone and a tail light out.,1.125,0.0481971531441952,72,65,5,2
4117,What do you think this is boy?! The Bonnyville Salt Flats?,1.125,0.0520980026290286,72,66,3,3
4118,Never mind how fast I had to be going in order to catch you!,1.125,0.0439514421205464,72,64,7,1
4119,Do you know why I stopped you for the seventeenth time today?,1.125,0.0481971531441952,72,65,5,2
4120,It isn't rocket science. Mach 2 will cost you $50.,1.125,0.0439514421205464,72,64,7,1
4121,How many demerit points? Let's just say your great-grandchildren will probably still be working this one off for you.,1.125,0.0392491141014224,72,63,9,0
4122,You failed to signal when you turned left at Jupiter.,1.125,0.0392491141014224,72,63,9,0
4123,"What do you mean... ""Show me your smog check certificate"" ?",1.125,0.0439514421205464,72,64,7,1
4124,Sorry. This is not the Bonneville salt flats.,1.125,0.0481971531441952,72,65,5,2
4125,"Given these times, you're not the first.",1.125,0.0392491141014224,72,63,9,0
4126,Do you have any idea how fast you were texting?,1.125,0.0439514421205464,72,64,7,1
4127,"Don't give me that, Cher told me the same thing last week.",1.125,0.0481971531441952,72,65,5,2
4128,How do you spell 'mach'?,1.125,0.0481971531441952,72,65,5,2
4129,D.U.I.F.O.,1.125,0.0439514421205464,72,64,7,1
4130,"Sorry officer, could't see you there.",1.125,0.0520980026290286,72,66,3,3
4131,Going faster than the speed of light is still no excuse for missing that stop sign.,1.125,0.0439514421205464,72,64,7,1
4132,"I'm sorry if I was going too fast, but the speedometer only works in Mach numbers.",1.125,0.0439514421205464,72,64,7,1
4133,It's a shoulder harness not a seat belt and I'm sitting on a parachute not a seat.,1.125,0.0439514421205464,72,64,7,1
4134,"You familiar with the phrase: click it or ticket, Sir?",1.125,0.0392491141014224,72,63,9,0
4135,"It's the new Tesla, under a Police Interceptor body.",1.125,0.0392491141014224,72,63,9,0
4136,You didn’t break our speed limit — you broke our glitz limit.,1.125,0.0392491141014224,72,63,9,0
4137,"Can we speed this up, I am in a hurry.",1.125,0.0392491141014224,72,63,9,0
4138,""" license, registration please.... oh by the way, what is the make of your vehicle? Saturn?",1.125,0.0520980026290286,72,66,3,3
4139,"Sir, do you know how fast you were going?"" ""Faster than the current action on climate change.",1.125,0.0520980026290286,72,66,3,3
4140,I clocked you ten over hyperspeed.,1.125,0.0392491141014224,72,63,9,0
4141,Your brake lights are smoked!,1.125,0.0481971531441952,72,65,5,2
4142,"You were doing 65,000 in a 55,000 zone.",1.125,0.0392491141014224,72,63,9,0
4143,Your left thruster signal seems to be on the fritz.,1.125,0.0439514421205464,72,64,7,1
4144,"I'll let you off with a warning this time, but your tail-light is out.",1.125,0.0439514421205464,72,64,7,1
4145,Your right rear tail light is out.,1.125,0.0392491141014224,72,63,9,0
4146,You failed to signal when you turned 90 degrees starboard back there.,1.125,0.0481971531441952,72,65,5,2
4147,"You sure know how to get a ticket, eh?",1.125,0.0481971531441952,72,65,5,2
4148,"It's not the speed, nor the noise, it's the flowers from the tail pipes we object to.",1.125,0.0439514421205464,72,64,7,1
4149,"I'm sorry officer, the throttle on this is just really sensitive.",1.125,0.0481971531441952,72,65,5,2
4150,I may have to test drive it to see how fast you were going.,1.125,0.0392491141014224,72,63,9,0
4151,"What's your hurry, Mister?",1.125,0.0520980026290286,72,66,3,3
4152,"Sir, I pulled you over because both of your tail engines were out",1.125,0.0392491141014224,72,63,9,0
4153,"""Did you know your Dilithium Crystal turn signal is out on the right?",1.125,0.0439514421205464,72,64,7,1
4154,"Sir, are you aware the driving limit isn't light speed?",1.125,0.0520980026290286,72,66,3,3
4155,"Why did I stop you? Haven't a clue? Well mister smarty pants, your plates are expired.",1.125,0.0439514421205464,72,64,7,1
4156,It runs on solar power,1.125,0.0392491141014224,72,63,9,0
4157,"Because you were approaching the speed of light, you get the AARP discount.",1.125,0.0481971531441952,72,65,5,2
4158,"Sir, how slow do you think you weren't going?",1.125,0.0481971531441952,72,65,5,2
4159,I'm stopping you because you clipped a Harrier back there.,1.125,0.0392491141014224,72,63,9,0
4160,"I recognize that it's an idiom, sir, but I meant it quite literally.",1.125,0.0481971531441952,72,65,5,2
4161,"Officer, when I'm going that fast, I'm not looking at the speedometer.",1.125,0.0439514421205464,72,64,7,1
4162,"You were doing 1,250 in a thirty-five.",1.125,0.0392491141014224,72,63,9,0
4163,There are a couple of things that keep the Blue Flame from being street legal.,1.125,0.0439514421205464,72,64,7,1
4164,Sorry pal. Click it or ticket.,1.125,0.0481971531441952,72,65,5,2
4165,Do you realize you were doing 250 in a 200 mph zone?,1.125,0.0481971531441952,72,65,5,2
4166,"Sir, you have a broken tail light.",1.125,0.0439514421205464,72,64,7,1
4167,Let me guess - you're late for work on Mars.,1.125,0.0481971531441952,72,65,5,2
4168,"I see that your name is Elton John, but you still have no right to drive that vehicle as fast as a rocket, man!",1.125,0.0439514421205464,72,64,7,1
4169,"Setting aside the speeding violation, your stop and turn lights appear to have burnt out.",1.125,0.0439514421205464,72,64,7,1
4170,"just step out of the -er, rocket, please sir",1.125,0.0392491141014224,72,63,9,0
4171,"Oh, you're a populist candidate for president... Apologies - carry on...",1.125,0.0439514421205464,72,64,7,1
4172,"Not as fast as thought, catcha",1.125,0.0439514421205464,72,64,7,1
4173,I experienced a malfunction and luckily found this nice stretch of road. I´d appreciate an escort to the closest air base.,1.125,0.0439514421205464,72,64,7,1
4174,"....AND, ACCORDING TO YOUR LICENSE, YOUR NAME IS GEORGE...GEORGE JETSON...",1.125,0.0439514421205464,72,64,7,1
4175,I'll let you off with a warning,1.125,0.0439514421205464,72,64,7,1
4176,Do you mind stepping out of your rocket?,1.125,0.0481971531441952,72,65,5,2
4177,"No sir, a light-year is a unit of distance, not time. Plus, the signs indicate miles per hour!",1.125,0.0481971531441952,72,65,5,2
4178,Looks like you might have been speeding today.,1.125,0.0439514421205464,72,64,7,1
4179,"Your mom needs you to pick up milk, eggs and a loaf of bread on your way home. And make it snappy.",1.125,0.0392491141014224,72,63,9,0
4180,"And no, it's not about the rocket.",1.125,0.0439514421205464,72,64,7,1
4181,Do you know why I pulled you over today?,1.125,0.0481971531441952,72,65,5,2
4182,"Officer, I have already have a ticket for the broken tail light....",1.125,0.0439514421205464,72,64,7,1
4183,"License, registration and interplanetary insurance card please",1.125,0.0481971531441952,72,65,5,2
4184,No license plate.,1.125,0.0439514421205464,72,64,7,1
4185,They told me this was okay in Utah!,1.125,0.0481971531441952,72,65,5,2
4186,"You were doing 2,275 mph in a 55 mph speed zone.",1.125,0.0481971531441952,72,65,5,2
4187,Didja know you were going 231 miles an hour?,1.125,0.0481971531441952,72,65,5,2
4188,You were going mach 5 in a 25.,1.125,0.0439514421205464,72,64,7,1
4189,"Sir, you were driving at speeds out of this world.",1.125,0.0439514421205464,72,64,7,1
4190,"When you sped by the donut shop, you soured the cream filling.",1.125,0.0481971531441952,72,65,5,2
4191,"You know transporting an illegal alien is a felony, right?",1.125,0.0481971531441952,72,65,5,2
4192,no Sir it is not for the red light its for the 14 full stop signs you missed,1.125,0.0481971531441952,72,65,5,2
4193,Going over the speed of sound is no excuse for not hearing my siren,1.125,0.0439514421205464,72,64,7,1
4194,"No, there's nothing wrong. Just a broken tail light.",1.125,0.0439514421205464,72,64,7,1
4195,"No, it's not your speed, it's your pollution!!",1.125,0.0481971531441952,72,65,5,2
4196,You really should use the GPS.,1.125,0.0439514421205464,72,64,7,1
4197,"How did you tail me, officer?",1.125,0.0392491141014224,72,63,9,0
4198,Your right booster is out,1.125,0.0439514421205464,72,64,7,1
4199,"I'm sorry, officer, I left my registration on Mars.",1.125,0.0439514421205464,72,64,7,1
4200,"Sir, did you know that one of your tail lights is out?",1.125,0.0392491141014224,72,63,9,0
4201,Do you even have brake lights?,1.125,0.0481971531441952,72,65,5,2
4202,Did you realize you were doing 700 mph over the speed limit?,1.125,0.0481971531441952,72,65,5,2
4203,"Officer, the abstraction/s verisimilar",1.125,0.0481971531441952,72,65,5,2
4204,"Yes, quite an improvement on Air Force One, Mr. Trump.",1.125,0.0439514421205464,72,64,7,1
4205,"Are you aware of your trajectory, sir?",1.125,0.0392491141014224,72,63,9,0
4206,This is a first. 25 years on the force and you're the first Elon I've ever ticketed,1.125,0.0439514421205464,72,64,7,1
4207,"I wasn't speeding officer, honest.",1.125,0.0481971531441952,72,65,5,2
4208,You were going 800m.p.h. in a 40m.p.h. zone.,1.125,0.0439514421205464,72,64,7,1
4209,Your seatbelt wasn't on when you broke the sound barrier.,1.125,0.0481971531441952,72,65,5,2
4210,"Mister, you can't be serious about just looking for a place to park.",1.125,0.0439514421205464,72,64,7,1
4211,Registration?,1.125,0.0520980026290286,72,66,3,3
4212,Your tail lights are too bright.,1.125,0.0439514421205464,72,64,7,1
4213,I don't want to hear your excuses for why you were going faster than the speed of sound.,1.125,0.0392491141014224,72,63,9,0
4214,"'Your getting a ticket because you ran a stop sign-500 miles ago""",1.125,0.0439514421205464,72,64,7,1
4215,"Yes, officer I can think of a few reasons why you pulled me over.",1.125,0.0392491141014224,72,63,9,0
4216,Our department wants to expand beyond military surplus.,1.125,0.0481971531441952,72,65,5,2
4217,"I clocked you at 1,395 over the limit. Doesn't happen very often. Not even out here",1.125,0.0439514421205464,72,64,7,1
4218,"Sir, ... are you aware that you were going Mach 1 in a twenty-five miles an hour zone school safety zone?",1.125,0.0481971531441952,72,65,5,2
4219,"Playing a little loose with the Speed limit there, sir.",1.125,0.0439514421205464,72,64,7,1
4220,"No, there is no Sonic drive through here",1.125,0.0481971531441952,72,65,5,2
4221,Let me guess. You were born about 1966.,1.125,0.0392491141014224,72,63,9,0
4222,"UFO or not, electric or hybrid makes no difference, you were still going too fast!",1.125,0.0439514421205464,72,64,7,1
4223,"I don't care if you are Evel Knievel reincarnated ,160 is too FAST",1.125,0.0392491141014224,72,63,9,0
4224,"If you're an African American between the ages of 18 and 34, please step out of your jet car.",1.125,0.0392491141014224,72,63,9,0
4225,"SIR,MAY I SEE YOUR ASTRONAUT'S LICENSE",1.125,0.0392491141014224,72,63,9,0
4226,Improper plane change.,1.125,0.0481971531441952,72,65,5,2
4227,"Well, I've been following you for about 800 miles.",1.125,0.0439514421205464,72,64,7,1
4228,"You were passing in a no passing zone, sir.",1.125,0.0439514421205464,72,64,7,1
4229,"Ever heard of altitude limits, son!",1.125,0.0392491141014224,72,63,9,0
4230,I wasn't profiling you as a speeder.,1.125,0.0481971531441952,72,65,5,2
4231,I clocked you at over Mach 1 Chuck.,1.125,0.0392491141014224,72,63,9,0
4232,Can you just let me off with a warning? I was just on the way to replacing the left-turn signal light..,1.125,0.0392491141014224,72,63,9,0
4233,"Wait, this isn't Mars?",1.125,0.0481971531441952,72,65,5,2
4234,Do you know that you're driving with expired NASA plates?,1.125,0.0439514421205464,72,64,7,1
4235,"Sir, did you know your left tail light is out?",1.125,0.0481971531441952,72,65,5,2
4236,Did you know you were going 600 in a 20 mile an hour speed zone?,1.125,0.0439514421205464,72,64,7,1
4237,"Officer, if you had such a fine automobile, would you drive it slow?",1.125,0.0481971531441952,72,65,5,2
4238,And how many light years per hour did you say you were going? Please step out for a sobriety test.,1.125,0.0439514421205464,72,64,7,1
4239,"Sir, your left afterburner is burnt out.",1.125,0.0439514421205464,72,64,7,1
4240,I stopped you for doing Mach 4 in Mach i zone.,1.125,0.0439514421205464,72,64,7,1
4241,"She may be a sedan, but she really kicks in at 10,000 miles per hour.",1.125,0.0439514421205464,72,64,7,1
4242,We find ourselves in an unusual situation.,1.125,0.0439514421205464,72,64,7,1
4243,"Sir, you can't outrun lousy mileage.",1.125,0.0520980026290286,72,66,3,3
4244,License and excuse summation,1.125,0.0439514421205464,72,64,7,1
4245,"Sir, do you have any idea how many light-years per hour you were going?",1.125,0.0481971531441952,72,65,5,2
4246,It's also against the law to exceed traffic light speed.,1.125,0.0481971531441952,72,65,5,2
4247,You were doing 439 in a 65 zone.,1.125,0.0439514421205464,72,64,7,1
4248,"So you missed the sign, 'THREE-WHEELERS NOT ALLOWED '?",1.125,0.0481971531441952,72,65,5,2
4249,...And your greenhouse gas emissions have exceeded the local 55 ton/day limit.,1.125,0.0481971531441952,72,65,5,2
4250,The gas mileage is actually better than you would think.,1.125,0.0439514421205464,72,64,7,1
4251,I hope YOU know how fast you were going - 'cuz I sure don't.,1.125,0.0392491141014224,72,63,9,0
4252,Just keep it below Mach 0.07 next time and we'll leave you alone.,1.125,0.0439514421205464,72,64,7,1
4253,"No, I said driver's license, not pilot's license.",1.125,0.0392491141014224,72,63,9,0
4254,"Yes, children were present.",1.125,0.0481971531441952,72,65,5,2
4255,Mach 3 is definately over the speed limit.,1.125,0.0520980026290286,72,66,3,3
4256,There's a feminist march up ahead. If you want to live I'd suggest going another way.,1.125,0.0481971531441952,72,65,5,2
4257,I'm sorry but I have to give you a ticket because one of your turn signals is out.,1.125,0.0392491141014224,72,63,9,0
4258,"Officer, as you can see I'm in a rush. Could you please make this quick.",1.125,0.0481971531441952,72,65,5,2
4259,Where's the retrofire?,1.125,0.0481971531441952,72,65,5,2
4260,"I clocked you at ""Mach 1""!",1.125,0.0481971531441952,72,65,5,2
4261,"No, it isn't Kansas, but we still call it home!",1.125,0.0392491141014224,72,63,9,0
4262,I don't care about interplanetary speed limits.,1.125,0.0439514421205464,72,64,7,1
4263,"I'm sorry Elon, but you were going 5 times the speed of sound over the limit.",1.125,0.0439514421205464,72,64,7,1
4264,What’s your problem? Do you think that staying within the speed limit is rocket science?,1.125,0.0439514421205464,72,64,7,1
4265,Your tailights are not working,1.125,0.0392491141014224,72,63,9,0
4266,"Mr. President, please step out of the conflict of interest.",1.125,0.0520980026290286,72,66,3,3
4267,Hughes? How is that spelled?,1.125,0.0439514421205464,72,64,7,1
4268,Where's the fire?,1.125,0.0439514421205464,72,64,7,1
4269,"You were doing Mach 0.15 in a Mach 0.05 zone, and by the way, where's the fire?",1.125,0.0439514421205464,72,64,7,1
4270,I noticed you have a non working license plate light sir !,1.125,0.0392491141014224,72,63,9,0
4271,"So, how do you plead to the charge of speeding?",1.125,0.0481971531441952,72,65,5,2
4272,So it's a parking ticket instead of acclaim for making it back from Mars?,1.125,0.0392491141014224,72,63,9,0
4273,"The good news, you broke the land speed record.",1.125,0.0481971531441952,72,65,5,2
4274,"Sir, were you driving high?",1.125,0.0392491141014224,72,63,9,0
4275,Twenty thousand miles over the speed limit gives you an astronomical fine.,1.125,0.0439514421205464,72,64,7,1
4276,You were clocked doing Tom Hanks in an Eddie Albert zone.,1.125,0.0439514421205464,72,64,7,1
4277,Your left tail light is out. I'm going to have to write you a ticket.,1.125,0.0481971531441952,72,65,5,2
4278,"Well, sir, you were doing the speed of sound in a thirty-five mile per hour zone.",1.125,0.0481971531441952,72,65,5,2
4279,I stopped you because you have a broken tail light,1.125,0.0439514421205464,72,64,7,1
4280,"Please, book me on the drugs fixing the tail light will cost a fortune.",1.125,0.0439514421205464,72,64,7,1
4281,Sir you forgot to signal at the last sound barrier,1.125,0.0481971531441952,72,65,5,2
4282,"- Officer, was I driving too fast? - No, you were flying too low...",1.125,0.0439514421205464,72,64,7,1
4283,"Sir, i don't know if you are aware of this?, but your taillights are in flames.",1.125,0.0439514421205464,72,64,7,1
4284,"Doesn't matter. When you hit the highway, the limit is 75 miles an hour.",1.125,0.0481971531441952,72,65,5,2
4285,"Your tail lights are out, there is no inspection sticker and you can't drive for crap.",1.125,0.0481971531441952,72,65,5,2
4286,You can't bring that into the country.,1.125,0.0481971531441952,72,65,5,2
4287,"I'm going to give you a warning on the speeding, but I cannot overlook the noise pollution violation by breaking the sound barrier.",1.125,0.0520980026290286,72,66,3,3
4288,Your backlight needs to be changed.,1.125,0.0439514421205464,72,64,7,1
4289,Actually you were going 700 mph over the limit!,1.125,0.0481971531441952,72,65,5,2
4290,You were passing on the double yellow line.,1.125,0.0520980026290286,72,66,3,3
4291,Two out of three?,1.125,0.0481971531441952,72,65,5,2
4292,"You were doing 17,200 in a 55 zone!",1.125,0.0481971531441952,72,65,5,2
4293,Do you know how many decibels you were going?,1.125,0.0439514421205464,72,64,7,1
4294,"Rocket License and Registration, please.",1.125,0.0439514421205464,72,64,7,1
4295,"Sorry, officer... I had no idea my tail-light was out.",1.125,0.0392491141014224,72,63,9,0
4296,I think it's gonna be a long long time til you get this license back.,1.125,0.0520980026290286,72,66,3,3
4297,"Anything you say can and will be used against you, assuming the sound waves reach me.",1.125,0.0481971531441952,72,65,5,2
4298,"Air and noise pollution, Obama is still our president.",1.125,0.0439514421205464,72,64,7,1
4299,Scoot over and let me take her for a spin.,1.125,0.0392491141014224,72,63,9,0
4300,"Sir, you were doing the speed of light in a 55.",1.125,0.0392491141014224,72,63,9,0
4301,You should have seen the size of the bottle,1.125,0.0439514421205464,72,64,7,1
4302,I suppose you were not aware there is a weight restriction on this road!,1.125,0.0392491141014224,72,63,9,0
4303,"I'll be honest, the speedometer melted off.",1.125,0.0439514421205464,72,64,7,1
4304,"You know, I pulled you over to inform you that the Darwin Awards were already selected last week.",1.125,0.0439514421205464,72,64,7,1
4305,In a rush to get over the border before the wall is built?,1.125,0.0439514421205464,72,64,7,1
4306,"""I've never seen a drivers license from Pluto before"".",1.125,0.0481971531441952,72,65,5,2
4307,"Officer, there's no way i was going above the speed limit.",1.125,0.0481971531441952,72,65,5,2
4308,Do you know what the fine is for 500 M.P.H over the speed limit?,1.125,0.0392491141014224,72,63,9,0
4309,You were clocked at eight hundred in a no afterburner zone.,1.125,0.0439514421205464,72,64,7,1
4310,"Still trying to beat that Toyota Corona, huh?",1.125,0.0481971531441952,72,65,5,2
4311,Depends. How long have you been following me?,1.125,0.0392491141014224,72,63,9,0
4312,Do you know the land speed record round these parts?,1.125,0.0392491141014224,72,63,9,0
4313,"Nice try, cowboy, but this thing jest AIN'T one-o'-them gigant-o barbecues, now, is it?",1.125,0.0520980026290286,72,66,3,3
4314,"You know you were going 632,550 in a 632,525?",1.125,0.0392491141014224,72,63,9,0
4315,Your break-the-sound-barrier lights are out.,1.125,0.0439514421205464,72,64,7,1
4316,I thought I told you to lay low.,1.125,0.0481971531441952,72,65,5,2
4317,"Sorry, sonny, you can't drive your dad's private jet with only a learner's permit.",1.125,0.0481971531441952,72,65,5,2
4318,"Officer, The after burners don't even kick in until I reach 220 MPH.",1.125,0.0439514421205464,72,64,7,1
4319,Speeding?! My speedometer said I was only going 35!,1.125,0.0392491141014224,72,63,9,0
4320,You shouldn't have relied on federal funding.,1.125,0.0439514421205464,72,64,7,1
4321,"Yaw didn't think we'd catcha after hitt'n that there satellite, didja?!",1.125,0.0481971531441952,72,65,5,2
4322,You broke the speed barrier,1.125,0.0439514421205464,72,64,7,1
4323,A rocket scientist such as yourself should know you can't drive through here at the speed of sound.,1.125,0.0439514421205464,72,64,7,1
4324,You sucked up two deer back there!,1.125,0.0392491141014224,72,63,9,0
4325,I clocked you at mach 1 in a 55.,1.125,0.0392491141014224,72,63,9,0
4326,"Spacio-temporal disruption or not, I'll still need to see your license and registration.",1.125,0.0439514421205464,72,64,7,1
4327,There is no such thing as a license plate exemption.,1.125,0.0481971531441952,72,65,5,2
4328,"Breaking the sound barrier isn't a crime, but this is a 55mph zone.",1.125,0.0392491141014224,72,63,9,0
4329,"Let's see... no seat belt, expired emissions sticker, 18,0000 in 17, 500 zone, what else?",1.125,0.0439514421205464,72,64,7,1
4330,This is a non-smoking road.,1.125,0.0481971531441952,72,65,5,2
4331,Mr. Jetson do you realize you were going Mach 2 in a 45 mph zone?,1.125,0.0520980026290286,72,66,3,3
4332,You like homonyms? Because I've got the write stuff too.,1.125,0.0481971531441952,72,65,5,2
4333,'Do you realize how slowly you were going?',1.125,0.0481971531441952,72,65,5,2
4334,"The car pool lane is not the fast lane, sir.",1.125,0.0481971531441952,72,65,5,2
4335,"Sorry, HOV lane does not mean High Flying Vehicles!",1.125,0.0481971531441952,72,65,5,2
4336,"Officer, I had a license tag in the front ,but it must have fallen off.",1.125,0.0392491141014224,72,63,9,0
4337,You forgot to signal your turn by that last asteroid.,1.125,0.0439514421205464,72,64,7,1
4338,Best mirage yet.,1.125,0.0439514421205464,72,64,7,1
