rank,caption,mean,precision,votes,not_funny,somewhat_funny,funny
2961,The natural progression from the standing desk.,1.0476190476190477,0.0487950036474266,21,20,1,0
2962,Something Something Rat Race,1.0476190476190477,0.0487950036474266,21,20,1,0
2963,Now let's not try to reinvent the wheel here.,1.0476190476190477,0.0487950036474266,21,20,1,0
2964,"Suddenly, Stanley regretted his dying remarks that life had been an unending rat race.",1.0476190476190477,0.0487950036474266,21,20,1,0
2965,"I work for celery, not salary.",1.0476190476190477,0.0487950036474266,21,20,1,0
2966,It's more honest than a standing desk.,1.0476190476190477,0.0487950036474266,21,20,1,0
2967,"Suckers, all of them: soon I'll run on the upper floor while they stay here...",1.0476190476190477,0.0487950036474266,21,20,1,0
2968,Wheel of Fortune,1.0476190476190477,0.0487950036474266,21,20,1,0
2969,"The generator works fine, so bring home 30 hamsters.",1.0476190476190477,0.0487950036474266,21,20,1,0
2970,The new freedom!,1.0476190476190477,0.0487950036474266,21,20,1,0
2971,"I will make the government more efficient, I will make the government more efficient...",1.0476190476190477,0.0487950036474266,21,20,1,0
2972,"Well, first, they got rid of the unpaid interns...",1.0476190476190477,0.0487950036474266,21,20,1,0
2973,"Yes, sir we have reduced overhead costs...I am in better shape!  I think we're ready for social media!",1.0476190476190477,0.0487950036474266,21,20,1,0
2974,Nirvana!,1.0476190476190477,0.0487950036474266,21,20,1,0
2975,"I'm not just a member of this gym, I'm the president!",1.0476190476190477,0.0487950036474266,21,20,1,0
2976,I'm working from home now. I've had enough of the rat race.,1.0476190476190477,0.0487950036474266,21,20,1,0
2977,It's time we started thinking outside the wheel.,1.0476190476190477,0.0487950036474266,21,20,1,0
2978,Trump's Congressional Wood Shed,1.0476190476190477,0.0487950036474266,21,20,1,0
2979,I've got enough water..what else do you have handy?,1.0476190476190477,0.0487950036474266,21,20,1,0
2980,"The mouse owner started to grow weary of his human pet; making the wheel squeak incessantly for at least eight hours a day. And his getting lost in his tunnel, thinking he was going to escape his with? Don't get me started!",1.0476190476190477,0.0487950036474266,21,20,1,0
2981,I wish I never made the hamster upset...,1.0476190476190477,0.0487950036474266,21,20,1,0
2982,"Senator, hold off funding wind; the Government Energy Resource Back-up Initiative  Lab shows great potential!"" [Ed. note: Hold drawing close, giggle magazine, wheel TURNS!] shows good potentiual!",1.0476190476190477,0.0487950036474266,21,20,1,0
2983,Treadmill desks are for wimps and pussies.,1.0476190476190477,0.0487950036474266,21,20,1,0
2984,Sometimes I get way ahead of myself before I go out.,1.0476190476190477,0.0487950036474266,21,20,1,0
2985,Yes-congress will SOON pass the new health care act!,1.0476190476190477,0.0487950036474266,21,20,1,0
2986,I'm late for work!,1.0476190476190477,0.0487950036474266,21,20,1,0
2987,This IPA is delicious!,1.0476190476190477,0.0487950036474266,21,20,1,0
2988,We should have drawn the line at stand-up desks.,1.0476190476190477,0.0487950036474266,21,20,1,0
2989,Promoted from the mailroom!,1.0476190476190477,0.0487950036474266,21,20,1,0
2990,Your turn. Now you enterrain me.,1.0476190476190477,0.0487950036474266,21,20,1,0
2991,"Hon, sorry I will be late for dinner. I have to run the office by myself again.",1.0476190476190477,0.0487950036474266,21,20,1,0
2992,"And with this new technology, I can connect with other hampster wheels around the world!",1.0476190476190477,0.0487950036474266,21,20,1,0
2993,Jim has an epiphany.,1.0476190476190477,0.0487950036474266,21,20,1,0
2994,Rats!,1.0476190476190477,0.0487950036474266,21,20,1,0
2995,Let's roll!,1.0476190476190477,0.0487950036474266,21,20,1,0
2996,There's a new health fad every week. Maybe I should have read the test results on the Hamster Health Model more closely.,1.0476190476190477,0.0487950036474266,21,20,1,0
2997,Bob prepares to join the rat race.,1.0476190476190477,0.0487950036474266,21,20,1,0
2998,"Gee, if I stopped running on this thing and walked out that door, I could be free....What a bizarre thought.",1.0476190476190477,0.0487950036474266,21,20,1,0
2999,"Sure, free health club membership, but the boss is a conniving rat.",1.0476190476190477,0.0487950036474266,21,20,1,0
3000,"""This is one wheel I never fall asleep at"".",1.0476190476190477,0.0487950036474266,21,20,1,0
3001,"Yeah, well, it's almost happy hour.",1.0476190476190477,0.0487950036474266,21,20,1,0
3002,It's a representation of my most authentic self.,1.0476190476190477,0.0487950036474266,21,20,1,0
3003,The boss's idea of a time out didn't please Carl at all.,1.0476190476190477,0.0487950036474266,21,20,1,0
3004,Yet this bastard still won't get me an assistant!,1.0476190476190477,0.0487950036474266,21,20,1,0
3005,So much for working harder......,1.0476190476190477,0.0487950036474266,21,20,1,0
3006,"Well no, I did not think they meant it literally.",1.0476190476190477,0.0487950036474266,21,20,1,0
3007,I hate being in the control group.,1.0476190476190477,0.0487950036474266,21,20,1,0
3008,"I was tired of the rat race, so I got the wheel.",1.0476190476190477,0.0487950036474266,21,20,1,0
3009,How many gerbils lost their jobs because of him?,1.0476190476190477,0.0487950036474266,21,20,1,0
3010,"I'm afraid you'll have to speak faster, I'm wheelie busy.",1.0476190476190477,0.0487950036474266,21,20,1,0
3011,"I'm thinking of returning my new treadmill desk, if I can ever get off it.",1.0476190476190477,0.0487950036474266,21,20,1,0
3012,The standing desk was just not enough.,1.0476190476190477,0.0487950036474266,21,20,1,0
3013,How did they not notice this side effect in testing?,1.0476190476190477,0.0487950036474266,21,20,1,0
3014,"""No, we're going to try again!"" -Paul Ryan and his healthcare bill",1.0476190476190477,0.0487950036474266,21,20,1,0
3015,Can't stop yet...they keep moving my carrot.,1.0476190476190477,0.0487950036474266,21,20,1,0
3016,Tell the cleaning crew I'm sorry about the newspaper in the corner.,1.0476190476190477,0.0487950036474266,21,20,1,0
3017,"In retrospect, my comment about this place being a rat race was probably a mistake...",1.0476190476190477,0.0487950036474266,21,20,1,0
3018,"'Escape the rat race,' they said.",1.0476190476190477,0.0487950036474266,21,20,1,0
3019,Trump's America - circa 2020,1.0476190476190477,0.0487950036474266,21,20,1,0
3020,"Hard? Heck, even a gerbil could do it!",1.0476190476190477,0.0487950036474266,21,20,1,0
3021,Keeping busy.,1.0476190476190477,0.0487950036474266,21,20,1,0
3022,"Just give me the dam water already,I've been running for 4 eons straight!!!",1.0476190476190477,0.0487950036474266,21,20,1,0
3023,"Ah, you know. Same old, same old...",1.0476190476190477,0.0487950036474266,21,20,1,0
3024,This office fitness challenge sucks.,1.0476190476190477,0.0487950036474266,21,20,1,0
3025,How the Millennial prepare for the rat race.,1.0476190476190477,0.0487950036474266,21,20,1,0
3026,I'll come home as soon as I reach the water station. Almost there.,1.0476190476190477,0.0487950036474266,21,20,1,0
3027,Damn Fitbit.,1.0476190476190477,0.0487950036474266,21,20,1,0
3028,Wait up! I'll be right there.,1.0476190476190477,0.0487950036474266,21,20,1,0
3029,All I requested was a standing desk.,1.0476190476190477,0.0487950036474266,21,20,1,0
3030,"Yes, Debbie, it's going to be OK; I think they put me in the control group.",1.0476190476190477,0.0487950036474266,21,20,1,0
3031,It's worth every penny.,1.0476190476190477,0.0487950036474266,21,20,1,0
3032,Tell Dad I’m putting a positive spin on his healthcare plan!,1.0476190476190477,0.0487950036474266,21,20,1,0
3033,Racing but getting nowhere,1.0454545454545454,0.0465242105199235,22,21,1,0
3034,Hi Bob. Just wanted to circle back with you. Are you on your wheel?,1.0454545454545454,0.0465242105199235,22,21,1,0
3035,"We did, your pregnant, and we are much better off apart.",1.0454545454545454,0.0465242105199235,22,21,1,0
3036,"Mr. Smithson, Reeves from accounting here. I've been running in place for years now. Don't you think I'm due for a promotion?",1.0454545454545454,0.0465242105199235,22,21,1,0
3037,"Thank you, it's big. I was recruited to run their Global Rotational Program.",1.0454545454545454,0.0465242105199235,22,21,1,0
3038,"I hope they meant what they say about ""the squeaky wheel gets the oil.""",1.0454545454545454,0.0465242105199235,22,21,1,0
3039,The faster I run the sooner I'll get to the door.,1.0454545454545454,0.0465242105199235,22,21,1,0
3040,"At the tone, the time will be 7:20.",1.0454545454545454,0.0465242105199235,22,21,1,0
3041,I just feel ready to get out out of this rat race and move on.,1.0454545454545454,0.0465242105199235,22,21,1,0
3042,I gave the hamster the day-off!,1.0454545454545454,0.0465242105199235,22,21,1,0
3043,There has to be a closer happy hour!,1.0454545454545454,0.0465242105199235,22,21,1,0
3044,I feel SO much better that I started doing this as part of the sharing economy instead of for someone else!,1.0454545454545454,0.0465242105199235,22,21,1,0
3045,"Same thing, same result-I think we can conclude the hamsters and insane.",1.0454545454545454,0.0465242105199235,22,21,1,0
3046,"Getting better every day, in every way!",1.0454545454545454,0.0465242105199235,22,21,1,0
3047,It powers the bluetooth.,1.0454545454545454,0.0465242105199235,22,21,1,0
3048,Wrong! It cost $1.39/lb.,1.0454545454545454,0.0465242105199235,22,21,1,0
3049,Is there a forwarding address?,1.0454545454545454,0.0465242105199235,22,21,1,0
3050,At least I keep the wheel turning!,1.0454545454545454,0.0465242105199235,22,21,1,0
3051,I hate being the guinea pig for these new exercise programs.,1.0454545454545454,0.0465242105199235,22,21,1,0
3052,"Jiminy it's Mickey, they like the script, they want Pacino to play Geppetto, call me.",1.0454545454545454,0.0465242105199235,22,21,1,0
3053,Rats! I thought this was a spinning class.,1.0454545454545454,0.0465242105199235,22,21,1,0
3054,"Oops, I've gotta run.",1.0454545454545454,0.0465242105199235,22,21,1,0
3055,I heard sitting is the new smoking.,1.0454545454545454,0.0465242105199235,22,21,1,0
3056,It's going to be a day late.,1.0454545454545454,0.0465242105199235,22,21,1,0
3057,Quitting the rat race isn't really getting me anywhere.,1.0454545454545454,0.0465242105199235,22,21,1,0
3058,"Actually, I preferred the rat race.",1.0454545454545454,0.0465242105199235,22,21,1,0
3059,Coming soon to Theatres near you: The Hamster of Wall Street,1.0454545454545454,0.0465242105199235,22,21,1,0
3060,"That's great, I think we're really getting somewhere.",1.0454545454545454,0.0465242105199235,22,21,1,0
3061,"I'm running on a man-size hamster wheel, probably at work.",1.0454545454545454,0.0465242105199235,22,21,1,0
3062,"Johnson, it's like I've been saying all along: The rat race is for suckers.",1.0454545454545454,0.0465242105199235,22,21,1,0
3063,"Hello, you're through to David in the Government Department of Progress...",1.0454545454545454,0.0465242105199235,22,21,1,0
3064,"I'd love to, but the rest of my afternoon is looking pretty full.",1.0454545454545454,0.0465242105199235,22,21,1,0
3065,Tell your mother that I’m going big places.,1.0454545454545454,0.0465242105199235,22,21,1,0
3066,"Why did they have to shut down Indian Point, anyway?",1.0454545454545454,0.0465242105199235,22,21,1,0
3067,I've been running around in circles all day.,1.0454545454545454,0.0465242105199235,22,21,1,0
3068,Little did I know then I would be longing to be back in the Rat Race!,1.0454545454545454,0.0465242105199235,22,21,1,0
3069,"Houston, this is not the place I wanted to land.",1.0454545454545454,0.0465242105199235,22,21,1,0
3070,Late AGAIN!,1.0454545454545454,0.0465242105199235,22,21,1,0
3071,"Don't worry, Theresa, we're making great progress.",1.0454545454545454,0.0465242105199235,22,21,1,0
3072,Hello! Bill Gerbil speaking.,1.0454545454545454,0.0465242105199235,22,21,1,0
3073,Can't talk right now I am on the wheel of life.,1.0454545454545454,0.0465242105199235,22,21,1,0
3074,I've deconstructed my life and I love it!,1.0454545454545454,0.0465242105199235,22,21,1,0
3075,It's a hamsterocracy I tell ya.,1.0454545454545454,0.0465242105199235,22,21,1,0
3076,THE WHEEL OF MISFORTUNE,1.0454545454545454,0.0465242105199235,22,21,1,0
3077,So glad I got out of the rat race.,1.0454545454545454,0.0465242105199235,22,21,1,0
3078,"Yes, but I'm not sure I would exactly call it a ""bathroom break""",1.0454545454545454,0.0465242105199235,22,21,1,0
3079,But WHY does Richard Gere want a meeting?,1.0454545454545454,0.0465242105199235,22,21,1,0
3080,"Just a moment, I'm in the washroom.",1.0454545454545454,0.0465242105199235,22,21,1,0
3081,Mr. Rateri was convicted for his cruelty to the lab animals. He chose to begin his sentence while his case was on appeal.,1.0454545454545454,0.0465242105199235,22,21,1,0
3082,"At this rate, I'll never make my meeting.",1.0454545454545454,0.0465242105199235,22,21,1,0
3083,"Another Pokémon Go, but this time, originated in New York.",1.0454545454545454,0.0465242105199235,22,21,1,0
3084,Next Gen Energy Independence,1.0454545454545454,0.0465242105199235,22,21,1,0
3085,TGIF,1.0454545454545454,0.0465242105199235,22,21,1,0
3086,"I'm not a hamster, I just run a lot.",1.0454545454545454,0.0465242105199235,22,21,1,0
3087,My doubts about the corporate treadmill began with they put wood shavings on the floor.,1.0454545454545454,0.0465242105199235,22,21,1,0
3088,"For the fish/pigeon cartoon: ""Take FDR Drive north, the RIGHT at E. 94th. You can't miss it.""",1.0454545454545454,0.0465242105199235,22,21,1,0
3089,Some days I feel like a hamster,1.0454545454545454,0.0465242105199235,22,21,1,0
3090,"She said, ""Feel for me, feel for my gerbil.""",1.0454545454545454,0.0465242105199235,22,21,1,0
3091,At least I get healthcare.,1.0454545454545454,0.0465242105199235,22,21,1,0
3092,"The wheel is spinning, but the hamster is dead.",1.0454545454545454,0.0465242105199235,22,21,1,0
3093,You gotta ditch the salary trap and go solo Bob. Own your life!,1.0454545454545454,0.0465242105199235,22,21,1,0
3094,"Miss Schmaltz, call my wife and tell her I'll be working late--I'm on a roll here and don't want to quit now. Order me a cheese pizza -- and send housekeeping in to change my floor.",1.0454545454545454,0.0465242105199235,22,21,1,0
3095,"After this, I can cool off in the office fish tank.",1.0454545454545454,0.0465242105199235,22,21,1,0
3096,They warned me that too much Hamster.com could lead to this.,1.0454545454545454,0.0465242105199235,22,21,1,0
3097,This Mindfulness training isn't getting me anywhere.,1.0454545454545454,0.0465242105199235,22,21,1,0
3098,A late night in Hamsterdam.,1.0454545454545454,0.0465242105199235,22,21,1,0
3099,I was tired of being pigeonholed.,1.0454545454545454,0.0465242105199235,22,21,1,0
3100,I bet they all think it's water,1.0454545454545454,0.0465242105199235,22,21,1,0
3101,I'm avoiding getting caught up in the rat race.,1.0454545454545454,0.0465242105199235,22,21,1,0
3102,It’s definitely a rat race but I always thought of myself as more of a hamster guy.,1.0454545454545454,0.0465242105199235,22,21,1,0
3103,"I hear ya buddy, I'm fed up with the rat race too..",1.0454545454545454,0.0465242105199235,22,21,1,0
3104,When is my shift gonna be over?,1.0454545454545454,0.0465242105199235,22,21,1,0
3105,Good idea. That should get us off the cycle.,1.0454545454545454,0.0465242105199235,22,21,1,0
3106,"Panting? Oh, I'm just trying out the new wheel my owners installed for me.",1.0454545454545454,0.0465242105199235,22,21,1,0
3107,Delivery please: A hunk of cheese and some water.,1.0454545454545454,0.0465242105199235,22,21,1,0
3108,"Hold on, I'm calling from SoullessCycle.",1.0454545454545454,0.0465242105199235,22,21,1,0
3109,"No, I can't stop. If I do, Times Square goes dark.",1.0454545454545454,0.0465242105199235,22,21,1,0
3110,My new job literally has me running around in circles.,1.0454545454545454,0.0465242105199235,22,21,1,0
3111,"Why not?,.. the boss says I'm always up his ass, anyway!",1.0454545454545454,0.0465242105199235,22,21,1,0
3112,At least I'm not likely to be replaced by a robot.,1.0454545454545454,0.0465242105199235,22,21,1,0
3113,Bastards promised me a window.,1.0434782608695652,0.0444554224474387,23,22,1,0
3114,"Yes, we're spending a lot of energy on this negotiation, but it's going nowhere.",1.0434782608695652,0.0444554224474387,23,22,1,0
3115,"""...and make that TWO underarm deodorants and a bottle of Energy Plus Vitamins to deliver.",1.0434782608695652,0.0444554224474387,23,22,1,0
3116,Who ratted me out?,1.0434782608695652,0.0444554224474387,23,22,1,0
3117,Ten more pounds.,1.0434782608695652,0.0444554224474387,23,22,1,0
3118,Sure it's repetitive but it's probably better for my health than covering the Trump Administration.,1.0434782608695652,0.0444554224474387,23,22,1,0
3119,"Yes, it bears some resemblance to a standing desk.",1.0434782608695652,0.0444554224474387,23,22,1,0
3120,I was misheard. I wanted to be a big wheel.,1.0434782608695652,0.0444554224474387,23,22,1,0
3121,I like to think of it as the rodent race.,1.0434782608695652,0.0444554224474387,23,22,1,0
3122,I liked it better when it was just a rat race,1.0434782608695652,0.0444554224474387,23,22,1,0
3123,This inner-office treadmill has been great for getting me through the work-week grind!,1.0434782608695652,0.0444554224474387,23,22,1,0
3124,I feel like I'm running in circles.,1.0434782608695652,0.0444554224474387,23,22,1,0
3125,"Just put one foot in front of the other, and soon you'll be walking out the door!",1.0434782608695652,0.0444554224474387,23,22,1,0
3126,I am my own pet.,1.0,0.0645497224367902,16,16,0,0
3127,So thirsty.,1.0,0.0645497224367902,16,16,0,0
3128,"Damn, hamsters make this look easy!",1.0,0.0645497224367902,16,16,0,0
3129,"Skills pay the bills, honey.",1.0,0.0645497224367902,16,16,0,0
3130,Will somebody please close the door???,1.0,0.0645497224367902,16,16,0,0
3131,If I stay focused and keep moving I think I'm on track to make partner.,1.0,0.0645497224367902,16,16,0,0
3132,"What, if I am late?",1.0,0.0645497224367902,16,16,0,0
3133,"Sorry, honey, have to run.",1.0,0.0645497224367902,16,16,0,0
3134,Executive water boarding.,1.0,0.0645497224367902,16,16,0,0
3135,Hello? I need help. I can't get out. Why is the Wi-fi down?!,1.0,0.0645497224367902,16,16,0,0
3136,The mouse is on a lunch break. I'm just trying to keep the momentum going.,1.0,0.0645497224367902,16,16,0,0
3137,"""Great...these negotiations are going nowhere fast.",1.0,0.0645497224367902,16,16,0,0
3138,I can't be lazy eating seeds everyday.,1.0,0.0645497224367902,16,16,0,0
3139,I thought you said I would have a standing desk!,1.0,0.0645497224367902,16,16,0,0
3140,A person can't live on Trump alone.,1.0,0.0645497224367902,16,16,0,0
3141,I figured we were well beyond pigs flying at this point.,1.0,0.0645497224367902,16,16,0,0
3142,I'm starting to feel I'm getting nowhere with my life,1.0,0.0645497224367902,16,16,0,0
3143,"First, there was the Stand Up Desk...",1.0,0.0645497224367902,16,16,0,0
3144,I feel like we've spent a lot of cycles on this project without really getting anywhere.,1.0,0.0645497224367902,16,16,0,0
3145,"Mom, I can't talk now... Yeah, it's an important meeting.",1.0,0.0645497224367902,16,16,0,0
3146,"This brings the term ""rat race"" into better perspective.",1.0,0.0645497224367902,16,16,0,0
3147,I knew better than to volunteer to be a guinea pig to get ahead ...........,1.0,0.0645497224367902,16,16,0,0
3148,i guess my hamster found out that all his running was for my energy...he made me switch spots with him.,1.0,0.0606339062590832,17,17,0,0
3149,"Business is like being cooped up in a cage, you won't go anywhere with it.",1.0,0.0645497224367902,16,16,0,0
3150,"Customer Service, Gerbils are Us!",1.0,0.0645497224367902,16,16,0,0
3151,I should have taken the stairs.,1.0,0.0645497224367902,16,16,0,0
3152,Congratulations! You've won a trip to magical...hello?,1.0,0.0645497224367902,16,16,0,0
3153,"The wheel is turning and this hamster is NOT dead. Not yet, at least.",1.0,0.0645497224367902,16,16,0,0
3154,Where's my relief? It's nearly past morning break time!,1.0,0.0645497224367902,16,16,0,0
3155,"New hires at Universal Pet Supplies enjoy many benefits, including a private gym and a generous ""Open Door"" policy.",1.0,0.0645497224367902,16,16,0,0
3156,"After this deal is final, I've got a date with a cheesy chew and a pile of nesting fluff.",1.0,0.0606339062590832,17,17,0,0
3157,Did you (pant-pant) find the gerbils yet?,1.0,0.0606339062590832,17,17,0,0
3158,"Hamsters are evolving at an amazing rate, that ones got a full time job now !",1.0,0.0645497224367902,16,16,0,0
3159,"No, spin work - like spin class only less productive.",1.0,0.0645497224367902,16,16,0,0
3160,I know I can reinvent the wheel if I just keep at it.,1.0,0.0645497224367902,16,16,0,0
3161,"9998, 9999, 10,000!",1.0,0.0645497224367902,16,16,0,0
3162,CAN ANYONE HEAR ME??? I AM GETTING DIZZY!!!,1.0,0.0645497224367902,16,16,0,0
3163,The doctor said there were more heart benefits than climbing the walls.,1.0,0.0645497224367902,16,16,0,0
3164,"I'm tired of running around in circles, Ted. Let's have a drink and talk this over.",1.0,0.0645497224367902,16,16,0,0
3165,Is the wifi speed fast enough for streaming yet?!,1.0,0.0606339062590832,17,17,0,0
3166,We Have A Great Cage Culture Here At Delaney and Partners,1.0,0.0645497224367902,16,16,0,0
3167,Why didn't you tell me I was supposed to jump THROUGH it?!,1.0,0.0645497224367902,16,16,0,0
3168,It even has a river view.,1.0,0.0606339062590832,17,17,0,0
3169,"One day I'll just jump off of this darn thing. Then I'll begin to really live my life. One day I'll do it, but not today, perhaps tomorrow. Yes tomorrow it is! Tomorrow, tomorrow, I love you...",1.0,0.0645497224367902,16,16,0,0
3170,The President does this day after day with only a few hours sleep. So who am I to complain.,1.0,0.0645497224367902,16,16,0,0
3171,It's a great job: Whenever I get bored I get to go the other way and look out the window,1.0,0.0645497224367902,16,16,0,0
3172,"Then he says to me, 'Which will it be — rat race or shark tank?' So, here I am.",1.0,0.0645497224367902,16,16,0,0
3173,"Mom, the internship is going well. I do a lot of running around, but I'm making progress.",1.0,0.0645497224367902,16,16,0,0
3174,"You mean, he really thinks this is how we power Twitter?",1.0,0.0645497224367902,16,16,0,0
3175,I'd like to order a bucket of hamster pellets and a 16 oz. diet cola.,1.0,0.0645497224367902,16,16,0,0
3176,I finally feel like I'm getting somewhere.,1.0,0.0645497224367902,16,16,0,0
3177,Get IT on the line ASAP. It's happened again...,1.0,0.0645497224367902,16,16,0,0
3178,"The exercise plan is great, but I chose to come aboard for the executive bathroom.",1.0,0.0645497224367902,16,16,0,0
3179,First the Bad News. Herbie the Hamster Died.,1.0,0.0645497224367902,16,16,0,0
3180,I need to make it to the bathroom,1.0,0.0645497224367902,16,16,0,0
3181,I'm just here to teach you kids about death.,1.0,0.0606339062590832,17,17,0,0
3182,Repeal for Obama Care is underway!!!,1.0,0.0645497224367902,16,16,0,0
3183,"Mary, I'm going to need something to nibble on when I'm done here.",1.0,0.0645497224367902,16,16,0,0
3184,"Alice, I can't take it anymore. Push everything back indefinitely. I'm running out for a drink.",1.0,0.0645497224367902,16,16,0,0
3185,Talk to me.,1.0,0.0645497224367902,16,16,0,0
3186,OK 1000 bananas per hour but no reverse spin!,1.0,0.0645497224367902,16,16,0,0
3187,I thought Singularity was going to lead to a reduced workload.,1.0,0.0645497224367902,16,16,0,0
3188,"'There is no need to try to invent a better mousetrap""",1.0,0.0645497224367902,16,16,0,0
3189,"Can I call you back? I'm running late for a meeting. If, that is, I can ever get out the door.",1.0,0.0606339062590832,17,17,0,0
3190,"YA, SOMETIMES I FEEL LIKE I'M IN A RAT RACE TOO.",1.0,0.0645497224367902,16,16,0,0
3191,I am making America great again,1.0,0.0645497224367902,16,16,0,0
3192,One more week and I am on a beach in Cayman and retired! Out of this rodent-like life for good!,1.0,0.0645497224367902,16,16,0,0
3193,"I am there, fore, I think.",1.0,0.0606339062590832,17,17,0,0
3194,Only 29 weeks until the marathon.,1.0,0.0645497224367902,16,16,0,0
3195,I wouldn't exactly call it a 'rat race.',1.0,0.0645497224367902,16,16,0,0
3196,K. Finishing up the cardio. Gonna hit the maze.,1.0,0.0645497224367902,16,16,0,0
3197,Trumpcare gives me better calves.,1.0,0.0645497224367902,16,16,0,0
3198,"No, dear; the job description didn't specify how to run the business.",1.0,0.0645497224367902,16,16,0,0
3199,Boss said I could run for president.,1.0,0.0645497224367902,16,16,0,0
3200,It's hard work being a furry.,1.0,0.0606339062590832,17,17,0,0
3201,"Well, somebody's gotta pay the rent!",1.0,0.0645497224367902,16,16,0,0
3202,The new procedures to get government research money are exhausting.,1.0,0.0645497224367902,16,16,0,0
3203,"Ya, these Nikes work.",1.0,0.0645497224367902,16,16,0,0
3204,Front desk? Housekeeping left the door open on the cage and it's ruining my career.,1.0,0.0645497224367902,16,16,0,0
3205,TGIF,1.0,0.0645497224367902,16,16,0,0
3206,"I'm working hard to get back on track, but I feel like I'm just running in circles.",1.0,0.0645497224367902,16,16,0,0
3207,I just received a patent for my Endorphin Engine!,1.0,0.0645497224367902,16,16,0,0
3208,This new weight loss machine works great!,1.0,0.0645497224367902,16,16,0,0
3209,"I've been running around in circles to get to 10,000 steps.",1.0,0.0645497224367902,16,16,0,0
3210,Now I know what they meant about by rat race,1.0,0.0645497224367902,16,16,0,0
3211,I feel like I've seen this all before.,1.0,0.0645497224367902,16,16,0,0
3212,Just give me one more chance to prove that I'm not the rat I used to be.,1.0,0.0606339062590832,17,17,0,0
3213,A rush-in trumpmill. How tweet it is.,1.0,0.0645497224367902,16,16,0,0
