rank,caption,mean,precision,votes,not_funny,somewhat_funny,funny
1998,"Marx was wrong, Marx was wrong, Marx was wrong...",1.0833333333333333,0.0576303395673437,24,22,2,0
1999,"Help, how do you stop this wheel?",1.0833333333333333,0.0576303395673437,24,22,2,0
2000,"Alexa, order more wood chips and find a ENT doctor to come over and clean my cheek pouches.",1.0833333333333333,0.0833333333333333,24,23,0,1
2001,"I think the ""We Know Hamsters"" campaign's losing steam.",1.0833333333333333,0.0576303395673437,24,22,2,0
2002,Standing desks are for losers.,1.0833333333333333,0.0576303395673437,24,22,2,0
2003,The American Dream?,1.0833333333333333,0.0576303395673437,24,22,2,0
2004,Then I discovered that all progress is just an illusion.,1.0833333333333333,0.0576303395673437,24,22,2,0
2005,"Yeah, this could be it...they said I'm inner circle material.",1.0833333333333333,0.0576303395673437,24,22,2,0
2006,I hope they fix the treadmill soon.,1.0833333333333333,0.0576303395673437,24,22,2,0
2007,And schedule a lunch meeting at that new Alfalfa place.,1.0833333333333333,0.0576303395673437,24,22,2,0
2008,Is this what we look like to God?,1.0833333333333333,0.0576303395673437,24,22,2,0
2009,"3,000,001, 3,000,002, 3,000,003'.........",1.0833333333333333,0.0576303395673437,24,22,2,0
2010,"For the fish/pigeon cartoon: ""Ok, I'm a rat with wings. I've decided to own it.""",1.0833333333333333,0.0576303395673437,24,22,2,0
2011,"Honey, if I leave work early tonight I'll never get ahead.",1.0833333333333333,0.0576303395673437,24,22,2,0
2012,C-a-d-m-e-a-n!,1.0833333333333333,0.0576303395673437,24,22,2,0
2013,The flip side of the future seen in 2017's Doodle 4 Google...,1.0833333333333333,0.0576303395673437,24,22,2,0
2014,I'm on my lunch break.,1.0833333333333333,0.0576303395673437,24,22,2,0
2015,I still don't understand why I need this tie!,1.0833333333333333,0.0833333333333333,24,23,0,1
2016,Training for yet another rat race...,1.0833333333333333,0.0576303395673437,24,22,2,0
2017,Husbands always treated like an animal.,1.0833333333333333,0.0576303395673437,24,22,2,0
2018,I don't get it why would the hamster run away from such a luxurious amenity,1.0833333333333333,0.0576303395673437,24,22,2,0
2019,My cellphone is almost charged,1.0833333333333333,0.0576303395673437,24,22,2,0
2020,"Is this why the call it ""the rat race""?",1.0833333333333333,0.0576303395673437,24,22,2,0
2021,The modern Sisyphus.,1.0833333333333333,0.0576303395673437,24,22,2,0
2022,Fitbit sales employee of the month,1.0833333333333333,0.0576303395673437,24,22,2,0
2023,Invest in pedometer stock.,1.0833333333333333,0.0576303395673437,24,22,2,0
2024,America! America. God shed his grace on thee!,1.0833333333333333,0.0833333333333333,24,23,0,1
2025,"The market is cyclical.""",1.0833333333333333,0.0576303395673437,24,22,2,0
2026,It's for science they said... It'll be fun they said...,1.0833333333333333,0.0576303395673437,24,22,2,0
2027,"I know the meeting is at two, but this required medical treatment won't allow me out the door.",1.0833333333333333,0.0576303395673437,24,22,2,0
2028,Big wheels keep on turning!,1.0833333333333333,0.0576303395673437,24,22,2,0
2029,I really feel like I'm going places.,1.0833333333333333,0.0576303395673437,24,22,2,0
2030,"If you think this is bad, wait till you taste one of the food pellets.",1.0833333333333333,0.0576303395673437,24,22,2,0
2031,"Progress is great, but nothing fills the day like activity.",1.0833333333333333,0.0576303395673437,24,22,2,0
2032,Trying to keep ahead of investigations.,1.0833333333333333,0.0576303395673437,24,22,2,0
2033,"guns, taxes, deregulation",1.0833333333333333,0.0833333333333333,24,23,0,1
2034,''The job's gone from being a joke to a metaphor. Just like everything else.'',1.0833333333333333,0.0576303395673437,24,22,2,0
2035,David really wanted to be Employee of the Month,1.0833333333333333,0.0833333333333333,24,23,0,1
2036,"When Trump said he'd bring more jobs to town, this isn't what I had in mind.",1.0833333333333333,0.0576303395673437,24,22,2,0
2037,"Um, I know it's sustainable but do you have anything softer than cedar?",1.0833333333333333,0.0576303395673437,24,22,2,0
2038,They told me that I'd be out of the rat race....,1.0833333333333333,0.0833333333333333,24,23,0,1
2039,Progress on this deal has been slow in coming.,1.0833333333333333,0.0576303395673437,24,22,2,0
2040,"Sorry, I can't leave work yet. My boss has me running in circles",1.0833333333333333,0.0576303395673437,24,22,2,0
2041,Sorry about all the noise. I'm calling from my home office.,1.0833333333333333,0.0576303395673437,24,22,2,0
2042,"Yes, I quit the rat race to work from home.",1.0833333333333333,0.0576303395673437,24,22,2,0
2043,"Well, ok. I'll take the global warming.",1.0833333333333333,0.0833333333333333,24,23,0,1
2044,It's definitely a multitasking breakthrough but sometimes I can't resist dropping down on all fours to relieve myself in the wood chips...,1.0833333333333333,0.0576303395673437,24,22,2,0
2045,"Sure, but it's just until December. I'm up for a bigger wheel.",1.0833333333333333,0.0576303395673437,24,22,2,0
2046,I'll find that damn hamster even if it takes all day!,1.0833333333333333,0.0833333333333333,24,23,0,1
2047,Cancel my one o'clock--I think I'm getting somewhere.,1.0833333333333333,0.0576303395673437,24,22,2,0
2048,Just think...in thirty years I can retire...,1.0833333333333333,0.0576303395673437,24,22,2,0
2049,"Hello, Humane Society?...I have a complaint...",1.0833333333333333,0.0576303395673437,24,22,2,0
2050,"After this, I'm getting a huge hunk of cheese.",1.0833333333333333,0.0576303395673437,24,22,2,0
2051,"I'm not getting anywhere in this job, but the perks are good.",1.0833333333333333,0.0576303395673437,24,22,2,0
2052,Same old! Same old!,1.0833333333333333,0.0576303395673437,24,22,2,0
2053,Tell those hamsters their bathroom break is over!!,1.0833333333333333,0.0833333333333333,24,23,0,1
2054,The boss has a different definition of 'telecommute.',1.0833333333333333,0.0833333333333333,24,23,0,1
2055,"Dr. Johnson, when will this stress be over? Dr. Johnson?",1.0833333333333333,0.0576303395673437,24,22,2,0
2056,The politician that will one day have to drink the water from Flint.,1.0833333333333333,0.0576303395673437,24,22,2,0
2057,Sisyphus Redux--Wall Street Version,1.0833333333333333,0.0833333333333333,24,23,0,1
2058,What a rat race!,1.0833333333333333,0.0576303395673437,24,22,2,0
2059,This is an awesome break from my daily routine's vicious circle!,1.0833333333333333,0.0576303395673437,24,22,2,0
2060,"Nope, just the seeds.",1.0833333333333333,0.0576303395673437,24,22,2,0
2061,"How is ""always""? Is ""always"" good for you?",1.0833333333333333,0.0576303395673437,24,22,2,0
2062,"Okay,I'm leading the gerbil.But by how much?",1.0833333333333333,0.0576303395673437,24,22,2,0
2063,We just launched a corporate truth-telling initiative.,1.0833333333333333,0.0576303395673437,24,22,2,0
2064,Wheeling and dealing,1.0833333333333333,0.0576303395673437,24,22,2,0
2065,I hear they're adding a tower to our office tomorrow.,1.0833333333333333,0.0833333333333333,24,23,0,1
2066,That's not workers on the roof.,1.0833333333333333,0.0576303395673437,24,22,2,0
2067,When do I turn to unwind this thing?,1.0833333333333333,0.0576303395673437,24,22,2,0
2068,"For those in the corner office, turn-over was common.",1.0833333333333333,0.0576303395673437,24,22,2,0
2069,John thought of himself as quite the wheeler dealer,1.0833333333333333,0.0833333333333333,24,23,0,1
2070,"Yes, still tracking the source.",1.0833333333333333,0.0576303395673437,24,22,2,0
2071,Yup! Livin' the dream.,1.0833333333333333,0.0576303395673437,24,22,2,0
2072,Enough already! I swear never again I tell 'Putin on the ritz' joke'!,1.0833333333333333,0.0576303395673437,24,22,2,0
2073,They told me I was joining the rat race...someone told me wrong.,1.0833333333333333,0.0576303395673437,24,22,2,0
2074,Is he the new guinea pig?,1.0833333333333333,0.0576303395673437,24,22,2,0
2075,Gerbil? Who said gerbil?,1.0833333333333333,0.0576303395673437,24,22,2,0
2076,"That's your toothbrush charged, Sally. Now attach the car.",1.0833333333333333,0.0576303395673437,24,22,2,0
2077,"Shoot, I'm late for work! Can't this thing go any faster?!",1.0833333333333333,0.0576303395673437,24,22,2,0
2078,These workplace health programs are getting out of control.,1.0833333333333333,0.0576303395673437,24,22,2,0
2079,"Like rodents, humans are highly motivated to run in wheels. Voluntary wheel-running is an indicator of workplace satisfaction, ambition and focus.",1.0833333333333333,0.0576303395673437,24,22,2,0
2080,"Mom, you won't believe my new office.",1.0833333333333333,0.0576303395673437,24,22,2,0
2081,Must...continue...to pursue...the Russia hacking the election...story.,1.0833333333333333,0.0833333333333333,24,23,0,1
2082,They promoted me from gopher to hamster.,1.0833333333333333,0.0576303395673437,24,22,2,0
2083,Management uses Milo as a guinea pig in sales.,1.0833333333333333,0.0576303395673437,24,22,2,0
2084,Have I made it to success yet?,1.0833333333333333,0.0576303395673437,24,22,2,0
2085,I'm here on a rotating basis. The pay is peanuts but the benefits are cushy.,1.0833333333333333,0.0576303395673437,24,22,2,0
2086,Your new running wheel will decrease healthcare costs and provide clean energy. Buy yours today.,1.0833333333333333,0.0833333333333333,24,23,0,1
2087,I'm faster than the hamsters and I don't eat the plants!,1.0833333333333333,0.0576303395673437,24,22,2,0
2088,Dan's working on renewable energy,1.0833333333333333,0.0576303395673437,24,22,2,0
2089,"No, boss, that's not the sound of a big wheel. My office is right next to the railroad tracks.",1.0833333333333333,0.0833333333333333,24,23,0,1
2090,"To hell with the rat race, I joined the gerbil race.",1.0833333333333333,0.0576303395673437,24,22,2,0
2091,Water? It's suposed to be vodka!,1.0833333333333333,0.0576303395673437,24,22,2,0
2092,"Yeah, it's a rat race, but it's a lot better than the boiler room.",1.0833333333333333,0.0576303395673437,24,22,2,0
2093,You'd think think this gig would be a bit more dress casual !?,1.0833333333333333,0.0576303395673437,24,22,2,0
2094,"Now, if you will follow me into the next room, we find a rare example of commuter still preserved in its wild state, running late for its train.",1.0833333333333333,0.0576303395673437,24,22,2,0
2095,Now I know how a gerbil feels!,1.0833333333333333,0.0576303395673437,24,22,2,0
2096,A new spin on Spin.,1.0833333333333333,0.0833333333333333,24,23,0,1
2097,Being the Announcer on Wheel of Fortune has gotten much trickier these days,1.0833333333333333,0.0576303395673437,24,22,2,0
2098,I think I pulled a hammy!,1.0833333333333333,0.0576303395673437,24,22,2,0
2099,"Honey, I'll be home next May 21st.",1.0833333333333333,0.0833333333333333,24,23,0,1
2100,"Well, if it's done nothing else, at least it's increased my sense of déjà vu.",1.0833333333333333,0.0576303395673437,24,22,2,0
2101,alright then. Just let me know when your phone is charged.,1.0833333333333333,0.0576303395673437,24,22,2,0
2102,"Most days my job feels like a rat race, but that God it's only 9 to 5.",1.0833333333333333,0.0576303395673437,24,22,2,0
2103,I just feel like I'm running in circles,1.0833333333333333,0.0576303395673437,24,22,2,0
2104,"Look, as long as the hamster's numbers stay this good, no need to tell the boss about the job switch.",1.0833333333333333,0.0576303395673437,24,22,2,0
2105,I'm just trying to get in better shape in case I lose my White House job and am impersonated by someone on Saturday Night Live.,1.0833333333333333,0.0576303395673437,24,22,2,0
2106,"I'll meet you at the tube, cheerio!",1.0833333333333333,0.0576303395673437,24,22,2,0
2107,"Help me! This wheel is stuck- the water bottle spout and window sill extension go right through it.""",1.0833333333333333,0.0576303395673437,24,22,2,0
2108,I don't seem to be getting any closer to the door.,1.0833333333333333,0.0576303395673437,24,22,2,0
2109,"If I have to be in the rat race, I might as well enjoy it.",1.0833333333333333,0.0576303395673437,24,22,2,0
2110,"Yikes, am I a man or a mouse?",1.0833333333333333,0.0576303395673437,24,22,2,0
2111,It's great for my productivity and puts a positive spin on the whole rat race concept.,1.0833333333333333,0.0576303395673437,24,22,2,0
2112,Wish I had brought my trainers.,1.0833333333333333,0.0576303395673437,24,22,2,0
2113,So you’re sure this cures cancer?,1.0833333333333333,0.0576303395673437,24,22,2,0
2114,The Unexamined Life Is Not Worth Living,1.0833333333333333,0.0576303395673437,24,22,2,0
2115,Weeeeeeeeeee,1.0833333333333333,0.0576303395673437,24,22,2,0
2116,Let me run some figures by you.,1.0833333333333333,0.0576303395673437,24,22,2,0
2117,I'm going to win this rat race.,1.0833333333333333,0.0576303395673437,24,22,2,0
2118,"I dont mind it so much, it's the only exercise that I get...",1.0833333333333333,0.0576303395673437,24,22,2,0
2119,I gave the gerbil the week off.,1.0833333333333333,0.0833333333333333,24,23,0,1
2120,No metaphor at all. I literally can't get off this hamster wheel.,1.0833333333333333,0.0576303395673437,24,22,2,0
2121,"Listen, I'm gonna have to let you go, my cedar chip guy is calling.",1.0833333333333333,0.0833333333333333,24,23,0,1
2122,Memo to self: Update the dress code.,1.0833333333333333,0.0576303395673437,24,22,2,0
2123,Only 20 more years to retirement.,1.0833333333333333,0.0576303395673437,24,22,2,0
2124,A look into the American Ninja offices.,1.0833333333333333,0.0833333333333333,24,23,0,1
2125,"Hi Hon, I've just gotten the prototype working!",1.0833333333333333,0.0833333333333333,24,23,0,1
2126,I had to get out of the rat race!,1.0833333333333333,0.0576303395673437,24,22,2,0
2127,"It was the only way I could get my daily 10,000 steps in.",1.0833333333333333,0.0576303395673437,24,22,2,0
2128,Wow! This is exactly where I saw myself in five years!,1.0833333333333333,0.0576303395673437,24,22,2,0
2129,"As the king of turnaround specialists, I've returned countless unicorns to solvency.",1.0833333333333333,0.0576303395673437,24,22,2,0
2130,"Apparently, it wasn't cute to ask for a ""pro-motion""",1.0833333333333333,0.0576303395673437,24,22,2,0
2131,"Give me a few more days, I feel like I'm really starting to make some progress",1.0833333333333333,0.0833333333333333,24,23,0,1
2132,BodyShredder! Work out! Have fun! All while disappearing those pesky records linking you to Russia.,1.0833333333333333,0.0576303395673437,24,22,2,0
2133,Apartment available. Modern living setup perfect for those who work from home.,1.0833333333333333,0.0576303395673437,24,22,2,0
2134,Ok. I'll meet you at the White House as soon as I'm done here.,1.0833333333333333,0.0576303395673437,24,22,2,0
2135,"I'm going to need the flea powder in a minute, Angie.",1.0833333333333333,0.0576303395673437,24,22,2,0
2136,Success is right around the corner!,1.0833333333333333,0.0576303395673437,24,22,2,0
2137,You gotta get one! My fitness tracker put me back in control of my life...,1.0833333333333333,0.0576303395673437,24,22,2,0
2138,Why don't I take the tube and meet you at Charing Cross?,1.0833333333333333,0.0576303395673437,24,22,2,0
2139,"Everyone says New York apartments are small, but mine goes on for days!",1.0833333333333333,0.0576303395673437,24,22,2,0
2140,"Sir, I'm sorry but you misunderstood when the staff requested an exercise room.",1.0833333333333333,0.0576303395673437,24,22,2,0
2141,"Yes, sir. I'm running those numbers as we speak.",1.0833333333333333,0.0576303395673437,24,22,2,0
2142,"Martha, I want that auto-feeder yesterday.",1.0833333333333333,0.0576303395673437,24,22,2,0
2143,So this the rat race.,1.0833333333333333,0.0576303395673437,24,22,2,0
2144,Western Meditation,1.0833333333333333,0.0576303395673437,24,22,2,0
2145,"I've tried to lick, press 1 and say 'more water', but nothing seems to work.",1.0833333333333333,0.0576303395673437,24,22,2,0
2146,"Great, but are the lights on upstairs ?",1.0833333333333333,0.0576303395673437,24,22,2,0
2147,I can't stop running in circles climbing the corporate ladder - please promote me!,1.0833333333333333,0.0576303395673437,24,22,2,0
2148,I only use it when it's raining.,1.0833333333333333,0.0576303395673437,24,22,2,0
2149,I'll call you back. I've got to run to another meeting.,1.0833333333333333,0.0576303395673437,24,22,2,0
2150,Look how cute!,1.0833333333333333,0.0576303395673437,24,22,2,0
2151,At my last job I felt like a rat in a cage.,1.0833333333333333,0.0576303395673437,24,22,2,0
2152,Thank you for calling GERBILS-R-US. How may I help you?,1.0833333333333333,0.0576303395673437,24,22,2,0
2153,Our office decorator was way too much into metaphors!,1.0833333333333333,0.0833333333333333,24,23,0,1
2154,"Yes, a nice pair of running shoes would be a good birthday present.",1.0833333333333333,0.0576303395673437,24,22,2,0
2155,I feel like we're getting nowhere.,1.0833333333333333,0.0576303395673437,24,22,2,0
2156,"Mission Impossible 6: ""Mission Meaningless""",1.0833333333333333,0.0576303395673437,24,22,2,0
2157,Are you sick and tired of your standing desk?,1.0833333333333333,0.0576303395673437,24,22,2,0
2158,"I don't believe that 'if the door shuts, a window opens' nonsense.",1.0833333333333333,0.0576303395673437,24,22,2,0
2159,My investigation is really moving ahead--but before I say anything I'd like to close the door.,1.0833333333333333,0.0576303395673437,24,22,2,0
2160,I've taken the standing desk to the next level.,1.0833333333333333,0.0576303395673437,24,22,2,0
2161,Tweeting is for the birds. I'm going to win the rat race!,1.0833333333333333,0.0576303395673437,24,22,2,0
2162,My hamster thinks I need to lose weight.,1.0833333333333333,0.0576303395673437,24,22,2,0
2163,You think your standing desk is cool?,1.0833333333333333,0.0833333333333333,24,23,0,1
2164,I actually miss my stand-up desk.,1.0833333333333333,0.0576303395673437,24,22,2,0
2165,So where's my prize?,1.0833333333333333,0.0576303395673437,24,22,2,0
2166,Some people think this company is cagey.,1.0833333333333333,0.0576303395673437,24,22,2,0
2167,I'm never going to be there.,1.0833333333333333,0.0833333333333333,24,23,0,1
2168,"I will not compare this to Washington politics, I will not compare this to Washington politics, I will not....",1.0833333333333333,0.0576303395673437,24,22,2,0
2169,Beats the rat race,1.0833333333333333,0.0833333333333333,24,23,0,1
2170,"Despite the administration’s executive order, I am continuing my banana peal research at the NIH.",1.0833333333333333,0.0576303395673437,24,22,2,0
2171,"Ultimately, it was the isolation that that got to Barry.",1.0833333333333333,0.0833333333333333,24,23,0,1
2172,"Hey, what's up with you?",1.0833333333333333,0.0576303395673437,24,22,2,0
2173,Hang on a sec ... I forgot my briefcase!,1.0833333333333333,0.0833333333333333,24,23,0,1
2174,"When the robots took control, they thought we could stand to lose a few.",1.0833333333333333,0.0576303395673437,24,22,2,0
2175,"You got the wrong guy, I'm the designer...",1.0833333333333333,0.0576303395673437,24,22,2,0
2176,"I can handle the pointlessness, it the mortality salience that gets me.",1.0833333333333333,0.0576303395673437,24,22,2,0
2177,"Run, run, run, run, I gotta run, I gotta run, woo, woo, I gotta run.",1.0833333333333333,0.0576303395673437,24,22,2,0
2178,"""This conversation seems to be going in circles"".",1.0833333333333333,0.0576303395673437,24,22,2,0
2179,Fox News spin doctor on deck circle.,1.0833333333333333,0.0576303395673437,24,22,2,0
2180,Could someone please close the door? The other options are distracting.,1.0833333333333333,0.0576303395673437,24,22,2,0
2181,"The new company's exercise wheel and water bottle does make work more efficient, but I draw the line if they want me to use the cedar chips.",1.0833333333333333,0.0576303395673437,24,22,2,0
2182,"Siri, when do we get a break?",1.0833333333333333,0.0576303395673437,24,22,2,0
2183,Oh I up to the same old thing!,1.0833333333333333,0.0833333333333333,24,23,0,1
2184,It's a great job. They give me everything I need to survive. I just hate the damn squeaking.,1.0833333333333333,0.0576303395673437,24,22,2,0
2185,The gym at CNN,1.0833333333333333,0.0833333333333333,24,23,0,1
2186,"Above all, I'm being productive.",1.0833333333333333,0.0576303395673437,24,22,2,0
2187,"Just a few more steps, and I'll reach the water...",1.0833333333333333,0.0576303395673437,24,22,2,0
2188,Gotta run. I'll meet you later for happy hour at the water bowl.,1.0833333333333333,0.0576303395673437,24,22,2,0
2189,"After his mundane daily office tasks became automated, Frank zealously transitions into his new daily routine.",1.0833333333333333,0.0576303395673437,24,22,2,0
2190,ARE THE LIGHTS ON NOW HONEY ?,1.0833333333333333,0.0576303395673437,24,22,2,0
2191,But I'll get a 'step increase' and water when I face forward and spin backwards.,1.0833333333333333,0.0833333333333333,24,23,0,1
2192,"With the promotion, I get Astroturf and a treadmill.",1.0833333333333333,0.0576303395673437,24,22,2,0
2193,No wonder hamsters stay in shape!,1.0833333333333333,0.0576303395673437,24,22,2,0
2194,"Honey, I'll be a little late. My paperwork is just plain shredded and I can't make it out the door.",1.0833333333333333,0.0576303395673437,24,22,2,0
2195,I feel like we're going in circles.,1.0833333333333333,0.0576303395673437,24,22,2,0
2196,I preferred the rat race.,1.0833333333333333,0.0576303395673437,24,22,2,0
2197,I'm really getting tired of this rate race.,1.0833333333333333,0.0576303395673437,24,22,2,0
2198,"Yea, I'm still Trying to find out who moved my cheese....",1.0833333333333333,0.0576303395673437,24,22,2,0
2199,Fifteen more minutes and you should have enough energy to start using the computers again.,1.0833333333333333,0.0576303395673437,24,22,2,0
2200,"The ad said ""Recharge Your batteries!"" I thought I was buying a Caribbean cruise.",1.0833333333333333,0.0576303395673437,24,22,2,0
2201,"Yeah I'm STILL training for the NASA astronaut program. What? Yes I'm very serious about this mom, I need my space.",1.0833333333333333,0.0576303395673437,24,22,2,0
2202,"I get the whole active lifestyle thing, but this thing is a little ridiculous.",1.0833333333333333,0.0576303395673437,24,22,2,0
2203,I'm on my way out the door.,1.0833333333333333,0.0576303395673437,24,22,2,0
2204,I mean it this time -- just one more bonus.,1.0833333333333333,0.0576303395673437,24,22,2,0
2205,These new pre-employment physicals suck!,1.0833333333333333,0.0833333333333333,24,23,0,1
2206,okay sir is your refrigerator running now?,1.0833333333333333,0.0576303395673437,24,22,2,0
2207,Should be home for dinner.,1.0833333333333333,0.0576303395673437,24,22,2,0
2208,"No thanks, I don't want to go to spin class tonight.",1.0833333333333333,0.0576303395673437,24,22,2,0
2209,I call it Hamsterobics... Hello? Shark Tank Pitch Line?... Hello?,1.0833333333333333,0.0576303395673437,24,22,2,0
2210,Beats a standing desk.,1.0833333333333333,0.0576303395673437,24,22,2,0
2211,"The job's OK, but the carrrot-only lunch is a bit much.",1.0833333333333333,0.0576303395673437,24,22,2,0
2212,This office really FEELS like a rat race.....,1.0833333333333333,0.0576303395673437,24,22,2,0
2213,This project is building momentum.,1.0833333333333333,0.0576303395673437,24,22,2,0
2214,I just don't anticipate running into any forks in the road.,1.0833333333333333,0.0576303395673437,24,22,2,0
2215,"""It was this or Politics... I'm happy with my decision."" - John on his first day in Metaphor R&D",1.0833333333333333,0.0576303395673437,24,22,2,0
2216,I think I'll put my name in for the position in the Maze Department,1.0833333333333333,0.0576303395673437,24,22,2,0
2217,Jensen never realized his true situation until it was too late.,1.0833333333333333,0.0833333333333333,24,23,0,1
2218,Sisyphus has nothing on me .....,1.0833333333333333,0.0576303395673437,24,22,2,0
2219,I'm so glad I didn't waste my money on a treadmill!,1.0833333333333333,0.0576303395673437,24,22,2,0
2220,"No, I'm good. We can keep going. They just brought in fresh shavings.",1.0833333333333333,0.0576303395673437,24,22,2,0
2221,"George found out how fit his pet was, so he followed their lead.",1.0833333333333333,0.0576303395673437,24,22,2,0
2222,"Okay, but I draw the line at eating insects!",1.0833333333333333,0.0576303395673437,24,22,2,0
2223,This office gym is great.,1.0833333333333333,0.0576303395673437,24,22,2,0
2224,Our electricity bills for shredding have dropped to almost nothing since I introduced this!,1.0833333333333333,0.0833333333333333,24,23,0,1
2225,"No, this is how I unwind after the rat race",1.0833333333333333,0.0576303395673437,24,22,2,0
2226,I feel like my career is going nowhere.,1.0833333333333333,0.0576303395673437,24,22,2,0
2227,Now I know why the hiring manager said I remind him of a gerbil.,1.0833333333333333,0.0576303395673437,24,22,2,0
2228,WILL JOIN RAT RACE FOR CHEESE.,1.0833333333333333,0.0576303395673437,24,22,2,0
2229,"Sunrise, sunset...",1.0833333333333333,0.0576303395673437,24,22,2,0
2230,"Yeah, they finally put down sawdust so I can shit myself in peace.",1.0833333333333333,0.0576303395673437,24,22,2,0
2231,"Oh, just keeping fit so I can continue to inflict misery on others. And you, Mr. President?",1.0833333333333333,0.0576303395673437,24,22,2,0
2232,Kevin changed his mind and determined he would do whatever it takes to CRUSH in the rat race.,1.0833333333333333,0.0576303395673437,24,22,2,0
2233,"My boss tells me if I pick up the pace, I will get to where I'm going a lot faster.",1.0833333333333333,0.0576303395673437,24,22,2,0
2234,Just another day in the rat race.,1.0833333333333333,0.0576303395673437,24,22,2,0
2235,"Well, at least it's healthier than my old cubicle.",1.0833333333333333,0.0576303395673437,24,22,2,0
2236,"FASTER, FASTER PLEASE THE MASTER",1.0833333333333333,0.0833333333333333,24,23,0,1
2237,"Honey, I have to stay a little late at the office. My Fitbit shows I fell a little short today.",1.0833333333333333,0.0576303395673437,24,22,2,0
