rank,caption,mean,precision,votes,not_funny,somewhat_funny,funny
1014,I tried the stand-up desk but this stimulates more endorphins and better ideas.,1.15625,0.091022141492801,32,29,1,2
1015,"The Spicer Spin, an alternative way to lose facts",1.15625,0.0791763930074957,32,28,3,1
1016,SoulCycle is for suckers.,1.15625,0.0791763930074957,32,28,3,1
1017,Can you hear me now? Can you hear me now? Can you hear me now?. . .,1.15625,0.091022141492801,32,29,1,2
1018,The boss will never know we lost the last one and replaced him with another.,1.15625,0.0652132822162736,32,27,5,0
1019,Keeping up with the Sisyphus's,1.15625,0.0791763930074957,32,28,3,1
1020,Four legs good--two legs almost as good.,1.15625,0.0652132822162736,32,27,5,0
1021,Hate it when I forget my Fitbit!,1.15625,0.091022141492801,32,29,1,2
1022,"Yeah, it's a bit harder to read email, but I can pee in the corner!",1.15625,0.0652132822162736,32,27,5,0
1023,Proof that the Fitbit is turning men into mice.,1.15625,0.0791763930074957,32,28,3,1
1024,I've got you on handsfree cause I'm at the wheel.,1.15625,0.0652132822162736,32,27,5,0
1025,"Well, they told me if I keep working really hard, I can make my way up to CEO.",1.15625,0.0652132822162736,32,27,5,0
1026,"My brain says get another job, but my Fitbit says stay here.",1.15625,0.0791763930074957,32,28,3,1
1027,Can you check if the boss's room is cool now?,1.15625,0.0791763930074957,32,28,3,1
1028,Trump action...no progress.,1.15625,0.0791763930074957,32,28,3,1
1029,...I'll circle back to you on that one,1.15625,0.0791763930074957,32,28,3,1
1030,"Hello, you're through to David in the Government Progress Department...",1.15625,0.0652132822162736,32,27,5,0
1031,You should see him at crossfit.,1.15625,0.091022141492801,32,29,1,2
1032,Hi honey. Remember when they said I'd get the office reserved for the 'big wheel'?,1.15625,0.0652132822162736,32,27,5,0
1033,"Honey, I'll be home in about thirty minutes if I clear the doorway and don't crash into the wall.",1.15625,0.091022141492801,32,29,1,2
1034,I decided to reinvent myself.,1.15625,0.0652132822162736,32,27,5,0
1035,When do we break for lunch?,1.15625,0.0652132822162736,32,27,5,0
1036,"Dave, I gotta run. We still on for yogurt drops later?",1.15625,0.0791763930074957,32,28,3,1
1037,"Yes boss, I’m working on the Habitrail account.",1.15625,0.0791763930074957,32,28,3,1
1038,"Is it just me, or is this conversation continuing to go in circles?",1.15625,0.0652132822162736,32,27,5,0
1039,Someone stop this thing!,1.15625,0.091022141492801,32,29,1,2
1040,"Though generally happy at his new job, Bill did at times wonder about the prospects for advancement.",1.15625,0.0652132822162736,32,27,5,0
1041,All this wheelin & dealin was making Joe thirsty,1.15625,0.0791763930074957,32,28,3,1
1042,Our company finally renovated the employee gym - no more treadmills!,1.15625,0.0791763930074957,32,28,3,1
1043,I'm in the wheel house.,1.15625,0.0652132822162736,32,27,5,0
1044,It's the hamster efficiency program. I've also got a protein bar stored in my cheeks.,1.15625,0.0791763930074957,32,28,3,1
1045,"It is soul crushing, but somehow I like it.",1.15625,0.0652132822162736,32,27,5,0
1046,Thank you for calling Alternate Energy Inc. How may I help you?,1.15625,0.091022141492801,32,29,1,2
1047,You ever have one of those days where you feel like you just can't get ahead?,1.15625,0.0652132822162736,32,27,5,0
1048,A glimpse into the R&D labs at RedBull.,1.15625,0.0791763930074957,32,28,3,1
1049,When does the whole privilege thing kick in?,1.15625,0.0791763930074957,32,28,3,1
1050,Can't talk now - gotta run.,1.15625,0.0652132822162736,32,27,5,0
1051,"Actually some people would be offended by the expression, ""I don't give a rat's ass"".",1.15625,0.0652132822162736,32,27,5,0
1052,Act now and we'll include this bag of cedar chips for free!,1.15625,0.0791763930074957,32,28,3,1
1053,I'd rather join the rat race!,1.15625,0.0791763930074957,32,28,3,1
1054,Sometimes I feel like I'm just going in circles.,1.15625,0.0791763930074957,32,28,3,1
1055,"Yes, it's working perfectly so far productivity wise but I just can't get that damn ""I'm Chip, He's Dale"" song out of my head!",1.15625,0.091022141492801,32,29,1,2
1056,We should have just told him he was fired instead of letting him run in circles.,1.15625,0.091022141492801,32,29,1,2
1057,I assumed it was a typo when I saw our new fitness center called 'state of the rat.',1.15625,0.0652132822162736,32,27,5,0
1058,It looked smaller on TV.,1.15625,0.0791763930074957,32,28,3,1
1059,"Oh yeah, you feel you're on the treadmill of life. Tell me about it.",1.15625,0.0791763930074957,32,28,3,1
1060,I try not to think about it when I'm running.,1.15625,0.0791763930074957,32,28,3,1
1061,YOU think it's easy getting to the top!,1.15625,0.0791763930074957,32,28,3,1
1062,"100,000 steps this week and it's only Wednesday.",1.15625,0.0791763930074957,32,28,3,1
1063,Dyslexic Sisyphus,1.15625,0.0791763930074957,32,28,3,1
1064,"That's right, Honey. I'm on a hamster wheel in an office ... indoors ... there's no breeze. But my tie is sticking straight out, like it's caught in the wind.",1.15625,0.091022141492801,32,29,1,2
1065,"If the hamster calls in sick tomorrow, I'm not doing this again.",1.15625,0.0652132822162736,32,27,5,0
1066,It’s called Soulless Cycle. I think they’re gonna IPO.,1.15625,0.0652132822162736,32,27,5,0
1067,Buy small cube of apple futures asap.,1.15625,0.0791763930074957,32,28,3,1
1068,We have openings right now with unlimited opportunity for advancement.,1.15625,0.0652132822162736,32,27,5,0
1069,Sorry. Can't talk now. Gotta run.,1.15625,0.0791763930074957,32,28,3,1
1070,"However, the worksite gym is bringing a decline in my mental health.",1.15625,0.091022141492801,32,29,1,2
1071,I dunno. I'll get there when I get there!,1.15625,0.0791763930074957,32,28,3,1
1072,"Well, I bet the hamster isn't feeling any more rewarded sitting my cubicle, either.",1.15625,0.0791763930074957,32,28,3,1
1073,I liked my old spin class better,1.15625,0.0791763930074957,32,28,3,1
1074,"Running a little late, Dear. I'll be home soon.",1.15625,0.0652132822162736,32,27,5,0
1075,Middle management training for the rat race.,1.15625,0.091022141492801,32,29,1,2
1076,Sometimes I feel like I'm just spinning my wheel.,1.15625,0.0791763930074957,32,28,3,1
1077,"The last time I saw your stupid dog, he was chasing his tail.",1.15625,0.0791763930074957,32,28,3,1
1078,Hamster appreciation month,1.15625,0.0791763930074957,32,28,3,1
1079,It's not exactly my dream job but my office has a window.,1.15625,0.0652132822162736,32,27,5,0
1080,The door is always open...The door is always open...The door is always open...,1.15625,0.0652132822162736,32,27,5,0
1081,Yes sir I understand the metaphor but are the cedar chips really necessary?,1.15625,0.0791763930074957,32,28,3,1
1082,More fresh news please.,1.15625,0.0791763930074957,32,28,3,1
1083,"I've been spinning my wheel all day, but I just don't see a way out.",1.15625,0.0652132822162736,32,27,5,0
1084,All this running around has got me thinking...,1.15625,0.0791763930074957,32,28,3,1
1085,It all started with a stand up desk.,1.15625,0.0791763930074957,32,28,3,1
1086,My work-life balance is spinning out of control!,1.15625,0.0652132822162736,32,27,5,0
1087,Manster,1.15625,0.0791763930074957,32,28,3,1
1088,"Actually, I've always dreamed of working from home.",1.15625,0.0652132822162736,32,27,5,0
1089,"Yea, at my old job I felt like I was just treading water, but in this new position I feel like I'm finally getting somewhere.",1.15625,0.0652132822162736,32,27,5,0
1090,I think I'm done here. Get the maze ready.,1.15625,0.0791763930074957,32,28,3,1
1091,Just the same old rat race. How about you?,1.15625,0.0791763930074957,32,28,3,1
1092,Donald Trump's alternative energy plan,1.15625,0.0652132822162736,32,27,5,0
1093,Climbing the corporate ladder takes forever.,1.15625,0.0791763930074957,32,28,3,1
1094,99 Bottles of Beer on the Wall 99 Bottles of Beer,1.15625,0.0791763930074957,32,28,3,1
1095,My boss said that if I do this everyday I might actually get somewhere.,1.15625,0.0791763930074957,32,28,3,1
1096,"Hang on guys, I'm almost there.",1.15625,0.0652132822162736,32,27,5,0
1097,This is my year!,1.15625,0.0791763930074957,32,28,3,1
1098,Am I there yet?,1.15625,0.0652132822162736,32,27,5,0
1099,"Pet Smart, rodent health. How may I help you.",1.15625,0.0791763930074957,32,28,3,1
1100,How many more revolutions until I'm a real corporate rat?,1.15625,0.0791763930074957,32,28,3,1
1101,"Sorry honey, but I'll be late for dinner. Traffic at the office is a nightmare.",1.15625,0.0652132822162736,32,27,5,0
1102,"Every day, as Frank worked his way up the corporate ladder, things seemed to get more and more pointless.",1.15625,0.0652132822162736,32,27,5,0
1103,I just feel like I'm always running and never getting anywhere at work.,1.15625,0.0652132822162736,32,27,5,0
1104,"The Maze is next, I think.",1.15625,0.0652132822162736,32,27,5,0
1105,"Hon, I'll be late, been running in circles.",1.15625,0.0652132822162736,32,27,5,0
1106,"With my clear ball in the shop, it's the green tube for me today.",1.15625,0.0652132822162736,32,27,5,0
1107,Trump's Immigration Bill is starting to gain some traction.,1.15625,0.091022141492801,32,29,1,2
1108,"Yeah, the hours are good, but there's really no room for advancement here.",1.15625,0.0652132822162736,32,27,5,0
1109,"You've got to trust me on this, I'm making real progress.",1.15625,0.0652132822162736,32,27,5,0
1110,"I've been thinking, it's time I quit this rat race.",1.15625,0.0652132822162736,32,27,5,0
1111,I'm tired of running this by myself!,1.15625,0.0791763930074957,32,28,3,1
1112,Are you sure this will kick start the sump pump?,1.15625,0.0652132822162736,32,27,5,0
1113,Help! I'm trapped in the Congressional investigation into Russian meddling!,1.1333333333333333,0.0792686880439847,30,27,2,1
1114,Making America great. And you?,1.1333333333333333,0.0792686880439847,30,27,2,1
1115,I finally feel like I'm getting somewhere at work.,1.1333333333333333,0.0792686880439847,30,27,2,1
1116,Welcome to the Rat Race,1.1333333333333333,0.0631242768631999,30,26,4,0
1117,"And to think, I only have $50,000.00 left to pay on my student loans!",1.1333333333333333,0.0792686880439847,30,27,2,1
1118,Beats me; something about 'running this Department like a great American company'.,1.1333333333333333,0.0631242768631999,30,26,4,0
1119,The GOP's alternative energy plan is going great so far.,1.1333333333333333,0.0631242768631999,30,26,4,0
1120,"Hi, who just joined the call?",1.1333333333333333,0.0631242768631999,30,26,4,0
1121,I'm telling you t's not a metaphor.,1.1333333333333333,0.0792686880439847,30,27,2,1
1122,Do you think we're just spinning our wheels in here?,1.1333333333333333,0.0792686880439847,30,27,2,1
1123,"Although some people insisted that it was a metaphor, Dan simply referred to it as ""great cardio.""",1.1333333333333333,0.0631242768631999,30,26,4,0
1124,I prefer to think of it as multi-tasking.,1.1333333333333333,0.0631242768631999,30,26,4,0
1125,Tell my manager that Sisyphus had it easier!,1.1333333333333333,0.0792686880439847,30,27,2,1
1126,What Time Is The Meeting ?,1.1333333333333333,0.0792686880439847,30,27,2,1
1127,Don't give me that runaround.,1.1333333333333333,0.0792686880439847,30,27,2,1
1128,"Hi, I'm calling from Hamsterdam.",1.1333333333333333,0.0631242768631999,30,26,4,0
1129,This year's bonus could be $100K and a really long drink of water.,1.1333333333333333,0.0792686880439847,30,27,2,1
1130,"Sure, it's tough, but I found a job that the robots aren't going to want to take.",1.1333333333333333,0.0631242768631999,30,26,4,0
1131,"He's big, brown and white, and is in fantastic shape.",1.1333333333333333,0.0792686880439847,30,27,2,1
1132,Sometimes I feel like I am getting nowhere.,1.1333333333333333,0.0792686880439847,30,27,2,1
1133,When do we vest again?,1.1333333333333333,0.0792686880439847,30,27,2,1
1134,"Another day, another scoop of hamster kibble.",1.1333333333333333,0.0631242768631999,30,26,4,0
1135,I'm in my wheelhouse.,1.1333333333333333,0.0792686880439847,30,27,2,1
1136,3.14159 26535 89793 23846 26433 83279 50288 41971 69399 37510 58209 74944 59230 78164 06286 20899 86280 34825 34211 70679 82148 08651 32823 06647 09384 46095 50582 23172 53594 08128 48111 74502 84102 70193 85211 05559 64462 29489 54930 38....,1.1333333333333333,0.0631242768631999,30,26,4,0
1137,I'll never win this damn contest!,1.1333333333333333,0.0792686880439847,30,27,2,1
1138,Keeping up with the Trump News cycle.,1.1333333333333333,0.0631242768631999,30,26,4,0
1139,"Nah, I've gotten out of the rat race.",1.1333333333333333,0.0631242768631999,30,26,4,0
1140,"It is not the destination, it is not the destination, it is not the destination...",1.1333333333333333,0.0631242768631999,30,26,4,0
1141,"Half a pound of apple, carrot and cucumber cubes, a small cauliflower and a Diet Coke.",1.1333333333333333,0.0631242768631999,30,26,4,0
1142,"Yes, available on QVC. You get the wheel, water bottle---all inclusive. We're calling it Hamster Health!",1.1333333333333333,0.0631242768631999,30,26,4,0
1143,They weren't kidding about that rat race thing.,1.1333333333333333,0.0631242768631999,30,26,4,0
1144,Promise you'll call when the power comes back.,1.1333333333333333,0.0792686880439847,30,27,2,1
1145,I need a spin doctor.,1.1333333333333333,0.0631242768631999,30,26,4,0
1146,An office with an adjoining washroom. What more could I want?,1.1333333333333333,0.0631242768631999,30,26,4,0
1147,The wheel's spinning but the hamster's dead.,1.1333333333333333,0.0926411111706201,30,28,0,2
1148,It was a hostile takeover.,1.1333333333333333,0.0792686880439847,30,27,2,1
1149,Sisyphus was an amateur.,1.1333333333333333,0.0631242768631999,30,26,4,0
1150,I can talk the talk. What I need is a job where I only have to walk the walk.,1.1333333333333333,0.0631242768631999,30,26,4,0
1151,Running desks are the next big thing.,1.1333333333333333,0.0792686880439847,30,27,2,1
1152,My last office was in a tube.,1.1333333333333333,0.0631242768631999,30,26,4,0
1153,I can't wait until I get promoted to the maze.,1.1333333333333333,0.0792686880439847,30,27,2,1
1154,"Hey, it beats the 'rat race'!.",1.1333333333333333,0.0792686880439847,30,27,2,1
1155,The intern is running just fine.,1.1333333333333333,0.0792686880439847,30,27,2,1
1156,Your overqualified resume is not a problem as long as you can pass our wheel test.,1.1333333333333333,0.0792686880439847,30,27,2,1
1157,God I hate Pi..!,1.1333333333333333,0.0631242768631999,30,26,4,0
1158,Hello? United States Congress. Please hold.,1.1333333333333333,0.0792686880439847,30,27,2,1
1159,They're just spinning their wheels in HR.,1.1333333333333333,0.0631242768631999,30,26,4,0
1160,Let me call you back - I need to take a dump in the corner.,1.1333333333333333,0.0792686880439847,30,27,2,1
1161,"A politician's day: spin, spin, spin, with no forward movemen.",1.1333333333333333,0.0631242768631999,30,26,4,0
1162,"Hey genie? ... my wish was to BECOME a big wheel, not to BE in one!",1.1333333333333333,0.0631242768631999,30,26,4,0
1163,The squeaking sound must be at your end.,1.1333333333333333,0.0631242768631999,30,26,4,0
1164,I get the sense that we're running in circles here.,1.1333333333333333,0.0792686880439847,30,27,2,1
1165,"I can't attend the conference Gary, I'm currently in Aspen training for the Rat Race.",1.1333333333333333,0.0792686880439847,30,27,2,1
1166,I'm never going to get ahead!,1.1333333333333333,0.0631242768631999,30,26,4,0
1167,I think I'm just going to stay home and nibble around the house tonight.,1.1333333333333333,0.0631242768631999,30,26,4,0
1168,And it's safer than a treadmill.,1.1333333333333333,0.0792686880439847,30,27,2,1
1169,Department of Labor.,1.1333333333333333,0.0792686880439847,30,27,2,1
1170,I was always to short to ride the Ferris Wheel.,1.1333333333333333,0.0792686880439847,30,27,2,1
1171,I don't believe in multi-tasking.,1.1333333333333333,0.0792686880439847,30,27,2,1
1172,Has he released his tax returns yet?,1.1333333333333333,0.0792686880439847,30,27,2,1
1173,Don't worry. I'll get around to it.,1.1333333333333333,0.0792686880439847,30,27,2,1
1174,"....special offer just for you. This fund is going to so successful, you too can spend your days just running on the beach.",1.1333333333333333,0.0792686880439847,30,27,2,1
1175,Circle of life or circle of ex wife?,1.1333333333333333,0.0631242768631999,30,26,4,0
1176,I'll have the car charged in 30 minutes. See you in 31.,1.1333333333333333,0.0631242768631999,30,26,4,0
1177,I feel we're getting nowhere fast.,1.1333333333333333,0.0792686880439847,30,27,2,1
1178,And they stock the kitchen with free pellets!,1.1333333333333333,0.0792686880439847,30,27,2,1
1179,"Yes, I'm getting around to it.",1.1333333333333333,0.0631242768631999,30,26,4,0
1180,"Let's not try and reinvent the hamster wheel, okay?",1.1333333333333333,0.0792686880439847,30,27,2,1
1181,I like to stay hydrated while exercising.,1.1333333333333333,0.0792686880439847,30,27,2,1
1182,"The stand-up desk was fine, but now I get more done AND I power the entire office",1.1333333333333333,0.0792686880439847,30,27,2,1
1183,I see now why you never see a fat hamster.,1.1333333333333333,0.0792686880439847,30,27,2,1
1184,'It's called Shred-bit',1.1333333333333333,0.0926411111706201,30,28,0,2
1185,"I'm working on a remake of ""As the World Turns""",1.1333333333333333,0.0926411111706201,30,28,0,2
1186,"I came, I saw, I spun my wheels.",1.1333333333333333,0.0792686880439847,30,27,2,1
1187,"Honey, don't wait up...The lab rats are on strike again!",1.1333333333333333,0.0792686880439847,30,27,2,1
1188,When did the make the treadmills round?,1.1333333333333333,0.0792686880439847,30,27,2,1
1189,All dressed up and nowhere to go.,1.1333333333333333,0.0631242768631999,30,26,4,0
1190,Not much. Singularity keeping me crazy busy as always. You?,1.1333333333333333,0.0792686880439847,30,27,2,1
1191,Just an Ambien. Why?,1.1333333333333333,0.0792686880439847,30,27,2,1
1192,"My cholesterol is down, but I have the overwhelming urge to breed.",1.1333333333333333,0.0792686880439847,30,27,2,1
1193,The good news is I got that job at the E.P.A...,1.1333333333333333,0.0792686880439847,30,27,2,1
1194,"The job may be run of the mill, but the benefits are oh so youge!",1.1333333333333333,0.0792686880439847,30,27,2,1
1195,A metaphor he said. It'll be good he said.,1.1333333333333333,0.0792686880439847,30,27,2,1
1196,Am I a mouse or am I a man?,1.1333333333333333,0.0631242768631999,30,26,4,0
1197,"Bob, its so much more rewarding than the elliptical.",1.1333333333333333,0.0792686880439847,30,27,2,1
1198,"I can assure you sir, this is not a pyramid scheme.",1.1333333333333333,0.0631242768631999,30,26,4,0
1199,Employee Training Lab,1.1333333333333333,0.0792686880439847,30,27,2,1
1200,Giving the hamsters a chance to run things seemed like the logical next step at the time.,1.1333333333333333,0.0631242768631999,30,26,4,0
1201,Standing desks are so 2016.,1.1333333333333333,0.0631242768631999,30,26,4,0
1202,Dr. Pavlov's coffee break,1.1333333333333333,0.0631242768631999,30,26,4,0
1203,"Sure, come on over and we can go for a spin.",1.1333333333333333,0.0631242768631999,30,26,4,0
1204,"I'm your congressman, working for you.",1.1333333333333333,0.0926411111706201,30,28,0,2
1205,"Sorry, I was on mute.",1.1333333333333333,0.0631242768631999,30,26,4,0
1206,"Take that, gerbils!",1.1333333333333333,0.0792686880439847,30,27,2,1
1207,"This is a test - to show someone I care for, that we're not just stuck in some pigeon-holed existence.",1.1333333333333333,0.0792686880439847,30,27,2,1
1208,"Despite all of his effort, Brad felt like he was getting nowhere.",1.1333333333333333,0.0792686880439847,30,27,2,1
1209,Ow! I think I just pulled a hamsterstring.,1.1333333333333333,0.0792686880439847,30,27,2,1
1210,I'm always in training for the the rat race.,1.1333333333333333,0.0792686880439847,30,27,2,1
1211,Something's gotta change around here- no matter how hard I try I can't seem to get anywhere.,1.1333333333333333,0.0631242768631999,30,26,4,0
1212,"I'd like to order one large pizza – half hamster pellet, and half gerbil mix … both with extra cheese.",1.1333333333333333,0.0631242768631999,30,26,4,0
1213,"The more I go forward, the behinder I get.",1.1333333333333333,0.0631242768631999,30,26,4,0
1214,"A couple of changes, and we can build the big one uncle Ferris !",1.1333333333333333,0.0792686880439847,30,27,2,1
1215,I should have never suggested the company should be more energy efficient.,1.1333333333333333,0.0792686880439847,30,27,2,1
1216,Tell the gerbil thanks but we're going with the hamster instead.,1.1333333333333333,0.0926411111706201,30,28,0,2
1217,"Well, I’d better go. It’s almost pellet-time.",1.1333333333333333,0.0631242768631999,30,26,4,0
1218,I'd like to apologize to P.E.T.A.,1.1333333333333333,0.0792686880439847,30,27,2,1
1219,Riding on the heels of those who have come before you is never easy,1.1333333333333333,0.0792686880439847,30,27,2,1
1220,Why won't my co-workers gather around the water cooler?,1.1333333333333333,0.0926411111706201,30,28,0,2
1221,Don’t look so smug. There’s still no scientific consensus.,1.1333333333333333,0.0792686880439847,30,27,2,1
1222,This is not the corporate wellness program I remember.,1.1333333333333333,0.0792686880439847,30,27,2,1
1223,And they said I'd never make it to middle management!,1.1333333333333333,0.0631242768631999,30,26,4,0
1224,Has anyone told him about the snake?,1.1333333333333333,0.0926411111706201,30,28,0,2
1225,I am just spinning my heels; how about you?,1.1333333333333333,0.0926411111706201,30,28,0,2
1226,Training for the maze.,1.1333333333333333,0.0631242768631999,30,26,4,0
1227,Let's circle back around to that later.,1.1333333333333333,0.0631242768631999,30,26,4,0
1228,"This conversation is going nowhere, fast.",1.1333333333333333,0.0631242768631999,30,26,4,0
1229,Productivity numbers are off you say? I don't understand. I have this office running like a well-oiled machine.,1.1333333333333333,0.0792686880439847,30,27,2,1
1230,"No, I wouldn't exactly say that they've got me chasing my own tail...",1.1333333333333333,0.0631242768631999,30,26,4,0
1231,I’m telling you we can’t call this thing “Habitat for Humanity”. That’s already trademarked.,1.1333333333333333,0.0631242768631999,30,26,4,0
1232,Wow this day is flying.,1.1333333333333333,0.0631242768631999,30,26,4,0
1233,yeah dude i shit and piss wherever i want. it's so tight.,1.1333333333333333,0.0792686880439847,30,27,2,1
1234,They say I’m climbing the ladder but…,1.1333333333333333,0.0631242768631999,30,26,4,0
1235,"Frank, I'm telling you, the treadmill desk is passe.",1.1333333333333333,0.0631242768631999,30,26,4,0
1236,Booooorn in the USAAAAA,1.1333333333333333,0.0631242768631999,30,26,4,0
1237,The gig economy got me like...,1.1333333333333333,0.0631242768631999,30,26,4,0
1238,I need to talk to someone about the standing desk I ordered...,1.1333333333333333,0.0631242768631999,30,26,4,0
1239,Sometimes I feel like I am going nowhere in this industry.,1.1333333333333333,0.0631242768631999,30,26,4,0
1240,All it takes is a little leg work to turn this whole thing around.,1.1333333333333333,0.0631242768631999,30,26,4,0
1241,Our HR department has some unique ideas on WORK-LIFE balance.,1.1333333333333333,0.0631242768631999,30,26,4,0
1242,"No, I clearly ordered the treadmill desk!",1.1333333333333333,0.0792686880439847,30,27,2,1
1243,Sell! And bring more carrots and lettuce! And deodorant.,1.1333333333333333,0.0631242768631999,30,26,4,0
1244,You've reached the Trump promises help desk.,1.1333333333333333,0.0792686880439847,30,27,2,1
1245,I love the smell of fresh cedar shavings in the morning.,1.1333333333333333,0.0631242768631999,30,26,4,0
1246,"Miss Hastings, what time is my maze?",1.1333333333333333,0.0631242768631999,30,26,4,0
1247,Note to self: Never buy a home gym on ebay.,1.1333333333333333,0.0792686880439847,30,27,2,1
1248,"Yes, I said my name is Mr. Ham, sir.",1.1333333333333333,0.0792686880439847,30,27,2,1
1249,"Ma'am, could you please un-stuff your cheek pouches, I'm having trouble hearing you.",1.1333333333333333,0.0631242768631999,30,26,4,0
1250,The truth is you're a fish out of water. And it's not flying.,1.1333333333333333,0.0792686880439847,30,27,2,1
1251,"I'm still coming as quickly as I can, boss.",1.1333333333333333,0.0792686880439847,30,27,2,1
1252,"Yes, my pacemaker seems to be acting up.",1.1333333333333333,0.0792686880439847,30,27,2,1
1253,I have another call - can I put you on coast?,1.1333333333333333,0.0631242768631999,30,26,4,0
1254,Don't you hate it when the hamsters don't close the door after they fed you?,1.1333333333333333,0.0926411111706201,30,28,0,2
1255,I need two thousand more steps to beat Bob in Accounting's Fit Bit steps.,1.1333333333333333,0.0792686880439847,30,27,2,1
1256,It's just a 30-day trial.,1.1333333333333333,0.0792686880439847,30,27,2,1
1257,Do you deliver pellets?,1.1333333333333333,0.0631242768631999,30,26,4,0
1258,"Heck, this place is a million times better than Sisyphus Inc!",1.1333333333333333,0.0792686880439847,30,27,2,1
1259,Running my own department isn't all it's cracked up to be,1.1333333333333333,0.0631242768631999,30,26,4,0
1260,Corner office with a view my ass!,1.1333333333333333,0.0792686880439847,30,27,2,1
1261,Am I a hamster dreaming I'm a man or a man dreaming I'm an accountant?,1.1333333333333333,0.0631242768631999,30,26,4,0
1262,"Good news Mr. President, we have finally repealed and replaced the hamster",1.1333333333333333,0.0926411111706201,30,28,0,2
1263,I can't believe this got IRB approval.,1.1333333333333333,0.0792686880439847,30,27,2,1
1264,"I feel like we're going in circles, here.",1.1333333333333333,0.0792686880439847,30,27,2,1
1265,"Boss, I really don't consider this as being on the fast track...",1.1333333333333333,0.0631242768631999,30,26,4,0
1266,I feel like I'm on the wheel of misfortune.,1.1333333333333333,0.0631242768631999,30,26,4,0
