rank,caption,mean,precision,votes,not_funny,somewhat_funny,funny
1092,He is such a bad magician he has to use a shredder to make a piece of paper disappear.,1.3006993006993006,0.0486546725701044,143,109,25,9
1093,Bet thisn’t what you thought I meant by “stripper?”,1.300653594771242,0.0455114339393687,153,115,30,8
1094,"And now, ladies and gentlemen...I will make my heretofore unsubstantiated relationship with Russia disappear. Oh, and my tax records!",1.300653594771242,0.0491455783081198,153,119,22,12
1095,Behold! The Un-shredder!,1.300653594771242,0.0455114339393687,153,115,30,8
1096,"As you can see ladies and gentlemen, there is no collusion.",1.300653594771242,0.0500128701360464,153,120,20,13
1097,"Next, a little something my accountant calls the ""leave no trace"" trick.",1.300653594771242,0.0473633744915682,153,117,26,10
1098,"You're right, this works a lot better than a dove.""",1.300578034682081,0.0435247734966605,173,131,32,10
1099,"I used to hide the coin behind my ear,but the IRS caught on.",1.300578034682081,0.0472278793041149,173,136,22,15
1100,Don't try this with a live rabbit.,1.300578034682081,0.0435247734966605,173,131,32,10
1101,This ballot will reappear in a very different form!,1.300578034682081,0.042745673147231,173,130,34,9
1102,And now I shall make this subpoena from Robert Mueller disappear..like magic!,1.300518134715026,0.041091654587142,193,146,36,11
1103,For all my past and current assistants claiming abuse and wishing for a mere shred of evidence- wish granted!,1.3,0.0470612908946529,150,114,27,9
1104,Does he really think hiring magicians is going to make the whole Russia thing disappear?,1.3,0.045584726406848,170,131,27,12
1105,And now you will witness my vote magically disappear.,1.3,0.0415920552535673,170,126,37,7
1106,"And now, my subpoena into confetti trick.",1.3,0.0450366726878491,160,121,30,9
1107,"If it's not a rabbit that comes out of the bottom, run like hell.",1.3,0.0513937303473231,140,109,20,11
1108,My mother was right. Big wand small hands.,1.3,0.0441552435684732,160,120,32,8
1109,"They'll never suspect, if I just make it part of the act!",1.3,0.0450366726878491,160,121,30,9
1110,"And for this trick, I will amend my tax return.",1.3,0.0415181144684701,190,144,35,11
1111,"Thank you, Miss Jones. This is the perfect cover for obstruction of justice!",1.299465240641711,0.0383782065511764,187,137,44,6
1112,"Ipso Facto, Shreddo",1.2994350282485876,0.0450168117253777,177,137,27,13
1113,And just like that the notes from the Trump Putin meeting disappear,1.2994011976047903,0.0445540553993376,167,127,30,10
1114,"For my next trick, I will make a shredder not jam.",1.2994011976047903,0.0461449193987018,167,129,26,12
1115,And now watch as I magically make this evidence disappear.,1.2994011976047903,0.0420550740321437,167,124,36,7
1116,"You haven't been replaced, okay. I'll saw you in half later.",1.2994011976047903,0.0453564628186543,167,128,28,11
1117,Observe how I make this ballot magically disappear!,1.2993630573248407,0.0437736596652465,157,117,33,7
1118,"'Abraconomics!'  I wave my corporate wand, and now there is no pension.",1.2993630573248407,0.0464877535752498,157,120,27,10
1119,"And for my next trick, I'll show you the simple art of taking back the district",1.2993630573248407,0.0456010078303654,157,119,29,9
1120,"And on the third tap, this shredded document will mysteriously reappear in the Cayman Islands!",1.2993630573248407,0.039868483933759,157,113,41,3
1121,I learned this next trick from legendary illusionist Arthur Andersen.,1.2993197278911566,0.047698856134741,147,112,26,9
1122,"When I say the magic words, the IRS will have no memory of your tax return.",1.298780487804878,0.0450944426421193,164,125,29,10
1123,SEE I FIXED IT,1.298780487804878,0.0467241067905836,164,127,25,12
1124,"And, abracadabra, to the special counsel's delight, shredded documents magically reappear.",1.298780487804878,0.0450944426421193,164,125,29,10
1125,Even I can't make Trump's words disappear.,1.298780487804878,0.0475179845370686,164,128,23,13
1126,Presto! I will no longer go to prison for fraud!,1.298780487804878,0.0416442308231817,164,121,37,6
1127,"Gina, trust me. America’s Got Talent will eat this up.",1.2987012987012987,0.0452570679672312,154,116,30,8
1128,"O' K' Ivanka, tell your dad not to worry about a thing.",1.2987012987012987,0.0452570679672312,154,116,30,8
1129,Abra Ca Dabra:  There goes the Mueller report!,1.2986111111111112,0.0483607159704601,144,110,25,9
1130,... And the Harassment Clause of my assistant's contract...,1.2984293193717278,0.0419914597189799,191,146,33,12
1131,For my next trick I'm going to find an assistant who knows how to work a printer.,1.298342541436464,0.042152600221283,181,137,34,10
1132,"""For my next trick... Donna, where are your pants?""",1.298342541436464,0.0414180437878261,181,136,36,9
1133,And now I will make this ordinary piece of evidence disappear.,1.298342541436464,0.0428745735794578,181,138,32,11
1134,"If  Nixon had done this with his tapes, he'd still be president",1.298342541436464,0.0406702224853177,181,135,38,8
1135,"And now, with a wave of my wand, I will now make a work of art by Banksy.",1.2982456140350878,0.0461035886933947,171,133,25,13
1136,It's our new voting system. The outcome is a miracle.,1.2982456140350878,0.0453513113460384,171,132,27,12
1137,And then you just shred your dignity like so...,1.2982456140350878,0.0438080191471437,171,130,31,10
1138,And now the final step in assuring that this can never be traced back to individual # 1!,1.2982456140350878,0.0453513113460384,171,132,27,12
1139,Anyone know how to fix a paper jam?,1.2982456140350878,0.0422083361717528,171,128,35,8
1140,And now--we shall make fraud and misrepresentation litigation disappear.,1.2982456140350878,0.0422083361717528,171,128,35,8
1141,Now watch as the IRS makes my debt reappear,1.2981366459627328,0.0489364530395725,161,127,20,14
1142,This new voting machine is real sharp.  It even recycles.,1.2981366459627328,0.0464957759526164,161,124,26,11
1143,Now watch as my Yelp reviews disappear,1.2981366459627328,0.0489364530395725,161,127,20,14
1144,And for my next trick - I make a felony disappear.,1.297872340425532,0.0520547222499275,141,111,18,12
1145,Voilà...presidential tax returns!,1.2976190476190477,0.0418419669743155,168,125,36,7
1146,Crank it up a notch. I gotta get rid of this warrant before intermission ends.,1.2976190476190477,0.0451208842776663,168,129,28,11
1147,The President doesn't care how I make the Mueller report disappear!,1.2976190476190477,0.0443239009854598,168,128,30,10
1148,And I say the magic word - BANKSY!!!!!!!!,1.2974683544303798,0.0453510709692974,158,120,29,9
1149,For my next trick I will make my collusions with Russia Disappear!!,1.2972972972972974,0.0474186188595638,148,113,26,9
1150,Voila!  What once was shredded is now...evidence.,1.2972972972972974,0.0474186188595638,148,113,26,9
1151,"And that, my friends, is how you make evidence disappear.",1.2972972972972974,0.0454386189032425,148,111,30,7
1152,My next trick is debt-defying.,1.2971428571428572,0.0430940360354539,175,133,32,10
1153,"Yes, the rabbit does live in there and this is how he gets fresh bedding.",1.2971428571428572,0.0438494855935254,175,134,30,11
1154,"This may not produce a rabbit, but it could make our legal problems disappear....",1.2971428571428572,0.042325104805933,175,132,34,9
1155,"Ladies and Gentlemen, this ""tax evasion"" number is literally cutting-edge",1.2971014492753623,0.0486889581975237,138,105,25,8
1156,"Giuliani defends Trump: ""...and abracadabra, not a shred of evidence here!""",1.2969696969696969,0.0431777659176685,165,124,33,8
1157,"For my next trick, I will make an official ballot disappear.",1.2969696969696969,0.0423132324413248,165,123,35,7
1158,I learned this ballot box trick from comrade Putin.,1.2969696969696969,0.0448568738283862,165,126,29,10
1159,No! Banksy stole this trick from me!,1.2969696969696969,0.0456732849668507,165,127,27,11
1160,Watch very closely as I make the President’s tax return disappear.,1.2967741935483872,0.0459268407396556,155,118,28,9
1161,"okay, this time will try it with paper and if it works, we'll use the rabbit again",1.2967741935483872,0.0485863791819251,155,121,22,12
1162,And the Federal debt seems to disappear...,1.2967032967032968,0.0412224493181676,182,137,36,9
1163,"For my next trick, I will make whole the shredded IRS returns of the President.",1.296551724137931,0.0490563616847662,145,112,23,10
1164,"Ladies and gentlemen, the power of magic is about to reveal the President's complete tax return.",1.2965116279069768,0.0427999320389161,172,130,33,9
1165,I will now make this cartoon caption entry disappear.,1.2965116279069768,0.0403464473593746,172,127,39,6
1166,"Now, I chant the magic word Vladimir three times and presto, change, those notes are from a meeting that never even happened.",1.2965116279069768,0.0451202011359535,172,133,27,12
1167,...and now for my final act... an original Banksy,1.2962962962962965,0.0454078543579917,162,124,28,10
1168,"For my next trick, I will plead the fifth before Congress.",1.2962962962962965,0.0462445074954649,162,125,26,11
1169,AbracaBansky,1.2962962962962965,0.0436865055273769,162,122,32,8
1170,A magician never reveals his secrets... or his sensitive account information.,1.2962962962962965,0.0436865055273769,162,122,32,8
1171,Now watch as I make this piece of damning evidence magically disappear!,1.2962962962962965,0.0454078543579917,162,124,28,10
1172,I learned this trick from Banksy.,1.2960526315789471,0.0492527074427246,152,119,21,12
1173,Voila! Coleslaw.,1.2958579881656804,0.0432899220334936,169,128,32,9
1174,I will now make my tax liabilities disappear...,1.2958579881656804,0.0432899220334936,169,128,32,9
1175,"I take these confidential papers, say the magic words, ‘reductio ad absurdum’, and it’s like nothing ever happened.",1.2958579881656804,0.0464304518845628,169,132,24,13
1176,And that ladies and gentleman is how you make tax returns disappear.,1.2955974842767295,0.0459778272847125,159,122,27,10
1177,I will now make Russian Collusion disappear.,1.2954545454545454,0.0458102961674214,176,138,24,14
1178,"Going, going Banksy.",1.2954545454545454,0.0428817324184391,176,134,32,10
1179,And the Banksy is now magically reassembled!,1.2954545454545454,0.0465136356338862,176,139,22,15
1180,And now I will magically shred this evidence for Mr. Trump.,1.2953367875647668,0.0435144482700539,193,151,27,15
1181,Jeff your not a magician and we still have to pay the bill!,1.2953020134228188,0.0508439171324218,149,118,18,13
1182,Oi vey! It's whole again!,1.2951807228915662,0.042095592018741,166,124,35,7
1183,"Taxes done, now to run for President",1.2951807228915662,0.0437958624491385,166,126,31,9
1184,"And Voila, the indictment goes away!",1.2951807228915662,0.0437958624491385,166,126,31,9
1185,Thank you madam for your federal-employment contract; let's put it through this and we'll see what happens...,1.2951807228915662,0.0437958624491385,166,126,31,9
1186,Prototype Magic Ballot Box (TM) for 2020 Trump supporters.,1.2950819672131149,0.0410286187692494,183,138,36,9
1187,"If this works, the original Bill of Rights should come out of my hat.",1.2950819672131149,0.0417540033827837,183,139,34,10
1188,Presto-Chango....Now...into the Electoral College counter....,1.294871794871795,0.047447632286453,156,121,24,11
1189,I assure you! This is NOT a trick!,1.2947976878612717,0.0433682814318859,173,132,31,10
1190,"And just like that the interpreter’s notes disappear. For the interpreter, we’ll need a wood chipper.",1.2947976878612717,0.0456338453314239,173,135,25,13
1191,"And for my next act, I'll do my taxes without receipts.",1.2945205479452055,0.0487615235648597,146,113,23,10
1192,....then....from this shredded tax return...voila! A presidency!,1.294478527607362,0.0468119555920638,163,127,24,12
1193,It’s magic!  Hillary’s missing emails have reappeared!,1.294478527607362,0.0443185976790394,163,124,30,9
1194,"And for my next trick, Mr. President, I'll turn proof of collusion into pretty confetti!",1.294478527607362,0.0434556985698956,163,123,32,8
1195,No deductions up my sleeve.,1.294478527607362,0.042575314163946,163,122,34,7
1196,"... And after our vote gets processed by the E-Voter2016 machine,it gets sent to the electoral college.",1.294478527607362,0.0459958565994201,163,126,26,11
1197,I used a white rabbit before PETA got wind of it.,1.294478527607362,0.0459958565994201,163,126,26,11
1198,Notice my hand never leaves the mail fraud evidence.,1.2944444444444445,0.0407085157432387,180,135,37,8
1199,And now I will feed this ordinary page of translater’s notes into the shredder.....,1.2944444444444445,0.0414639180547172,180,136,35,9
1200,"Yes, it's your resume.  
Or did you change your mind about the sword box?",1.2941176470588236,0.0430696978616861,170,129,32,9
1201,Presidential interpreter,1.2941176470588236,0.0443606425788479,153,115,31,7
1202,Do you remember the trick to unjamming these?,1.2941176470588236,0.0413505583274492,153,112,37,4
1203,"And now I present to you, the results of the presidential election.",1.2941176470588236,0.0523080025482793,136,107,18,11
1204,"And with a waiver of my wand, your vote disappears!",1.2941176470588236,0.0430696978616861,170,129,32,9
1205,The real magic is making your student loan debt disappear!,1.2941176470588236,0.0389705407698119,187,139,41,7
1206,"And now, for my old ""Shred of Evidence Trick""!",1.2937853107344632,0.0441503579125627,177,137,28,12
1207,Now presenting... How to Cut Your Bills in Half!,1.2934131736526946,0.045985491296925,167,130,25,12
1208,And the Oscar goes too...,1.293103448275862,0.0446647661740653,174,135,27,12
1209,Now watch closely as I make my student loans disappear.,1.2929936305732483,0.0416673818297095,157,116,36,5
1210,"Buck up, Lisa. We're performing for the President this weekend.",1.292817679558011,0.0412662762440085,181,137,35,9
1211,I call this the Banksy.,1.292817679558011,0.0420034868701617,181,138,33,10
1212,"For my next trick, I will make the Russian Interpreter's notes disappear!",1.292817679558011,0.0405156537753222,181,136,37,8
1213,and NOW.......The missing POTUS  Tax Return!!,1.292817679558011,0.0441413068663237,181,141,27,13
1214,Presto! Chango! Subpoena Disappearo!,1.292817679558011,0.0412662762440085,181,137,35,9
1215,"I will put my ballot into the ballot box, wave my magic wand, and undo the results of the last presidential election.",1.2926829268292683,0.0423529925808667,164,123,34,7
1216,"And that, Mr Trump, is why I, the Magnificent Magoo, should be your lawyer!",1.2926829268292683,0.0457497844465293,164,127,26,11
1217,What is it about a shredder that makes me feel like a magician?,1.2926829268292683,0.0440841170800712,164,125,30,9
1218,I now invite Mr. Mueller to come to the stage.,1.2925531914893618,0.040934851093197,188,143,35,10
1219,"Watch carefully, Ladies and Gentlemen.  Later in the show I shall use my magic wand to reconstitute this absentee ballot.",1.2923976608187135,0.0428516199612237,171,130,32,9
1220,"Behold, ladies and gentlemen, as I make this vote miraculously disappear.",1.2923976608187135,0.0436470019921821,171,131,30,10
1221,"I am a magician, not a freaking accountant.",1.292207792207792,0.0459969816616986,154,118,27,9
1222,For my next act I will be getting the IRS off my back,1.292207792207792,0.0441130076773214,154,116,31,7
1223,This is the Constitution.  Wish me luck...,1.2921348314606742,0.0409408911219809,178,134,36,8
1224,"As promised in my confirmation hearing, here is the Meuller Report.",1.291925465838509,0.0446168571330881,161,123,29,9
1225,Watch the paper disappear and then reappear as a shredded rabbit.,1.291925465838509,0.0463243288514791,161,125,25,11
1226,No matter. It was mostly in Russian anyway.,1.291925465838509,0.0463243288514791,161,125,25,11
1227,"I don’t think magic will work dear...
It has to be a Banksy for it to double in value when you shred.",1.2918918918918918,0.0406461608859446,185,140,36,9
1228,I call my next trick The Amazing Bladen County Ballot Box.,1.2916666666666667,0.0465169550560801,168,132,23,13
1229,"Watch, as I make my assistant's sexual harassment 
complaint magically disappear!",1.2916666666666667,0.0457443013747031,168,131,25,12
1230,The spirit of Houdini tells me the rabbit is in dire need of new bedding,1.2914285714285714,0.0405775799587465,175,131,37,7
1231,"Trust me, it's a lot more impressive with a rabbit.",1.2914285714285714,0.0436951459006103,175,135,29,11
1232,And now please observe me destroying the contract in which it states that I will appear to saw Lydia’s body in half in a way that is objectifying and demeaning.,1.2913907284768211,0.0465966715440644,151,116,26,9
1233,"And presto, the fraud case against me disappears!",1.2913907284768211,0.0436617582872445,151,113,32,6
1234,I do not think inserting a piece of paper in a shredder is the warm-up I want you doing before you saw me in half.,1.2911392405063291,0.0451678563470191,158,121,28,9
1235,"I thought for the trial run, we'd just use paper.",1.2911392405063291,0.0451678563470191,158,121,28,9
1236,"Now I reverse the shredder, and, presto, out comes a perfect copy of President Trump's translator's notes from his Helsinki meeting with Vladimir Putin!",1.2911392405063291,0.0460517198600487,158,122,26,10
1237,"Here is the ""disappearing Mueller Report"" trick that the Republican members of my audience love.",1.291005291005291,0.0400504540077271,189,143,37,9
1238,"Once again the Russians have interfered , this was supposed to be a rabbit",1.291005291005291,0.0434220602674986,189,148,27,14
1239,and now I will make the evidence disappear!,1.290909090909091,0.0430010414440838,165,125,32,8
1240,This trick seems to work much better with paper than it does with birds.,1.290909090909091,0.0446867902773358,165,127,28,10
1241,The real illusion will be convincing the board that we didn't actually do this.,1.290909090909091,0.0438520170035907,165,126,30,9
1242,And now I will demonstrate how to make a ballot disappear!,1.290909090909091,0.0446867902773358,165,127,28,10
1243,I'll now transform my assistant's harassment suit into a dove.,1.290909090909091,0.0455062529252628,165,128,26,11
1244,"Thank you, translator.  That's all I need.",1.290909090909091,0.0463112177048432,165,129,24,12
1245,"And at the count of three, no more incriminating evidence.",1.290909090909091,0.0421328818770853,165,124,34,7
1246,"And for my next collusion, watch as I make the allegations disappear",1.2907801418439715,0.0508678553949557,141,111,19,11
1247,...and here we will shred the interpreter's notes from Helsinki,1.2906976744186047,0.0449644056905697,172,134,26,12
1248,"And for all you youngins out there, before the delete button, we had something more reliable.”",1.2906976744186047,0.0434257857395515,172,132,30,10
1249,"As Attorney General, my next trick is to make these translator's notes disappear.",1.2906976744186047,0.0449644056905697,172,134,26,12
1250,The new attorney general makes a show of reading Robert Mueller’s report at a White House party.,1.2905405405405406,0.0472184355545753,148,114,25,9
1251,"And with a swish of my wand, I will clear the jam!",1.2905405405405406,0.0472184355545753,148,114,25,9
1252,This trick worked for Banksy!,1.2905027932960893,0.0415073825571783,179,136,34,9
1253,"For my final act, 
I will make my prenuptial agreement disappear.",1.2905027932960893,0.0407442279115714,179,135,36,8
1254,Abraca....dagnabit! I actually needed that.,1.2903225806451613,0.0419145318417453,155,115,35,5
1255,Folks this thing is not even plugged in!,1.2903225806451613,0.0438680104476534,155,117,31,7
1256,Insert here and voila! No more Constitution.,1.2903225806451613,0.0448128276411654,155,118,29,8
1257,"Miss McGyver, I believe your thumb has jammed the mechanism.",1.2903225806451613,0.0466450842245949,155,120,25,10
1258,"...for my next trick, these teeny, tiny hands will pull a great big beautiful wall out of my hat!",1.289855072463768,0.0505998071072371,138,108,20,10
1259,That was the death certificate for the other girl.,1.2897727272727273,0.0442181688685473,176,137,27,12
1260,And this ladies and gentlemen is the magic of the KonMari method.,1.2897727272727273,0.0427244230881733,176,135,31,10
1261,Watch as I make the president's tax returns disappear.,1.2897727272727273,0.0427244230881733,176,135,31,10
1262,"And now, I will make your vote disappear.",1.2897727272727273,0.0411765248454396,176,133,35,8
1263,I hear there is an even better magician named Bob Mueller who will make the evidence reappear.,1.2897727272727273,0.0403803310215758,176,132,37,7
1264,Now watch as I make the photos that my wife had of you and me disappear!,1.2897727272727273,0.039568119344707,176,131,39,6
1265,"Watch carefully, I will bring back the Trump-Putin
Meetings Notes.",1.289655172413793,0.0498246363257315,145,114,20,11
1266,My genius “ magician “ believes there’s only one copy of our prenup .,1.289655172413793,0.0478635926750735,145,112,24,9
1267,Presto!  And the Mueller report disappears.,1.2894736842105263,0.0424004985635689,152,113,34,5
1268,Now observe as I magically transform this restraining order into harmless confetti!,1.2893081761006289,0.0466588572198716,159,124,24,11
1269,Muller will never find it here,1.289156626506024,0.0436222633451563,166,127,30,9
1270,"Watch closely folks, here's a trick that blew their minds in the Oval Office!",1.289156626506024,0.0436222633451563,166,127,30,9
1271,"Before your very eyes, a presidential address becomes an anthology of tweets.",1.289156626506024,0.0419149514982256,166,125,34,7
1272,"And now, Ladies and Gentlemen, performing for the first time in public, I give you The Great Banksy...!!!",1.2890173410404624,0.0439776600049684,173,134,28,11
1273,This is your ballot; this is a ballot box.,1.2890173410404624,0.0416220443291236,173,131,34,8
1274,"For my next trick, watch me make President Trump's subpoena disappear.",1.2890173410404624,0.0399745907281632,173,129,38,6
1275,Data!,1.288888888888889,0.0502802171787575,135,105,21,9
1276,For my next trick I will make your job disappear.,1.2885906040268456,0.0478972898300701,149,116,23,10
1277,This will shred any doubt that I'm a true magician.,1.2884615384615383,0.0472656951447863,156,122,23,11
1278,Voila! The president’s Putin notes disappear!,1.2883435582822085,0.0423893709912522,163,123,33,7
1279,"And, the Trump Tax Returns look like ...",1.2882352941176471,0.0429006049724751,170,130,31,9
1280,"As my mother always said, why hire an accountant when you’ve got MAGIC!",1.2882352941176471,0.0429006049724751,170,130,31,9
1281,And presto! All your hopes and dreams are gone.,1.2882352941176471,0.0420814479638009,170,129,33,8
1282,"Yes, this is how 50 Shades of Grey ends.  For good.",1.2881355932203389,0.0417519997067464,177,135,33,9
1283,With a quick 'abracadabra' the U.S. Constitution is 'Trumped'.,1.2880434782608696,0.0414076155891261,184,141,33,10
1284,And my next trick will be avoiding an indictment.,1.2880434782608696,0.0384318162959616,184,137,41,6
1285,And here's the  page that keeps Social Security running for another 150 years.,1.2876712328767124,0.0465725637560611,146,112,26,8
1286,A magician never reveals his secrets.,1.2875,0.0464015662010664,160,125,24,11
1287,"There! Magically, one vote is now thirty minority votes.",1.2874251497005988,0.0458207947130498,167,131,24,12
1288,Miss Shimansky was beginning to have doubts about the interview process for administrative assistant.,1.2874251497005988,0.0458207947130498,167,131,24,12
1289,Watch in wonder as I make a letter from my ex-wife’s attorneys disappear.,1.2874251497005988,0.0408249436837227,167,125,36,6
1290,Abraca - PAPER JAM!,1.2874251497005988,0.0433948225881532,167,128,30,9
1291,"I call this trick ""the subpoena solution"".",1.2874251497005988,0.0433948225881532,167,128,30,9
1292,I learned this banking trick during the Great Recession.,1.287292817679558,0.0425768987907804,181,140,30,11
1293,Watch as I attempt to cut the evidence against me in half.,1.287292817679558,0.0453689511390829,181,144,22,15
1294,Who really reads instructions?,1.287292817679558,0.04110982367063,181,138,34,9
1295,"President Trump's brand new Attorney General, making his very first appearance, along with the U.S. Constitution -- its very last.",1.2867132867132869,0.0482352585529752,143,111,23,9
1296,"And for my next trick, watch me unshread wheat!",1.2866666666666666,0.0466666666666666,150,116,25,9
1297,"Uh oh, we may have found Trump’s long lost tax return!",1.286624203821656,0.0443168658661352,157,120,29,8
1298,"I’ll keep the return here, for safe keeping",1.286624203821656,0.0478604415933394,157,124,21,12
1299,The magic part is when I make this credit score disappear from Google.,1.286624203821656,0.0461226976103223,157,122,25,10
1300,"Fleer-o, schmeer-o, criminal record disappear-o!",1.2865853658536586,0.040353484404808,164,122,37,5
1301,... and there goes your vote.,1.2865853658536586,0.0447491586406411,164,127,27,10
1302,And now let's see what news the toaster of fate will bring us.,1.286549707602339,0.041038741932944,171,129,35,7
1303,"Shut down or no shut down, we still have to shred.",1.286549707602339,0.042682282491071,171,131,31,9
1304,Now watch as I file my tax return.,1.2865168539325842,0.0444992453484856,178,140,25,13
1305,Now watch carefully as the incriminating document miraculously disappears!,1.2865168539325842,0.0407772360054069,178,135,35,8
1306,"Et voila, hanging chads!",1.2865168539325842,0.041548320643673,178,136,33,9
1307,Watch as I make my assistant's sexual harassment claim disappear right before her eyes!,1.2857142857142858,0.0452979880304808,161,125,26,10
1308,And it will re-appear as Trump’s tax turns!,1.2857142857142858,0.0455793560470734,168,132,24,12
1309,"Only 32,999 left to go.",1.2857142857142858,0.0439875630014492,168,130,28,10
1310,Alice will now take this backstage to Mueller the Magical Mender.,1.2857142857142858,0.0452784178449531,147,112,28,7
