rank,caption,mean,precision,votes,not_funny,somewhat_funny,funny
2175,I now give you... the president's tax returns!,1.238095238095238,0.0398153845198151,168,135,26,7
2176,"And, presto, the paper un-shreds right into my hand!",1.238095238095238,0.0415672568654724,168,137,22,9
2177,"With a wave of the wand, I insert the paper into the magic box and, voila, the national debt has disappeared. Thank you -- I'll be appearing on Capital Hill all week!",1.238095238095238,0.0389098810719208,168,134,28,6
2178,"Heh, Trump thought this really worked on his tax returns.",1.238095238095238,0.0344974511870428,189,148,37,4
2179,"And voila! Along with my interpreter's notes, evidence of treason disappears!",1.237837837837838,0.0381471327215389,185,149,28,8
2180,Ta da.....and next I will disappear the rabbit,1.2378048780487805,0.0422532400170496,164,134,21,9
2181,"So I shred the 'fake news,' like so, wave my wand and say ""Nostrovia"" for our Russian friends listening in and then...Tada! The paper comes back out as favorable news!",1.2378048780487805,0.0431294909664564,164,135,19,10
2182,"Nothing to worry to worry about folks, I moonlight as the President’s tax attorney. And a magician never reveals his secrets, unless it’s to the special counsel. So here we go. Abracadabra!",1.2378048780487805,0.0404438239260821,164,132,25,7
2183,"And before your very eyes, watch as I make these sensitive documents disappear!",1.2378048780487805,0.0365572988254738,164,128,33,3
2184,I wave my magic wand and Presto! Out comes a Banksy!,1.2375690607734806,0.040251103484235,181,148,23,10
2185,We're gonna recycle your vote.,1.2375,0.0370783421840769,160,125,32,3
2186,I call this trick is the Banksy.,1.2375,0.042970938694972,160,131,20,9
2187,"Don't worry,Helen.  It worked on YouTube.",1.2375,0.042970938694972,160,131,20,9
2188,And out comes a new prenuptial agreement.,1.2375,0.042970938694972,160,131,20,9
2189,Watch as my assistant's restraining order magically disappears!,1.2375,0.0411007161485603,160,129,24,7
2190,"VOILA, President Trump's 2016 tax return.",1.237410071942446,0.0463254432353865,139,114,17,8
2191,My god! That's my only copy of the Gettysburg Address!,1.2373737373737377,0.0371535800850647,198,160,29,9
2192,"There are options to gerrymandering, Sylvia.",1.2372881355932204,0.0375967756165071,177,141,30,6
2193,For my next act  I will shred a Banksy.,1.2372881355932204,0.0416476195441812,177,146,20,11
2194,Presto! This simple shredded paper will now transmogrify into Donald Trump's complete 2018 Federal tax return.,1.2371794871794872,0.0464738241890453,156,131,13,12
2195,"Don't worry, we should have this wand in working order when it's time to saw you in half.",1.2369942196531791,0.0372477116288083,173,137,31,5
2196,"Not as dramatic, but sure beats the last guy sawing me in half.",1.2369942196531791,0.0381392888857219,173,138,29,6
2197,And next my lovely assistant will step into the shredder.,1.2369942196531791,0.0398626645742595,173,140,25,8
2198,"Voila! As Mr. Trump says, ""your subpoena is shreded so you are free to go!""",1.236842105263158,0.0414709098441645,152,122,24,6
2199,Fig. 2. Constitutional law and stagecraft do not mix.,1.236842105263158,0.0425085254865832,152,123,22,7
2200,"Now, who wants coleslaw?",1.2365591397849462,0.0371896331365271,186,149,30,7
2201,"Listen Honey, I'm happy to help but if you really want to make your jury duty disappear then just wear that outfit down to the court...",1.2364864864864864,0.0443140259965886,148,121,19,8
2202,"And now, for my final trick, I'll make his tax returns....DISAPPEAR!",1.2364864864864864,0.0410846310675248,148,118,25,5
2203,Behold! As I turn this ordinary piece of paper into festive confetti!,1.2363636363636363,0.0392943194318078,165,132,27,6
2204,And Presto! The judge will not be able to find a shred of evidence to convict you!,1.2363636363636363,0.0373660792644099,165,130,31,4
2205,"For my next act, I will make Trump’s tax returns disappear",1.2363636363636363,0.0411322647033169,165,134,23,8
2206,"Now as I promised, you can see that all your social security numbers are being completely shredded.",1.2363636363636363,0.0392943194318078,165,132,27,6
2207,For my next trick-- How to disappear one hour of colusion with Russia...,1.2362637362637363,0.038504880303622,182,147,27,8
2208,"In goes the marriage certificate, and viola! We're no longer man and wife!",1.2361111111111112,0.0440585177101959,144,117,20,7
2209,"Secretary of Magic ""And for my next trick the Robert Mueller Investigation""",1.2361111111111112,0.04179596617581,144,115,24,5
2210,I started using paper for this trick after 1 unfortunate loss of a rabbit.,1.2361111111111112,0.0440585177101959,144,117,20,7
2211,"Much like the scandal, the lesser-known 'Iran-Contra' trick, continues to leave audiences shocked and astounded.",1.236024844720497,0.0358086789315852,161,125,34,2
2212,Wordsmithing!,1.2359550561797752,0.0374087211485022,178,142,30,6
2213,"Sawing a beautiful woman in half has become
too costly and time consuming.",1.2359550561797752,0.0374087211485022,178,142,30,6
2214,"We say the magic words, “Collusion's Illusion” and – Hey Presto! – the evidence disappears!",1.2359550561797752,0.0356714518043319,178,140,34,4
2215,"Now I’ll wave my magic wand, and watch the evidence disappear!",1.2359550561797752,0.0390688157243603,178,144,26,8
2216,"Donald the Great: ""You see a State of the Union address, Nancy? Covfefe! Now you don't.""",1.2359550561797752,0.0390688157243603,178,144,26,8
2217,"...and so, to make this transition to the paperless office, we’ll be distributing magic wands to all company associates.”",1.2359550561797752,0.0374087211485022,178,142,30,6
2218,"For my next trick I’ll turn my assistant’s and my 
marriage license into a divorce decree!",1.235897435897436,0.0360444104242469,195,156,32,7
2219,Another illusion on the cutting edge!,1.2356687898089171,0.0405540263531117,157,126,25,6
2220,"If I can't read the bad news, then it disappears",1.2356687898089171,0.0405540263531117,157,126,25,6
2221,"and when this reappears, it will be a perfectly toasted piece of artisan bread!",1.2356687898089171,0.0405540263531117,157,126,25,6
2222,It will reappear in the cloud at the moment I attain my Go Fund Me target.,1.2356687898089171,0.0405540263531117,157,126,25,6
2223,"Aren't you taking a bit too far,with this whole dress-for-the-job-you-want-thing,Ben?",1.2356687898089171,0.0415486265811156,157,127,23,7
2224,And the magic word is FAKE NEWS,1.2356687898089171,0.0405540263531117,157,126,25,6
2225,"Nothing is lost, nothing is added.",1.2356687898089171,0.0395344120497671,157,125,27,5
2226,I'm gonna ask my lovely assistant to watch herself please.  Making this document reappear is one thing.  Her thumb is another story.,1.235632183908046,0.0352195768304005,174,136,35,3
2227,I will now place this ordinary subpoena into the box without reading the amount I owe my ex-wife.,1.235632183908046,0.0388095563532179,174,140,27,7
2228,And next I will make a rabbit disappear!,1.235632183908046,0.0379439177771395,174,139,29,6
2229,!arbadacarbA,1.2352941176470589,0.0385014432329097,170,136,28,6
2230,"and presto, we have shredded your old birth certificate and you are now 21.",1.2352941176470589,0.0375865333163713,170,135,30,5
2231,Behold as the corporate hocus pocus of Theranos turns this once valuable stock certificate into hamster litter.,1.2352941176470589,0.0385014432329097,170,136,28,6
2232,''Abra Cadabra we're divorced.'',1.235,0.0374953933518914,200,163,27,10
2233,"evidence, schmedivence",1.2349397590361446,0.0371675844222485,166,131,31,4
2234,I can make it disappear but it would take a real magician to make it reappear.,1.2349397590361446,0.0400060918132266,166,134,25,7
2235,Hmmm making that rabbit disappear was a lot messier.,1.2349397590361446,0.0390828355168933,166,133,27,6
2236,My assistant will take this ungainly proposed legislation - and reassemble it into a coherent document.,1.2349397590361446,0.0400060918132266,166,134,25,7
2237,And abracadabra your ballet has been tampered!,1.2349397590361446,0.0409085166230224,166,135,23,8
2238,My assistant will open the shredder in 30 seconds and find  the inserted page shredded and 10 copies of it completely intact!,1.2349397590361446,0.0400060918132266,166,134,25,7
2239,"Unfortunately,  the Constitution is no longer worth the paper it's written on.",1.2348993288590604,0.0419345167535454,149,120,23,6
2240,Where does it say you can't claim rabbits as dependents?,1.2348993288590604,0.0419345167535454,149,120,23,6
2241,You'll find out why magician assistants have such a high turnover rate when we switch to the rabbit.,1.2348993288590604,0.0408388169978781,149,119,25,5
2242,They say you can’t make taxes disappear.,1.23463687150838,0.0363695399643473,179,142,32,5
2243,"In case you were wondering, Oliver North taught me this trick.",1.23463687150838,0.0372224950245967,179,143,30,6
2244,"Once we upgraded the operating system, the dove flew off and took the hat.",1.23463687150838,0.0388722977598685,179,145,26,8
2245,Now I pull a perfect copy out of my Reverse Shredder.,1.2345679012345678,0.0415769310920065,162,132,22,8
2246,"A ""50 percent off"" coupon toward a rabbit of your choice.",1.2345679012345678,0.0406443103389384,162,131,24,7
2247,Why should I saw you in half my dear when I can just shred our license.,1.2342857142857142,0.038610635063959,175,141,27,7
2248,"Abracadabra....and the winner is,Vladamir Putin.",1.2342857142857142,0.0359685530021274,175,138,33,4
2249,"Picasso,
""The urge to destroy is a creative urge.""",1.2342857142857142,0.038610635063959,175,141,27,7
2250,"Due to the delay in my federal magician's subsidy, I will be performing presto-change-O Lite.",1.2341772151898731,0.0422763180655055,158,129,21,8
2251,Now watch this!  Old boring stuff becomes hot news!,1.2341772151898731,0.0432193558982458,158,130,19,9
2252,The real magic is me getting the paper I am shredding. Everyone has been trying to get these tax returns.,1.2341772151898731,0.0413117587872066,158,128,23,7
2253,Here goes my assistant’s contract.,1.2341772151898731,0.0382725025160623,158,125,29,4
2254,"And now, I'll turn this everyday office memo into glorious confetti!",1.2340425531914894,0.0422736512248047,141,113,23,5
2255,It's called the Enron vanish.,1.2339181286549707,0.0383003514296592,171,137,28,6
2256,My chances of ever getting a date again.,1.2339181286549707,0.0391882172245664,171,138,26,7
2257,Where's the rabbit?,1.2337662337662338,0.0399390586955991,154,123,26,5
2258,For my next trick I will make the US constitution disappear!,1.2337662337662338,0.0439847491840635,154,127,18,9
2259,Abracataxfraud!,1.2337662337662338,0.0409879353873079,154,124,24,6
2260,The tricky part is putting the pieces back together again.,1.2335329341317365,0.0397906901789989,167,135,25,7
2261,This is much nicer...the rabbit doesn't fit well in the shredder!,1.2335329341317365,0.0388735663147641,167,134,27,6
2262,"As the election judge, I can do what I want with any ballot.",1.2333333333333334,0.0361904061829876,180,143,32,5
2263,Now I'll make you're vote disappear.,1.2333333333333334,0.0353224044093666,180,142,34,4
2264,Flip the switch while I distract them with my wand.,1.2333333333333334,0.0427433594844265,150,122,21,7
2265,"‘Boring’, I hear you say.  Well, next is the Bunny in my hat.",1.2333333333333334,0.0386777098466545,180,146,26,8
2266,"If this doesn't work, I'm toast.",1.2333333333333334,0.0361904061829876,180,143,32,5
2267,And voila! You pay no tax!,1.2331288343558282,0.0413461218380933,163,133,22,8
2268,And Now for a Masterpiece,1.2331288343558282,0.0431391065638629,163,135,18,10
2269,I really don't understand how Banksy did it,1.2331288343558282,0.0375038710387973,163,129,30,4
2270,"Don't worry, I'm only going to shred you in half.",1.2329545454545454,0.0348693589844412,176,138,35,3
2271,The Great  Bandoni mistakenly shreds priceless historical document while hiding a worthless copy up his sleeve,1.2329545454545454,0.039249809179933,176,143,25,8
2272,"Abracadabra Alakazam
Shred these tax papers
Hiding the scam",1.2329545454545454,0.0408707432099207,176,145,21,10
2273,"Abracadabra, the secret to this trick is now unshredded..alacazam, it's the rabbit's resignation letter!",1.2329545454545454,0.0400684737118376,176,144,23,9
2274,"Hocus POTUS, Alakasham, say them with me folks, Abracallusion, Vladiflimflam.",1.2329545454545454,0.0424297982602017,176,147,17,12
2275,"And now, observe as I turn this into a cloud.",1.2328042328042328,0.0381656884191029,189,154,26,9
2276,"Ladies and gentlemen, my probation officer gave me this idea after I sawed my last assistant in half.",1.2327044025157232,0.0420353975596105,159,130,21,8
2277,Technology has really put a damper on the vanishing act.,1.2327044025157232,0.0400967786261502,159,128,25,6
2278,I'm sending an encrypted message that will now appear in plain text on your smartphones.,1.2325581395348837,0.0381013033446104,172,138,28,6
2279,"WaLa,it disappears just like during the 2000 election",1.2325581395348837,0.0381013033446104,172,138,28,6
2280,I am now adding artistic value to junk mail,1.2324324324324325,0.0379426113613118,185,150,27,8
2281,"An for my next trick, I’ll make my debts disappear!",1.2324324324324325,0.0371602926567466,185,149,29,7
2282,"When my attorney said he could make my student debt disappear, I had envisioned something a little more legitimate",1.232394366197183,0.0443214222296548,142,116,19,7
2283,"Well if this doesn't throw Mueller off our trail, I don't know what will.",1.232258064516129,0.0417659555504514,155,126,22,7
2284,And this shredder works on reputations as well as names!,1.232258064516129,0.03970920147673,155,124,26,5
2285,"Next time listen more closely - I asked for the shredder, not the toaster.",1.232258064516129,0.0417659555504514,155,126,22,7
2286,"Watch closely as I shred my assistant's contract, and then we will see if she can reassemble it in 30 seconds.  There are no copies.",1.232258064516129,0.0427572476149209,155,127,20,8
2287,Abracadabra...watch my impeachment disappear!,1.232258064516129,0.0386397916836796,155,123,28,4
2288,...with help from my trusty assistant Hillary.,1.2321428571428572,0.0413395033823556,168,138,21,9
2289,Screw you Mueller,1.2321428571428572,0.0413395033823556,168,138,21,9
2290,Houdini didn’t have to worry about hackers and identity theft.,1.2321428571428572,0.0367766847710778,168,133,31,4
2291,"Before going into real estate, Fred used to be a magician.",1.2321428571428572,0.040468117580017,168,137,23,8
2292,And what have we here? An unshredding 'dear john' letter?,1.2321428571428572,0.0386664782674949,168,135,27,6
2293,"For my next trick, I shall make my surprisingly litigious assistant’s lawsuit disappear.",1.2321428571428572,0.0395775509732521,168,136,25,7
2294,"And now, I make the evidence of collusion disappear!",1.2317880794701987,0.0392464434172955,151,120,27,4
2295,"And now, to make the tax return of Individual 1 disappear ...",1.2317880794701987,0.0414352960941282,151,122,23,6
2296,"Next, we will try to analyze a phone bill.",1.2317073170731707,0.0411178175444376,164,134,22,8
2297,And with that I will make this lawsuit disappear.,1.231638418079096,0.0373693688003473,177,142,29,6
2298,"No, this isn't a trick. This is for security purposes.",1.231638418079096,0.0382187265607339,177,143,27,7
2299,They sure don’t make magic wands like they used to.,1.231638418079096,0.0365002519052758,177,141,31,5
2300,"If I can nail this, I’ve got a big gig over at Facebook lined up after this.",1.231638418079096,0.0373693688003473,177,142,29,6
2301,Can we plug this in?,1.231638418079096,0.0373693688003473,177,142,29,6
2302,"Magic, it can help you avoid both death and taxes!",1.231578947368421,0.0364883361105832,190,153,30,7
2303,I guess Donald just likes the aesthetic of a magician making his tax returns disappear...,1.23125,0.0388735603587908,160,128,27,5
2304,"And for my last trick, I will make your tax returns disappear!",1.23125,0.0378488750528637,160,127,29,4
2305,"The magic may be gone from our marriage, but who says you can’t bring a little magic to divorce?",1.23125,0.0388735603587908,160,128,27,5
2306,"Can’t speak for democracy, but voter suppression has been a boon for us magicians.",1.23121387283237,0.0396378641340761,173,141,24,8
2307,"Abracadabra
Only shreds of evidence left.",1.23121387283237,0.0387807547371862,173,140,26,7
2308,... and watch as I shred my New Year's resolution list,1.23121387283237,0.0370070299772139,173,138,30,5
2309,"And just like that, Miss Adams.....Viola! Your contract with me is up!",1.2311827956989247,0.0361867109924917,186,149,31,6
2310,"And now, I will make our marriage...disappear!",1.2307692307692308,0.0405158566985326,156,126,24,6
2311,Magician BANKSY!,1.2307692307692308,0.0349799340155435,182,144,34,4
2312,And now my assistant will help me shred the evidence.,1.2307692307692308,0.042508359364878,156,128,20,8
2313,A magician never reveals his vote.,1.2307692307692308,0.036674532301339,182,146,30,6
2314,Now you've all seen Trump's tax return.,1.2307692307692308,0.0393666396707045,169,137,25,7
2315,Ta da!  And those critics thought I couldn't make anything disappear.,1.2307692307692308,0.042508359364878,156,128,20,8
2316,And Presto a Banksy Original,1.2307692307692308,0.0384615384615384,169,136,27,6
2317,"...and, finally, the only signed copy of that codicil to the Bezos' pre-nup.",1.2307692307692308,0.039481915582672,156,125,26,5
2318,The rubber chicken told me to shred everything.,1.2307692307692308,0.0393666396707045,169,137,25,7
2319,And the document now will vanish...subpoena-cadabra.,1.2307692307692308,0.0384615384615384,169,136,27,6
2320,And just like that all of your bills will disappear,1.2303370786516854,0.0396599603376747,178,146,23,9
2321,"It's magical, the votes vanish and the hares appear tomorrow.",1.2303030303030302,0.0371014095634141,165,131,30,4
2322,"...and make it reappear, ladies and gentlemen, still as a divorce 
decree, but now with me getting custody of Mr. Floppy Bun.""",1.2303030303030302,0.0408919785730864,165,135,22,8
2323,I wish Ted would drop it with these silly outfits — as if wearing them somehow magically makes this legal.,1.2303030303030302,0.0371014095634141,165,131,30,4
2324,May this caption deserve a short life at the bottom of a hampster cage”.,1.2303030303030302,0.0390427234143185,165,133,26,6
2325,Banksky: His Pre-Artist Phase.,1.2303030303030302,0.0399780449949015,165,134,24,7
2326,"As I wave my magic wand and insert the ballot, I utter that magic word abra-electoral-cadabra",1.2303030303030302,0.0390427234143185,165,133,26,6
2327,No need for magic when you can make things disappear this way.,1.2303030303030302,0.0390427234143185,165,133,26,6
2328,"If i were in politics, my tax cuts would be spectacular",1.2303030303030302,0.0390427234143185,165,133,26,6
2329,"And when I say Banksy, put your tongue in it.",1.2303030303030302,0.0408919785730864,165,135,22,8
2330,Abra-ca-electoral college.,1.2303030303030302,0.0380844380502008,165,132,28,5
2331,And voila...I have saved his resume on file.,1.230263157894737,0.0422345468560858,152,124,21,7
2332,And now I will make all fiduciary liability disappear.,1.230263157894737,0.0422345468560858,152,124,21,7
2333,"Please, ladies and gentlemen, do not attempt this trick at home, . . . at least for seven years after you file.",1.230263157894737,0.0378840790461666,152,120,29,3
2334,The real wonder is why we still print things in the first place?,1.2302158273381294,0.0412460324851471,139,111,24,4
2335,"Full Disclosure, One page at a time.",1.2302158273381294,0.0399621168259453,139,110,26,3
2336,"If you keep holding on to that document, your hand is going to be REALLY small.",1.2299465240641712,0.03833411438851,187,153,25,9
2337,"Doris, get your thumb out of the way or else this won’t work.",1.2299465240641712,0.0360139043585744,187,150,31,6
2338,"Why yes, my cousin is Banksy - why do you ask?",1.2298850574712643,0.0402654625944695,174,143,22,9
2339,"I hope you’ve enjoyed the Trump magic show! For my grand finale: Into the shredder with the U.S. Constitution! Aaaaaand… Presto! Out it com…. Uh, oh… ehhhh… Presto! Uh…  Something’s gone… Hmmmmmmmmm….",1.2298850574712643,0.0385801236627887,174,141,26,7
2340,Behold as I make my IRS tax forms- disappear!,1.2298850574712643,0.0394317982076819,174,142,24,8
2341,Maybe this time the damm rabbit will come out instead of that orange haired thing!,1.2298850574712643,0.0385801236627887,174,141,26,7
2342,"The rabbit has died, we should have stayed with the hat.""",1.2298850574712643,0.0377092186843057,174,140,28,6
2343,"And now, with this simple act, I will make my career disappear.",1.2298850574712643,0.0385801236627887,174,141,26,7
2344,This illusion was a lot more exciting before I ran out of rabbits.”,1.2298136645962734,0.04427508518442,161,135,15,11
2345,And shazzam! The last piece of evidence magically disappears.,1.2298136645962734,0.0376404690090079,161,128,29,4
2346,Now they'll never read what I did to that rabbit!,1.2298136645962734,0.0386580477878912,161,129,27,5
2347,The Attorney General assured me that this trick would work.  Even gave me the paper.,1.2298136645962734,0.0424853347048373,161,133,19,9
2348,"I shall now shred this document, along with the thumb of my assistant........",1.2297297297297298,0.0418967845834183,148,120,22,6
2349,Now watch closely as this piece of paper will be recycled into a wall.,1.229591836734694,0.0364102041417602,196,159,29,8
2350,‘Well here goes Donald’s billet doux to Stormy’,1.2295081967213115,0.0403999757639204,183,152,20,11
2351,Watch this restraining order magically disappear.,1.2295081967213115,0.0381052531889506,183,149,26,8
2352,This lovely volunteer from the audience has agreed to let me make her ballot disappear.,1.2295081967213115,0.0388852100543528,183,150,24,9
2353,The magic of progressiveism meet the shredder of politics.,1.2295081967213115,0.0373089946288683,183,148,28,7
2354,"Tis I, the Magical Michael Cohen.",1.2295081967213115,0.0388852100543528,183,150,24,9
2355,And now. I'll make my lovely assistant's identity disappear.,1.2294117647058824,0.0382587146134442,170,137,27,6
2356,"And for this next trick, I will make my student loans disappear.",1.2294117647058824,0.0354244027620811,170,134,33,3
2357,And for my next trick I’ll make his tax returns appear.,1.2294117647058824,0.0391579224186786,170,138,25,7
2358,Now pretend this is paper is my assistant and I'm sawing her in half.,1.2292993630573248,0.0402837918492787,157,127,24,6
2359,"As I told Trump, with the touch of a wand and the help of shredder, I could make the Mueller report disappear.",1.2291666666666667,0.0361473114742703,192,155,30,7
2360,Phew. Last time I pulled out a rabbit.,1.229050279329609,0.0361373915924084,179,143,31,5
2361,"I will now make the translator's notes of the meeting with Putin disappear. No, I'm not a expert magician, but I did sleep at a White House last night.",1.229050279329609,0.0386551829256659,179,146,25,8
2362,And with a tap of my wand this harrasment claim against me will disappear.,1.229050279329609,0.0378345406788403,179,145,27,7
2363,"This was the form that said I can't turn anyone into a frog,right?",1.229050279329609,0.0369956993411524,179,144,29,6
2364,It's a coll-u-u-u-sion.,1.2289156626506024,0.0432780581627454,166,139,16,11
2365,Banksy has nothing on me.,1.2289156626506024,0.0378797335995287,166,133,28,5
2366,Watch me make Trump's tax returns disappear.,1.2289156626506024,0.0378797335995287,166,133,28,5
2367,"And now I, the Great-Outstanding-Phillip, will make this mail-in ballot disappear!",1.2287581699346406,0.0387905518985362,153,122,27,4
2368,And for my next trick I give you 'The Michael Cohen Fever Dream',1.2287581699346406,0.0398836586661572,153,123,25,5
2369,"Now watch carefully as I make these song lyrics disappear........wait, OH NO, they are JAMMING.",1.2285714285714286,0.0392278271832882,175,143,24,8
2370,you can catch my next trick at the Governor Mansion in Georgia,1.2285714285714286,0.0400562588182386,175,144,22,9
2371,"Now, please watch carefully as I escape from taxes.",1.2285714285714286,0.0392278271832882,175,143,24,8
2372,"One, two, three...Abracabanksy !",1.2284263959390862,0.0362436519205215,197,160,29,8
2373,"For my next trick, I’ll make my tax returns disappear!",1.2284263959390862,0.0369513149052857,197,161,27,9
2374,"Wearing Lincoln's hat doesn't give you the right to shred the Constitution, Mr. Trump! And what's with the bowtie?",1.228395061728395,0.0413285720429984,162,133,21,8
2375,And this is how we get rid of toxic masculinity.,1.228395061728395,0.0384448586784856,162,130,27,5
2376,"Not part of the act, ladies and gentlemen... I just love to shred.",1.228395061728395,0.0384448586784856,162,130,27,5
2377,Ok. Not what I saw myself doing at this point in my life but my high school leotard still fits.,1.2281879194630871,0.0382370494990411,149,118,28,3
2378,And in my next act I will show how one makes an email disappear!,1.2280701754385963,0.0389513660217489,171,139,25,7
2379,"Abracadabra, it's now great art",1.2280701754385963,0.041516349355085,171,142,19,10
2380,"And for my next trick, I will attempt to make this jury summons disappear...",1.2280701754385963,0.0398247205208606,171,140,23,8
2381,And then we shred the shredder.,1.2280701754385963,0.03620511795516,171,136,31,4
2382,"But first, I'll make this cease-and-desist order disappear.",1.2280701754385963,0.0380579750559045,171,138,27,6
2383,I can make the information on this page reappear on computers everywhere,1.2280701754385963,0.0389513660217489,171,139,25,7
2384,And now I will make the Constitional Republic reappear,1.2279411764705883,0.0429912487481139,136,110,21,5
2385,I like to start the show with easier tricks.,1.2278481012658229,0.0400543190975625,158,128,24,6
2386,Next we cut the translator in half.,1.2278481012658229,0.0379881187768289,158,126,28,4
