caption,mean,precision,votes,not_funny,somewhat_funny,funny
"Don't worry, I see a hairball.",1.205128205128205,0.04238344472700523,156,133,14,9
I don’t know that performance art is what is called for here.,1.205128205128205,0.03718590401258447,156,128,24,4
"A little to the left, dear.” 
Douglas Monaghan, Floral Park, New Yor",1.205128205128205,0.039347394184503885,156,130,20,6
"This is what happens to dentists who are too curious.

Phyllis Landis
Oceanside  CA",1.205128205128205,0.04238344472700523,156,133,14,9
He wants to remember you too.,1.205128205128205,0.03605660093927814,156,127,26,3
"Quit lion to me, Jim",1.204968944099379,0.03952160783935913,161,135,19,7
"Hurry up, it's my turn next!",1.204968944099379,0.036455976623178094,161,132,25,4
It was the only way the animal welfare people would let us have one.,1.204968944099379,0.03952160783935913,161,135,19,7
"Darling, I think the press has lionized you enough.",1.204968944099379,0.03537511102451712,161,131,27,3
Did you make sure it was dead?,1.204968944099379,0.03750570600725312,161,133,23,5
He agrees. Six and a half inches higher!,1.204968944099379,0.03537511102451712,161,131,27,3
I told you impeachment wouldn’t be enough,1.204968944099379,0.03750570600725312,161,133,23,5
George!!!  I thought you said you'd killed it!,1.204968944099379,0.03852684433814036,161,134,21,6
"No, you look far more like an inept lion tamer than you do a skilled big game hunter.",1.204968944099379,0.03952160783935913,161,135,19,7
"Do not worry,this is more effective than a KN-95",1.2048192771084338,0.03775178080966938,166,138,22,6
I never did like that thing.,1.2048192771084338,0.036771967640765936,166,137,24,5
We'll have to give him a big dose of emetic so your head can be extricated.,1.2048192771084338,0.03775178080966938,166,138,22,6
"I understand your frustration, but that won't do anything to increase your chances of having your captions appear in the rate the submissions section.",1.2048192771084338,0.0405494143568643,166,141,16,9
Again with your “belly of the beast!”,1.2048192771084338,0.035765321948023246,166,136,26,4
"Harry, this proves nothing.",1.2046783625730995,0.037018323687218455,171,142,23,6
"Yes dear, I'm sure it looked just like that.",1.2046783625730995,0.03511064495851469,171,140,27,4
I told you that the Board said we cannot have any pets!,1.2046783625730995,0.03511064495851469,171,140,27,4
So no head?,1.2046783625730995,0.037018323687218455,171,142,23,6
"I’ve heard of cinema verite, but this is my first experience with art verite.",1.2046783625730995,0.033093178907352895,171,138,31,2
I told you it felt warm.,1.2046783625730995,0.03607709576736016,171,141,25,5
"well talk about holding on to a grudge, cripes",1.2045454545454546,0.03541789647608998,176,145,26,5
I think this chablis will be an excellent pairing.,1.2045454545454546,0.03806878755090871,176,148,20,8
You want to take it down some on the left.,1.2045454545454546,0.034489017467245454,176,144,28,4
"Honey, your mustache could use a trim.",1.2044198895027625,0.037344506388616056,181,152,21,8
Ralph! I told you to get rid of all that Jumanji stuff!,1.204225352112676,0.03939753617923242,142,117,21,4
This really completes our home,1.2040816326530612,0.03731104416148252,147,120,24,3
"Remember, you're allergic to cats!",1.2040816326530612,0.038539615677062114,147,121,22,4
"Our patience is running out, Stanley...now, who is she?",1.2039473684210527,0.03886999157655591,152,126,21,5
The art dealer had assured Lydia that the piece was a captivating addition.,1.2038216560509554,0.03469243023008109,157,127,28,2
Did you sing Wimoweh nonstop last night and wake him up again?,1.2038216560509554,0.036971385555930394,157,129,24,4
"It's Tiger King, Harold.  Lion King is an entirely different genre.",1.2038216560509554,0.036971385555930394,157,129,24,4
"Honey, I think I'm stuck.",1.2038216560509554,0.03585002137512823,157,128,26,3
"I told you, we should KILL him first and then hang!",1.2037037037037037,0.03830918502930805,162,135,21,6
I’d like to call this piece Revenge of the Ecosystem,1.2037037037037037,0.03407152349402146,162,131,29,2
Quit clowning around. You're not in the circus any longer.,1.2037037037037037,0.03625232662060062,162,133,25,4
"You didn't perchance buy that at an Addams Family estate sale, did you?",1.2037037037037037,0.03625232662060062,162,133,25,4
"Ok dear, ok, you don't have to tell me how you FEEL..",1.2037037037037037,0.03830918502930805,162,135,21,6
"Harold, have you gone wild!!!",1.2035928143712575,0.03454270310023845,167,136,28,3
"George, I told you - being the lion's share is NOT the same as getting it.",1.2035928143712575,0.03454270310023845,167,136,28,3
"Clark, I know they say ""See how the art can make you feel"", but we're in the realism gallery now.",1.2034883720930232,0.03492619473255962,172,141,27,4
"Shhhh, you’ll wake up the cat.",1.2034883720930232,0.0368217054263566,172,143,23,6
"Wow, it's not too late for even a trophy lion to find his courage!",1.2034883720930232,0.03588646728923073,172,142,25,5
“It’s not straight from the lion’s mouth either!”,1.2034883720930232,0.03773377063731812,172,144,21,7
Welcome to the concrete jungle.,1.2034883720930232,0.03862430455702838,172,145,19,8
"Your Karma's come, Bwana.",1.2033898305084745,0.03613571463654416,177,147,24,6
Trophy husband bye bye.,1.2033898305084745,0.03613571463654416,177,147,24,6
I knew you were a Leo!,1.2033898305084745,0.034313076246792557,177,145,28,4
"Marvin, you were supposed to wear the catnip for ME.",1.2033898305084745,0.03613571463654416,177,147,24,6
Heads up! Dinner's ready.,1.2033898305084745,0.03613571463654416,177,147,24,6
"Looks like he's the king of your jungle, too.",1.2033898305084745,0.035236182212407395,177,146,26,5
Well Mr. Smartypants....how many times did I tell you not to go on that safari?,1.2033898305084745,0.035236182212407395,177,146,26,5
Despite the quarantine you really do need a haircut.,1.2033898305084745,0.03336444014411786,177,144,30,3
And you say I use too much teeth.,1.2032967032967032,0.034618058764962885,182,150,27,5
"Sheesh, I thought you said you were a former Lion Tamer",1.2032967032967032,0.034618058764962885,182,150,27,5
I told you not to leave that Lion around,1.2032967032967032,0.03632954071337264,182,152,23,7
I guess I was wrong  honey when I said his roar is worse than his bite.,1.2028985507246377,0.04134548201289941,138,115,18,5
Now raise the right side...why are you looking at me like that?,1.2027027027027026,0.03948493939933707,148,123,20,5
You seem to have a blind spot when it comes to trophy hanging?,1.2027027027027026,0.03708373110482346,148,121,24,3
He could have kill Ed the antelope but no he had to kill the lion.,1.2027027027027026,0.04063236521206408,148,124,18,6
"After being stuck in that position so long, I think he’s just trying to get ahead.",1.2026143790849673,0.0397354048860777,153,128,19,6
Leonard! I thought you ended it with her!,1.2025316455696202,0.03564575011131952,158,129,26,3
"This is hard to hang, and I'm not lyin'!",1.2025316455696202,0.03889082753360974,158,132,20,6
Do unto animals as they would do unto you.,1.2025316455696202,0.03564575011131952,158,129,26,3
"So … sometimes you get the lion, and the lion gets you?",1.2025316455696202,0.03449628742220223,158,128,28,2
Careful with Uncle Leo!,1.2025316455696202,0.03784006885783284,158,131,22,5
I TOLD YOU MOTHER NATURE WAS NOT LIKING WHAT  YOU WERE DOING!,1.2024539877300613,0.04003284760743292,163,138,17,8
That's what you get for trying to keep ahead of everything!,1.2024539877300613,0.03605090067396688,163,134,25,4
Sorry. He gets offended when I call him “off the wall”.,1.2024539877300613,0.03605090067396688,163,134,25,4
Haven't I told you about these superrealists?,1.2024539877300613,0.03907542098968375,163,137,19,7
Don't change the subject. Where is Mom's picture going to hang?,1.2024539877300613,0.03605090067396688,163,134,25,4
"Honey, I'm sacrificing life and limb.",1.2024539877300613,0.04003284760743292,163,138,17,8
I told you he doesn’t like to be tickled.,1.2024539877300613,0.034984669176159076,163,133,27,3
But you said you killed it!,1.2023809523809523,0.03637353713486552,168,139,24,5
Lying will eat you up from the outside too....,1.2023809523809523,0.038283236573738964,168,141,20,7
"Jerry, whether they are décor or not, they are still wild animals.",1.2023809523809523,0.03435785506753902,168,137,28,3
"Well,you did have to insist on buying a piece called The Narcissist.",1.2023809523809523,0.033304297101309686,168,136,30,2
"Honey, you’ve been framed... I’m calling the human rights attorney!",1.2023809523809523,0.038283236573738964,168,141,20,7
"Do you think we can take this in the bedroom""",1.2023809523809523,0.03435785506753902,168,137,28,3
"Oh, George, you've always had such trouble centering those pieces.",1.2023121387283238,0.034743638519106376,173,142,27,4
I miss the days when you could just slam out the door to the corner bar.,1.2023121387283238,0.03569781159499867,173,143,25,5
"I know you said you’re close to your cat, but this isn’t going to work for me.",1.2023121387283238,0.038418403897729644,173,146,19,8
"Thanks, Leo!  More wine for me!",1.2023121387283238,0.034743638519106376,173,142,27,4
Leo! I told you to do it in the storage unit!,1.2023121387283238,0.03662713594860661,173,144,23,6
"Your head may fit in his mouth, but I still don't believe you killed him when your head was in his mouth.",1.2023121387283238,0.03569781159499867,173,143,25,5
"This is nine, last chance",1.2023121387283238,0.03569781159499867,173,143,25,5
Come down from there.  The cats are getting ideas.,1.2021857923497268,0.03614754790538152,183,153,23,7
"I’ve only had one drink, but I think you’re over-identifying with the art!!",1.2020725388601037,0.031649719489302106,193,157,33,3
Ed had a hard time time leaving his lion-taming career.,1.2014388489208634,0.04107290135151053,139,116,18,5
Trojan lion. Hostile takeover.,1.2013888888888888,0.042480240288721084,144,122,15,7
"I meant it figuratively when I said you have eyes in the back of your head.""",1.2013422818791946,0.041489440121040645,149,126,16,7
"Leo, see if this wine pairs well with his Eau Sauvage.",1.2013422818791946,0.03806953476017015,149,123,22,4
It’s only learned behavior.,1.2012987012987013,0.03493706387506468,154,125,27,2
"Dear, could it be you're being a little headstrong?",1.20125786163522,0.035443749678574984,159,130,26,3
"Is there something you're trying to tell me, Tim?",1.20125786163522,0.03762289705854003,159,132,22,5
How hard is it to hang a mounted lion head?,1.20125786163522,0.03654956753748931,159,131,24,4
"I just asked you one little question. Is it so hard to talk to me?. Okay, never mind. Oh come on - just a few sentences is all I need. Really? You have nothing to say? I know you're in there.",1.20125786163522,0.03430230160466607,159,129,28,2
wimoWHAT?,1.20125786163522,0.03654956753748931,159,131,24,4
Better he swallows your pride rather than his.,1.20125786163522,0.038666443836710765,159,133,20,6
Honey! I told you your exotic tastes would come back to bite you!,1.20125786163522,0.03654956753748931,159,131,24,4
This is not the wardrobe!,1.201219512195122,0.037881066042358136,164,137,21,6
Honey! Are you looking for hope in American democracy ???,1.201219512195122,0.03585166336909664,164,135,25,4
Karen was starting to sense that George getting stuck in the lion's mouth wasn't an accident!,1.201219512195122,0.03585166336909664,164,135,25,4
"I told you, honey. I got courage!",1.201219512195122,0.037881066042358136,164,137,21,6
"Hey, you told me it was stuffed!",1.201219512195122,0.03688032626507339,164,136,23,5
Let him go!  You’re not in the circus anymore!,1.201219512195122,0.03688032626507339,164,136,23,5
About as funny as your lampshade hat...Shecky.,1.2011834319526626,0.03898894950842367,169,143,18,8
I told you to wait until he’s dry.,1.2011834319526626,0.03417493662169663,169,138,28,3
"Perfect, now just hold it for a couple of years.",1.2011834319526626,0.03617749368552709,169,140,24,5
"Maybe a bit too far to the right, Hank.",1.2011834319526626,0.03807487105212209,169,142,20,7
Im getting my head into this.,1.2011834319526626,0.03898894950842367,169,143,18,8
"Sorry, I eat when I'm stressed.",1.2011834319526626,0.03519046278797235,169,139,26,4
I TOLD the taxidermist to leave you out,1.2011834319526626,0.03519046278797235,169,139,26,4
Your name is Donald not Daniel!,1.2011494252873562,0.03456294797559984,174,143,27,4
I don't care what you say. You're getting a DNA test Monday.,1.2011494252873562,0.0335880425852526,174,142,29,3
you're lion.,1.2011173184357542,0.03748067798252562,179,151,20,8
I told you that store was haunted.,1.2011173184357542,0.03487820416988456,179,148,26,5
"Oh, you're just hangry.",1.2011173184357542,0.03396643089107652,179,147,28,4
"When I said I found Scott attractive for the way he put his head inside the lion's mouth, this isn't what I meant.",1.2011173184357542,0.03911959380292097,179,153,16,10
I told you hanging it there would be a commitment.,1.201086956521739,0.0333985089575997,184,151,29,4
At least you get to practice for the circus during COVID-19.,1.2010582010582012,0.034527653451386836,189,157,26,6
"Well, don't bite my head off, big mouth.",1.2,0.03624401881463749,175,146,23,6
My therapist said it's unhealthy to hold a grudge.,1.2,0.03598352099922362,170,141,24,5
There must be a better way to fight plaque.,1.2,0.03706898651442383,155,128,23,4
Careful....he's full of himself.  Don't bite off more than you can chew.,1.2,0.03399391849953476,170,139,28,3
I really appreciate how you get your head into this decorative art.,1.2,0.03667640803206492,165,137,23,5
"There seems to be saliva all over your neck and shirt, Marvin. Marvin? MARVIN!",1.2,0.0395839411397689,165,140,17,8
"I know you miss him,
I had your nose framed too.",1.2,0.03786873475639399,170,143,20,7
"No, you're mixing it up with the mouse that roared.",1.2,0.03565458001613713,165,136,25,4
It'll give you courage,1.2,0.03500285901504746,170,140,26,4
John shows his wife his mask against the South African Covid variant.,1.2,0.033001253590845214,195,161,29,5
"Dear, you're wrong again!",1.2,0.032864486728012614,180,147,30,3
Surely your therapist had something else in mind when she said you'd have more fun if your head was in the lion’s mouth more often?,1.2,0.03565458001613713,165,136,25,4
You get the lion's share.,1.2,0.03460259016489566,165,135,27,3
"Here, have him gargle with this.",1.2,0.033517598603007695,165,134,29,2
"Yeah, yeah ""Daniel in the lion's den"", a little more to the left.",1.2,0.03820214529901523,140,115,22,3
"If he'd survived that stupid safari, we'd be celebrating his 50th birthday tonight.",1.2,0.037139067635410375,175,147,21,7
"Harold, it will never be as funny as the ""Monica Turkey Head"" episode on 'Friends', so just come get your wine and call it a day.",1.2,0.03341533427725102,175,143,29,3
"Fred, you've got your head on backward!",1.2,0.03863908081398027,165,139,19,7
"Obliviously, the taxidermist  didn't do a thorough job.",1.2,0.038655567174253426,145,120,21,4
Didn't anyone tell you they could still be dangerous even with their head cut off?,1.2,0.03818241665698899,155,129,21,5
I just wish there was an easier way for him to get off.,1.2,0.03818241665698899,155,129,21,5
"Leon, lampshade on your head is one thing but...",1.2,0.03693815679992499,170,142,22,6
You deserve it.,1.2,0.03598352099922362,170,141,24,5
"Dearest, please give him your wine.",1.2,0.033001253590845214,195,161,29,5
When you told me that was heavy you weren't lyin'.,1.2,0.03460259016489566,165,135,27,3
There are some downsides to your cruelty-free trophy philosophy.,1.2,0.03706898651442383,155,128,23,4
"No, it's still not grabbing me as much as the New Yorker cover did.",1.2,0.03740816848206272,160,133,22,5
"George, I told you not to feed him until bedtime.",1.2,0.03460259016489566,165,135,27,3
"This is not what I meant when I said ""Get your act together!""",1.2,0.03293790613225679,160,129,30,1
Give it up. You're not going to replace Siegfried and Roy!,1.2,0.03740816848206272,160,133,22,5
Call 911!,1.2,0.03539486432495052,150,122,26,2
"My late husband, Jungle Jim wanted everyone to know it was a fair fight and guns are for cowards!",1.2,0.03667640803206492,165,137,23,5
Did you say you smell wildebeest?,1.198952879581152,0.034197403442398286,191,159,26,6
I'll always enjoy sharing this rare moment!,1.198952879581152,0.03254595520518849,191,157,30,4
Mounted Maned Mimic Mauls Man,1.1989247311827957,0.030323157743884332,186,150,35,1
"It’s definitely an improvement, but you’ve got it on backwards!",1.1988950276243093,0.0354051266024248,181,151,24,6
"Fred, did Leo attack you again or were you giving him another drink?",1.1988950276243093,0.03452731723619277,181,150,26,5
I thought it might take over the wall.,1.1988950276243093,0.03174859954255609,181,147,32,2
Pierre! Please care again!,1.1988636363636365,0.03420705323679923,176,145,27,4
"After you get it positioned, close his mouth. I don't want that being the mane attraction.",1.1988304093567252,0.034817212055394814,171,141,26,4
I told you that rubber bullets wasn't a good idea!,1.1988304093567252,0.03674013002860954,171,143,22,6
My god its alive!,1.1988304093567252,0.03579158706895705,171,142,24,5
"Okay John, quit playing dead.",1.1987951807228916,0.03647470029782505,166,138,23,5
I told you trophy hunting would bring bad mojo!,1.1987951807228916,0.03647470029782505,166,138,23,5
This is NOT what I meant when I said 'put your head into it'!,1.1987951807228916,0.03647470029782505,166,138,23,5
"Come on back, George, my knitting group won't bite.",1.1987577639751552,0.035046415292802544,161,132,26,3
How do you like your meat? Roar!,1.1987577639751552,0.03719584288574698,161,134,22,5
"Does the ""Lion's share"" always have to come from the top?",1.1987577639751552,0.03922767175205233,161,136,18,7
"Honey, you have got to stop eating our guests!",1.1987577639751552,0.03613711355972388,161,133,24,4
"Dick, get out of that...   Piece of Art.",1.1987577639751552,0.03275624706479657,161,130,30,1
Did you take off your hearing aides?,1.1987577639751552,0.03613711355972388,161,133,24,4
I hope those Trump boys see this.,1.1987179487179487,0.03685290524349477,156,129,23,4
"After killing it, I thought your head had grown to big to fit inside its mouth.",1.1987179487179487,0.04209158531797022,156,134,13,9
What happened? Did you try again to make an on-line vaccination appointment?,1.1987179487179487,0.04209158531797022,156,134,13,9
I would hate to lose my head over this...,1.198581560283688,0.04176920492229612,141,119,16,6
I have a bad feeling about this.,1.198581560283688,0.036597786674413706,141,115,24,2
"The ""Never Give Up"" frog has nothing on this.",1.1979166666666667,0.033223737260704926,192,159,28,5
Those antelope steaks we had were too underdone.,1.1978609625668448,0.035437231516071165,187,157,23,7
Have fun living on his wall.,1.1978021978021978,0.03522701078497383,182,152,24,6
Honey! I told you never give your feline a treat!,1.1977401129943503,0.03586872932818104,177,148,23,6
"Well, I told you this would happen.",1.1977401129943503,0.034962328415460805,177,147,25,5
Well you got to Congress!  Are you happy now?,1.1977401129943503,0.03675278328244121,177,149,21,7
Now do you accept that we should have called Taskrabbit?,1.1977401129943503,0.03107344632768361,177,143,33,1
Is that really the best haircut option?,1.197674418604651,0.03746301034721944,172,145,20,7
‘The Cir-cle of Li-ife!’,1.197674418604651,0.03746301034721944,172,145,20,7
You're not being level-headed about this.,1.197674418604651,0.03654418815997311,172,144,22,6
A little lower on the left dear ...,1.197674418604651,0.03746301034721944,172,145,20,7
Daddy always warned against getting too close to second-hand lions.,1.1976047904191616,0.03725631058761278,167,140,21,6
"I think you're getting the mane idea, there.",1.1976047904191616,0.036275167976288505,167,139,23,5
Maybe the lion will write his history after all.,1.1976047904191616,0.03422861489926968,167,137,27,3
"If he wasn't good in the bedroom, we would have divorced five years ago.",1.1976047904191616,0.03914488999072687,167,142,17,8
I told him to feed him more often.,1.1976047904191616,0.03526673992326519,167,138,25,4
"Fred, do you always have to blame Goldie every time you misplace your keys?",1.1976047904191616,0.03422861489926968,167,137,27,3
I take it there was already something in the oven?,1.1976047904191616,0.03422861489926968,167,137,27,3
"Okay, honey--we'll go on the safari vacation...",1.1975308641975309,0.036985880884117604,162,135,22,5
"I know you miss Siegfried and Roy, dear, but......",1.1975308641975309,0.03593430323065427,162,134,24,4
I think I forgot 'feeding time' again.,1.1975308641975309,0.036985880884117604,162,135,22,5
"Wow, you ain't lyin'.",1.197452229299363,0.034338301244741895,157,128,27,2
Oh that's my MGM lion wall,1.197452229299363,0.037737208221581046,157,131,21,5
No wonder you wanted me to hang him!,1.197452229299363,0.036639289936226345,157,130,23,4
You kept ignoring him! Promise him a professional dental exam!,1.197452229299363,0.035507439357165,157,129,25,3
"Hon, Google says the fancy nepeta cataria seasoning you bought is actually just catnip.",1.197452229299363,0.03880407455006589,157,132,19,6
"No need to lose your head, Kitty, it was only a joke.",1.1973684210526316,0.0385329996278268,152,127,20,5
I guess they're not extinct after all.,1.1973684210526316,0.0385329996278268,152,127,20,5
Your voice has an echo.,1.1973684210526316,0.03964757793433007,152,128,18,6
"Honey, I'm pretty sure I heard Tom say not to stick your head in the lion's mouth.",1.1973684210526316,0.03497680564454209,152,124,26,2
Trying to relive your circus days as a lion tamer is just not worth it.,1.1973684210526316,0.0385329996278268,152,127,20,5
Well if it’s any consolation I can’t imagine it was easy to put his trophy up on his wall.,1.1973684210526316,0.03964757793433007,152,128,18,6
"Fred, Now that lion is really stuffed!",1.1973684210526316,0.03964757793433007,152,128,18,6
Did you make sure the lion was dead? Did you?,1.1973684210526316,0.03738520676119665,152,126,22,4
"My, it certainly is an ideal trophy for a former lion tamer.",1.1972789115646258,0.039377619808549695,147,123,19,5
I told you not to put that thing up.,1.1972789115646258,0.03565155061761026,147,120,25,2
Don't go much farther down.,1.1972789115646258,0.03293413337570795,147,118,29,0
I told you not to mess with the neighbor's kitty...,1.1972789115646258,0.03565155061761026,147,120,25,2
Some conspiracy theories are real.,1.1970443349753694,0.031278589458884086,203,167,32,4
Your very last selfie?,1.1970443349753694,0.032048767663965534,203,168,30,5
They say trophies separate the winners from the losers. I didn't know they meant it literally.,1.196808510638298,0.03444787645967674,188,157,25,6
'Mfffh-hffm',1.196808510638298,0.03444787645967674,188,157,25,6
Wasn't 2021 supposed to be good?,1.1967213114754098,0.03237901592324459,183,150,30,3
"So, how's that catnip cheese?",1.1967213114754098,0.03237901592324459,183,150,30,3
"Oh, honey! I don't think you can have your wine now",1.196629213483146,0.03478310041387025,178,148,25,5
"A little higher, it'll be easier to vacuum the rug.",1.196629213483146,0.03385829443921487,178,147,27,4
"No, no it's still crooked. Dad always said I should marry a man with a level.",1.1965317919075145,0.036350298975678354,173,145,22,6
"Give it up, Norman, you're never gonna run away with the circus!""",1.1965317919075145,0.037263354260545195,173,146,20,7
He just needed a quick snack.,1.1964285714285714,0.03705255687749121,168,141,21,6
He doesn’t bite!,1.1964285714285714,0.03607777670159304,168,140,23,5
Watch the rigor mortis.,1.1964285714285714,0.03188200078431655,168,136,31,1
"You always said, “Turn about was fair game.”",1.1964285714285714,0.03404458801146792,168,138,27,3
"Oh, absolutely, hon. Ringling Brothers will HAVE to take you now.",1.1964285714285714,0.032981024444987656,168,137,29,2
"Honey,you said you weren’t seeing anyone else!",1.1964285714285714,0.030743714391423968,168,135,33,0
Ed do you regret running away from the circus?,1.1964285714285714,0.03404458801146792,168,138,27,3
"I know we discussed lionising you, but isn’t this going too far!",1.196319018404908,0.03465773365749465,163,134,26,3
Move 2 feet to the right and then step forward.,1.196319018404908,0.037793909408668336,163,137,20,6
"Honey, the trophy from Fred on safari is crooked again.",1.196319018404908,0.036778243926969906,163,136,22,5
"I told you to put it a little higher,dear!",1.196319018404908,0.03573372166893295,163,135,24,4
Apparently Siegfried and Roy have nothing on you.,1.196319018404908,0.0397474566792454,163,139,16,8
"If you can keep your head when all about you   
    Are losing theirs and blaming it on you...",1.196319018404908,0.03465773365749465,163,134,26,3
"Welcome to Narnia""",1.196319018404908,0.03465773365749465,163,134,26,3
We can put on Game of Thrones instead,1.1962025316455696,0.03414315627610505,158,129,27,2
How... Tasteful.,1.1962025316455696,0.038577943709175604,158,133,19,6
"I said, 'IT MEANS NO WORRIES'!",1.1962025316455696,0.038577943709175604,158,133,19,6
No dear! A bit more to the left!,1.1962025316455696,0.03414315627610505,158,129,27,2
"That’s my late husband, Robert Browning, hanging on the wall.",1.1962025316455696,0.03751842328436623,158,132,21,5
Didn't you tell me last night you wanted a lion?,1.1962025316455696,0.0353041183940058,158,130,25,3
"Phil, it's not over 'til it's over.",1.196078431372549,0.038302050691219065,153,128,20,5
"George, that's one helleva way to be lionized.,,",1.196078431372549,0.038302050691219065,153,128,20,5
"It's just like in Tanzania, dear: more to the left.",1.196078431372549,0.038302050691219065,153,128,20,5
I am woman.,1.195945945945946,0.03913335823054826,148,124,19,5
Do you remember what I went through to get this trophy?,1.195945945945946,0.03913335823054826,148,124,19,5
