caption,mean,precision,votes,not_funny,somewhat_funny,funny
Cutting a hole in the back to see the nail was a great idea!,1.3212121212121213,0.0462870305105758,165,123,31,11
The cat got your tongue Ed?,1.3210526315789475,0.044595333716632324,190,144,31,15
"Herb, you do this every cocktail  hour.  Give it up .  We know you won .",1.3209876543209877,0.04520936054380971,162,119,34,9
This is what happens when you lionize Trump.,1.320855614973262,0.04697406389719763,187,145,24,18
"How about this, Gladys?! Does this make you happy!?",1.320855614973262,0.04314576041063998,187,139,36,12
I told you the nude would have been better.,1.320855614973262,0.04380705020518909,187,140,34,13
"Lower on the left, George.",1.320855614973262,0.04380705020518909,187,140,34,13
Shake your head!  He’ll puke!,1.320754716981132,0.04831427474293785,159,120,27,12
I warned you he'd get back at you some day!,1.320754716981132,0.047483235441954395,159,119,29,11
"That's right honey, let him know who's boss.""",1.3206521739130435,0.045621263110009844,184,140,29,15
"Um, dear... just curious, is your life insurance paid up?",1.3206521739130435,0.04081083102626945,184,133,43,8
Not sure if that's the head-shot we want.,1.3206521739130435,0.04153216175805556,184,134,41,9
"I told you, Harry. Karma's a bitch.",1.3205128205128205,0.04636245476149804,156,115,32,9
"Well, that's ironic.",1.3204419889502763,0.04341696301842774,181,134,36,11
I thought you fed it!,1.3204419889502763,0.041241612664012314,181,131,42,8
"This doesn't cancel our Zoom with the Nussbaums 
in an hour.",1.3204419889502763,0.04341696301842774,181,134,36,11
"no, irony would be if you were being sucked in by an ebay auction —
oh, wait, i get it, yes, it's ironic",1.3204419889502763,0.046818473370761365,181,139,26,16
"What do you think Leon, cat got your tongue?",1.3204419889502763,0.04270416049448213,181,133,38,10
"I don't know, you just seem like you are in a different headspace these days.",1.3204419889502763,0.044808563759102894,181,136,32,13
You can’t both play dead!,1.3204419889502763,0.04411825055403439,181,135,34,12
I guess I still have the lion's share of my husband.,1.3202614379084967,0.04787682960264073,153,114,29,10
I just love how much of yourself you put into your art.,1.3202614379084967,0.0460455447224733,153,112,33,8
So... this is what you meant when you said you wanted to get ahead in life?,1.3202247191011236,0.044627289480707245,178,133,33,12
Is he the one you trained at the circus?,1.3202247191011236,0.044627289480707245,178,133,33,12
"Oh,Donald Trump Jr. what a fitting way for you to die!",1.3202247191011236,0.046027762388937264,178,135,29,14
You'll never find it like that.  Let me get you a flashlight.,1.3202247191011236,0.043181419873103054,178,131,37,10
Say again? I can barely hear you.,1.3202247191011236,0.04244001708515687,178,130,39,9
Shall I call the fire department or the dance instructor?,1.3201970443349753,0.041957187728251785,203,152,37,14
"Listen Herb, you can't just go all 'Siegfried and Roy' on me every time I ask you to sit down and discuss finances.",1.32,0.04441925942148704,175,130,34,11
"Simba! Bad kitty, Simba.",1.32,0.04441925942148704,175,130,34,11
"Let him go, Leo.  I swear I haven't told him about us.",1.32,0.042142926720601596,175,127,40,8
I guess the cat really does have your tongue,1.32,0.043673666694720926,175,129,36,10
"You were right as always, dear.  I *do* like it more as time passes.",1.32,0.04291512224810487,175,128,38,9
"Well, it's not level.",1.32,0.041793942962368456,200,149,38,13
"Accept it, Harold. You're not snatching victory.",1.32,0.043673666694720926,175,129,36,10
"""Am I boring you?""",1.32,0.04515254203857359,175,131,32,12
"Oh, he likes you!",1.3197969543147208,0.03969895777569541,197,143,45,9
This is weird. Now you've got eyes in the back of your head.,1.3197969543147208,0.044613744496800646,197,151,29,17
"Next time, less Siegfried and more Roy.",1.3197969543147208,0.042227914029124486,197,147,37,13
Look Robert! I want to talk about our relationship and I’m not falling for your ‘the cats got my tongue’ excuse anymore.,1.319767441860465,0.044944618405000886,172,128,33,11
"""What, did you think I would buy a fake one?""",1.319767441860465,0.045694837559351234,172,129,31,12
I am woman...hear me roar.,1.319767441860465,0.04643293696913699,172,130,29,13
"I agree, George.  It is quite lifelike.",1.319767441860465,0.04340529704497413,172,126,37,9
I thought only the females hunted.,1.319767441860465,0.044944618405000886,172,128,33,11
I knew those eyes have been following me!,1.3195876288659794,0.04204381606325179,194,144,38,12
"Karma's a bitch, isn't it George.",1.3195876288659794,0.04009282503332157,194,141,44,9
"Didn't I tell you not to say ""Heads you win""!",1.319526627218935,0.04310175653323499,169,123,38,8
Talk about feeding the head that bites you!,1.319526627218935,0.04625506381780278,169,127,30,12
I told you before that safari that payback is hell.,1.319526627218935,0.04470622073626484,169,125,34,10
What did you do to make him mad this time?,1.3193717277486912,0.042490115105893005,191,142,37,12
Wow. You really failed the dismount!,1.3193717277486912,0.0431337626773279,191,143,35,13
"Really, that is so 2020!",1.3193717277486912,0.042490115105893005,191,142,37,12
I don't think he likes to be touched.,1.3193717277486912,0.044393070232729606,191,145,31,15
"While you're in there, see if you can find my keys.",1.319277108433735,0.046834172302435126,166,125,29,12
Stop complaining.  You get to stand in here.  His ass is out in the cold.,1.319277108433735,0.045248215379157374,166,123,33,10
How can you not see that it’s too high on the left??,1.319277108433735,0.045248215379157374,166,123,33,10
Are you sure you’ve played hide-and-seek before?,1.319277108433735,0.046834172302435126,166,125,29,12
Not quite the same thing as when a lion tamer does it dear.,1.319277108433735,0.04443401450320272,166,122,35,9
"See, this rarely happens in small game hunting.",1.3191489361702127,0.04425431263460658,188,142,32,14
I changed my mind- this doesn't really go with our decor.,1.3191489361702127,0.04021328668676121,188,136,44,8
"""I wish.",1.3190184049079754,0.04977075483646028,163,126,22,15
"Honey, it's so spooky--- no matter where I stand, I feel like he's watching me!",1.3190184049079754,0.04580858245783624,163,121,32,10
"It's not your head I'm worried about, it's your lower back.",1.3190184049079754,0.04146956012066838,163,116,42,5
Next time don't choose the taxidermist with the low price.,1.3190184049079754,0.043257428734028915,163,118,38,7
Karma's a bitch isn't it Bob?,1.3190184049079754,0.04743318406847935,163,123,28,12
"He has your head, but I have your heart.",1.3190184049079754,0.04580858245783624,163,121,32,10
Can you at least check if the remote is in there?,1.318918918918919,0.04134340146156312,185,135,41,9
Perfect!! Just like that!,1.318918918918919,0.04134340146156312,185,135,41,9
I guess he wasn’t stuffed.,1.318918918918919,0.04342280580701183,185,138,35,12
I told you it was too wild for our decore.,1.318918918918919,0.044755434053469385,185,140,31,14
Nope. Still a bit more to the left.,1.318918918918919,0.044755434053469385,185,140,31,14
"Trust me, you're no trophy!",1.31875,0.04805319624969103,160,121,27,12
I would be more impressed if it was alive,1.31875,0.04722809881426588,160,120,29,11
Will you please just tell people I died of COVID-19?,1.3186813186813187,0.04659379606991243,182,140,26,16
This model was only supposed to sing The Lion Sleeps Tonight!,1.3186813186813187,0.041785074571418064,182,133,40,9
"Hey Alexa, he asked for decaf, not decap.",1.3186813186813187,0.04527202553911643,182,138,30,14
"Oh, like you didn't know this would happen.""",1.3186813186813187,0.04105215815330396,182,132,42,8
I hate to think what's hanging in his den.,1.3186813186813187,0.043213632024271524,182,135,36,11
I told you it was too low.,1.3184713375796178,0.045217293942080586,157,115,34,8
You put the  television control in the zebra.,1.3184713375796178,0.04698853377262087,157,117,30,10
"Honey, I’m going to the store for more wine.",1.318435754189944,0.04511445004387252,179,135,31,13
"Cats got your tongue now, honey.",1.318435754189944,0.045804850195137026,179,136,29,14
"Revenge is a dish best served cold, Ralph.",1.3181818181818181,0.04346285852125068,176,130,36,10
"Really, Frank, you both left the circus years ago.",1.3181818181818181,0.044932062057158946,176,132,32,12
"Should I call the doctor first, or the interior designer?",1.3181818181818181,0.045792816505496894,154,113,33,8
At least now you can’t put your foot in your mouth.,1.317948717948718,0.042486545113173194,195,146,36,13
"It's a little off center, Roy. Get your head in the game!",1.317948717948718,0.042486545113173194,195,146,36,13
I think it would look better in the other room,1.317948717948718,0.041859747031587444,195,145,38,12
Fred..Fred!...my mother isn't coming!..,1.3179190751445087,0.04396440640277733,173,128,35,10
Have you located the stud?,1.3179190751445087,0.04472228041451216,173,129,33,11
I told you we shouldn't have replaced the old batteries!,1.3179190751445087,0.04620074713384661,173,131,29,13
"Yes, Harold. He is very lifelike.",1.3179190751445087,0.04396440640277733,173,128,35,10
I’m sensing a shift in bragging rights.,1.3178807947019868,0.04825508098894511,151,113,28,10
"A little to the left, I think.",1.3177083333333333,0.04294074908025697,192,144,35,13
"Ok, you’re right. You do have enough guts to put your head in the mouth of a lion.",1.3176470588235294,0.039509284982702404,170,120,46,4
You promised your circus days were over.,1.3175355450236967,0.041339869920368665,211,159,37,15
"Luckily, we didn’t keep the backside.",1.3175355450236967,0.041339869920368665,211,159,37,15
"""I only asked if you are ever going to commit. What's the matter Steve? Cat got your tongue?""",1.3174603174603174,0.044051916448666795,189,143,32,14
"Bad Elsa, you spit out the Senate Minority Leader right now!""",1.3174603174603174,0.0453116532854409,189,145,28,16
Herbert! I told you not to learn taxidermy from TikTok!,1.3174603174603174,0.04275507878767893,189,141,36,12
I still think performance art is more suitable for the bedroom.,1.3174603174603174,0.039326331007245204,189,136,46,7
Don’t put it there. It will eat up all the space!,1.3174603174603174,0.04209167936553244,189,140,38,11
Never look a gift lion in the mouth,1.3173652694610778,0.04501706732852322,167,124,33,10
"I said, a little to the left!  Do you even listen to me anymore?",1.3173652694610778,0.045811365595815993,167,125,31,11
"Pull  his hair...Play dead... No wait, shoot him again.",1.3173652694610778,0.04811565045213122,167,128,25,14
"Ok,Margaret, next time we go with the impressionist.",1.3172413793103448,0.04961870734287213,145,109,26,10
"If you weren't enjoying yourself, you should have just left.",1.3172043010752688,0.0425450668748997,186,138,37,11
Just hold on......I have to get my camera for this !,1.3172043010752688,0.043222741168943556,186,139,35,12
"Dear, it's only 3 weeks more until your 1st vaccine.",1.3172043010752688,0.04519483676772036,186,142,29,15
"NO, being a trophy wife doesn't mean I have any experience in solving this problem.",1.3172043010752688,0.0425450668748997,186,138,37,11
"Sorry dear, can't help you.  What goes around comes around.",1.3170731707317074,0.0438974509610867,164,120,36,8
Those edibles are really kicking in aren’t they ?,1.3169398907103824,0.04301211020510221,183,136,36,11
Easy there Siegfried - as a single woman in New York City you had me at rent controlled apartment!,1.3167701863354038,0.047794819173068055,161,122,27,12
"Honey he’s so stuffed, he can’t eat much more of you.",1.3166666666666667,0.04277392825714615,180,133,37,10
I told you this spot was bad feng shui.,1.3164556962025316,0.04758846906261719,158,119,28,11
"Jerry, stop roughhousing with the cat. You’re going to get hurt!",1.3163841807909604,0.04471363754208912,177,133,32,12
It used to belong to Siegfried & Roy,1.3163841807909604,0.04398986300112271,177,132,34,11
"See, nothing--the bad breath is yours.",1.3163841807909604,0.04471363754208912,177,133,32,12
Don’t you hear me? Straighten by turning it down on your left.,1.316326530612245,0.04528754433564404,196,152,26,18
A little more to the left and perfecto.,1.316326530612245,0.04040213709564586,196,144,42,10
"Oh, Hank.  This does explain what happened to Cuddles and Patches.",1.316326530612245,0.041044625782830066,196,145,40,11
"Technically you're right, he didn't bite the hand.",1.3161290322580645,0.04645347480325674,155,115,31,9
Wouldn’t a painting in front of the wall safe have been sufficient?,1.3161290322580645,0.04908448698907763,155,118,25,12
"George, should I push or pull?",1.3161290322580645,0.050762793698767995,155,120,21,14
At least it is better than the Trump  picture!',1.3160919540229885,0.04808986509511792,174,135,23,16
Now take 5 steps to the right.,1.3160919540229885,0.04450203685889274,174,130,33,11
"You promised to give all this up when you retired from the circus, Frank .",1.3157894736842106,0.04123295799249142,190,140,40,10
"While you are in there, look for the Jurgensons.",1.3157894736842106,0.04426029599871416,171,127,34,10
But can you see the hook?,1.3157894736842106,0.0465335594029406,171,130,28,13
You are exuding masculinity dear.,1.3157894736842106,0.04426029599871416,171,127,34,10
I think he likes you.,1.3157894736842106,0.04190288316270683,190,141,38,11
"Come on, George, this is all a Big Game to you!",1.3157894736842106,0.0461303680908071,152,112,32,8
"The question remains, is it your trophy or is it his trophy.",1.3157894736842106,0.04706537194088697,152,113,30,9
"I told you, you should have gone fishing!",1.3157894736842106,0.04578834678280707,171,129,30,12
"Honey, I told you we should have gotten the moose.",1.3157894736842106,0.04347613543415962,171,126,36,9
I'll get the spray bottle!,1.3155080213903743,0.04166653213869419,187,138,39,10
The Murray kids next door must have pulled his tail again.,1.3154761904761905,0.046352470661044774,168,127,29,12
Do you still want me to hand this to you?,1.3154761904761905,0.04557702861040093,168,126,31,11
"Well, it's only fair. After all, you shot him.",1.3154761904761905,0.04316720443420177,168,123,37,8
Honey I think this is too much for a mask.,1.3152709359605912,0.04185111561390127,203,153,36,14
I knew we should have gone with the deer. At least it's a vegetarian.,1.315217391304348,0.044845167790266996,184,140,30,14
"Sorry, Honey.  But it does seem fair.",1.315217391304348,0.04281237531846924,184,137,36,11
You just can't take this lion down.,1.315217391304348,0.04350052886634885,184,138,34,12
Maybe he's trying to tell you he'd prefer to be put in the den.,1.315217391304348,0.04281237531846924,184,137,36,11
Bad kitty!,1.3151515151515152,0.04771656633278765,165,126,26,13
I think it would go better in the den.,1.3151515151515152,0.046141641091063744,165,124,30,11
So I am guessing you are upset.,1.3151515151515152,0.0436728926515564,165,121,36,8
"Hon, I'm certain the marriage counselor told us to ""read between the LINES"" !",1.3151515151515152,0.0507199174153595,165,130,18,17
"Fine, you've made your point. Figuratively, it's time to get your head in the game.",1.3151515151515152,0.046141641091063744,165,124,30,11
Now what makes you think the remote would be there?,1.3151515151515152,0.0436728926515564,165,121,36,8
It’s still not centered.,1.315,0.04168408346204043,200,150,37,13
"You know,it looks better that way.",1.315,0.04287266409535529,200,152,33,15
It's still tilted. Take a small step to the right,1.315,0.04168408346204043,200,150,37,13
"That is not what I meant by '""Stick it where the sun don't shine!""",1.3149171270718232,0.04669879312377888,181,140,25,16
"Ralph, you’re not listening to me!",1.3149171270718232,0.04399122483402074,181,136,33,12
"Issac, you’re being consumed by your pride!",1.3148148148148149,0.04589775548385575,162,121,31,10
"Quick,last wishes,mount your head next to his?",1.3148148148148149,0.04331928265970286,162,118,37,7
"Just a bit to the left, and don't get any blood on the carpet.",1.3146067415730338,0.04077504949981512,178,129,42,7
What did you just say about karma? Your voice is muffled.,1.3146067415730338,0.043778128671605215,178,133,34,11
Now can you find the nail hole?,1.3146067415730338,0.04304700428506971,178,132,36,10
At least this time you didn't put your head up your ass.,1.3146067415730338,0.04520491670300087,178,135,30,13
Will you be free for dinner?,1.3146067415730338,0.043778128671605215,178,133,34,11
I did remind you to pay the taxidermist.,1.3144329896907216,0.04255965050364756,194,146,35,13
Down a bit on the left.,1.3144329896907216,0.04063343452115038,194,143,41,10
"Finally — my trophy husband, a real Leo.",1.3142857142857143,0.04645540464960787,175,134,27,14
'Now who's the king of beasts?,1.3142857142857143,0.04784838044429914,175,136,23,16
"Don't worry, I'll put yours right next to it.",1.3142857142857143,0.04353594883761751,175,130,35,10
Hang on Leonard - there's got to be a way to give it the Heimlich maneuver.,1.3142857142857143,0.04501934840904774,175,132,31,12
I told you not to use the cheapest taxidermist.,1.3142857142857143,0.04501934840904774,175,132,31,12
It's still better than that singing fish.,1.314102564102564,0.043430717555876214,156,113,37,6
I find it easier to enter Narnia through the painting or the wardrobe.,1.314102564102564,0.048810912130906235,156,119,25,12
This is not what I meant when I called you a trophy husband.,1.314102564102564,0.04708587018600659,156,117,29,10
"Probably not what you want to hear, but QAnon did predict this.",1.313953488372093,0.046298641954541864,172,131,28,13
I told you to lose the hair gel. He obviously thinks you're Don Jr.,1.313953488372093,0.046298641954541864,172,131,28,13
Maybe he'll let go if you move him back into the sun.,1.3138297872340425,0.04348695324779555,188,142,33,13
"Honey, it's still crooked.",1.3138297872340425,0.044776039235800064,188,144,29,15
It was fine already—I told you not to lose your head over this.,1.3137254901960784,0.0386685486634642,204,149,46,9
"What goes around comes around, Donald.",1.3137254901960784,0.048605058261684916,153,116,26,11
I told you that hunting trip would come back to bite you.,1.3136094674556213,0.042123599741049296,169,123,39,7
"I don't know dear, it's a little too life-like for me...",1.3136094674556213,0.042123599741049296,169,123,39,7
"Trust me Clarence, I already looked for the keys there.",1.3136094674556213,0.04376393962400437,169,125,35,9
My mother calls and suddenly the cats got your tongue,1.3136094674556213,0.04687272046673036,169,129,27,13
This is it! No more redecorating during the pandemic.,1.3136094674556213,0.04687272046673036,169,129,27,13
Did you find my keys?,1.3135135135135134,0.041919364783321096,185,137,38,10
"Frank, I can still see you.",1.3135135135135134,0.03976141250126384,185,134,44,7
Maybe a little to the left.,1.3135135135135134,0.04397154038214515,185,140,32,13
"Jerry, I don't think that's how you get to Narnia.",1.3134328358208955,0.04268761088380624,201,153,33,15
"To _his_ left, not yours!",1.3132530120481927,0.04428278942178168,166,123,34,9
The right side has to go up a little.,1.3131868131868132,0.043084136760492345,182,136,35,11
Can you get it up a little higher? And a little to the left. No right. No left. And maybe down just a smidge.,1.3131868131868132,0.044470983530690934,182,138,31,13
"A little lower, dear.",1.3131868131868132,0.0423736955256645,182,135,37,10
"If you get a chance, go up on the right.",1.3131868131868132,0.0423736955256645,182,135,37,10
"Jesus, Adam! You said your circus days were behind you.",1.3131313131313131,0.042539574604401276,198,150,34,14
"All right already, I'll scratch your back!",1.3131313131313131,0.04372829442617219,198,152,30,16
It's open season for headhunters,1.312883435582822,0.04647823840144727,163,123,29,11
"Here, drink this and you won't feel so suicidal.",1.312883435582822,0.04647823840144727,163,123,29,11
Don't put it there - it swallows up the space.,1.312849162011173,0.0442828482871078,179,135,32,12
The truth will set you free Harold.,1.312849162011173,0.044986012837957556,179,136,30,13
His name is Karma.,1.312849162011173,0.04284191003145465,179,133,36,10
I TOLD you not to go with the discount taxidermist,1.312849162011173,0.04210295187401209,179,132,38,9
"A little more to the left, and try to get your whole shoulder in.",1.312849162011173,0.04356833659644502,179,134,34,11
"George, there’s someone on the phone for you. A Karma-somebody. They said you were expecting their call.",1.312849162011173,0.0442828482871078,179,135,32,12
"Honey, get that out of your mouth you don't know where that things been.",1.312849162011173,0.04284191003145465,179,133,36,10
"At some point, if you want to replace Siegfried and Roy, you'll have to start using live animals.",1.3128205128205128,0.03979791295665836,195,143,43,9
Are you certain that he has a cavity?,1.3128205128205128,0.04110486666948538,195,145,39,11
Who’s ‘King of the Jungle’ now?,1.3128205128205128,0.04110486666948538,195,145,39,11
So how much did you pay for that online taxidermy class?,1.3125,0.0410149244297003,176,128,41,7
Yes. Neo-Surrealism is difficult to live with.,1.3125,0.042695628191498324,160,116,38,6
I think he is still angry that you shot him.,1.3125,0.04153009905357379,192,143,38,11
Don’t try hiding in there and go and greet my parents,1.3125,0.04179903217670346,176,129,39,8
Is there something wrong with the lampshade?,1.3125,0.04589675130229494,192,150,24,18
But we always hang The Lion in Winter.,1.3125,0.04790213752928165,160,122,26,12
"Yes honey, I'm fine put the wine in this hand.",1.3125,0.04332469527624194,176,131,35,10
What were you looking for?,1.3125,0.04179903217670346,176,129,39,8
I told you it looked too lifelike.,1.3125,0.04707439248331258,160,121,28,11
Maybe your Dogs Playing Poker wall covering wasn’t so bad after all.,1.3121387283236994,0.04678984768552909,173,133,26,14
You should have shot it first,1.3121387283236994,0.04750266499430007,173,134,24,15
"OK This is bad, but lets not lose our heads",1.3121387283236994,0.043822785237046,173,129,34,10
"When you’re done, do you think you could hang up the antique musket?",1.3121387283236994,0.043822785237046,173,129,34,10
Where did you say you kept your insurance policy?,1.3121019108280254,0.04682775606338453,157,118,29,10
Maybe if you hold still he'll be able to relax and open his mouth.,1.3121019108280254,0.04505019537444462,157,116,33,8
Enough already. I didn't call YOU cowardly.,1.311881188118812,0.04072863685079608,202,151,39,12
You showed him.,1.3118279569892473,0.04442600386782021,186,142,30,14
I guess some of the big cats have more than nine lives.,1.3118279569892473,0.04571558921417482,186,144,26,16
Please don't leave holes in the wall.,1.3118279569892473,0.042418178925552386,186,139,36,11
You and your foolish pride.,1.311764705882353,0.04511518714327072,170,128,31,11
"I guess you won't be needing this glass of wine after all, George.",1.311764705882353,0.04273802964748733,170,125,37,8
Has the big cat got your tongue?,1.3114754098360655,0.04357676187148371,183,138,33,12
"Well, I think we can scratch lion tamer off the job list.",1.3114754098360655,0.044933647258576896,183,140,29,14
I told you MGM takes intellectual property very seriously.,1.3114754098360655,0.042882221663842084,183,137,35,11
"Honey, please get me your whip from our bedroom?",1.3114754098360655,0.04217624561823608,183,136,37,10
"I’ve had enough of this party, too, but there are better ways to get out of this.",1.3114754098360655,0.042882221663842084,183,137,35,11
"A bit to the left, no, the other left""",1.311377245508982,0.04405677386109729,167,124,34,9
Bad Kitty! Bad Kitty! How dare you eat my trophy husband!,1.311377245508982,0.04323024931867899,167,123,36,8
Ha! No wonder he was on sale,1.311377245508982,0.04323024931867899,167,123,36,8
Is this a big game?,1.3112582781456954,0.05076494807082595,151,117,21,13
I knew this would come back to haunt me,1.3112244897959184,0.0402813581031531,196,145,41,10
"Honey, one of you has bitten off more than you can chew.",1.3111111111111111,0.04115713698524718,180,132,40,8
"Were you calling me, dear?",1.3111111111111111,0.04190445288096708,180,133,38,9
"If I said you don't look ridiculous, I'd be lyin.",1.3111111111111111,0.044070431249825036,180,136,32,12
Cats got your tongue! Really!!  This is how you want to start this conversation.,1.3109756097560976,0.04373867990289973,164,121,35,8
"George, you said you were going to give ME head tonight!",1.3109756097560976,0.04703550697076911,164,125,27,12
"Honey! No, I said, ""Hurry, get in the LINE!""",1.3109756097560976,0.04782421578117623,164,126,25,13
Exactly which Trump recommended this taxidermist?,1.3109756097560976,0.04458574681145939,164,122,33,9
I said to make it look like an accident!,1.310880829015544,0.04387923493770549,193,148,30,15
"Honey, I told you to stop using that Gorilla Glue on your toupee.",1.3108108108108107,0.04968308403335294,148,113,24,11
My psychic was certain I'd meet a Leo,1.310734463276836,0.04457958772520553,177,134,31,12
Maybe you should’ve just left him in the mighty jungle.,1.310734463276836,0.04599719896390266,177,136,27,14
"OK. Forget the tribal dance, just hang it like a normal person.",1.310734463276836,0.04385360083689274,177,133,33,11
"Men will do anything to get head,",1.310734463276836,0.04457958772520553,177,134,31,12
I told you the Taxidermy for Dummies book was a bad idea.,1.310734463276836,0.03838917762400085,177,126,47,4
I'm wondering which of you is the trophy,1.310734463276836,0.043115391346637964,177,132,35,10
Wait till they see my trophy husband!,1.310734463276836,0.04529393973962821,177,135,29,13
"If you’re trying to be funny John, try the lampshade.",1.31055900621118,0.04247398257779311,161,117,38,6
"I said, ""Pray the wall holds,"" not, ""the wall holds the prey.""",1.3105263157894738,0.044987992261737594,190,147,27,16
