caption,mean,precision,votes,not_funny,somewhat_funny,funny
Serves you right for buying Don Jr's book.,1.2650602409638554,0.040233595659601044,166,128,32,6
"Meet you in Narnia, honey! But I will go through the wardrobe.",1.2650602409638554,0.040233595659601044,166,128,32,6
That's not funny.,1.2650602409638554,0.04286957277701307,166,131,26,9
"I told you not to ask him to wear a mask, George!",1.2650602409638554,0.04113102928238062,166,129,30,7
I don't think that's where you put your keys.,1.2650602409638554,0.04371292280563499,166,132,24,10
I'll tell the photographer to come back tomorrow.,1.2650602409638554,0.04113102928238062,166,129,30,7
"That's close, but it needs to go down a bit on the left.",1.2650602409638554,0.03837581946284275,166,126,36,4
"Well, that's one way to guarantee it's stuffed.",1.2650602409638554,0.04286957277701307,166,131,26,9
It’s too low and needs tilted to the left a bit  Harry!,1.265,0.03715883333034506,200,155,37,8
"911, call the taxidermist!",1.2649006622516556,0.045748121958067656,151,120,22,9
"OK, nice job. everybody left our party.  Nobody but you wants to play your ""put your head in the lion's mouth"" game.",1.2648648648648648,0.03909283507072205,185,144,33,8
It's poetic justice. You took his head on his turf. Now he's got your head on your turf.,1.2648648648648648,0.038333997277693106,185,143,35,7
This is how you practice for your Senate confirmation hearing?,1.2648648648648648,0.04056794999784513,185,146,29,10
"Very funny Jack. I still say its eyes follow me around the room, so get rid of it now.",1.2647058823529411,0.04216893547604273,170,134,27,9
"I warned you, he had been a circus lion.",1.2647058823529411,0.04216893547604273,170,134,27,9
Bad kitty! We haven't decided yet if he's husband material.,1.2647058823529411,0.04216893547604273,170,134,27,9
"Oh honey, it's just a metaphor.",1.2645739910313902,0.03521440654526081,223,173,41,9
"No, Chardonnay won’t help!",1.2645502645502646,0.04203149526063296,189,152,24,13
"I just wanted to see how it looked in here, you don’t have to bite my head off!",1.264516129032258,0.043009356212492286,155,121,27,7
I knew we should've put it in the study and not the den.,1.264367816091954,0.03986518060165665,174,135,32,7
Hold still. There’s a boa in the bedroom that can pull you out.,1.264367816091954,0.04229131031983447,174,138,26,10
And that's why I bought it...,1.264367816091954,0.0381621682860414,174,133,36,5
Just hope that the lion is a vegan.,1.2641509433962264,0.0403519566651928,159,122,32,5
Now is not the time to lose your head over this!,1.2641509433962264,0.042278876504817556,159,124,28,7
"He said to treat it like a gift horse, i.e., never look in its mouth.”",1.2641509433962264,0.04132664881900788,159,123,30,6
Hey it looks like the cat got my ...... tongue !,1.2641509433962264,0.042278876504817556,159,124,28,7
A little to the left darling,1.2641509433962264,0.042278876504817556,159,124,28,7
"No, that’s our cat door.",1.2641509433962264,0.04412172243135608,159,126,24,9
"I told you that you would be in serious trouble if you bought a body spray called ""gnu""!",1.2641509433962264,0.0432101249062025,159,125,26,8
I told you not to look a gift mounted lion head in the mouth.,1.2640449438202248,0.04007146524885307,178,139,31,8
Pay back time! Told you to quit while you had a head.,1.2640449438202248,0.04085587227387088,178,140,29,9
"I know you miss the circus, Ken.",1.2640449438202248,0.04162550025318211,178,141,27,10
I told you there was something off about that taxidermist.,1.2640449438202248,0.03845467959887866,178,137,35,6
I think I found Bernie’s mittens.,1.2640449438202248,0.04162550025318211,178,141,27,10
Lost the remote again?,1.263959390862944,0.038176242025278834,197,154,34,9
I don’t think you have to obsess about getting it level.,1.2638888888888888,0.0451472931629876,144,113,24,7
"Larry, I told you to it’s probably under the couch cushions!",1.2638036809815951,0.04158145875937286,163,127,29,7
"Nice work, your boss won’t believe me this time.",1.2638036809815951,0.03875302086858048,163,124,35,4
Now why would your keys be in THERE?,1.2638036809815951,0.04336471418832697,163,129,25,9
This story is definitely going under 'worst first date fail' in my dating profile. No one is going to believe this. Are you O.K. by the way? I feel like you're overreacting.,1.2638036809815951,0.04158145875937286,163,127,29,7
"Face it, you're no Bert Lahr.",1.2638036809815951,0.04158145875937286,163,127,29,7
Raise the right side a little.,1.2638036809815951,0.04248244431051909,163,128,27,8
'Even the head understands it doesn't go with the interior!',1.2638036809815951,0.04248244431051909,163,128,27,8
You said you wanted more spontaneity in our relationship.,1.2638036809815951,0.04336471418832697,163,129,25,9
"No, I said , take the bull by the horns.",1.2638036809815951,0.04158145875937286,163,127,29,7
I told you not to use Craigslist to find a taxidermist!,1.2638036809815951,0.03875302086858048,163,124,35,4
But they said NOT to feed it!,1.2637362637362637,0.03870147282946782,182,141,34,7
We've officially reached the misinterpreted Churchhill quotes level of quarantine.,1.2637362637362637,0.040239651277815675,182,143,30,9
You have good taste.,1.263681592039801,0.03562689311436449,201,154,41,6
He's been waiting years for you to get too close.,1.2635135135135136,0.045339404091624,148,117,23,8
Have you tried suspending his social media access?,1.2634730538922156,0.040914790907759784,167,130,30,7
Oh you weren’t exaggerating when you said the cat got your tongue!,1.2634730538922156,0.040023433737411664,167,129,32,6
It better than sticking your head up your ass!,1.2634730538922156,0.04347935965149285,167,133,24,10
Just don’t leave a stain on the carpet,1.2634730538922156,0.03817833828688122,167,127,36,4
"Honey, you need to move it a little to the right.",1.263157894736842,0.03853076306005052,171,131,35,5
Dentists.,1.263157894736842,0.039785734000971296,190,150,30,10
"Face it, Stu-- you couldn't tame him then, and you can't tame him now.",1.263157894736842,0.04276233097028002,171,136,25,10
"Honey, I think it lost its appetite years ago.",1.263157894736842,0.03941343871821078,171,132,33,6
"Harold, how many times did I tell you to stop playing with his whiskers?",1.263157894736842,0.04116180529410535,190,152,26,12
"I can't hear you, deer.",1.263157894736842,0.040276774960249236,171,133,31,7
Running out of Hide and Go Seek options with the kids?,1.263157894736842,0.03941343871821078,171,132,33,6
Tell him I am also a LEO!,1.263157894736842,0.03941343871821078,171,132,33,6
"You seem comfortable getting into his head, what about trying mine sometime",1.263157894736842,0.040276774960249236,171,133,31,7
"That’s almost it, but the feet should be perfectly flat on the floor, and you perfectly level.",1.263157894736842,0.03941343871821078,171,132,33,6
"So, do you still think it’s a jungle ‘out there’?",1.263157894736842,0.04250852548658323,152,118,28,6
"Take off the mask and be yourself, Larry.",1.263157894736842,0.04547955437628567,152,121,22,9
"Tilt it a little more towards his left molar, George.""",1.263157894736842,0.04639515559581379,133,104,23,6
Did you say Etsy?  Or Eatsy?,1.262857142857143,0.038828734906879,175,135,34,6
He got tired of you saying you were the KING,1.262857142857143,0.042849479336715776,175,140,24,11
You remind me of your mother when you behave this way.,1.262857142857143,0.042076079123842355,175,139,26,10
"Honey,are you sure this is how you prepare for a safari?",1.262857142857143,0.03966550263718428,175,136,32,7
"This is soooo weird, with your last name being Hairball and all.",1.262857142857143,0.043609165601045635,175,141,22,12
Oh what an exciting day -- he's no longer cowardly!,1.262857142857143,0.040484979244804646,175,137,30,8
Damn Karma,1.262857142857143,0.03966550263718428,175,136,32,7
I thought you knew that you were supposed to kill the thing before you mounted it on the wall.,1.262857142857143,0.03797353301283531,175,134,36,5
Somewhere there's a lioness chuckling.,1.262857142857143,0.040484979244804646,175,137,30,8
"After a couple of glasses of  wine, I see you can't resist being the lion tamer's son again.",1.2628205128205128,0.04276639324281545,156,122,27,7
Carole Baskin knew the police were gonna love this one.,1.2628205128205128,0.04276639324281545,156,122,27,7
You found  my keys too?  Great!  Now a little to the left.,1.2628205128205128,0.04078649800021505,156,120,31,5
"Honey, could you hand me the screwdriver, please?",1.2625698324022345,0.03826768678691019,179,138,35,6
I told you not to believe it when it said it had a toothache!,1.2625698324022345,0.040653756873561986,179,141,29,9
Are you sure he had dinner?,1.2625698324022345,0.040653756873561986,179,141,29,9
Have you considered renting a safety deposit box?,1.2625698324022345,0.03907923426397883,179,139,33,7
Give up already. You're never going to find your watch.,1.2625698324022345,0.03987426800954235,179,140,31,8
"Leo,is she gone yet?",1.2625698324022345,0.04141857851945868,179,142,27,10
"Leo, I can help you find the hook, if you just would ask.",1.2625,0.045632780201635956,160,129,20,11
"In the living room of a large carpeted apartment, a man in a white shirt is being devoured by a lion head mounted on the wall, with an explicatory plaque beneath it. The lion locks eyes with a woman, who walks up cautiously, a wine glass in her hand.",1.2625,0.04732423621500229,160,131,16,13
I told you he was still breathing.,1.2625,0.04297093869497203,160,126,26,8
"A little more to the left, Larry, and higher too, see if you can get it centered on the wall",1.2625,0.04297093869497203,160,126,26,8
"Brien, wouldn’t it have been just as funny if you’d put the lampshade on your head?",1.2624113475177305,0.042282149295294606,141,108,29,4
Thank God you went to see the Lion King and learned which end is which!,1.2622950819672132,0.03928817636165757,183,143,32,8
Enough with the drama. I am not biting your head off.,1.2622950819672132,0.0407879796334524,183,145,28,10
Down on the left.,1.2621951219512195,0.04135842831698485,164,128,29,7
"Big Mouth Billy Bass is ‘so yesterday’ you said. Big Mouth Billy Bass is too kitschy you said. Well, enjoy your Large Lips Larry Lion.",1.2621951219512195,0.04312949096645643,164,130,25,9
"Right side, a little higher.",1.2621951219512195,0.0422532400170497,164,129,27,8
Poacher's karma!,1.2621951219512195,0.04398829037497232,164,131,23,10
"Henry, don’t you go pull a Siegfried and Roy on me.",1.2621951219512195,0.03854957192485366,164,125,35,4
"When I asked you to feed the cat, I meant the one that sleeps on our bed.",1.2621951219512195,0.04312949096645643,164,130,25,9
I told you it would clash.,1.2621951219512195,0.04312949096645643,164,130,25,9
Your lion eyes tell me you've been on the cheatin' side of town.,1.2621951219512195,0.04044382392608218,164,127,31,6
They always said art imitates life,1.2620689655172415,0.045926696606912745,145,115,22,8
You can't hide your lion eyes.,1.2620320855614973,0.03872516679292352,187,146,33,8
"I warned you that he'd get back at you, one way or the other.",1.2620320855614973,0.041588971713787115,187,150,25,12
Oh no!  He's actuary intolerant!,1.2620320855614973,0.03872516679292352,187,146,33,8
You said that YOU are King of the Jungle.  Serves you right.,1.2619047619047619,0.04070074746107804,168,131,30,7
"Well, you’re the meathead who chose the cheapest taxidermist.",1.2619047619047619,0.03890988107192088,168,129,34,5
"That was Mr Whiskers for you, he always wanted to play.",1.2619047619047619,0.043248223572530546,168,134,24,10
"No, honey.  I don't think our safe word is going to work in this instance.",1.2619047619047619,0.04241606821417886,168,133,26,9
"I tried to warn you, what goes around comes around.",1.261744966442953,0.04300938393335905,149,116,27,6
Does white wine go with Bob?,1.261744966442953,0.04405112743045617,149,117,25,7
I told you to hang it higher.,1.2616279069767442,0.04254050804547336,172,137,25,10
Do I need to get some butter?,1.2616279069767442,0.03833663449946048,172,132,35,5
Didn't I tell you not to wear mutton chops!,1.2616279069767442,0.040910828795788036,172,135,29,8
stop it with the drama!,1.2615384615384615,0.03835830714086093,195,153,33,9
I hoped you would have learned your lesson from the snake.,1.261437908496732,0.04226479039206945,153,119,28,6
I guess he needs a trophy head too.,1.261437908496732,0.04123485412706176,153,118,30,5
"We're safe, it stops at the wall.",1.261437908496732,0.04327021861385808,153,120,26,7
"I know, Bob, but until you get the vaccine, you’re still safer working from home.",1.261437908496732,0.04327021861385808,153,120,26,7
"You know, it's amazing how much money I've saved on fresh meat for Mr. Whiskers since getting on Tinder.",1.261437908496732,0.04226479039206945,153,119,28,6
You should never get the cheapest taxidermist.,1.261437908496732,0.04226479039206945,153,119,28,6
Careful! He bites.,1.2613636363636365,0.03946775468628012,176,137,32,7
Stop fussing.......just move it to the other wall.,1.2613636363636365,0.03946775468628012,176,137,32,7
They can live for weeks without a head.,1.2611464968152866,0.04440480205790382,157,125,23,9
Found the car FOB!,1.2611464968152866,0.03954098960776125,157,120,33,4
"I told you,Harold. Big game hunting is not only unethical, it is also dangerous.",1.2611464968152866,0.03954098960776125,157,120,33,4
I still think a smidge down on the left.,1.2611464968152866,0.0415548853183028,157,122,29,6
A little more to the left.,1.261111111111111,0.03967894813932362,180,141,31,8
I said...I WANT A DIVORCE!,1.261111111111111,0.03808244257635737,180,139,35,6
That's a nice effect.,1.261111111111111,0.03808244257635737,180,139,35,6
You call this Pride Week?,1.2608695652173914,0.03871470607829881,207,165,30,12
"I don’t think that being in lockdown for almost a year is having much impact on our mental health, do you?",1.2608695652173914,0.04181605230798118,161,126,28,7
You should see how my eye is sticking out of my head right now. And you think YOU have problems?,1.2608695652173914,0.04181605230798118,161,126,28,7
"I always knew you'd get a head, dear. But I didn't imagine the head would get you.",1.2608695652173914,0.04181605230798118,161,126,28,7
"You could’ve hired someone to do your taxidermy, but, no.",1.2608695652173914,0.040877163295304914,161,125,30,6
Larry—i think the hook goes on the other side,1.2608695652173914,0.0391000647701035,184,144,32,8
"Bad boy, Leo!  Bad boy!",1.2608695652173914,0.03985237252998702,184,145,30,9
I knew they were too heavy for that hook.,1.2608695652173914,0.03755025968673369,184,142,36,6
"Well, dear. You often say 'you play foolish games, you win foolish prizes!'",1.2608695652173914,0.0427343185528518,161,127,26,8
I'd be lion if I said there wasn't any irony in this.,1.2606382978723405,0.039992576468757014,188,149,29,10
Too real. Stick with juggling.,1.2606382978723405,0.03779865463616994,188,146,35,7
"At long last, Leo had a chance to fulfill his destiny.",1.2606382978723405,0.03927488865896887,188,148,31,9
"Honey, can you really not see this? It’s not straight!",1.2606382978723405,0.03626237313572431,188,144,39,5
You should really see a dermatologist or maybe just buy a back scratcher.,1.2606060606060605,0.045407711768204864,165,134,19,12
"Harry, I said your drink is ready, cat got your tongue?",1.2606060606060605,0.0402293587816165,165,128,31,6
Maybe it's a sign that you're not cut out to become a lion tamer.,1.2606060606060605,0.03930001880371858,165,127,33,5
I honestly don't think you're ready for a circus side-hustle.,1.2606060606060605,0.0402293587816165,165,128,31,6
"Don't worry, honey, he's just joking!!",1.2605633802816902,0.04433729098140915,142,111,25,6
See? Fur IS murder.,1.2603550295857988,0.03960941787021744,169,131,32,6
I don't know? Do lions have tonsils?,1.2603550295857988,0.03960941787021744,169,131,32,6
A little more toward the uvula.,1.2603550295857988,0.04134961596299139,169,133,28,8
What the fuck is in this DRINK?,1.2603550295857988,0.04219280884726161,169,134,26,9
I told you it would go to your head!,1.2603550295857988,0.04219280884726161,169,134,26,9
You couldn't quit while you were a head.,1.260115606936416,0.03986753746280222,173,135,31,7
I warned you not to call him Kitty.,1.260115606936416,0.03901547395870322,173,134,33,6
He's just getting to know you.,1.260115606936416,0.04070176751043654,173,136,29,8
And didn't I warn you about using that el cheapo taxidermy shop?,1.26,0.04061055284328368,150,115,31,4
"I'm proud of you Arnold, for facing your fears.",1.26,0.03715858751887926,150,112,37,1
What you own ends up eating you.,1.26,0.04275731422181574,150,117,27,6
Can't I finish this Pinot Grigio first?!,1.26,0.04169775126850501,150,116,29,5
A little bit to the left Marvin,1.2598870056497176,0.040874021061281206,177,140,28,9
Mr. Goldwyn!  Where is Mr. Mayer?,1.2598870056497176,0.04008097132468578,177,139,30,8
It’s so realistic!,1.2598870056497176,0.03844582671181271,177,137,34,6
"You need to get another hobby, Marvin-this one will eat you alive!",1.2597402597402598,0.039952856954326835,154,118,32,4
I told you to stick with that singing fish,1.2597402597402598,0.04399727866706485,154,122,24,8
"You insisted it be ""life like!""",1.2597402597402598,0.04100138066744236,154,119,30,5
"You really miss the circus, don't you, Great Rudolpho?",1.2597402597402598,0.04399727866706485,154,122,24,8
"Who are you pretending to be today, Frank?  Siegfried or Roy?",1.2596685082872927,0.03948548004199308,181,142,31,8
That's the last time Roberta will say my taste is too tame.,1.2596685082872927,0.03948548004199308,181,142,31,8
I told you it’s been growling at me.,1.259493670886076,0.04132410908906316,158,123,29,6
wheres your gun?,1.2594594594594595,0.03576671786060543,185,141,40,4
How “Trophy Head” McGurk got his nickname.,1.2594594594594595,0.0389136959545367,185,145,32,8
Careful now … a little to the left.,1.2594594594594595,0.03966144399063931,185,146,30,9
I told you not to stick your head in there. Asshole.,1.2592592592592593,0.037623411807978444,189,147,35,7
"Honey, kindly tell him it's my den, not his.",1.2592592592592593,0.043392975850472526,162,129,24,9
"Karma is a bitch, isn't it?",1.2592592592592593,0.043392975850472526,162,129,24,9
Your head would go nicely on that wall.,1.2592592592592593,0.03393560600458455,216,166,44,6
"Revenge is the sweetest dessert, Don. There's a reason they say that.""",1.2592592592592593,0.043392975850472526,162,129,24,9
I'm starting to think you like it.,1.2592592592592593,0.036867788457444636,189,146,37,6
How can you drink this with that thing on your head?,1.2592592592592593,0.041588314235571515,162,127,28,7
"Speaking of “the spirit lives on,” I guess you won’t be needing this cocktail.",1.2592592592592593,0.03970170536329124,162,125,32,5
He's still got some bite in him.,1.2592592592592593,0.038723948309180224,162,124,34,4
It was either this or the singing fish.,1.2592592592592593,0.043392975850472526,162,129,24,9
I told you that he wasn't dead when you shot him.,1.2592592592592593,0.043392975850472526,162,129,24,9
"Alright Harold, just a little bit more to the left.",1.2592592592592593,0.036867788457444636,189,146,37,6
Is your online taxidermy school actually accredited?,1.2590361445783131,0.03814876712449716,166,127,35,4
In like a lamb.  Out like a lion.,1.2590361445783131,0.04266644095490079,166,132,25,9
"Stop mumbling, Einstein."" "" Did you say 'Karma IS a bitch or 'Call 9-1-1' ?",1.2590361445783131,0.04266644095490079,166,132,25,9
Do you think you should have pulled the trigger a bit sooner!,1.2590361445783131,0.0390940888530082,166,128,33,5
I guess the home taxidermy hit was not such a good idea.,1.2589928057553956,0.04490299266794211,139,109,24,6
"Next time, let’s not go to the cheapest taxidermist.",1.2588235294117647,0.04027911870455726,170,133,30,7
I still say we should've taken the settlement instead.,1.2588235294117647,0.041134183447469726,170,134,28,8
"No, I will not help you",1.2588235294117647,0.04027911870455726,170,133,30,7
"If you want the part, you have to wear it the other way",1.2588235294117647,0.03940550417570542,170,132,32,6
I would recommend moving it a bit down and to the left.,1.2588235294117647,0.03665996217290334,170,129,38,3
"So, your expectations are not being met by the current circumstances.",1.2586206896551724,0.039665931469940595,174,136,31,7
"That's not what I meant when I said, ""get a head.""",1.2586206896551724,0.040494776051156305,174,137,29,8
"I tried to tell you, just like a rattlesnake, the head can bite even after being killed.",1.2586206896551724,0.042103544073437096,174,139,25,10
Maybe next time you’ll listen to me and settle for a photograph.,1.2586206896551724,0.041306992815848764,174,138,27,9
The collection has become all consuming.,1.2586206896551724,0.04288530274580254,174,140,23,11
"No, I will not remove you and ruin a perfectly good story!",1.2586206896551724,0.041306992815848764,174,138,27,9
I need another glass of wine,1.2586206896551724,0.03706836677292631,174,133,37,4
"It's a little tight, dear.
Maybe it comes in a larger size",1.2586206896551724,0.040494776051156305,174,137,29,8
"Don’t worry, it’s an interactive piece",1.2586206896551724,0.03706836677292631,174,133,37,4
I knew that trip to the Serengeti would come back to bite you.,1.2585034013605443,0.04217596891968898,147,114,28,5
I cannot believe how realistic these wall ornaments are !!,1.2585034013605443,0.04638495655680603,147,118,20,9
I told you not to name him Jumanji.,1.2584269662921348,0.038257099316967906,178,138,34,6
Apparently lions have nine lives too.,1.2584269662921348,0.03907794288620063,178,139,32,7
"Amazing COVID mask,honey!",1.2584269662921348,0.038257099316967906,178,138,34,6
Help me separate the art from the artist,1.2584269662921348,0.04294747350614725,178,144,22,12
"For the last time, Ted, no, it isn't as impressive as Siegfried & Roy.",1.2582781456953642,0.04145645994811443,151,117,29,5
"So, getting the lion's share of everything is not what it used to be...",1.2582781456953642,0.04250809678379129,151,118,27,6
"A bit up on the right""",1.2580645161290323,0.043744612142876955,155,123,24,8
I see trouble lyin’ ahead.,1.2580645161290323,0.043744612142876955,155,123,24,8
I distinctly recall warning you about the halitosis.,1.2578947368421052,0.03818609181052831,190,149,33,8
I said go with the singing bass. But nooooo. You opted for the King of Beasts. Good luck getting the blood out of your collar.,1.2578616352201257,0.042989396920528576,159,126,25,8
"Dear,if Camus told you to jump off an existential bridge would you?",1.2578616352201257,0.042053260892477094,159,125,27,7
"Oh, I'm sorry. I thought you said the cat got your tongue.",1.2578616352201257,0.044803027123072464,159,128,21,10
So...You finally let your love of trophies to consume you.,1.2576687116564418,0.04487602069702191,163,132,20,11
My therapist says I have to face my fragile masculinity head on.,1.2576687116564418,0.03948942974222286,163,126,32,5
"Warren, this isn’t funny anymore.",1.2575757575757576,0.03917561643194734,198,158,29,11
See! That’s what you get for lionizing Trump.,1.2574850299401197,0.04243853957397885,167,133,25,9
Magical reality bites.,1.2574850299401197,0.0388902323675404,167,129,33,5
"'Frank, wait... leave it on...'",1.2574850299401197,0.0398069722598191,167,130,31,6
I guess he wasn't really dead.,1.2574850299401197,0.0398069722598191,167,130,31,6
Have you seen my safari hat?,1.2574850299401197,0.04157986020033555,167,132,27,8
"Perhaps next time you’ll try to swallow your pride, Oliver.",1.2574850299401197,0.04243853957397885,167,133,25,9
Hang it high enough so that I can occasionally dust your shoes when I walk by.,1.2574850299401197,0.04070306999953109,167,131,29,7
Got the cat's tongue?,1.2574257425742574,0.03599783439640419,202,157,38,7
"I told you you've been riding the tiger, Kevin, but I have to admit I didn't see this coming.",1.2573529411764706,0.04667171252997456,136,108,21,7
I told you to take smaller bites.,1.2573529411764706,0.04667171252997456,136,108,21,7
"You shouldn't have said, 'Here, kitty, kitty""",1.2573099415204678,0.04007147148199086,171,134,30,7
The taxidermist did say it was good I shot it when I did.,1.2573099415204678,0.03920361433755316,171,133,32,6
Not LITERALLY Honey!!!,1.2573099415204678,0.041753104386869404,171,136,26,9
I warned you not to economize with a taxidermist known for sloppy work,1.2573099415204678,0.041753104386869404,171,136,26,9
I can't see the hook!,1.2571428571428571,0.040289824989123924,175,138,29,8
I told you to read the assembly instructions!,1.2571428571428571,0.04109685441303293,175,139,27,9
This is not the first foolish thing you've done.,1.2571428571428571,0.040289824989123924,175,138,29,8
From what I understand he was a Siegfried and Roy cat.,1.2571428571428571,0.04575666073015567,140,111,22,7
This is not how I wanted to tell Hubert about our affair!,1.2571428571428571,0.03946629641431337,175,137,31,7
"I suggested a PHOTOGRAPHY safari, but oh, no'-----",1.2571428571428571,0.04188833832509729,175,140,25,10
"Nope, Still not Straight!",1.2571428571428571,0.03946629641431337,175,137,31,7
Now do you see why we need a chair by that window?,1.2569832402234637,0.04123614496928283,179,143,26,10
Now a tad to the right and dip the left a skooch.,1.2569832402234637,0.03968473578911617,179,141,30,8
I think you need to move it a little to the left to center it.,1.2569832402234637,0.04046787557174003,179,142,28,9
You said it was already stuffed!,1.2569832402234637,0.03968473578911617,179,141,30,8
You shouldn't look a gift lion in the mouth.,1.2568306010928962,0.037536971805753584,183,142,35,6
"Don’t worry honey, you’ve already done the lion’s share...",1.2568306010928962,0.04061060469698003,183,146,27,10
A little bit lower.,1.2568306010928962,0.039864419893901215,183,145,29,9
"Boy, you're really a mouthful.",1.2568306010928962,0.04134332417974498,183,147,25,11
