caption,mean,precision,votes,not_funny,somewhat_funny,funny
I’ve changed my mind. I love it.,1.974987974987975,0.018588149603656862,2079,773,585,721
Still not level.,1.8645459209851205,0.01921811549406798,1949,851,511,587
Are you even listening to me?,1.8300423131170662,0.022017367907192737,1418,628,403,387
"All right, now out like a lamb!",1.7676369018253577,0.018141391058300444,2027,966,566,495
Does this make me the trophy's wife?,1.7097560975609756,0.01693246992929155,2050,986,673,391
“So this is how you lionize yourself?”,1.6777939042089987,0.018812904682626665,2067,1196,341,530
Getting warmer.,1.645473393227367,0.021253324269874425,1447,820,320,307
Can't  you stop being a Dentist for even one minute!,1.5952203136669156,0.019690284265373094,1339,728,425,186
OMG - he did remember you!,1.5705024311183144,0.030655791942685313,617,368,146,103
"That reminds me, I need to visit the gynecologist.",1.565979381443299,0.02339111532746421,970,559,273,138
That reminds me. Your mother called.,1.5654761904761905,0.024654914693698776,840,476,253,111
As long as it covers your nose and mouth it counts as a mask.,1.5624242424242425,0.025643674576219334,825,483,220,122
I liked it at the store but at home it seems too daring.,1.5599078341013826,0.027662943760666383,868,563,124,181
There.  That’s perfect.,1.558011049723757,0.02675003264315033,724,418,208,98
"I tried calling 911, but she can't stop laughing.",1.54519368723099,0.02727270049386814,697,411,192,94
"In the condo, the mighty condo, the lion eats tonight",1.5380029806259314,0.029558101238597714,671,423,135,113
"Well, give me a second to savor the irony here, Bob.",1.534274193548387,0.032630502124630215,496,300,127,69
So now do you believe me when I said I thought I saw it move.,1.5271867612293144,0.035851361394883645,423,262,99,62
I know you can still hear me.,1.5256637168141594,0.028721905087891485,565,329,175,61
I wish I could say this is the stupidest thing you've done.,1.525328330206379,0.032358738212213835,533,335,116,82
I changed my mind. Let’s keep it.,1.5233968804159446,0.028393235249292666,577,337,178,62
Should we go back to the singing bass?,1.5207373271889402,0.02760562074616623,651,392,179,80
"Looks like the pussy grabbed you, Mr. Trump.",1.5183374083129584,0.03855960355109818,409,270,66,73
"Sometimes you swallow your pride, other times your pride swallows you.",1.516597510373444,0.03325333362989248,482,301,113,68
Am I going to be a trophy widow?,1.5135658914728682,0.029731560269740158,516,304,159,53
"To be fair, you started it.",1.510548523206751,0.03233723160204854,474,290,126,58
"Yes, it was a gift from my mother. Why do you ask?",1.505592841163311,0.03364954830734833,447,278,112,57
"Well, look at that…a lion’s head and a horse’s ass all in the same wall hanging!",1.5045871559633028,0.0359407418899101,436,284,84,68
It's always the last place you look.,1.5035335689045937,0.028375937405504526,566,339,169,58
Tell him one of your jokes to make him yawn.,1.4951923076923077,0.036020022027789506,416,270,86,60
I think it belongs in the den.,1.4950099800399201,0.03064428096543664,501,308,138,55
"Well, Harry, at least for once in your life your head is not up your ass.",1.4944567627494456,0.03528898344154152,451,298,83,70
"I said to center it, not enter it.",1.4921875,0.034590944127126134,384,235,109,40
I was once the trophy you lost your head over.,1.491566265060241,0.03543410534652096,415,267,92,56
"On second thought, it was fine where it was.",1.4871794871794872,0.0357076633960458,390,248,94,48
Should I call animal control or your therapist?,1.487106017191977,0.03797998347367951,349,223,82,44
This is so much better than your singing fish.,1.4870689655172413,0.02910004221893394,464,271,160,33
"You can come out now, my mom left.",1.4867469879518072,0.03459941533538062,415,264,100,51
"You can pretend you are being eaten by that lion, but we are still going to my sisters this weekend.",1.4859154929577465,0.03425262266441845,426,272,101,53
"Alexa, open mouth now",1.4826666666666666,0.03772849184437223,375,247,75,53
"Well, well.  Now who's endangered?",1.4803149606299213,0.03614050284106773,381,245,89,47
"That reminds me, did you feed the cat?",1.4795180722891565,0.03459090184922092,415,267,97,51
What a coincidence! That's exactly how my first husband died.,1.4783715012722647,0.036216583869731846,393,257,84,52
You turn every simple task into a circus.,1.4776536312849162,0.03869064410112054,358,238,69,51
You never kiss me like that.,1.4775725593667546,0.03430132849237664,379,235,107,37
See! I’m not the only one who finds you difficult to swallow these days.,1.4766584766584767,0.034748973620393205,407,262,96,49
Could you hold my drink while I get the camera?,1.475,0.0400577561085417,320,210,68,42
"Some days you swallow your pride. Others, the pride swallows you.""",1.4746192893401016,0.03667280668410554,394,262,77,55
"They say, if you put your head  in there long enough, you can hear the jungle.",1.4741641337386018,0.03778055591080867,329,209,84,36
"Oh, that reminds me. The headhunter called you back today.",1.46984126984127,0.039002771401066165,315,203,76,36
"Bad boy, drop it! I said drop it!",1.46875,0.03494768329782559,384,246,96,42
"This may not be the best time, but I want a divorce.",1.467966573816156,0.03838664629165371,359,241,68,50
"Can't hear you, Honey. Cat got your tongue?",1.4672619047619047,0.038591941666010814,336,221,73,42
"I'd help, but I'm feeling a little conflicted right now.",1.4656716417910447,0.03867443694860468,335,221,72,42
"An elephant never forgets, but a lion always dismembers.",1.465045592705167,0.04036768793279459,329,223,59,47
Let me know if you need help.,1.4637223974763407,0.03722827220805489,317,200,87,30
We also need to talk about the elephant in the room,1.463276836158192,0.03688623607338647,354,231,82,41
Help?  With what?,1.4626038781163435,0.03439504359592542,361,226,103,32
Do you still want this wine?,1.4624624624624625,0.037657826731638686,333,216,80,37
Not your left... the lion's left.,1.4623115577889447,0.034579526658916976,398,259,94,45
Don’t feel bad. My first three husbands couldn’t get out of it either.,1.4605263157894737,0.03919769186529745,304,197,74,33
It's like you're not even listening to me.,1.4599483204134367,0.03253545619974881,387,240,116,31
Seems your pride's come back to bite you.,1.4588607594936709,0.040150559259052976,316,212,63,41
Wish you had read the instructions now?,1.4587458745874586,0.039839130130545464,303,199,69,35
"You can come out now, Trump lost",1.4585987261146496,0.04084456959377553,314,213,58,43
"Oh George, stop it. I can't handle it if you die ironically.",1.4584615384615385,0.037829179556509294,325,211,79,35
Who's the trophy spouse now?,1.4580838323353293,0.0358460067029801,334,211,93,30
"Henry, just once will you look at me when I'm talking to you?",1.4575757575757575,0.03885461296619122,330,220,69,41
Just play dead.,1.457142857142857,0.03791281771055672,315,203,80,32
"You can come out now, he's been inaugurated.""",1.456445993031359,0.04147648619817538,287,191,61,35
I can't tell if it's straight if you don't hold still.,1.45625,0.03926583052360492,320,213,68,39
You’re about to be my first trophy husband.,1.4556962025316456,0.0380850315563241,316,205,78,33
Yep.  He remembers you.,1.4555555555555555,0.03978578649714357,270,171,75,24
Always playing the victim.,1.4554140127388535,0.03931038443512442,314,208,69,37
Did you hear ANYTHING I just said?,1.4542772861356932,0.0378371484762419,339,225,74,40
Does he know your safe word?,1.4539473684210527,0.03861575643911908,304,197,76,31
"No one’s laughing, Barry.  In fact, they all left 20 minutes ago.",1.453416149068323,0.03755780130731473,322,209,80,33
Well at least your head isn't where my mother always says it is.,1.4512987012987013,0.03851563375192925,308,201,75,32
His mounting troubles eventually consumed him.,1.4511784511784511,0.04313111528913149,297,208,44,45
You have to admit that there's a certain irony to it.,1.4507936507936507,0.03894100403743269,315,209,70,36
"Okay,you win, put singing trout back up.",1.450657894736842,0.04052320187161982,304,205,61,38
"Now, be fair, dear. You took his head off first.",1.450657894736842,0.0383200771038325,304,197,77,30
"Don’t install the wall safe back there,” I said. But did you listen? Noooo",1.4504249291784703,0.035814718835704626,353,230,87,36
You always have to play the victim,1.4501718213058419,0.04073438471928549,291,194,63,34
Something's eating you. What is it?,1.4495412844036697,0.03787440514663369,327,216,75,36
I guess this makes me a trophy wife.,1.4491803278688524,0.03850393219192517,305,199,75,31
"While you're in there, can you see my last husband?",1.4487179487179487,0.03841341425478684,312,205,74,33
"Alexa, relax your teeth.",1.4482758620689655,0.039825796177449364,319,217,61,41
I know you can still hear me Henry!,1.4464285714285714,0.04160078179213957,280,188,59,33
"Stop mumbling, Henry. I don't know what 'Elp me' means.",1.445692883895131,0.041439718191832904,267,176,63,28
"Anyway, my mother is only staying for the weekend.",1.4453125,0.04090624274442333,256,165,68,23
"Well, you mounted him, what the hell did you think he'd do, congratulate you?",1.445141065830721,0.037518023198813755,319,209,78,32
"Well, just try not to show fear. They sense it.",1.444794952681388,0.038474576186585036,317,211,71,35
"No, to the lion’s right.",1.4444444444444444,0.039804466658711665,279,182,70,27
"Yes, it does look more realistic that way.",1.4440894568690097,0.03961697677263293,313,212,63,38
What should I do with your drink?,1.444043321299639,0.04129671552851391,277,185,61,31
"Alexa, end Safari simulation.",1.4429967426710097,0.038845022309159906,307,204,70,33
"Honey, try using your tongue to lift the wire over the nail.",1.4427710843373494,0.03766670568889172,332,222,73,37
Looks like I finally snagged a trophy husband.,1.4427244582043344,0.03768312752007266,323,214,75,34
Let him go and I'll put you where you can look out the window.,1.4416666666666667,0.04241311845864746,240,156,62,22
Good thing you did not keep it’s butt as a trophy.,1.4407894736842106,0.04179901819616588,304,213,48,43
That's funny. I always thought Karma would eventually bite you in the ass.,1.4406779661016949,0.0399919086141648,295,198,64,33
Good thing you didn't mount the rump.,1.4404761904761905,0.04429566822649311,252,172,49,31
"I’d help, but it might spoil the story.",1.440443213296399,0.03222649065047363,361,225,113,23
Let's try it in the den.,1.4402985074626866,0.04061630004960351,268,176,66,26
"Karma has a way of evening the score, Donald.",1.4397163120567376,0.04010837790355176,282,187,66,29
"OHMYGOD, HARRY, YOU’RE SCRATCHING THE WALL!!!",1.4395973154362416,0.04053357314657447,298,203,59,36
"Hmm...911, SPCA or Tik Tok?",1.4393939393939394,0.037081505212299415,330,219,77,34
"Funny - people rarely talk about ""trophy husbands"" but here we are.",1.4391143911439115,0.04259348663728596,271,185,53,33
You must've hurt his pride.,1.4385382059800664,0.037371108402031096,301,195,80,26
I found the remote.,1.4384858044164037,0.03712323182045216,317,208,79,30
"Every time I bring up wanting kids, you change the subject.",1.4383116883116882,0.03762086885834928,308,202,77,29
"Well,after all dear ... you did shoot him.",1.4372623574144487,0.041855428426506545,263,176,59,28
Wait. Stop. Suddenly it DOES spark joy!,1.4366666666666668,0.04086531521186752,300,207,55,38
Some art just pulls you right in.,1.4366666666666668,0.039759122364843434,300,203,63,34
"You can't hide there forever, Henry.  Come say hello to Mom.",1.4363057324840764,0.038174566374138935,314,210,71,33
Maybe it would go better in the den.,1.4355400696864111,0.03864078728319902,287,188,73,26
This could be the reason it was so cheap.,1.4354243542435425,0.0395788831272832,271,177,70,24
I’m surprised he remembered you!,1.4354243542435425,0.0388821395535835,271,175,74,22
"Well, well, well. Look what the cat dragged in.",1.435374149659864,0.03858856618328708,294,194,72,28
This Harold.  This is why no one invites us over anymore.,1.4352941176470588,0.0413382648091022,255,168,63,24
I guess that explains all the one star reviews on Amazon,1.4351145038167938,0.04054211089432058,262,172,66,24
That reminds me.  Have you fed the cat?,1.4344827586206896,0.0407622123718636,290,198,58,34
"To be honest, it sort of works for me now.",1.434108527131783,0.03986597251422036,258,167,70,21
"Oh that reminds me , Ralph .Did you feed the cat today?",1.434108527131783,0.04348479725944556,258,177,50,31
He can’t be hungry... You said he was stuffed.,1.4336283185840708,0.04467833792367004,226,151,52,23
And this is my late husband on our safari. The last thing He said was “ Yes dear...I’m sure he’s dead...”,1.4334600760456273,0.04319839047241559,263,181,50,32
Did you try turning it off and turning it back on?,1.4327272727272726,0.039152510836263574,275,180,71,24
"Honey, you're wearing it backwards.",1.4317343173431734,0.04124730908362386,271,183,59,29
You were right.  It really does reach out and grab you.,1.4312267657992566,0.0404535292836779,269,179,64,26
He almost never does that.,1.4310344827586208,0.04163416071731488,232,150,64,18
How come you never kiss me like that?,1.4304635761589404,0.03980654069152328,302,207,60,35
What do you mean you don't see the irony?,1.430327868852459,0.044196251021700175,244,167,49,28
"Well, I did say I wanted a trophy husband.",1.4299674267100977,0.037377506348348,307,203,76,28
Mom's only staying a week.,1.4296296296296296,0.04033505599206488,270,180,64,26
He’ll spit you out once he starts choking on your hairpiece.,1.4290909090909092,0.04046302558688972,275,185,62,28
"What’s the matter, Ted ... cat got your tongue?",1.4285714285714286,0.0433249931702385,259,179,49,31
"To be honest, I don’t like to be called your trophy either.",1.4280575539568345,0.04141190954265638,278,191,55,32
Looks like your pride swallowed you.,1.4275362318840579,0.04287905051220788,276,194,46,36
Careful of the lamp!,1.4275362318840579,0.04131417029498627,276,189,56,31
"Sure..shoot him, mount him, THEN stick your head in his mouth.",1.4273127753303965,0.04492719340621437,227,154,49,24
I TOLD you I saw it move.,1.4270462633451957,0.03949903121838377,281,188,66,27
"It’s art dear.
It’s all consuming.",1.4270462633451957,0.0410763991773491,281,193,56,32
I see I’m not the only one who wants to bite your head off.,1.4251012145748987,0.04144385092540587,247,164,61,22
"You were humming 'Wim-o-weh' again, weren't you?",1.424908424908425,0.04163335600886191,273,188,54,31
"You get to Narnia through the wardrobe,dear,not the lion.",1.4247104247104247,0.04189437106493021,259,176,56,27
"Okay, so what do you want me to do, Harold, 
call the paramedics or Ringling Brothers?",1.4240282685512367,0.03991015141695779,283,192,62,29
"Honestly, John, every time you tell me that story, you get way too dramatic.",1.4238683127572016,0.042724121276191386,243,164,55,24
"You can take your head out now, 2020 is over.",1.4237918215613383,0.041754463550682235,269,185,54,30
"Honey if you can hear me, a little more to the left.",1.423529411764706,0.04236683421971009,255,174,54,27
"Phil, you know that I can still see you.",1.423529411764706,0.04272969851204116,255,175,52,28
You've always got some lame excuse for not going along to my parents house.,1.4233870967741935,0.04131197677052445,248,165,61,22
"Lois was torn between calling 9-1-1, or grabbing her phone for a picture for the insurance man.",1.4233870967741935,0.04324267266302156,248,170,51,27
I told you to leave it in the den.,1.4233576642335766,0.03884830854870776,274,181,70,23
"Less impressive now that it's dead, Frank.",1.4233576642335766,0.039530565175884484,274,183,66,25
"Really, Harold? After only 10 months of lockdown?",1.4230769230769231,0.042118946095070636,260,178,54,28
Now I'm a trophy's wife,1.4229390681003584,0.03835353175872088,279,184,72,23
Cat have your tongue again?,1.4225352112676057,0.04192877745696949,284,200,48,36
"Make sure you relax. Remember, they can smell fear!",1.4223107569721116,0.04133914918276234,251,168,60,23
"When I said use your head, I wasn't being literal.",1.4221311475409837,0.0392881086942982,244,157,71,16
"Be careful, it already costed us an arm and a leg.",1.4219409282700421,0.044308054133602705,237,163,48,26
Be careful of the lamp dear.,1.421641791044776,0.0404973685664573,268,181,61,26
"So, then I told her about my new sweater and....Are you listening to me!",1.421641791044776,0.04251749854520501,268,187,49,32
He never bites.  You must have done something to provoke him.,1.421455938697318,0.040195485833517425,261,174,64,23
My goodness. Talk about holding a grudge.,1.4210526315789473,0.0441074596305346,247,172,46,29
I can't hear you. Do you want your wine here or should I put it on the coffee table?,1.4210526315789473,0.04020341908292748,247,162,66,19
I TOLD  you the eyes were following me!,1.420849420849421,0.040411706964589865,259,173,63,23
I was told you could hear the Serengeti.,1.4208333333333334,0.04308853583074264,240,163,53,24
"Speak up, George. You're mumbling.""

(Apologies to the Charles Addams' cartoon, circa 1940s, of a man just swallowed by a large snake, and his wife saying this to him",1.4206008583690988,0.04360484140571823,233,158,52,23
"Did you even consider asking what ""interactive art"" actually meant !?",1.4206008583690988,0.04360484140571823,233,158,52,23
I told you not to wear your MAGA hat in the house...,1.4204946996466432,0.039885736784881935,283,193,61,29
"So, can I talk now?",1.420408163265306,0.04124565108489728,245,163,61,21
Could you try fighting for your life a little more to the left?,1.4202898550724639,0.04553997348018702,207,139,49,19
He seems to remember you.,1.4202334630350195,0.03910608677045618,257,168,70,19
There’s gotta be an easier way to find the nail.,1.4193548387096775,0.03966752760237492,248,162,68,18
I bet that framed Toulouse-Lautrec poster from MOMA is looking pretty good right now.,1.4190871369294606,0.042944888766061555,241,164,53,24
He’s just being affectionate.,1.4189723320158103,0.03831349022955951,253,163,74,16
"What, Mr. Life of The Party, the lamp shade wasn't good enough?",1.4188034188034189,0.04303114468650345,234,158,54,22
Scratch him behind the ears!  He loves that!,1.4187725631768953,0.04017931584860485,277,189,60,28
So you finally got your head in the game.,1.4176706827309238,0.04114925188572714,249,167,60,22
"Honey, it's okay. The Smiths have gone home now.",1.417624521072797,0.03942538330633622,261,173,67,21
"I’d help,  but if you could see, I have wine here.",1.4175438596491228,0.042078485843293774,285,203,45,37
"Then, once it's level, his jaws release",1.4173913043478261,0.04355792966621229,230,156,52,22
"Jerry, I think it's time to acknowledge that you're being consumed by your own pride.",1.4172661870503598,0.04257708752946508,278,198,44,36
It’s a good thing you didn’t put it lower!,1.4170212765957446,0.0437245579557262,235,161,50,24
Isn’t it more likely that you left your reading glasses at work?,1.416988416988417,0.041116174514770766,259,176,58,25
I always wanted a trophy husband.,1.4166666666666667,0.04140433457298755,240,160,60,20
"And in the other universe, you're on HIS wall.",1.41635687732342,0.04103067048547209,269,185,56,28
"All right,Fred,what's eating you this time?",1.416,0.04476372599168477,250,178,40,32
"Taxidermy, meet tax attorney.",1.415929203539823,0.047120142865475945,226,161,36,29
I'm still glad we didn't go with the singing bass.,1.4157706093189963,0.039622943940134304,279,190,62,27
Cat got your tongue again?,1.4155844155844155,0.04468849796370582,231,160,46,25
"Here honey, brought you a glass of wine to wash down my husband",1.4154411764705883,0.04168016429103995,272,190,51,31
On second thought let's go with the singing fish.,1.4153846153846155,0.04025801503494586,260,175,62,23
“It won’t work Harry. It will be the first place my Mother will look.”,1.4152542372881356,0.04231514277505886,236,159,56,21
"Honey, it wasn't funny in Tanzania. It isn't funny now.",1.4151785714285714,0.04300631835934029,224,150,55,19
"Hold on, let me get the squirt bottle.",1.4151785714285714,0.04438083741349638,224,153,49,22
"While you’re in there, do you see any sign of the dog?",1.4148148148148147,0.04157519753398107,270,188,52,30
Do you still want this Chardonnay?,1.4140969162995596,0.0443868668299254,227,156,48,23
I think he remembers you.,1.4139344262295082,0.039217671438606765,244,159,69,16
I think a simple cloth mask would be best.,1.4137931034482758,0.03693689132686423,290,192,76,22
"Gladys, why can't you lose your ring down the sink like everyone else?",1.4134615384615385,0.045322430613859786,208,141,48,19
"Nice going, Tarzan.",1.4130434782608696,0.04219190689129765,230,154,57,19
"When I told you to get your head in the game, this is not what I meant.",1.4129554655870444,0.04252461739581174,247,170,52,25
"Don't be so dramatic, my parents will only be staying a few days.",1.4125,0.04342439605731802,240,166,49,25
"Don't move, that is perfect",1.4124087591240877,0.039784621452279775,274,187,61,26
"I thought he wanted courage, not a brain.",1.4122137404580153,0.04180020122460201,262,182,52,28
"Be careful, dear.  I lost my last husband to a cougar.",1.4121405750798721,0.03674210448378035,313,212,73,28
"The hunter becomes the hunted, eh, Patrick.",1.4120171673819744,0.04395665992728909,233,161,48,24
Did you make eye contact again?”,1.411764705882353,0.04286628428327568,238,163,52,23
"I’ve changed my mind Bob,
It can stay.",1.411764705882353,0.042030987218105526,238,161,56,21
"Well, this is better than the usual place your head ends up.",1.4115044247787611,0.04666457822877986,226,161,37,28
"You know, I've always wanted a trophy husband.",1.4109589041095891,0.045078164797625324,219,151,46,22
"Who did I call last time, your taxidermist or 911?",1.4107883817427387,0.04206215149810081,241,164,55,22
"For Pete's sake, George, Mother's only here for three months.",1.4107883817427387,0.041231884451556435,241,162,59,20
"It really jumps out at you, doesn't it?",1.4106463878326996,0.04025327437708183,263,179,60,24
Rub his ears Norman!!!,1.4103585657370519,0.04006629321831898,251,168,63,20
"You enter Narnia through the wardrobe,dear.",1.4102564102564104,0.04624790191321341,234,168,36,30
"Cat got your tongue, Honey?",1.41015625,0.04177686293641012,256,177,53,26
Perfect!,1.41015625,0.04066195411071283,256,174,59,23
You want me to shoot it again?,1.4098360655737705,0.042879316611492205,244,169,50,25
Your pride is killing you.,1.4097744360902256,0.04131725681804688,266,185,53,28
"Just relax, Jerry. He’s as frightened as you are.",1.4094827586206897,0.043218051855410354,232,159,51,22
Will this ever not be funny to you?,1.4094827586206897,0.04449446049437695,232,162,45,25
"Lion pays fifty-thousand dollars to hunt dentists in New York, sparking international debate.",1.4094488188976377,0.044528402948170634,254,183,38,33
Who's endangered now Larry?,1.4094202898550725,0.04053910541446,276,192,55,29
Pretend you are a hairball.,1.4093023255813955,0.047079772795703335,215,152,38,25
Should I go outside and pull his tail?,1.4093023255813955,0.04567382809783959,215,149,44,22
"Well, look who's endangered now.",1.409282700421941,0.0433893496815968,237,164,49,24
2020.,1.4090909090909092,0.04627731894447461,220,155,40,25
Has the cat got your tongue?,1.4087591240875912,0.03768291185984166,274,182,72,20
Would you like some wine with my husband?,1.4087301587301588,0.04262107340095706,252,176,49,27
"Quick, make yourself look bigger.",1.4086956521739131,0.043916530398228994,230,159,48,23
Don't move. It's perfect.,1.4085603112840468,0.04236825241319565,257,180,49,28
Keep this in mind if you ever start thinking about a trophy wife,1.408,0.043975897012707876,250,178,42,30
See?  I told you it's not just gift horses.,1.408,0.041339810348847934,250,171,56,23
Watch out for the lamp.,1.407843137254902,0.04150635773430655,255,176,54,25
Didn't you learn anything from getting your head caught in the staircase railing?,1.4074074074074074,0.045025628683364516,216,149,46,21
I told you that thing would come back to bite you!,1.407239819004525,0.04334540188359883,221,150,52,19
Play dead!,1.4069767441860466,0.03849713504923243,258,171,69,18
"Okay, you win. It does fit.",1.4063926940639269,0.04409570877735617,219,150,49,20
"Well, well. Look who the cat dragged in!",1.4063604240282686,0.03946052379066464,283,196,59,28
Hold still. I'm going to try the Heimlich maneuver.,1.4061302681992338,0.04221787334192594,261,184,48,29
"Let me take a pic, your ex-wife will love this.",1.405857740585774,0.0418515510071518,239,163,55,21
Not real impressive when the lion's already dead.,1.405857740585774,0.042683408218413064,239,165,51,23
"Looking for your pride, dear?",1.405857740585774,0.04226952601368934,239,164,53,22
"For God's sake Tom, if you don't feel like Chablis just say so.",1.405857740585774,0.04100282071112628,239,161,59,19
"Ok, next time I'll just say hang it high instead of place it overhead.",1.4056224899598393,0.04221183609668415,249,173,51,25
Apparently the lion is not sleeping tonight.,1.405511811023622,0.04160430844996476,254,176,53,25
"While you're in there, see if you can find the cat.",1.4051724137931034,0.04528726728656712,232,165,40,27
We should have gotten a standard wall safe.,1.4047619047619047,0.0418374012331633,252,175,52,25
I think I found the remote.,1.4047619047619047,0.043685992143983804,252,180,42,30
At least the portrait of your mother didn’t come alive.”,1.404669260700389,0.042692257421425094,257,182,46,29
"Oh my goodness, now I really am a trophy wife.",1.4042553191489362,0.04402791041431572,235,165,45,25
"Finally,my own trophy husband.",1.404,0.042454038459563595,250,175,49,26
"Oh for goodness sake,use a level!",1.4038461538461537,0.04161075120771075,260,182,51,27
"Don't move, I'm getting my camera.",1.403755868544601,0.04396348998045423,213,145,50,18
I just feel like you aren't really listening to me.,1.403755868544601,0.04446436049141037,213,146,48,19
