caption,mean,precision,votes,not_funny,somewhat_funny,funny
I thought partly cloudy with a chance of rage was a typo,1.8288288288288288,0.011581653254284247,4773,2006,1578,1189
Well it looks like my mother found out that you’re not Jewish.,1.822623828647925,0.012164660069772659,4482,1954,1369,1159
"They banned him from Twitter, but he’s still in the Cloud.",1.8117567870765088,0.012061037534876745,4457,1943,1410,1104
That reminds me. Your mother called.,1.802893309222423,0.012009417349629325,4424,1933,1430,1061
A bunny. Seriously. You see a bunny.,1.8003651856360317,0.014057172969142714,3286,1460,1022,804
What do I think? I think we should stop asking the universe for a sign.,1.7816059225512528,0.013116803258031993,3512,1528,1223,761
"He was banned from Facebook and Twitter, so he's trying the Cloud.",1.7725376965030477,0.014370405590285174,3117,1438,950,729
What the hell did you upload to the cloud?!,1.768041237113402,0.01157825087909348,4656,2118,1500,1038
The forecast did say the weather would turn ugly.,1.7670660351072722,0.012435172790444156,3589,1511,1403,675
He hates when someone steals his thunder.,1.7653287367643438,0.01209348193984757,4061,1794,1426,841
"Don’t worry, it’s just a front.",1.7634722590921157,0.012504537907779239,3767,1660,1338,769
It's just a temperature tantrum.  It'll blow over.,1.7630512514898689,0.01187372678299548,4195,1855,1479,861
I guess they weren’t kidding when they said the weather might turn nasty,1.7596731554914684,0.01169540732393677,4161,1804,1553,804
The forecast did call for threatening skies.,1.7594816687737043,0.01323861938251536,3164,1349,1227,588
He looks cirrius!,1.7533333333333334,0.01605433435599553,2400,1111,770,519
Is it just me or is climate change starting to feel more personal?,1.7501945525291829,0.014939802704831983,2570,1138,936,496
Don't ask me.  I really don't know clouds at all.,1.7452054794520548,0.014638392401524538,2920,1380,904,636
I finally get a date with you and it turns out to be Judgment Day.,1.744970798182998,0.014091477133903747,3082,1436,996,650
Clouds used to look like animals… now they look like any Republican in office.,1.7442788717402873,0.013052127466063186,3758,1806,1107,845
I see your father learned how to access the cloud.,1.7427502338634238,0.016923214054919287,2138,1000,688,450
"Shakespeare in the Park, you said. An immersive production of The Tempest, you said.",1.7370266479663394,0.014257153961262215,2852,1300,1002,550
"Really Jennifer, everything reminds you of your ex.",1.7358490566037736,0.014632534024359984,2756,1273,938,545
I'm getting the distinct impression that the climate wants US to change.,1.7304534094966084,0.014387639573991464,2801,1291,974,536
I wonder what precipitated that.,1.7281405116456663,0.014920615401321414,2619,1216,899,504
It’s my fault.  I promised if he went away he could come again another day.,1.7278860569715142,0.015044181545019273,2668,1267,860,541
He’s been mad ever since I stole his thunder,1.7224761113419194,0.015473620466504816,2407,1120,835,452
"The weather’s not bad, it’s just misunderstood.",1.7180062864840593,0.016311148970581113,2227,1062,731,434
Nimbus?! You can't be cirrus.,1.7166666666666666,0.016891591218002783,2160,1058,656,446
it's an affront coming in.,1.715186802523047,0.01726682364306818,2061,1010,628,423
Don't worry - it's just a front.,1.7144992526158445,0.016554990189523795,2007,920,740,347
Don't be fooled by the angry face. It's just a front.,1.7135161606268365,0.01676503744206506,2042,962,703,377
That reminds me.  How’s your mother doing?,1.7104025091479351,0.01772821286387434,1913,932,603,378
Let's be like the Republicans and just pretend it isn't happening.,1.7102229054573406,0.021934930019135518,1301,650,378,273
"Sweetheart, did you know you can store anger and resentment in the cloud now?",1.7087533156498673,0.017941016434510897,1885,926,582,377
"This reminds me, your dad called.",1.7031431897555296,0.018214051072549718,1718,820,588,310
I'm not seeing the silver lining in this one.,1.7012858555885262,0.023161683491667116,1011,470,373,168
"you know, I really don’t know clouds at all.",1.6971649484536082,0.019439701330399666,1552,761,500,291
I may have put the wrong mushrooms in our Sandwich..,1.6960698689956333,0.0230547985973791,1145,575,343,227
"Well, the weather report did say the skies were threatening.",1.69377990430622,0.019421854719118236,1463,696,519,248
"Uh-oh, looks like Trump has found a new cloud-based social platform.",1.6929824561403508,0.02051027281479959,1482,759,419,304
That's just a front,1.6927792915531334,0.01963708183704292,1468,710,499,259
"Oh, that reminds me. When are we going to tell your mother we're engaged?",1.6906614785992218,0.02371244132442107,1028,505,336,187
"It's an illusion, Joni! You really don't know clouds at all, do you?",1.6906116642958748,0.020990975841772248,1406,720,401,285
I’ve had worse signs on a first date…,1.6898355754857997,0.020176970421035525,1338,636,481,221
Wait until he claps.,1.6897784131522515,0.019574195468498624,1399,659,515,225
I think you should tell me what you see first.,1.6883686905632773,0.02013764210341942,1367,658,477,232
"So your ex, Zeus... Was that a nickname?",1.68735976065819,0.021074354345173494,1337,671,413,253
"Even though he's not our President anymore, I keep seeing his face everywhere.",1.6853582554517135,0.021434780137921963,1284,644,400,240
They did predict threatening weather.,1.6842948717948718,0.02086652270912622,1248,598,446,204
"That's the difference between us, Irma. You see a dark cloud looming overhead, while I see the possibility of being put out of my misery.",1.6832937450514647,0.021855037353789096,1263,644,375,244
And to think that just a couple minutes ago it looked like a bunny.,1.6828685258964144,0.021296687848451467,1255,619,415,221
The forecast looks grim,1.6792929292929293,0.02070981023311462,1188,554,461,173
Every night I write down all my negative thoughts and upload them to the cloud so I can sleep better.  Why do you ask?”,1.678721614802355,0.021799674425249896,1189,588,395,206
I thought he was in Mar-a-Lago.,1.6777583187390543,0.023001942280603184,1142,588,334,220
So much for the friendly skies,1.676131322094055,0.02175852478604367,1127,542,408,177
I see Rudy Giuliani.,1.6739327883742052,0.022950943922983663,1101,557,346,198
Remember when they all looked like bunny rabbits and puppy dogs?,1.6738934056007226,0.021938545236099994,1107,534,400,173
Really? I see a puppy.,1.6737327188940092,0.023190025669107123,1085,551,337,197
"Oh, for crying out loud.  Just when they said small, outdoor gatherings are safe, someone has gone and uploaded the GOP to the cloud.",1.673450508788159,0.023843519132037524,1081,566,302,213
"The forecast didn’t say anything about angry recrimination, only a chance of silent disappointment with passing waves of resentment.",1.6725912067352666,0.023179275502317527,1069,539,341,189
Cirrusly?,1.6719184430027803,0.023196272011296978,1079,548,337,194
"Reminds me, we're invited to my mother's house for dinner.",1.6705882352941177,0.023730595201678657,1020,516,324,180
Don't worry. It's a front,1.6702439024390243,0.02323294760148657,1025,508,347,170
We've got to be more careful about what we upload to the cloud.,1.6676470588235295,0.022968612328223566,1020,500,359,161
Looks like someone needs his climate changed,1.6648706896551724,0.025531738248021574,928,488,263,177
Climate change is really getting ugly.,1.6618625277161863,0.0244004490200081,902,446,315,141
"We’ve done climate change denial and guilt, next is anger.",1.6577480490523968,0.025039998537136236,897,458,288,151
"... altocumulus, stratus and, uh-oh, these ones look cirrius.",1.6576879910213242,0.025125188448910256,891,455,286,150
I think the weather’s turning on us.,1.6575342465753424,0.023774881194836173,876,418,340,118
"Well, the forecast was for threatening weather.",1.6546091015169195,0.02519740420094296,857,432,289,136
Is that what they mean by 'threat of rain'?,1.6537102473498233,0.02528233611947369,849,428,287,134
Please tell me you see it too.,1.6518607442977191,0.025340499554742563,833,418,287,128
"You know that piece I wrote debunking ""Climate Change""?  Maybe I shouldn't have uploaded it to the cloud....",1.6508515815085159,0.026524384108334482,822,431,247,144
I don't think there is a silver lining in this one.,1.6503067484662577,0.02596728886336495,815,416,268,131
"It’s not the heat that gets you, it’s the hostility",1.6472819216182049,0.02685281286488824,791,414,242,135
"Not to worry, the weather report said to expect only a threat of rain.",1.6464516129032258,0.025338509820280495,775,378,293,104
Did you exceed the storage limit?,1.6459143968871595,0.02729624573075898,771,406,232,133
"Honey, where did you get the mushrooms for our salad?",1.6453715775749673,0.027599701223890796,767,408,223,136
Did you steal his thunder too?,1.6436314363143631,0.027296880511586696,738,381,239,118
"So, what did you put in those brownies?",1.6434426229508197,0.026995031777933266,732,372,249,111
I think he's cirrius.,1.6432584269662922,0.0289879588754566,712,385,196,131
It's getting cloudy with a chance of apocalypse,1.6399416909620992,0.0276041230559167,686,347,239,100
Oh great. Now we have to worry about Mad Clouds disease.,1.639777468706537,0.02851307396002833,719,386,206,127
I'm sensing an air of hostility.,1.6395027624309393,0.02725751418542881,724,372,241,111
That reminds me. Have you told your dad that we’re moving in together?,1.639344262295082,0.026816117613400924,732,372,252,108
"Apparently, climate change is getting more serious.",1.6391608391608392,0.02752955558012446,715,369,235,111
Let’s wait and see if he’s voiced by James Earl Jones,1.63884430176565,0.029434882506806044,623,321,206,96
"I really need you to update your iCloud payment information, these reminders are starting to get aggressive.",1.637660485021398,0.028262855514346243,701,369,217,115
I think this may be an exception to the silver lining rule,1.6355685131195334,0.028018336728591095,686,355,226,105
"The forecast didn't say belligerent, it said inclement.",1.6353111432706222,0.02670783782880109,691,342,259,90
"As a kid, I always saw bunnies and elephants. Now its always my disappointed father.",1.6349924585218703,0.03017616354192403,663,365,175,123
Now that is a severe thunderstorm warning....,1.6347569955817378,0.027072945304959108,679,338,251,90
Now those are threatening clouds!,1.6334841628959276,0.02903206461171374,663,351,204,108
It's Trump's new social media platform.,1.6321483771251932,0.03087587202711684,647,362,161,124
Dear…what did you save to the Cloud?,1.631892697466468,0.02861349919098704,671,353,212,106
They weren't kidding about threatening weather...,1.6318181818181818,0.028022114933159724,660,337,229,94
Scary? No. I’ve looked at clouds from both sides now.,1.6302003081664098,0.02947027007633113,649,347,195,107
"Yeah, whatever. It can’t be worse than 2020.",1.627388535031847,0.028454544501862456,628,320,222,86
What was in that brownie?,1.6272,0.02935798497941032,625,328,202,95
'He's deadly Cirrus',1.6262135922330097,0.030583525409470364,618,337,175,106
I guess even unlimited cloud storage has a limit.,1.6258064516129032,0.02928736047326638,620,324,204,92
It may be time to rethink my climate change denial.,1.6254019292604502,0.029393360846112083,622,327,201,94
I know you don't like small talk but... what do you think of the weather?,1.625,0.029351515395693816,616,322,203,91
"Well, they banned him from Twitter and Facebook, so...",1.6231404958677687,0.030685348117134078,605,329,175,101
Looks like the weather might be turning on us,1.6231155778894473,0.029431115960366305,597,309,204,84
I see my boss when I tell him I want to keep working from home. What do you see?,1.6220338983050848,0.029611624726797802,590,306,201,83
It looks like the weather is about to turn ugly.,1.6218487394957983,0.02903321861447027,595,304,212,79
"Your father, Art, in heaven?",1.6214405360134003,0.03111358113564675,597,328,167,102
When you said you were bringing me to the tempest in the park I thought you meant Shakespeare,1.618881118881119,0.030754182827990625,572,305,180,87
Is it just me or does the weather look threatening to you too?,1.618213660245184,0.030297963051504968,571,300,189,82
It looks like a rain of terror .,1.6176991150442477,0.030550864604643357,565,298,185,82
The forecast was for threatening clouds.,1.61660777385159,0.031024487096571806,566,304,175,87
He still thinks he won the election.,1.6162162162162161,0.03282307212902087,555,313,142,100
Here comes the winter of our discontent,1.6162162162162161,0.03140522677756033,555,299,170,86
"Oh,and your mother called yesterday.",1.6159420289855073,0.031015355566480694,552,293,178,81
Nature abhors a picnic.,1.614678899082569,0.031548163053301645,545,293,169,83
"Don't worry, He really did lose the election, you know.",1.6125461254612545,0.03265279069626912,542,302,148,92
"You were right, magic mushrooms and a Central Park picnic-  not my best idea",1.6119402985074627,0.03018538885174338,536,275,194,67
The weather report did mention the possibility of threatening thunderstorms.,1.6118546845124282,0.030394292774336782,523,267,192,64
"Okay fine, I'm ready to admit climate change is probably real.",1.6099426386233269,0.03216384856604697,523,283,161,79
So that’s what they mean by a threat of a thunderstorm.,1.6091954022988506,0.030697268890603313,522,270,186,66
Looks like we may have reached our limit on free storage”,1.6088631984585742,0.03270734561716976,519,285,152,82
That's a newly designated cloud type; Trumpus! It's usually formed when a lot of hot air and global warming denial clash.  The smaller clouds are called Trumpus Juniourus idioti!,1.608187134502924,0.03447898800521986,513,296,122,95
"Don't worry about rain, the weatherman said it was just threatening.",1.6081081081081081,0.031483129592240026,518,274,173,71
They did say storm clouds would be threatening.,1.6077669902912621,0.03126589699023583,515,270,177,68
It said cloudy with high temper... I thought it was just a typo!,1.6074950690335306,0.03225433916784365,507,272,162,73
Oh dear. Looks like Trump's in the cloud now.,1.607421875,0.03306794999056106,512,283,147,82
I see angry and you see constipated.,1.6070038910505837,0.032969248923516783,514,284,148,82
Now that one looks like a candidate who can't accept that he lost the election.,1.6067193675889329,0.034306198437648094,506,289,127,90
I bet there's no silver lining in that one.,1.606361829025845,0.03318433573843443,503,277,147,79
I thought Trump was in Florida.,1.606,0.03417402123623892,500,283,131,86
Scientifically it's known as Cumulobadass,1.6055226824457594,0.033453440509695176,507,283,141,83
"Well, the weather called for ""threatening clouds"" today...",1.6051587301587302,0.03192782508212866,504,268,167,69
Have you noticed how angry the world has become since Trump?,1.603658536585366,0.033413962142140596,492,271,145,76
"Don’t blame me. The forecast said threatening, not menacing.",1.6008230452674896,0.031410742174429226,486,252,176,58
I think it’s threatening to reign.,1.5991649269311066,0.03324394826592599,479,261,149,69
"I distinctly heard it say, “Let’s get ready to rumble”.",1.5991471215351811,0.03311114916140915,469,252,153,64
Climate change is becoming increasingly personal.,1.598326359832636,0.032905510953411515,478,258,154,66
Don't take it personally - he's just passing a hail stone.,1.5978494623655914,0.03402584198783228,465,256,140,69
I have a feeling it won't be cats and dogs this time.,1.596529284164859,0.031689397204635664,461,237,173,51
"Beth, I don't want to sound like an alarmist, but it looks as if this could be cirrus.",1.5964912280701755,0.03283958489469781,456,241,158,57
"Apparently, my Twitter rant about the weather ended up in the cloud.",1.5958333333333334,0.03347168140794015,480,265,144,71
They can't be cirrus.,1.5956043956043957,0.034480438764054495,455,252,135,68
The heavens really should stop watching Fox News,1.5951859956236323,0.034919647566990016,457,257,128,72
"Look, it's either this, or we have to go back home to the kids.",1.5946547884187083,0.03526996720838556,449,253,125,71
Looks like cloudy with a chance of vengeance.,1.5936794582392777,0.03297132346079097,443,233,157,53
I miss when the clouds looked like a dog,1.5936794582392777,0.03448550545858601,443,243,137,63
Really? I just see a rabbit.,1.592920353982301,0.03248329204341857,452,237,162,53
Sorry. I meant it looked like your Mother in a good  way.,1.5923423423423424,0.03559531481935898,444,252,121,71
Isn’t your husband a meteorologist?,1.5919661733615222,0.03453367579281786,473,269,128,76
I get the feeling he’s ready to rumble.,1.5898617511520738,0.033824062074771066,434,233,146,55
Are you sure we took a micro dose?,1.5894495412844036,0.034938027408544285,436,242,131,63
Remember when stayng inside seemed scary?,1.5892018779342723,0.034788216208317284,426,233,135,58
And I was worried about the ants!,1.5876777251184835,0.03423744982682483,422,227,142,53
I think it's time we stopped seeing Trump everywhere,1.5871559633027523,0.03628365476714101,436,252,112,72
Global warming is getting more and more threatening...,1.5865384615384615,0.03544407604319695,416,230,128,58
I think he’s under a lot of pressure.,1.5855421686746989,0.03468645700874981,415,225,137,53
Cloudy with a chance of Armageddon”.  Why do you ask,1.5827160493827162,0.036036269430880924,405,226,122,57
I think we’ve gone past climate change and are now experiencing climate rage.,1.5822222222222222,0.03384593080139484,450,249,140,61
They said he’s holed up at Mar-a-Lago but it feels like he’s still hanging over us...,1.5818639798488665,0.036945479485470424,397,225,113,59
I am not sure if it is safe to store our passwords in the Cloud anymore.,1.577720207253886,0.03577215897027199,386,211,127,48
"Well, they did say threat of nasty weather.",1.5766233766233766,0.036036523454087484,385,212,124,49
"They warned us about the effects of global warming but, they forgot about global rage.",1.5759162303664922,0.03810254328169191,382,221,102,59
"Well, they won't let him on social media anymore.",1.575063613231552,0.036392650857187944,393,221,118,54
Does the weather look threatening to you?,1.5743073047858942,0.033936412843932694,397,211,144,42
It's the raining heavyweight champion.,1.5733695652173914,0.038097121876340075,368,210,105,53
"Whatever you do,do not make  eye contact .",1.5733695652173914,0.03650919500063401,368,202,121,45
He’s no longer President and yet he still seems to be everywhere,1.5722070844686649,0.03759380620510478,367,207,110,50
"When you said your Ex had his head in the clouds, I didn't know you meant literally.",1.5717821782178218,0.03599265991005594,404,229,119,56
Uh-oh. I get the feeling this will be no picnic.,1.5710526315789475,0.03526257753938794,380,206,131,43
I told you we should stop uploading so much data to the cloud. He was bound to snap at some point...,1.5710382513661203,0.037876587319078094,366,208,107,51
And I was worried about ants …,1.5706806282722514,0.035516671735985876,382,209,128,45
How come you ALWAYS see a bunny?,1.5698324022346368,0.03893587420264723,358,207,98,53
I must have exceeded my cloud upload limit.,1.5690140845070422,0.0371091905890753,355,196,116,43
Is it just me or does that cloud look like your father?,1.5686274509803921,0.036741749460581445,357,196,119,42
Threatening? They look downright homicidal.,1.5685714285714285,0.03921604733417764,350,202,97,51
"The forecast called for “threatening skies”, but I just thought it was more “fake news”.",1.5683060109289617,0.037692277199869936,366,208,108,50
Looks pretty cirrus.,1.5682451253481895,0.03743187526503896,359,201,112,46
"So I should probably tell you about my ex, Zeus.",1.5671232876712329,0.0373764691681673,365,206,111,48
How 'bout we go somewhere with a friendlier atmosphere?,1.566951566951567,0.037869239084474655,351,197,109,45
Just when we thought it was safe to go outside!,1.566951566951567,0.03871949552818539,351,201,101,49
So does 'What the hell' mean you'll marry me or not?,1.5666666666666667,0.03610517402674206,390,220,119,51
Are you sure we are back in the Paris Climate Agreement?,1.565934065934066,0.03746031739453572,364,206,110,48
They follow me everywhere. I hope that's not a problem for you.,1.565459610027855,0.036392003531164924,359,197,121,41
You’ve really got to look at clouds from both sides now.,1.564102564102564,0.03915132370956011,351,204,96,51
"Besides ruining our picnic, he has all of our financial data and wants a ransom.",1.563953488372093,0.039553175844288774,344,200,94,50
If you stored that much useless information wouldn’t you be mad too?!,1.5636856368563685,0.03747995296348216,369,211,108,50
The forecast said the weather could turn threatening.,1.5635838150289016,0.038734824949866846,346,198,101,47
It's just a front he puts on.,1.5635359116022098,0.03638846225288901,362,200,120,42
I told you the weather forecaster predicted threatening clouds.,1.5634920634920635,0.0352404013718363,378,207,129,42
"Ignore them. They are disgruntled, low level clouds.",1.5632183908045978,0.03725585728361319,348,193,114,41
Let's go. I think the weather is about to turn nasty.,1.5625,0.03894115391680662,336,191,101,44
Now do you believe in climate change?,1.5621468926553672,0.03635194454096942,354,194,121,39
Didn't you say your ex was a weatherman.,1.5615615615615615,0.038747810913306535,333,188,103,42
Really? I see determination and resolve.,1.5592705167173253,0.039350100804867255,329,188,98,43
I don’t mind that the sun is blocked but who needs the attitude.,1.559228650137741,0.037771646634543105,363,209,105,49
"The forecast called for mild resentment, not rage.",1.5587392550143266,0.03828807980173525,349,200,103,46
The weather looks a little threatening today.,1.5541401273885351,0.03848693218995957,314,174,106,34
How many ‘storms of the century’ can one century have?,1.5537974683544304,0.039851724758464074,316,181,95,40
"“It’s life’s illusion, I recall.”",1.5516129032258064,0.04018360013601687,310,178,93,39
Remember when I told you my ex-wife has powerful friends?,1.5512820512820513,0.03947198275352416,312,177,98,37
He’s been under a lot of low pressure lately,1.5501519756838906,0.03891535925207602,329,189,99,41
"The forecast calls for vengeance, with a chance of calamity.",1.5496688741721854,0.04231364189497569,302,180,78,44
Well he has been under a lot of Barometric Pressure.,1.549342105263158,0.03971135602282307,304,172,97,35
They must have gotten blown over from a red state.,1.54858934169279,0.04081599827065083,319,189,85,45
I can handle threatening clouds. What I can’t except is bullying clouds.,1.5483870967741935,0.03967376536050802,310,177,96,37
It's cloud illusions I recall. I really don't know clouds at all.,1.5482954545454546,0.038081902493604936,352,205,101,46
"""I didn't think you were referring to umbrellas when you asked me to bring protection.",1.5480769230769231,0.04127158468768308,312,185,83,44
‘He’s ready to rumble.’,1.5466666666666666,0.040667050457826766,300,173,90,37
I wouldn’t hold your breath for silver lining.,1.5460526315789473,0.0397243934592784,304,173,96,35
We have a cirrus problem here.,1.5442176870748299,0.04348972045695837,294,179,70,45
The weather is starting to look ugly!,1.5439739413680782,0.03944381798346609,307,175,97,35
I think it's called a cumulonemesis.,1.5436893203883495,0.04209705356918559,309,187,76,46
I’ve seen worst signs on a first date,1.543554006968641,0.04205984621222791,287,168,82,37
Do those clouds look threatening to you?,1.539568345323741,0.0412553870799011,278,159,88,31
I told you not to store that in the cloud.,1.5392857142857144,0.04134946187340765,280,161,87,32
Yes I am a senior oil company executive.  How did you know?,1.5387205387205387,0.043165732738007626,297,182,70,45
Can YOU see a silver lining?,1.5382059800664452,0.04004574228812373,301,174,92,35
"Interesting. You see The Thing, but I see your mom.",1.537162162162162,0.04248240941997242,296,179,75,42
"Jesus, Sheila, I never knew you had such a dark side. To me it looks like a Labrador puppy chasing a butterfly.",1.5353159851301115,0.04061382252111625,269,151,92,26
This climate change business is getting personal.,1.532871972318339,0.03858838291667319,289,161,102,26
Really? To me it looks like your mother.,1.532871972318339,0.04383593557437652,289,179,66,44
You're right. A minute ago it just looked like it wanted a hug.,1.5326460481099657,0.040209173212283233,291,168,91,32
"This is weather, not climate...right?",1.5315985130111525,0.04096526688601057,269,153,89,27
MY dad?  It looks more like YOUR dad!,1.5313653136531364,0.04334695512931081,271,162,74,35
Maybe the “proud climate denier” t-shirt wasn’t such a great idea.,1.5313653136531364,0.04366110541032928,271,163,72,36
Rudy Giuliani seems to hang over the city like a dark cloud.,1.5308219178082192,0.04376087738966683,292,182,65,45
"Should we be worried,or is it just a front?",1.529616724738676,0.0406296321854095,287,167,88,32
Maybe we should go. The skies look threatening.,1.5290322580645161,0.0394712296398392,310,182,92,36
"If you squint this way, it looks more like he's looking at the couple next to us.",1.5280898876404494,0.04119722183966659,267,153,87,27
‘They said it was going to be cloudy with a chance of rage’,1.5276752767527675,0.0430398862504413,271,162,75,34
Sometimes the silver lining is more of an angry gray,1.52734375,0.04319653305514308,256,150,77,29
It’s mostly water weight.,1.5254901960784313,0.04296849665611273,255,149,78,28
"Cumulus, Cirrus, Nimbus - looks more like a Threatenus.""",1.525,0.04107880229451523,280,164,85,31
All I see is your ex-husband.,1.5243445692883895,0.04353241769704234,267,161,72,34
"A heads up about the jealous ex would have been nice, Hera.",1.5238095238095237,0.04298238409021071,252,147,78,27
Talk about a threatening forecast….,1.5236363636363637,0.04226443183371165,275,164,78,33
As a Republican I refuse to believe it.,1.5234375,0.04561994247418599,256,158,62,36
