caption,mean,precision,votes,not_funny,somewhat_funny,funny
Since the beginning of the pandemic I have been so consumed with disinfecting everything that   the cloud formation looks like Mr. Clean to me.,1.1917808219178083,0.05739637027386542,73,62,8,3
You didn't tell me your ex was a weatherman.,1.1917808219178083,0.053979864920259725,73,61,10,2
We're gonna need a bigger blanket.,1.1917808219178083,0.04639817678744647,73,59,14,0
"Not even $130,000 could hush up that storm.",1.1917808219178083,0.053979864920259725,73,61,10,2
Which one of us is taller?,1.1917808219178083,0.053979864920259725,73,61,10,2
I guess calling him “little stormy” was a bad idea?,1.1917808219178083,0.053979864920259725,73,61,10,2
Thank God Bob Ross didn’t live to see THIS!,1.1917808219178083,0.053979864920259725,73,61,10,2
"It's either Stratus or Cumulonimbus, or the end of the world",1.1917808219178083,0.053979864920259725,73,61,10,2
"I have heard of Angry Looking Clouds, but this one is ready to rumble!!",1.1917808219178083,0.04639817678744647,73,59,14,0
"Yes, it does look angry, but 11% of scientists disagree.",1.1917808219178083,0.05033198101609266,73,60,12,1
I wouldn’t be feeling this alarmed if he were wearing a mask.,1.1917808219178083,0.04639817678744647,73,59,14,0
The gods must be angry. I'd better go get that jug of wine.,1.1917808219178083,0.05033198101609266,73,60,12,1
Cumulus is not the threat they puff themselves up to be.,1.1917808219178083,0.060620630353204315,73,63,6,4
Remember that article on Sunday about the Republicans weaponising the weather?,1.1917808219178083,0.05739637027386542,73,62,8,3
Somebody must have told him there's going to be a parade here.,1.1917808219178083,0.060620630353204315,73,63,6,4
This is not how I envisioned polyamory.,1.1917808219178083,0.05033198101609266,73,60,12,1
What do you mean a vengeful and angry God is coming to smite us? That looks just like Taylor Swift's cat,1.1917808219178083,0.053979864920259725,73,61,10,2
"Honey, don't look at them directly. They might just come this way.",1.1917808219178083,0.05033198101609266,73,60,12,1
Looks more like a monkey riding an elephant to me,1.1917808219178083,0.053979864920259725,73,61,10,2
"Yea, well, the forecast said ‘cloudy with a chance of meatheads’",1.1917808219178083,0.053979864920259725,73,61,10,2
"Remember that time I mistakenly sang, ""Send In The Clouds""?",1.1914893617021276,0.04606848309753145,94,78,14,2
Why is everybody always so mad at us?,1.1914893617021276,0.04848799577537426,94,79,12,3
Don't worry. He's not allowed within six feet.,1.1914893617021276,0.06550379636299904,47,39,7,1
He's upset we didn't bring an umbrella.,1.1911764705882353,0.056443282467648626,68,57,9,2
"Well, at least it's not the marshmellow man.",1.1911764705882353,0.048040410179077814,68,55,13,0
What makes you think I would storm out on you?,1.1911764705882353,0.052410519678289844,68,56,11,1
Don’t talk about his silver lining that way,1.1911764705882353,0.052410519678289844,68,56,11,1
It seems that the clouds are against us.,1.1911764705882353,0.056443282467648626,68,57,9,2
"Honey, did you forget to turn off our upload to cloud?",1.1911764705882353,0.056443282467648626,68,57,9,2
*Bad wind joke*,1.1911764705882353,0.052410519678289844,68,56,11,1
Please tell me that was a Mushroom Quiche,1.1911764705882353,0.060206525381366546,68,58,7,3
The earthly delights of Spring are a test of our prudence. Look at the sky: we will be punished for our impiety.,1.1911764705882353,0.052410519678289844,68,56,11,1
"I am telling the truth – I'm the daughter of Zeus, and Daddy loves to mess with my dates.",1.1911764705882353,0.052410519678289844,68,56,11,1
"Here comes the 
advanced winter of discontent.",1.1911764705882353,0.056443282467648626,68,57,9,2
Kiss her already!,1.1911764705882353,0.056443282467648626,68,57,9,2
Well maybe because it's a cumulus and i called it a cirrus?,1.1911764705882353,0.056443282467648626,68,57,9,2
My weather app said to expect an angry front from California.,1.1911764705882353,0.052410519678289844,68,56,11,1
I'm sorry I forgot the jug of wine.,1.1911764705882353,0.048040410179077814,68,55,13,0
He looks just like your uncle Ted.,1.1911764705882353,0.052410519678289844,68,56,11,1
It reminds me I want a crab Louie,1.1911764705882353,0.052410519678289844,68,56,11,1
That one looks like my father,1.1911764705882353,0.056443282467648626,68,57,9,2
mmm finally some fresh air,1.1911764705882353,0.052410519678289844,68,56,11,1
I feel like the gods are angry with me over a terrible secret - but which one?,1.1910112359550562,0.052701300672173365,89,76,9,4
My ex was a meteorologist.,1.1910112359550562,0.052701300672173365,89,76,9,4
"Honey, did you forgot to turn the lights of at home?",1.1910112359550562,0.04484795700808779,89,73,15,1
Not a big fan of romance I guess,1.1910112359550562,0.04484795700808779,89,73,15,1
At least your mom is not here.,1.1904761904761905,0.05925438255602429,63,53,8,2
"Oh no, it's the rare Karencumulus cloud.",1.1904761904761905,0.054819870042874363,84,72,8,4
Do you think UFOs can come in disguise?,1.1904761904761905,0.05925438255602429,63,53,8,2
I think your ex is stalking us again.,1.1904761904761905,0.049310188462709244,84,70,12,2
Do not taunt Happy Fun Cloud.,1.1904761904761905,0.04986999410368025,63,51,12,0
I wrote a fierce little poem for you. I saved it in the cloud.,1.1904761904761905,0.054763574408528054,63,52,10,1
I wish you hadn’t said “I don’t like the look of that cloud”,1.1904761904761905,0.054763574408528054,63,52,10,1
Just think! You'll be Mrs Rorschach and we can see things together in the world that nobody else can!,1.1904761904761905,0.054763574408528054,63,52,10,1
"Sorry about this, it's hard for him to understand that I'm dating again",1.1904761904761905,0.04986999410368025,63,51,12,0
It looks like there is a storm brewing,1.1904761904761905,0.04310187027192874,84,68,16,0
Looks like it's going to pain.,1.1904761904761905,0.049310188462709244,84,70,12,2
There's a 30 percent chance he's angry.,1.1904761904761905,0.04631018196447773,84,69,14,1
Do you think we are not socially distanced enough?,1.1904761904761905,0.052137859745800555,84,71,10,3
"Is it because you don’t like small talk?”
“No, it’s not that. I just really don’t think we should talk about the weather anymore.”",1.1904761904761905,0.05925438255602429,63,53,8,2
Looks like it's gonna rain rats and hogs.,1.1904761904761905,0.054763574408528054,63,52,10,1
I think it’s called ‘cumulus angryus’”,1.1904761904761905,0.05925438255602429,63,53,8,2
Remember that time when Al Gore won an Oscar?,1.1904761904761905,0.054763574408528054,63,52,10,1
Cloud confrontation swollen up and fed up,1.1904761904761905,0.054763574408528054,63,52,10,1
Reading ‘The Cloud of Unknowing’ during the pandemic rid me of all my anxiety!,1.1904761904761905,0.054763574408528054,63,52,10,1
"I know it looks ominous, but they said the pandemic is over.",1.1904761904761905,0.049310188462709244,84,70,12,2
Do you think he’s mad because we’re blocking the earth?,1.1904761904761905,0.054763574408528054,63,52,10,1
I still think it’s a hoax.,1.1904761904761905,0.054763574408528054,63,52,10,1
I think the Cloud is an overloaded with angry Tweets again”,1.19,0.04425591326123392,100,83,15,2
My storm chasing trip did not end well.,1.1898734177215189,0.05427504385344417,79,67,9,3
This is why we should stay inside,1.1898734177215189,0.05119775815863599,79,66,11,2
It seems our future together looks cloudy.,1.1898734177215189,0.05119775815863599,79,66,11,2
"Well, Sarah,  I see only fluffy kittens.",1.1898734177215189,0.05119775815863599,79,66,11,2
"In his defense, the forecast did say cloudy with a chance of rage.",1.1898734177215189,0.05119775815863599,79,66,11,2
Trump is like an evil cloud hovering over us.,1.1898734177215189,0.05427504385344417,79,67,9,3
We better pack up... those clouds look really threatening.,1.1898734177215189,0.05427504385344417,79,67,9,3
"From the looks of him, he’s all threat but no storm.",1.1898734177215189,0.04792327717974918,79,65,13,1
"Yes, I agree, this climate crisis is a hoax""",1.1898734177215189,0.05119775815863599,79,66,11,2
Did you forget to pay for your extra cloud storage ?,1.1898734177215189,0.05427504385344417,79,67,9,3
Looks like storm clouds are moving in,1.1898734177215189,0.04792327717974918,79,65,13,1
The weather is just awful today.,1.1898734177215189,0.04792327717974918,79,65,13,1
We're running out of storage space in the cloud.,1.1898734177215189,0.04792327717974918,79,65,13,1
I think Mother Nature wants us to start indoor dining again,1.1898734177215189,0.04792327717974918,79,65,13,1
I've got a feeling we're not in Kansas anymore.,1.1896551724137931,0.06249934809931834,58,49,7,2
I defy you to come up with caption!,1.1896551724137931,0.05745613836035109,58,48,9,1
I blame the chemtrails.,1.1896551724137931,0.05192539992843435,58,47,11,0
We have to tell your mother... I'm an alien.,1.1896551724137931,0.06249934809931834,58,49,7,2
I think the Picnic Rapture was a bad idea.,1.1896551724137931,0.05745613836035109,58,48,9,1
The last thing I need is the weather telling me that life isn't all sunshine and rainbows.,1.1896551724137931,0.05192539992843435,58,47,11,0
About my bachelor party...,1.1891891891891893,0.05330844518372843,74,62,10,2
"We should probably pack up, those clouds are looking extremely threatening",1.1891891891891893,0.04971475717491742,74,61,12,1
I see it too. NEVER put hard-boiled eggs in the potato salad.,1.1891891891891893,0.05330844518372843,74,62,10,2
You’re pissed?!?! Try living down here.,1.1891891891891893,0.05330844518372843,74,62,10,2
He's Jake Paul's next opponent,1.1891891891891893,0.05667471724545394,74,63,8,3
"""The umbrella? It's in the car. Do you think we'll need it?""",1.1891891891891893,0.04584019888717137,74,60,14,0
I suppose this means the Angry Birds will be here soon...,1.1891891891891893,0.04971475717491742,74,61,12,1
I have the sense you're angry with me.,1.1891891891891893,0.05330844518372843,74,62,10,2
You weren't kidding when you said your ex was an airhead and full of fluff.,1.1891891891891893,0.05330844518372843,74,62,10,2
Pretty sure he knows we're not vaccinated and are from different households.,1.1891891891891893,0.04971475717491742,74,61,12,1
Should we take a rain check?,1.1891891891891893,0.05667471724545394,74,63,8,3
I was going to say “I’m on cloud 9” but .... .,1.1891891891891893,0.05667471724545394,74,63,8,3
‘But I did say let’s go for a panic.’,1.1891891891891893,0.04971475717491742,74,61,12,1
It’s like Wordsworth said ..” I wandered ANGRY as a cloud”,1.1891891891891893,0.04971475717491742,74,61,12,1
So it was actually global ‘WARNING’ this whole time!?,1.1891891891891893,0.04971475717491742,74,61,12,1
They say ignorance is bliss.,1.1891891891891893,0.05330844518372843,74,62,10,2
"Blame me, I haven't paid for extra data storage.",1.1888888888888889,0.04712573678232538,90,75,13,2
"Not to worry, hot air clouds only reign once.",1.1888888888888889,0.04712573678232538,90,75,13,2
Our cloud servers have become our cloud overlords.,1.1888888888888889,0.04712573678232538,90,75,13,2
"Oh, that's just the dark cloud that's been following me all my life.  Now it wants to kick my ass.",1.1888888888888889,0.04712573678232538,90,75,13,2
"Well, the forecast did mention a chance of unpleasant weather.",1.1888888888888889,0.044397603281480034,90,74,15,1
You see a bunny rabbit?!,1.1886792452830188,0.06629640403806239,53,45,6,2
Looks like some nasty weather coming our way.,1.1884057971014492,0.055688216518499936,69,58,9,2
So how ‘bout this weather?,1.1884057971014492,0.055688216518499936,69,58,9,2
"Yo know, I really miss those isolation days at home.",1.1884057971014492,0.05171962876419153,69,57,11,1
He's upset you thought he looked like a whale.,1.1884057971014492,0.05171962876419153,69,57,11,1
"This gives a whole new meaning to the expression ""threatening clouds.""",1.1884057971014492,0.05171962876419153,69,57,11,1
Its a bluff. There's no lightning.,1.1884057971014492,0.05171962876419153,69,57,11,1
Give me that f-ing baguette!!,1.1884057971014492,0.055688216518499936,69,58,9,2
My app says about 20 minutes of tantrums followed by an insincere apology.,1.1884057971014492,0.05171962876419153,69,57,11,1
I guess Rob Ross must have used up all the happy clouds.,1.1884057971014492,0.05171962876419153,69,57,11,1
"Honey, what did you do to make him angry?",1.1884057971014492,0.05171962876419153,69,57,11,1
"I sometimes have the creeping sensation that the universe is out to get me, then I think to myself, no, I probably just left the stove on.",1.1884057971014492,0.05939221260836197,69,59,7,3
He seems upset that we've almost finished the Camembert,1.1884057971014492,0.04742006474057418,69,56,13,0
"It looks more like a nimbus than a stratocumulus, Betty.",1.1884057971014492,0.055688216518499936,69,58,9,2
I guess I shouldn't have posted that Tweet about the weather.,1.1884057971014492,0.05171962876419153,69,57,11,1
"I hear Climate is going through ""The Change"" - Do you think it's hormonal?",1.1884057971014492,0.05171962876419153,69,57,11,1
Well it’s not a good omen.”,1.1884057971014492,0.055688216518499936,69,58,9,2
Even the heavens have political views!,1.1884057971014492,0.05171962876419153,69,57,11,1
"Cumulus my ass, that thing is pissed.",1.1884057971014492,0.05939221260836197,69,59,7,3
All this time I thought he was in Mar-a-Lago...,1.1884057971014492,0.05939221260836197,69,59,7,3
"Have you been taking Thor's name in vain, again?",1.1884057971014492,0.05939221260836197,69,59,7,3
Just look on the bright side.,1.1884057971014492,0.05939221260836197,69,59,7,3
"You know what they say about the weather in NYC, if you don't like it wait five minutes and go f*@& yourself.",1.1884057971014492,0.04742006474057418,69,56,13,0
it's a furionimbus I think...means it's going to hail,1.1884057971014492,0.05171962876419153,69,57,11,1
"The clouds were angry that day, my friends.",1.1884057971014492,0.05939221260836197,69,59,7,3
Someone still has mask-face,1.1884057971014492,0.05171962876419153,69,57,11,1
Mufasa?,1.1884057971014492,0.05171962876419153,69,57,11,1
Maybe we should move a little further,1.1884057971014492,0.05171962876419153,69,57,11,1
"I'm sorry, I should have told you I'm a meteorologist.",1.188235294117647,0.051569532748121864,85,72,10,3
"I told you, no matter where we go, Big Brother is watching us.",1.188235294117647,0.051569532748121864,85,72,10,3
Now I get the meaning of hangry.,1.188235294117647,0.048778116640986524,85,71,12,2
The landing strip for angry clouds is just past us. I thought we could lie on our backs and watch them fly over.,1.188235294117647,0.051569532748121864,85,72,10,3
My cloud has reached it’s limit on your angry texts.,1.1875,0.058397074018894594,64,54,8,2
"Sure, I've felt threatened before — but never so personally.",1.1875,0.047379928186276406,80,66,13,1
But the AccuWeather 5 Team with Mega Doppler 5000 said it was going to be a nice day.,1.1875,0.042695628191498324,96,79,16,1
I'm not sure he wanted us to come back outside.,1.1875,0.047379928186276406,80,66,13,1
"""I guess it does kind of look like puppies playing together""",1.1875,0.0491747370293402,64,52,12,0
Talk to me about those mushrooms again?,1.1875,0.058397074018894594,64,54,8,2
"Quick, let's get started so he doesn't realize there are two more virgins to sacrifice.",1.1875,0.058397074018894594,64,54,8,2
Even climate change judges us for not wearing a mask.,1.1875,0.047379928186276406,80,66,13,1
It was either this or greenhouse gases.,1.1875,0.047379928186276406,80,66,13,1
I agree. It does look like a goose flying south.,1.1875,0.047555369390792634,96,81,12,3
I wonder what made his barometer rise.,1.1875,0.053644841199706916,80,68,9,3
"My judgement is clouded! I think I am in love with her""",1.1875,0.053983205795288855,64,53,10,1
"Oh sure, I suppose you think we should get vaccinated too.",1.1875,0.05651747237398629,80,69,7,4
"Oh, I forgot to tell you that the weatherman said there was a chance of violent storms.",1.1875,0.058397074018894594,64,54,8,2
side effects of climate change I'm afraid,1.1875,0.047379928186276406,80,66,13,1
Climate change is really getting bad,1.1875,0.058397074018894594,64,54,8,2
"So, what do you see? I hear clouds are the new Rorschach.",1.1875,0.053983205795288855,64,53,10,1
I have a very ominous sense that our first date may be seriously shortened,1.1875,0.050609418996262354,80,67,11,2
Tell me you were joking when you said your dad’s name is Zeus.,1.1875,0.0625,64,55,6,3
"Oh shit, honey, I forgot to synch my new laptop to the cloud.",1.1875,0.058397074018894594,64,54,8,2
Why can't you be like other people and make out a a charming teddy bear or a unicorn?,1.1875,0.053983205795288855,64,53,10,1
"They do seem more serious,somehow.",1.1875,0.058397074018894594,64,54,8,2
I'm sure there's a silver lining behind that frown.,1.1875,0.050609418996262354,80,67,11,2
I’m sorry; clearly I should have swiped left.,1.1875,0.04391357305815796,80,65,15,0
I was hoping for a sunnier disposition.,1.1875,0.058397074018894594,64,54,8,2
"I dunno, they look like they could pack a mean punch.",1.1875,0.050609418996262354,80,67,11,2
"After an awkward picnic date, the council of clouds were in agreement that this was not to be a match made in heaven.",1.1875,0.050609418996262354,80,67,11,2
"Quick, Protect the Brie!",1.1875,0.047379928186276406,80,66,13,1
"Taking about weather, marriage and picnics isn’t ease these days",1.1875,0.047379928186276406,80,66,13,1
I’m guessing he was absent when the silver linings were handed out,1.1875,0.047379928186276406,80,66,13,1
I guess it’s time to look into an electric vehicle.,1.1875,0.0625,64,55,6,3
"Now I'm not a luddite, but the cloud only had a storage of a few killerbytes...",1.1875,0.053983205795288855,64,53,10,1
When’s lunch?,1.1875,0.050609418996262354,80,67,11,2
"We only dated for a month and I promise, it wasn’t serious. His head was always in the clouds.",1.1868131868131868,0.04919892568609763,91,77,11,3
That one? It looks like a poodle to me.,1.1866666666666668,0.05265332251978379,75,63,10,2
They say this climate change thing is like the 7 plagues on Egypt - only it's coming after Republicans.,1.1866666666666668,0.05597082036858787,75,64,8,3
"I've been bullied all my life, and now...a cloud?",1.1866666666666668,0.05597082036858787,75,64,8,3
I just have this feeling that your father really doesn't really like me that much...,1.1866666666666668,0.05265332251978379,75,63,10,2
You don't need a mask.,1.1866666666666668,0.04911223892281852,75,62,12,1
"Put your shoes back on, he's about to sneeze and we don't want to lose the bread and the cheese.",1.1866666666666668,0.04911223892281852,75,62,12,1
I would say something if there were any sense to be made of this.,1.1866666666666668,0.04911223892281852,75,62,12,1
I think we're in for a thunderstorm,1.1866666666666668,0.05597082036858787,75,64,8,3
I suspect this concert isn’t happening.,1.1866666666666668,0.04911223892281852,75,62,12,1
I think he's angry cause we're outside without a mask,1.1866666666666668,0.05910239498610095,75,65,6,4
Where you see dark foreboding I see random cumulonimbus variation.,1.1866666666666668,0.04911223892281852,75,62,12,1
I take this as an omen,1.1866666666666668,0.04911223892281852,75,62,12,1
Here come the acid pain clouds.,1.1866666666666668,0.05265332251978379,75,63,10,2
There's a cumulus among us.,1.1866666666666668,0.05597082036858787,75,64,8,3
It’s not easy being a meteorologist.,1.1866666666666668,0.05265332251978379,75,63,10,2
I don't believe in global warning.,1.1866666666666668,0.05265332251978379,75,63,10,2
I think Mother Nature's upset.,1.1866666666666668,0.05265332251978379,75,63,10,2
The forecast was cloudy with a chance of anger.,1.1866666666666668,0.04911223892281852,75,62,12,1
The weather channel never said anything about 'angry cloud' warnings today.,1.1866666666666668,0.05265332251978379,75,63,10,2
I should not have let that protein shake evaporate.,1.1866666666666668,0.06207619071313455,75,66,4,5
"Beatrice, I'm afraid I misunderstood when you said your father was a weatherman",1.1866666666666668,0.05265332251978379,75,63,10,2
I confess to some baggage,1.1866666666666668,0.04911223892281852,75,62,12,1
"Honey, that star you pointed at wasn’t your Mama after all!",1.1866666666666668,0.0452951614596046,75,61,14,0
i’m confused. Should he be wearing a mask?,1.1866666666666668,0.05597082036858787,75,64,8,3
"Forget recovery, wine in moderation is complementary to a picnic, and is appeasing to the rain God.",1.1866666666666668,0.05597082036858787,75,64,8,3
How would you feel if someone said you looked like a dog?,1.1866666666666668,0.05265332251978379,75,63,10,2
Where's the space force when you need them?,1.1866666666666668,0.04911223892281852,75,62,12,1
"Well, they did say climate change would be a fight",1.1866666666666668,0.05265332251978379,75,63,10,2
They have been seeding the clouds with despair.,1.1864406779661016,0.061514949365445624,59,50,7,2
Is that what happens after inhaling too much greenhouse gas?,1.1864406779661016,0.061514949365445624,59,50,7,2
"When we thought it's all over, they pull us right back into the eye of the storm",1.1864406779661016,0.0565653202898158,59,49,9,1
"You see sheep? Oh, uh—me too.",1.1864406779661016,0.0565653202898158,59,49,9,1
"Regular tourist clouds, dangling by an Embarassing American thread",1.1864406779661016,0.061514949365445624,59,50,7,2
I forgot to increase my cloud storage quota.,1.1864406779661016,0.061514949365445624,59,50,7,2
I could’ve sworn you said you were haunted by clowns,1.1864406779661016,0.0565653202898158,59,49,9,1
"Ugh, I’ll go buy the toilet paper.",1.1864406779661016,0.0565653202898158,59,49,9,1
Are the heavens always angry like this? Or maybe it's just about us...,1.186046511627907,0.05101333724100219,86,73,10,3
Another thing in common....I also bombed on my Rorschach test.,1.186046511627907,0.05101333724100219,86,73,10,3
The blue screen of death was much friendlier than cloud computer crashes.,1.186046511627907,0.0482572560890765,86,72,12,2
"Hmm, Cupid sure has changed.",1.186046511627907,0.0482572560890765,86,72,12,2
Limburger probably was not the right choice.”,1.1857142857142857,0.05104642933009962,70,58,11,1
Maybe there really is global warming.,1.1857142857142857,0.05495285818136392,70,59,9,2
If we take Manhattan do we have to take Staten Island too?,1.1857142857142857,0.05104642933009962,70,58,11,1
Silver lining? I don't see any silver lining.,1.1857142857142857,0.04681516071108391,70,57,13,0
"When we can escape to the park, a feeling of serenity overcomes me.",1.1857142857142857,0.05495285818136392,70,59,9,2
"Pandemic, Murder Hornets, now this...I guess life's not a picnic after all.",1.1857142857142857,0.05859944792614804,70,60,7,3
Did I mention I'm in debt to the cloud mafia?,1.1857142857142857,0.05104642933009962,70,58,11,1
So what did you think of the CBD brownies?,1.1857142857142857,0.05495285818136392,70,59,9,2
Lately I’ve been feeling as if I’m under a dark cloud.,1.1857142857142857,0.05104642933009962,70,58,11,1
I see a puppy.,1.1857142857142857,0.05495285818136392,70,59,9,2
"If this date does not go well, he'll let me know",1.1857142857142857,0.05104642933009962,70,58,11,1
Cumulobrutus clouds are rolling through.,1.1857142857142857,0.05495285818136392,70,59,9,2
The weather forecast did mention threatening clouds with a chance of a popup shower.,1.1857142857142857,0.05495285818136392,70,59,9,2
I think I'm lacto-gluten intolerant.,1.1857142857142857,0.05859944792614804,70,60,7,3
"I'm sure He is warning all  of us, our behavior is despicable.",1.1857142857142857,0.05104642933009962,70,58,11,1
The difference between cumulus and curmudgeon are the little streaks of self-righteousness.,1.1857142857142857,0.05104642933009962,70,58,11,1
"I just thought the weatherman misspoke when he said, ""Partly cloudy with a ten percent chance of pain"".",1.1857142857142857,0.05104642933009962,70,58,11,1
The Trump cloud,1.1857142857142857,0.05859944792614804,70,60,7,3
I did upload some porn...,1.1857142857142857,0.04681516071108391,70,57,13,0
"This must be the war mad humid air coming from the west, from today's forecast.",1.1857142857142857,0.05104642933009962,70,58,11,1
No summer in the city,1.1857142857142857,0.05495285818136392,70,59,9,2
"Well I checked the forecast, but I don't remember seeing that",1.1857142857142857,0.05104642933009962,70,58,11,1
"If we leave, cancel culture wins",1.1857142857142857,0.05104642933009962,70,58,11,1
I think they know our food packaging isn’t recyclable.,1.1857142857142857,0.05495285818136392,70,59,9,2
I still don’t know what ‘high pressure system’ means.,1.1857142857142857,0.05495285818136392,70,59,9,2
Look at those gains,1.1857142857142857,0.06203203988422092,70,61,5,4
I told you not to forget the umbrella,1.1857142857142857,0.05859944792614804,70,60,7,3
I knew we should have deleted those pictures before they were backed up to the cloud!,1.1857142857142857,0.05104642933009962,70,58,11,1
"But, dear, to quote Bob Dylan...",1.1851851851851851,0.043429775553920656,81,66,15,0
Think you can weather the storm?,1.1851851851851851,0.046848557928420444,81,67,13,1
Who did you say your father was again?,1.1851851851851851,0.05302896690102354,81,69,9,3
"This might be a good time to tell you a bit about myself, weather-wise.",1.1851851851851851,0.055863344922216146,81,70,7,4
I think climate change may be a personality disorder.,1.1851851851851851,0.046848557928420444,81,67,13,1
"The forecast did say ""Chance of childhood fears surfacing this afternoon"".",1.1851851851851851,0.05302896690102354,81,69,9,3
Michael immediately regretted hiring an abstract artist sky writer to show Caroline his “thunderstruck love.”,1.1851851851851851,0.05302896690102354,81,69,9,3
That formation is called cumulus scare us,1.1851851851851851,0.0500342818003937,81,68,11,2
