caption,mean,precision,votes,not_funny,somewhat_funny,funny
"TAKE NOTICE!  
It's drooling and it's not wearing a mask. Quick, cover the brie.",1.1408450704225352,0.04157742116654289,71,61,10,0
The gods must be angry unless they just don' appreciate liverwurst.,1.1408450704225352,0.046163800079517044,71,62,8,1
He hates the music they've been playing.  It's louder than his thunder.,1.1408450704225352,0.04157742116654289,71,61,10,0
I guess this is what the hipster meteorologist meant when he said it’s gonna get “wicked mad cloudy” today.,1.1408450704225352,0.04157742116654289,71,61,10,0
Couples counseling might be an option.,1.1408450704225352,0.04157742116654289,71,61,10,0
OK. I'm SORRY I didn't propose years ago.,1.1408450704225352,0.04157742116654289,71,61,10,0
I cloud is angry cloud.,1.1408450704225352,0.046163800079517044,71,62,8,1
I think Nature will get back at us someday.,1.1408450704225352,0.05033399372892188,71,63,6,2
"Maybe it wants your shoes, not our hoagie . . .",1.1408450704225352,0.05033399372892188,71,63,6,2
Grey skies are not going to clear up! See my face,1.1408450704225352,0.05033399372892188,71,63,6,2
The forecast did say cloudy with a chance of grumpiness,1.1408450704225352,0.046163800079517044,71,62,8,1
You didn't tell me your father is an angry rain cloud.,1.1408450704225352,0.05033399372892188,71,63,6,2
Why do they always copy us?,1.1408450704225352,0.04157742116654289,71,61,10,0
"Who let the newyorkers out? Going about, stealing my thunder.  (I am not a newyorker, but fun contest)",1.1408450704225352,0.046163800079517044,71,62,8,1
The doctor says my head is in the clouds.,1.1408450704225352,0.04157742116654289,71,61,10,0
"You know, behind every cloud is a figure biding",1.1408450704225352,0.046163800079517044,71,62,8,1
Looks like it might reign.,1.1408450704225352,0.05033399372892188,71,63,6,2
Egad! Acid rain flashback!!,1.1408450704225352,0.04157742116654289,71,61,10,0
The weatherman said it would be 75° and sunny on the 7-day forecast but the climate scientist insisted it will be four to five more decades of this.,1.1408450704225352,0.046163800079517044,71,62,8,1
What makes you think we need a prenup?,1.140625,0.043797805514170944,64,55,9,0
"Looks a little like a crab, doesn’t he? Or maybe it’s your ex?",1.140625,0.043797805514170944,64,55,9,0
You might want to put your shoes on!,1.140625,0.04913531839612815,64,56,7,1
I think my cat passed gas.,1.140625,0.053947300765845876,64,57,5,2
"I'm telling you, those are definitely cumulus clouds!",1.140625,0.04913531839612815,64,56,7,1
"Yeah uh, so as I was saying my ex and I had a really amicable break-up",1.140625,0.04913531839612815,64,56,7,1
I uploaded the climate change report to the cloud...,1.140625,0.04913531839612815,64,56,7,1
The end of the mastlessness is neigh,1.140625,0.04913531839612815,64,56,7,1
What! We're not even on his cloud.,1.140625,0.04913531839612815,64,56,7,1
"Okay, so we don't really need to be friends, but please stop channeling your rage into the atmosphere.",1.140625,0.04913531839612815,64,56,7,1
Does your jealous ex have a super power I should know about?,1.140625,0.053947300765845876,64,57,5,2
The climate just seems so entitled to me.,1.140625,0.053947300765845876,64,57,5,2
"OH, I forgot to tell you Helen, I just transferred all my aggressive feelings toward you to the Cloud.",1.140625,0.053947300765845876,64,57,5,2
Do you reckon that's a Texas cloud?,1.140625,0.043797805514170944,64,55,9,0
We should have just gone to the movies…,1.140625,0.043797805514170944,64,55,9,0
"Maybe he’s thinking if one more couple stores an unoriginal “picnic at the park” photo in me, I am going to literally dissolve. No selfies today Sue.",1.140625,0.04913531839612815,64,56,7,1
"Honey, let's get out of here. That angry father cloud just told his offspring that they'd be able to breathe easier if we would all walk to picnics in our city park.",1.140625,0.04913531839612815,64,56,7,1
Feels nice to go back to worrying about fuming pollution.,1.140625,0.04913531839612815,64,56,7,1
Let's stick around for the rainbow.,1.1403508771929824,0.046416689667799826,57,49,8,0
They're COVID protocol enforcers- just making sure we socially distance,1.1403508771929824,0.05273590328947571,57,50,6,1
They’re just more stressed since people started storing their information there.,1.1403508771929824,0.05273590328947571,57,50,6,1
"Are you seeing this, or is it just me?",1.1403508771929824,0.046416689667799826,57,49,8,0
I can't marry until climate change happens.,1.1403508771929824,0.05273590328947571,57,50,6,1
They haven’t yet created a vaccine for the clouds.,1.1403508771929824,0.05837501102181511,57,51,4,2
I guess the Climate Change Deniers rally must have wrapped up.,1.1403508771929824,0.05273590328947571,57,50,6,1
"Now that the pandemic is over, I foresee only bright and sunny days",1.1403508771929824,0.05273590328947571,57,50,6,1
"I’m sorry, I just don’t see a unicorn, I see three angry men. Everything is subjective, babe.",1.1403508771929824,0.05273590328947571,57,50,6,1
Humans are out - my anger stems from the soon negative impacts of ultimate anthropogenic emissions.,1.1403508771929824,0.05273590328947571,57,50,6,1
"That's fine, I was hoping you would offer your own view, people are such pessimists.",1.14,0.04956957592256425,50,43,7,0
There are some consequences of climate change that we cannot yet explain.,1.14,0.05721424112714514,50,44,5,1
Is this the real life? Is this just fantasy?,1.14,0.04956957592256425,50,43,7,0
I'm glad we can finally meet outdoors But every silver lining has a cloud.,1.1395348837209303,0.037583616572355615,86,74,12,0
I think maybe the New Yorker might want to recognize the @newyorkerunion pretty soon….,1.1395348837209303,0.06297704189640278,43,38,4,1
"No, I don't see a horse running on a beach.",1.139240506329114,0.043140950178920556,79,69,9,1
What! No potato salad for me?,1.139240506329114,0.043140950178920556,79,69,9,1
"I told you, Jake, it´s called ""projection"", you see what you are on everything, that's why the clouds are angry!",1.139240506329114,0.046751593846233896,79,70,7,2
"Everyone on 1/1/20: “I think 2020 will be great!”
2020:",1.139240506329114,0.043140950178920556,79,69,9,1
"It’ll be fine, it’s only threatening to rain”.",1.139240506329114,0.046751593846233896,79,70,7,2
I think you need to up your medication.,1.139240506329114,0.043140950178920556,79,69,9,1
"Yes,it does look a bit like famed Swiss psychoanalyst Herman Rorschach.",1.139240506329114,0.043140950178920556,79,69,9,1
Do you think every cloud has a silver lining?,1.139240506329114,0.039199128019855194,79,68,11,0
"I'm not sure, I can never remember the difference between Cumulus and Cumulonimbus",1.1388888888888888,0.04556013565281042,72,63,8,1
They have finally had enough of our nonsense,1.1388888888888888,0.04556013565281042,72,63,8,1
May 25th 2021,1.1388888888888888,0.04104253469235572,72,62,10,0
"I don't see it, why do you think that cloud looks like my Mother?",1.1388888888888888,0.04556013565281042,72,63,8,1
"Magic"" mushrooms? More like ""Malevolent"" mushrooms",1.1388888888888888,0.04556013565281042,72,63,8,1
No-one else is wearing masks.,1.1388888888888888,0.04556013565281042,72,63,8,1
"perhaps, He wants us to stop saying we are a 'match made in heaven'",1.1388888888888888,0.04556013565281042,72,63,8,1
That wasn't a microdose.,1.1388888888888888,0.04966852391033734,72,64,6,2
He wants something from you you’ll never be able to give him.,1.1388888888888888,0.04104253469235572,72,62,10,0
"It’s the cheese, or your feet have upset the  atmosphere.",1.1388888888888888,0.04104253469235572,72,62,10,0
If they would just use sunscreen they wouldn't get so thunder-headed.,1.1388888888888888,0.04104253469235572,72,62,10,0
The clouds look menacing and you still doubt climate change !,1.1388888888888888,0.05346212279886589,72,65,4,3
I'm starting to think this climate change thing might be real.,1.1388888888888888,0.04556013565281042,72,63,8,1
I guess you could say that one looks pretty steamed.,1.1388888888888888,0.04104253469235572,72,62,10,0
"All this talk about climate change... frankly my dear, I don’t give a damn.",1.1388888888888888,0.04556013565281042,72,63,8,1
Not every cloud looks like it's from Star Wars!,1.1388888888888888,0.04556013565281042,72,63,8,1
Is it me or are these Chemtrails getting more  like a wizard of Oz movie?,1.1388888888888888,0.04104253469235572,72,62,10,0
No matter how dark it gets we will be ok.,1.1388888888888888,0.04556013565281042,72,63,8,1
So I guess the Covid gods are ticked off about high vaccine efficacy or it's just going to be a hell of a rainstorm,1.1384615384615384,0.04842183966159297,65,57,7,1
Your expectations are a bit clouded with the current reality.,1.1384615384615384,0.053154903696481744,65,58,5,2
Not my idea of an angel  -,1.1384615384615384,0.04842183966159297,65,57,7,1
Only face I'm seeing is your Dad's if I get you home late.,1.1384615384615384,0.043172969847391635,65,56,9,0
I did not think that chasing your dark clouds away cwould cause such a storm of indignation,1.1384615384615384,0.053154903696481744,65,58,5,2
"Get the camera, Baby. There’s a withering disappointment rolling in.",1.1384615384615384,0.053154903696481744,65,58,5,2
I Want Out.,1.1384615384615384,0.043172969847391635,65,56,9,0
I think it looks like Arnold,1.1384615384615384,0.04842183966159297,65,57,7,1
"Cloud formations are always so dramatic in the Park. 
Our bread and cheese will add that perfect touch!",1.1384615384615384,0.04842183966159297,65,57,7,1
"Honey, I think a storm is brewing!",1.1384615384615384,0.043172969847391635,65,56,9,0
"Not to worry. I have planned for the chance of conniving, cumulonimbus clouds. However, I did not plan to disclose my foot fetish today. So...",1.1384615384615384,0.043172969847391635,65,56,9,0
"Don't worry, The Cirrus are much more dangerous.",1.1384615384615384,0.053154903696481744,65,58,5,2
I think you were right. We should have gone to one of the restaurants with inside-outside seating.,1.1384615384615384,0.04842183966159297,65,57,7,1
This anti-climate change picnic may not have been the best idea.,1.1384615384615384,0.043172969847391635,65,56,9,0
I think it needs a change of climate,1.1384615384615384,0.04842183966159297,65,57,7,1
"Adam, when You told me we will have a cool shower before the baby comes, I though it will be for the baby, Adam, for the baby...",1.1384615384615384,0.043172969847391635,65,56,9,0
I still think dining outside should be fine tonight,1.1384615384615384,0.043172969847391635,65,56,9,0
'I'm worried my invisible friend is angry with me.',1.1384615384615384,0.053154903696481744,65,58,5,2
"Hypothetically, scale of one to ten, how difficult would it be for the cloud to disappear?",1.1384615384615384,0.043172969847391635,65,56,9,0
Mayhem is everywhere.,1.1384615384615384,0.04842183966159297,65,57,7,1
"Sure Jerry’s head is in the clouds but I love him! Steve, I want a divorce.",1.1384615384615384,0.04842183966159297,65,57,7,1
This is classic Cloudspreading and those poor cirrus girls he’s clouding out shouldn’t have to stand for this!,1.1384615384615384,0.04842183966159297,65,57,7,1
Storm's a-stewin',1.1379310344827587,0.045673529553966995,58,50,8,0
Life was easier when we used to see a Doggie and a Cat,1.1379310344827587,0.05741073642646482,58,52,4,2
I'm beginning to think the environment is tired of us.,1.1379310344827587,0.045673529553966995,58,50,8,0
"I suppose we shouldn't take it personally, or do you have something you haven't told me?",1.1379310344827587,0.040619414815555276,87,76,10,1
Looks like we're going to get pounded.,1.1379310344827587,0.045673529553966995,58,50,8,0
Our God approacheth.,1.1379310344827587,0.045673529553966995,58,50,8,0
"The cloud appears to be stormy and pregnant, but it's not mine.",1.1379310344827587,0.05187515763323573,58,51,6,1
angry rain seems to be heading this way,1.1379310344827587,0.05187515763323573,58,51,6,1
"After having submitted 90 captions over the past four years, today I have won the 752nd New Yorker Caption Contest.",1.1379310344827587,0.046739204878581554,87,78,6,3
"My judgement is a bit clouded, I need bread!",1.1379310344827587,0.05741073642646482,58,52,4,2
"Oh sure, blame it on “bad vibes” again.",1.1379310344827587,0.045673529553966995,58,50,8,0
"Didn""t see this on the Weather Channel.",1.1375,0.04619629964906088,80,71,7,2
"You said it was only bad weather, not mean weather.",1.1375,0.042633817622437835,80,70,9,1
I’ve looked at clouds from both sides now...,1.1375,0.042633817622437835,80,70,9,1
"No, I don't think it is because of something you did.",1.1375,0.042633817622437835,80,70,9,1
Excuse me.,1.1375,0.042633817622437835,80,70,9,1
"You can pick your friends, but you can’t pick your clouds.”",1.1375,0.03874515077865563,80,69,11,0
"As a personal favor, I'm asking you to ignore it.",1.1375,0.03874515077865563,80,69,11,0
Oh my fucking god we are so fucked.,1.1372549019607843,0.06871143320758917,51,47,1,3
"Oh, that's just God.  Angry that we're not hugging.
He'll go away once we're fruitful and multiply.",1.1372549019607843,0.048665386847023,51,44,7,0
The clouds look beautiful today—you can almost see the storm coming!,1.1372549019607843,0.05614831789520141,51,45,5,1
"If you ignore it hard enough and truly, TRULY believe, this too will someday transform into just another problem for Gen Z to fix.",1.1372549019607843,0.0369671833309425,102,89,12,1
And you said it was just Weather Channel  hype.”,1.1369863013698631,0.05275899547164993,73,66,4,3
I still don't believe in climate change.,1.1369863013698631,0.04052109440479185,73,63,10,0
Forecast said a high pressure zone would come in.,1.1369863013698631,0.04902034372964355,73,65,6,2
Cumulonimbus? More like Cumulo-NIMBY,1.1369863013698631,0.04902034372964355,73,65,6,2
I think he’s cirrus this time.,1.1369863013698631,0.04497195343285888,73,64,8,1
Do you believe in Fate?,1.1369863013698631,0.04902034372964355,73,65,6,2
Complicity’s a bitch!,1.1369863013698631,0.04902034372964355,73,65,6,2
Jakkals trou met wolf se vrou,1.1369863013698631,0.04052109440479185,73,63,10,0
"Is it just me, or does that cloud remind you of your Dad when he found out we eloped?",1.1369863013698631,0.04497195343285888,73,64,8,1
"Like your mom said, there are consequences for not cleaning up.",1.1369863013698631,0.04902034372964355,73,65,6,2
I think that the forecast of a little rain might be a little under rated!,1.1369863013698631,0.04902034372964355,73,65,6,2
where do you see yourself in 5 years?,1.1369863013698631,0.04497195343285888,73,64,8,1
Strange.  I had a sudden thought of Ghostbusters.,1.1369863013698631,0.04497195343285888,73,64,8,1
"‘No, I think he’s looking at you.’",1.1369863013698631,0.04052109440479185,73,63,10,0
"No, Cheryl, that cloud doesn’t want to be your friend.",1.1369863013698631,0.04497195343285888,73,64,8,1
Damn these panic attacks. They really cloud me.,1.1369863013698631,0.04497195343285888,73,64,8,1
"Uh oh, the clouds are horny again.",1.1369863013698631,0.04052109440479185,73,63,10,0
Got any Bean-O from Costco?!,1.1369863013698631,0.04052109440479185,73,63,10,0
Greta didn't mention this  possibility.,1.1363636363636365,0.04772866020849245,66,58,7,1
The weatherman said it would only look threatening.,1.1363636363636365,0.04772866020849245,66,58,7,1
Those Lewis Black clouds look angry,1.1363636363636365,0.04772866020849245,66,58,7,1
The Covid gods are upset we’ve reentered society.,1.1363636363636365,0.042565532289603344,66,57,9,0
Now there's some angry storm clouds!,1.1363636363636365,0.0523853555060782,66,59,5,2
Don’t let it bother you; people feel all kinds of emotions looking at clouds!,1.1363636363636365,0.0523853555060782,66,59,5,2
"So – climate change. Science or hoax?""",1.1363636363636365,0.04772866020849245,66,58,7,1
Eternal damnation for leaving the seat up?,1.1363636363636365,0.042565532289603344,66,57,9,0
I feel this cloud of suspicion every time I go out without a mask,1.1363636363636365,0.04772866020849245,66,58,7,1
"That must be the new super hero, Stratocumulus.",1.1363636363636365,0.04772866020849245,66,58,7,1
I thought El Nino was just a figure of speech.,1.1363636363636365,0.04772866020849245,66,58,7,1
"Is it just me? Or, is that hotdog trying to wriggle away from an angry bun?",1.1363636363636365,0.04772866020849245,66,58,7,1
You see your boyfriend?,1.1363636363636365,0.04772866020849245,66,58,7,1
I just think we should seek new horizons.,1.1363636363636365,0.04772866020849245,66,58,7,1
Why on earth did you call him a powder puff?,1.1363636363636365,0.04772866020849245,66,58,7,1
Looks like kidney stones.,1.1363636363636365,0.040185756578953784,88,77,10,1
We’ve got to be more careful about what we store in the Cloud.,1.1363636363636365,0.04772866020849245,66,58,7,1
We need to talk about where I got your ring's silver lining.,1.1363636363636365,0.0523853555060782,66,59,5,2
Don't kiss me. St. Cloud is watching.,1.1363636363636365,0.040185756578953784,88,77,10,1
I thought the forecast was for nice weather.,1.1363636363636365,0.04772866020849245,66,58,7,1
Does that remind you of anyone?,1.1363636363636365,0.043314293849451554,88,78,8,2
It's God again. Trying to put a face on an angry climate.,1.1363636363636365,0.0523853555060782,66,59,5,2
That must be the raging storm that was predicted.,1.1363636363636365,0.04772866020849245,66,58,7,1
I still can’t see it. I just see two pawns stuck together,1.1363636363636365,0.042565532289603344,66,57,9,0
... there's something more!,1.1363636363636365,0.042565532289603344,66,57,9,0
We probably need to stop funding Elon Musk.,1.1363636363636365,0.042565532289603344,66,57,9,0
"The couple, on cloud nine, encounter “cloud three,” the forgotten and angry trio seeking revenge.",1.1363636363636365,0.04772866020849245,66,58,7,1
I tried to warn you not to say 'moist' three times fast,1.1363636363636365,0.040185756578953784,88,77,10,1
Maybe we should have walked instead of driving...,1.1363636363636365,0.042565532289603344,66,57,9,0
The future isn't looking so bright for us,1.1363636363636365,0.04772866020849245,66,58,7,1
So when you said your past was cloudy...,1.1363636363636365,0.042565532289603344,66,57,9,0
"Sorry honey, I guess I was wrong about the weather. They said sunny with a chance of herd immunity”",1.1363636363636365,0.04772866020849245,66,58,7,1
I think my pareidolia has taken a dark turn.,1.1363636363636365,0.04772866020849245,66,58,7,1
I believe there is some climate that doesn't like change.,1.1358024691358024,0.04565398046197679,81,72,7,2
You didn't tell me that your husband is so high up.,1.1358024691358024,0.03830146187034216,81,70,11,0
No rain in the forecast...it's just my ex-wife is the weather reporter at Channel 6.,1.1358024691358024,0.04565398046197679,81,72,7,2
It’s a nasty recently described Cirrus Seditionist Cloud....let’s get to shelter quickly,1.1358024691358024,0.04565398046197679,81,72,7,2
Are you mad at me?,1.1358024691358024,0.03830146187034216,81,70,11,0
That cloud looks like your mom!!!,1.1358024691358024,0.03830146187034216,81,70,11,0
I think I just uploaded my latent anger to the cloud.,1.1355932203389831,0.051041903681298045,59,52,6,1
Who knew the Weather Gods would require a knife for their cheese sacrifice?,1.1355932203389831,0.05647768999662433,59,53,4,2
I hope that's not the cloud we stored our research data in,1.1355932203389831,0.044953558206965276,59,51,8,0
The days of the fluffy bunnies are over.,1.1355932203389831,0.044953558206965276,59,51,8,0
Your ex? I bet there's a story there.,1.1355932203389831,0.051041903681298045,59,52,6,1
"My ex, how to describe him...he was quite...cumulus.",1.1355932203389831,0.051041903681298045,59,52,6,1
Your ex husband is a cloud?,1.1355932203389831,0.051041903681298045,59,52,6,1
"Nothing's the matter, nothing at all.",1.1355932203389831,0.051041903681298045,59,52,6,1
I thought you blew off Aeolus.,1.1355932203389831,0.044953558206965276,59,51,8,0
Greenhouse gas is colorless even when it's angry.,1.1355932203389831,0.044953558206965276,59,51,8,0
I guess it was a slight chance of pain.,1.1355932203389831,0.051041903681298045,59,52,6,1
"Don’t worry, it’s mostly just hot air",1.1355932203389831,0.05647768999662433,59,53,4,2
A Sunday Afternoon on the Island of La Grande Jatte,1.1355932203389831,0.05647768999662433,59,53,4,2
"Oh,now I see what is stopping DOGE from going to the moon. I should call Elon.",1.135135135135135,0.040012605956627305,74,64,10,0
Why us ?,1.135135135135135,0.044398669826762854,74,65,8,1
I've never felt so smitten.,1.135135135135135,0.040012605956627305,74,64,10,0
"We may not agree on much,but you have to agree...those clouds look awfully menacing!",1.135135135135135,0.040012605956627305,74,64,10,0
Even our relationship is mostly in the cloud these days...,1.135135135135135,0.044398669826762854,74,65,8,1
Arthur felt confident his Gene Kelly impersonation would win Helen's heart.,1.135135135135135,0.04838879136051528,74,66,6,2
Oh no – I saw him last summer. We should get out of here.,1.135135135135135,0.040012605956627305,74,64,10,0
"No, no, it's okay, I had my second jab!",1.135135135135135,0.040012605956627305,74,64,10,0
"Wait till you hear the Sound of my Thunder,
You will leave with the Speed of my Lightning.",1.135135135135135,0.044398669826762854,74,65,8,1
Was it insulting to call them ‘wispy’?,1.135135135135135,0.040012605956627305,74,64,10,0
What a gorgeous day it is in London!,1.135135135135135,0.044398669826762854,74,65,8,1
Raindrops keep falling on my head.,1.135135135135135,0.044398669826762854,74,65,8,1
"Cloud nine will drift in soon, don't worry about those first three",1.135135135135135,0.044398669826762854,74,65,8,1
This phone cannot be backed up because there is not enough cloud storage available. You can mange your storage in settings.,1.135135135135135,0.04838879136051528,74,66,6,2
The day I believe in climate change will be the day the clouds come to life.,1.135135135135135,0.044398669826762854,74,65,8,1
Have no fear. They're just workout clouds.,1.1346153846153846,0.04779328093727965,52,45,7,0
For every drop of rain that falls...someone will get hurt,1.1346153846153846,0.055121189353288455,52,46,5,1
"You know, this is usually when Iron Man shows up. When the sky starts looking strange.",1.1346153846153846,0.055121189353288455,52,46,5,1
"Honey, we did all get vaccinated didn’t we?",1.1343283582089552,0.041974785069899656,67,58,9,0
The pandemic has led to cloud-sourcing serious anger.,1.1343283582089552,0.04705493189919477,67,59,7,1
"Scientists are saying the climate's going through ""The Change"" at the moment",1.1343283582089552,0.0516376863386756,67,60,5,2
They’re even more ominous when you give them names.,1.1343283582089552,0.04705493189919477,67,59,7,1
"Is it my imagination,or is that cloud staring at me with malicious intent?",1.1343283582089552,0.041974785069899656,67,58,9,0
"Oh, I forgot... it's not just your birthday, it's Earth Day""",1.1343283582089552,0.04705493189919477,67,59,7,1
"Honey, I think your head's in the clouds again.",1.1343283582089552,0.04705493189919477,67,59,7,1
"He's giving us ""angry skies"" I would suppose.",1.1343283582089552,0.04705493189919477,67,59,7,1
Now you did it!  Here comes the big thunder and it's not from down under!,1.1343283582089552,0.041974785069899656,67,58,9,0
No comment.,1.1343283582089552,0.04705493189919477,67,59,7,1
It's not you.  It's me...isn't it ?,1.1343283582089552,0.0516376863386756,67,60,5,2
I think they want the park.,1.1343283582089552,0.041974785069899656,67,58,9,0
I SHOULD HAVE LISTENED TO YOU ABOUT CLIMATE CHANGE,1.1343283582089552,0.041974785069899656,67,58,9,0
I've never seen the skies so angry!,1.1343283582089552,0.04705493189919477,67,59,7,1
What’s your guess? Vaccinated or not?,1.1343283582089552,0.041974785069899656,67,58,9,0
You’ll move heaven and earth? We’ll see.,1.1343283582089552,0.04705493189919477,67,59,7,1
Do you think this is what they mean by 'extreme weather'?,1.1343283582089552,0.041974785069899656,67,58,9,0
"Don't worry, it's just an old acid flashback.",1.1343283582089552,0.04705493189919477,67,59,7,1
"After 45 years of denial and neglect, is it any wonder we have angry radicals?",1.1343283582089552,0.0516376863386756,67,60,5,2
"Send in the Clouds"" was never one of my favorites",1.1343283582089552,0.04705493189919477,67,59,7,1
Your moodiness should be reflective of the weather!,1.1343283582089552,0.041974785069899656,67,58,9,0
"« As soon as I noticed there were three, I found them oddly satisfying. »",1.1343283582089552,0.041974785069899656,67,58,9,0
"Would you please not look him in the eyes, I'm not the type to win fights!",1.1343283582089552,0.04705493189919477,67,59,7,1
"life is returning to normal, just look to the horizon",1.1343283582089552,0.0516376863386756,67,60,5,2
The Smug is crazy this time of year,1.1343283582089552,0.041974785069899656,67,58,9,0
"Breaking up with me because ‘it feels like EVERYTHING is against us’? Really? Is that not just a BIT hyperbolic, Nancy?",1.1343283582089552,0.041974785069899656,67,58,9,0
Those are hangry clouds!  Hide the food!,1.1343283582089552,0.041974785069899656,67,58,9,0
I knew I shouldn’t have uploaded those images to the cloud.,1.1343283582089552,0.04705493189919477,67,59,7,1
Methinks it's your Father,1.1341463414634145,0.037867719817024754,82,71,11,0
"Yeah, that's my ex. He was banished to the skies after he broke my restraining order against him. Real antediluvian stuff. Anyways, what made you join OK Cupid?",1.1341463414634145,0.041654271406339864,82,72,9,1
‘The Pentagon is really taking its time on that UFO report.’,1.1341463414634145,0.045124189174381366,82,73,7,2
"I must say, the park musicians are on another level this year.",1.1333333333333333,0.05023485333552976,60,53,6,1
"I wish you could’ve met my mom, she would’ve loved you.",1.1333333333333333,0.051406640063737324,75,68,4,3
