caption,mean,precision,votes,not_funny,somewhat_funny,funny
Why did you have  to badmouth the skyline?,1.2682926829268293,0.060233362522744895,82,64,14,4
How fast can you run in those heels?,1.2682926829268293,0.057679665728435664,82,63,16,3
"Is it me, or is this cloud judging us?",1.2682926829268293,0.057679665728435664,82,63,16,3
Cirrus envy.,1.2682926829268293,0.057679665728435664,82,63,16,3
Weather’s especially threatening today,1.268041237113402,0.05387769319682185,97,75,18,4
I think we've been uploading too much to the Cloud.,1.268041237113402,0.051846207112077713,97,74,20,3
That reminds me. Trump said he’s going to run again in 2024.,1.268041237113402,0.0558353154957798,97,76,16,5
The forecast did say 'partly cloudy with a chance of pain.',1.267605633802817,0.06640448725132937,71,56,11,4
I tell you that is not Donald Trump!,1.267605633802817,0.07221069796751049,71,58,7,6
Is your mother in town?,1.267605633802817,0.06003937835511713,71,54,15,2
I told you not to call the weather ugly,1.267605633802817,0.06003937835511713,71,54,15,2
YOU'RE the Key Master?,1.267605633802817,0.06640448725132937,71,56,11,4
"I hate asking about exes on first dates, but can you tell me a little more about Zeus?",1.267605633802817,0.06936836753184764,71,57,9,5
Wait.. You’re married?!?,1.267605633802817,0.06003937835511713,71,54,15,2
"I thought you were joking when you called your ex a '
god among men'",1.2674418604651163,0.05590792363042257,86,66,17,3
Do you think God is mad at us?I thought we were just going to have a picnic.,1.2674418604651163,0.06282109007584707,86,69,11,6
It didn't like my joke about the weather.,1.2674418604651163,0.05590792363042257,86,66,17,3
I'm sensing stratus anxiety.,1.2674418604651163,0.05340503827774727,86,65,19,2
"Honey, can we go? I'm starting to feel a little nephophobic.",1.2674418604651163,0.05590792363042257,86,66,17,3
Is it just me or are storms more violent lately?,1.2666666666666666,0.06390683910258811,75,59,12,4
"What makes you think that climate change is real?""",1.2666666666666666,0.06666666666666668,75,60,10,5
I sense your umbrella is worthless at this point.,1.2666666666666666,0.05653322026700586,90,70,16,4
The skies look angry today.,1.2666666666666666,0.054799662435119106,75,56,18,1
Did I tell you about my ex?,1.2666666666666666,0.06390683910258811,75,59,12,4
I guess we shouldn’t have talked about the weather.,1.2666666666666666,0.05427998805840393,90,69,18,3
Heaven has finally gotten woke.,1.2666666666666666,0.061022321520274245,75,58,14,3
I guess forgetting the ant spray won't be the biggest of our problems.,1.2666666666666666,0.06666666666666668,75,60,10,5
"As you can probably tell, I’ve dealt with my anger issues and I’m ready to move forward.",1.2666666666666666,0.057994511493445346,75,57,16,2
"I repeat ""I don't have a silver lining!""",1.2666666666666666,0.06666666666666668,75,60,10,5
"See Susan, you're Greek Mythology jokes  aren't funny",1.2659574468085106,0.05056426495224639,94,71,21,2
"Oh I don’t know, people see all kinds of stuff up there",1.2658227848101267,0.05895569816249504,79,61,15,3
Don't give me that crap about its silver lining.,1.2658227848101267,0.05895569816249504,79,61,15,3
I think it's going to rain on our parade.,1.2658227848101267,0.05895569816249504,79,61,15,3
Don't pay any attention to him. He's just a blowhard.,1.2658227848101267,0.05895569816249504,79,61,15,3
"I'm two months behind on my rain checks, otherwise I'd say postpone.",1.2658227848101267,0.05895569816249504,79,61,15,3
"Uh-oh, that one looks like my ex.",1.2658227848101267,0.0667044539764516,79,64,9,6
Looks like it's gonna rain punches and slaps.,1.2658227848101267,0.06422549521392139,79,63,11,5
I don’t think MY lack of sunny disposition is the problem here,1.2658227848101267,0.05613558943312265,79,60,17,2
When did you say your family is coming for a visit.,1.265625,0.07127727652491728,64,51,9,4
That’s what I love about you—it does look like a little lamb.,1.265625,0.0599362570629355,64,48,15,1
Tell me you see a puppy.,1.265625,0.0599362570629355,64,48,15,1
I didn't know your ex was a meteorologist.,1.2653061224489797,0.05533027360293121,98,77,16,5
It's just a threat without teeth.,1.2650602409638554,0.05707210525447058,83,64,16,3
"Leave discreetly, or start pointing and screaming. It’s your call.”",1.2650602409638554,0.05959096876580979,83,65,14,4
I'm afraid our future looks rather cloudy.,1.2650602409638554,0.05959096876580979,83,65,14,4
Does that cloud look like your father staring at my hand?,1.2650602409638554,0.05707210525447058,83,64,16,3
Dad??? Your back??? We’re just having lunch!,1.2650602409638554,0.05443681509701885,83,63,18,2
That cloud looks like 2020.,1.2650602409638554,0.05959096876580979,83,65,14,4
"We're not going to let a few threatening clouds spoil our picnic, are we?",1.2650602409638554,0.05707210525447058,83,64,16,3
At least the ants are not angry at me too.,1.2650602409638554,0.05443681509701885,83,63,18,2
"I'm second guessing storing everything in ""the cloud.""",1.2647058823529411,0.07141381422136293,68,55,8,5
"The forecast said cloudy, with a chance of anthropomorphism.",1.2647058823529411,0.06150600111631588,68,52,14,2
That's what my Grammie called an angry cloud...,1.2647058823529411,0.05199657745302887,102,79,19,4
Best summer ever.,1.2647058823529411,0.06150600111631588,68,52,14,2
... and you didn't believe me when I said your family is looming large over us!,1.2647058823529411,0.05199657745302887,102,79,19,4
I thought you said your ex wasn't the jealous type,1.264367816091954,0.05998255585976032,87,69,13,5
Did you ever notice how some clouds look like angry baguettes?,1.264367816091954,0.05534700167800779,87,67,17,3
"These thunderstorms never understand when I call them a low-pressure system on the 5:00 news, its nothing personal.",1.264367816091954,0.050285924293200834,87,65,21,1
I see a happy little cloud that wants a hug.,1.264367816091954,0.05534700167800779,87,67,17,3
CLOUD-19,1.264367816091954,0.05534700167800779,87,67,17,3
"Darling, do you think we made him angry by not wearing the mask?",1.264367816091954,0.05998255585976032,87,69,13,5
Soooo . . . when do we get to the 'rapture' part ?,1.2638888888888888,0.0625271632852148,72,56,13,3
Looks like that storm can really pack a punch.,1.2638888888888888,0.05931618532716555,72,55,15,2
I think that’s beyond ominous.,1.2638888888888888,0.052306187285139805,72,53,19,0
"Ohh - I thought you were saying ""sirius"".",1.2638888888888888,0.05592113674664872,72,54,17,1
"What do you mean ""see other people"" Sheila?",1.2638888888888888,0.05931618532716555,72,55,15,2
The sign did say keep off the grass,1.2638888888888888,0.06558111355584914,72,57,11,4
Looks like he's bringing the thunder,1.2637362637362637,0.04644942852497394,91,67,24,0
It’s a stratocumulus horribilis.,1.2637362637362637,0.04900764893868004,91,68,22,1
"Barry, have you met my father?",1.2637362637362637,0.055985269375949595,91,71,16,4
Is that your thought cloud or mine?,1.2637362637362637,0.04900764893868004,91,68,22,1
"Hera, I think we need to break up.",1.2637362637362637,0.060189292033534736,91,73,12,6
Must I explain again the difference between climate and weather?,1.2637362637362637,0.05143879760158815,91,69,20,2
"""How long have you had this fixation of                               
              dangerous clouds looming over your head?""",1.263157894736842,0.04670917327822506,114,87,24,3
I didn’t expect anyone to notice that I farted.,1.263157894736842,0.06025426957831666,95,77,11,7
Um . . . yeah . . . that was thunder . . .,1.263157894736842,0.05733380574866034,76,58,16,2
I'm a pilot and I think I cut him off to get here on time.,1.263157894736842,0.06315789473684212,76,60,12,4
Maybe you should put your shoes back on.,1.263157894736842,0.060316187500600305,76,59,14,3
No one else seems to think the sky looks threatening. What do you think?,1.263157894736842,0.06587713458076698,76,61,10,5
We're not exactly on Cloud Nine.,1.263157894736842,0.06315789473684212,76,60,12,4
When are the Clouds getting vaccinated?,1.263157894736842,0.052294553631162456,95,73,19,3
I still see Trump everywhere”,1.263157894736842,0.06315789473684212,76,60,12,4
My ex is still a little possessive,1.2626262626262625,0.05292098361007867,99,77,18,4
"My therapist says we see what we want to see, but this is *not* that.",1.2626262626262625,0.060209656695599065,99,81,10,8
"I don't like the looks of those clouds, honey.",1.2625,0.05260237155937827,80,60,19,1
"To be fair, they did predict threatening rain clouds.",1.2625,0.05552895811982627,80,61,17,2
"Remind me, your first marriage was on Mt Olympus, right?",1.2625,0.06350458470442126,80,64,11,5
"He was in case you said ""no"".",1.2625,0.058308840548204614,80,62,15,3
I 'm guessing that's the difference between 'partly cloudy' and 'partly sunny'.,1.2625,0.05552895811982627,80,61,17,2
Climate rage.,1.2625,0.058308840548204614,80,62,15,3
Maybe it's time we got vaccinated .,1.2625,0.058308840548204614,80,62,15,3
I don’t think they like the shapes we’re choosing,1.2625,0.058308840548204614,80,62,15,3
Eye-Cloud?,1.2625,0.05552895811982627,80,61,17,2
They’ve really improved data security on the cloud.,1.2621359223300972,0.049672763253145694,103,79,21,3
Hmmm. That cloud could use a class in anger management.,1.2619047619047619,0.05114592652470999,84,63,20,1
No one else seems to think those clouds look threatening. You're probably just anxious without your mask.,1.2619047619047619,0.05647680289606312,84,65,16,3
So you say your last boyfriend was a meteorologist.,1.2619047619047619,0.05387733783991093,84,64,18,2
Looks like we're in for some nasty weather.,1.2619047619047619,0.06134617127947345,84,67,12,5
Apparently the climate change deniers have finally gone too far.,1.2619047619047619,0.05387733783991093,84,64,18,2
"Mr. Cloud looks angry and threatening, but you know we can no longer trust truth of what we see with our own eyes and what we hear with our own ears!",1.2619047619047619,0.0636412952672662,84,68,10,6
Maybe a movie would have been a better idea.,1.2619047619047619,0.058961775736536534,84,66,14,4
I must have miscalculated our social distance.,1.2619047619047619,0.05647680289606312,84,65,16,3
No. I didn’t bring an umbrella.,1.2619047619047619,0.05647680289606312,84,65,16,3
I didn’t know Zeus was your father and that he doesn’t approve,1.2619047619047619,0.058961775736536534,84,66,14,4
I guess it wasn't a Freudian slip when the meteorologist said cloudy with a chance of pain.,1.2619047619047619,0.058961775736536534,84,66,14,4
We should have brought wine.,1.2615384615384615,0.07029102647114255,65,52,9,4
At least someone has been working out during this lockdown,1.2615384615384615,0.07363149891952556,65,53,7,5
"Don't make eye contact, maybe they'll pass.",1.2613636363636365,0.05479685620357943,88,68,17,3
I don't think I'll be ready to go back to air travel for quite some time.,1.2613636363636365,0.05937307040656715,88,70,13,5
"Um, no, it just looks like a cloud to me.",1.2613636363636365,0.049801901671405496,88,66,21,1
Turbulent times ahead,1.2613636363636365,0.052358976593723176,88,67,19,2
I got sunshine on a cloudy day...,1.2608695652173914,0.06072934769429053,69,53,14,2
I hate the ones shaped like idiots on picnic blankets,1.2608695652173914,0.0673837412910942,69,55,10,4
Looks like threatening weather's approaching.,1.2608695652173914,0.055447545442538,92,72,16,4
"Do you want my opinion as a meteorologist, or a demonic wizard?",1.2608695652173914,0.05711213716775524,69,52,16,1
A fluffy little bunny. Why? What do you see?,1.2608695652173914,0.06072934769429053,69,53,14,2
you don't know ... if the weatherman lied ... why not come with me little girl ... on a tragic carpet ride?,1.2608695652173914,0.07047571248232014,69,56,8,5
"I said my tailor made it green, not Rep. Marjorie Taylor Greene",1.2608695652173914,0.07047571248232014,69,56,8,5
I guess the afterlife didn't change your dad's opinion about me.,1.2608695652173914,0.06414289618406369,69,54,12,3
I’m getting tired of the end of the world just hanging over us,1.2608695652173914,0.06157194917590659,92,75,10,7
Any chance you like meatballs?,1.2602739726027397,0.061770544559217745,73,57,13,3
"Look, the cloud ran out of storage space.",1.2602739726027397,0.05860957832417096,73,56,15,2
"It’s not you, it’s me",1.2602739726027397,0.061770544559217745,73,57,13,3
"As long as he's 6 feet away, I think we're okay.",1.2602739726027397,0.06765083283118291,73,59,9,5
"Well, they did say cloudy with a chance of whoop-ass.",1.2602739726027397,0.061770544559217745,73,57,13,3
I know this type.  It's a cumulus pugnacious.,1.2602739726027397,0.06477744730187722,73,58,11,4
Is this just a phase or is the climate really changing?,1.2602739726027397,0.05860957832417096,73,56,15,2
Well I see a happy little pony.,1.2597402597402598,0.059625733486870995,77,60,14,3
I think the weather may be turning on us.,1.2597402597402598,0.05358825519207446,77,58,18,1
Those storm clouds sure look as angry as hail.,1.2597402597402598,0.06510572243024297,77,62,10,5
We better go!,1.2597402597402598,0.06510572243024297,77,62,10,5
That sky is looking pretty angry.,1.2597402597402598,0.059625733486870995,77,60,14,3
I’ve been thinking..it may be time to reconsider God’s plan and get vaccinated.,1.2597402597402598,0.06242588880829495,77,61,12,4
Ok kids like we practiced. On the count of three. I’ll take the ones with the baguette,1.2597402597402598,0.06242588880829495,77,61,12,4
You didn't tell me your family was in town.,1.2596153846153846,0.04925735314273533,104,80,21,3
"Yeah, uh huh, I see a bunny rabbit, too.",1.2596153846153846,0.05111744649348446,104,81,19,4
Are you sure that was just CBD?,1.2592592592592593,0.054934803608116006,81,62,17,2
Why are the Gods mad at us? I don't see them practicing social distancing.,1.2592592592592593,0.057675598157027524,81,63,15,3
"'Ominous?'  I think that's putting it lightly, don't you?",1.2592592592592593,0.06279935169560431,81,65,11,5
The threat of rain,1.2592592592592593,0.0602919281337026,81,64,13,4
Wow! I guess they didn't like the soft and fluffy comment!,1.2592592592592593,0.052049886379834036,81,61,19,1
They don’t look menacing to you?,1.2592592592592593,0.057675598157027524,81,63,15,3
You kids get off my lawn,1.2592592592592593,0.0602919281337026,81,64,13,4
‘It did say sunny with a chance of mortal doom’,1.2592592592592593,0.06279935169560431,81,65,11,5
"Are you sure that was a micro-dose, Cindy?",1.2592592592592593,0.0602919281337026,81,64,13,4
"Let’s just consider Both Sides, Now",1.2589285714285714,0.04870513761633515,112,87,21,4
Those low pressure fronts take their jobs way too seriously.,1.2588235294117647,0.06069841223879822,85,68,12,5
Just chill and watch the world burst into flames.,1.2584269662921348,0.06090920310923091,89,72,11,6
"The weather app says it's going to be sunny all day, so I wouldn't worry about it.",1.2580645161290323,0.054919776177983784,93,73,16,4
Is there something you want to tell me?,1.2580645161290323,0.06477999978190735,62,48,12,2
Nature may have thought she was rid of us.,1.2580645161290323,0.05274872249394527,93,72,18,3
Some people are taking fighting climate change too literally.”,1.2577319587628866,0.0572837906466311,97,78,13,6
My ex is the new weather woman on channel 5.,1.2577319587628866,0.04698456671434816,97,73,23,1
There are easier ways to cancel this concert in the park for lack of attendance,1.2575757575757576,0.062244746122568174,66,51,13,2
"When you said Thunder was you previous boyfriend, I thought you were joking.",1.2575757575757576,0.062244746122568174,66,51,13,2
That’s just their of looking angry when they can’t make it rain.,1.2575757575757576,0.06588329747412035,66,52,11,3
Uh-oh! They look like they've got an agenda.,1.2574257425742574,0.055674914532711096,101,81,14,6
"I've heard about ""Mad Cloud"" disease.",1.2574257425742574,0.05742574257425744,101,82,12,7
"I promised myself I wouldn't just talk about the weather, but...",1.2571428571428571,0.05641356563327061,70,53,16,1
I think that we've really ticked him off this time!,1.2571428571428571,0.05997140203803452,70,54,14,2
"I always thought ""angry sky"" was just a metaphor.",1.2571428571428571,0.05068861239448445,105,82,19,4
The forecast said there was a chance of thunderous rage.”,1.2571428571428571,0.06651861703541385,70,56,10,4
"Like I said, don't try to argue with the weather.""",1.2571428571428571,0.05997140203803452,70,54,14,2
Get off my lawn!!!,1.2571428571428571,0.06332967501381806,70,55,12,3
"Raging Corona virus, raging cumulonimbus, these days it seems like we just can't win.",1.2567567567567568,0.06399281131765669,74,59,11,4
Meet my dad.,1.2567567567567568,0.06399281131765669,74,59,11,4
"In hindsight, maybe cloud storage wasn’t such a great idea.",1.2567567567567568,0.06103152180137437,74,58,13,3
That's not a Bob Ross cloud.,1.2567567567567568,0.06103152180137437,74,58,13,3
"Not a fan of my recent upload, I'm guessing!",1.2567567567567568,0.06399281131765669,74,59,11,4
H2O.  That’s all a cloud can be.  Nothing else.  Believe me.  Only H2O.,1.2567567567567568,0.06399281131765669,74,59,11,4
None of my weather apps said anything about an ass whooping.,1.2567567567567568,0.06399281131765669,74,59,11,4
Do you think anyone else our age notices the shapes of clouds anymore,1.2567567567567568,0.05462948068122636,74,56,17,1
My knees hurt. I think it’s going to rain.,1.2567567567567568,0.06399281131765669,74,59,11,4
Ahh yes! I remember. The world is a frightening and perilous place! We are complacent! Picnicking is a lie!!!,1.2567567567567568,0.06399281131765669,74,59,11,4
I really do know clouds. That one's Vito.,1.2564102564102564,0.05895046497960103,78,61,14,3
"Relax. If this was really serious, I’d be getting an alert on my iPhone.",1.2564102564102564,0.061710271870341823,78,62,12,4
You see a playful puppy?,1.2564102564102564,0.056054946153848324,78,60,16,2
I think they want you to put your shoes back on.,1.2564102564102564,0.0693336761848995,78,65,6,7
"Wait, is that god?",1.2564102564102564,0.06688914949610412,78,64,8,6
I told you our data was too personal.,1.2560975609756098,0.05963599209936419,82,65,13,4
"Then again, maybe we shouldn't go back to my place.",1.2560975609756098,0.05963599209936419,82,65,13,4
"Give it a rest, will ya? Toxic masculinity is not literally everywhere.",1.2560975609756098,0.05705556442121219,82,64,15,3
"Well MacKenzie, it looks like your ex is spying on you from the cloud again",1.2560975609756098,0.05963599209936419,82,65,13,4
I know you’re an optimist… but please tell me you packed an umbrella,1.2560975609756098,0.06210930426214548,82,66,11,5
It just seems like there’s so much anger in the air.,1.255813953488372,0.05532158567646685,86,67,16,3
It's more the bullying than the actual climate change that's bothering me.,1.255813953488372,0.06006391149595306,86,69,12,5
Do we put our masks back on?,1.255813953488372,0.052790908597419986,86,66,18,2
Did I leave the oven on?,1.255813953488372,0.05532158567646685,86,67,16,3
You used to date who?,1.255813953488372,0.05774145523777671,86,68,14,4
What do you mean you have a feeling that this is not going to work out?,1.2555555555555555,0.05372773437412524,90,70,17,3
"Seriously, Jill?  You still don’t believe in climate change?",1.2555555555555555,0.05818973467245933,90,72,13,5
Oh my...it's a trap alright.,1.2555555555555555,0.048859939221226036,90,68,21,1
Isn't it  nice to be back to normal?,1.2555555555555555,0.048859939221226036,90,68,21,1
"The skies get angry, dear, when people submit captions without the hashtag",1.2555555555555555,0.05135154867031013,90,69,19,2
I can't decide which cloud service I should subscribe to.,1.2553191489361701,0.05440169827573315,94,74,16,4
I said I don't like 𝘊𝘭𝘢𝘶𝘥𝘦,1.2553191489361701,0.05440169827573315,94,74,16,4
"Rows and flows of angel hair 
And ice cream castles in the air . . .",1.2551020408163265,0.05292064109695132,98,77,17,4
I wonder if this is what my therapist meant when she said I needed to face the day head on,1.2551020408163265,0.050894015545911955,98,76,19,3
"What do you mean, you think the sky looks threatening?",1.2551020408163265,0.05292064109695132,98,77,17,4
Luckily it's only partly cloudy.,1.2549019607843137,0.051546223005715035,102,80,18,4
I can't believe it's already Thor's day.,1.253968253968254,0.059732523654257956,63,48,14,1
The sky was angry that day my friend,1.253968253968254,0.06776459195111455,63,50,10,3
"Honey, I am getting a strange feeling that cloud knows I may have lied a little on my tax return.",1.253968253968254,0.06776459195111455,63,50,10,3
"Oh, happy day.",1.253968253968254,0.07144279314527355,63,51,8,4
Apparently he doesn't like atheists ...,1.2537313432835822,0.057630286517219256,67,51,15,1
A climate change of mood.,1.2537313432835822,0.06142909700158688,67,52,13,2
"Sorry, I suffer from irritable cloud syndrome.",1.2537313432835822,0.06500629194781038,67,53,11,3
I think we are on the grass they're supposed to water.,1.2537313432835822,0.06500629194781038,67,53,11,3
Tell me a little more about your imaginary friend.,1.2537313432835822,0.06142909700158688,67,52,13,2
Old Cloud Shakes Fist at Man,1.2537313432835822,0.06500629194781038,67,53,11,3
Did you say it’s time to send in the CLOUDS?,1.2535211267605635,0.05573113763304321,71,54,16,1
We shouldn't have banned him from tweeting.,1.2535211267605635,0.06567498125342551,71,57,10,4
Hmm...I'm no good at this game....maybe a rabbit?,1.2535211267605635,0.06567498125342551,71,57,10,4
Do you want to hear the bad or ominous news first,1.2535211267605635,0.06253629886486937,71,56,12,3
Maybe we should think about lowering our carbon footprint this year?,1.2535211267605635,0.06253629886486937,71,56,12,3
Spoiler Alert,1.2535211267605635,0.05573113763304321,71,54,16,1
it's Stevie Rain Vaughan.,1.2535211267605635,0.05923153036006021,71,55,14,2
"Your mother's in town, isn't she?",1.2533333333333334,0.05400478234857089,75,57,17,1
"You see a puppy? Cool. I see a wrathful God who's always hated us and wants nothing better than to wipe the human race from the earth. But I can sorta see a puppy, too.",1.2533333333333334,0.06869001614731442,75,62,7,6
"That cloud looks like your Mother, dear”",1.2533333333333334,0.0632265576921407,75,60,11,4
"When you said the sky looked menacing, I thought you meant rain.",1.2533333333333334,0.0632265576921407,75,60,11,4
"More like Doom-ulus cloud, right?",1.2533333333333334,0.057244011711941316,75,58,15,2
"That’s serious looking cloud. I believe the correct name is cirrus, Darling.",1.2533333333333334,0.057244011711941316,75,58,15,2
Honey...what does 'ominous' mean?,1.2533333333333334,0.05400478234857089,75,57,17,1
"The forecast called for thunder storms. 
Threatening clouds are to be expected.",1.2531645569620253,0.05242683788109758,79,60,18,1
"He's just jealous ""Calm"" always comes first.",1.2531645569620253,0.05543593847887846,79,61,16,2
Remember that anger management course I took right before Meteorology?,1.2531645569620253,0.0610105168366915,79,63,12,4
...and we thought you getting hit in the face with that frisbee was going to be the worst part of this day...,1.2531645569620253,0.058289906672228484,79,62,14,3
That's Gaia and she's not happy.,1.2531645569620253,0.0610105168366915,79,63,12,4
"The forecast said ""Cloudy with a chance of violence""",1.2531645569620253,0.0610105168366915,79,63,12,4
Did I say something?,1.2531645569620253,0.0610105168366915,79,63,12,4
"This dude is throwing some shade, cirrusly.",1.2531645569620253,0.0610105168366915,79,63,12,4
It wasn't me.,1.2530120481927711,0.06378080460099088,83,68,9,6
I said DON’T LITTER!,1.2530120481927711,0.05378250267948101,83,64,17,2
I don't know. It's been too long since I've been outside.,1.2530120481927711,0.05378250267948101,83,64,17,2
Just when I almost figured out what Dogecoin is.,1.2530120481927711,0.05378250267948101,83,64,17,2
I forgot that reopening the economy would bring back the smog.,1.2530120481927711,0.061433970043286566,83,67,11,5
Think it's time to return to indoor restaurants?,1.2528735632183907,0.05714959431707437,87,69,14,4
There is anger in the air.,1.2528735632183907,0.05226336879576659,87,67,18,2
I knew there were some things I shouldn't have saved in the cloud.,1.2528735632183907,0.05714959431707437,87,69,14,4
... And that's what's known as a Cirrious cloud!,1.2528735632183907,0.059442277353480615,87,70,12,5
Not to worry. It's just one of those anti asthma nasal spray ads.,1.2527472527472527,0.05086169950977227,91,70,19,2
Did you bring an umbrella? That cloud looks ready to burst.,1.2527472527472527,0.055455504374433896,91,72,15,4
I don't know about you but I'd rather put up with ants.,1.2527472527472527,0.057615216823536305,91,73,13,5
Seriously? You see a castle?,1.2527472527472527,0.0532082016349229,91,71,17,3
The news warned of threatening skies today,1.2527472527472527,0.0532082016349229,91,71,17,3
"Jeez Anne, I told you that hairspray was bad for the ozone layer",1.2525252525252526,0.05437646084102963,99,79,15,5
Uh-oh! Maybe because we've stopped wearing masks?,1.2524271844660195,0.047231454755101675,103,79,22,2
Looks like your Mother found the iSpy app on her phone.,1.25,0.06485206471146153,72,58,10,4
"You're not helping by singing Stormy Weather.""",1.25,0.05585357054399395,84,66,15,3
Jealous.  So Jr. High.,1.25,0.05506433852460047,72,55,16,1
I've noticed older climates are more resistant to change.,1.25,0.05764360164082898,80,63,14,3
"Please, please tell me you see a bunny.",1.25,0.06485206471146153,72,58,10,4
I guess you mix our current political climate with cloud data storage and this is what you get.,1.25,0.058509124791617455,72,56,14,2
Look at me and tell me why we should mind your departed husband.,1.25,0.05836508438405426,84,67,13,4
Democrat or Republican?,1.25,0.057051707044017595,92,74,13,5
"That's not just a storm, it looks personal.",1.25,0.051389153237064875,72,54,18,0
