caption,mean,precision,votes,not_funny,somewhat_funny,funny
We can put this case to bed once we determine why he crossed the road,1.1772151898734178,0.04683939034393647,79,66,12,1
He’s still not sure.,1.1772151898734178,0.04683939034393647,79,66,12,1
What zero pussy does to a mf,1.1764705882352942,0.051069236647683494,68,57,10,1
"I know I'm in the minority here, but to me, the blackboard came first.",1.1764705882352942,0.051069236647683494,68,57,10,1
"Yeah, this one will be a long time!",1.1764705882352942,0.055200076943347304,68,58,8,2
"Reverse engineering didn't work,
so we're thinking alphabetical order.",1.1764705882352942,0.06689694944796853,51,44,5,2
Even a beautiful mind like his can’t figure this out,1.1764705882352942,0.04657344059657538,68,56,12,0
He insists the chicken came first.,1.1764705882352942,0.051069236647683494,68,57,10,1
But where's my dad?,1.1764705882352942,0.051069236647683494,68,57,10,1
"Man, I had no idea they were related.",1.1764705882352942,0.055200076943347304,68,58,8,2
And you thought the drive-through was slow?,1.1764705882352942,0.04657344059657538,68,56,12,0
Kornacki says it,1.1764705882352942,0.04159451654038513,85,70,15,0
The next session deals with crossing the road.,1.1764705882352942,0.06075267994050848,51,43,7,1
We just picked up a chicken trying to cross the road. She's in the interrogation room now. See if she'll crack open and tell us what she knows.,1.1764705882352942,0.051069236647683494,68,57,10,1
Looks like more votes for the chicken!,1.1764705882352942,0.055200076943347304,68,58,8,2
Jerome here is thinking Nobel.,1.1764705882352942,0.055200076943347304,68,58,8,2
I never knew eggs could smoke.,1.1764705882352942,0.055200076943347304,68,58,8,2
"If you embrace Darwin's Evolution Theory, a bird laid an mutant egg that hatched into the first chicken.",1.1764705882352942,0.06075267994050848,51,43,7,1
The case went cold after Mr. Sunnyside was acquitted.,1.1764705882352942,0.055200076943347304,68,58,8,2
Stop egging him on. He’s too chicken to solve it.,1.1764705882352942,0.051069236647683494,68,57,10,1
"If he solves this, he could win the Nobawk Prize!",1.1764705882352942,0.051069236647683494,68,57,10,1
The origin story is not as riviting as Karl thought.,1.1764705882352942,0.04657344059657538,68,56,12,0
"This is so meta, I HATE it",1.1764705882352942,0.055200076943347304,68,58,8,2
"Call Boggis, Bunce and Bean. Tell them the Fox is back.",1.1764705882352942,0.05391265523477457,51,42,9,0
He dreams of becoming the best conspiracy theorist ever!,1.1764705882352942,0.051069236647683494,68,57,10,1
I was thinking fried chicken for lunch...Or maybe an omelet.,1.1756756756756757,0.052194025100977155,74,63,9,2
We got DNA of an old hit. Suspect on the left had a 4 am Disturbing the Peace violation in '07.,1.1756756756756757,0.04453930581352029,74,61,13,0
We brought in an egghead to see if he had any ideas.,1.1756756756756757,0.052194025100977155,74,63,9,2
"I think he deserves at least a standing ovulation.""",1.1756756756756757,0.04851786278573962,74,62,11,1
He claims there’s been a break in the case and he knows which came first.,1.1756756756756757,0.04851786278573962,74,62,11,1
"Well, it's now part of the curriculum, but only in Texas and Tennessee",1.1756756756756757,0.052194025100977155,74,63,9,2
Nature also abhors a copyright.,1.1756756756756757,0.04851786278573962,74,62,11,1
Congressional,1.1756756756756757,0.0556277763638545,74,64,7,3
"Look Beth, I want answers as much as anyone but is there any question that funding comes first?",1.1756756756756757,0.0556277763638545,74,64,7,3
Give him a few more hours. This is the guy who cracked why the chicken crossed the road.,1.1756756756756757,0.058861555790962444,74,65,5,4
"It doesn't answer the question, but it provokes meaningful discussion.",1.1756756756756757,0.04851786278573962,74,62,11,1
The USDA ordered an ontological review of our poultry products.,1.1756756756756757,0.052194025100977155,74,63,9,2
"Ultimately, at the end of the day, yeah, we still have no idea.",1.1756756756756757,0.0556277763638545,74,64,7,3
"Our two suspects are a chicken and an egg, it had to be one of them, there was no one else at the scene.",1.1756756756756757,0.0556277763638545,74,64,7,3
"Oh, by the way, did I tell you this guy is dyslexic?",1.1754385964912282,0.050825312758579544,57,47,10,0
At least he's stopped crowing.,1.1754385964912282,0.06680502724442022,57,50,4,3
He's studying to become a farmercologist.,1.1754385964912282,0.0566549100524176,57,48,8,1
''The one my wife puts in front of me at meal time!'',1.1754385964912282,0.0566549100524176,57,48,8,1
Let nature take its course.,1.1754385964912282,0.050825312758579544,57,47,10,0
". . .and which comes first,the fresh chino's or the shower?",1.1754385964912282,0.0566549100524176,57,48,8,1
Supply chain conundrum,1.1754385964912282,0.06193823737472377,57,49,6,2
Chicken v. egg: tautology or iteratively resolvable?,1.1754385964912282,0.0566549100524176,57,48,8,1
You should see him trying to choose something off of a restaurant menu.,1.1754385964912282,0.050825312758579544,57,47,10,0
This case has been cold for years,1.1754385964912282,0.0566549100524176,57,48,8,1
He's trying to solve the critical question of our day: What's for lunch?,1.175,0.04630321092291712,80,67,12,1
"It was easy to understand the theoretical question, and we made good progress towards defining the technical answer until our funding ran out.....",1.175,0.04960285312333035,80,68,10,2
Most of them have been saying that relativity invalidates the whole notion of one thing happening before another.,1.1746031746031746,0.053258792666124335,63,53,9,1
If he makes that joke again I'm calling H.R.,1.1746031746031746,0.053258792666124335,63,53,9,1
"This never going to go away, is it?",1.1746031746031746,0.053258792666124335,63,53,9,1
"It’s a tough case. What went missing first, the chicken or the egg?",1.1746031746031746,0.04821271851032602,63,52,11,0
I thought you said reducing the menu to only two items would make things easier.,1.1746031746031746,0.04821271851032602,63,52,11,0
He's working on how the chicken fits into an egg.,1.1746031746031746,0.053258792666124335,63,53,9,1
He claims this is really the last time he’ll try to solve this cold case….We’ve heard that before.,1.1746031746031746,0.053258792666124335,63,52,9,1
"He has started to call the chicken, Mummy.",1.1746031746031746,0.04821271851032602,63,52,11,0
So there you have it!  Ronnie comes before both the chicken and the egg.,1.1746031746031746,0.04821271851032602,63,52,11,0
But the homeless want us to spend billions to determine which came first.,1.1746031746031746,0.053258792666124335,63,53,9,1
"Anti-vax proponents review talking points for upcoming news release announcing that ""Big Pharma created covid-19 vaccine in 2018 at request of US Govt""",1.1746031746031746,0.057866499516996066,63,54,7,2
Jim's been staring at that board for a long time.  Do you think he's cracked it?,1.1746031746031746,0.053258792666124335,63,53,9,1
This should keep Mr. Goody-two shoes busy for a few weeks. Let’s go raid the evidence room.,1.1746031746031746,0.057866499516996066,63,54,7,2
Nope. I was here first.,1.1746031746031746,0.053258792666124335,63,53,9,1
"He’s contemplating the tough question, all right.   He can’t decide on KFC or egg salad for lunch.",1.1746031746031746,0.053258792666124335,63,53,9,1
"That ought to keep that idiot busy for hours. Now if you’ll excuse me, I have to go check my Facebook.",1.1746031746031746,0.053258792666124335,63,53,9,1
We're hoping the egg will roll on the hen.,1.1746031746031746,0.053258792666124335,63,53,9,1
"Well, that resolved nothing!",1.1746031746031746,0.053258792666124335,63,53,9,1
"Mike, here, is the Head of Comporate Accountability.",1.1746031746031746,0.053258792666124335,63,53,9,1
Have we tried augmented reality on this one ?,1.1746031746031746,0.053258792666124335,63,53,9,1
We are on the DNA report.,1.1746031746031746,0.04821271851032602,63,52,11,0
He knows what question to ask. That’s why he’s the boss.,1.1746031746031746,0.053258792666124335,63,53,9,1
"It's ""The artist formerly known as Egg"", please.",1.1746031746031746,0.04821271851032602,63,52,11,0
"Mark’s in intelligence, he always diagrams his lunch options.",1.1746031746031746,0.04821271851032602,63,52,11,0
"The problem is in the male gaze, and the question itself. The true answer is, and always has been: the Rooster came first.",1.1746031746031746,0.053258792666124335,63,53,9,1
I think he needs a consultant.,1.1746031746031746,0.04821271851032602,63,52,11,0
Everyone asks the same question and thinks they're hilariously original,1.1746031746031746,0.053258792666124335,63,53,9,1
These middle school science fairs are getting very philosophical,1.1746031746031746,0.057866499516996066,63,54,7,2
What's up with him?! Colonel Sanders took less time putting the puzzle pieces together!,1.1746031746031746,0.04821271851032602,63,52,11,0
I do not see any family resemblance whatsoever,1.1746031746031746,0.04821271851032602,63,52,11,0
Didn’t we see this at the Biennale last year…,1.1746031746031746,0.057866499516996066,63,54,7,2
"Jerry stared for hours…then it all clicked. Came into focus. “My god,” he muttered. It was the damned cloaca. “Guys,” he called to the others. “Guess what?”",1.1744186046511629,0.04435850856191577,86,72,13,1
Breakfast gets more complicated by the day.,1.173913043478261,0.054454286181317306,69,59,8,2
"And sometimes not at all,” he whispered to himself with a smirk.",1.173913043478261,0.054454286181317306,69,59,8,2
"I guess you're right.
The chicken does come before the egg.",1.173913043478261,0.045964707814862935,69,57,12,0
Right! You be the judge!,1.173913043478261,0.045964707814862935,69,57,12,0
"I don't know which came first, but I sure am hungry.",1.173913043478261,0.054454286181317306,69,59,8,2
Why did you place the chicken in the first position?,1.173913043478261,0.05038860807773185,69,58,10,1
I thought I’d keep him busy til we come back from lunch.,1.173913043478261,0.045964707814862935,69,57,12,0
The annotations came first.,1.173913043478261,0.05038860807773185,69,58,10,1
Poor Bill. He keeps waiting for the chicken to unmute,1.173913043478261,0.05038860807773185,69,58,10,1
"The New Yorker embraced negative short stories, negative comics, when will it end?",1.173913043478261,0.045964707814862935,69,57,12,0
I know the investors are getting anxious but I assure you we are on the verge of a groundbreaking discovery.,1.173913043478261,0.05038860807773185,69,58,10,1
if...t.hen...,1.173913043478261,0.054454286181317306,69,59,8,2
Can we agree that they both arrived?,1.173913043478261,0.054454286181317306,69,59,8,2
"Yeah, well I ""see"" corporate chickening out on maternal leave again.",1.173913043478261,0.05038860807773185,69,58,10,1
The egg came first.,1.173913043478261,0.06448868249648397,46,39,6,1
I’ve always wanted a Polaris.,1.173913043478261,0.045964707814862935,69,57,12,0
"Do you think that really matters? I""ll bet you five dollars it was the egg.",1.173913043478261,0.05038860807773185,69,58,10,1
All the other job candidates balked at this question.,1.173913043478261,0.05038860807773185,69,58,10,1
If he cracks the code we could end this Chicken Sandwich War tonight.,1.173913043478261,0.05038860807773185,69,58,10,1
"Quick, get an election set up! Steve Kornacki is going to lose his mind without some juice!",1.173913043478261,0.054454286181317306,69,59,8,2
"Science has an answer, but people nevertheless seem to enjoy the debate.",1.173913043478261,0.045964707814862935,69,57,12,0
I'm afraid that his thinking is scrambled.,1.173913043478261,0.05038860807773185,69,58,10,1
"It’s a pterodactyl egg, why haven’t we fired this guy?!",1.173913043478261,0.05038860807773185,69,58,10,1
"While working from home, Sherm created a new org chart.",1.173913043478261,0.05038860807773185,69,58,10,1
I think he's focusing too much on the chicken...and I'm afraid to tell him he's got it all wrong.,1.173913043478261,0.054454286181317306,69,59,8,2
I think we are asking the wrong questions....,1.173913043478261,0.054454286181317306,69,59,8,2
Do you know if turkey's lay eggs too?,1.173913043478261,0.05038860807773185,69,58,10,1
"We’ve already determined which came first, and why it crossed the road. Now we’re working on the exact amount of milk to add for perfect scrambled eggs.",1.173913043478261,0.054454286181317306,69,59,8,2
He needs to know if the chicken is organic-fed and free-range before making a conclusion.,1.173913043478261,0.058236816044683844,69,60,6,3
It’s a draw.,1.173913043478261,0.054454286181317306,69,59,8,2
There's something wrong. Chickens don't lay eggs in this dystopia.,1.173913043478261,0.058236816044683844,69,60,6,3
"We don’t know which was fried to death first, but we do know it’s not the work of a cereal killer",1.173913043478261,0.054454286181317306,69,59,8,2
"Ask me 'which came first' one more time, and you're fired.",1.173913043478261,0.05038860807773185,69,58,10,1
He's stumped on who comes first in the organizational chart.,1.173913043478261,0.045964707814862935,69,57,12,0
This formula does finally explain which came first but it fails to explain why the chicken crossed the road,1.173913043478261,0.05038860807773185,69,58,10,1
The frying pan came first.,1.173913043478261,0.045964707814862935,69,57,12,0
His mother told him he’s brilliant.,1.173913043478261,0.058236816044683844,69,60,6,3
"Just because I’m a woman, they stick me on the egg projects.",1.173913043478261,0.05038860807773185,69,58,10,1
He's been like this since breakfast.,1.173913043478261,0.058236816044683844,69,60,6,3
we’re positive that one of them did it.,1.1733333333333333,0.05154664932909857,75,64,9,2
He wants to reverse the order.,1.1733333333333333,0.05154664932909857,75,64,9,2
He said you asked him to find an 'egg spurt' witness,1.1733333333333333,0.04792386354100322,75,63,11,1
Right now we are trying to decide on breakfast or lunch.,1.1733333333333333,0.05154664932909857,75,64,9,2
His approach is very original.,1.1733333333333333,0.05154664932909857,75,64,9,2
"He wants to call it ""Manifest"" and pitch it to Netflix.",1.1733333333333333,0.05154664932909857,75,64,9,2
He's looking for a new angle on the egg.,1.1733333333333333,0.05154664932909857,75,64,9,2
He’s the agency’s best chicken psychologist.  We’ll know before long why they keep crossing the road.,1.1733333333333333,0.04792386354100322,75,63,11,1
Who the cluck cares anymore,1.1733333333333333,0.05154664932909857,75,64,9,2
How much for Red October?,1.1730769230769231,0.05297452250664297,52,43,9,0
My experiments basically showed that the chicken came first--or perhaps the egg.,1.1730769230769231,0.05297452250664297,52,43,9,0
He's working on developing new roll proof packaging at the source.,1.1730769230769231,0.05297452250664297,52,43,9,0
I  do not think he is going back far enough to what came first.,1.1730769230769231,0.05966948841558946,52,44,7,1
And to think I had chicken and egg on my salad today.,1.1730769230769231,0.05297452250664297,52,43,9,0
He says he’s a strategist but I’m not buying it.,1.1730769230769231,0.06568558183307435,52,45,5,2
We are in your side but don’t count on us agreeing with your ‘cat in a box’ correlation.,1.1728395061728396,0.04903426446477898,81,69,10,2
"I, for one, have reached a conclusion - don't know, don't care.",1.1724137931034482,0.06093608879319741,58,50,6,2
"Yes, but are we sure about why it crossed the road?",1.1724137931034482,0.05575164786673556,58,49,8,1
"Johnson determined where the chicken came from, sir. It's just a matter of time before we figure out the egg.",1.1724137931034482,0.05575164786673556,58,49,8,1
The last guy stood there for 23 days,1.1724137931034482,0.06093608879319741,58,50,6,2
Feels like overkill. We’re just choosing pizza toppings.,1.1724137931034482,0.06093608879319741,58,50,6,2
This should keep him busy while we make matzo balls.,1.1724137931034482,0.050032844835173236,58,48,10,0
He is insisting that the egg came before the chicken  and he won’t leave until we redo the display.,1.1724137931034482,0.050032844835173236,58,48,10,0
"The display is fine, but I'm not sure it settles the question.",1.1724137931034482,0.05575164786673556,58,49,8,1
"Yeah, yeah, I know, but you have to tell Carl.",1.1724137931034482,0.05575164786673556,58,49,8,1
Is this the new org chart?,1.1724137931034482,0.050032844835173236,58,48,10,0
Which came first: the chicken or the egg?  The egg which was laid by a bird that was one genetic mutation away from being a chicken.,1.1724137931034482,0.05575164786673556,58,49,8,1
"Actually, its  fertilized in the cloaca",1.1724137931034482,0.06093608879319741,58,50,6,2
"Yes, I know the question but then why does ham come before eggs?",1.1724137931034482,0.050032844835173236,58,48,10,0
The fox takes the rooster reports the farmer in the dell.,1.1724137931034482,0.06571276584476107,58,51,4,3
He decided to re-open the case.,1.1724137931034482,0.05575164786673556,58,49,8,1
"No, I wasn't talking about the chicken or the egg. I was talking about me or my husband.",1.1724137931034482,0.05575164786673556,58,49,8,1
Operation ‘Goo goo g'joob’ is still nowhere near a breakthrough I’m afraid.,1.1724137931034482,0.05575164786673556,58,49,8,1
"I don't think we will get the board, anytime soon",1.1724137931034482,0.05575164786673556,58,49,8,1
He's been staring at the work since 9am.,1.171875,0.0570204619879343,64,55,7,2
Obviously he's been cooped up too long.,1.171875,0.04753177456453702,64,53,11,0
Myron prefers to view every puzzle as a murder mystery.,1.171875,0.04753177456453702,64,53,11,0
We've sent a search team to The Road.,1.171875,0.0570204619879343,64,55,7,2
Again... A new hypothesis about which came first.,1.171875,0.04753177456453702,64,53,11,0
I don't think this new procedural drama is going to fly.,1.171875,0.06121572372641858,64,56,5,3
There are compelling arguments for either...,1.171875,0.0570204619879343,64,55,7,2
Good grief! I don't think we can establish this timeline beyond a reasonable doubt!,1.171875,0.04753177456453702,64,53,11,0
Who is the victim here?,1.171875,0.05249096435850378,64,54,9,1
"After this, he is going to work on the Crossing the Road problem.",1.171875,0.0570204619879343,64,55,7,2
Of all our visitors he was the first.,1.171875,0.05249096435850378,64,54,9,1
Preliminary analysis suggests that which came first is a really stupid question.,1.171875,0.04753177456453702,64,53,11,0
The script started out simple enough.,1.171875,0.05249096435850378,64,54,9,1
"Pandemic-era virtual classes came first,
abysmal science projects, second.",1.171875,0.04753177456453702,64,53,11,0
we think we finally found his motive,1.171875,0.04753177456453702,64,53,11,0
He calls it Causality Brunch.,1.171875,0.04753177456453702,64,53,11,0
I still say the egg came first.,1.171875,0.04753177456453702,64,53,11,0
"If anyone can crack it, it’s Bert. He solved the second sock mystery.",1.171875,0.04753177456453702,64,53,11,0
We are beginning to think that the answer might in fact be rooster.,1.171875,0.0570204619879343,64,55,7,2
"Hard case to crack, it boils down to who’s gonna chicken out first.",1.171875,0.0570204619879343,64,55,7,2
We’re starting a PhD program.,1.171875,0.05249096435850378,64,54,9,1
"I told you the FBI’s entrance 
exam was too tough.",1.171875,0.05249096435850378,64,54,9,1
Remember Darwin?,1.171875,0.04753177456453702,64,53,11,0
"I feel like we finally cracked the chicken crossing the road case, and now this!",1.171875,0.05249096435850378,64,54,9,1
"We still don’t know which came first, but we have determined why it crossed the road.",1.1714285714285715,0.0497256596779289,70,59,10,1
"Think of it as a baseball question, Who’s on First?",1.1714285714285715,0.0497256596779289,70,59,10,1
"The solution came to him in a flash, but no one else can understand it.",1.1714285714285715,0.057452576794271674,70,61,6,3
He's waiting for the shipment from Amazon but they're on back-order.,1.1714285714285715,0.0497256596779289,70,59,10,1
He’s deciding whether to have Coq du Vin or an omelette for dinner.,1.1714285714285715,0.05372820400267856,70,60,8,2
"This is not a vegan problem.""",1.1714285714285715,0.04537138476459545,70,58,12,0
"Which will it be, free breakfasts or free lunches?",1.1714285714285715,0.05372820400267856,70,60,8,2
Do they first inject Covid-19 into the chicken or the egg?,1.1714285714285715,0.0497256596779289,70,59,10,1
He's been standing there for a week,1.1714285714285715,0.0497256596779289,70,59,10,1
"If I'd know this is what your brother would do, I would've told you to leave him at home.",1.1714285714285715,0.0497256596779289,70,59,10,1
"Well, one place it didn't come from is analysis paralysis.",1.1714285714285715,0.05372820400267856,70,60,8,2
"By the time we order breakfast, it'll be time for lunch.",1.1714285714285715,0.0497256596779289,70,59,10,1
It's nice to get the team thinking but he's been standing there for 8 hours.,1.1714285714285715,0.0497256596779289,70,59,10,1
"Intersting,but we need to see more data.",1.1714285714285715,0.0497256596779289,70,59,10,1
Our big breakthrough came when we decided to focus on a strictly alphabetical methodology.,1.1714285714285715,0.0497256596779289,70,59,10,1
"Apparently, the chicken came from Mars...",1.1714285714285715,0.0497256596779289,70,59,10,1
"With Covid under control, we may need to upgrade our associate training program.",1.1714285714285715,0.0497256596779289,70,59,10,1
"Philosophical question? No, he's deciding what to get for breakfast.",1.1714285714285715,0.05372820400267856,70,60,8,2
"grad school is becoming a joke”

l d soderlind 
minneapolis mn.",1.1714285714285715,0.0497256596779289,70,59,10,1
Wasn't the mandate to find the origin of the virus?,1.1714285714285715,0.05372820400267856,70,60,8,2
"Most bets are on the chicken, but I've a persistent suspicion regarding the egg",1.1714285714285715,0.0497256596779289,70,59,10,1
The worst part is he thinks he’s trying to figure out a Rube Goldberg thing.,1.1714285714285715,0.05372820400267856,70,60,8,2
Round and around and around we go….,1.1714285714285715,0.0497256596779289,70,59,10,1
"Do you want to tell him,or should I?  He’s putting the chicken before the egg.",1.1710526315789473,0.047344048310574156,76,64,11,1
"""Speaking for product development, we don't care which came first as long as it's ready for beta testing",1.1710526315789473,0.050914988985724385,76,65,9,2
This just keeps the busy-bodies busy; the real casework is on the other side.,1.1710526315789473,0.04348082011015344,76,63,13,0
All of the clues to this egg-sistential question always lead us back to the beginning.,1.1710526315789473,0.050914988985724385,76,65,9,2
The catered lunch choices at the office are raising a lot of issues for  vegetarians,1.1704545454545454,0.043434064987402626,88,74,13,1
He's Ivy league.  He'll be here all day....,1.169811320754717,0.0586238473980282,53,45,7,1
It’s easier if I just keep him busy.,1.169811320754717,0.0586238473980282,53,45,7,1
"Yeah, I came in second last year.",1.169811320754717,0.0586238473980282,53,45,7,1
It's Professor Frod's bulletin board. She has dozens of psychology lectures based on that theme.,1.169811320754717,0.05206789873629057,53,44,9,0
He just keeps repeating...omelet...omelet.,1.169811320754717,0.0586238473980282,53,45,7,1
"Our current theory is that the egg came first, but that’s only if the chicken’s alibi checks out.",1.169811320754717,0.0586238473980282,53,45,7,1
I think he has finally lost it.,1.169811320754717,0.05206789873629057,53,44,9,0
He's an undecided voter.,1.169811320754717,0.05206789873629057,53,44,9,0
"He's so sure it's the egg, but he keeps having doubt how black matter fits into this?",1.169811320754717,0.0586238473980282,53,45,7,1
"Everyone jokes about it, but if he actually solves it we could be looking at some serious money.",1.169811320754717,0.0586238473980282,53,45,7,1
He's been there for four hours.  He claims he's seen the chicken before.,1.1694915254237288,0.054876421247483355,59,50,8,1
"He's close, close to cracking it wide open.",1.1694915254237288,0.054876421247483355,59,50,8,1
"If this isn’t resolved soon, I’m worried about how this is going to impact our budget for the road crossing project.",1.1694915254237288,0.054876421247483355,59,50,8,1
"If he solves that problem, he'll be the most famous man alive, and we'll elect him to Congress.",1.1694915254237288,0.054876421247483355,59,50,8,1
I hope we can settle this once and for all!,1.1694915254237288,0.049264267709845745,59,49,10,0
"Which came first, the victim or the murderer?",1.1694915254237288,0.05996561635533429,59,51,6,2
"Once upon a time, I heard a joke that went something like, Which came first--the chicken or the egg?",1.1694915254237288,0.054876421247483355,59,50,8,1
"We're still work that which-came-first conundrum. After that, we'll get after the chicken-crossing-road enigma.",1.1694915254237288,0.054876421247483355,59,50,8,1
Figuring out who is primarily responsible for the recent customer violence at Popeye’s is proving to be beyond the FBI’s capabilities.,1.1694915254237288,0.054876421247483355,59,50,8,1
This museum always scrambles my brain.,1.1694915254237288,0.05996561635533429,59,51,6,2
Senators Sinema and Manchin Chicken Out of Build Back Better,1.1694915254237288,0.054876421247483355,59,50,8,1
It’s a classic example of a biological koan.,1.1694915254237288,0.049264267709845745,59,49,10,0
"Ever since he cured cancer, he's been bored. So, we thought this might give him something to do.""
-Cynthia Speakman, Thousand Oaks, C",1.1694915254237288,0.049264267709845745,59,49,10,0
"If we are talking Easter eggs, you have to go with natural selection.",1.1694915254237288,0.054876421247483355,59,50,8,1
"Next , “Why did the chicken cross the road?” It’s gotta have a chicken, to be worth his time .",1.1694915254237288,0.049264267709845745,59,49,10,0
