caption,mean,precision,votes,not_funny,somewhat_funny,funny
"I personally think the egg should come first, and then the picture of the chicken.",1.2236842105263157,0.054927972647204476,76,61,13,2
The chicken lobby is funding his research.,1.2236842105263157,0.05163530755354893,76,60,15,1
It's hard to decide between breakfast or lunch!,1.2236842105263157,0.058034122480782796,76,62,11,3
He thinks he can prove Gödel was wrong and become famous.,1.2236842105263157,0.058034122480782796,76,62,11,3
This case is no longer cold—we just got in some new for-hen-sics.,1.2236842105263157,0.054927972647204476,76,61,13,2
Which came first? Our clients always come first.,1.2236842105263157,0.054927972647204476,76,61,13,2
We believe this could also lead to breakthroughs in road-crossing motivational theory.,1.2236842105263157,0.054927972647204476,76,61,13,2
He always makes everything so complicated.,1.2236842105263157,0.048117853164570124,76,59,17,0
"If anyone asks if they're organic, we deflect.",1.2236842105263157,0.054927972647204476,76,61,13,2
An egg this size must have come first!,1.2236842105263157,0.054927972647204476,76,61,13,2
"So many clues, yet people can't figure out who came first.",1.2236842105263157,0.06098226434871827,76,63,9,4
"One of these two is the murderer, I'm sure of it.",1.223529411764706,0.051249022914058924,85,68,15,2
I told you we could receive bipartisan Congressional approval for a scientific study.,1.223529411764706,0.05645074347855474,85,70,11,4
This is it for docent training?,1.223529411764706,0.051249022914058924,85,68,15,2
looks like were working late again,1.2234042553191489,0.0481985126163457,94,75,17,2
Let's call the whole thing off.,1.2222222222222223,0.06292801266165045,54,43,10,1
One could make a career of of this.,1.2222222222222223,0.05315633121839994,72,57,14,1
The truth is out there.,1.2222222222222223,0.052704627669472946,81,65,14,2
His preliminary conclusion is that the chicken is just the egg's way of making another egg.,1.2222222222222223,0.060067197055121264,72,59,10,3
Don't tell him about the dinosaur.,1.2222222222222223,0.05315633121839994,72,57,14,1
"Unfortunately, none of this seems to be helping us figure out which comes first, although now I have a craving for egg salad.",1.2222222222222223,0.052704627669472946,81,65,14,2
My research conclusions depend on which one I assumed came first.,1.2222222222222223,0.049690399499995284,81,64,16,1
"Marketing’s deciding whether we should go with the chicken, or the egg sandwich.",1.2222222222222223,0.06575585358598524,63,52,8,3
"He won't accept ""both became both"".",1.2222222222222223,0.04648111258522637,81,63,18,0
Even our precinct Ace is stumped with how to solve this one.,1.2222222222222223,0.052704627669472946,81,65,14,2
He’s obsessed with what came first.,1.2222222222222223,0.056717121359687366,72,58,12,2
"He’s about to have a breakthrough, and decide which sandwich to order for lunch!",1.2222222222222223,0.06173977251921359,63,51,10,2
The right answer gets the corner office.,1.2222222222222223,0.04933922619854284,72,56,16,0
He might need a bigger board when we get to God and the Big Bang.,1.2222222222222223,0.05744359616725745,63,50,12,1
He's been like this since the poaching incident.,1.2222222222222223,0.06173977251921359,63,51,10,2
He is wondering where he fits in.,1.2222222222222223,0.05744359616725745,63,50,12,1
Is he really the right one to work for the Colonel?,1.2222222222222223,0.056717121359687366,72,58,12,2
He has not moved all day.  Should we tell him the truth?,1.2222222222222223,0.06292801266165045,54,43,10,1
He's gathering his thoughts for an exciting new podcast series.,1.2222222222222223,0.05555555555555552,81,66,12,3
We're deadlocked.,1.2222222222222223,0.056717121359687366,72,58,12,2
"What comes first, the raise or the promotion?",1.2222222222222223,0.060067197055121264,72,59,10,3
HR says we have to add a rooster.,1.2222222222222223,0.06626115585708793,72,61,6,5
Next let's ask him why it crossed the road.,1.2222222222222223,0.06173977251921359,63,51,10,2
It’s a really defining question.,1.2222222222222223,0.05315633121839994,72,57,14,1
"It's easy! Eggs for breakfast and Chicken for dinner!""",1.2222222222222223,0.05315633121839994,72,57,14,1
"I find far more interesting, which came first, Scotch or vodka.",1.2222222222222223,0.06575585358598524,63,52,8,3
Works from Richard Scarry's formative period.,1.2222222222222223,0.06825501298155011,54,44,8,2
My drawing on that billboard is a hoax and doesn't have any hidden meaning.,1.2222222222222223,0.05744359616725745,63,50,12,1
This is the new artist I told you about. This work is from his Chicken Period.,1.2222222222222223,0.060067197055121264,72,59,10,3
"In quantum mechanics, it's an omelet made of live chicken",1.2222222222222223,0.05744359616725745,63,50,12,1
"I'm telling you, the issue isn't the substance, it's the sequence.",1.2222222222222223,0.05744359616725745,63,50,12,1
The only crime scene I see is those khakis.,1.2222222222222223,0.05744359616725745,63,50,12,1
He just became a vegetarian and is trying to figure out if he can still eat eggs.,1.2222222222222223,0.056717121359687366,72,58,12,2
"I don't care how many computer simulations you've done...
the chicken came first!",1.2222222222222223,0.05315633121839994,72,57,14,1
I'm stumped. This is clearly a case for Law and Order. Or is it Order and Law?,1.2222222222222223,0.056717121359687366,72,58,12,2
"NOTHING THAT PROFOUND, HE’S JUST NARROWING DOWN HIS LUNCH OPTIONS",1.2222222222222223,0.056717121359687366,72,58,12,2
He's undecided. But I believe that the chicken came first.,1.2222222222222223,0.05744359616725745,63,50,12,1
"He's still deciding where to place the ""Start Here"" Post-It.",1.2222222222222223,0.05744359616725745,63,50,12,1
Prioritization is one of those executive skills you either have or you don't.,1.2222222222222223,0.056717121359687366,72,58,12,2
"Thank you for the Grant offer, but we’re designing a menu.",1.2222222222222223,0.05744359616725745,63,50,12,1
You need the breakfast app.,1.2222222222222223,0.04933922619854284,72,56,16,0
"Yes, a hen is essential to the equation.",1.2222222222222223,0.056717121359687366,72,58,12,2
We’re trying pin down the timeline but the chicken looks good for it,1.2222222222222223,0.05744359616725745,63,50,12,1
"If he doesn’t solve it soon, the egg is going to hatch and then what?",1.2222222222222223,0.04933922619854284,72,56,16,0
What a revelation! The chicken comes from an Egg.,1.2222222222222223,0.03928371006591925,81,66,14,1
Nonlinear analysis makes it a much more difficult problem.,1.2222222222222223,0.056717121359687366,72,58,12,2
"If Henderson’s calculations are correct, we will be the first team to successfully turn the chicken back into the egg.",1.2222222222222223,0.05744359616725745,63,50,12,1
He says to ask the rooster.,1.2222222222222223,0.05279899592349904,63,49,14,0
Michael Pollan researching for his next book.,1.2222222222222223,0.060067197055121264,72,59,10,3
I told them that we don't need another intern but they wouldn't listen...,1.2222222222222223,0.052704627669472946,81,65,14,2
Raises the intriguing possibility that they came at the same time.,1.2210526315789474,0.0522268875856145,95,78,13,4
We can't make an omelette without breaking this case,1.2209302325581395,0.053345434421812485,86,70,13,3
He's been rearranging the suspect list for the past two hours.,1.2209302325581395,0.05071624554750072,86,69,15,2
My point is that it could have been an email.,1.2209302325581395,0.053345434421812485,86,70,13,3
"He told me, 'If this is to be my life's work, so be it.'",1.2207792207792207,0.057349096534596404,77,63,11,3
"It depends, some read from right to left.",1.2207792207792207,0.06025514395462593,77,64,9,4
It's a painting titled circular logic.,1.2207792207792207,0.057349096534596404,77,63,11,3
"The next person who asks which one was painted first,please call 911 for the patron and a criminal defense attorney for me.",1.2207792207792207,0.0475776037055225,77,60,17,0
Honestly? It's a distraction. I couldn't take one more conversation about Squid Games.,1.2207792207792207,0.06025514395462593,77,64,9,4
We need to close the hatch on this one.,1.2207792207792207,0.05428770923216617,77,62,13,2
"He's taking this ""Mother and Child Reunion"" thing a little too seriously.",1.2207792207792207,0.06025514395462593,77,64,9,4
A classic Whodunit first story.,1.2207792207792207,0.057349096534596404,77,63,11,3
Give him a chance... last year he proved the wing IS on the boid.,1.2207792207792207,0.057349096534596404,77,63,11,3
"Biology posters? Obviously, this is the philosophy section.",1.2207792207792207,0.057349096534596404,77,63,11,3
Come here often?,1.2205882352941178,0.05481867402299337,68,54,13,1
You wouldn't believe how he got started.,1.2205882352941178,0.050656741494739324,68,53,15,0
He's Assistant Senior Vice President of the Big Questions Department.,1.2205882352941178,0.05868618733921613,68,55,11,2
Does the price include delivery?,1.2205882352941178,0.05868618733921613,68,55,11,2
Let's wrap this case up and start working on 'Who's on First?',1.2205882352941178,0.06900009617918414,68,58,5,5
Detective Grimes has almost figured out their relationship.  We’ve got just one last question left to answer.,1.2205882352941178,0.06231412478072636,68,56,9,3
Before this he was going to do his dissertation on whether there is a God?,1.2205882352941178,0.05868618733921613,68,55,11,2
He'll work it out. He's from Scotland Yard.,1.2205882352941178,0.05481867402299337,68,54,13,1
"I'm waiting for a scientific consensus, so I can think the opposite.",1.2205882352941178,0.06231412478072636,68,56,9,3
The last place poster at the 2021 Society for Neuroscience Conference.,1.2205882352941178,0.06574216082516834,68,57,7,4
I ordered one of each from Amazon. I'll let you know.,1.2205882352941178,0.05481867402299337,68,54,13,1
‘I love this forensic philosophy course the Bureau is rolling out. We finally going to get stuck into solving some real mysteries!’,1.2205882352941178,0.06231412478072636,68,56,9,3
He is asking for another clue,1.2205882352941178,0.050656741494739324,68,53,15,0
"We need to reboot the entire web.  It's locked in an algorithmically  hopeless infinite loop... Google wants the Egg, Amazon the Chicken, and Facebook users rage messaging that neither one is a suitable answer.",1.2205882352941178,0.06231412478072636,68,56,9,3
"Once again, where's the vegan option?",1.2205882352941178,0.05481867402299337,68,54,13,1
It's his vested interest.,1.2205882352941178,0.05481867402299337,68,54,13,1
Both suspects in the Macdonald case had clear motives. The question is which one got to him first?,1.2205882352941178,0.05481867402299337,68,54,13,1
Zeke should not be on this project. He is dyslexic.,1.2205882352941178,0.050656741494739324,68,53,15,0
In the lobby of the Annual National Philosophy Conference.,1.2205882352941178,0.06231412478072636,68,56,9,3
I think this is a recipe...,1.2205882352941178,0.05868618733921613,68,55,11,2
"In this tight labor market, it's foolproof. Either answer and you get the job.",1.2205882352941178,0.06574216082516834,68,57,7,4
He keeps mumbling about trees falling in forests.,1.2205882352941178,0.06231412478072636,68,56,9,3
Forty-five percent of chickens first came before eggs. The rest came after eggs.,1.2205882352941178,0.05868618733921613,68,55,11,2
Lunch? He's deciding between chicken salad or egg salad.,1.2205882352941178,0.05868618733921613,68,55,11,2
Providing the full family tree to egg buyers is testing well so far,1.2205882352941178,0.06574216082516834,68,57,7,4
As a supermarket bulletin board?  Meh.  Re-labeled as 'modern art'?  Off the charts.,1.2205882352941178,0.06231412478072636,68,56,9,3
We must really be out of LA now... No vegan options ?!,1.2205882352941178,0.05868618733921613,68,55,11,2
"Ah yes, it’s titled “What came first, the artist or the snobist?",1.2203389830508475,0.059551198008116694,59,47,11,1
"Very clever Diane....no one ever thought of posing the question, ""Which came Second""",1.2203389830508475,0.06427129001463884,59,48,9,2
"Neither came first, obviously.",1.2203389830508475,0.06427129001463884,59,48,9,2
Next project is seedless oranges,1.2203389830508475,0.059551198008116694,59,47,11,1
It's the Facebook algorithm.,1.2203389830508475,0.06427129001463884,59,48,9,2
He's over thinking it.,1.2203389830508475,0.059551198008116694,59,47,11,1
"Don't ask me which came first, but there seems to be a connection.",1.2203389830508475,0.06427129001463884,59,48,9,2
"No, after you.",1.2203389830508475,0.06866769441367393,59,49,7,3
"In Hebrew,the egg came first.",1.2203389830508475,0.059551198008116694,59,47,11,1
"On the latest episode of the Eggs-Files, Agents Mulder and Scully try and crack the case after things go a-fowl.",1.2203389830508475,0.06427129001463884,59,48,9,2
We're never going to crack this.,1.2197802197802199,0.053685189628018305,91,75,12,4
"Don't worry, sir. I'm sure he'll crack the problem soon.""",1.2195121951219512,0.052128412091250256,82,66,14,2
It's our business incubator plan .,1.2195121951219512,0.05494074507510377,82,67,12,3
McKinsey thinks they can add value to anything….,1.2195121951219512,0.05761596646468645,82,68,10,4
We can't get either to flip.,1.2195121951219512,0.052128412091250256,82,66,14,2
No decision on this until we get the Gen Z take on it.,1.2195121951219512,0.05494074507510377,82,67,12,3
Let's pretend that we are not here.,1.2191780821917808,0.05601755317984154,73,59,12,2
"Chicken before egg, egg before chicken. Who cares, as long as we are funded.",1.2191780821917808,0.05601755317984154,73,59,12,2
I've been waiting for over an hour for his lunch order.,1.2191780821917808,0.05931680847838621,73,60,10,3
His AI unit threw up its digital hands--and now he's just been staring at the board for hours.,1.2191780821917808,0.05601755317984154,73,59,12,2
The question is: does E = mc2?,1.2191780821917808,0.05601755317984154,73,59,12,2
He takes his comedy very seriously.,1.2191780821917808,0.04875378197274571,73,57,16,0
"Shouldn't someone besides a straight cis white guy get a crack at the problem?""
""I'll sit on it.",1.2191780821917808,0.062441983247385126,73,61,8,4
Jean-Paul is having a tough time putting together his shopping list,1.2191780821917808,0.062441983247385126,73,61,8,4
"The new philosophy PHD final isn't pass/fail in the traditional sense. They either get the joke, or they don't.",1.2191780821917808,0.05931680847838621,73,60,10,3
He's looking to get laid tonight.,1.2191780821917808,0.05931680847838621,73,60,10,3
"Having determined how many angels can dance on the head of a pin, Thomas is on to his next assignment.",1.2191780821917808,0.05931680847838621,73,60,10,3
"If he's Mensa, he'll be pretty sure chickens don't lay dinosaur eggs.",1.2191780821917808,0.05601755317984154,73,59,12,2
"The Benjamin Button Chicken.  Rest assured, we'll find him",1.2191780821917808,0.05931680847838621,73,60,10,3
"We've been asking the wrong question: It's not Who came first..the issue is, Which one crossed the road?",1.2191780821917808,0.05931680847838621,73,60,10,3
He’s still trying to figure out where the sky went.,1.2191780821917808,0.05601755317984154,73,59,12,2
"Tell me, which frame was first put up on the board?",1.2191780821917808,0.05601755317984154,73,59,12,2
"If he can’t decide in the next minute, we are ordering Chinese",1.2191780821917808,0.05931680847838621,73,60,10,3
"I've been telling you, we can't make a break through unless we receive more funding to jump to experimental research",1.2191780821917808,0.062441983247385126,73,61,8,4
Did we need to be in the office to do this?,1.2191780821917808,0.05251141552511415,73,58,14,1
‘Y’know he’s vegan…’,1.21875,0.06481333851304336,64,53,8,3
Typical Devil's Advocate. Can't stop admiring his own work.,1.21875,0.060866551595885596,64,52,10,2
He’s been pondering for hours.  We’ve got an office pool going on what comes first: regained responsiveness or soiled underwear.,1.21875,0.06481333851304336,64,53,8,3
Sometimes vintage tech helps put first things first.,1.21875,0.052083333333333336,64,50,14,0
The professor has scientific proof that the chicken came before the egg.,1.21875,0.05664543544843536,64,51,12,1
"What's really the difference? Once a month, my eggs tell me to kill you.",1.21875,0.052083333333333336,64,50,14,0
"Which came first, the bulletin board or yarn?",1.21875,0.06481333851304336,64,53,8,3
I think it’s obvious which came first.,1.21875,0.05664543544843536,64,51,12,1
"Yeah, he’s the only one that wanted to meet in the office instead of Zoom. So let’s see how he does interpreting the data on my kid’s science project.",1.21875,0.05664543544843536,64,51,12,1
"Yes, I know about the chicken.  But why did the egg cross the road?",1.21875,0.05664543544843536,64,51,12,1
"We're just city folks, what do we know?",1.21875,0.05664543544843536,64,51,12,1
He's certain he almost has it now...,1.21875,0.06481333851304336,64,53,8,3
YOU promoted to detective the only person from the police academy who had a college degree in philosophy.,1.21875,0.060866551595885596,64,52,10,2
I know the egg's too big to have come from the chicken but whatever the artist claims is 110% true.,1.21875,0.05664543544843536,64,51,12,1
Definitely the incredible egg. It had over 50 million views.,1.21875,0.060866551595885596,64,52,10,2
I'm finding it hard to complete my existential debate to do list.,1.21875,0.06853320797422294,64,54,6,4
"Just like you, the rooster is irrelevant in this discussion.",1.21875,0.05664543544843536,64,51,12,1
He can't decide what to have for dinner.,1.21875,0.06481333851304336,64,53,8,3
He'll get this.  He already figured out why it crossed the road,1.21875,0.05664543544843536,64,51,12,1
These interview puzzles are getting out of hand.,1.21875,0.05664543544843536,64,51,12,1
I think it could go either way.,1.21875,0.060866551595885596,64,52,10,2
‘It’s anybody’s guess’ is a cop-out.,1.2183908045977012,0.05526366862947198,87,72,11,4
"I tried to egg him on,but the ""roost"" is up,he said. According to Stan,the chicken came first.",1.2183908045977012,0.052789817806336015,87,71,13,3
I think we'll be here awhile,1.2181818181818183,0.061905266448664883,55,44,10,1
"Our symposium explores the questions of which came first, the chicken or the egg and did the chicken cross the road because the egg was on the other side.",1.2181818181818183,0.0671242332357016,55,45,8,2
"Don't worry, he's an eggspert in the field...",1.2181818181818183,0.056203748457549704,55,43,12,0
"Empirically, I guess you could also suggest the head and the ass.",1.2179487179487178,0.05667979681019971,78,64,11,3
What came first?  Performance art or bulletin boards?,1.2179487179487178,0.0504638355700878,78,62,15,1
We'll find that Cock,1.2179487179487178,0.05667979681019971,78,64,11,3
This would be easier if half our evidence wasn't scrambled and the other half wasn't fried.,1.2179487179487178,0.05667979681019971,78,64,11,3
It’s neither. Trump was first. He is first at everything and he always wins.,1.2179487179487178,0.06741365365003485,78,68,3,7
The T rex obviously came first,1.2179487179487178,0.0504638355700878,78,62,15,1
.  I guess you had to go to business school.,1.2179487179487178,0.05667979681019971,78,64,11,3
We just got the results from forensics. Turns out neither one of them came.,1.2173913043478262,0.061487546190134544,69,57,9,3
It's part of the QAnon deprogramming.,1.2173913043478262,0.061487546190134544,69,57,9,3
Nothing definitive yet.  But the research is yielding valuable data on her motivation for crossing the road.,1.2173913043478262,0.05791770780148665,69,56,11,2
"It's still a mystery, Captain. We just don't know.",1.2173913043478262,0.050019455794393694,69,54,15,0
It’s all the rooster’s fault!,1.2173913043478262,0.05791770780148665,69,56,11,2
"Scientists are confident that if they can determine what came first the chicken or the egg
They will also be able unlock the secret to what actually started COVID-19",1.2173913043478262,0.061487546190134544,69,57,9,3
He says it's just a matter of organizing the information.,1.2173913043478262,0.05791770780148665,69,56,11,2
It's a classic chicken and egg problem.,1.2173913043478262,0.061487546190134544,69,57,9,3
"First of all, I’m vegan.",1.2173913043478262,0.061487546190134544,69,56,9,3
I thought I told you not to bring anymore of those Cornell Ag School guys here,1.2173913043478262,0.05411287663276502,69,55,13,1
"Ah, the chicken or the egg again. how much tenure did you say he has?",1.2173913043478262,0.050019455794393694,69,54,15,0
His may be the definitive call. He has a lot of pluck with this Gallery.,1.2173913043478262,0.05411287663276502,69,55,13,1
"Where should we place him, research and development or shipping and receiving?",1.2173913043478262,0.06486120408988312,69,58,7,4
The eleventh focus group was split as well.,1.2173913043478262,0.05411287663276502,69,55,13,1
"I know this is only the pilot, but I have a good feeling",1.2173913043478262,0.06486120408988312,69,58,7,4
We’re leaning towards alien insemination of the chicken…,1.2173913043478262,0.05791770780148665,69,56,11,2
The suspect hatched a plan that has stumped humanity,1.2173913043478262,0.06486120408988312,69,58,7,4
We've been trying to crack this one for years.,1.2173913043478262,0.050019455794393694,69,54,15,0
Put aside your other projects.  This one’s urgent.,1.2173913043478262,0.050019455794393694,69,54,15,0
"Next, he signs the salmonella and cholesterol waiver... then he can be seated for breakfast.",1.2173913043478262,0.061487546190134544,69,57,9,3
He almost certain it's another cereal killer,1.2173913043478262,0.05791770780148665,69,56,11,2
"I proved conclusively that the chicken did cross the road...the egg, not so much.",1.2173913043478262,0.05791770780148665,69,56,11,2
Again: I prefer talking in circles online. You?,1.2173913043478262,0.05411287663276502,69,55,13,1
With Gil back we will finally get an answer.,1.2173913043478262,0.05791770780148665,69,56,11,2
"The focus group says ""affable"", ""unthreatening"", ""trustworthy""...just what we need right now, the Egg!",1.2173913043478262,0.05411287663276502,69,55,13,1
He has an egg fetish.,1.2173913043478262,0.05411287663276502,69,55,13,1
He’s working on our origin story.,1.2173913043478262,0.050019455794393694,69,54,15,0
Both are claiming rights to the I.P.,1.2173913043478262,0.05791770780148665,69,56,11,2
Are you hoping that Chicken Little's claims won't come true if you turn her into a riddle?,1.2173913043478262,0.05791770780148665,69,56,10,2
"to make things worse, he’s left-handed.",1.2173913043478262,0.050019455794393694,69,54,15,0
This restaurant has two items and Jerry still can’t decide.,1.2173913043478262,0.061487546190134544,69,57,9,3
He’s taking this whole chicken sandwich thing way too far.,1.2173913043478262,0.05411287663276502,69,55,13,1
His conspiracy theories are getting out of control,1.2173913043478262,0.061487546190134544,69,57,9,3
"As an Economist,  I must say, on the other hand, they both came first.",1.216867469879518,0.05433917050702214,83,68,12,3
"Whenever he's done with the ""Which came first?"" display, he moves on to ""Can omnipotent God create a stone he cannot lift?""",1.216867469879518,0.04551011283857881,83,65,18,0
"It's the new and improved egg. Twice the size, without the need for a chicken.",1.216867469879518,0.04863156105710082,83,66,16,1
It's going to become a book called chick magnets for dummies.,1.216867469879518,0.05433917050702214,83,68,12,3
But those Darwinian constructs simply no longer apply to modern GMO-based agribusiness models.,1.216867469879518,0.05433917050702214,83,68,12,3
"Yes sir, I will eggsplain that to him",1.216867469879518,0.04863156105710082,83,66,16,1
The yoke in the joke,1.2166666666666666,0.05866531842313125,60,48,11,1
The RNC is trying to show that chickens came first and cast fraudulent votes for Biden.,1.2166666666666666,0.07550832133836045,60,52,3,5
"New Intern,huh?",1.2166666666666666,0.053634390406482234,60,47,13,0
He's struggling: omelette or Southern deep fried...,1.2166666666666666,0.06329764084940143,60,49,9,2
I’m going to need a lot more charts and graphs to figure out this one.,1.2166666666666666,0.053634390406482234,60,47,13,0
We have narrowed it down to our two prime suspects.  We just don't know which one was at the location first.,1.2166666666666666,0.053634390406482234,60,47,13,0
"Make up your mind, Einstein, time’s up.",1.2166666666666666,0.053634390406482234,60,47,13,0
To eggs-plore this phenomenon I’d say it was the rooster who was the first!,1.2166666666666666,0.06329764084940143,60,49,9,2
"As a feminist, I believe we need to think intersectionally about this question.",1.2166666666666666,0.05866531842313125,60,48,11,1
Just don’t ask him how this started,1.2166666666666666,0.06329764084940143,60,49,9,2
We’re trying the Nordic Noir method now.,1.2166666666666666,0.05866531842313125,60,48,11,1
If Dan doesn’t figure this out in the next hour no one is coming tonight.,1.2166666666666666,0.05866531842313125,60,48,11,1
This will keep him busy or he will compete in the race for promotion,1.2166666666666666,0.053634390406482234,60,47,13,0
We still can’t figure out which came first.,1.2162162162162162,0.0585846589323963,74,61,10,3
We’re getting closer to which came first.,1.2162162162162162,0.04818155789706756,74,58,16,0
We're trying to shape it for the vegan market.,1.2162162162162162,0.06166356711357831,74,62,8,4
"Despite not having a product or customers, SoftBank just gave us $200 million in VC funding to disrupt chicken fucking. Now you go in to that conference and tell the staff we're disrupting chicken fucking, and let those nerds figure it out.",1.2162162162162162,0.06740075669502478,74,64,4,6
"We don't talk to him, he supports a free-range economy...",1.2162162162162162,0.0585846589323963,74,61,10,3
We're still vetting our candidate,1.2162162162162162,0.05188155518422755,74,59,14,1
