caption,mean,precision,votes,not_funny,somewhat_funny,funny
It’s the screening test for new Evolutionary Zoology interns. It weeds out the evangelicals.,1.2891566265060241,0.06068015045143841,83,63,16,4
No. YOU go first.,1.2891566265060241,0.06534368660666384,83,65,12,6
He's working on a new breakfast menu.,1.2891566265060241,0.06068015045143841,83,63,16,4
"As cold cases go, it’s a hard one to crack.",1.2891566265060241,0.05562700727406159,83,61,20,2
Just waiting on the Feds to crack this case.,1.288888888888889,0.0575063247771442,90,68,18,4
This dumbass thinks fully-grown chickens hatch out of giant eggs.,1.288888888888889,0.0575063247771442,90,68,18,4
The crossing guard confirmed the chicken was struck by the egg.,1.288888888888889,0.052986805990734444,90,66,22,2
DNA keeps leading us to IHOP.,1.288888888888889,0.0575063247771442,90,68,18,4
"He's right; it's the whiteboard that came first.""",1.288888888888889,0.05529276172553746,90,67,20,3
We're really close on this. We just need some more red yarn.,1.288888888888889,0.05963778399229567,90,69,16,5
He was the only man for the job after his work on the Schrödinger case,1.288888888888889,0.05529276172553746,90,67,20,3
Now that's a combo,1.288659793814433,0.052756416212522445,97,72,22,3
Don’t ever make the mistake of asking him if he wants chicken or an egg  for supper.,1.288659793814433,0.058545446863920325,97,75,16,6
He’s getting ideas for the Sex Ed curriculum for the school district.,1.2876712328767124,0.06005911615509547,73,54,17,2
"Protruding evidence points to the egg coming before the chicken, but office politics will keep this in the dark.",1.2876712328767124,0.06005911615509547,73,54,17,2
He' s working on an algorithm.  He's sure that will solve it.,1.2876712328767124,0.06891044873418525,73,57,11,5
That's been some trouble figuring out who wins third place.,1.2875,0.06211909244000285,80,61,15,4
We’ve been asked to appear on ‘Unsolved Mysteries.’,1.2875,0.06211909244000285,80,61,15,4
I find it pretty fowl that we've such poultry evidence to go by.,1.2875,0.06211909244000285,80,61,15,4
Conference budgets sure took a hit since the pandemic.,1.2875,0.053938989209680446,80,58,21,1
"The egg, just before Adam,  for his bacon and egg breakfast.",1.2875,0.059517442396049634,80,60,17,3
"Frank,just because I have ovaries doesn’t mean I can solve this for you...",1.2875,0.06934081578822976,80,64,9,7
It was this or figuring out the unified field theory.,1.2875,0.059517442396049634,80,60,17,3
That reminds me - my gnawing conundrum right now is should I order a chicken salad or egg salad sandwich for lunch?,1.2875,0.053938989209680446,80,58,21,1
What he doesn’t realize is that I come first,1.2875,0.06211909244000285,80,61,15,4
The victim bought the farm.,1.2875,0.06461607649627257,80,62,13,5
It doesn't matter if chicken or egg came first now because we made it in the lab. All good for Business,1.2875,0.056796745093046976,80,59,19,2
He's a hardboiled detective.,1.2873563218390804,0.06097323038936246,87,67,15,5
"He keeps mumbling something about ""crossing a road"".",1.2873563218390804,0.05874033212156991,87,66,17,4
"I don't know how many times I've told him, ""Just make the damned omelet!""",1.2873563218390804,0.06722841246972949,87,70,9,8
We've narrowed it down to just two suspects... each claims the other got there first.,1.2873563218390804,0.05874033212156991,87,66,17,4
"Well, if you read left-to-right, it's obviously the chicken.",1.2873563218390804,0.06312719723285842,87,68,13,6
the solution is on the other side of the board,1.2873563218390804,0.06097323038936246,87,67,15,5
"He refers to it as his ""Rosetta Stone.""",1.2873563218390804,0.06312719723285842,87,68,13,6
He was only asked to redesign the breakfast menu,1.2873563218390804,0.06097323038936246,87,67,15,5
What about Meta?,1.2873563218390804,0.06097323038936246,87,67,15,5
We should crack this case pretty soon,1.2873563218390804,0.06097323038936246,87,67,15,5
Let’s just follow the science.,1.2872340425531914,0.05156516274621984,94,69,23,2
I'm thinking of reassigning him to Project Tree in the Forest.,1.2872340425531914,0.05783863593878793,94,72,17,5
Which came first?  The quill or egg tempera?,1.2872340425531914,0.05783863593878793,94,72,17,5
The murderer is obviously someone who can't stand existential questions.,1.2872340425531914,0.05156516274621984,94,69,23,2
This research project won’t be over easy.,1.2871287128712872,0.05687685788651512,101,78,17,6
"Still, no crack in the case. It just dozen seem possible...",1.2871287128712872,0.05859178069510292,101,79,15,7
The egg seems to think this is all a yolk.,1.287037037037037,0.049313258815131475,108,82,22,4
Analog or Metaverse? That is the question.,1.287037037037037,0.049313258815131475,108,80,25,3
It's all wrong if one is reading from left to right.,1.287037037037037,0.05432318376671947,108,83,19,6
He said he’s about to crack this case wide open.,1.2857142857142858,0.05695941250527519,91,69,18,4
Apparently the evolutionary biologists want us all to vote on who came first.,1.2857142857142858,0.055068487509023045,84,62,20,2
The defining case of his career.,1.2857142857142858,0.052497373120429666,91,67,22,2
"He claims he can prove, using geometric logic, which came first.",1.2857142857142858,0.05191265860554197,105,79,22,4
Wouldn’t it be good if Will Hunting were here?,1.2857142857142858,0.059064159328194484,91,70,16,5
He says it was a tie.,1.2857142857142858,0.0495864381786159,84,60,24,0
He's almost got this case cracked.,1.2857142857142858,0.05501861630239431,77,56,20,1
"Well, he currently thinks it’s the dinosaur, but it’s probably his latest ‘breakthrough’.”",1.2857142857142858,0.05804146482893351,77,57,18,2
If anyone can figure it out it’s Steve Kornacki.,1.2857142857142858,0.05501861630239431,77,56,20,1
What part of “golden goose” was unclear?,1.2857142857142858,0.060914490387317215,77,58,16,3
"We put our eggheads on it, sir. We expect a breakthrough any minute now.",1.2857142857142858,0.05761423477905692,84,63,18,3
He says he doesn't understand the question.,1.2857142857142858,0.063657981736816,77,59,14,4
"It's something called 'neo-meta'.""",1.2857142857142858,0.05761423477905692,84,63,18,3
I thought it would be more interesting asking which came second.,1.2857142857142858,0.06239489974722311,84,65,14,5
He's not even looking at the rooster.,1.2857142857142858,0.06497057526101394,91,73,10,8
"An exercise in self-confidence; chicken and egg today, global warming tomorrow.",1.2857142857142858,0.056177411259972436,98,75,18,5
He's now pondering what came first: the chicken salad sandwich or the omelette.,1.2857142857142858,0.060914490387317215,77,58,16,3
"He hasn't cracked it yet, but I'm craving an omelet",1.2857142857142858,0.05695941250527519,91,69,18,4
"It's a new start-up, Chickenancestry.com.",1.2857142857142858,0.05801978086477821,98,76,16,6
Is there a problem?,1.2857142857142858,0.05761423477905692,84,63,18,3
He just proved they both came first.,1.2857142857142858,0.06239489974722311,84,65,14,5
Explain to me again the merits of having a hands-on CEO.,1.2857142857142858,0.05761423477905692,84,63,18,3
"‘We’ve cancelled all interviews, this is all we really need to know about prospective employees.’",1.2857142857142858,0.05011760110325879,91,66,24,1
He never knew his mother,1.2857142857142858,0.05804146482893351,77,57,18,2
Don't underestimate him; last year he invented Gluten-free bacon.,1.2843137254901962,0.05096134823432229,102,76,23,3
He says he's close to cracking it.,1.2842105263157895,0.05325498655943968,95,71,21,3
Couldn't we just have asked Frank Perdue?,1.2842105263157895,0.06108969026259694,95,75,13,7
"My study sheds new light on ""which came first,"" but more research is needed.",1.2842105263157895,0.05325498655943968,95,71,21,3
It’s not as easy as it looks.,1.2842105263157895,0.06108969026259694,95,75,13,7
He earned his stripes solving the case of a zebra's undercoat,1.2842105263157895,0.055317788813180016,95,72,19,4
He will give up and go vegan soon,1.2842105263157895,0.05730638642344382,95,73,17,5
He’s tried reversing his approach but still no luck.,1.2842105263157895,0.05325498655943968,95,71,21,3
Our next symposium will examine the timeline of the cart versus the horse.,1.2840909090909092,0.05586982845460908,88,66,19,3
Let's not wait -- he overthinks everything.,1.2840909090909092,0.06036475603574378,88,68,15,5
"I don't get this obsession. Like Dr. Ruth used to say, ""Just take turns!""",1.2840909090909092,0.05586982845460908,88,66,19,3
I'm not sure I understand  the question.,1.2840909090909092,0.05816073203976336,88,67,17,4
We don’t think that coming first is important here,1.2840909090909092,0.05586982845460908,88,66,19,3
"I know how it looks, but we ran out of work for the last summer interns.",1.2840909090909092,0.06249109369429035,88,69,13,6
The new branding team at Facebook is just going through their process.,1.2840909090909092,0.06036475603574378,88,68,15,5
Where’s the pregnancy test result stick?,1.2839506172839505,0.06391199558293721,81,63,13,5
The data shows that you have to cross the road to get ahead.,1.2839506172839505,0.061449989455529964,81,62,15,4
Are you the guy from I.T. who told him to use a smart board?,1.2839506172839505,0.06391199558293721,81,63,13,5
"Which came first, the intellectual or the naif?",1.2839506172839505,0.06628261578047466,81,64,11,6
are you kidding?  he doesn't even know how his toaster works.,1.2839506172839505,0.05620335624735822,81,60,19,2
He thinks the one on the right should come first,1.2839506172839505,0.058885135889934916,81,61,17,3
It’s not problematic. It’s the cafeteria menu.,1.2839506172839505,0.06391199558293721,81,63,13,5
F the protein diet!,1.2839506172839505,0.061449989455529964,81,62,15,4
I’d say he’s going to vote for the egg.,1.2839506172839505,0.058885135889934916,81,61,17,3
"HE came first, of course.",1.2839506172839505,0.061449989455529964,81,62,15,4
"Yeah,but what are we going to do if the DNA doesn’t match?",1.2839506172839505,0.058885135889934916,81,61,17,3
"We know it happened just before breakfast, sir.""",1.2839506172839505,0.06391199558293721,81,63,13,5
"He wants the chicken/egg project to be the lead story, can we bump climate emergency again?",1.2839506172839505,0.058885135889934916,81,61,17,3
What is wrong with this mirror?,1.2839506172839505,0.061449989455529964,81,62,15,4
When he gets done with this he's going to find out why the chicken crossed the road.,1.2837837837837838,0.06808392111797266,74,58,11,5
We poached the best in business,1.2837837837837838,0.0624095651395455,74,56,15,3
Chicken is the clear National winner of  “who came first “but this Florida guy is claiming voter fraud.,1.2837837837837838,0.06808392111797266,74,58,11,5
Just wait until we introduce him to Schrodinger.,1.2837837837837838,0.0624095651395455,74,56,15,3
"Which came first, the project or the staffing?",1.2837837837837838,0.05936935719680311,74,55,17,2
"I don't know, I walked away as soon as he said, 'podcast'.",1.2837837837837838,0.05936935719680311,74,55,17,2
Unlike that guy over there we both know who came first,1.2837837837837838,0.06808392111797266,74,58,11,5
"explain it to him, please!",1.2830188679245282,0.056483850201068636,106,83,16,7
"Actually, he's just trying to decide what to order for lunch.",1.2830188679245282,0.05487012679245056,106,82,18,6
"This security guard … was he by any chance sort of a reddish-brown, with white markings?",1.2828282828282829,0.05750320013036443,99,77,16,6
I think we've cracked the case.,1.2828282828282829,0.05926855058560707,99,78,14,7
He just asked me about the road.,1.2826086956521738,0.05850111983222954,92,71,16,5
McNuggets or McMuffins?,1.2826086956521738,0.05426414963072896,92,69,20,3
"Our perp is being a chicken - I'm going to apply some heat and win him over, easy",1.2826086956521738,0.06050845035913785,92,72,14,6
No one seems to know.,1.2826086956521738,0.05850111983222954,92,71,16,5
We've finally whittled it down to these two,1.2826086956521738,0.05426414963072896,92,69,20,3
We've officially run out of Law & Order plots.,1.2823529411764707,0.057031527734309716,85,64,18,3
This one always stumps the new recruits.,1.2823529411764707,0.054520483406618934,85,63,20,2
"Evolutionary, my dear Watson.",1.2823529411764707,0.04911475360068048,85,61,24,0
His conspiracy flow chart seems to be going nowhere.,1.2823529411764707,0.05943658133277237,85,65,16,4
just let him think he’s the philosopher he thinks he is,1.2823529411764707,0.06397602121235049,85,67,12,6
He promised his 6 year old daughter he would have the answer by her bedtime.,1.2823529411764707,0.057031527734309716,85,64,18,3
Actually...,1.2823529411764707,0.06174803029526685,85,66,14,5
Do we at least know which was first to the scene?,1.2823529411764707,0.057031527734309716,85,64,18,3
No doubt about it. He came first.,1.2820512820512822,0.060239935115303136,78,59,16,3
And just when we thought we'd run out of ideas for Podcasts...,1.2820512820512822,0.06294322930781567,78,60,14,4
"That guy there, he's actually projecting those objects on the board from his brain through his eyes. Want to go get a coffee?",1.2820512820512822,0.06294322930781567,78,60,14,4
It’s a decision made in hell. No matter what you decide you get in.,1.2820512820512822,0.07043330969574882,78,63,8,7
"Everyone thinks what came first, the chicken or the egg? But what about the rooster?",1.2820512820512822,0.05740948919556417,78,58,18,2
"Poor guy, he thinks it's the egg",1.2820512820512822,0.05443205964039268,78,57,20,1
He wants to know exactly when the chicken crossed the road.,1.2820512820512822,0.06553510851975908,78,61,12,5
Clearly that guy is a Never Chickener.,1.2820512820512822,0.060239935115303136,78,59,16,3
"Sure, We have eggs for breakfast, then chicken for lunch.",1.2820512820512822,0.05740948919556417,78,58,18,2
Even the janitor can't figure this one out.,1.2820512820512822,0.06294322930781567,78,60,14,4
We're looking at Mrs. Peacock with a dagger in the kitchen.,1.2820512820512822,0.05740948919556417,78,58,18,2
They always want to know if the egg is an original print or a reproduction.,1.2820512820512822,0.060239935115303136,78,59,16,3
"It’s all such a mess,  we decided to start from scratch",1.2820512820512822,0.060239935115303136,78,59,16,3
Finally someone is working on the real issues,1.2820512820512822,0.05443205964039268,78,57,20,1
Are we sure we REALLY want to know which came first?,1.2816901408450705,0.0670838347287272,71,55,12,4
"That should keep your nerdy boyfriend busy while you and I--ahem--take a lunch break.""",1.2816901408450705,0.07001896435132925,71,56,10,5
We're trying to work out what the crime actually is.,1.2816901408450705,0.0670838347287272,71,55,12,4
Women figured this out centuries ago. Can we move on to something more pressing?,1.2816901408450705,0.0640142671206166,71,54,14,3
But the rooster is the only one who actually came.,1.2816901408450705,0.0640142671206166,71,54,14,3
This crime will never be solved.,1.2815533980582525,0.0523890971493569,103,78,21,4
Should we tell him that's not a lunch menu?,1.28125,0.054818530370029296,96,73,19,4
It is actually pronoun ediquette training,1.28125,0.06230781856545745,96,77,11,8
Neither . . .,1.28125,0.05678353209816962,96,74,17,5
‘This is what a meta problem used to mean’,1.28125,0.05678353209816962,96,74,17,5
"He is trying to decipher which came first, the egg or the chicken.",1.2808988764044944,0.061867357959051864,89,70,13,6
He works in the cafeteria.,1.2808988764044944,0.06586573624168951,89,72,9,8
Even Einstein couldn't work this one out,1.2808988764044944,0.05759205458226946,89,68,17,4
This chart offers definite proof that the chicken is unrelated to the egg.,1.2808988764044944,0.05533066180784329,89,67,19,3
These Vegans need time to get their heads round this dilemma!,1.2808988764044944,0.052972818701488324,89,66,21,2
"Yes, of course it was an affair.",1.2808988764044944,0.05759205458226946,89,68,17,4
If he murmurs “Eggs-actly” one more time…,1.2808988764044944,0.05533066180784329,89,67,19,3
Our rebrand? Ovum,1.2808988764044944,0.05976794597374316,89,69,15,5
ForHENsics 101,1.2808988764044944,0.05976794597374316,89,69,15,5
Never ask a forensic detective what they want for lunch.,1.2808988764044944,0.05976794597374316,89,69,15,5
CSI: Old McDonald’s Farm,1.2808988764044944,0.05533066180784329,89,67,19,3
It turns out the chicken was actually in cahoots with the egg,1.2808988764044944,0.05976794597374316,89,69,15,5
I told you a philosophy major would come in handy.,1.2808988764044944,0.05533066180784329,89,67,19,3
It keeps him busy.,1.2804878048780488,0.05562161450345199,82,61,19,2
There is evidence of fowl play.,1.2804878048780488,0.0632226728850309,82,64,13,5
Is this relevant? The suspect ordered an omelette?,1.2804878048780488,0.06079467282974132,82,63,15,4
All I asked him was if he knew how to make an omelet.,1.2804878048780488,0.0632226728850309,82,64,13,5
He took your analogy too seriously Chief.,1.2804878048780488,0.05562161450345199,82,61,19,2
We think he’s cracked it.,1.2804878048780488,0.06079467282974132,82,63,15,4
"While your research findings are undoubtedly compelling, I was actually more interested in whether you might be free for dinner tonight.",1.2804878048780488,0.06079467282974132,82,63,15,4
"He's our best cold case detective, but I don't know about this one.",1.2804878048780488,0.06079467282974132,82,63,15,4
We had to go back to the drawing board.,1.28,0.05869450608911405,75,56,17,2
"You'd think he was ordering off of a French menu""",1.28,0.055194788218315013,100,77,18,5
I still think “Dialectics of Ambiguity in Interpreting Domestic Avian Reproduction in the Context of Transgressions of Asphalt” sounded fundable.,1.28,0.06454274371116994,75,58,13,4
"It's was great to get Kornacki to speak at our convention between elections, but he's easily distracted.",1.28,0.06168796807648479,75,57,15,3
He has a major in Criminal Justice and a minor in Collage.,1.28,0.055194788218315013,100,77,18,5
The Boss wants to know where the bacon fits in.,1.28,0.06168796807648479,75,57,15,3
"We do have one eyewitness who said he thought he saw the chicken laying that first egg, but he's not sure.",1.28,0.0555399377446958,75,55,19,1
"Sometimes you don't want the answer, you just want the thrill of the chase.",1.28,0.06454274371116994,75,58,13,4
He's planning their family reunion.,1.28,0.05869450608911405,75,56,17,2
Did we really need to bring in McKinsey for this?,1.28,0.06168796807648479,75,57,15,3
This would explain the clucking sound,1.2795698924731183,0.05993137613320426,93,73,14,6
"Yep, he thinks the chicken did it.",1.2795698924731183,0.05589509516788062,93,71,18,4
I'm not buying it.,1.2795698924731183,0.05794838871377718,93,72,16,5
"The good news is the eggs are getting larger.  The bad news is the chickens are not happy about it.""",1.2795698924731183,0.05589509516788062,93,71,18,4
"Which came first, breakfast or dinner?",1.2795698924731183,0.05794838871377718,93,72,16,5
So I’m guessing he’s made no actual progress on next year’s budget.,1.2795698924731183,0.05154370458584886,93,69,22,2
"Either way, it's rich in protein.",1.2795698924731183,0.05589509516788062,93,71,18,4
"I disagree, the egg came first and it should be on the left.",1.2795698924731183,0.05589509516788062,93,71,18,4
"He’s close to an answer. Let’s not tell him, just yet, that his finding has been pulled",1.2795698924731183,0.053763440860215075,93,70,20,3
"Yes, we have the chicken under close surveillance.",1.2790697674418605,0.04865119940989379,86,62,24,0
He needs the overtime.,1.2790697674418605,0.05646000918945887,86,65,18,3
If we can figure this out we can take back the House.,1.2790697674418605,0.05646000918945887,86,65,18,3
"No real leads yet, but we are still waiting on results from the coop.",1.2790697674418605,0.05883307274731867,86,66,16,4
It is imperative that we crack this before breakfast.,1.2790697674418605,0.06111405943077911,86,67,14,5
What are we looking at here? Tiny chicken or giant egg?,1.2790697674418605,0.05646000918945887,86,65,18,3
"Confidentially speaking, I don't think Harris can solve this.  It feels like... like he's winging it.",1.2784810126582278,0.05679046615991113,79,59,18,2
Which came second?,1.2784810126582278,0.059579585358435654,79,60,16,3
He thinks the results of this study could get him tenure.,1.2784810126582278,0.059579585358435654,79,60,16,3
Why do Ivy League breakfast menus have to be so complicated?,1.2784810126582278,0.059579585358435654,79,60,16,3
"He's been at this since graduate school, but he can't stop because the 
National Institutes of Health keeps giving him grants.",1.2784810126582278,0.05679046615991113,79,59,18,2
The answer was obvious. Egg McMuffin for breakfast and chicken McNuggets for lunch,1.2784810126582278,0.06224385059028908,79,61,14,4
Chicken vs. Egg (Rooster started it!),1.2783505154639174,0.05814698027153856,97,76,15,6
"Of course it won't work.  It's the goose that lays the golden egg, not the damn chicken.",1.2783505154639174,0.05432787544248242,97,74,19,4
"He was transferred from IT, and we didn't know what else to do with him.",1.2783505154639174,0.05814698027153856,97,76,15,6
He keeps switching them from left to right.,1.2783505154639174,0.050219167510912335,97,72,23,2
I think we’re treading on eggshells.,1.2783505154639174,0.05231387404686713,97,73,21,3
"Do you think he'll find out it's an elementary school bulletin board? It looks like that, no.",1.2783505154639174,0.05814698027153856,97,76,15,6
Looks like Ted had finally moved past his one-hand-clapping phase.,1.2777777777777777,0.0632400543072825,72,55,14,3
"If we can establish which side of the road they are on, the whole issue of “first”becomes irrelevant.",1.2777777777777777,0.0531563312184,72,52,20,0
I think he’s leaning towards the egg.,1.2777777777777777,0.056717121359687414,72,53,18,1
Tell him it was a tie and let’s get out of here!,1.2777777777777777,0.06626115585708797,72,56,12,4
Apparently this chicken or egg issue is still a major unresolved case for CSI: Des Moines.,1.2777777777777777,0.06006719705512132,72,54,16,2
He believes he may soon have the solution.,1.2777777777777777,0.057034010436855194,90,69,17,4
I told you Jerry doesn't deal very well with metaphors.,1.2777777777777777,0.06626115585708797,72,56,12,4
"Criminology 101 hasn't changed in years, has it?",1.2777777777777777,0.06626115585708797,72,56,12,4
What difference does it really make ?,1.2777777777777777,0.05918248251508748,90,70,15,5
I told you we should've made it cruelty-free.,1.2777777777777777,0.05480137275994078,90,68,19,3
False dichotomies are political necessities; we always start newbies with the easier ones.,1.2777777777777777,0.06006719705512132,72,54,16,2
And that's how the chickenosaurus was born,1.2777777777777777,0.057034010436855194,90,69,17,4
I'm sorry but I just don't care and I have serious reservations about people who do.,1.2777777777777777,0.06626115585708797,72,56,12,4
Maybe we should go for pancakes instead,1.2777777777777777,0.05247382744032162,90,67,21,2
"As it turns out, we were asking the wrong question.",1.2777777777777777,0.06125564567275382,90,71,13,6
"You don't need an egg pun to win the caption contest, Don.",1.2777777777777777,0.06006719705512132,72,54,16,2
We can always call it a Six Sigma project    and confuse the heck out of everyone.,1.2771084337349397,0.06254766742241297,83,65,13,5
We appear to have a conundrum wrapped in an enigma.,1.2771084337349397,0.05765842505171365,83,63,17,3
"He's not sure which came first, the research or the art.",1.2771084337349397,0.06254766742241297,83,65,13,5
"We know one of them crossed the road, but we are still working on the motive.",1.2771084337349397,0.060152741747275584,83,64,15,4
It's awful but someone will buy it.,1.2771084337349397,0.060152741747275584,83,64,15,4
If he solves it do we hire him?  Or do we hire him to solve it?,1.2771084337349397,0.06254766742241297,83,65,13,5
This might be the most complex case I’ve seen yet Scully,1.2767857142857142,0.054124929116160334,112,88,17,7
Its value as a scientific tool is questionable but it’s got a great chance in the annual office art contest.,1.2765957446808511,0.05537719355921566,94,72,18,4
He’s an expert in cloaca-location.,1.2765957446808511,0.05537719355921566,94,72,18,4
He’s an evolutionary genealogist.,1.2765957446808511,0.05740569802641553,94,73,16,5
"That’s right, he killed the chicken AND the egg.  So we’ll never know",1.2763157894736843,0.06648752477767439,76,60,11,5
David has just declared that he’s “ovo-vegetarian.”,1.2763157894736843,0.06098226434871825,76,58,15,3
"Corporate understands ""first things first.""  They really need him to move on to the ""before they hatch"" problem",1.2763157894736843,0.06098226434871825,76,58,15,3
This family tree leaves me with more questions than answers.,1.2763157894736843,0.06098226434871825,76,58,15,3
He's invented Bitcoin.,1.2763157894736843,0.06379430819500599,76,59,13,4
This research says noting about why it crossed the road.,1.276190476190476,0.054964587492755165,105,82,17,6
Bring in the rooster.,1.276190476190476,0.058201428200252134,105,84,12,8
It was a cooperative effort.,1.2758620689655173,0.05345495814950669,87,65,20,2
"Which came first, the flowchart or the geek?",1.2758620689655173,0.05345495814950669,87,65,20,2
"Of course CANCER RESEARCH gets all the funding. No one gets it.""",1.2758620689655173,0.06266311017028482,87,69,12,6
"""I told him we don't have 'answers' . . . only dozens of 'questions'.""",1.2758620689655173,0.05824129946600936,87,67,16,4
"We have two suspects:  God and Darwin.  The evidence points to Darwin, but the witnesses insist God made the chicken first.",1.2758620689655173,0.06049262078841781,87,68,14,5
"Who is going to tell him
that neither is actually coming first, while they’re stuck on a container at the port?",1.2758620689655173,0.06266311017028482,87,69,12,6
