caption,mean,precision,votes,not_funny,somewhat_funny,funny
"Honey, I don't think this is how you play Pinball.",1.1764705882352942,0.044835430755667996,85,71,13,1
"Look, I'm just doing what the couples therapist said. Now, stand over there.",1.1764705882352942,0.051069236647683494,68,57,10,1
"Damn, we forgot the shoes!",1.1764705882352942,0.055200076943347304,68,58,8,2
11A already thinks we are bowling up here,1.1764705882352942,0.051069236647683494,68,57,10,1
I donno what the neighbors are complaining about.,1.1764705882352942,0.04657344059657538,68,56,12,0
"Don't get me wrong, the bowling yoga class was great. I just don't think hot bowling yoga is for me.",1.1764705882352942,0.055200076943347304,68,58,8,2
"Thought if they all met in a less frantic context, things would be different",1.1764705882352942,0.055200076943347304,68,58,8,2
They should have been perfect for each other…,1.1764705882352942,0.04657344059657538,68,56,12,0
"It just sorta felt right, I don’t know.",1.1764705882352942,0.055200076943347304,68,58,8,2
I don’t think that driving away the neighbors is going bring the rent down,1.1764705882352942,0.055200076943347304,68,58,8,2
"I’m pretty skeptical this will be the next Peloton, but who even knows anymore.",1.1764705882352942,0.051069236647683494,68,57,10,1
"Go ahead,pick your weapon of choice.",1.1758241758241759,0.04580951853732888,91,77,12,2
It worked. I don’t feel like bowling.,1.1758241758241759,0.04580951853732888,91,77,12,2
"I am guessing, this exactly wasn't your idea for the ""Bowling for a Pin Singles Night""?",1.1758241758241759,0.04580951853732888,91,77,12,2
Get your mind out of the gutter.,1.1756756756756757,0.052194025100977155,74,63,9,2
They just appeared. I must be some kind of Pin-Ball  Wizard.,1.1756756756756757,0.04453930581352029,74,61,13,0
No one said breaking the juggling record was going to be easy.,1.1756756756756757,0.052194025100977155,74,63,9,2
"Great amenities, lovely view, but seems there's a few strikes against it.",1.1756756756756757,0.04851786278573962,74,62,11,1
"Grandpa was a pinsetter""",1.1756756756756757,0.0556277763638545,74,64,7,3
"Apparently they no longer identify as balls and pins, which pretty much screws up the game.",1.1756756756756757,0.052194025100977155,74,63,9,2
I feel we're missing something.,1.1756756756756757,0.0556277763638545,74,64,7,3
You can hear a pin drop,1.1756756756756757,0.0556277763638545,74,64,7,3
"OK, then, how about a size 7 men's shoe?",1.1756756756756757,0.052194025100977155,74,63,9,2
Is this what you meant when you said I'd be bowled over?,1.1756756756756757,0.0556277763638545,74,64,7,3
You said you favored the strike.,1.1756756756756757,0.04851786278573962,74,62,11,1
"Good news, the bowling alley has reopened.",1.1756756756756757,0.052194025100977155,74,63,9,2
I told you they wouldn’t work as chess pieces,1.1756756756756757,0.04851786278573962,74,62,11,1
"So do you think we have too many balls, or not enough pins?",1.1756756756756757,0.04453930581352029,74,61,13,0
"What a relief, no more 'gutter balls'!",1.1756756756756757,0.04851786278573962,74,62,11,1
How is this *not* CrossFit?,1.1756756756756757,0.058861555790962444,74,65,5,4
"Ma’am I wanted “bold” furniture, not bowled furniture.",1.1756756756756757,0.052194025100977155,74,63,9,2
"I know how much you hate the game, so I got these for you to throw off the balcony.",1.1754385964912282,0.06680502724442022,57,50,4,3
"Face it, your apartment is just too small to practice in.",1.1754385964912282,0.0566549100524176,57,48,8,1
I thought lifting all these balls would do more for my biceps,1.1754385964912282,0.0566549100524176,57,48,8,1
‘They needed a new home since they are closing the bowling alley’,1.1754385964912282,0.0566549100524176,57,48,8,1
"Spare me the details Jon, lets just strike a deal here and call it a day. I get the house and kids…you can have the pins and the balls",1.1754385964912282,0.06680502724442022,57,50,4,3
"When you have a bowling ball, everything is a pin.",1.175257731958763,0.04636788236602624,97,83,11,3
Hi,1.175,0.05269628766978955,80,69,8,3
We have to get outside.,1.175,0.04960285312333035,80,68,10,2
I'm just saying it's easier with duck pins.,1.175,0.04630321092291712,80,67,12,1
"No, I wasn't aware that having a juggler upstairs was a living hell.",1.175,0.05269628766978955,80,69,8,3
"I have to be honest Gayle, I'm starting to rethink the decision to implement a weekly game night.",1.175,0.0427496391279461,80,66,14,0
“Why are we always left with clean up?”,1.175,0.04960285312333035,80,68,10,2
Boss said to put a pin in it. Balls were my idea.,1.175,0.04630321092291712,80,67,12,1
Don't tell me you forgot the shoes!,1.175,0.05269628766978955,80,69,8,3
Who needs an alley when we've got each other?,1.175,0.04960285312333035,80,68,10,2
"Hey sticky fingers, what you been  up too?",1.175,0.04960285312333035,80,68,10,2
This is not what I meant but picking up a spare,1.175,0.04960285312333035,80,68,10,2
Working from home has taken a weird turn,1.175,0.0427496391279461,80,66,14,0
Are you sure they are going to let this porno on TicTok,1.1746031746031746,0.04821271851032602,63,52,11,0
"Downstairs neighbors again - They say 'No, Duckpin won't be better.'",1.1746031746031746,0.053258792666124335,63,53,9,1
The neighbors called to complain about the noise.  Maybe we should try and learn to juggle with something lighter.,1.1746031746031746,0.04821271851032602,63,52,11,0
We can use the bedroom for shoe rental.,1.1746031746031746,0.057866499516996066,63,54,7,2
I guess the floor is level after all.,1.1746031746031746,0.057866499516996066,63,54,7,2
So this is how we're going to prevent a strike?,1.1746031746031746,0.053258792666124335,63,53,9,1
It worked for the Dude?,1.1746031746031746,0.057866499516996066,63,54,7,2
The previous downstairs tenant was OK as long as I stopped at midnight!,1.1746031746031746,0.04821271851032602,63,52,11,0
It was either this or pins and needles.....,1.1746031746031746,0.04821271851032602,63,52,11,0
I’m taking up bowling. I hope you’ll be supportive.,1.1746031746031746,0.053258792666124335,63,53,9,1
"I know you like balls, but PINS, NOW?",1.1746031746031746,0.053258792666124335,63,53,9,1
I think we're out of our league here,1.1746031746031746,0.06213344136974703,63,55,5,3
The airport manager filed a noise complaint against us.,1.1746031746031746,0.057866499516996066,63,54,7,2
Apparently the lanes were repurposed into furniture.,1.1746031746031746,0.057866499516996066,63,54,7,2
Apparently I'm not very good at knocking them down.,1.1746031746031746,0.053258792666124335,63,53,9,1
"Look, it's not my fault that pins come in packs of 10 and balls come in packs of 12.",1.1746031746031746,0.057866499516996066,63,54,7,2
"I don't care if you have two balls, I'm still going to pin you!",1.1744186046511629,0.04734210697735226,86,73,11,2
You can stay in the spare bedroom.,1.1744186046511629,0.04435850856191577,86,72,13,1
I stand by my opinion!,1.1744186046511629,0.04734210697735226,86,73,11,2
My mother was right.,1.1744186046511629,0.04734210697735226,86,73,11,2
"We’ve given birth to 16 children, wait, 18. You take the buttons I’ll take the bolts",1.1744186046511629,0.04734210697735226,86,73,11,2
I holeheartedly believe in you,1.1744186046511629,0.04734210697735226,86,73,11,2
"This is why we don’t have people over, they’ll all think we live in the gutter.",1.1744186046511629,0.050148508494994894,86,74,9,3
This stuff was just sitting in the alley.,1.173913043478261,0.058236816044683844,69,60,6,3
"I’m so sorry, but I did pay extra for soundproofing.",1.173913043478261,0.05038860807773185,69,58,10,1
This was more fun in virtual reality.,1.173913043478261,0.05038860807773185,69,58,10,1
This isn't going to be a clean split.,1.173913043478261,0.054454286181317306,69,59,8,2
I'm beginning to suspect we may have pushed the marriage counselor's allegory a bit too far.,1.173913043478261,0.054454286181317306,69,59,8,2
I can't wait to get a longer apartment,1.173913043478261,0.054454286181317306,69,59,8,2
This isn't what I meant by 'I want to split',1.173913043478261,0.05038860807773185,69,58,10,1
You're mistaken; I wanted to juggle the pins.,1.173913043478261,0.054454286181317306,69,59,8,2
we’ll put a pin in that?,1.173913043478261,0.04791071000168168,92,79,10,3
Don’t pin this idea on me.,1.173913043478261,0.054454286181317306,69,59,8,2
I take it that this doesn’t bowl you over.,1.173913043478261,0.054454286181317306,69,59,8,2
It's win-win.  He loses his deposit and we learn a new sport.,1.173913043478261,0.045964707814862935,69,57,12,0
"Okay, but shouldn't I start my juggling career with something a little easier?",1.173913043478261,0.054454286181317306,69,59,8,2
"Don't 'Oh Henry' me. 
I wasn't the only one in this relationship that sold their
prized collection in order to buy the other the perfect gift.",1.173913043478261,0.058236816044683844,69,60,6,3
Sorry if you were expecting something else when I said I liked skittles. I like the balls too.,1.173913043478261,0.045964707814862935,69,57,12,0
"You’re right, we shouldn’t have bought all of this during lockdown",1.173913043478261,0.058236816044683844,69,60,6,3
"Man, that Horoscope was dead on.",1.173913043478261,0.05038860807773185,69,58,10,1
I thought we needed one ball per pin,1.173913043478261,0.054454286181317306,69,59,8,2
"Balls to that idea, I’m getting my ducks in a row",1.173913043478261,0.05038860807773185,69,58,10,1
I give up; a pin beats three holes anytime.,1.1734693877551021,0.04592713290344636,98,84,11,3
We either need to join the circus or Jugglers Anonymous.,1.1733333333333333,0.04792386354100322,75,63,11,1
It's not what I meant when I said let's go see 'Nightmare Alley.,1.1733333333333333,0.05154664932909857,75,64,9,2
Maybe we could invite them up for cocktails and a few frames.,1.1733333333333333,0.04792386354100322,75,63,11,1
To understand the present you have to deconstruct the past.,1.1733333333333333,0.05154664932909857,75,64,9,2
There's something strange about this day where are the devil eggs to sit on,1.1733333333333333,0.04792386354100322,75,63,11,1
I mostly play spares,1.1733333333333333,0.04792386354100322,75,63,11,1
I told you these wouldn't sell on Etsy,1.1733333333333333,0.05493102417957832,75,65,7,3
I know I'm not a sports guy but when I spotted a bargain on this golf equipment I jumped on it.,1.1733333333333333,0.04792386354100322,75,63,11,1
I ordered a pin-ball machine,1.1733333333333333,0.05493102417957832,75,65,7,3
I see you and raise you one.,1.1733333333333333,0.05154664932909857,75,64,9,2
Not what I had in mind for the spare room.,1.1733333333333333,0.05154664932909857,75,64,9,2
I’ve got the balls,1.1733333333333333,0.05493102417957832,75,65,7,3
“How do you win synchronized bowling?”,1.1733333333333333,0.05154664932909857,75,64,9,2
"No. 1 of course is the no-fly zone, but these might be helpful too",1.1733333333333333,0.04792386354100322,75,63,11,1
Of course all the guys practice at home.”,1.1733333333333333,0.044003821837839685,75,62,13,0
I don't understand. Pet rocks were popular and this is a niche.,1.1733333333333333,0.04792386354100322,75,63,11,1
They say just have tiny little wins every day,1.1733333333333333,0.05154664932909857,75,64,9,2
It was love at first sight when Lewis and Lauren met at the Jugglers Anonymous.,1.1733333333333333,0.05154664932909857,75,64,9,2
"Hey, it's not like we're living in the gutter.",1.1728395061728396,0.05208647681414562,81,70,8,3
I guess everyone had the same idea.,1.1728395061728396,0.04577900300676331,81,68,12,1
That's it. I'm going on strike.,1.1728395061728396,0.054969473730600425,81,71,6,4
Are we bowling yet?,1.1728395061728396,0.04903426446477898,81,69,10,2
This open bowling isn’t what I expected- but at least we get to use the house balls,1.1728395061728396,0.04227381152657757,81,67,14,0
Do you think we could persuade Goodwill to carry this stuff?,1.1728395061728396,0.04227381152657757,81,67,14,0
"Are you sure about that Feng Shui stuff? Somehow, I don't feel the energy flowing.",1.1728395061728396,0.05208647681414562,81,70,8,3
Very cool! Now would you like to see my Bowldle score?,1.1724137931034482,0.06093608879319741,58,50,6,2
What? This is legitimate political discourse.,1.1724137931034482,0.05575164786673556,58,49,8,1
Do you think the Irish Dancers up stairs will mind?,1.1724137931034482,0.05575164786673556,58,49,8,1
I didn’t know you were from Massachusetts.,1.1724137931034482,0.04960926328218621,87,75,9,3
Let me alley your fears.,1.1724137931034482,0.04960926328218621,87,75,9,3
Sooo... where should we put the couch?,1.1724137931034482,0.05575164786673556,58,49,8,1
We don't have the budget for new baseball equipment this year but the bowling team is helping us out,1.1724137931034482,0.050032844835173236,58,48,10,0
"This is not what I meant when I said you’re right up my alley.”
…”Oh spare me.",1.1724137931034482,0.06093608879319741,58,50,6,2
Wait until you see the shoe closet.,1.171875,0.05249096435850378,64,54,9,1
"This is not my idea of bowling.  Could
 we do this in the hall.",1.171875,0.05249096435850378,64,54,9,1
Co-op League Night is really catching on.,1.171875,0.04753177456453702,64,53,11,0
Spare me your threat of a housework strike.,1.171875,0.0570204619879343,64,55,7,2
"The folks in the apartment below us
are complaining.",1.171875,0.04753177456453702,64,53,11,0
It’s not what you think.,1.171875,0.0570204619879343,64,55,7,2
At this time anything is better then having an 'elephant' in the room,1.171875,0.0570204619879343,64,55,7,2
I think we should be safe from prank phone calls here.,1.171875,0.04753177456453702,64,53,11,0
Maybe the old rules were better after all,1.171875,0.0570204619879343,64,55,7,2
When I said I wanted a place with a spare room this wasn’t exactly what I meant,1.171875,0.05249096435850378,64,54,9,1
"I also thought this was a singles night AT a bowling alley, not FOR one.",1.171875,0.05249096435850378,64,54,9,1
I think this is the start of a beautiful friendship.,1.171875,0.0570204619879343,64,55,7,2
This is the last time we hire an interior decorator from behind a bowling alley.   #🎳,1.171875,0.05249096435850378,64,54,9,1
"Well, i know it’s only our third date but i must say you’ve completely bowled me over!",1.171875,0.0570204619879343,64,55,7,2
"Trust me, we're going to be famous!",1.171875,0.0570204619879343,64,55,7,2
Safe word…nachos?!,1.171875,0.0570204619879343,64,55,7,2
...then you add up the pins you were able to knock down. So really it's the same as normal bowling. Do you want to try a round or should I explain again?,1.171875,0.05249096435850378,64,54,9,1
The ratio is 1:1 to finally create a game of equal opportunity,1.171875,0.05249096435850378,64,54,9,1
But you said three strikes and you’re out.,1.1714285714285715,0.05372820400267856,70,60,8,2
"I said, ""Where are my ROLLING pins?""",1.1714285714285715,0.0497256596779289,70,59,10,1
"Before we we go any further, I think we should rent some shoes.",1.1714285714285715,0.0497256596779289,70,59,10,1
I knew this apartment was right up your alley.,1.1714285714285715,0.057452576794271674,70,61,6,3
But it all was a Daily Deal on Amazon!,1.1714285714285715,0.05372820400267856,70,60,8,2
"I just thought of a great first line to a blues song: ""You like to roll 'em and I like to knock 'em down!""",1.1714285714285715,0.0497256596779289,70,59,10,1
Baseball season—help me practice calling balls and strikes.,1.1714285714285715,0.05372820400267856,70,60,8,2
It's extreme Whac-A-Mole!,1.1714285714285715,0.04537138476459545,70,58,12,0
Next time let's get duck pins.,1.1714285714285715,0.0497256596779289,70,59,10,1
It’s nice to finally have an apartment on the top floor.,1.1714285714285715,0.04537138476459545,70,58,12,0
How much longer is this redecorating going to take?,1.1714285714285715,0.04537138476459545,70,58,12,0
"You were right, advertising the downstairs apartment as a haunted Airbnb has been great for us financially and creatively.",1.1714285714285715,0.057452576794271674,70,61,6,3
"When I said I wanted to play pinball on our date, this wasn’t what I had in mind.",1.1714285714285715,0.0497256596779289,70,59,10,1
They fired us to turn our office into bowling storage,1.1714285714285715,0.0497256596779289,70,59,10,1
"Now, let's try one more time",1.1714285714285715,0.05372820400267856,70,60,8,2
"Now that the bowling alleys are open again, we can move these into the basement",1.1714285714285715,0.0497256596779289,70,59,10,1
"I am starting to think ""Do-It-Yourself bowling is not up our alley...",1.1710526315789473,0.050914988985724385,76,65,9,2
"Don't worry, this I can pick up.",1.1710526315789473,0.05425138981075869,76,66,7,3
I thought that we were playing go.,1.1710526315789473,0.050914988985724385,76,65,9,2
Why don't we just get an alarm system installed?,1.1710526315789473,0.057394167729668745,76,67,5,4
"But Honey, with only nine pins it's not real bowling.",1.1710526315789473,0.050914988985724385,76,65,9,2
Balls?  I’ll show you balls!!,1.1710526315789473,0.047344048310574156,76,64,11,1
"They thought their love of bowling could keep them together but, sadly that fateful morning, at 7:10, split.",1.1710526315789473,0.047344048310574156,76,64,11,1
Honey I'm in the club.,1.170731707317073,0.05433587440586295,82,72,6,4
"If this is my anniversary present, I'm going to hit you with this pin!",1.170731707317073,0.04847843853658083,82,70,10,2
It's the best workout ever! I'm totally ripped!,1.1704545454545454,0.04634383476994134,88,75,11,2
The super nixed the flaming torches.,1.1704545454545454,0.04908140219102683,88,76,9,3
I know the dating site said we were both into bowling but I pictured different.,1.1704545454545454,0.04634383476994134,88,75,11,2
Our realtor DID say this apartment was a lucky strike...,1.1704545454545454,0.04634383476994134,88,75,11,2
You ain't no match!,1.1702127659574468,0.046958019171166314,94,81,10,3
I know you're crafty..but a chandelier?,1.1702127659574468,0.04445531425009222,94,80,12,2
"We both know your Super Bowl dreams were unrealistic, so I settled for the next best thing.",1.169811320754717,0.05206789873629057,53,44,9,0
Get your mind out of the gutter. Spare me the details of how this happened.,1.1694915254237288,0.054876421247483355,59,50,8,1
"It's like having a pool. Once the neighbors figure out we have a lane, they'll all want to come over and play, no?",1.1694915254237288,0.054876421247483355,59,50,8,1
They did say to bring our favorite party game.,1.1694915254237288,0.054876421247483355,59,50,8,1
But knocking down my balls isn't the object of the game.,1.1694915254237288,0.05996561635533429,59,51,6,2
The floor test went so well let's skip testing the windows.,1.1694915254237288,0.054876421247483355,59,50,8,1
"When I said we needed a spare room, this isn't what I had in mind.",1.1694915254237288,0.05996561635533429,59,51,6,2
I feel pinned.,1.1694915254237288,0.06465546133791814,59,52,4,3
How many times do I have to ask you to be respectful of my vices and stop kink shaming me?,1.1694915254237288,0.05996561635533429,59,51,6,2
You've got some balls coming in here like that,1.1694915254237288,0.054876421247483355,59,50,8,1
'I said I needed a new rolling pin.',1.1694915254237288,0.05996561635533429,59,51,6,2
"It’s been so long, I forget what goes in what hole",1.1694915254237288,0.054876421247483355,59,50,8,1
"No, I can’t help you clean up. My fingers are stuck.",1.1692307692307693,0.06032456592830045,65,57,5,3
Watch out for the window,1.1692307692307693,0.05619861229308635,65,56,7,2
I don't think this is how to play pinball.,1.1692307692307693,0.05619861229308635,65,56,7,2
"Oh, and that pin in your hand is NOT a metaphor?",1.1692307692307693,0.0517447078733604,65,55,9,1
Being a sore loser is not an excuse for petty larceny!,1.1692307692307693,0.05619861229308635,65,56,7,2
I think we should consider split custody,1.1692307692307693,0.06032456592830045,65,57,5,3
We should go over the rules!,1.1692307692307693,0.0517447078733604,65,55,9,1
"Spare me, I’ve already given you my pin.",1.1692307692307693,0.05619861229308635,65,56,7,2
"Listen honey, split happens.”
“Spare me your excuses.",1.1692307692307693,0.06032456592830045,65,57,5,3
Is this 'Intro to repetitive activities'?,1.1690140845070423,0.05302106749939831,71,61,8,2
But I thought you said we needed spares to win?,1.1690140845070423,0.05302106749939831,71,61,8,2
"This is the best workout: I lift the 10 pound balls, and you lift the 1 pound pins.",1.1690140845070423,0.049079722002617565,71,60,10,1
Wait until we hear that broom handle again.,1.1690140845070423,0.05302106749939831,71,61,8,2
You've got to stop taking your work home with you.,1.1690140845070423,0.049079722002617565,71,60,10,1
Any pinterest in this apartment?,1.1690140845070423,0.049079722002617565,71,60,10,1
They had a BOGO sale.,1.1690140845070423,0.05668904731689607,71,62,6,3
At least we've moved out of the gutter.,1.1690140845070423,0.049079722002617565,71,60,10,1
"Well honey, how else is a pro bowler supposed to work from home?",1.1690140845070423,0.05302106749939831,71,61,8,2
I'm just glad they're finally potty-trained,1.1690140845070423,0.049079722002617565,71,60,10,1
That’s a lot of aggression for our downstairs neighbor,1.1690140845070423,0.05668904731689607,71,62,6,3
Didn't you say this is the spare bedroom?,1.1690140845070423,0.044792908199096586,71,59,12,0
I thought you wanted me to grow a pair!,1.1690140845070423,0.044792908199096586,71,59,12,0
"It's not like dating, you only need one bowling ball for 10 pins.",1.1690140845070423,0.05302106749939831,71,61,8,2
"Oh, you wanted to play Pinball.",1.1690140845070423,0.044792908199096586,71,59,12,0
"I don't like wearing those shoes at the bowling alley either, but this is ridiculous.",1.1690140845070423,0.05302106749939831,71,61,8,2
"How 'bout in the hallway, dear ?",1.1690140845070423,0.060133705794827005,71,63,4,4
No more bowling alone!,1.1688311688311688,0.05358825519207449,77,67,7,3
Stop calling me a pinhead.,1.1688311688311688,0.04677792316055112,77,65,11,1
Maybe working from home wasn't such a good idea after all.,1.1688311688311688,0.04677792316055112,77,65,11,1
"Oh sorry, I didn't know you could hear me in the apartment below.",1.1688311688311688,0.04296988009706553,77,64,13,0
"If you’re tired of chess, I have cheese wheel checkers.",1.1688311688311688,0.04677792316055112,77,65,11,1
Is there a map for this.,1.1688311688311688,0.04677792316055112,77,65,11,1
Would you also like to see my collection of vintage bowling shirts?,1.1688311688311688,0.05029848501568076,77,66,9,2
We're bowled over. Where did we go awry?,1.1688311688311688,0.04296988009706553,77,64,13,0
Not this strike.,1.1688311688311688,0.05029848501568076,77,66,9,2
"Most bowlers collect trophies, you collect the ones that got away!",1.1688311688311688,0.04296988009706553,77,64,13,0
This’ll make the downstairs think.,1.1688311688311688,0.05358825519207449,77,67,7,3
It seems like they really went on strike this time. .,1.1688311688311688,0.04677792316055112,77,65,11,1
"The sex shop was closed, I had to improvise.",1.1688311688311688,0.05029848501568076,77,66,9,2
I’m trying to manifest hardwood floors,1.1688311688311688,0.04296988009706553,77,64,13,0
You really expect me to believe you never wanted to split before now?,1.1686746987951808,0.05090793955616516,83,72,8,3
You are correct. We should be playing this in the lanes.,1.1686746987951808,0.04793495540400362,83,71,10,2
I'm game if you are,1.1686746987951808,0.05090793955616516,83,72,8,3
This might not  be right up our alley.,1.1686746987951808,0.04793495540400362,83,71,10,2
Sorry this whole work-from-home idea didn't work out for you,1.1686746987951808,0.044764959391397484,83,70,12,1
The new Bowlaton came.,1.1686746987951808,0.05371663308626588,83,73,6,4
"Violence won't help, babe. Put down the pin.",1.1666666666666667,0.05101913957479684,66,56,9,1
And I still can't find one that fits my hand.,1.1666666666666667,0.04969660420745535,78,67,9,2
"If they can hold rock concert upstairs, then we can do this.",1.1666666666666667,0.048450158311150925,72,61,10,1
..and each month we ship them to our subscribers.,1.1666666666666667,0.059025354442335316,60,52,6,2
We’ve got no room to spare!,1.1666666666666667,0.055399937447194535,66,57,7,2
"I'm telling you ...
the baby had my phone and 
somehow got on E-Bay.....",1.1666666666666667,0.05101913957479684,66,56,9,1
This is what happens when you give them the vote.,1.1666666666666667,0.04604218762109019,96,83,10,3
How did you find out I'd been lying about being at bowling league every Friday night?,1.1666666666666667,0.05101913957479684,66,56,9,1
I specifically asked for an assortment of ball point pens!,1.1666666666666667,0.05101913957479684,66,56,9,1
I think it is time to stop teleworking.,1.1666666666666667,0.04740341308792834,84,72,10,2
But you said you wanted to live on a nicer lane...,1.1666666666666667,0.046225016352102404,66,55,11,0
"We may be broke, but at least we're not in the gutter.",1.1666666666666667,0.04422874103618961,72,60,12,0
Don't hit the balls.,1.1666666666666667,0.06325783747136791,66,59,3,4
What the hell! I ordered ‘holding bins for the walls’!,1.1666666666666667,0.05594542388644594,72,63,6,3
"Well, at least now no one can say we struck out.",1.1666666666666667,0.048450158311150925,72,61,10,1
Perhaps you're right and bowling might be easier than juggling.,1.1666666666666667,0.046225016352102404,66,55,11,0
"It precludes a strike, but even so I like our chances.",1.1666666666666667,0.04422874103618961,72,60,12,0
No wonder the decorating in this place generated so much buzz on Pinterest.,1.1666666666666667,0.05101913957479684,66,56,9,1
Nothing I read about pinball said it took so much space.,1.1666666666666667,0.04969660420745535,78,67,9,2
