caption,mean,precision,votes,not_funny,somewhat_funny,funny
"I love the new job, but I'm just so used to taking work home with me...",1.2337662337662338,0.048547261524614,77,59,18,0
"Stay in your own lane, Barb.",1.233644859813084,0.047097821290308706,107,85,19,3
I'm not sure we got the ratio right.,1.2333333333333334,0.054851974222946666,90,73,13,4
We need a longer apartment.,1.2333333333333334,0.054851974222946666,90,73,13,4
We are on the way to breaking our lease.,1.2333333333333334,0.054851974222946666,90,73,13,4
Guess we should have thought about it before we bought this place.,1.2333333333333334,0.05252667118728806,90,72,15,3
I still don't understand. Can you explain again what a 7-10 split mortgage is?,1.2333333333333334,0.05009354545128693,90,71,17,2
"Sorry love, I didn't think this through.",1.2333333333333334,0.05252667118728806,90,72,15,3
"Just once, I want to hit something",1.2333333333333334,0.05252667118728806,90,72,15,3
It's either a bigger apartment or we take up bridge instead.,1.233009708737864,0.04819980997808794,103,82,18,3
It seems the previous tenants WERE bowling in their living room!,1.2328767123287672,0.056940474490136644,73,58,13,2
Okay it's settled.  You keep your pins and I keep my balls.,1.2328767123287672,0.06327126237694529,73,60,9,4
"Honey, I can't play with just nine pins. Honey? Honey?",1.2328767123287672,0.053494860793881195,73,57,15,1
The last one did hurt.,1.2328767123287672,0.0601891613080551,73,59,11,3
"On 2nd thought, securing the sliding door with a broomstick seems like the better choice.",1.2328767123287672,0.053494860793881195,73,57,15,1
"I thought you said I love playing with your balls,so I ordered more.",1.2328767123287672,0.06327126237694529,73,60,9,4
The indoor putting green was probably a better choice.,1.2328767123287672,0.04981147084308545,73,56,17,0
"No, the kleptomania itself is not really the problem...",1.2328767123287672,0.0601891613080551,73,59,11,3
My safe word is Strike.,1.2328767123287672,0.06327126237694529,73,60,9,4
Just stick with juggling the pins.,1.2325581395348837,0.05144802965162532,86,68,16,2
"I said I wanted to play ""Pinball!""",1.2325581395348837,0.054041628086615126,86,69,14,3
You are the yin yo my yang,1.2325581395348837,0.054041628086615126,86,69,14,3
i told them to turn the music down.,1.2325581395348837,0.05144802965162532,86,68,16,2
. I don't think this is how you play.,1.2325581395348837,0.048716546920086694,86,67,18,1
I thought tonight was your night to do the dishes,1.2325581395348837,0.06116609354785182,86,72,8,6
"Scoring was confusing enough, multiplying is a nightmare.",1.2323232323232323,0.04937933227205968,99,79,17,3
I found them in the alley out back.,1.2318840579710144,0.06575979804152395,69,57,8,4
The landlord says he has an opening in the basement.,1.2318840579710144,0.058922288817144,69,55,12,2
"It's like an employee perk, Man. Like you get free pens from the bank.",1.2317073170731707,0.058328572493308625,82,67,11,4
People who live in glass houses should not bowl.,1.2317073170731707,0.055687595089524436,82,66,13,3
I didn't realize I selected the 'subscribe and save' option...,1.2317073170731707,0.055687595089524436,82,66,13,3
Looks like we ended up with way too much time to spare.,1.2317073170731707,0.05291497070397462,82,65,15,2
"The guy downstairs is SO ornery, and I can't understand why.",1.2317073170731707,0.055687595089524436,82,66,13,3
Right…happy hour.,1.2317073170731707,0.05291497070397462,82,65,15,2
Where did all our furniture go?,1.2317073170731707,0.058328572493308625,82,67,11,4
I told you it was more than my mind that was in the gutter.,1.2317073170731707,0.05291497070397462,82,65,15,2
"Read the instruction again, Brad.",1.231578947368421,0.05689351082709109,95,79,10,6
Not what was meant when I said I wanted to play pinball,1.231578947368421,0.052810446341281445,95,77,14,4
I wish the alley wasn't ten floors down.,1.231578947368421,0.05064562248636977,95,76,16,3
Is it weird that this all came in one set?,1.2307692307692308,0.0545104355767976,78,62,14,2
$2000 on a new carpet and the still complain about the noise?,1.2307692307692308,0.04960632092961228,91,72,17,2
It was all on sale so why not?,1.2307692307692308,0.060310763987640445,78,64,10,4
They say it`s the distraction room.,1.2307692307692308,0.057483805717545654,78,63,12,3
"Sorry,
I think we have to sell the bowling alley.",1.2307692307692308,0.051365233901656364,78,61,16,1
"Hi, is this the ballroom?",1.2307692307692308,0.06493055006205434,65,53,9,3
"One ball , one pin .It's the new equal opportunity mandate .",1.2307692307692308,0.0545104355767976,78,62,14,2
Just showing those guys down in 5B what REAL noise is.,1.2307692307692308,0.0545104355767976,78,62,14,2
Loud music from the neighbours. We'll show them what loud is!,1.2307692307692308,0.057483805717545654,78,63,12,3
"This is the newest exercise regimen. We have 8, 10, 12 and 15 pound balls, unless you prefer a pin. Those are only 5 pounds.",1.2307692307692308,0.0545104355767976,78,62,14,2
It worked better in the alley.,1.2307692307692308,0.057483805717545654,78,63,12,3
Tell them I'll stop when their baby stops.,1.2307692307692308,0.05651006820711174,91,75,11,5
"The next time I wish for a pinball machine, I’ll have to say it out loud.",1.2307692307692308,0.0543064228666571,91,74,13,4
I don't think this is how you play checkers.,1.2307692307692308,0.0545104355767976,78,62,14,2
"Yeah, so mine look more like this.",1.2307692307692308,0.06853280646617484,65,54,7,4
I’m starting to feel like the hallway was a missed opportunity.,1.2307692307692308,0.05704768066996663,65,51,13,1
"According to the Food Channel, there are actual tools speciffacly made to tenderize meat!",1.2307692307692308,0.04960632092961228,91,72,17,2
I’m tired of bowling alone.,1.2307692307692308,0.057483805717545654,78,63,12,3
Why do we have more bowling balls than pins?,1.2307692307692308,0.051365233901656364,78,61,16,1
I started out with two and they just kept multiplying. Their breeding potential is striking.,1.2307692307692308,0.05200949259867792,91,73,15,3
This is not what I meant when I said we needed new bowls.,1.2307692307692308,0.0545104355767976,78,62,14,2
You can see now why this martial art is so rarely practiced.,1.2307692307692308,0.060310763987640445,78,64,10,4
"Neighbor downstairs says if we're going to continue bowling we need to get an automatic ball return.


Steven Assael 516-316-5161",1.2307692307692308,0.06493055006205434,65,53,9,3
I never thought bowling at home was much fun.,1.2307692307692308,0.0543064228666571,91,74,13,4
Split happens.,1.2307692307692308,0.0543064228666571,91,74,13,4
"If they can find a way to live together, so can we.",1.2307692307692308,0.057483805717545654,78,63,12,3
I needed something more challenging.,1.2307692307692308,0.05651006820711174,91,75,11,5
When we married you said you had no hidden secrets. Your self-storage says otherwise.,1.2307692307692308,0.05704768066996663,65,51,13,1
Can't we just get an Oculus instead?,1.2300884955752212,0.043562968573791494,113,89,22,2
"Stay in your lane,"" they said.",1.23,0.052905480802936666,100,82,13,5
"If the White House can do it for the President, we can do it for our staff.  Plus we can charge for shoe rental.",1.23,0.04893822120745191,100,80,17,3
This isn't as fun without the beer and the nachos.,1.23,0.05096047190685833,100,81,15,4
I misplaced the directions.,1.23,0.05478147589295219,100,83,11,6
"Bernice, you just bowl me over!",1.23,0.052905480802936666,100,82,13,5
It still seems working class.,1.2298850574712643,0.055926856386234985,87,71,12,4
I call my installation 'yin/yang - pin/bang.',1.2298850574712643,0.053483689652870973,87,70,14,3
Next time let’s do rock/paper/scissors.,1.2298850574712643,0.05092344109074604,87,69,16,2
I really don't think we can reframe this game to resemble Wordle and cash in on the popularity.,1.2298850574712643,0.055926856386234985,87,71,12,4
I know! The Badminton Set cost too much!,1.2298850574712643,0.04822746775604901,87,68,18,1
"Oh, spare me the drama of striking me with that pin.",1.2298850574712643,0.055926856386234985,87,71,12,4
Which is why we're paying extra for the Spare bedroom!,1.2298850574712643,0.053483689652870973,87,70,14,3
Ball to pin ratio is way off !,1.2298850574712643,0.055926856386234985,87,71,12,4
They had it all.,1.2298850574712643,0.055926856386234985,87,71,12,4
You're right. This sucks.,1.2297297297297298,0.05945356909331092,74,60,11,3
Maybe we should have included places other than the bowling alley on our registry,1.2297297297297298,0.05286076412654233,74,58,15,1
I don't want to go bowling. I want to bowl alone.,1.2297297297297298,0.05286076412654233,74,58,15,1
This is wrong up my alley.,1.2297297297297298,0.05945356909331092,74,60,11,3
It’s still no match for the unit upstairs”,1.2297297297297298,0.05625383214490832,74,59,13,2
Hey! My eyes are up here!,1.2297297297297298,0.05625383214490832,74,59,13,2
I was on a roll.,1.2295081967213115,0.05910739795842607,61,48,12,1
I think we should sublet the spare room,1.2291666666666667,0.05017331074496788,96,77,16,3
"When I said I wanted 'a split', this isn't what I meant",1.2291666666666667,0.04559347124186794,96,75,20,1
Let’s stop playing games.,1.2291666666666667,0.0543687189690835,96,79,12,5
The downstairs neighbors called again. Apparently they are not fans of performance art.,1.2289156626506024,0.052348044099806715,83,66,15,2
I think we've misunderstood how bowling works.,1.2289156626506024,0.0494616958949545,83,65,17,1
Looks like there is no room to spare.,1.2289156626506024,0.05768911891870084,83,68,11,4
I hope our new game doesn't disturb the neighbors too much!,1.2289156626506024,0.05508335575603268,83,67,13,3
We should move this stuff to the alley,1.2289156626506024,0.05768911891870084,83,68,11,4
Go ahead - Strike me! I got balls!,1.2289156626506024,0.05508335575603268,83,67,13,3
Guess we’re ready to play pin ball,1.2289156626506024,0.060182163486255276,83,69,9,5
I feel like I’m walking on pins and bowling balls around you.,1.2285714285714286,0.05816884316617732,70,56,12,2
"Well, what did you want to put in the spare room?",1.2285714285714286,0.06489816380443914,70,58,8,4
"I promise, babe, one more proof-of-purchase and we'll be able to pay off our mortgage.",1.2285714285714286,0.05816884316617732,70,56,12,2
Now that they’ve moved out what’ll we do with these?,1.2285714285714286,0.047380354147934275,105,84,18,3
I think we are missing something here.,1.2285714285714286,0.054493445847579626,70,55,14,1
"Trust me I have plenty of ""spares""...",1.2285714285714286,0.054493445847579626,70,55,14,1
"You know, for me, it’s always been about the shoes.",1.2285714285714286,0.05816884316617732,70,56,12,2
Now we HODL until the Bowling Supplies market heats up,1.2285714285714286,0.05816884316617732,70,56,12,2
I guess this is why you need a registry...,1.2282608695652173,0.05150218562468723,92,74,15,3
I’m starting to regret buying off an alley.,1.2282608695652173,0.046633593445508804,92,72,19,1
"This is your second strike, I won’t spare you again!",1.2282608695652173,0.05150218562468723,92,74,15,3
Don’t!… Just don’t. This is no time for puns,1.2282608695652173,0.04912823608557884,92,73,17,2
People with floor windows shouldn't throw bowling balls.,1.2278481012658229,0.05389522782353846,79,63,14,2
"Let’s not, OK?",1.2278481012658229,0.05682662691885048,79,64,12,3
I'm a PinBall Wizard.,1.2278481012658229,0.06227684494754404,79,66,8,5
"Well, we did tell the realtor we wanted a spare room.",1.2278481012658229,0.05389522782353846,79,63,14,2
Klepto what!,1.2278481012658229,0.05682662691885048,79,64,12,3
I'm thinking hardwood floors.,1.2278481012658229,0.050794937122985044,79,62,16,1
"Hon, you're standing in the gutter.",1.2278481012658229,0.05389522782353846,79,63,14,2
Seems our downstairs neighbor is not a bowling fan.,1.2278481012658229,0.050794937122985044,79,62,16,1
"Some people perfected their sourdough during Covid, but how many mastered juggling reactive resin, low-mass bowling balls?",1.2278481012658229,0.059614054314375664,79,65,10,4
Hi we’re the fucking neighbors who live above Michael and Kelsey!,1.2278481012658229,0.059614054314375664,79,65,10,4
Our act still needs some practice.,1.2278481012658229,0.05682662691885048,79,64,12,3
"But you cleary said if it was in the alley, I could bring it home.",1.2278481012658229,0.05389522782353846,79,63,14,2
So this is where the ball return leads.,1.2272727272727273,0.05293692330821457,88,71,14,3
I think the original ratio of balls to pins worked better.,1.2272727272727273,0.060284695763812665,66,53,11,2
"Wait, do you think this is annoying to the people that live below us?",1.2272727272727273,0.05040917406074098,88,70,16,2
"I've always thought of them as adversaries, but what if that's just the way they've learned to approach each other?",1.2272727272727273,0.05040917406074098,88,70,16,2
The bowling alley was closing and selling everything after the owner ran it into the gutter.,1.2272727272727273,0.060284695763812665,66,53,11,2
I m' guessing no 300 games today.,1.2272727272727273,0.059883360868449254,88,74,8,6
This wasn't what I had in mind when you said you'd found some decor in an alley.,1.2272727272727273,0.056285380669717305,66,52,13,1
Some guy named Dude used to live here,1.2272727272727273,0.059883360868449254,88,74,8,6
Have you seen my pen?,1.2268041237113403,0.053857140957585814,97,80,12,5
"Your Pin, my two balls. Is that love?",1.2268041237113403,0.053857140957585814,97,80,12,5
"And, the three holes don’t bother you?",1.2268041237113403,0.05182484925036311,97,79,14,4
"I should have never gone on strike.
It would have spared us a lot of agony.",1.2268041237113403,0.05182484925036311,97,79,14,4
'I swear I read the ration is supposed to be one to one',1.2266666666666666,0.06172690021546694,75,62,9,4
I guess we'll just have to come up with some rules...or something...,1.2266666666666666,0.05873542244548729,75,61,11,3
"You know what honey, I think it’s time to take up baseball … again.",1.2266666666666666,0.052241067457787754,75,59,15,1
It is kind of like skins and shirts.,1.2266666666666666,0.06457995486658823,75,63,7,5
I’ve really had it with that jerk that lives below us!!,1.2266666666666666,0.05558317631702502,75,60,13,2
WHO says you can't bring them home,1.2266666666666666,0.05558317631702502,75,60,13,2
Just buying more of them doesn't actually make you stronger!,1.2266666666666666,0.05558317631702502,75,60,13,2
It’s time you cancelled your Costco membership,1.2264150943396226,0.05066142723877443,106,87,14,5
"I heard bowling and a home cooked meal was the best first date. Sadly, we are crunched for time.",1.2261904761904763,0.057063317179970284,84,69,11,4
They said this was a good game for two people to play.,1.2261904761904763,0.05449183824149288,84,68,13,3
Let's bowl nude!,1.2261904761904763,0.057063317179970284,84,69,11,4
Let's read the rule book again.,1.2261904761904763,0.04894524460708411,84,66,17,1
Can we put a pin in this? I have to roll.,1.2261904761904763,0.057063317179970284,84,69,11,4
Of course there's no point. It's a Nihilism and Indoor Sports event.,1.2261904761904763,0.05179284412244766,84,67,15,2
So I guess the order really did go through the first time…,1.2261904761904763,0.06188655454031693,84,71,7,6
I suppose we should take the next step and see how the game is played.,1.2261904761904763,0.06188655454031693,84,71,7,6
"Oh, fuck!",1.2258064516129032,0.059468253535842175,93,79,7,7
I see what you mean but I still think I’m more of a dog person,1.2258064516129032,0.05324669855036502,93,76,13,4
"Maybe we could play ""pin the tail on the donkey"" instead.",1.2258064516129032,0.06263791695329896,62,50,10,2
How else will I keep the tenants awake without a trombone or work boots?,1.2258064516129032,0.06672577740289717,62,51,8,3
So do we throw the balls or the pins?,1.2254901960784315,0.05195996014042177,102,84,13,5
Try not to hit the glass door.,1.2253521126760563,0.06083649988077124,71,58,10,3
Oh - so it is 10 pins and ONE ball?,1.2253521126760563,0.05743400761588512,71,57,12,2
You said you wanted a guy with balls.,1.2253521126760563,0.06405852171775905,71,59,8,4
"My bonus points at ""Bowler Depot"" were about to expire...",1.2253521126760563,0.05743400761588512,71,57,12,2
Where’s the shoe rental?,1.2253521126760563,0.05381682584378254,71,56,14,1
You never appreciate the nuance of my art installations.,1.2253521126760563,0.05743400761588512,71,57,12,2
Let’s be honest for once - no games.,1.225,0.05618403304872525,80,65,12,3
The guy told me we could get an even better deal on typewriters.,1.225,0.05893302355914537,80,66,10,4
I'm going to install a camera so we can catch them in the act.,1.225,0.050236781119167934,80,63,16,1
But you told me get some balls…,1.225,0.053293431803719676,80,64,14,2
I think that croquet book was wrong,1.225,0.05618403304872525,80,65,12,3
"If we put them all together this way, they'll look like penises.",1.225,0.05893302355914537,80,66,10,4
To the death.,1.225,0.0615593775311716,80,67,8,5
The real challenge is getting them to stay up.,1.225,0.05893302355914537,80,66,10,4
What would Bobby Fischer do?,1.2247191011235956,0.05478346498667158,89,73,12,4
"“OK, I promise to stop spiking the ball after each strike.”


Bob Murphy

Aurora , IL",1.2247191011235956,0.05706654581152645,89,74,10,5
When you told me on our first date last week that I bowled you over I wasn't sure what you meant.,1.2247191011235956,0.04727726928669147,89,70,18,1
Hurry.  Let's clean up before the folks downstairs realize what's going on.,1.2247191011235956,0.05478346498667158,89,73,12,4
"Trust me, we'll call it Lover's Lane.",1.2247191011235956,0.04990493769277262,89,71,16,2
Our downstairs neighbor left another note,1.2247191011235956,0.05240100591622927,89,72,14,3
Read the instructions? And ruin all this?,1.2247191011235956,0.05478346498667158,89,73,12,4
A great view and right up my alley - I'll take it!,1.2244897959183674,0.051345482390755634,98,80,14,4
Let me X-plain.,1.2244897959183674,0.05529145895514973,98,82,10,6
The ratio is wrong.,1.2241379310344827,0.06527480857241695,58,47,9,2
This will be a tough split.,1.2238805970149254,0.05947492059078341,67,54,11,2
When I said you needed “More Balls” this isn’t what I had in mind…,1.2238805970149254,0.06316288636259096,67,55,9,3
"I didn't think that this was what the apartment advertisement meant when it said ""the place has room to spare.""",1.2238805970149254,0.06316288636259096,67,55,9,3
"Ya know, it's just like you to bring a bowling pin to a bowling ball fight!",1.2238805970149254,0.06316288636259096,67,55,9,3
I hope they pick a caption soon. These balls are getting heavy,1.2238805970149254,0.06664708731840549,67,56,7,4
I think there’s someone in the house,1.2238805970149254,0.06664708731840549,67,56,7,4
Wish you hadn't lost the instructions.,1.2236842105263157,0.054927972647204476,76,61,13,2
I'm not sure we quite understand how to play this,1.2236842105263157,0.054927972647204476,76,61,13,2
remind me again why we don't  like like our downstairs neighbors,1.2236842105263157,0.05163530755354893,76,60,15,1
The ball returners went on strike,1.2236842105263157,0.054927972647204476,76,61,13,2
Leave? It’ll be tough to split at 7:10,1.2236842105263157,0.06098226434871827,76,63,9,4
"When I signed up for juggling school, I had something else in mind.",1.2236842105263157,0.054927972647204476,76,61,13,2
I think the guy who turned the bowling alley into an exercise club duped us.,1.2236842105263157,0.06098226434871827,76,63,9,4
It was cheaper by the dozen,1.2236842105263157,0.058034122480782796,76,62,11,3
Their interests are not up each other's alley,1.223529411764706,0.05887952516876743,85,71,9,5
I think we played it wrong,1.223529411764706,0.05391265523477455,85,69,13,3
"OK, fine. I'll do the vacuuming.",1.223529411764706,0.05645074347855474,85,70,11,4
"Now that we’ve kept only the things that spark joy, what next?",1.223529411764706,0.05391265523477455,85,69,13,3
You’ve got some pair of balls,1.223529411764706,0.05887952516876743,85,71,9,5
You are right up my alley!,1.223529411764706,0.05645074347855474,85,70,11,4
I think Alexa heard me talking about going on strike,1.223529411764706,0.05391265523477455,85,69,13,3
Find something else to roll out the dough!  I need all ten pins for my game to count.,1.2234042553191489,0.04576369761091061,94,74,19,1
"So...You're having that dream again, too, huh?",1.2234042553191489,0.0481985126163457,94,75,17,2
I was expecting another kind of pinball.,1.2222222222222223,0.05826715823167505,81,67,10,4
I don't think this is a good version of couple's therapy.,1.2222222222222223,0.05555555555555552,81,66,12,3
"I misunderstood the expression ""picking up spares"" with the guys at the alley.",1.2222222222222223,0.04933922619854284,72,56,16,0
IKEA bowling was a bad idea.,1.2222222222222223,0.05187562620058009,90,73,14,3
They were having a yard sale at the bowling alley.,1.2222222222222223,0.05315633121839994,72,57,14,1
How does this gender reveal work?,1.2222222222222223,0.06085806194501842,81,68,8,5
I think I'm ready for plan B.,1.2222222222222223,0.056717121359687366,72,58,12,2
I think it's time we try that split.,1.2222222222222223,0.05187562620058009,90,73,14,3
"But you said, “Bowl me over!”",1.2222222222222223,0.056717121359687366,72,58,12,2
"OK, let’s call the whole thing off.",1.2222222222222223,0.060743988626461014,90,77,6,7
Perhaps we could store these in the spare room?,1.2222222222222223,0.060067197055121264,72,59,10,3
Only bowling benefits from disparity.,1.2222222222222223,0.05555555555555552,81,66,12,3
I still think you're a perfect 10,1.2222222222222223,0.049690399499995284,81,64,16,1
"When I said prepare to go bowling tonight, I didn't know you've never been to a bowling alley.",1.2222222222222223,0.052704627669472946,81,65,14,2
I guess the strike is over,1.2222222222222223,0.05187562620058009,90,73,14,3
I just can’t stay in my lane.,1.2222222222222223,0.05187562620058009,90,73,14,3
That's the beauty of freestyle bowling—you can play it anywhere you want to.,1.2222222222222223,0.05826715823167505,81,67,10,4
They're all so beautiful. I just can't choose one.,1.2222222222222223,0.04933922619854284,72,56,16,0
"Later baby, I gotta 7-10 split right now.""",1.2222222222222223,0.04664712806708399,99,79,18,2
"It's always 10 to 1, I'm trying to even it up",1.2222222222222223,0.05826715823167505,81,67,10,4
"Next time let’s go to the escape room first, then bowl.",1.2222222222222223,0.056717121359687366,72,58,12,2
"Don’t worry about noise complaints, there’s a three strikes policy.",1.2222222222222223,0.06324005430728245,72,60,8,4
It was a stork.,1.2222222222222223,0.05826715823167505,81,67,10,4
"Honey, put on your bowling shoes! People might think we’re crazy!",1.2222222222222223,0.04681564710038359,90,71,18,1
"See, I‘be got a lot of balls",1.2210526315789474,0.050036822652392024,95,77,15,3
Everybody needs somebody.,1.2210526315789474,0.0522268875856145,95,78,13,4
Please tell me WHY I have to go down to the alley to play with my toys?,1.2210526315789474,0.0522268875856145,95,78,13,4
our Super Bowl party was a bust.,1.2209302325581395,0.05824887120010925,86,72,9,5
It's called an escape room.,1.2209302325581395,0.053345434421812485,86,70,13,3
"You are right, we probably should have started with a lane.",1.2209302325581395,0.04794308866997282,86,68,17,1
I play by my own rules.,1.2209302325581395,0.06491320689766797,86,75,3,8
We didn’t stay in our lanes.,1.2209302325581395,0.0558509909032007,86,71,11,4
How do these things work?,1.2209302325581395,0.05824887120010925,86,72,9,5
But where are the shoes?,1.2209302325581395,0.05071624554750072,86,69,15,2
"Y'know, people who live in glass houses shouldn't throw bowling balls.",1.2209302325581395,0.053345434421812485,86,70,13,3
"You can't avoid the split, Barb.",1.2209302325581395,0.053345434421812485,86,70,13,3
Pandemic bowling isn't as much fun.,1.2207792207792207,0.05104303942770242,77,61,15,1
But we've always wanted a spare bedroom.,1.2207792207792207,0.057349096534596404,77,63,11,3
It's mid-century Milwaukee.,1.2207792207792207,0.06025514395462593,77,64,9,4
"Honey, the downstairs neighbours are complaining again. I think it's time we bought a rug.",1.2207792207792207,0.05104303942770242,77,61,15,1
This should finally get rid of our downstairs neighbors.,1.2205882352941178,0.050656741494739324,68,53,15,0
The realtor assured me that this place would be up our alley,1.2205882352941178,0.06231412478072636,68,56,9,3
It seems we never have a spare moment.,1.2205882352941178,0.06231412478072636,68,56,9,3
"I don’t mind picking up after you once in a while, but this is where I draw the line.",1.2197802197802199,0.05136048423833287,91,74,14,3
I need a new shirt.,1.2197802197802199,0.055913324258145554,91,76,10,5
Auto-correct bungled my order for 'flooring.',1.2197802197802199,0.05136048423833287,91,74,14,3
I'm starting to think it was a bad idea to live above your ex-boyfriend.,1.2195121951219512,0.05494074507510377,82,67,12,3
this way I know I can knock them all down,1.2195121951219512,0.052128412091250256,82,66,14,2
We prefer the challenge of random selection.,1.2195121951219512,0.04915543942335245,82,65,16,1
America's Got Talent called.   They said no.,1.2195121951219512,0.052128412091250256,82,66,14,2
Spring cleaning helps remind me how crazy COVID lockdowns were.,1.2195121951219512,0.052128412091250256,82,66,14,2
"What can I say, Janet. I'm bowled over!",1.2195121951219512,0.05494074507510377,82,67,12,3
What did you think I meant when I said I’m getting a turkey tonight?,1.2191780821917808,0.062441983247385126,73,61,8,4
I could get used to the smell of rental shoes.,1.2191780821917808,0.05601755317984154,73,59,12,2
How else will our downstairs neighbors know we're up here?,1.2191780821917808,0.04875378197274571,73,57,16,0
"Is that what getting ""ratioed"" means?",1.2191780821917808,0.05931680847838621,73,60,10,3
