caption,mean,precision,votes,not_funny,somewhat_funny,funny
"I know we said until the Millers moved, but the thrill is gone.",1.135135135135135,0.044398669826762854,74,65,8,1
Now we know what was going on upstairs.,1.135135135135135,0.040012605956627305,74,64,10,0
"Sorry, we just don’t share the same goals.",1.1348314606741574,0.03976119739356875,89,78,10,1
Something's off here,1.1348314606741574,0.04844626572719376,89,81,4,4
I can't get my mind out of the gutter.,1.1346153846153846,0.055121189353288455,52,46,5,1
"We can do this all day, Suzy",1.1346153846153846,0.055121189353288455,52,46,5,1
They’re right up my alley and they keep me out of the gutter.,1.1346153846153846,0.055121189353288455,52,46,5,1
"Ever since we turned our home into a bowling alley, my wife never had to buy another pair of shoes again.",1.1346153846153846,0.055121189353288455,52,46,5,1
I should’ve known “1bed/spare room in Upper West Side” was too good to be true,1.1346153846153846,0.055121189353288455,52,46,5,1
It's a different game now.,1.1343283582089552,0.04705493189919477,67,59,7,1
Spare me these therapy lessons.,1.1343283582089552,0.0516376863386756,67,60,5,2
This is one of those jobs that can't be 'Working From Home.',1.1343283582089552,0.0516376863386756,67,60,5,2
I thought they'd be right up your alley,1.1343283582089552,0.041974785069899656,67,58,9,0
"OK, we've got the equipment, now all
we need is a name. How about Pinball!",1.1343283582089552,0.04705493189919477,67,59,7,1
People who bowl in glass houses just aren't right in the head.,1.1343283582089552,0.041974785069899656,67,58,9,0
Somehow we seemed to have gotten this ten-pin game all screwed up.,1.1343283582089552,0.041974785069899656,67,58,9,0
The plan is to just baffle my new district manager.,1.1343283582089552,0.04705493189919477,67,59,7,1
I thought the only split you wanted was the 7-10.,1.1343283582089552,0.041974785069899656,67,58,9,0
But they were so lonely I had to bring them home - no one bowls any more.,1.1343283582089552,0.04705493189919477,67,59,7,1
Were you trying to suggest this wouldn't be a fair fight?,1.1343283582089552,0.04705493189919477,67,59,7,1
How about you and me strike up a conversation.,1.1343283582089552,0.041974785069899656,67,58,9,0
I'm sure I asked our agent about gutters.,1.1343283582089552,0.0516376863386756,67,60,5,2
I don't think the neighbors are going to like this new hobby of yours...,1.1343283582089552,0.0516376863386756,67,60,5,2
None of these pins match up to ANY of these holes. I hate bowling!!,1.1343283582089552,0.0516376863386756,67,60,5,2
Now that the kids have moved out we finally have that spare bedroom you always wanted.,1.1343283582089552,0.0516376863386756,67,60,5,2
Explain to me again the difference between equity and equality.,1.1343283582089552,0.041974785069899656,67,58,9,0
Ugh your place looks like a gutter,1.1343283582089552,0.0516376863386756,67,60,5,2
An educated consumer is our best customer.,1.1343283582089552,0.041974785069899656,67,58,9,0
I guess I really striked out this time,1.1343283582089552,0.041974785069899656,67,58,9,0
"If this doesn’t work out, can I have the pins?",1.1343283582089552,0.0516376863386756,67,60,5,2
Bowling alleys have really changed since the pandemic.,1.1341463414634145,0.045124189174381366,82,73,7,2
I should have collected stamps.,1.1341463414634145,0.04834569857699535,82,74,5,3
We can't go on meeting like this,1.1341463414634145,0.045124189174381366,82,73,7,2
Better than living in an alley...,1.1341463414634145,0.04834569857699535,82,74,5,3
It's our duty as the upstairs neighbor to create a racket,1.1341463414634145,0.041654271406339864,82,72,9,1
It helps me figure out Wordle.,1.1333333333333333,0.043839729948095284,75,66,8,1
I worked my whole life to get out of the gutter.,1.1333333333333333,0.044255719836307675,60,52,8,0
What did you think I meant by 'up your alley?',1.1333333333333333,0.05023485333552976,60,53,6,1
When did you say the pin setter gets out of quarenteen?,1.1333333333333333,0.044255719836307675,60,52,8,0
I'd like us to hit reset.,1.1333333333333333,0.044255719836307675,60,52,8,0
So...how much did you spend on this escape room again?,1.1333333333333333,0.05023485333552976,60,53,6,1
"Honey, I think we need to ratchet this down a little.",1.1333333333333333,0.05023485333552976,60,53,6,1
Don’t worry. The kids will just think we’re having wild sex in here.,1.1333333333333333,0.05023485333552976,60,53,6,1
"Now we just need to add bumpers, flappers and flashing lights",1.1333333333333333,0.044255719836307675,60,52,8,0
This seemed like such a good idea until we remembered the glass doors.,1.1333333333333333,0.039516598557587955,75,65,10,0
O.K. Next time candlepins.,1.1333333333333333,0.05557438475642006,60,54,4,2
"When he said ""sporting goods"" could he have meant stocks?",1.1333333333333333,0.05023485333552976,60,53,6,1
After getting stuck without toilet paper...,1.1333333333333333,0.044255719836307675,60,52,8,0
You’ll never pin me down.,1.1333333333333333,0.05023485333552976,60,53,6,1
Looks like the Pin Ball Wizard has struck again!,1.1333333333333333,0.05023485333552976,60,53,6,1
"Harry, I don't think this is the right kind of pinball for your man cave.",1.1333333333333333,0.05023485333552976,60,53,6,1
I told you to get a PINBALL machine!,1.1333333333333333,0.051406640063737324,75,68,4,3
We're all done with the easy part of the plan.,1.1333333333333333,0.039516598557587955,75,65,10,0
I said Rockin' and Rollin' not Bowlin',1.1333333333333333,0.05023485333552976,60,53,6,1
Its nice.  But I really don't need the spare room.,1.1333333333333333,0.044255719836307675,60,52,8,0
I'll put them down quietly if you don't strike me with that pin.,1.1333333333333333,0.05557438475642006,60,54,4,2
"Like I told you, duck pins take up less room!",1.1333333333333333,0.05023485333552976,60,53,6,1
This isn’t what I imagined when you suggested extreme pinball.,1.1333333333333333,0.05557438475642006,60,54,4,2
I can't tell whether this marriage counselor is bonkers or a genius,1.1333333333333333,0.047773238138965245,75,67,6,2
I'm starting to worry it's obvious we found all this stuff in an alley.,1.1333333333333333,0.051406640063737324,75,68,4,3
Change my mind. Let’s play outside.,1.1333333333333333,0.044255719836307675,60,52,8,0
They say the justices ‘just call balls and strikes’ so I thought this might be good luck.,1.1333333333333333,0.05023485333552976,60,53,6,1
"My parents always said if I dropped out of school, I’d wind up living in the gutters.",1.1333333333333333,0.05023485333552976,60,53,6,1
now you take a turn as pin person,1.1325301204819278,0.047787007657898894,83,75,5,3
It could be worse. We could be in a gutter somewhere.,1.1323529411764706,0.05091098018830443,68,61,5,2
The union called. We've made a terrible mistake.,1.1323529411764706,0.05091098018830443,68,61,5,2
We gotta get this fucking bowling stuff outta here,1.1323529411764706,0.055053696211138176,68,62,3,3
I'm playing Buckeyball Pickup with Jaroslav. Why,1.1323529411764706,0.0414000577075105,68,59,9,0
I don’t care if you were a world champion bowler in a previous life. I want a divorce.,1.1323529411764706,0.0463998528118308,68,60,7,1
"It takes balls !...to play what ever
this is"".. Pins and Balls",1.1323529411764706,0.0414000577075105,68,59,9,0
"Yes, each ball is coded for a specific pin. I'm sure it will make the sport a lot more fun !",1.1323529411764706,0.0463998528118308,68,60,7,1
I think I want to split.,1.1323529411764706,0.0463998528118308,68,60,7,1
It seems like we should get roller skates too.,1.1323529411764706,0.0414000577075105,68,59,9,0
Your salt and pepper shakers are too heavy.,1.1323529411764706,0.0463998528118308,68,60,7,1
I'm bowled over. I don't know what else to say.,1.1323529411764706,0.0414000577075105,68,59,9,0
Donald Trump was in.,1.1323529411764706,0.05091098018830443,68,61,5,2
"I ordered a pinsetter, but they said that would constitute human trafficking.",1.1323529411764706,0.0463998528118308,68,60,7,1
I didn't know we were supposed to bring our own pins..,1.1323529411764706,0.0414000577075105,68,59,9,0
"When I said I wanted a ""spare bedroom"" this isn't exactly what I had in mind.",1.1323529411764706,0.0414000577075105,68,59,9,0
"Somehow, I'm not so sure this is going to catch on.",1.1323529411764706,0.0463998528118308,68,60,7,1
You think this will make the downstairs neighbors move out?,1.1323529411764706,0.0463998528118308,68,60,7,1
We could install thicker carpeting..,1.1323529411764706,0.0463998528118308,68,60,7,1
"I know you told me to get a job, but let me tell you why this is better!",1.1323529411764706,0.05091098018830443,68,61,5,2
Your furniture choices are striking,1.1323529411764706,0.05091098018830443,68,61,5,2
It doesn't matter which ones I grab. The pin or the balls. Either way I've got you.,1.1323529411764706,0.0414000577075105,68,59,9,0
"I meant strike out, not strike in.",1.1323529411764706,0.05091098018830443,68,61,5,2
Wait...were these art displays interactive?,1.1323529411764706,0.0414000577075105,68,59,9,0
I sometimes think stamp collecting would have been easier,1.1320754716981132,0.05413078722488102,53,47,5,1
We have to sign a lease both for the apartment and for the special shoes.,1.1320754716981132,0.05413078722488102,53,47,5,1
I don't know. . . it just doesn't strike my fancy,1.1320754716981132,0.05413078722488102,53,47,5,1
"So this is what the decorator meant by, “The Dude abides.”",1.1320754716981132,0.04695159976668159,53,46,7,0
Don't you think this beats playing Wordle? It's physical.,1.1320754716981132,0.04695159976668159,53,46,7,0
I pinned my location for you,1.1320754716981132,0.06046347269649694,53,48,3,2
"When I asked for the office to be bowling-themed, I didn't mean it literally.",1.131578947368421,0.03903262361629298,76,66,10,0
Are you sure this is how to bowl?,1.131578947368421,0.03903262361629298,76,66,10,0
They were spares so I got them for free.,1.131578947368421,0.03903262361629298,76,66,10,0
It's like what Wordle is to the crossword ... but for bowling.,1.131578947368421,0.05075605663680504,76,69,4,3
I collected ping-pong balls and paddles when I was a kid.,1.131578947368421,0.03903262361629298,76,66,10,0
"What do you mean, 'Split?'",1.131578947368421,0.04717308652543423,76,68,6,2
"Well, I wouldn't say he up-sold me necessarily",1.131578947368421,0.03903262361629298,76,66,10,0
"Well,you did say this was the spare room.",1.131578947368421,0.03903262361629298,76,66,10,0
I think hybrid working isn't an option.,1.131578947368421,0.04717308652543423,76,68,6,2
This is one intense Escape Room!,1.131578947368421,0.043294605892116034,76,67,8,1
You always say I don’t care about all your juggling,1.131578947368421,0.043294605892116034,76,67,8,1
"Andrea, we don’t need lanes. Linear paradigms are what got us into this mess.",1.131578947368421,0.04717308652543423,76,68,6,2
It worked for deconstructed pizza...,1.1311475409836065,0.04357902084672543,61,53,8,0
Yelp just rated us Worst Store Ever.,1.1311475409836065,0.049452797144256905,61,54,6,1
They shut down the bowling alley for 14 days due to a Covid outbreak.,1.1311475409836065,0.049452797144256905,61,54,6,1
Maybe nix the home bowling league idea.,1.1311475409836065,0.049452797144256905,61,54,6,1
It’s experimental.,1.1311475409836065,0.05469942625679649,61,55,4,2
"What do you mean, 'it's not a fair battle?'",1.1311475409836065,0.04357902084672543,61,53,8,0
I feel that we have this same crisis every time your mother comes to visit.,1.1311475409836065,0.04357902084672543,61,53,8,0
I just don't know why people used to think playing pinball was fun!,1.1311475409836065,0.049452797144256905,61,54,6,1
When I get enough money I will purchase a Bowling alley.,1.1311475409836065,0.04357902084672543,61,53,8,0
It's how couples work out their problems nowadays.,1.1311475409836065,0.05469942625679649,61,55,4,2
I finally have the balls to ask you to stop pinning everything on me.,1.1311475409836065,0.05469942625679649,61,55,4,2
"For a 60-foot apartment in the city, I can live with it.",1.1311475409836065,0.04357902084672543,61,53,8,0
I just think it’s important for us to exercise because we have such thin necks.,1.1311475409836065,0.04357902084672543,61,53,8,0
"Now, at the end, you hit me on the head with the pin. That'll be the performance part of the art.",1.1311475409836065,0.049452797144256905,61,54,6,1
We're still transitioning from work from home. I go into the alley Tuesdays and Thursdays.,1.1311475409836065,0.04357902084672543,61,53,8,0
He: Why is it so quiet in here ? She: so you can hear the pin drop!,1.1311475409836065,0.049452797144256905,61,54,6,1
Did they think we wouldn't realize the door slides open?,1.1311475409836065,0.05469942625679649,61,55,4,2
I've worked my way up from the alley to here.,1.130952380952381,0.04071845422256089,84,74,9,1
We sure do have a lot of bowling balls and pins.,1.130952380952381,0.04410050166290234,84,75,7,2
"When they said this place was right up our alley, I didn't think I would be so bowled over.",1.130952380952381,0.04071845422256089,84,74,9,1
It’s a Y2K thing.,1.1304347826086956,0.045762664165056526,69,61,7,1
This is why I always put off cleaning the gutters.,1.1304347826086956,0.04084071463598804,69,60,9,0
"Shh. Wait. Nope, he's still practicing on that banjo.",1.1304347826086956,0.04084071463598804,69,60,9,0
You wanted bowling-themed decor. I got you bowling-themed decor.,1.1304347826086956,0.04084071463598804,69,60,9,0
You seem upset with me ever since I gave up curling.,1.1304347826086956,0.054283849812765045,69,63,3,3
I think I might have misspelled 'pans' on the wedding registry.,1.1304347826086956,0.04084071463598804,69,60,9,0
"I call it ""Room to Spare""…",1.1304347826086956,0.054283849812765045,69,63,3,3
Wouldn't it be cheaper to just install a lock on the door?,1.1304347826086956,0.05904796749989387,46,41,4,1
You're the one who said I should take up a hobby!,1.1304347826086956,0.045762664165056526,69,61,7,1
"Well, our building has a pet limit, not a bowling ball limit.",1.1304347826086956,0.04084071463598804,69,60,9,0
"On the bright side,the party theme could have been Under the Sea",1.1304347826086956,0.035304258388745714,92,80,12,0
I am doing my best to bowl you over,1.1304347826086956,0.04084071463598804,69,60,9,0
Still working out the kinks for my bowling alley-share app.,1.1304347826086956,0.04084071463598804,69,60,9,0
"Uhhh, I think they've been reproducing in the closet...maybe...",1.1304347826086956,0.04084071463598804,69,60,9,0
"Honey, I am trying to spare you from a strike",1.1304347826086956,0.05020437123388052,69,62,5,2
Why are the downstairs neighbors complaining when they could hear a pin drop?,1.1304347826086956,0.04084071463598804,69,60,9,0
This is not how I remember bowling as a kid Jen!,1.1304347826086956,0.04084071463598804,69,60,9,0
I don't think we have enough room to spare.,1.12987012987013,0.04658776821420219,77,69,6,2
"Spare me your conversation about how we stuck out.""
Robert  Weingast , Manhattan, New York",1.12987012987013,0.04658776821420219,77,69,6,2
The ‘ol Ball and Pin has got me tied down again,1.12987012987013,0.04658776821420219,77,69,6,2
I guess this is where the Kingpin kept his spares,1.12987012987013,0.04658776821420219,77,69,6,2
I think the ratio is one ball to ten pins. Can we return these?,1.12987012987013,0.03856025347250398,77,67,10,0
We should stop at the bank for a loan tomorrow. We need just a few more pins to open a bowling alley,1.12987012987013,0.04276279513224073,77,68,8,1
Every other weekend and holidays isn’t enough.,1.12987012987013,0.03856025347250398,77,67,10,0
"...THEY Played Music ALL NIGHT, WHATS THE DIFFERENCE?",1.12987012987013,0.04658776821420219,77,69,6,2
This apartment is right up my alley,1.12987012987013,0.03856025347250398,77,67,10,0
Sure drones are more precise but I like to keep a hand in it.,1.1296296296296295,0.04613879568230504,54,47,7,0
They kept telling me to pick up the spare.,1.1296296296296295,0.053175186756420766,54,48,5,1
You told me you wanted the gutters cleaned.,1.1296296296296295,0.059383604691421045,54,49,3,2
I thought we agreed we wouldn’t start until the neighbors went to bed.,1.1296296296296295,0.053175186756420766,54,48,5,1
Can you believe all of this was just laying in the alley?,1.1296296296296295,0.053175186756420766,54,48,5,1
"I found these out on the curb.  Now all we need is a long, skinny apartment.",1.1296296296296295,0.053175186756420766,54,48,5,1
You said I worked too much so I thought I'd bring work home this time,1.1296296296296295,0.04613879568230504,54,47,7,0
"Honey, I’m not hoarding. I’m being proactive — preparing for any future lockdowns so we have something fun to do.",1.1296296296296295,0.053175186756420766,54,48,5,1
Wrong ball to pin ratio for the game.,1.1296296296296295,0.059383604691421045,54,49,3,2
"You know how I told you I was absolutely sure the guy living below us was Lin-Manuel Miranda? Well, I saw him in the elevator today, and he started yelling at me in Portuguese or Russian or something. We've been fucking with, like, some...random guy.",1.1294117647058823,0.043605807743241236,85,76,7,2
It's the old fashioned pin ball?,1.1290322580645162,0.053851505523430813,62,56,4,2
I'm warming up in the ballpen before my big game.,1.1290322580645162,0.04869459844138252,62,55,6,1
stick with juggling the pins,1.1290322580645162,0.053851505523430813,62,56,4,2
"Due to noise complaints, we'll have to rethink our self-defense training.",1.1290322580645162,0.04869459844138252,62,55,6,1
I knew we should have bought the duck pins,1.1290322580645162,0.04869459844138252,62,55,6,1
"Don’t threaten me with that pin, Alice– I’ve got 2 balls.",1.1290322580645162,0.04292252541026548,62,54,8,0
The silence his final strike provoked was so absolute that he could hear a pin drop. The look on her face was clear: her love had finally guttered out.,1.1290322580645162,0.04869459844138252,62,55,6,1
I told you you needed the booster lanes.,1.1290322580645162,0.053851505523430813,62,56,4,2
Help me assemble these dicks.,1.1290322580645162,0.04869459844138252,62,55,6,1
"Umm, how about no strikes, and fewer balls?",1.1290322580645162,0.04292252541026548,62,54,8,0
Perhaps we should have downsized before we moved into the apartment.,1.1290322580645162,0.04869459844138252,62,55,6,1
"Don’t worry, this is how WeWork was started.",1.1290322580645162,0.04292252541026548,62,54,8,0
"Babe, it's not my fault.. they said it was BYOB!",1.1290322580645162,0.04292252541026548,62,54,8,0
"If you strike me with that, I will start to play Wordle again!",1.1290322580645162,0.04869459844138252,62,55,6,1
I think you should take your pins and leave.,1.1285714285714286,0.04951704046747739,70,63,5,2
Your ability to pick up spares is legendary.,1.1285714285714286,0.04951704046747739,70,63,5,2
"But Darlene, a vintage collection from an estate sale in New Jersey is as sweet as it gets!  Don’t make me turn to eBay!",1.1285714285714286,0.04514264748228169,70,62,7,1
You rolled 16 balls and didn't knock over a single pin?,1.1285714285714286,0.04951704046747739,70,63,5,2
I think we need more operational help.,1.1285714285714286,0.04951704046747739,70,63,5,2
It seemed like a good idea at the time …like the  stationary bike”,1.1285714285714286,0.04951704046747739,70,63,5,2
"I was laid off from the bowling alley, can you believe all this was in my locker.",1.1285714285714286,0.04514264748228169,70,62,7,1
"With our upstairs neighbor’s problem solved, we can sleep in peace.",1.1285714285714286,0.04951704046747739,70,63,5,2
"Don't worry. If Putin comes our way, we're ready for the drones.",1.1285714285714286,0.04029615300200892,70,61,9,0
"You say 'tom-A-to,' I say 'tom-aaaah-to'",1.1285714285714286,0.04029615300200892,70,61,9,0
All I wanted was the damned shirt!,1.1285714285714286,0.04029615300200892,70,61,9,0
Is it a All Hands meeting or All Hands and Heads meeting?,1.1285714285714286,0.04951704046747739,70,63,5,2
Did you say I was a Pin Ball Wizard?,1.1285714285714286,0.04514264748228169,70,62,7,1
I told you we needed more than a studio!,1.1285714285714286,0.04514264748228169,70,62,7,1
"OK, but I'm only moving the furniture one more time.",1.1285714285714286,0.04029615300200892,70,61,9,0
"I know we're going minimalist, but this is for my BOWLING installation  of mid-century nostalgia art...",1.1285714285714286,0.04029615300200892,70,61,9,0
I said I’m on pins and needles,1.1285714285714286,0.053535184426749045,70,64,3,3
Did you read the directions?,1.1285714285714286,0.04951704046747739,70,63,5,2
Now what can we do with this stuff that’s entertaining?,1.1282051282051282,0.038099080213023176,78,68,10,0
"If I strike first, your balls won't do you any good.",1.1282051282051282,0.038099080213023176,78,68,10,0
"Post-pandemic,American consumers have now been hoarding bowling supplies,causing a nationwide panic.",1.1282051282051282,0.04224381902809815,78,69,8,1
"Ok, shall we call the new game, Hit or Miss?",1.1282051282051282,0.04224381902809815,78,69,8,1
"You can't strike honey, please put it down",1.127659574468085,0.049202908961969306,47,41,6,0
Well personally I think we're great upstairs neighbors,1.1272727272727272,0.04535342286998722,55,48,7,0
We’ll call it Bowldl.,1.1272727272727272,0.04535342286998722,55,48,7,0
"I keep forgetting what you told me the first, second, third time that if the holes are too small don’t put your fingers in them. As for the pins, well…..,.",1.1272727272727272,0.04535342286998722,55,48,7,0
Those aren't regulation shoes.,1.1272727272727272,0.0583415316290653,55,50,3,2
It's safe to go back to the lanes now.,1.1272727272727272,0.05225259457122252,55,49,5,1
You're still out of your league.,1.1272727272727272,0.0583415316290653,55,50,3,2
Surrender. I've got balls.,1.1272727272727272,0.04535342286998722,55,48,7,0
None of these Russian bowling balls will stay in their lane,1.126984126984127,0.0530293926364563,63,57,4,2
Can’t believe they are complaining about noise again downstairs!,1.126984126984127,0.04795918799660978,63,56,6,1
Was there another way to tell me to clean the gutters?,1.126984126984127,0.0530293926364563,63,57,4,2
Hit me in the stomach...I double dare you.,1.126984126984127,0.0422853514020739,63,55,8,0
You said you would love having one of my pieces of art in your home...,1.126984126984127,0.0422853514020739,63,55,8,0
"Sorry, I seem to have balled things up again.",1.126984126984127,0.04795918799660978,63,56,6,1
"If you don’t like the spare room, you’re definitely not going to like the turkey room.",1.126984126984127,0.04795918799660978,63,56,6,1
"Okay – ""There Will Be Blood"" reenactment,  take 1…",1.126984126984127,0.04795918799660978,63,56,6,1
Clearly I am the one with more balls.,1.126984126984127,0.0422853514020739,63,55,8,0
I know your Bowling Style takes more balls. But 9 to 2.5 ratio?,1.126984126984127,0.0422853514020739,63,55,8,0
You got some balls,1.126984126984127,0.0422853514020739,63,55,8,0
"This is not what I meant when I said, you and me, we're gonna bowl a perfect 300 together.",1.126984126984127,0.0422853514020739,63,55,8,0
Extra balls clutter the scoring.,1.126984126984127,0.04795918799660978,63,56,6,1
"We keep going until they stop the Bieber.""",1.126984126984127,0.0422853514020739,63,55,8,0
"They had me at ""bowling at the office'* to get me to come back.",1.126984126984127,0.04795918799660978,63,56,6,1
So that’s what you meant by “Super” Bowl…,1.126984126984127,0.04795918799660978,63,56,6,1
"It’s 7:10, I need to split",1.126984126984127,0.0530293926364563,63,57,4,2
You'd think ONE of us would have gotten a strike by now...,1.126984126984127,0.0422853514020739,63,55,8,0
Post-truth bowling,1.126984126984127,0.04795918799660978,63,56,6,1
This isn’t what I envisioned when I said ‘let’s knock a few back’,1.126984126984127,0.0422853514020739,63,55,8,0
I think the downstairs neighbors have finally surrendered!,1.1267605633802817,0.03976580062454872,71,62,9,0
Maybe pandemic home bowling wasn't such a good idea after all.,1.1267605633802817,0.044539121974202504,71,63,7,1
Bad news - bowling for dollars has been canceled.,1.1267605633802817,0.03976580062454872,71,62,9,0
You go bowling then I'm going to play Whack a Mole.,1.1267605633802817,0.044539121974202504,71,63,7,1
I think you are right.  'Pinball' does not require a hyphen.,1.1267605633802817,0.048848212589146164,71,64,5,2
We need to be on the same team.,1.1267605633802817,0.048848212589146164,71,64,5,2
Think the downstairs neighbors will mind the noise?,1.1267605633802817,0.03976580062454872,71,62,9,0
I'm not sure that the judge's order to settle all our differences amicably one-on-one extends this far.,1.1267605633802817,0.044539121974202504,71,63,7,1
"You threatened an intimacy strike, but I didn't expect this.",1.1267605633802817,0.03976580062454872,71,62,9,0
"I know they said he was an alley cat, but this is a bit much.",1.1267605633802817,0.044539121974202504,71,63,7,1
Sometimes a cigar is just a cigar.,1.1267605633802817,0.044539121974202504,71,63,7,1
asdf,1.1267605633802817,0.044539121974202504,71,63,7,1
"Spare me your 300th speech that if I don't strike my bowling obsession, you'll split and I'll be living in the gutter on Alley Lane.",1.1267605633802817,0.048848212589146164,71,64,5,2
Yes honey! You are right,1.1265822784810127,0.041737221436360945,79,70,8,1
This is not my idea of an internet stote.,1.1265822784810127,0.03764871456510459,79,69,10,0
I'm thinking this unit isn't really up our alley.,1.1265822784810127,0.04545949403645994,79,71,6,2
"There, now it is impossible to not get a strike.",1.1265822784810127,0.04545949403645994,79,71,6,2
I’m inventing a new game for you called,1.1265822784810127,0.041737221436360945,79,70,8,1
"Um, no idea, actually",1.1265822784810127,0.04545949403645994,79,71,6,2
Just let them mingle and we’ll see what hooks.,1.1265822784810127,0.03764871456510459,79,69,10,0
"Today it's the pins against the balls, baby.",1.1265822784810127,0.04545949403645994,79,71,6,2
