caption,mean,precision,votes,not_funny,somewhat_funny,funny
We’re looking for a Jellystone Park.,1.1486486486486487,0.04973991010198831,74,65,7,2
Change the ride you will get noticed!,1.1486486486486487,0.04973991010198831,74,65,7,2
Bleep bloop (aliens don't speak English and I don't understand their language well enough to translate),1.1486486486486487,0.04973991010198831,74,65,7,2
"Space ship Captain:  “The aerodynamics of the Earth Vehicle don’t look very good?             First Officer:  “Sir, we’re in outer space. THERE IS NO ATMOSPHERE! So aerodynamics don’t apply! “",1.1486486486486487,0.04973991010198831,74,65,7,2
Does it have a restroom?  We have to pee.,1.1486486486486487,0.04973991010198831,74,65,7,2
"Sure, the mileage is not great, but just try parking a saucer behind a Walmart.""",1.1486486486486487,0.045867476603888985,74,64,9,1
Hmmm ...U. F.  Winnebag-O?,1.1486486486486487,0.04973991010198831,74,65,7,2
The earthlings have abandoned their mobile homes due to stratospheric gas prices.,1.1486486486486487,0.045867476603888985,74,64,9,1
"It’s almost $7 a galaxy, can you believe it?",1.1486486486486487,0.041636428317793156,74,63,11,0
We bought it as soon as we both retired.,1.1486486486486487,0.045867476603888985,74,64,9,1
We cannot afford their fuel. Abort mission.,1.1481481481481481,0.05549729066741694,54,47,6,1
Fancy meeting you here!!!,1.1481481481481481,0.046848557928420444,81,71,8,2
"What this ""junky box"" lacks in speed is more than made up for by its very spacious bathroom.",1.1481481481481481,0.03971779738801338,81,69,12,0
Wow! Look what the new generation is driving!,1.1481481481481481,0.05549729066741694,54,47,6,1
Motel 2  ?,1.1481481481481481,0.043429775553920656,81,70,10,1
"Hey, your one of your brake lights is out.",1.1481481481481481,0.0500342818003937,81,72,6,3
Wow! What's the mileage per planet on that thing ?,1.1481481481481481,0.03971779738801338,81,69,12,0
"License and registration, please. Have you seen a large guy in a cat suit?",1.1481481481481481,0.05549729066741694,54,47,6,1
"Yup, we're trying to escape the US too.",1.1481481481481481,0.05549729066741694,54,47,6,1
We haven't had a nanosecond of regret about retirement.,1.1481481481481481,0.05549729066741694,54,47,6,1
You never heard of 'Spaceballs?',1.1477272727272727,0.041332851083640286,88,76,11,1
Come back home. Life on earth is not sustainable.,1.1477272727272727,0.03804170814840831,88,75,13,0
Aren't they the ones we met at Area 52 and told to get a horse?,1.1477272727272727,0.041332851083640286,88,76,11,1
"What do you mean ""there is no parking left in Area 51""?",1.1477272727272727,0.041332851083640286,88,76,11,1
Astronomical gas prices have left us stranded out here.,1.1475409836065573,0.04578439358612771,61,52,9,0
"With the high price of diesel fuel, we warned you not to buy a camper",1.1475409836065573,0.04578439358612771,61,52,9,0
"Our ship crashed, so some guy named Musk gave us this.",1.1475409836065573,0.05140679705526445,61,53,7,1
We were worried about the price of gas too until we remembered the earthlings don't know we just take it anyway,1.1475409836065573,0.05140679705526445,61,53,7,1
I guess they still haven’t figured out how to wean themselves off of fossil fuels.,1.1475409836065573,0.05140679705526445,61,53,7,1
Is this the right way to Las Vega?,1.1475409836065573,0.05140679705526445,61,53,7,1
I think we took the wrong exit off the Interstate.,1.1475409836065573,0.05140679705526445,61,53,7,1
It's True! The space force is up and running,1.1475409836065573,0.05140679705526445,61,53,7,1
"I swear, this isn’t what it looks like! We’re environmentalists…really!",1.1475409836065573,0.04578439358612771,61,52,9,0
The KOAs are all filled. So we buzzed a battleship instead.,1.1470588235294117,0.052441304127157654,68,60,6,2
Is that a new Tesla Space Odyssey?,1.1470588235294117,0.04807399313332188,68,59,8,1
The Smith's are always showing off their new RVs.,1.1470588235294117,0.04326808584867506,68,58,10,0
"We prefer the RV. As you know, terraforming certainly tries one's patience.",1.1470588235294117,0.04807399313332188,68,59,8,1
That is Just TOO 20th Century!,1.1470588235294117,0.04807399313332188,68,59,8,1
We had to join low earth orbit and weightlessness because we couldn't afford gasoline anymore....China and India have bought everything from Russia.,1.1470588235294117,0.04807399313332188,68,59,8,1
It’s a souvenir from Earth”.,1.1470588235294117,0.052441304127157654,68,60,6,2
The hookups are better on Venus.,1.1470588235294117,0.052441304127157654,68,60,6,2
What kind of gas mileage do you guys get?,1.1470588235294117,0.04326808584867506,68,58,10,0
Amazon delivery is out of this world,1.1470588235294117,0.04807399313332188,68,59,8,1
Is that KOA AOK?,1.1470588235294117,0.04326808584867506,68,58,10,0
They've got two new guys on our tail.,1.1470588235294117,0.04807399313332188,68,59,8,1
We have the kids this vacation.,1.1470588235294117,0.04326808584867506,68,58,10,0
It’s E.T.  He’s run away to Earth again. Will you help us find him?,1.1470588235294117,0.04807399313332188,68,59,8,1
How many light years to the nearest powering station?,1.1470588235294117,0.04807399313332188,68,59,8,1
"Sure it’s spacious, but how many light-years a gallon does it get",1.1470588235294117,0.04807399313332188,68,59,8,1
"Cool retro fit, man",1.1470588235294117,0.04326808584867506,68,58,10,0
"Yes, it's slower but we love it when we have a long line of cars behind us going up a hill.",1.1466666666666667,0.041125312050989835,75,64,11,0
That junk don't float my boat.,1.1466666666666667,0.0452951614596046,75,65,9,1
Of course I can swim!  I'm more worried about getting down from this chair!,1.1466666666666667,0.0452951614596046,75,65,9,1
I told you wouldn’t need a/c here.,1.1466666666666667,0.0452951614596046,75,65,9,1
"Sure, yours be better on gas, but up here we don’t have to sell our souls to afford it. Plus, it has a built in mini fridge in the back.",1.1466666666666667,0.0452951614596046,75,65,9,1
Now children don't hurt the earthlings.,1.1466666666666667,0.04911223892281852,75,66,7,2
Can you direct us to the nearest Walmart?,1.1466666666666667,0.0452951614596046,75,65,9,1
"I think they're getting a bit carried away with this ""Open Road"" thing",1.1466666666666667,0.0452951614596046,75,65,9,1
Talk about a gas giant!,1.1466666666666667,0.04911223892281852,75,66,7,2
What if nobody blinks first?,1.1466666666666667,0.0452951614596046,75,65,9,1
Looks like someone got the new Winne-ufo.,1.1466666666666667,0.0452951614596046,75,65,9,1
We got tired of abducting people.,1.1466666666666667,0.04911223892281852,75,66,7,2
We shoulda taken a left at Alpha Centauri.,1.1466666666666667,0.04911223892281852,75,66,7,2
"yeah yeah its cute Verne, but there's not much space� in that thing.",1.1466666666666667,0.04911223892281852,75,66,7,2
Gotta love Waze!,1.1466666666666667,0.0452951614596046,75,65,9,1
We are making the most of zero gravity.,1.146341463414634,0.04293490384215413,82,71,10,1
Are you worried about the gas mileage?,1.146341463414634,0.04630896338925494,82,72,8,2
Might want to fly under boarder patrol.,1.146341463414634,0.04293490384215413,82,71,10,1
Walmart parking lot?  Second star on the left and straight on til morning.,1.146341463414634,0.04630896338925494,82,72,8,2
"Oh yeah? Well, we have unlimited miles!",1.146341463414634,0.04293490384215413,82,71,10,1
"It’s like Van Life, but with a bathroom!",1.146341463414634,0.04630896338925494,82,72,8,2
"Jesse.....I told you not to take the highway""
(Breaking bad reference intended",1.146341463414634,0.04293490384215413,82,71,10,1
"Atleast try to assimilate, Johnny_256!",1.146067415730337,0.03764845249025972,89,76,13,0
Ufologists deserve a vacation from flying saucers.,1.146067415730337,0.040899493760002945,89,77,11,1
This motherfucker…,1.1454545454545455,0.05454545454545452,55,48,6,1
How many cases of fermented barley drinks can the chilling closet hold?,1.1454545454545455,0.0604037025766709,55,49,4,2
You won’t find any RV parks where you are going,1.1454545454545455,0.04797713974560772,55,47,8,0
"Sure, the gas costs a lot, but the air miles are worth it.",1.1451612903225807,0.050626817657001666,62,54,7,1
"Yeah, the cost of fuel is outrageous, but there's lots more room and it smells like bacon and eggs.",1.1451612903225807,0.050626817657001666,62,54,7,1
Guess the chip shortage is more widespread than we thought.,1.1451612903225807,0.04510270431252087,62,53,9,0
The Drexin7Z's always have to one up us!,1.1451612903225807,0.050626817657001666,62,54,7,1
Taking a stellar vacation.  Venus has plenty of fuel.,1.1451612903225807,0.05560481450241429,62,55,5,2
The only dump station we know of around here is about halfway between Venus and Mars.,1.1451612903225807,0.05560481450241429,62,55,5,2
Any extra fuel? The gas station on Uranus was too busy.,1.1451612903225807,0.04510270431252087,62,53,9,0
It looked cooler on Tiktok.,1.1451612903225807,0.05560481450241429,62,55,5,2
Final frontier? We will if we can’t find the campground!,1.1451612903225807,0.05560481450241429,62,55,5,2
"Hey, we've traded our ship for this retro 1966 Winnebago 'Brave' .",1.1451612903225807,0.04510270431252087,62,53,9,0
I left my license at home I swear!,1.1451612903225807,0.05560481450241429,62,55,5,2
"So, what kinda mileage you guys get outa that?",1.1451612903225807,0.05560481450241429,62,55,5,2
"No, there are no campsites on Mars. Who told you that?",1.1451612903225807,0.050626817657001666,62,54,7,1
"Hang a left at the bend and it’ll be down on your right, you can’t miss it.",1.144927536231884,0.04742006474057418,69,60,8,1
"Look, we know it doesn't go fast or have a nifty shape, but it does have both input and output rooms.",1.144927536231884,0.04742006474057418,69,60,8,1
Curfew is midnight; you're grounded.,1.144927536231884,0.05171962876419153,69,61,6,2
Never wanted one.  The mileage is horrible.,1.144927536231884,0.04742006474057418,69,60,8,1
Having a bathroom onboard meant a lot of sense.,1.144927536231884,0.04742006474057418,69,60,8,1
We camped in New Jersey. Fuhgeddaboudit it.,1.144927536231884,0.04742006474057418,69,60,8,1
It's going to cost you a fortune in gas.,1.144927536231884,0.05171962876419153,69,61,6,2
Remember that planet killing asteroid you passed. Hope you have vacation insurance.,1.144927536231884,0.05171962876419153,69,61,6,2
Yes we know its very 50’s ……. But.,1.144927536231884,0.04268963668731212,69,59,10,0
"Yeah, but the humans just run right in!",1.144927536231884,0.04742006474057418,69,60,8,1
Did you abbreviate when you entered Methodist space lab,1.144927536231884,0.04742006474057418,69,60,8,1
We’re keeping the rubber side down and the bugs off the glass!,1.144927536231884,0.04742006474057418,69,60,8,1
"It’s roomier than a saucer, but the gas prices are killing us.",1.144927536231884,0.04742006474057418,69,60,8,1
Are you coming from or going to Skinwalker Ranch?,1.144927536231884,0.055688216518499936,69,62,4,3
"It's retro, sleeps eight and has a kick-ass warranty.",1.144927536231884,0.04742006474057418,69,60,8,1
The downside is it only gets half a lightyear per gallon.,1.144927536231884,0.04742006474057418,69,60,8,1
"You‘ve seen Breaking Bad, right?",1.144927536231884,0.055688216518499936,69,62,4,3
Sure it's roomier. But just try to park it on a residential street.,1.144736842105263,0.04473684210526319,76,66,9,1
Wait!  You've gone a gazillion bajillion miles in R.V. and never actually been to Earth?!  Hilarious!,1.144736842105263,0.04850012612904946,76,67,7,2
It’s called an RV. It’s the only way to get around the planets.,1.144736842105263,0.04473684210526319,76,66,9,1
"Sure, it’s cool looking but there’s no room for a good old-fashioned anal probe.",1.144736842105263,0.04473684210526319,76,66,9,1
"3.767 x 10 to the 22nd power interstellar, 16 city.",1.144736842105263,0.05199172460609632,76,68,5,3
"After passing the moon, we got lost.",1.144736842105263,0.04473684210526319,76,66,9,1
I knew we should’ve taken a left in Albuquerque.,1.144736842105263,0.04473684210526319,76,66,9,1
Meet you on Mars!,1.144736842105263,0.04850012612904946,76,67,7,2
"We drive from Walmart to Walmart. Henry plays his guitar and sings about Mike Lindell and Admiralty Law, and I blow truckers until I get enough cash for a bottle of Wild Turkey. Then we get shitface drunk. It's pretty tight.",1.144736842105263,0.04850012612904946,76,67,7,2
The gas prices down there are out of this world!,1.144736842105263,0.04473684210526319,76,66,9,1
We never go there without our own bathroom.,1.144736842105263,0.040626442725997976,76,65,11,0
"A Winnebago!”
“You won a bagel?!",1.144736842105263,0.040626442725997976,76,65,11,0
"Officer, we’re starting our vacation so we were merely doing “escape velocity”.",1.144736842105263,0.04473684210526319,76,66,9,1
What are you doing after the Big Bang?,1.144736842105263,0.040626442725997976,76,65,11,0
"I told you, I’m flooring it!",1.144736842105263,0.04473684210526319,76,66,9,1
Any trailer park around here?,1.144736842105263,0.04473684210526319,76,66,9,1
"Yeah, we said we’re good with just the ion propulsion drive, but they insisted the tires come standard, then charged us 150 blarkles…PER TIRE! You can imagine how Jerry’s already overly buggy eyes burst straight out of his bulbous skull.",1.144578313253012,0.051804153562474094,83,75,4,4
I wonder how they fit a shower in there?,1.144578313253012,0.04578158588104717,83,73,8,2
We retired so we traded in the saucer to travel more.,1.144578313253012,0.04245109239481769,83,72,10,1
"It’s great, no more holding it for lightyears",1.144578313253012,0.04245109239481769,83,72,10,1
We found it at a gas station.,1.144578313253012,0.04245109239481769,83,72,10,1
Did you check anything off your bucket list?,1.144578313253012,0.04245109239481769,83,72,10,1
Star War 11 or some shit I don’t fucking know,1.144578313253012,0.04578158588104717,83,73,8,2
Hope in! It sleeps four!,1.1444444444444444,0.04623424889153682,90,80,7,3
"Yes, saucers are cheap to run. But the repair costs get you every time something breaks.",1.1428571428571428,0.04444078691701825,63,54,9,0
"It's a 1993 'Sunshine Adventure'.   Before we got it, we were just another 'unidentified flying object'.",1.1428571428571428,0.05362551382353918,56,49,6,1
These out-of-galaxy plates are drawing a crowd.,1.1428571428571428,0.04678356086900139,70,61,8,1
Humans call it a RV. It seats many more than just two.,1.1428571428571428,0.04575090108716776,91,81,7,3
Ungainly but roomy.  Do you have beds in that saucer?  Kitchen sink?  Bathroom?,1.1428571428571428,0.047184161362558326,56,48,8,0
I bought the porta-potties. Did you bring the tent?,1.1428571428571428,0.04986999410368029,63,55,7,1
Is it Really the Jepson's?,1.1428571428571428,0.04678356086900139,70,61,8,1
It’s an all stop!,1.1428571428571428,0.05925438255602432,63,57,3,3
I musta made a wrong turn at Albequerque!,1.1428571428571428,0.04790300390810151,77,68,7,2
"Wow,you guys going back a few Millenia? Nice retrofit.",1.1428571428571428,0.04419201606355329,77,67,9,1
The Grand Canyon? I think you missed your turn a while back.,1.1428571428571428,0.05476357440852809,63,56,5,2
With gas prices they way they are??,1.1428571428571428,0.045266017894605576,84,74,8,2
Have you seen Ms. Frizzle,1.1428571428571428,0.0421262731871135,70,60,10,0
Vanlife!  It's all the rage!,1.1428571428571428,0.04013939192492975,77,66,11,0
RV World. Just take a left at Saturn.,1.1428571428571428,0.05476357440852809,63,56,5,2
"The mileage stinks, but there's room to probe nine",1.1428571428571428,0.04678356086900139,70,61,8,1
It has all your creature comforts but it's a bear to park.,1.1428571428571428,0.0421262731871135,70,60,10,0
Don't stop at the 3rd planet. They shoot everything in sight and the price of gas is out of this world.,1.1428571428571428,0.04986999410368029,63,55,7,1
You always space out when it's your turn to drive.,1.1428571428571428,0.05925438255602432,63,57,3,3
Now isn’t strange- driving an RV in space,1.1428571428571428,0.04986999410368029,63,55,7,1
"Glip trob blorp, hapk foob luplup!",1.1428571428571428,0.04678356086900139,70,61,8,1
"I guess they don't fully understand their ""threshold guardian"" role.",1.1428571428571428,0.05925438255602432,63,57,3,3
"Pardon me,but we have the right of way.",1.1428571428571428,0.045266017894605576,84,74,8,2
It comes with a fully fitted kitchen but the only abductee recipes we've found are for a chef salad and a shepherd's pie.,1.1428571428571428,0.04013939192492975,77,66,11,0
Win BOTH of these with the best caption!,1.1428571428571428,0.04678356086900139,70,61,8,1
Bingo! Winnebago!,1.1428571428571428,0.04419201606355329,77,67,9,1
Don't go that way! The life forms in that little blue-green planet are freaks....,1.1428571428571428,0.0421262731871135,70,60,10,0
We lost our GPS. Which way to I-95,1.1428571428571428,0.05362551382353918,56,49,6,1
"Just straight ahead. Your great, great, grand children will arrive in 89 light years.",1.1428571428571428,0.0421262731871135,70,60,10,0
"We made the right decision--once we hit Earth, this camper will be more practical!""",1.1428571428571428,0.05476357440852809,63,56,5,2
Play to win,1.1428571428571428,0.05134648267484176,77,69,5,3
"Aerodynamically speaking,you haven’t stepped up to the challenge.",1.1428571428571428,0.04013939192492975,77,66,11,0
"Milky way to the left, Mars bar to the right, but the Galaxy? We just ate the last one.",1.1428571428571428,0.04299935704272291,91,80,9,2
Oh @#$&! Space balls.,1.1428571428571428,0.04790300390810151,77,68,7,2
"Look honey, it's those weirdos again!",1.1428571428571428,0.047184161362558326,56,48,8,0
We Just Retired!,1.1428571428571428,0.05492594029673081,70,63,4,3
We’re on our way to a Mel Brooks convention.,1.1428571428571428,0.0421262731871135,70,60,10,0
Is any space left in the parking lot?,1.1428571428571428,0.04790300390810151,77,68,7,2
Are we in their space or they in ours ?,1.1428571428571428,0.04790300390810151,77,68,7,2
Ours is much more spacious.,1.1428571428571428,0.04678356086900139,70,61,8,1
"Oh, look, Marv, that nice young couple next door got a new Tesla!",1.1428571428571428,0.04678356086900139,70,61,8,1
"For once, I don’t have to hear about infrastructure stuff.",1.1428571428571428,0.04678356086900139,70,61,8,1
Maintenance is a snap. Just turned 4 trillion miles on one set of tires and still using the original air filter.,1.1428571428571428,0.04444078691701825,63,54,9,0
"Officer, how fast were we going?",1.1428571428571428,0.0421262731871135,70,60,10,0
Watch our video how an RV is light-years better than a flying saucer!,1.1428571428571428,0.05492594029673081,70,63,4,3
What are the chances of bumping into them here!,1.1428571428571428,0.04678356086900139,70,61,8,1
"No matter where we go, tourists everywhere!",1.1428571428571428,0.04678356086900139,70,61,8,1
Have you not seen a retro cartoon caption.,1.1428571428571428,0.04444078691701825,63,54,9,0
We're trying the whole downshifting thing.,1.1428571428571428,0.04790300390810151,77,68,7,2
"""Is there a Walmart nearby where we can park this thing overnight?",1.1428571428571428,0.0421262731871135,70,60,10,0
It doesn’t handle warp speed very well.,1.1428571428571428,0.04419201606355329,77,67,9,1
Looks like the Wilsons bought into the covid RV craze,1.1428571428571428,0.04444078691701825,63,54,9,0
Looks like this boondocking spot has become too popular!,1.1428571428571428,0.04419201606355329,77,67,9,1
Merry Christmas! Sh*tter was full!,1.1428571428571428,0.05492594029673081,70,63,4,3
Seriously! No passing on the right already!,1.1428571428571428,0.04986999410368029,63,55,7,1
We got this RV from some folks on earth that realized the remote life didn’t work for them with a looming recession. We thought it was really an out of this world deal.,1.1428571428571428,0.04444078691701825,63,54,9,0
"When they said Keeping up with the Jones’s , I didn’t think they mean all the way to the next galaxy",1.1428571428571428,0.04986999410368029,63,55,7,1
Space.... To boldly go where no one has gone before in a camper van (but Geoff Bezos beat you to it in a rocket shaped like a sausage),1.1428571428571428,0.047184161362558326,56,48,8,0
You're not going to get very far in that thing,1.1428571428571428,0.0421262731871135,70,60,10,0
We're trying to hit as many Galactic Parks as we can this summer.,1.141304347826087,0.04527751066040476,92,82,7,3
We’ve got to stop meeting like this!,1.1411764705882352,0.04151521329086001,85,74,10,1
Kids these days...,1.1411764705882352,0.04151521329086001,85,74,10,1
"We wanted to bring
the kids along.",1.1411764705882352,0.03799211615279771,85,73,12,0
We saw the price of gasoline at planet Earth and kept driving.,1.141025641025641,0.04366020435906118,78,68,9,1
Have you seen the road?,1.141025641025641,0.047320331546548966,78,69,7,2
We love retirement.,1.141025641025641,0.03966375060019729,78,67,11,0
But do you know of any routes that avoid Earth?,1.141025641025641,0.04366020435906118,78,68,9,1
Have you passed by any gaseous plants in your travels?”,1.141025641025641,0.04366020435906118,78,68,9,1
What kind of gas mileage do you get on that thing?,1.141025641025641,0.04366020435906118,78,68,9,1
How much did you pay for that GPS?,1.141025641025641,0.04366020435906118,78,68,9,1
Frankie's Used Cars gave us an offer we couldn't refuse.,1.141025641025641,0.047320331546548966,78,69,7,2
"Sorry, you need to store that thing behind Pluto!",1.141025641025641,0.047320331546548966,78,69,7,2
How’s parking back there?,1.141025641025641,0.04366020435906118,78,68,9,1
"It’s roomy, but these higher gas prices are killing us.",1.141025641025641,0.04366020435906118,78,68,9,1
Mind if we probe you for directions?,1.1408450704225352,0.046163800079517044,71,62,8,1
We have the same space for parking?,1.1408450704225352,0.05033399372892188,71,63,6,2
O The Jone’s,1.1408450704225352,0.046163800079517044,71,62,8,1
It's cool but it's no orbiting Tesla Roadster.,1.1408450704225352,0.046163800079517044,71,62,8,1
R U AN RV 2?,1.1408450704225352,0.05033399372892188,71,63,6,2
Ours is the more environmentally friendly,1.1408450704225352,0.05418418045541222,71,64,4,3
"Kids,get in here.  You're ruining your father's fantasy camp.",1.1408450704225352,0.04157742116654289,71,61,10,0
Hope they bought the extended warranty.,1.1408450704225352,0.05033399372892188,71,63,6,2
The new models are out already?,1.1408450704225352,0.05033399372892188,71,63,6,2
"your vehicle is not in compliance
with the ""Aerodynamically Correct Statute"".",1.1408450704225352,0.05033399372892188,71,63,6,2
"Oh, Earth? We were there last year. Surprised to hear it’s still open. Badly in need of a remodel, if you ask us!",1.1408450704225352,0.05033399372892188,71,63,6,2
These gas prices are actually out of this world...,1.1408450704225352,0.05418418045541222,71,64,4,3
"We’re working remote while traveling, so we just needed more space",1.1408450704225352,0.046163800079517044,71,62,8,1
"Sorry we’re late; Ronald’s refusal to ask for directions led us not down the Milky, but rather the Wrong Way.",1.1408450704225352,0.046163800079517044,71,62,8,1
The emperor heard you have that good blue meth…,1.1408450704225352,0.046163800079517044,71,62,8,1
"For leisure, they recommended an identified flying object.",1.140625,0.043797805514170944,64,55,9,0
"Buddy, fuel prices are out of this world, everywhere.",1.140625,0.04913531839612815,64,56,7,1
We're taking the kids to Space Camp.,1.140625,0.04913531839612815,64,56,7,1
I bet they mock us every time they fill up.,1.140625,0.043797805514170944,64,55,9,0
"Saucer's good for taking off a weekend, but space is our priority.",1.140625,0.04913531839612815,64,56,7,1
I hear they outsource production to the Orion-Spur,1.140625,0.043797805514170944,64,55,9,0
Oh crap... I called in sick this week.,1.140625,0.04913531839612815,64,56,7,1
"I'm sorry sir, your drive train is only covered up to one hundred thousand orbits.",1.140625,0.04913531839612815,64,56,7,1
"You've already taken Earth? Well, I guess we have to find another planet to invade.",1.140625,0.043797805514170944,64,55,9,0
"Can you please tell us, how far to Roswell?",1.140625,0.053947300765845876,64,57,5,2
"Oh look, it’s our next door neighbors!",1.140625,0.04913531839612815,64,56,7,1
"Hi, ...., Bye",1.140625,0.04913531839612815,64,56,7,1
To Earth.  Where are you headed?,1.140625,0.053947300765845876,64,57,5,2
I've always wanted to travel the galaxy in one of those,1.140625,0.053947300765845876,64,57,5,2
"We got lost in city traffic, can you direct us to Hoboken???",1.140625,0.053947300765845876,64,57,5,2
"ah! They seem to have solved the space problem, but isn’t there a lot of drag",1.140625,0.043797805514170944,64,55,9,0
Police checkpoint ahead mate,1.140625,0.04913531839612815,64,56,7,1
I doubt theirs has a tractor-trailer beam.,1.1403508771929824,0.05837501102181511,57,51,4,2
It's a classic.,1.1403508771929824,0.05837501102181511,57,51,4,2
Traffic even up here!,1.1403508771929824,0.046416689667799826,57,49,8,0
The thing about suburbanites is they all look exactly the same.”,1.1403508771929824,0.046416689667799826,57,49,8,0
Driving that guzzler with the price of plutonium at the pump these days?,1.1403508771929824,0.05273590328947571,57,50,6,1
Do you really want to know where we got this?,1.1403508771929824,0.05273590328947571,57,50,6,1
"Oh sure, it gets 70 light years to a gallon but can it sleep five Martians.",1.1403508771929824,0.046416689667799826,57,49,8,0
It’s not as bad as you might think. 26 meters-per-second-delta-V per gallon.,1.1397849462365592,0.03615262258846411,93,80,13,0
Can we hitch a ride?,1.1395348837209303,0.04426876841626457,86,76,8,2
Grounded for handing in the perfect resume to our HOA!,1.1395348837209303,0.041062465170461374,86,75,10,1
Love your retro spaceship.  How many galaxies per fill up do you get?,1.1395348837209303,0.04426876841626457,86,76,8,2
