caption,mean,precision,votes,not_funny,somewhat_funny,funny
The mileage isn't as good but it's a lot roomier for those long trips.,1.2526315789473683,0.04725006989129985,95,72,22,1
Told u we had to turn left,1.2526315789473683,0.05177352060850881,95,74,18,3
The gas prices are too high to settle down there.,1.2525252525252526,0.05044316967661914,99,77,19,3
You just missed it; it's about 2 parsecs that way.,1.2525252525252526,0.05244670085248555,99,78,17,4
"M-111 is blocked, don't take this exit!",1.2524271844660195,0.04920546440572204,103,80,20,3
Y'all should check out Florida.,1.2524271844660195,0.0547017363040833,103,83,14,6
"Sorry, the next rest stop is a little more than 250 million light years ahead.",1.2523364485981308,0.048050438482101374,107,83,21,3
Makes me miss our Astrovan”,1.2521739130434784,0.04758625114860668,115,90,21,4
"I’m not gonna say “yes I told you so”, but we definitely made a wrong turn.",1.25,0.05421135926495693,88,69,16,3
We're time travelling,1.25,0.057051707044017595,92,74,13,5
It's roomy but only gets 5 light years per gallon.,1.25,0.06176207566630455,72,57,12,3
Gas prices are out of this world.,1.25,0.05836508438405426,84,67,13,4
We’ve got take out in the back.,1.25,0.0468292905790847,96,73,22,1
"''Their television commercials are very convincing.""",1.25,0.05764360164082898,80,63,14,3
Win a what?,1.25,0.052698331948532,92,72,17,3
Earth is haveing a yard sale,1.25,0.05764360164082898,80,63,14,3
Is there a place around here to eat with a nice atmosphere?,1.25,0.06247806632675042,76,61,11,4
"We traded with an earthling !
He said we would be the coolest aliens in the galaxy !",1.25,0.051745902770176135,88,68,18,2
"Miles per gallon is a bear, though",1.25,0.05836508438405426,84,67,13,4
"Only 3x10(-12) light years per gallon, but we save so much on meals and hotel rooms",1.25,0.06289432567832845,80,65,10,5
"Look at us we're boomers spending our kids inheritance, hurr durr. Hahaha.",1.25,0.05319619424788554,116,95,13,8
Gets infinite miles per gallon,1.25,0.052477812801650835,104,83,16,5
We're up to 258 planets and 47 states.,1.25,0.05585357054399395,84,66,15,3
"Yes, he was too stubborn to ask for directions.",1.25,0.060326117945124845,80,64,12,4
"Sure, it gets better fuel economy, but does it sleep four?",1.25,0.0519809599951771,100,79,17,4
We've started to appreciate the journey as much as the destination.,1.25,0.050667685353280145,104,82,18,4
I told you not to take the Alpha Centauri route - we're going to get stuck behind one of those damn RVs again!,1.25,0.05339360629309896,96,76,16,4
Don't you just hate it when some yahoo drives one of those things in the left lane?,1.25,0.051745902770176135,88,68,18,2
Who has the right-of-way?,1.25,0.050667685353280145,104,82,18,4
How many parsecs to the gallon to you get with that?,1.25,0.060326117945124845,80,64,12,4
"Damn campers, clogging up the galaxy.",1.25,0.0674865446869524,68,55,9,4
I couldn’t care LESS about aero-effing-dynamics!,1.25,0.05339360629309896,96,76,16,4
You're telling me. Gas prices are out of this world!,1.25,0.05836508438405426,84,67,13,4
We come from Winnebago. We come in peace.,1.25,0.056569466085583144,88,70,14,4
What kind of mileage are you getting?,1.25,0.053889149223571936,100,80,15,5
We thought we could catch the game without arousing suspicion if we arrived in this.,1.25,0.0519809599951771,100,79,17,4
"Hello, this is roadside assistance, how can we help you?",1.25,0.06536170054958926,80,66,8,6
It's great...We were really getting tired of the commute!,1.25,0.051298917604257706,96,75,18,3
"It doesn't get great mileage, but you should see the kitchen!",1.25,0.053889149223571936,100,80,15,5
It has a cassette player!,1.25,0.056569466085583144,88,70,14,4
"So I said to Frank, ‘How about I pick the where and you pick the way.’",1.25,0.04944307347557363,108,85,19,4
Same space different design guidelines.,1.25,0.05585357054399395,84,66,15,3
I said we should have made an effort to blend in more.,1.25,0.04683803309583763,104,80,22,2
It came with three earthlings in the back!,1.25,0.051745902770176135,88,68,18,2
The Earth? I don't know. It was here when we visited last summer.,1.25,0.05339360629309896,96,76,16,4
"Watch where you’re going, ya space hog!",1.25,0.060326117945124845,80,64,12,4
"Hey, if you are looking for a place to camp, you have to turn back about 5000 light years, then look for a campground. Hopefully they are still open.",1.25,0.053889149223571936,100,80,15,5
How many Light Years a gallon?,1.25,0.044843500208385956,112,86,24,2
I think we're not in Kansas anymore.,1.25,0.0519809599951771,100,79,17,4
"Look Mom, Aliens!",1.25,0.056569466085583144,88,70,14,4
"Yeah, well we like our creature comforts.",1.25,0.05045689127585228,84,64,19,1
It supposedly sleeps six but that must be if at least two are larva.,1.25,0.05422755142758354,104,84,14,6
What are they doing in our Compact Only parking spot?,1.25,0.05836508438405426,84,67,13,4
The space in here is out of this world.,1.25,0.0519809599951771,100,79,17,4
We get 32 parasecs to the gallon on this baby.,1.25,0.05322367527583983,84,65,17,2
"Whatever you do, don’t stop for gas in California.",1.25,0.059108280467932546,92,75,11,6
Why did we have to run into them while we’re driving this stupid loaner?,1.25,0.055409163850364054,96,77,14,5
"I said 5073, not 1973!",1.25,0.0519809599951771,100,79,17,4
"Yeah, we saw the same thing. You thinkin' dark matter?",1.25,0.05836508438405426,84,67,13,4
"Way better mileage up here, dude.",1.25,0.05483000195079379,80,62,16,2
"„This old thing? We got it from this planets 
‚everything must go sale‘""",1.25,0.057051707044017595,92,74,13,5
It was the best thing they had.,1.25,0.049156946952051576,88,67,20,1
Just head north for about 94 million miles. If you incinerate you’ve gone too far.,1.25,0.0588331327829961,88,71,12,5
"Don’t worry honey, they’re empty nesters",1.25,0.05960395606792697,76,60,13,3
Flying saucer  right of way,1.247787610619469,0.04954115225390569,113,90,18,5
"Yes, it's more comfortable, but the cost of gas is killing us.",1.2477064220183487,0.04904103024434217,109,86,19,4
NASA hired us to look for UFOs.,1.2477064220183487,0.04727714016434343,109,85,21,3
We traded the old heap in at someplace called Area 54--this thing's got an on-board toilet!!,1.2477064220183487,0.04904103024434217,109,86,19,4
"I told you there was a better way to go""",1.2477064220183487,0.04544483817565494,109,84,23,2
Dealer said it’s designed for off roading.,1.2476190476190476,0.05203012719286361,105,84,16,5
"Yes, it's roomy, but the mileage is terrible!",1.2475247524752475,0.04956432083478743,101,79,19,3
"Gas mileage is so so but, there's lots of room for packing in abductees .",1.2475247524752475,0.05341031270994525,101,81,15,5
He stole our Tesla to manufacture it at a profit,1.2475247524752475,0.05152321517329776,101,80,17,4
Yes they are spacious  but they use so many resources,1.2475247524752475,0.04956432083478743,101,79,19,3
YOU’RE GOING THE WRONG WAY!,1.2475247524752475,0.05341031270994525,101,81,15,5
I hope this one's electric.,1.2475247524752475,0.05523297299398555,101,82,13,6
We're going on a revolution.,1.2475247524752475,0.05152321517329776,101,80,17,4
"Hey, why did you leave earth?
Because I need some space!",1.2475247524752475,0.05152321517329776,101,80,17,4
"Wow, I’ve heard about those classic space ships but have never seen on before.",1.2475247524752475,0.04956432083478743,101,79,19,3
These teens drive around like there's no end of space.,1.2475247524752475,0.05341031270994525,101,81,15,5
"I wouldn’t bother going if I were you, Pluto is a much nicer spot",1.2475247524752475,0.05341031270994525,101,81,15,5
Do you think they’re traveling to find abortion care too?,1.2475247524752475,0.060371687997727304,101,85,7,9
You’ll never believe where we came from.,1.2474226804123711,0.05290310762316375,97,77,16,4
Did you just see that big yellow schoolbus too?,1.2474226804123711,0.05083268794669077,97,76,18,3
How many parsecs per gallon do you get?,1.2474226804123711,0.05083268794669077,97,76,18,3
You gotta try one.  Humans know how to have fun!,1.2474226804123711,0.054895495520948266,97,78,14,5
"Don't bother visiting plant Earth.  Intelligent life is in serious decline there.""",1.2474226804123711,0.054895495520948266,97,78,14,5
Didn’t the Simons say they were out of town??!,1.2474226804123711,0.05290310762316375,97,77,16,4
These aliennials thinking they are so trendy with their “vintage” space craft,1.2474226804123711,0.05867766775439582,97,80,10,7
"Get out of the left lane, shit head!",1.2473118279569892,0.04990855119700494,93,72,19,2
"I know, I know. I told him he should have taken a left turn at Albuquerque!",1.2473118279569892,0.05439091527063355,93,74,15,4
"Oh great,it's the Scooby-Doo gang.",1.2473118279569892,0.052197869432388244,93,73,17,3
"They've been on our bumper for 30 parsecs, pull over and let them pass.",1.2473118279569892,0.05439091527063355,93,74,15,4
I  THINK WE MISSED THE LAST TURN!,1.2473118279569892,0.04990855119700494,93,72,19,2
You don’t seem like your from around here,1.2473118279569892,0.052197869432388244,93,73,17,3
You two can’t afford home prices either?,1.2473118279569892,0.05439091527063355,93,74,15,4
"This RV looks slow, but it can go 0-60 light-years in 3.5 seconds.",1.247191011235955,0.05600073616090189,89,71,14,4
"Oh, it's you two AND your gas guzzler!",1.247191011235955,0.05600073616090189,89,71,14,4
Who has the right of way here?,1.247191011235955,0.05600073616090189,89,71,14,4
You missed the turn 4 light years back.,1.247191011235955,0.05823611478692686,89,72,12,5
The hipsters are out of this world these days.,1.247191011235955,0.05600073616090189,89,71,14,4
Actually it gets pretty good lightyearage.,1.2470588235294118,0.05527086941984991,85,67,15,3
"OMG, those are aliens!",1.2470588235294118,0.05527086941984991,85,67,15,3
keep a lookout for sea glass.,1.2470588235294118,0.060125644246543875,85,69,11,5
We decided Earth is more of a day-trip planet.,1.2470588235294118,0.05267596189542411,85,66,17,2
For heaven's sake - another instance of cosmic road rage!,1.2470588235294118,0.06674900171924472,85,72,5,8
"Wow, a model T",1.2470588235294118,0.05527086941984991,85,67,15,3
How many miles per gallon are you getting?,1.2469135802469136,0.05423674725058963,81,63,16,2
"Honestly, it gets better mileage than you'd think.",1.2469135802469136,0.06218963481361076,81,66,10,5
Ugh! The old flying saucer design. I thought went out with hula hoops!,1.2469135802469136,0.0570111105630559,81,64,14,3
We're headed for Las Vegas. You?,1.2469135802469136,0.05965658976962751,81,65,12,4
3086 called. It wants its flying saucer back,1.2469135802469136,0.05423674725058963,81,63,16,2
Andromeda?  Two light years.  Left at the light.,1.2467532467532467,0.05891431779020231,77,61,13,3
We’d suggest skipping the third planet from the sun. That place is crazy.,1.2467532467532467,0.06445482014559827,77,63,9,5
"We forgot our death rays. Also, the burger buns.",1.2467532467532467,0.05891431779020231,77,61,13,3
I'm guessing they are from Wisconsin.,1.2465753424657535,0.06695378218545742,73,60,8,5
I really just got into the van life,1.2465753424657535,0.0640491330552764,73,59,10,4
They're retrograde.,1.2463768115942029,0.06331896380302154,69,55,11,3
"Once the kids moved out, Bob and I decided let’s just go for it.",1.2463768115942029,0.06331896380302154,69,55,11,3
It’s iconic but impractical.,1.2454545454545454,0.050330622710028694,110,88,17,5
Retirement is great! Nothing but open milkyways for the rest of our lightyears...,1.2454545454545454,0.050330622710028694,110,88,17,5
Beam over.  We have new pictures of our grandchildren.,1.2450980392156863,0.05293973839875468,102,82,15,5
"Hey,  Where'd you get that?",1.2448979591836735,0.05629194228866812,98,80,12,6
I'm telling you for the last time - Spaceballs wasn't real!,1.2448979591836735,0.0503746211842464,98,77,18,3
Terrible campsite.  Litter everywhere!,1.2448979591836735,0.0503746211842464,98,77,18,3
There is room to swing a thing called a cat.,1.2448979591836735,0.05242133053615801,98,78,16,4
"Sure the energy source is a dwindling finite material only found on one planet, but you should see how smooth it drives.",1.2448979591836735,0.05242133053615801,98,78,16,4
Don't you dare ask for directions.,1.2446808510638299,0.04944480181598743,94,73,19,2
If  this UAP's a rockin' don't come a knockin'!,1.2446808510638299,0.05990568774038176,94,78,9,7
We paid extra for the luxury model!,1.2446808510638299,0.04944480181598743,94,73,19,2
Didn’t we pass them ages ago?,1.2446808510638299,0.05170656656583808,94,74,17,3
Which way to Big Sky?,1.2446808510638299,0.04944480181598743,94,73,19,2
We reverse-engineered a 20th-century unidentified terrestrial craft.,1.2446808510638299,0.057964737765670564,94,77,11,6
Do y'all know where we can unload the shitter?,1.2446808510638299,0.057964737765670564,94,77,11,6
"Excuse me, but have you welcomed into your hearts and wallets our lord and savior, Elon Musk?",1.2446808510638299,0.0559565029718422,94,76,13,5
We have plenty of space here.,1.2444444444444445,0.05544308215259638,90,72,14,4
I heard that gas prices are sky high.,1.2444444444444445,0.05544308215259638,90,72,14,4
"It doesn't quite do the speed of light, but it sleeps four and will get you through most gravitational pulls and even some tractor beams.",1.2444444444444445,0.05544308215259638,90,72,14,4
"Looks weird, but at least we can take a dump in it.",1.2444444444444445,0.05544308215259638,90,72,14,4
How much are you paying for gas?,1.244186046511628,0.05469989386602394,86,68,15,3
"Can you direct us to Roswell, NM?",1.244186046511628,0.0521390504107696,86,67,17,2
It takes the alien out of the trip,1.244186046511628,0.049445755798847524,86,66,19,1
We thought that you were picking  up the replicants!,1.244186046511628,0.05469989386602394,86,68,15,3
"It's roomier, but the mileage isn't great.",1.244186046511628,0.049445755798847524,86,66,19,1
Why is it that we always reveal ourselves to a couple of pig farmers from  Arkansas?,1.244186046511628,0.05469989386602394,86,68,15,3
I heard that Barb and Jim got a loaner after they crashed in Roswell but I was envisioning a compact.,1.244186046511628,0.049445755798847524,86,66,19,1
"No no no, you should have made a left at Alpha Centauri B.",1.244186046511628,0.05469989386602394,86,68,15,3
"Sure. Go 112,773 million miles, and make a left""",1.2439024390243902,0.05900146627934212,82,66,12,4
The 2nd left after Neptune?,1.2439024390243902,0.05639201096662551,82,65,14,3
"Look, Bob. It’s Ted and Carol..",1.2439024390243902,0.053655799114426375,82,64,16,2
Our only regret is that we didn’t do this sooner.,1.2439024390243902,0.053655799114426375,82,64,16,2
it doesn't really fair as a space craft but we'll see,1.2439024390243902,0.05639201096662551,82,65,14,3
"Clearly, you two have never experienced space.",1.2435897435897436,0.05221021520794967,78,60,17,1
"No intelligent life there, but they do make a roomy and surprisingly affordable vehicle.",1.2435897435897436,0.06370171036998733,78,64,9,5
"I know gas prices are sky high, but this is out of this world.",1.2435897435897436,0.055307385628510335,78,61,15,2
We bought it pre-owned from the Area 51 lot.,1.2435897435897436,0.05824008274428433,78,62,13,3
"Well, that's the hybrid model but you really compromise on the bathroom and sleeping space.",1.2434782608695651,0.04877023818264036,115,92,18,5
This way we don't have to phone home.,1.2432432432432432,0.06326548497088139,74,60,10,4
"""Of all the gin joints, in all the Galaxies, in all the Universe, they cruise into ours.""",1.2432432432432432,0.06026846888427848,74,59,12,3
"Comfortable, but terrible on gas.""",1.2432432432432432,0.04825576177861834,111,88,19,4
Which way to Nomadland?,1.2432432432432432,0.0447327421161998,111,86,23,2
I told you not the dump our grey water back there.,1.2432432432432432,0.06612680875066024,74,61,8,5
"With the price of gas, they're practically giving them away.",1.2432432432432432,0.06612680875066024,74,61,8,5
"Since being aerodynamic isn't important, why travel in comfort?",1.2429906542056075,0.04758517314361994,107,84,20,3
Is this the Stairway to Heaven?,1.2429906542056075,0.0511568195807617,107,86,16,5
"I don't think the RV was our brightest purchase, especially since the gas prices in Uranus have skyrocketed lately",1.2429906542056075,0.052852208401104314,107,87,14,6
"We've found life, and it's a highway",1.2427184466019416,0.04871471870276674,103,81,19,3
Hey!  Get out of the fast lane!,1.2427184466019416,0.05063093152796277,103,82,17,4
How can they afford that on retirement income ??,1.2427184466019416,0.05247722016731465,103,83,15,5
"I thought RVs were for Earth not space.” Alison K. Burns, MASSACHUSETT",1.2427184466019416,0.054260722862752006,103,84,13,6
We’ve got the uncontrollable urge to take Route 66.,1.2424242424242424,0.05389566925536249,99,80,14,5
It's the Costanzas dammit!,1.2424242424242424,0.04992451339684328,99,78,18,3
We’re gonna make a space trip out of it and stop at Titus. We’ve heard wonderful things.,1.2424242424242424,0.05389566925536249,99,80,14,5
Now that's what I call space junk!,1.2424242424242424,0.05389566925536249,99,80,14,5
This is the last time we are picking you up!,1.2424242424242424,0.05389566925536249,99,80,14,5
"Hi, can you show me the way to the nearest gun-free zone please?",1.2424242424242424,0.05389566925536249,99,80,14,5
Horrible mileage but comfy at night!,1.2421052631578948,0.04664749386532822,95,73,21,1
"at the next light, take a left",1.2421052631578948,0.0554242306834273,95,77,13,5
"Yes, they're a primitive species, but this vehicle has a bathroom inside. We traveled hundreds of light years and never thought of that.",1.2421052631578948,0.05336554301341158,95,76,15,4
The family tasted like s’mores.,1.2421052631578948,0.05336554301341158,95,76,15,4
Dealer said driving one of these things would cost us right out of this world.,1.2417582417582418,0.061206149668001246,91,76,8,7
So that’s straight ahead two light years and then a sharp left just prior to the black hole?,1.2417582417582418,0.05917763524323631,91,75,10,6
We'll see what you're driving once you spawn a brood or two.,1.2417582417582418,0.054896193170210224,91,73,14,4
The mileage is not great. But there’s plenty of legroom.,1.2417582417582418,0.054896193170210224,91,73,14,4
Can we use your washroom?,1.2417582417582418,0.050251283925692364,91,71,18,2
"License and registration, sir",1.2417582417582418,0.050251283925692364,91,71,18,2
We have space issues,1.2417582417582418,0.054896193170210224,91,73,14,4
Gas prices don’t matter in space,1.2416666666666667,0.04878902350111492,120,97,17,6
Trust me.  You don't want to go there.,1.2413793103448276,0.05655511428673727,87,70,13,4
"Yeah, we thought we'd go native.",1.2413793103448276,0.05655511428673727,87,70,13,4
"Earth? Yeah, it’s the next right, but I should warn you—they don’t even treat their females like humans so God knows what they’ll do to us.",1.2413793103448276,0.05887095343501623,87,71,11,5
The leader of the Earthlings made abortion illegal. You'll be seeing a lot more boxes.,1.2413793103448276,0.05655511428673727,87,70,13,4
Quick. Hide the french fries.,1.2410714285714286,0.04952401448452785,112,90,17,5
Shatner gave us a deal.,1.2409638554216869,0.05578589650734455,83,66,14,3
We just got back from Earth.  Don't bother.,1.2409638554216869,0.053086795805151084,83,65,16,2
We've abandoned the extraterrestrial life for the Van Life.,1.2409638554216869,0.05836029994267084,83,67,12,4
Mom! Dad! Why are you here?  You're supposed to be on vacation!,1.2409638554216869,0.05836029994267084,83,67,12,4
"Gas is free up here, right?",1.2409638554216869,0.05578589650734455,83,66,14,3
Where we're going we do need roads.,1.2409638554216869,0.053086795805151084,83,65,16,2
We’re loving all this space.,1.2409638554216869,0.050242905256239485,83,64,18,1
Your constant movie references are getting old.,1.2409638554216869,0.05578589650734455,83,66,14,3
What kind of mileage do you get with that?,1.2407407407407407,0.048995394649344264,108,86,18,4
We rented it from Elon Musk.,1.240506329113924,0.05468979492327308,79,62,15,2
We traded in the old model for this baby at Area 51.,1.240506329113924,0.060333353614695454,79,64,11,4
Yellowstone was temporarily closed. Any other recommendations?,1.240506329113924,0.0575807573202435,79,63,13,3
A red Tesla just cut us off. Did you see which way it went?,1.240506329113924,0.060333353614695454,79,64,11,4
Mind giving us some space?,1.240506329113924,0.0575807573202435,79,63,13,3
We wanted something more spacious.,1.240506329113924,0.06296573276965015,79,65,9,5
Tell me again why you don’t like the gps?,1.240506329113924,0.06296573276965015,79,65,9,5
What exit do we take for the nearest Starbucks?,1.240506329113924,0.05468979492327308,79,62,15,2
Where is the nearest RV park?,1.2403846153846154,0.046327390305832834,104,81,21,2
"Excuse me, do you have any Grey Poupon?",1.24,0.06250045044882722,75,61,10,4
Could you help direct us to Area 51?,1.24,0.05315284776213995,75,58,16,1
They can't hear me honking can they.,1.24,0.05148305595538256,100,80,16,4
It’s an older model.,1.24,0.04948216697442473,100,79,18,3
This RV smells like Uranus.,1.24,0.05954784585479098,75,60,12,3
Your mission was to go where NO man has gone before.,1.24,0.06250045044882722,75,61,10,4
"It’s great on our long trips, but it’s really a gas guzzler.",1.24,0.0564409920676948,75,59,14,2
Earths that way. We turned around,1.24,0.04948216697442473,100,79,18,3
We're going where no man has gone before.,1.2395833333333333,0.046227867313713165,96,74,21,1
'They look familiar....',1.2395833333333333,0.05490180961343998,96,78,13,5
"OK, Boomers. Yield the right of way!",1.2395833333333333,0.05286691265069651,96,77,15,4
"I knew this would happen once we allowed ""space tourism.""",1.2395833333333333,0.05490180961343998,96,78,13,5
"Nice ride, but have you heard what earthlings are charging for gas?",1.2395833333333333,0.05490180961343998,96,78,13,5
You should have thought about that before you left the solar system.,1.2394366197183098,0.06171521774706097,71,57,11,3
Are there any National Parks up here?,1.2391304347826086,0.05651438814339234,92,75,12,5
Please pass the grey matter,1.2391304347826086,0.05211614894390477,92,73,16,3
"Yeah, we wanted to come back when we had more time...",1.2391304347826086,0.05858982514448541,92,76,10,6
See I told you they were following us .....,1.2391304347826086,0.05435976935181601,92,74,14,4
"Ours is a pop-up, to see the views",1.2391304347826086,0.05211614894390477,92,73,16,3
"Avoid the Northern Celestial Hemisphere, it's crowded with Taurus.",1.2391304347826086,0.05435976935181601,92,74,14,4
Do you think you could jumpstart us?,1.2391304347826086,0.05858982514448541,92,76,10,6
Don’t laugh until you’ve camped on Pluto.,1.2391304347826086,0.05858982514448541,92,76,10,6
Go back about half a light year and take the Intersteller 95 exit.,1.2391304347826086,0.049771492216969915,92,72,18,2
Sweet ride but the gas is killing us.,1.2388059701492538,0.06755252320668872,67,55,8,4
Any way we can get a jump?,1.2388059701492538,0.05662588885368121,67,52,14,1
Parking’s free at Walmart.,1.2386363636363635,0.05597599449516393,88,71,13,4
May we use your bathroom ?,1.2386363636363635,0.053591780525271915,88,70,15,3
We wanted to see Roswell without the paparazzi ruining our trip.,1.2386363636363635,0.06258602894643302,88,74,7,7
"We may be a flying object, but we won't be unidentified",1.2386363636363635,0.05826272375692998,88,72,11,5
We always empty ours on that blue planet,1.2386363636363635,0.06046303002190712,88,73,9,6
Look Marti! A vintage flying saucer!,1.2386363636363635,0.053591780525271915,88,70,15,3
They're more advanced than we thought-it's a car and a home!,1.2386363636363635,0.05597599449516393,88,71,13,4
"s 
“Look Marge!  It’s one of those old timey covered wagons!” “Ain’t that a hoot!”",1.2386363636363635,0.05826272375692998,88,72,11,5
"Oh look honey, the Walters must have gotten a souvenir when vacationing on the former planet Earth before it exploded in fossil fuels related climate disaster and societal meltdown- that RV is super cute though!",1.238532110091743,0.05197277471642225,109,89,14,6
Elon helped us launch this thing.,1.2380952380952381,0.05519237627642364,84,67,14,3
"Yes, w have a flush toilet.",1.2380952380952381,0.057732660874787296,84,68,12,4
Do you know of a good space to park around here?,1.2380952380952381,0.057732660874787296,84,68,12,4
"Excuse me, do you know where we can find a gas giant around here?",1.2380952380952381,0.060165786493056504,84,69,10,5
"If you can point us to gas and a motel I think we’ll stop for the night.  Oh, and can you point us to the night?",1.2380952380952381,0.057732660874787296,84,68,12,4
"Skylight's tiny, true, but the stereo rocks!",1.2380952380952381,0.049768345272611834,105,84,17,4
And it has a microwave!,1.2380952380952381,0.05252938859717925,84,66,16,2
It doesn’t look like the Taco Truck to me!,1.2380952380952381,0.057732660874787296,84,68,12,4
We did a swap with some Earthlings and they crashed it at Roswell.,1.2380952380952381,0.06475836107884288,84,71,6,7
"See, I told you UFOs were real.",1.2380952380952381,0.0533215580930853,105,86,13,6
"It's traveling through space, with space",1.2380952380952381,0.057732660874787296,84,68,12,4
You can't park here overnight.,1.2380952380952381,0.049768345272611834,105,84,17,4
That's as big as Uranus.,1.2376237623762376,0.0490473904019835,101,80,18,3
See that clunker?! Flying saucers are soooo 1947,1.2376237623762376,0.0490473904019835,101,80,18,3
"You don't just see the galaxy, you experience it!""",1.2375,0.059650219900493365,80,65,11,4
It’s a Whinney Bagel.,1.2375,0.05693586776342908,80,64,13,3
"Look, it's one of those tiny ships everybody is talking about. They have a bedroom and full kitchen in there.",1.2375,0.06473839762136747,80,67,7,6
