caption,mean,precision,votes,not_funny,somewhat_funny,funny
We don't recommend it yet. The only way we could leave was by taking this RV full of progressive voters from Texas.,1.1910112359550562,0.052701300672173365,89,76,9,4
"You haven't seen our son,  flying a bike by moonlight ...?",1.1904761904761905,0.05925438255602429,63,53,8,2
"Sure, they get better mileage. But I like to kick it old school. Or in this case, ancient school.",1.1904761904761905,0.049310188462709244,84,70,12,2
It’s not like global warming matters up here.,1.1904761904761905,0.04986999410368025,63,51,12,0
Head back five stars and take a left before you get to the Black Hole. It’s in Andromeda.”,1.1904761904761905,0.052137859745800555,84,71,10,3
"Baby boomers are here, finally.",1.1904761904761905,0.04631018196447773,84,69,14,1
Let's just do take-out. We already spent 2 light years trying to find parking in Queens,1.1904761904761905,0.05925438255602429,63,53,8,2
It's an earth obsession....its called RV-ing.,1.1904761904761905,0.04310187027192874,84,68,16,0
"Do you know you were going 100 Light Years per Minute 
in a 50 LY/M zone?",1.1904761904761905,0.05925438255602429,63,53,8,2
Don't take the Milky Way -- the locals are a bunch of Neanderthals.,1.1904761904761905,0.052137859745800555,84,71,10,3
#vanlifeonotherplanets,1.1904761904761905,0.052137859745800555,84,71,10,3
Where can we get a cheap tank of gas around here?,1.1904761904761905,0.04986999410368025,63,51,12,0
"So I guess this is not what the humans meant, when they talked about a ride with lots of space...",1.1904761904761905,0.054819870042874363,84,72,8,4
UFRV,1.1898734177215189,0.05119775815863599,79,66,11,2
What is the nearest EV hook-up?,1.1898734177215189,0.044408000977571145,79,64,15,0
We like the convenience but we only get 3 lightyears per gallon.,1.1898734177215189,0.05427504385344417,79,67,9,3
ETRV? WTF?,1.1898734177215189,0.05427504385344417,79,67,9,3
It's a trade in from our last auctee.,1.1898734177215189,0.05718697692758725,79,68,7,4
"I know, right!",1.1898734177215189,0.05119775815863599,79,66,11,2
Humans don't really bother with us.  They just think we're an IFO.,1.1898734177215189,0.04792327717974918,79,65,13,1
''We got it during a layover in the Milky Way.'',1.1898734177215189,0.05119775815863599,79,66,11,2
You're in my parallel parking spot.,1.1898734177215189,0.05427504385344417,79,67,9,3
"Now that the kids are grown, we decided to do a cross galaxy vacation.",1.1898734177215189,0.05119775815863599,79,66,11,2
Turn left at the Milky Way and continue on for 200 light years..,1.1898734177215189,0.04792327717974918,79,65,13,1
California? Left at Andromena and then look for the smoke.,1.1898734177215189,0.05119775815863599,79,66,11,2
The Milky Way was nice but the Grand Canyon was spectacular.,1.1898734177215189,0.05718697692758725,79,68,7,4
Tourists are simply everywhere these days,1.1898734177215189,0.05718697692758725,79,68,7,4
Where are you running away from?,1.1898734177215189,0.05427504385344417,79,67,9,3
"Ours has this thing called a toilet, what does yours have?",1.1896551724137931,0.06249934809931834,58,49,7,2
"Hello E.T., this is R.V.",1.1896551724137931,0.06716494018753925,58,50,5,3
We found it on Craigslist,1.1896551724137931,0.06249934809931834,58,49,7,2
I love this parking space,1.1894736842105262,0.0431013203605283,95,78,16,1
There goes the neighorhoof!,1.1894736842105262,0.0431013203605283,95,78,16,1
Those solar compacts are nice. Getting .00000025 light years per gallon is killing us.,1.1894736842105262,0.045625518983945526,95,79,14,2
"See I told you everyone thinks it's just a ""stopover"" planet and not worth packing for a long haul trip",1.1894736842105262,0.04801720679389688,95,80,12,3
"For long-distance travel, I think we made the right choice.",1.1891891891891893,0.04971475717491742,74,61,12,1
Greetings from the Ford Galaxy.,1.1891891891891893,0.04971475717491742,74,61,12,1
What! You haven't seen Spaceballs? It's a classic.,1.1891891891891893,0.05330844518372843,74,62,10,2
I told you a light year it is not as far as you think it is.,1.1891891891891893,0.04971475717491742,74,61,12,1
We didn't update our navigational app and now we're lost.,1.1891891891891893,0.05330844518372843,74,62,10,2
"Last week it was a rubber ducky, now it’s an RV? The joke has gone too far… he’s already been prescribed three different medications. Stop flying crazy things over that poor man’s house”",1.1891891891891893,0.05330844518372843,74,62,10,2
I read that antiques are back in vogue!!!,1.1891891891891893,0.05667471724545394,74,63,8,3
We retired to travel the universe,1.1891891891891893,0.04584019888717137,74,60,14,0
"We know it looks strange, but trust me, it’s quite comfy on long trips.",1.1891891891891893,0.05667471724545394,74,63,8,3
Avoid the N51...too much dark matter...,1.1891891891891893,0.04971475717491742,74,61,12,1
"Yes,we DO know an electric vehicle is more efficient.",1.1891891891891893,0.05330844518372843,74,62,10,2
"Excuse me New Mexico Winnie, but, we're looking for some ""Blue Magic, Blue Sky, Blue Light?""  _____ Ah, sorry to say that, ""All the K Marts have closed forever.""",1.1891891891891893,0.05667471724545394,74,63,8,3
Finally a vehicle that can go both on land and in the air.,1.1891891891891893,0.04584019888717137,74,60,14,0
Go around the spiral galaxy and take the third planet to the left. You can’t miss it.,1.1891891891891893,0.05330844518372843,74,62,10,2
It gets light-years to the gallon.,1.1891891891891893,0.05330844518372843,74,62,10,2
"I know there's no need for aerodynamics in a vacuum, but for the love of Orkle! Have some taste.",1.1891891891891893,0.04971475717491742,74,61,12,1
We’re trying to find our friend. He’s flying a red Tesla?,1.1891891891891893,0.059851957543573545,74,64,6,4
"Hey, it's only got 80,000 light years on it",1.1891891891891893,0.04584019888717137,74,60,14,0
I think you’ll find the folks in Roswell very accommodating.,1.1891891891891893,0.05330844518372843,74,62,10,2
Hey your lights are not working.,1.1891891891891893,0.04971475717491742,74,61,12,1
Do you know where the nearest Wawa is?,1.1888888888888889,0.04970435551754336,90,76,11,3
Timetravelocity.,1.1888888888888889,0.04970435551754336,90,76,11,3
Interested in buying some Space Meth?...,1.1888888888888889,0.05449677731470917,90,78,7,5
It’s called a “camper.” Now we can take the whole family to Roswell.,1.1886792452830188,0.04468761000837394,106,89,14,3
"I don't rate these new saucers much. They're a bit boxy.""",1.1884057971014492,0.05171962876419153,69,57,11,1
It's recycled; from Elon Musk.,1.1884057971014492,0.055688216518499936,69,58,9,2
"You better download ""Gas Buddy"" before you leave the galaxy",1.1884057971014492,0.05171962876419153,69,57,11,1
"We’re so happy to find a food truck in this galaxy! 

Deb Sherrer, Shelburne, VT",1.1884057971014492,0.055688216518499936,69,58,9,2
I hope the restaurant has atmosphere.,1.1884057971014492,0.05171962876419153,69,57,11,1
"Honest, we thought the limit was only 600,000 miles an hour.",1.1884057971014492,0.05171962876419153,69,57,11,1
Ours is more aerodynamic,1.1884057971014492,0.05171962876419153,69,57,11,1
The pale blue dot is on fire.,1.1884057971014492,0.04742006474057418,69,56,13,0
"Unlike humans who have long predicted a flying car, extraterrestrials dream of a flying RV.",1.1884057971014492,0.05171962876419153,69,57,11,1
We are going to earth uncover.,1.1884057971014492,0.055688216518499936,69,58,9,2
Their fuel costs must be outrageous,1.1884057971014492,0.04742006474057418,69,56,13,0
How did you know they were obsessed with Spaceballs?,1.1884057971014492,0.05939221260836197,69,59,7,3
"I don’t care where you dump your waste, but lemme get at least a few light years away first!”",1.1884057971014492,0.05171962876419153,69,57,11,1
"We’re going to orbit back around, I can’t find a parking space here.",1.188235294117647,0.045816946845285964,85,70,14,1
They say their home planet became uninhabitable.,1.188235294117647,0.045816946845285964,85,70,14,1
You just ran that red star!,1.188235294117647,0.045816946845285964,85,70,14,1
We just got it to cheese off our HOA.,1.188235294117647,0.048778116640986524,85,71,12,2
"Move Over,this is Our Space !",1.188235294117647,0.051569532748121864,85,72,10,3
They are looking for Yellowstone.,1.188235294117647,0.045816946845285964,85,70,14,1
Traded for it in New Mexico,1.1875,0.047379928186276406,80,66,13,1
"It's a Bird, It's a Plane, It's Super Strangers!",1.1875,0.04391357305815796,80,65,15,0
I suspect time travel is not as science fiction as I thought it was.,1.1875,0.05651747237398629,80,69,7,4
They had it modified made after winning the Show Case on the Price is Right.,1.1875,0.053983205795288855,64,53,10,1
"OLD SCHOOL
LOVE THE RETRO UFO",1.1875,0.0491747370293402,64,52,12,0
These gas prices are outrageous!,1.1875,0.047379928186276406,80,66,13,1
Did you submit this week's contest?,1.1875,0.0491747370293402,64,52,12,0
"Musk sent us, why?",1.1875,0.053644841199706916,80,68,9,3
"You're sure that was the George Washington Bridge, Herald?!?",1.1875,0.053644841199706916,80,68,9,3
It's got tons of room in back for probing Earthlings.,1.1875,0.053644841199706916,80,68,9,3
You won't believe your trade in value.,1.1875,0.050609418996262354,80,67,11,2
"Act normal, like we come in peace.",1.1875,0.050609418996262354,80,67,11,2
It's MPG aren't the only things out of this world.,1.1875,0.053644841199706916,80,68,9,3
"No, I know the next stop is pretty far away. . . . and we would totally let you use it, but our black tank has been full for A WHILE.",1.1875,0.04391357305815796,80,65,15,0
Look Martians! .... Look Winnebagos!,1.1868131868131868,0.046651195530939105,91,76,13,2
"Nice to meet you. You're real terraphiles, huh?",1.1866666666666668,0.05597082036858787,75,64,8,3
The KOA? Go to the Milky Way and it’s the starburst on your right.”,1.1866666666666668,0.04911223892281852,75,62,12,1
They're losing a lot of luxury for light speed.,1.1866666666666668,0.05597082036858787,75,64,8,3
The RV really gave us space to roam.,1.1866666666666668,0.05265332251978379,75,63,10,2
Our Tesla's in the shop.,1.1866666666666668,0.04911223892281852,75,62,12,1
"Sure it looks out of this world, but the gas mileage is terrible",1.1866666666666668,0.05265332251978379,75,63,10,2
Shitter's full,1.1866666666666668,0.05910239498610095,75,65,6,4
And you’ll never guess how much it cost to fill the tank!,1.1866666666666668,0.0452951614596046,75,61,14,0
We've heard that black holes are good for getting rid of that kind of thing - there's one just the other side of the nebula you just passed,1.1866666666666668,0.05265332251978379,75,63,10,2
We are  looking for  the Winnebago Constellation. How did you know?,1.1866666666666668,0.05265332251978379,75,63,10,2
The Jetsons meet the Klampets at the  trekkie convention.,1.1866666666666668,0.04911223892281852,75,62,12,1
"Yeah, but the lightyears per is killin' me.",1.1866666666666668,0.05597082036858787,75,64,8,3
Do the Earthlings realize that nothing good will ever happen to them again.,1.1866666666666668,0.04911223892281852,75,62,12,1
"Oh, I’d say about 30 Parsecs/gallon.",1.1866666666666668,0.05910239498610095,75,65,6,4
Zur and Zor did a great conversion job on Elon Musk’s Roadster,1.1866666666666668,0.05265332251978379,75,63,10,2
"They're out of chocolate, too.",1.1866666666666668,0.04911223892281852,75,62,12,1
"We just came back from a place called earth, its not worth the trip.",1.1866666666666668,0.0452951614596046,75,61,14,0
Watch out for the Warp Speed trap up ahead.,1.1864406779661016,0.061514949365445624,59,50,7,2
Waze is saying it's stop and go on Andromeda.,1.1864406779661016,0.061514949365445624,59,50,7,2
It was all they had for a loaner.,1.186046511627907,0.0482572560890765,86,72,12,2
You were only supposed to blow the bloody doors off!,1.186046511627907,0.0482572560890765,86,72,12,2
We've been going around in...?  You've been going around in circles!,1.186046511627907,0.0482572560890765,86,72,12,2
"It’s very roomy, which helps us with this recent increase in demand for anal probes.",1.186046511627907,0.05101333724100219,86,73,10,3
"Sure, it's fun, but it gets terrible plutonium mileage.",1.186046511627907,0.04533392718515793,86,71,14,1
we're on vacation to check out the Grand Canyon on the third planet of this G2V star.,1.186046511627907,0.0482572560890765,86,72,12,2
Watch out for that speed trap two stars ahead.,1.186046511627907,0.05362796274036271,86,74,8,4
"Pleekar, is that you? Small universe!",1.1857142857142857,0.05859944792614804,70,60,7,3
We told you fuel would be expensive!,1.1857142857142857,0.05104642933009962,70,58,11,1
Since covid we would rather avoid crowds,1.1857142857142857,0.05495285818136392,70,59,9,2
Humans can never blend in ?,1.1857142857142857,0.05859944792614804,70,60,7,3
It has a sixty inch flat screen TV. And airconditioning.,1.1857142857142857,0.05104642933009962,70,58,11,1
It has a toilet.,1.1857142857142857,0.05495285818136392,70,59,9,2
"Well, we heard that Yellowstone was washed out . . .",1.1857142857142857,0.05104642933009962,70,58,11,1
"Yeah, travel in the comfort of home and risk the whole thing tipping over?  Idiots!",1.1857142857142857,0.05495285818136392,70,59,9,2
"Just so they don't park it in the front yard.

(word bubble indicates it's coming from both vehicles.)",1.1857142857142857,0.06203203988422092,70,61,5,4
Probably not enough room for a Kuerig,1.1857142857142857,0.04681516071108391,70,57,13,0
I knew we should have ordered the new model Steve,1.1857142857142857,0.04681516071108391,70,57,13,0
They closed the Stuckeys?,1.1857142857142857,0.05104642933009962,70,58,11,1
Screw management! I liked working from home.,1.1857142857142857,0.05495285818136392,70,59,9,2
"It's the Cross-Galaxy Keanu.  Warp Speed, and radio-opaque.",1.1857142857142857,0.04681516071108391,70,57,13,0
There's lots of space in here.,1.1857142857142857,0.05495285818136392,70,59,9,2
"Forget about it. L.L. Bean was gone.' 
\",1.1857142857142857,0.05104642933009962,70,58,11,1
With the price of gas we were thinking about having a staycation.,1.1857142857142857,0.05495285818136392,70,59,9,2
They'll find out soon enough that gas costs even more up here.,1.1857142857142857,0.05859944792614804,70,60,7,3
It’s solar powered,1.1857142857142857,0.05495285818136392,70,59,9,2
are you guys still not driving an electric vehicle with these gas prices?,1.1857142857142857,0.05104642933009962,70,58,11,1
"Yes, we've gone native.",1.1855670103092784,0.04476431433028531,97,81,14,2
That's Ok.  We're just a few miilion miles from the trailer park.,1.1851851851851851,0.0500342818003937,81,68,11,2
Yellowstone was other wordly!,1.1851851851851851,0.0500342818003937,81,68,11,2
Don't go there,1.1851851851851851,0.0500342818003937,81,68,11,2
At least ours is more roomy.,1.1851851851851851,0.046848557928420444,81,67,13,1
Have you seen a MAGA convoy go by?,1.1851851851851851,0.0500342818003937,81,68,11,2
"Nomads, nomads everywhere you go!",1.1851851851851851,0.05302896690102354,81,69,9,3
"So, look who's driving that old cartoon vehicle!",1.1851851851851851,0.05302896690102354,81,69,9,3
You call that tiny thing a space ship?,1.1851851851851851,0.05302896690102354,81,69,9,3
Guzzlers!,1.1851851851851851,0.046848557928420444,81,67,13,1
"I'm sorry. I forgot to turn on the ""right-turn"" button.",1.1851851851851851,0.058560697410525546,81,71,5,5
You’ll never guess.  We found a more advanced civilization!,1.1851851851851851,0.0500342818003937,81,68,11,2
Picked this one up from Earth where to next,1.1851851851851851,0.0500342818003937,81,68,11,2
Have you seen what the Earthlings are flying?  I just saw one in a 1956 Bel Air convertible!,1.1851851851851851,0.0500342818003937,81,68,11,2
How do they live in that little thing?,1.1851851851851851,0.05302896690102354,81,69,9,3
We’re joining the #vanlife movement,1.184782608695652,0.04618599010841946,92,77,13,2
Finally you ask for directions.,1.1846153846153846,0.053224432704223244,65,54,10,1
"If you need an oil change, there's a Saturn Dealership up Milky Way",1.1846153846153846,0.053224432704223244,65,54,10,1
I told you we should have gone with the deluxe package!,1.1846153846153846,0.06159852837710371,65,56,6,3
No plutonium stations for the next 207 lightyears.,1.1846153846153846,0.048498154665071104,65,53,12,0
We told you that the john would be useful.,1.1846153846153846,0.05756395979652216,65,55,8,2
Oh good lord. Your parents followed us. How did they afford the fuel?,1.1846153846153846,0.053224432704223244,65,54,10,1
How far is it to Denny's,1.1846153846153846,0.06538461538461537,65,57,4,4
We finally bought this second-hand thing to enjoy our retirement,1.1846153846153846,0.05756395979652216,65,55,8,2
I bet they are on their way to Universal Studios.,1.1846153846153846,0.05756395979652216,65,55,8,2
You kids never phone home.,1.1842105263157894,0.05201391958025824,76,64,10,2
"My 5g network started glitching as soon as I left earth, what is your plan?",1.1842105263157894,0.05201391958025824,76,64,10,2
Uh oh! They probably read “How to bait the earthlings”,1.1842105263157894,0.05201391958025824,76,64,10,2
"We got a great deal at the third planet from that sun, and it sleeps 4!",1.1842105263157894,0.04852391819627838,76,63,12,1
Mom? Dad? What a coincidence!,1.1842105263157894,0.05528403949680258,76,65,8,3
"Yeah, we traded in the saucer after X'oron retired.",1.1842105263157894,0.05201391958025824,76,64,10,2
We really need to learn to pack light.,1.1842105263157894,0.04852391819627838,76,63,12,1
Make a left for Alpha Centauri. Can you tell us how to get to Santa Fe?,1.1842105263157894,0.05528403949680258,76,65,8,3
The Best Camping? Area 51,1.1842105263157894,0.05528403949680258,76,65,8,3
It’s camouflage,1.1842105263157894,0.05201391958025824,76,64,10,2
I told you this galaxy was getting pretty touristed,1.1842105263157894,0.0583712447705759,76,66,6,4
What d'ya say we hightail it out of this dump?,1.1842105263157894,0.0583712447705759,76,66,6,4
Can you tell us how to get to McDonald’s? We took a wrong turn at Saturn.,1.1842105263157894,0.05201391958025824,76,64,10,2
"We like not having to look for a pit stop, but the gas is killing is.",1.1842105263157894,0.05201391958025824,76,64,10,2
"If you go to Earth, pass on Area 51, but definitely check out Yellowstone.",1.1842105263157894,0.05201391958025824,76,64,10,2
We were wondering what time you have to return the rental and what kind of mileage you get?,1.1842105263157894,0.044762634463765195,76,62,14,0
"When they get to be our age, they'll prefer to cruise the open space with style instead of speed.",1.1839080459770115,0.04774726195683065,87,73,12,2
fellow alien  is there a KOA camp ground in this universe,1.1839080459770115,0.04177540678018991,87,71,16,0
Only a pilot test run,1.1839080459770115,0.04486081606493881,87,72,14,1
Was that sativa or indica?,1.1839080459770115,0.053051083279213804,87,75,8,4
Are they lost or we lost?,1.1839080459770115,0.04774726195683065,87,73,12,2
"You've beamed us up, Smarty Pants.",1.1839080459770115,0.04774726195683065,87,73,12,2
We’ve got a flat. Can we borrow your AAA card?,1.183673469387755,0.04434562619344774,98,82,14,2
Another Musk stunt!,1.1833333333333333,0.060560781750670575,60,51,7,2
"You may be faster, but we have a bathroom.",1.1833333333333333,0.06505828185300304,60,52,5,3
That must be a proton burner.,1.1830985915492958,0.061208023944109534,71,62,5,4
We decided to give those Planet Earth cretins something they could identify!”,1.1830985915492958,0.06441146390250896,71,63,3,5
Road hog! Show off!,1.1830985915492958,0.05782739582776625,71,61,7,3
You can't get there from here.,1.1830985915492958,0.054236456570277786,71,60,9,2
"Apparently Howard has some kind of Earth fetish, you should see his wardrobe!",1.1830985915492958,0.054236456570277786,71,60,9,2
Those strange creatures told us these things run forever but never said anything about the price of gas...,1.1830985915492958,0.050390264281685394,71,59,11,1
Look George! It's the Joneses in one of those Teslas that run on ozone.,1.1830985915492958,0.050390264281685394,71,59,11,1
No. We don’t make crystal meth in the back.,1.1830985915492958,0.050390264281685394,71,59,11,1
Glad to see used car salesman still have some use in the new economy.,1.1830985915492958,0.050390264281685394,71,59,11,1
We’ll take black holes over potholes any day.,1.1830985915492958,0.054236456570277786,71,60,9,2
We're taking the scenic route. Having a life expectancy of  900 years certainly has it's perks.,1.1830985915492958,0.061208023944109534,71,62,5,4
These are going for half-price down there!,1.1830985915492958,0.054236456570277786,71,60,9,2
"Two spaceburgers please--onions, relish, catsup. Skip the fries",1.1830985915492958,0.05782739582776625,71,61,7,3
"Do you know if we'll have to wear masks?

(I am submitting this caption on behalf of my  90 year old mother, and subscriber, Joyce Welz. She does not have a computer and therefore could not submit this on her own.)",1.1830985915492958,0.050390264281685394,71,59,11,1
Do you guys have any toilet paper?,1.1830985915492958,0.050390264281685394,71,59,11,1
"It's a Winnebago. Roomy, comfortable and earthlings don't seem to even notice us when we land.",1.1830985915492958,0.054236456570277786,71,60,9,2
Darnit.  Thot we moved here to escape the Malibu s.,1.1830985915492958,0.050390264281685394,71,59,11,1
The guy at the dealership said the best way to go stargazing was in an RV.,1.1830985915492958,0.054236456570277786,71,60,9,2
Driving had been the cheapest option when we left two light-years ago…,1.1830985915492958,0.04622514734921426,71,58,13,0
We really should get the new fuel efficient spaceship like the Joneses!,1.1829268292682926,0.04947191399330268,82,69,11,2
Winnebagos boldly go where no Earth vehicle has gone before.,1.1829268292682926,0.04632878319045735,82,68,13,1
"Did Elon Musk send you, too?",1.1829268292682926,0.04947191399330268,82,69,11,2
You get how many light-years to the gallon?!!!,1.1829268292682926,0.04947191399330268,82,69,11,2
"The lightyears per gallon is not that great, but there is plenty of room for us and all our abductees.",1.1829268292682926,0.04947191399330268,82,69,11,2
"Some of their land crawlers have more home comforts than our saucers, and they're not hard to convert",1.1829268292682926,0.04632878319045735,82,68,13,1
Skip Earth in case you need to refill.,1.1829268292682926,0.04947191399330268,82,69,11,2
We asked for cargo space.,1.1829268292682926,0.04632878319045735,82,68,13,1
"Plenty of leg room, kitchen and toilet too.",1.1829268292682926,0.04632878319045735,82,68,13,1
"Sorry, we're out of toilet paper, too.",1.1829268292682926,0.04632878319045735,82,68,13,1
"Whoa,more Republicans going home",1.1829268292682926,0.05522407553472856,82,71,7,4
"Greetings, we never met anyone from Earth before",1.1829268292682926,0.04632878319045735,82,68,13,1
Where's the nearest KOA?,1.1829268292682926,0.04947191399330268,82,69,11,2
Ditch the camper.  Gas prices are way too high right now.,1.1829268292682926,0.04947191399330268,82,69,11,2
Yes the extra space is great. But it’s really hard to find parking…,1.1829268292682926,0.04632878319045735,82,68,13,1
Just a heads up that there was an accident at the RV dump station back there. You might run into some “matter”.,1.1829268292682926,0.05788620423656866,82,72,5,5
"It's a gas guzzler, the dealer was practically giving it away.",1.1829268292682926,0.05242694342046913,82,70,9,3
"We just love spending time in nature.""",1.1829268292682926,0.04632878319045735,82,68,13,1
We really should have upgraded to the model with the bed and bath.,1.1829268292682926,0.04295628044484381,82,67,15,0
which way to CPAC?,1.1829268292682926,0.05242694342046913,82,70,9,3
Shmerbert zing cho gluborc voom hlayughar umja harhyuraot quoug'c ak quyuch iea? (translation: 'sup?),1.1829268292682926,0.04947191399330268,82,69,11,2
"Sure, it only gets 6 light years per gallon, but you can fit so many abducted humans in this bad boy!",1.1829268292682926,0.04632878319045735,82,68,13,1
"Look, they barely have any leg room!",1.1827956989247312,0.045729852307199545,93,78,13,2
We're going to Disneyland.  We hear it's out of this world!,1.1827956989247312,0.05058386673072214,93,80,9,4
Do you know of some RV docking station nearby in this galaxy?  Our fuel is down to 1 and a half light years.,1.1827956989247312,0.05058386673072214,93,80,9,4
Mel who?,1.1818181818181819,0.052486388108147784,66,55,10,1
This traffic is terrible!,1.1818181818181819,0.057657842219448745,77,67,6,4
"RV, UFO, we're just alien emojis in cyberspace, TBH.",1.1818181818181819,0.05138968544451671,77,65,10,2
"Pardon me, where is the nearest planet with a restroom?",1.1818181818181819,0.047839528325837946,66,54,12,0
"Sure, it's got a bathroom and space to move around, but it gets terrible plutonium mileage.",1.1818181818181819,0.0546137644714646,77,66,8,3
Any idea where the nearest dump station is?,1.1818181818181819,0.047839528325837946,66,54,12,0
First one to Mars wins!,1.1818181818181819,0.044242205762935236,77,63,14,0
"No wonder the mail is late. DeJoy says they go everywhere,man!",1.1818181818181819,0.05675404305280447,66,56,8,2
"You guys happen to know the way to Area 51""",1.1818181818181819,0.052486388108147784,66,55,10,1
We like our bubbles.,1.1818181818181819,0.052486388108147784,66,55,10,1
"Darling, why can't we get one of those new hybrids?",1.1818181818181819,0.05138968544451671,77,65,10,2
We can't even find Hunter Biden's laptop in the Twilight Zone.,1.1818181818181819,0.0479493093842668,77,64,12,1
Could you tell me which direction to the Milky Way?,1.1818181818181819,0.0443973183545807,88,73,14,1
"oh, you went electric?",1.1818181818181819,0.052486388108147784,66,55,10,1
How do we get to Alpha Centauri?,1.1818181818181819,0.0479493093842668,77,64,12,1
Be back before dark. Meet you at the camp site.,1.1818181818181819,0.05138968544451671,77,65,10,2
