caption,mean,precision,votes,not_funny,somewhat_funny,funny
How the mighty have fallen.,1.1868131868131868,0.05162106675444049,91,78,9,4
"It's time for your water, Lou",1.1868131868131868,0.046651195530939105,91,76,13,2
"For the last time, get off your high horse and go help your father conquer France.",1.1868131868131868,0.041084468550358834,91,74,17,0
I NEED MONEY FOR AN ISLAND VACATION,1.1868131868131868,0.05162106675444049,91,78,9,4
i don't have change for francs.,1.1868131868131868,0.04395604395604396,91,75,15,1
"Come on home little man, Waterloo will not end well!",1.1868131868131868,0.04395604395604396,91,75,15,1
God help me when he grows to 5’10” and thinks he’s Hitler.,1.1866666666666668,0.05265332251978379,75,63,10,2
"It’s a complex, not a victory.",1.1866666666666668,0.05597082036858787,75,64,8,3
"Listen, France is a lot of 50c's away from St Helena, and besides, unlike you,
that little horse is totally grounded.",1.1864406779661016,0.041605391784949604,118,99,16,3
"Hey, Napolean.  Try again.  You missed with both ""Hi yo Silver, away"" and ""Warp factor five, Captain.",1.1862745098039216,0.045641722077372035,102,86,13,3
"A little short on cash aren't you there, Emperor Napoleon?",1.1862745098039216,0.04346296968021364,102,85,15,2
"It was only a whiff of grape juice, Danny.",1.1862745098039216,0.049713588843674016,102,88,9,5
"Hey Napoleon, you can't get to the Alps on 50 cents.",1.1862745098039216,0.04116907422639316,102,84,17,1
"oh that reminds me, I forgot to grab some tea",1.1862745098039216,0.045641722077372035,102,86,13,3
Come with me now or be exiled.,1.186046511627907,0.04220861455688507,86,70,16,0
"C'mon, little man.  Get off your high horse and I'll let you eat cake.",1.186046511627907,0.0482572560890765,86,72,12,2
You met your Waterloo. I'm out of quarters.,1.186046511627907,0.0482572560890765,86,72,12,2
"Home or Waterloo, take your pick.",1.186046511627907,0.04220861455688507,86,70,16,0
Moscow or bust!,1.186046511627907,0.0482572560890765,86,72,12,2
"Come on, little Caesar.",1.186046511627907,0.0482572560890765,86,72,12,2
You have a complex.,1.186046511627907,0.05362796274036271,86,74,8,4
"It's Waterloo for you, buster, if you're not home by dinnertime.",1.186046511627907,0.05362796274036271,86,74,8,4
"Ok, but that attitude doesn't end well.",1.186046511627907,0.0482572560890765,86,72,12,2
"Let’s get going, Paul Revere. You’re two quarters short of a Revolution.”",1.186046511627907,0.0482572560890765,86,72,12,2
"Enjoy! You’re not going to be any taller!
!",1.186046511627907,0.05101333724100219,86,73,10,3
"Honey, you do not want little man syndrome.",1.186046511627907,0.05362796274036271,86,74,8,4
"I'm counting, mister. Elba or St. Helena?",1.186046511627907,0.04533392718515793,86,71,14,1
Forget it. I'm sick of my tax dollars going to the military.,1.186046511627907,0.05362796274036271,86,74,8,4
Let's go. You can meet your Waterloo next time.,1.186046511627907,0.0482572560890765,86,72,12,2
You need a Nap Leon!,1.186046511627907,0.0482572560890765,86,72,12,2
"I also preferred the Trojan horse, kid.",1.1858407079646018,0.04453132920091288,113,96,13,4
I'll be on the 'mommy wine bench.',1.1855670103092784,0.04476431433028531,97,81,14,2
"My Dear Bonaparte, I’ve run the economics and your chances of victory aren’t worth two bits.",1.1855670103092784,0.04476431433028531,97,81,14,2
"""Waterloo or bust!""",1.1855670103092784,0.04710223423323986,97,82,12,3
"OK, Napoleon, we are going home now.",1.1855670103092784,0.04710223423323986,97,82,12,3
Why don't you grow up?,1.1855670103092784,0.04476431433028531,97,81,14,2
"C‘mon, I got your favorite: shortcake.",1.1855670103092784,0.04710223423323986,97,82,12,3
Attention Shoppers:  Detour this way to avoid Waterloo.,1.1855670103092784,0.04476431433028531,97,81,14,2
"I know you stole that 50 cents out of my purse, Little Prince!",1.1855670103092784,0.04476431433028531,97,81,14,2
"Get off your high horse, Little Napoleon, and let's devour this baguette.",1.1855670103092784,0.04476431433028531,97,81,14,2
"Suit yourself,but water and the loo are that way.",1.1855670103092784,0.04710223423323986,97,82,12,3
No one uses cash anymore.,1.1851851851851851,0.046848557928420444,81,67,13,1
I want you home for dinner to meet your uncles Walter and Lou.,1.1851851851851851,0.05302896690102354,81,69,9,3
"You have about $40 in quarters, I’m headed to the Legion, meet you here in about an hour",1.1851851851851851,0.04190874258156364,108,90,16,2
"Sure you can have a horse.. let’s go, Napoleon",1.1851851851851851,0.0500342818003937,81,68,11,2
"Come on Emperor, that kid dressed as Louis xviii was next.",1.1851851851851851,0.04190874258156364,108,90,16,2
"Napoleon, you're pointing at a complex. The car is over here.",1.1851851851851851,0.043429775553920656,81,66,15,0
The hand goes in the pocket.,1.184782608695652,0.0487035648134137,92,78,11,3
"Sorry, you're too tall for that ride.",1.184782608695652,0.05109724815265259,92,79,9,4
Paul Revere you're not,1.184782608695652,0.05109724815265259,92,79,9,4
for once i just wish he would stay inside and play call of duty,1.184782608695652,0.04352302998477531,92,76,15,1
"Fine, you can capture the British fleet. Just be home by 6 for supper.",1.184782608695652,0.04618599010841946,92,77,13,2
"No, I said it's time for your nap, Leon!",1.184782608695652,0.04618599010841946,92,77,13,2
Follow my lead to the best french fries in the food court!,1.184782608695652,0.04352302998477531,92,76,15,1
At least he’s reading,1.184782608695652,0.0487035648134137,92,78,11,3
Let’s go before you break a bone apart!,1.184782608695652,0.05338370830143901,92,80,7,5
Just pretend you're at Austerlitz 'till I finish my shopping.,1.184782608695652,0.04068614746834948,92,75,17,0
When the cashier called you a “short king” it was a modern term of endearment not a challenge,1.184782608695652,0.05109724815265259,92,79,9,4
If you dont get of that horse and get in the car you will experience your own personal Waterloo!,1.1844660194174756,0.04523259434304088,103,87,13,3
"You can ride at home, but I’m taking the car",1.1844660194174756,0.04307691007839968,103,86,15,2
It’s time for your haircut Little Colonel.,1.1844660194174756,0.04729011524728668,103,88,11,4
This is what I get for shopping at the Napoleon Complex.,1.1844660194174756,0.04307691007839968,103,86,15,2
Right now or you’re exiled to your room.,1.1844660194174756,0.04307691007839968,103,86,15,2
This machine doesn't take euros.,1.1842105263157894,0.05201391958025824,76,64,10,2
"Sweetie, Mommy has four more errands before we can even think about crossing the Alps!",1.1842105263157894,0.05201391958025824,76,64,10,2
Are you my Uber?,1.1842105263157894,0.05201391958025824,76,64,10,2
It’s time to quit- Remember the pigeons?,1.1842105263157894,0.05528403949680258,76,65,8,3
Time to leave after you conquer France,1.1839080459770115,0.050468893694394994,87,74,10,3
See you on the other side.,1.1839080459770115,0.04774726195683065,87,73,12,2
"Fine, go conquer. If you're not in the car in one minute you can ride your pony to Valhalla.",1.1839080459770115,0.04486081606493881,87,72,14,1
I'm a little short on quarters. Help?,1.1839080459770115,0.050468893694394994,87,74,10,3
Charge?  How do you think I paid for these groceries?,1.1839080459770115,0.04774726195683065,87,73,12,2
You can conquer Austerlitz after dinner.,1.1839080459770115,0.04774726195683065,87,73,12,2
Don't go overboard! I only said it was time for your nap Leon,1.1839080459770115,0.04486081606493881,87,72,14,1
Capture Russia ? You'll need to crack open the piggy bank for that.,1.1839080459770115,0.04774726195683065,87,73,12,2
"We’ll ride again in a fortnight, when mom needs more eggs",1.1839080459770115,0.050468893694394994,87,74,10,3
Time to go home shorty,1.1839080459770115,0.04774726195683065,87,73,12,2
"Just so you know, the flavor you've been begging for is actually pronounced ""Neapolitan"".",1.1839080459770115,0.04774726195683065,87,73,12,2
"Russia please, not Waterloo...",1.1839080459770115,0.04486081606493881,87,72,14,1
"You can unleash grapeshot again next Tuesday, but it's time to go home.",1.183673469387755,0.04665756099726821,98,83,12,3
Watch me conquer the world!,1.183673469387755,0.04434562619344774,98,82,14,2
They’re called breasts and we all have them.,1.183673469387755,0.04434562619344774,98,82,14,2
I will not retreat until I get a frozen treat!,1.183673469387755,0.04434562619344774,98,82,14,2
"Before you conquer the world, clean up your room!",1.183673469387755,0.04190633754892204,98,81,16,1
I'm fresh out of francs.,1.18348623853211,0.04155722142841898,109,91,16,2
"Argh, now fetch me a sippy cup",1.18348623853211,0.0435533846923308,109,92,14,3
"I can no longer obey; I have tasted command, and I cannot give it up.”
“Don’t quote Napoleon to me young man.  We are leaving now.",1.18348623853211,0.04546198393675384,109,93,12,4
Conquer your chores.,1.1830985915492958,0.050390264281685394,71,59,11,1
"How many times have I told you it's time to go, Napoleon?",1.1829268292682926,0.05242694342046913,82,70,9,3
I just think you're too young to have a Waterloo experience.,1.1829268292682926,0.04947191399330268,82,69,11,2
I’m not sure where this is coming from - you’re actually above average height for your age.,1.1829268292682926,0.04632878319045735,82,68,13,1
"Yes, he was short and I'm short on quarters, so let's go.",1.1829268292682926,0.05788620423656866,82,72,5,5
"Don't get your blankie dirty, General.",1.1829268292682926,0.05522407553472856,82,71,7,4
"Time to go home, little emperor",1.1829268292682926,0.04947191399330268,82,69,11,2
"Glory is fleeting, but obscurity is forever. Now can I have 50 cents, mama?",1.1829268292682926,0.05242694342046913,82,70,9,3
Real caped superheroes don't need a horse,1.1827956989247312,0.048217978832950585,93,79,11,3
Your cheriot awaits over here,1.1827956989247312,0.040295300106155174,93,76,17,0
"Unless you have fifty cents, I'm afraid this is your Waterloo moment.",1.1827956989247312,0.045729852307199545,93,78,13,2
No I’m not going to take your picture now Paul.,1.1827956989247312,0.048217978832950585,93,79,11,3
Waterloo Street is that way!,1.1827956989247312,0.048217978832950585,93,79,11,3
"Mais, oui, mon generale.  You can have les french fries.  Now, let's go.",1.1827956989247312,0.043098321328581886,93,77,15,1
Did you do your homework?,1.1827956989247312,0.048217978832950585,93,79,11,3
"No, that is not Josephine",1.1827956989247312,0.05058386673072214,93,80,9,4
"No,I don’t have $27.50 in quarters so you can get to Waterloo.",1.1827956989247312,0.043098321328581886,93,77,15,1
"No, I am your mother, not your Da-veed!",1.1827956989247312,0.045729852307199545,93,78,13,2
Sorry.No change left after groceries anymore!,1.1826923076923077,0.04045212892175507,104,86,17,1
"Let's go, Napoleon. You're not the one who went to town riding on a pony.",1.1826923076923077,0.04269755533620633,104,87,15,2
Patriotism just gets more accessible by the day.,1.1826923076923077,0.04269755533620633,104,87,15,2
"Okay bitch, let's ride",1.1826923076923077,0.04483065613031456,104,88,13,3
I'll be done before you finish the Hamilton soundtrack.,1.1818181818181819,0.0479493093842668,77,64,12,1
It's time to go.  Come along and later I'll let you invade Russia.,1.1818181818181819,0.0443973183545807,88,73,14,1
I’ll be home when Wellington’s army  surrenders and not a moment before!,1.1818181818181819,0.046221117974161514,99,84,12,3
You’ve misunderstood colonialism”,1.1818181818181819,0.04135080237703108,88,72,16,0
You don't have a complex and you're not getting Cognac.,1.1818181818181819,0.05048443199000259,99,86,8,5
All this war play is giving ME a complex!,1.1818181818181819,0.05138968544451671,77,65,10,2
Let me know it you find any baby formula.,1.1818181818181819,0.04393459551987973,99,83,14,2
"Not another Waterloo moment... that's five today already.""",1.1818181818181819,0.048399739772722716,99,85,10,4
"For Halloween, you're going as Obi-Wan Kenobi, and that's final!",1.1818181818181819,0.04393459551987973,99,83,14,2
One if by Uber; two if by Lyft.,1.1818181818181819,0.04993583800023193,88,75,10,3
Boys are more easily governed through candy than vegetables.,1.1818181818181819,0.048399739772722716,99,85,10,4
Get down from there now  or  Mom’s going to Waterloo you!,1.1818181818181819,0.04135080237703108,88,72,16,0
"Sure, if you can get home before me, I'll buy you a real horse",1.1818181818181819,0.05138968544451671,77,65,10,2
"Honey, get down, it'll stunt your growth.",1.1818181818181819,0.0443973183545807,88,73,14,1
Give me fifty cents and I'll conquer the world!,1.1818181818181819,0.04724780309106126,88,74,12,2
Keep up.  Putin is the 21st century little man Emperor.,1.1818181818181819,0.052486388108147784,88,76,8,4
Give me liberty or give me another ride on this thing!,1.1818181818181819,0.0479493093842668,77,64,12,1
How many coins will you need before you win the war?,1.1818181818181819,0.04393459551987973,99,83,14,2
Where did you get that 50 cents?,1.1818181818181819,0.04993583800023193,88,75,10,3
"C’mon, kid.  Let’s go to the party.",1.1818181818181819,0.04724780309106126,88,74,12,2
"No, I will NOT take you to Nordstrom's",1.1818181818181819,0.052486388108147784,88,76,8,4
You forgot the Elba Macaroni,1.1818181818181819,0.0443973183545807,88,73,14,1
"Mike Flynn, you get down from that horse right now! For the thousandth time, you just aren’t big enough!",1.1818181818181819,0.04993583800023193,88,75,10,3
You can't fake Napoleon.,1.1818181818181819,0.0443973183545807,88,73,14,1
"Come Napoleon, we don’t want to keep Grandma waiting.",1.1818181818181819,0.05138968544451671,77,65,10,2
"Imagination may govern the world, but reality says it's time to go home and start dinner.",1.1818181818181819,0.0546137644714646,77,66,8,3
Bon voyage!!!  But you’ll need more quarters to conquer the world.,1.1818181818181819,0.041522350851192366,99,82,16,1
"Calm down, you'll hit a growth spurt.",1.1818181818181819,0.05675404305280447,66,56,8,2
"No, we can NOT annex the toy store.  We're still dealing with the sanctions from the pet store last week!",1.1818181818181819,0.0546137644714646,77,66,8,3
Consider that last $0.50 coin your Waterloo.,1.1818181818181819,0.04724780309106126,88,74,12,2
The red beets are coming! The red beets are coming!,1.180952380952381,0.04645087282554565,105,90,11,4
Let's go Boney....or we'll be late for therapy.,1.180952380952381,0.04010278091110972,105,87,17,1
No quarters from me Paul.,1.180952380952381,0.04443572215126961,105,89,13,3
Get fucked kid,1.1808510638297873,0.05231490004089126,94,82,7,5
"Sorry,you're not old enough for cognac.",1.1808510638297873,0.04774188483374011,94,80,11,3
You can take over the world from your car seat.,1.1808510638297873,0.04528252387039545,94,79,13,2
"Time to go, we are having French Fries for dinner.",1.1808510638297873,0.04528252387039545,94,79,13,2
Don't ask. It's complex.,1.1808510638297873,0.04774188483374011,94,80,11,3
On to Elba are we?,1.1808510638297873,0.042681686572437164,94,78,15,1
We’re not heading to Le Creperie.,1.1808510638297873,0.04774188483374011,94,80,11,3
Why can’t you be normal and pretend to be Oedipus?,1.1808510638297873,0.04774188483374011,94,80,11,3
"I'm glad you're taking our homeschooled history lessons to heart, but I have to get these melting groceries home now!",1.1808510638297873,0.04774188483374011,94,80,11,3
You're just like your father.,1.1808510638297873,0.04774188483374011,94,80,11,3
Enough with these inflated grocery prices. The revolution has begun!,1.1808510638297873,0.04774188483374011,94,80,11,3
"Stop playing Lord of The Flies, otherwise you’ll get it banned.",1.1808510638297873,0.04774188483374011,94,80,11,3
I'll go get some quarters. And stay out of Russia.,1.180722891566265,0.05183831390483617,83,71,9,3
Want to use the (water) loo before heading home?,1.180722891566265,0.04582023644587216,83,69,13,1
Josephine regretted naming her son Bonaparte.,1.180722891566265,0.04892190131450311,83,70,11,2
Napoleon crossing the sidewalk outside Trader Joe's.,1.180722891566265,0.05183831390483617,83,71,9,3
"Yes, you won the Battle of Waterloo. Try not to get your blankie dirty.",1.180722891566265,0.05183831390483617,83,71,9,3
"Actually, I'm pretty sure our complex is in this direction.",1.180722891566265,0.054599168022660204,83,72,7,4
"The more you ride,the less you're going to grow.",1.180722891566265,0.05183831390483617,83,71,9,3
"Yes, 50 cents surely IS too much to pay for the satisfaction of crushing your enemies underfoot.",1.180722891566265,0.04582023644587216,83,69,13,1
"We're going the other way, Johnny.",1.180722891566265,0.054599168022660204,83,72,7,4
"Donald, stop acting like a malignantly narcissistic brat.",1.180722891566265,0.05183831390483617,83,71,9,3
Crossing the Alps will just have to wait until we get home.,1.180722891566265,0.05183831390483617,83,71,9,3
You got the colonizer gene from your father.,1.180722891566265,0.04582023644587216,83,69,13,1
Get off that thing before you develop a complex!,1.1805555555555556,0.045649498541524836,72,59,13,0
"Not bad, considering the price of gas.",1.1801801801801801,0.046495881825511086,111,96,10,5
"No, I asked where to find the Melba toast aisle, not the Elba exile.",1.18,0.045792681696639026,100,85,12,3
I said you’re too young to operate complex machinery.,1.18,0.043531017619043745,100,84,14,2
That's not Teddy Roosevelt. Different metaphor.,1.18,0.045792681696639026,100,85,12,3
"What do you mean, ""I can no longer obey; I have tasted command, and I cannot give it up""? One more time: Get. In. The. Car.",1.18,0.045792681696639026,100,85,12,3
I never should have named you Napoleon,1.18,0.045792681696639026,100,85,12,3
"Je voudrais 50 centimes maintenant car je suis un ""petit homme, complexe"" et révolutionnaire.",1.18,0.045792681696639026,100,85,12,3
The height requirement for this ride is much taller than most people think!,1.1797752808988764,0.04394315017840537,89,74,14,1
"I consider myself a modern parent, but thankful you’re not being Lady Godiva.",1.1797752808988764,0.04941382071271398,89,76,10,3
‘’Get your Assterlitz back to the car…NOW!”,1.1797752808988764,0.04941382071271398,89,76,10,3
Napoleon's first conquest..the local acme.,1.1797752808988764,0.04941382071271398,89,76,10,3
We have Napoleon complexes at home.,1.1797752808988764,0.04394315017840537,89,74,14,1
"Ok Paul,you can ride for just a minute,but them we have to go..",1.1797752808988764,0.04093455548419588,89,73,16,0
"I said, let's go Nappie. Mind me, or no TV tonight, is gonna be be your Waterloo",1.1797752808988764,0.05193349874927952,89,77,8,4
Your dad also had his Waterloo moment.,1.1797752808988764,0.04941382071271398,89,76,10,3
"Come on Napoleon, get off your high horse.",1.1797752808988764,0.04093455548419588,89,73,16,0
Beware the Russian winter.,1.1797752808988764,0.04394315017840537,89,74,14,1
"Hey Buddy, I think Russia is in the other direction.",1.1797752808988764,0.04394315017840537,89,74,14,1
Hi Ho Half Dollar!,1.1797752808988764,0.04941382071271398,89,76,10,3
: Time to go. We still have to pick up the cats and go see the Monarch butterflies in the park.,1.1797752808988764,0.04093455548419588,89,73,16,0
Boys will be men.,1.1797752808988764,0.04675856138200858,89,75,12,2
The man in the red coats is coming for you.,1.1794871794871795,0.04738794815386097,78,65,12,1
Ere I saw elbow macaroni ….,1.1794871794871795,0.05395941341632321,78,67,8,3
"Your father is over six feet tall. Trust me, you’ll grow out of this.",1.1794871794871795,0.04373348027807394,78,64,14,0
"OK, Emperor, but keep in mind that there won't be  cookies waiting for you on Elba.",1.1794871794871795,0.05395941341632321,78,67,8,3
"Well, it's not the worst complex you could have.",1.1794871794871795,0.04738794815386097,78,65,12,1
I thought your father was spending too much time with you…,1.179245283018868,0.03975931589699097,106,88,17,1
"No, this way!",1.1789473684210525,0.047275010547505485,95,81,11,3
"That's Russia, you might want to think again.",1.1789473684210525,0.042272902559438594,95,79,15,1
You're not going anywhere young man until you finish graduate school.,1.1789473684210525,0.04958720387358252,95,82,9,4
"Enough, already.  You made your point. We'll stop by the bakery.",1.1789473684210525,0.042272902559438594,95,79,15,1
History is written by the winners.,1.1789473684210525,0.0448437560484542,95,80,13,2
Really?,1.1789473684210525,0.042272902559438594,95,79,15,1
We're having Beef Wellington and that's the last I want to hear from you!,1.1789473684210525,0.04958720387358252,95,82,9,4
In retrospect having only one may have been shortsighted,1.1789473684210525,0.042272902559438594,95,79,15,1
That reminds me. I need to pick up some Elba macaroni.,1.1785714285714286,0.051262641097241254,84,72,9,3
Vive la Prance!,1.1785714285714286,0.04838384688736214,84,71,11,2
You're reminding me that the Constitution was written by a bunch of rich White guys.,1.1785714285714286,0.051262641097241254,84,72,9,3
The Habsburgs aren’t the only ones who are going to be in trouble soon.,1.1785714285714286,0.04532256509703349,84,70,13,1
"Del, be aware the river’s in the other direction!",1.1785714285714286,0.04838384688736214,84,71,11,2
Could you put a couple of quarters in? My back is killing me.,1.1785714285714286,0.051262641097241254,84,72,9,3
"Fighting your own battles, are you, son? Well, I'm done with mine.",1.1785714285714286,0.04532256509703349,84,70,13,1
I'll start looking for a nice Airbnb in Saint Helena.,1.1785714285714286,0.04247469856733219,112,95,14,3
"When I said, “Charge!” this isn’t what I meant.",1.1785714285714286,0.04838384688736214,84,71,11,2
"And now, onwards to the croissants!",1.1785714285714286,0.04838384688736214,84,71,11,2
"Get off your high horse, Napoleon, it’s time for your history lesson.",1.1785714285714286,0.04838384688736214,84,71,11,2
You’re so complex.,1.1785714285714286,0.051262641097241254,84,72,9,3
"Oh dear, not the dictator phase again...",1.1785714285714286,0.04532256509703349,84,70,13,1
I'll be back after you conquer Italy.,1.1785714285714286,0.051262641097241254,84,72,9,3
En route to the Napoleon BYO app party,1.1785714285714286,0.0420389483019018,84,69,15,0
"„Relax, it was just a song by ABBA!“",1.1785714285714286,0.051262641097241254,84,72,9,3
Check in when you get back.,1.1782178217821782,0.03826960017839148,101,83,18,0
"Fine, you soldier on, and I'm going to the car.",1.1782178217821782,0.04537203658372121,101,86,12,3
If you don't get off that thing in three seconds you'll be meeting your Waterloo. One...two...,1.1782178217821782,0.040774772835592096,101,84,16,1
For two more quarters you can go from here to Hoboken.,1.1782178217821782,0.040774772835592096,101,84,16,1
Josephine wants you to go home for dinner now!,1.1782178217821782,0.05150418536095032,101,89,6,6
The insurrection is over…you missed the whole thing & it’s your horse’s fault,1.1782178217821782,0.04537203658372121,101,86,12,3
He does this every time we come,1.1782178217821782,0.04313469487285539,101,85,14,2
"Sorry, I don't know the way to Waterloo",1.1782178217821782,0.04750412093423826,101,87,10,4
I'll be back when your exile ends.,1.178082191780822,0.05634229533905509,73,63,7,3
"You'll still grow a bit I promise, no need to choose bad role models.",1.178082191780822,0.052857702752466776,73,62,9,2
Just be sure and take that off before we get to the therapist's office.,1.178082191780822,0.052857702752466776,73,62,9,2
"You're getting exiled to the shower, Monsieur Emperor.",1.1777777777777778,0.04890250633185913,90,77,10,3
Are you sure that's where we parked?,1.1777777777777778,0.04890250633185913,90,77,10,3
"Giddy up"" just changed to ""au revoir.",1.1777777777777778,0.046279231145300956,90,76,12,2
"""No more. You're going to end up with a complex.",1.1777777777777778,0.046279231145300956,90,76,12,2
I'll tear your bones apart...  unless you dismount and come with me.,1.1777777777777778,0.04890250633185913,90,77,10,3
"No, I will not give you fifty cents to put down the French revolution.",1.1777777777777778,0.046279231145300956,90,76,12,2
Vive helping me with the groceries.,1.1777777777777778,0.046279231145300956,90,76,12,2
My KINGDON for a quarter!,1.1777777777777778,0.046279231145300956,90,76,12,2
"It's rude to point -- put that hand of yours back in your shirt right this minute, young man!",1.1777777777777778,0.046279231145300956,90,76,12,2
"This caption is funny, but it was submitted by a woman!",1.1777777777777778,0.046279231145300956,90,76,12,2
"I feel like I’m stuck in place, but I wouldn’t call it a complex,",1.1777777777777778,0.04349803840706918,90,75,14,1
"Military genius, bedtime!",1.1775700934579438,0.0415980465952582,107,90,15,2
Stop Colonializing the parking lot and get in the car.,1.1772151898734178,0.04323607918126412,79,65,14,0
"Russia can wait, get in the car!",1.1772151898734178,0.04683939034393647,79,66,12,1
Waterloo is not a beach.,1.1772151898734178,0.05332043114452347,79,68,8,3
"Well the Prussians can just wait. 
I’ve got to get dinner on",1.1772151898734178,0.05018464339431694,79,67,10,2
At least the price of the ride isn’t as inflated as your ego.,1.1772151898734178,0.05332043114452347,79,68,8,3
"OK, this is the last ride and if you keep whining, I’ll drop you in Elbaland!",1.1772151898734178,0.05628177611146416,79,69,6,4
"Russia's the other direction, pal.",1.1772151898734178,0.05018464339431694,79,67,10,2
"You can cross the Alps some other time, Little Corporal.",1.1772151898734178,0.05018464339431694,79,67,10,2
I think somebody needs an exile,1.1772151898734178,0.04683939034393647,79,66,12,1
"Okay, little man - time for your exile.",1.1772151898734178,0.05018464339431694,79,67,10,2
"Sorry, kid, 
Elba's the other way.",1.1772151898734178,0.04683939034393647,79,66,12,1
It’s time to put all the shopping carts back.,1.1772151898734178,0.05018464339431694,79,67,10,2
