caption,mean,precision,votes,not_funny,somewhat_funny,funny
You'll have to lead your troops to victory another time because I'm out of quarters and patience,1.2520325203252032,0.04842377012779183,123,98,19,6
Stay away from the water in the loo.,1.2520325203252032,0.0511020699780237,123,100,15,8
You get a ride when the price gets back down to a quarter.,1.2520325203252032,0.04702745466282882,123,97,21,5
You might want to turn around--you're heading straight towards Waterloo.,1.2520325203252032,0.04842377012779183,123,98,19,6
"Ok, I'll catch up with you at Waterloo",1.2520325203252032,0.04842377012779183,123,98,19,6
I hope you get there before you run out of quarters.,1.2520325203252032,0.04410239732049511,123,95,25,3
Your lieutenant will be in the produce aisle when your trusty steed comes to a halt.,1.2520325203252032,0.04842377012779183,123,98,19,6
Get in the car right now or you’re gonna find out what Waterloo means,1.2519685039370079,0.047389685263170056,127,101,20,6
Where is that energy when I ask you to clean your room?,1.2519685039370079,0.049957492163318996,127,103,16,8
"Keep doing that, and one day you'll look as stupid as Donald Trump.",1.251908396946565,0.042449253251738844,131,101,27,3
Of course you have a complex. You're in middle school.,1.251908396946565,0.0464139907562274,131,104,21,6
"Right now, you precocious little turd.",1.2518518518518518,0.050117075226360955,135,111,14,10
You'll need more than 50 cents to get out of Elba.,1.2517985611510791,0.04689673819985177,139,112,19,8
We have enough Napoleon wannabes already!,1.2517985611510791,0.042216660165913016,139,108,27,4
"O.K., but this time take no prisoners.",1.2517482517482517,0.04264999541139126,143,112,26,5
Only 2 more quarters and the revolution is ours!,1.2517482517482517,0.04598370665040282,143,115,20,8
"Not to worry, I’m sure you’ll grow out of it.",1.25,0.042268793820328485,124,95,27,2
You can conquer the toy store later. Mommy is going home.,1.25,0.048297927830185765,112,88,20,4
"Sorry.  If you can't conquer in the allotted 90 seconds, you're done.",1.25,0.047706502325633324,120,95,20,5
It's Bed Bath & Beyond or Elba - the choice is yours.,1.25,0.04993560847296239,112,89,18,5
"You are overcompensating, young man!",1.25,0.042958962288966916,128,99,26,3
"You can cosplay all you want, but I’m not making Veal Marengo tonight.",1.25,0.04621530419392146,120,94,22,4
"First make your bed,then conquer Europe.",1.25,0.04660273245009,112,87,22,3
In the car now! Or it's straight to Elba with you when we get home!,1.25,0.04351941398892446,132,103,25,4
"That hat reminds me, I forgot to buy corn.",1.25,0.05176784759846126,116,94,15,7
"If you don't get off right now, I'm sending you to Elba",1.25,0.04878585829946003,116,92,19,5
You'll grow out of that complex.,1.25,0.04547906467530975,140,112,21,7
"Freedom's not free, but I hope they take Venmo.",1.25,0.04766075165356461,108,84,21,3
"No, another 50 cents will not get you all the way to Russia.",1.25,0.04380651604022256,148,118,23,7
It's not the Alps. It's Columbia Park.,1.25,0.04807465345971242,124,99,19,6
Hurry up! Our next stop is the Russian Tea Room.,1.25,0.05,100,78,19,3
Too bad your reality will grow up to be like mine.,1.25,0.04610054485521032,132,105,21,6
"When you’re done crossing the alps and conquering Europe, I could use a little help with the groceries.",1.25,0.05192377520339357,120,98,14,8
So you're conquering Russia single-handedly? Good. Find your own kopeks to put in the slot.,1.25,0.05192377520339357,120,98,14,8
"We came, you paid, I played",1.25,0.05055712025979709,120,97,16,7
You'll never handle a Moscow winter in those shorts,1.25,0.04621530419392146,120,94,22,4
You can conquer the world after you clean your bedroom.,1.25,0.04238884637277001,144,113,26,5
"Okay, little General, that way, Waterloo, this way, milk and cookies.",1.25,0.044621345688633046,144,115,22,7
"After Waterloo,it's time to clean your room",1.25,0.04669091947809488,124,98,21,5
Do you really want to pick this bone apart?,1.25,0.05600802246842692,108,89,11,8
"I don't think that horse is getting you across the Alps, General",1.2481203007518797,0.04452991733786778,133,105,23,5
"If we leave now, you can conquer your brother's room before dinner.",1.248062015503876,0.042668679954077526,129,100,26,3
After the supermarket do you want to go to Waterloo or water park?,1.248062015503876,0.04406518217403905,129,101,24,4
"Wrap it up. Time for your nappy, Nappy.",1.248062015503876,0.04801158582107557,129,104,18,7
"Oh, does your ice cream revolution require my 50 cents?",1.248062015503876,0.04673316105343991,129,103,20,6
Why don't you go conquer cleaning your room now.,1.2479338842975207,0.0443517615371859,121,94,24,3
"Honey, you can continue expanding the French empire and scheduling catholic holidays over pagan ones when we get home, but I’m out of coins.",1.2479338842975207,0.050180105009647265,121,98,16,7
"I think it is time for a nap, Leon.",1.2479338842975207,0.04587831512036333,121,95,22,4
Are you ready for your nap Emperor?,1.2478632478632479,0.049912955334506286,117,94,17,6
You might want to lead off with a call to quarters.,1.2478632478632479,0.04526827212564247,117,91,23,3
"Honey, don't go too far, you may get lost on the way back .",1.2478632478632479,0.04526827212564247,117,91,23,3
Let’s hope you can conquer the Austrians into giving you a ride home.,1.2478632478632479,0.046867671987938044,117,92,21,4
It’s Beef Wellington tonight then off Aunt Helena’s,1.2478632478632479,0.05136794064932088,117,95,15,7
"You do realize we live in Waterloo, NJ?",1.247787610619469,0.04954115225390569,113,90,18,5
Finish your home work and then you can cross the Alps.,1.247787610619469,0.05111118839882061,113,91,16,6
"No, Putin's the one without a shirt.",1.247787610619469,0.052634412625532395,113,92,14,7
Is this your first rodeo?,1.247787610619469,0.05111118839882061,113,91,16,6
"That's the wrong complex, honey.",1.247787610619469,0.04954115225390569,113,90,18,5
"Allons, enfant!",1.2477064220183487,0.04544483817565494,109,84,23,2
"Hey pal,  the Alps are over this way.",1.2476190476190476,0.04838216375282526,105,82,20,3
"Don't forget dear,you only have 30 minutes to conquer the World.",1.2476190476190476,0.05203012719286361,105,84,16,5
"Come on, Napoleon, we're late for dinner with the Wellingtons!",1.2476190476190476,0.050239267038397185,105,83,18,4
"You’ve been playing civilization again, haven’t you",1.2476190476190476,0.04838216375282526,105,82,20,3
Why don’t you just join QAnon like the other boys your age?,1.2475247524752475,0.05523297299398555,101,82,13,6
Mosco Street? I think it's in Chinatown.,1.2475247524752475,0.05699737807771981,101,83,11,7
50c won't get you to Russia,1.2475247524752475,0.05152321517329776,101,80,17,4
And you'll stay his size forever if you don't eat these vegetables,1.2475247524752475,0.05699737807771981,101,83,11,7
I don’t think you’re old enough to have a Napoleon complex.,1.2475247524752475,0.05523297299398555,101,82,13,6
"Yes, but the Lunch Brigade is this way.",1.2475247524752475,0.04956432083478743,101,79,19,3
Wait 'til Spring.,1.2475247524752475,0.05341031270994525,101,81,15,5
"1) you are not french and 
2) there will be no “Recess Revolution” at school",1.2474226804123711,0.05290310762316375,97,77,16,4
Charge of the Tantrum Brigade!,1.2473118279569892,0.05439091527063355,93,74,15,4
Russia? Dressed like that?,1.2473118279569892,0.0564989004731404,93,75,13,5
It’s starting to feel like it would have been cheaper to buy you the pony you asked for.,1.247191011235955,0.05600073616090189,89,71,14,4
"Now, conquer your homework",1.2461538461538462,0.04376652217065625,130,102,24,4
"I don't care that Jimmy's mother let him annex Lombardy, it's not happening.",1.2461538461538462,0.04767903329604257,130,105,18,7
"If your Dad finds out how much money you spent on this ride, you're gonna learn the hard way what Waterloo means.",1.246031746031746,0.047390988275359834,126,101,19,6
"Sorry, Napoleon, the baguette’s coming with me over the Bronx River",1.246031746031746,0.044631127206771724,126,99,23,4
Good thing it only cost 50 cents. You're about to cross a river on a horse that can't swim.,1.2459016393442623,0.048429439073835824,122,98,18,6
"No, I’ve done enough photos for your #history Instagram feed",1.2459016393442623,0.048429439073835824,122,98,18,6
Let's go. Everyone already knows a recession is coming.,1.2457627118644068,0.043290087533816725,118,91,25,2
"It's time to charge to the car, Napoleon !",1.2457627118644068,0.046516242130829305,118,93,21,4
You need to shift the campaign over to the drugstore now.,1.2457627118644068,0.048048156401865744,118,94,19,5
"No, I told you the Choco Tacos are no more!",1.2457627118644068,0.048048156401865744,118,94,19,5
I told you the car is THIS way!,1.2457627118644068,0.04493212915420019,118,92,23,3
"Yes, son, posting the revolution on TikTok counts as screen time.""",1.2457627118644068,0.04493212915420019,118,92,23,3
"Enough , already, mon petit colonel",1.2456140350877194,0.049152740009623504,114,91,18,5
Have fun. Marengo dies in 3 minutes.,1.2454545454545454,0.05196130535092515,110,89,15,6
"Sorry love, but I don't know the French word for ""Giddyup""",1.2454545454545454,0.04864530718359612,110,87,19,4
"EXILED,on Main Street!",1.2454545454545454,0.050330622710028694,110,88,17,5
Fifty cents! Even kings can’t avoid inflation.,1.2452830188679245,0.04981785467233606,106,84,18,4
"For my 50c, I assumed you knew which side we were on.",1.2452830188679245,0.04981785467233606,106,84,18,4
Sorry but your little war is already over budget!,1.2450980392156863,0.05293973839875468,102,82,15,5
Forget Waterloo...ditch the hat...dismount..and come home to lunch!!,1.2450980392156863,0.051073269338898615,102,81,17,4
no more of those genealogy websites when we get home.,1.2450980392156863,0.05293973839875468,102,82,15,5
Too short for an e-bike?,1.2448979591836735,0.048241154875598914,98,76,20,2
"Hurry up, Bud. Jacques-Louis David & Busters is closing soon.",1.2444444444444445,0.04394411580826142,135,107,23,5
You know Napoleon ate his vegetables.,1.2442748091603053,0.042099347106901525,131,102,26,3
"Get off your horse, you'll be late for your violin lesson.",1.2442748091603053,0.042099347106901525,131,102,26,3
Which way to the Ladies Room?,1.2439024390243902,0.04807567590482465,123,99,18,6
"No, I do not have 40 quarters for a $10 bill.",1.2439024390243902,0.04807567590482465,123,99,18,6
"Why don’t you first conquer the mess in your room, young man?",1.2439024390243902,0.04666894676742699,123,98,20,5
Don't fall and crack your Bonesapart,1.2439024390243902,0.04666894676742699,123,98,20,5
I have one word for you: Waterloo.,1.2436974789915967,0.04616990623084198,119,94,21,4
"We came. We saw. We're a mere twenty-five cents short of conquering. If you would be so kind, Mother.",1.2436974789915967,0.044600789096914985,119,93,23,3
"Mommy will be back in two hours, enough time to be George Washington AND Napoleon.",1.2436974789915967,0.0476874207172289,119,95,19,5
"No, you can’t conquer Russia!",1.2436974789915967,0.0476874207172289,119,95,19,5
Give me another fifty cents or... give me a new computer!,1.2436974789915967,0.04297441721268875,119,92,25,2
If I had a dollar I'd capture Moscow!,1.2436974789915967,0.04616990623084198,119,94,21,4
"Come along dear, we have to get to Waterloo Station.",1.2436974789915967,0.04297441721268875,119,92,25,2
"Ok son,you made your point.",1.2436974789915967,0.044600789096914985,119,93,23,3
To the Moon Alice!,1.2436974789915967,0.04616990623084198,119,94,21,4
Think your bronco's busted.,1.2434782608695651,0.04718030130356049,115,91,20,4
I’m just glad we vacationed in France instead of Germany this summer.,1.2434782608695651,0.04718030130356049,115,91,20,4
Come on short stuff. Get off your high horse and help with the groceries.,1.2434782608695651,0.04877023818264036,115,92,18,5
"Slow down, you still have four more years of Oedipal.",1.2434782608695651,0.04553488256049456,115,90,22,3
"Come, Your Eminence. The Royal Dodge Caravan awaits.",1.2432432432432432,0.0515385183375996,111,90,15,6
Stop trying to imitate your fucking father,1.2432432432432432,0.05310385142562876,111,91,13,7
You could have just told me your history report topic.,1.2432432432432432,0.04825576177861834,111,88,19,4
"You’re tall for your age, Billy, but don’t let it go to your head.",1.2429906542056075,0.04758517314361994,107,84,20,3
If you don’t get in the car you’re going to be exiled,1.2429906542056075,0.04758517314361994,107,84,20,3
"Waterloo, Iowa? Ok, but you won't like it.",1.2429906542056075,0.0511568195807617,107,86,16,5
You can have liberté when you’re eighteen.,1.2429906542056075,0.0511568195807617,107,86,16,5
It's not polite to point.,1.2427184466019416,0.04871471870276674,103,81,19,3
Time for dinner…. You can invade Russia tomorrow!,1.2427184466019416,0.05247722016731465,103,83,15,5
For the last time....we're not getting a St. Bernard.,1.2427184466019416,0.05247722016731465,103,83,15,5
"I got the baguette you asked for, but we will not be invading Russia today.",1.2427184466019416,0.04871471870276674,103,81,19,3
That is NOT my kid. We will just be leaving in the same car.,1.2426470588235294,0.042390861443509856,136,107,25,4
"You know the ""Quarter"" Horses are widely considered to be the fastest",1.2426470588235294,0.04608451496483136,136,110,19,7
"Hi Ho Silver, that change was for the meter.",1.2424242424242424,0.05389566925536249,99,80,14,5
I think I liked your Joan of Arc phase better.,1.2424242424242424,0.04992451339684328,99,78,18,3
"Come on, I don't care if you are only two quarters away from world domination?",1.2424242424242424,0.04702730530282264,132,107,18,7
"We have to go Billy, that’s enough toxic masculinity for one day!",1.2424242424242424,0.04578107712844859,132,106,20,6
"Get it in, son. Inflation’s about to make this ride $1",1.2424242424242424,0.04824135015781403,132,108,16,8
Onward to the Polish bakery!,1.2421875,0.04539049423914243,128,102,21,5
Hurry up. Your father wants a turn before we go...,1.2421875,0.04672610045078247,128,103,19,6
"John, I think Mikey may be literally showing some worrisome inclinations.",1.2421875,0.04672610045078247,128,103,19,6
"Fine, but before we cross the Alps, what say we first get these chipwiches into the freezer?",1.2421052631578948,0.0554242306834273,95,77,13,5
No! I am not going to give you another two quarters so you can conquer Russia.,1.2419354838709677,0.04341048188296504,124,97,24,3
You got taken for a ride.,1.2416666666666667,0.04582855844748356,120,95,21,4
"For the last time, you cannot invade Russia in the winter.",1.2416666666666667,0.04733194261577883,120,96,19,5
Prussia is this way.,1.2413793103448276,0.049918508786983055,116,94,16,6
"For the last time, you're  not invading Moscow.  So calm down.",1.2413793103448276,0.04518940591634643,116,91,22,3
napolean SHOPPING COMPLEX,1.2413793103448276,0.04518940591634643,116,91,22,3
Manoeuvre your derrière to the car now please,1.2410714285714286,0.04787225553270457,112,89,19,4
Let's go. Time to retreat.,1.2410714285714286,0.044384710521059405,112,87,23,2
"Aux voiture, Citoyen",1.2410714285714286,0.04952401448452785,112,90,17,5
It’s not a phase mom!,1.2410714285714286,0.05417797978228061,112,93,11,8
Listen to mommy or you may be in for a little corporal punishment.,1.2409638554216869,0.05836029994267084,83,67,12,4
"Into the fray tomorrow, sir. Right now is homework.",1.2408759124087592,0.04211755849911165,137,108,25,4
"Napoleon, your time is up.",1.2407407407407407,0.048995394649344264,108,86,18,4
Why are you calling me Josephine?,1.2407407407407407,0.043374392183180635,108,83,24,1
Keep it up and you’ll get a complex!,1.2407407407407407,0.04719616965725907,108,85,20,3
Waterloo? Nice place to visit...,1.2406015037593985,0.04547210134179587,133,107,20,6
Get off that now or I’m sending you into exile,1.2403846153846154,0.05019601664794919,104,83,17,4
"No, I don't want cake!",1.2403846153846154,0.04830045123945617,104,82,19,3
"If you don't get off that horse right now, you'll be seeing your Waterloo!",1.2403846153846154,0.05019601664794919,104,83,17,4
"Hey Napolean, after you're done advancing on Moscow, go ahead and advance on the parking lot and help me put the groceries in the car.",1.2403846153846154,0.05019601664794919,104,83,17,4
"There is joy in danger, Mother.",1.2403100775193798,0.04640046470470108,129,104,19,6
A ride to Waterloo was only a penny when I was your age!,1.2403100775193798,0.04768780929986155,129,105,17,7
"After you've finished crossing the Alps, you have to go home and clean your room.",1.24,0.04948216697442473,100,79,18,3
You’re already too tall.,1.24,0.04310527248642598,125,98,24,3
"Next time, you're staying in Elba, young man.",1.24,0.04948216697442473,100,79,18,3
"No more, I’m out of Francs!",1.24,0.04310527248642598,125,98,24,3
Keep it up and you'll stunt your growth,1.24,0.042923469599092795,100,76,24,0
I thought you liked my Beef Wellington,1.24,0.04457686366483794,125,99,22,4
Russia’s the other direction,1.2396694214876034,0.04842533286844887,121,98,17,6
This could end badly.,1.2396694214876034,0.04698161147287435,121,97,19,5
"Nap dear, that horse is not Marengo, and besides, from what I have heard about Russian winters, you would not last a day!",1.2393162393162394,0.04484898301597752,117,92,22,3
I told your father we should have named you Hannibal.,1.2393162393162394,0.04802245006476562,117,94,18,5
"No, not to conquer Russia.  We're going home to make sandwiches.",1.2393162393162394,0.046462818402408325,117,93,20,4
Where's the croissants?,1.2393162393162394,0.046462818402408325,117,93,20,4
Get down or you’re going to wish you were on Elba.,1.2391304347826086,0.05435976935181601,92,74,14,4
"Well, able was I ere I saw Aldi.",1.238938053097345,0.05224773279335481,113,93,13,7
Who do you think you are?!,1.238938053097345,0.05071289549168667,113,92,15,6
Let’s go. You can conquer your homework.,1.238938053097345,0.045800811460775734,113,89,21,3
"That's it, we're changing schools!",1.238938053097345,0.047494653839780694,113,90,19,4
"No, I won’t pull your finger.",1.238938053097345,0.05071289549168667,113,92,15,6
Waterloo’s not here! It’s in Iowa!,1.238938053097345,0.047494653839780694,113,90,19,4
"Sorry, Napoleon. I’m out of quarters.",1.238938053097345,0.045800811460775734,113,89,21,3
You can play art history at home.,1.238938053097345,0.05224773279335481,113,93,13,7
Let's go. Time for your nap-oleon.,1.238938053097345,0.05071289549168667,113,92,15,6
"Yes, you'd make a fine president - now get in the car.",1.238532110091743,0.050311774431205165,109,88,16,5
Moscow is this way.,1.238532110091743,0.0449621023807155,109,85,22,2
I have supplies. Now we conquer Bed Bath and Beyond.,1.238532110091743,0.048594032361072494,109,87,18,4
C.mon Napoleon. Waterloo is this way!,1.238532110091743,0.048594032361072494,109,87,18,4
Just remember that I can be the Duke of Wellington.,1.2380952380952381,0.04837495275885827,126,103,16,7
"When your time is up, I'll be on the aisle of Volvo.",1.2380952380952381,0.057732660874787296,84,68,12,4
"Let’s Go, Napoleon.  Help me with the groceries. An army travels on its stomach",1.2380952380952381,0.05665235144082404,105,88,9,8
OK Napoleon we are out of quarters.,1.2380952380952381,0.04789298495629314,105,83,19,3
You can't go to Moscow. Your snow suit is in storage.,1.2380952380952381,0.045674585936311615,126,101,20,5
"Son, it's not social commentary when you were born with white male privilege.",1.2380952380952381,0.04129425407367391,126,98,26,2
"Too tall,to be my Josephine.",1.2377049180327868,0.04205350539350959,122,95,25,2
Leave Mike Pence alone.'',1.2377049180327868,0.04663631960750777,122,98,19,5
Mommy can't afford  to buy groceries and storm the Bastille.,1.2377049180327868,0.04663631960750777,122,98,19,5
I bought your spaghetti.  Vive La Franco-American.,1.2377049180327868,0.04363462286723504,122,96,23,3
You know that’s not what I meant by Nap time!,1.2377049180327868,0.04363462286723504,122,96,23,3
"Your rocking horse dragoons will arrive shortly, mon general .",1.2376237623762376,0.04482863929770998,101,78,22,1
Onward to ice cream!,1.2376237623762376,0.05102613357118861,101,81,16,4
"No,I don't think Napoleon had a Timmy Complex!",1.2376237623762376,0.05102613357118861,101,81,16,4
"O.K. Bonaparte, it's Nap time.",1.2376237623762376,0.0490473904019835,101,80,18,3
"If you keep it up, they'll write an ABBA song about you.",1.2372881355932204,0.04915329166657519,118,96,16,6
Line starts over there.,1.2372881355932204,0.04765691481847306,118,95,18,5
"Oh yeah?  Well, at least you're the right height...",1.2372881355932204,0.04765691481847306,118,95,18,5
Don't point! It's not polite.,1.2372881355932204,0.0411305643462176,118,91,26,1
Gonna be rough without that grain from Ukraine...,1.2372881355932204,0.044513508362369864,118,93,22,3
I put in five dollars.  That should get you as far as Minsk.,1.236842105263158,0.04874234413978753,114,92,17,5
"OK Napoleon, Josephine is waiting for you at home. Do NOT keep her waiting!",1.236842105263158,0.050309755588419026,114,93,15,6
Must be this short to ride,1.236842105263158,0.050309755588419026,114,93,15,6
The insurrection is this way.,1.236842105263158,0.04370411796234467,114,89,23,2
"Eventually, I should tell him that he was actually named after the ice cream flavor...",1.236842105263158,0.05330649395351772,114,95,11,8
They were out of crêpes.,1.2366412213740459,0.045762363369893325,131,106,19,6
I don't think you meet the height requirements.,1.2366412213740459,0.04311976666223454,131,104,23,4
"I’m sorry, I can’t fight on the Russian front, I have to make dinner tonight.",1.2366412213740459,0.044460702750877136,131,105,21,5
"Let's go.  The price of groceries today already was our Waterloo.""",1.2365591397849462,0.05801341404418132,93,77,10,6
You're six. You're supposed to be short.,1.2365591397849462,0.05383352141248461,93,75,14,4
"Last ride, I’m out of munitions.",1.2363636363636363,0.04989943636291466,110,89,16,5
When you get your allowance.,1.2363636363636363,0.04643643404214965,110,87,20,3
Be glad that pony can't charge into battle.,1.2363636363636363,0.04643643404214965,110,87,20,3
"Conquer the world later, Napoleon. It's your nap time.",1.2363636363636363,0.04989943636291466,110,89,16,5
We ride at nap time!,1.236220472440945,0.039457470809377705,127,98,28,1
Don't worry.  You won't always be short like him.,1.236220472440945,0.04250718476420963,127,100,24,3
"The Alps await…Mom, I need another quarter.",1.236220472440945,0.045352282307337274,127,102,20,5
"While you're at it, why don't you conquer your homework?",1.236220472440945,0.045352282307337274,127,102,20,5
Ready to surrender? These pomme frites are getting cold.,1.236220472440945,0.046709890681067734,127,103,18,6
"Hey Little Man, we’re just crossing town, not the Alps.",1.236220472440945,0.045352282307337274,127,102,20,5
"Fine, French fries and French toast for dinner, now dépêche-toi!",1.2359550561797752,0.05766673633560067,89,73,11,5
Onward and upward to the car buddy.,1.2359550561797752,0.053054003145599986,89,71,15,3
You know that the front hooves in the air means the rider died in battle… right?,1.2359550561797752,0.050590163419978754,89,70,17,2
"I can't wait for you to grow out of this phase, which should be in about three weeks.",1.2358490566037736,0.04934774344395486,106,85,17,4
"Impressive, but still no macarons until after dinner.",1.2358490566037736,0.0474921600234526,106,84,19,3
Vive La Parking Lot!,1.2358490566037736,0.04556106610227715,106,83,21,2
"Remember, 'Waterloo' isn't just an ABBA song.",1.2358490566037736,0.0474921600234526,106,84,19,3
"Revolution is all well and good, but empire will get you grounded.",1.2358490566037736,0.05113603721767605,106,86,15,5
When I grow up I want to be a precedent.,1.2357723577235773,0.046295962192056256,123,99,19,5
"I love your enthusiasm, honey, but don't expect Waterloo to be a cakewalk.",1.2357723577235773,0.04332154282385029,123,97,23,3
"Little Man Syndrome, now only 50 cents",1.2357723577235773,0.04483342607880306,123,98,21,4
Food prices are killing me. Go find a quarter horse.,1.2357723577235773,0.046295962192056256,123,99,19,5
"Hey! Everyone in the family is tall, so cut it out!",1.2352941176470589,0.047296791851385606,119,96,18,5
I told your father we should have names you Scott.,1.2352941176470589,0.05021798707662224,119,98,14,7
"Water, Lou?",1.2352941176470589,0.05951969008648676,85,70,10,5
No.  I will not drive you to Russia.,1.2352941176470589,0.047296791851385606,119,96,18,5
You are learning way too much from your father!,1.2352941176470589,0.04658075943697518,102,80,20,2
Now Donald! Get off that hobby horse!,1.2352941176470589,0.050577082470770814,102,82,16,4
"At checkout, we ride!!",1.2352941176470589,0.05161662599710533,119,99,12,8
The only things going in that direction are prices,1.2348484848484849,0.04670479649701895,132,108,17,7
"I said you should TAKE a nap, not BE a nap.",1.2348484848484849,0.045449726014839965,132,107,19,6
"I'm sorry, but you'll have to cross the Alps another day. Right now we need to get home, so I can start making dinner.",1.2348484848484849,0.044158998786431834,132,106,21,5
Let's go.  You won't have any more luck than he did.,1.2347826086956522,0.0514183790085221,115,95,13,7
"Reign of terror time is over honey, let's head off to exile.",1.2347826086956522,0.045095770252620654,115,91,21,3
"Jeez, OK... we'll get french vanilla next time.",1.2347826086956522,0.045095770252620654,115,91,21,3
Looky mommy...I'm a blood thirsty mega maniac !,1.2347826086956522,0.048360511755673,115,93,17,5
I think it's Nap time.,1.2347826086956522,0.043371340691526074,115,90,23,2
"I said you need to take a nap, not be one!",1.2347826086956522,0.04991286806593372,115,94,15,6
"Good job, honey!  We’ll call this your first riding lesson.",1.2346938775510203,0.05189653807776411,98,79,15,4
