caption,mean,precision,votes,not_funny,somewhat_funny,funny
Get down before you hit Waterloo!,1.1466666666666667,0.04911223892281852,75,66,7,2
"We're done, not Verdun.",1.1466666666666667,0.04911223892281852,75,66,7,2
"It's your kingdom for a horse, not your empire.",1.1466666666666667,0.0452951614596046,75,65,9,1
"One way or the other, it's Nap time.",1.1466666666666667,0.0452951614596046,75,65,9,1
"The British are coming, the British are coming…! To arms!”…",1.1466666666666667,0.0452951614596046,75,65,9,1
It's Wellington's turn.,1.1466666666666667,0.0452951614596046,75,65,9,1
You're not old enough for that ABBA song.,1.1466666666666667,0.0452951614596046,75,65,9,1
All roads lead to Rome but yours might be the more scenic route,1.1466666666666667,0.0452951614596046,75,65,9,1
It isn’t their fault this time. Throwing tea into the harbour will only drive prices up more.,1.1466666666666667,0.05265332251978379,75,67,5,3
You’re about the right size,1.1466666666666667,0.0452951614596046,75,65,9,1
I knew this was the wrong complex.,1.146341463414634,0.04293490384215413,82,71,10,1
He'd salute France with another finger.,1.146341463414634,0.049453353904863606,82,73,6,3
Giddy-up!  I'm going that-away,1.146341463414634,0.04293490384215413,82,71,10,1
Next time try to help me conquer the food bill.,1.146341463414634,0.049453353904863606,82,73,6,3
"No, you cannot go to Elba!",1.146341463414634,0.04293490384215413,82,71,10,1
"You know he was actually riding a mule,right?",1.146341463414634,0.04293490384215413,82,71,10,1
Time's up. Get off the throne or throw in two more quarters.,1.146341463414634,0.03927202370241044,82,70,12,0
I’m out of quarters.  We’ll do Austerlitz next time. And don’t call me Josephine!,1.146341463414634,0.03927202370241044,82,70,12,0
"Son, you are stuck. 
 It would be better to get off .  Carry your mother                    this stock home.",1.146341463414634,0.03927202370241044,82,70,12,0
No.  We are going to the Statue of Liberty ride. I'm tired of Narcissists.,1.146341463414634,0.04630896338925494,82,72,8,2
Be sure to drink some milk when you get  there.,1.146341463414634,0.04293490384215413,82,71,10,1
Fifty cents won't get you world domination. Get off your high horse and help me load the car.,1.146341463414634,0.03927202370241044,82,70,12,0
My kingdom for a mechanical horse!,1.146341463414634,0.03927202370241044,82,70,12,0
I'll settle for you making it to the car.,1.146341463414634,0.04293490384215413,82,71,10,1
"Mom, l need 50 cents therefore l can conquer Russia",1.146341463414634,0.049453353904863606,82,73,6,3
History is written by quarters.,1.146067415730337,0.04391049082779304,89,78,9,2
"Enough Russia, my little Ukrainian. Lets go home.",1.146067415730337,0.04391049082779304,89,78,9,2
"I don't have time for that, Jimmy.  We have to go home and you have to clean your room.  My stuff  ""trumps your stuff right now"".",1.146067415730337,0.04391049082779304,89,78,9,2
There is only one step from the sublime to the ridiculous.,1.146067415730337,0.040899493760002945,89,77,11,1
I'm next!,1.146067415730337,0.049384779381546805,89,80,5,4
"Billy, you're eight years old - I  was so hoping you had grown out of that Trump complex by now",1.146067415730337,0.04391049082779304,89,78,9,2
Let's go now or you'll really feel a Russian winter!!,1.146067415730337,0.04391049082779304,89,78,9,2
You can wait to conquer other lands until after you do your homework when we get home.,1.146067415730337,0.040899493760002945,89,77,11,1
Just think what I could do with the real thing!,1.146067415730337,0.04391049082779304,89,78,9,2
Stop or I am going to blow apart!,1.146067415730337,0.04391049082779304,89,78,9,2
Enjoy Moscow.,1.146067415730337,0.04391049082779304,89,78,9,2
"No, I am not giving you money so that you can invade the ice cream shop",1.146067415730337,0.03764845249025972,89,76,13,0
"Yes, I tried to -- but they declined my card.",1.145631067961165,0.0423194072188415,103,91,9,3
Carousel Carol?,1.144927536231884,0.04742006474057418,69,60,8,1
You've met your Waterloo.,1.144927536231884,0.04268963668731212,69,59,10,0
You thought Waterloo was bad?  Wait 'til you see what happens when you don't get off that horse and head to the car now!,1.144927536231884,0.05171962876419153,69,61,6,2
"Viva la quarters.""",1.144927536231884,0.04742006474057418,69,60,8,1
Trust me: you're headed to a place called Waterloo.,1.144927536231884,0.04268963668731212,69,59,10,0
"Vini,vidi,vici! Oh,wait…",1.144927536231884,0.04742006474057418,69,60,8,1
It runs on manure.,1.144927536231884,0.04742006474057418,69,60,8,1
"I don't care if you are crossing the Alps, it's time to go home, little man.",1.144736842105263,0.040626442725997976,76,65,11,0
It really doesn't work with the beach towel.,1.144736842105263,0.04850012612904946,76,67,7,2
"Come along, Little Napoleon
or you'll be exiled to Saint Helena
in your room.",1.144736842105263,0.04850012612904946,76,67,7,2
Stay here.  Do NOT go to Russia.,1.144736842105263,0.04850012612904946,76,67,7,2
"If you don’t come along right now, you’re going to see Elba, if I’m able.",1.144736842105263,0.05199172460609632,76,68,5,3
The recession is coming! The recession is coming!,1.144736842105263,0.05199172460609632,76,68,5,3
"Maybe by your buddy Brad, you’re a Napoleon, but by Napoleons, you ain’t no Napoleon.",1.144736842105263,0.04850012612904946,76,67,7,2
I think the little Emperor will  find his time in Elba awfully lonely if he doesn't get in the car right now.,1.144736842105263,0.04473684210526319,76,66,9,1
You can’t cross the Alps until after lunch. Now let’s go.,1.144578313253012,0.04245109239481769,83,72,10,1
I'm still not buying cake.,1.144578313253012,0.04578158588104717,83,73,8,2
Did you forget to buy the brancy?,1.144578313253012,0.04578158588104717,83,73,8,2
Let’s go Chad!  You can storm the Capital another day!,1.144578313253012,0.051804153562474094,83,75,4,4
"Sorry, I doubt Silver takes PayPal.",1.144578313253012,0.04245109239481769,83,72,10,1
When your son gets a better ride from a plastic horse than your husband can ever give you.,1.144578313253012,0.04245109239481769,83,72,10,1
Destined for world conquest.,1.144578313253012,0.048885703084378854,83,74,6,3
"Won't fly, you're too tall",1.144578313253012,0.04245109239481769,83,72,10,1
"Let's go home and have dinner, Naplean, so you can live to conquer another day.",1.144578313253012,0.04245109239481769,83,72,10,1
"Ok, but we're ordering pizza for dinner.",1.144578313253012,0.04578158588104717,83,73,8,2
You know the deal: no Napoleon till you finish your Beef Wellington.,1.144578313253012,0.03883602561080367,83,71,12,0
Trump can’t ride a horse but the hat would be an improvement son,1.144578313253012,0.04578158588104717,83,73,8,2
The Alps will have wait…So get off your high horse Marengo and get into my Mustang. Now.,1.144578313253012,0.04245109239481769,83,72,10,1
"No, the store doesn’t sell swords.",1.144578313253012,0.051804153562474094,83,75,4,4
"I know you want an ice cream sandwich, but I don’t want frozen food section to become your Waterloo.",1.144578313253012,0.04578158588104717,83,73,8,2
"Yeah, I have a syndrome—being dynamite.”",1.1444444444444444,0.040475053925719685,90,78,11,1
This must be Bon at party,1.1444444444444444,0.037263146675402876,90,77,13,0
"Okay Napoleon, time to march on your stomach",1.1444444444444444,0.04345017698959632,90,79,9,2
Let's go. I got the Elba toast.,1.1444444444444444,0.04345017698959632,90,79,9,2
"I called for an Uber, not a horse”",1.1444444444444444,0.04623424889153682,90,80,7,3
"Yes I bought cake... No, that's not what deserter means",1.1444444444444444,0.040475053925719685,90,78,11,1
To the candy store!,1.1444444444444444,0.04345017698959632,90,79,9,2
"I'm not posting you on Insta again today, Napoleon!",1.1444444444444444,0.037263146675402876,90,77,13,0
"No, it wasn’t. It was Douglas MacArthur who said, “I shall return.”",1.1428571428571428,0.05134648267484176,77,69,5,3
"The Russians are coming, the Russians are coming!",1.1428571428571428,0.05492594029673081,70,63,4,3
You'll be exiled to your room if you keep up this attitude.,1.1428571428571428,0.04419201606355329,77,67,9,1
Do you want some water?  I'm going to the loo.,1.1428571428571428,0.045266017894605576,84,74,8,2
I'm getting ready to cross the Delaware and meet my troops.,1.1428571428571428,0.045266017894605576,84,74,8,2
Got 2 quarters?,1.1428571428571428,0.04790300390810151,77,68,7,2
"Your dad is tacking a sign on your door that says ""Elba"" even as we speak.",1.1428571428571428,0.0421262731871135,70,60,10,0
"Okay, Napolean. You will have to pay for your own horsey ride.",1.1428571428571428,0.04299935704272291,91,80,9,2
"Next quarter, you're taking Spanish.",1.1428571428571428,0.04197797807648538,84,73,10,1
Waterloo looking at?,1.1428571428571428,0.04678356086900139,70,61,8,1
"'History says he was short, but this is ridiculous!""",1.1428571428571428,0.04678356086900139,70,61,8,1
One more time then onto Waterloo!,1.1428571428571428,0.04005926187397017,91,79,11,1
Love you baby. I suggest you avoid Waterloo,1.1428571428571428,0.04197797807648538,84,73,10,1
"I don’t care how much of the known world you’ve conquered, I won’t buy Poptarts for breakfast.",1.1428571428571428,0.05101745037270873,70,62,6,2
The student council election is over. Now let’s go.,1.1428571428571428,0.04419201606355329,77,67,9,1
The Napoleonic Nines.,1.1428571428571428,0.04790300390810151,77,68,7,2
I command you to go back to the cookie aisle,1.1428571428571428,0.04419201606355329,77,67,9,1
The ladies room is just past the water fountain.,1.1428571428571428,0.04005926187397017,91,79,11,1
There's nothing on my calendar about a Russian invasion.,1.1428571428571428,0.04419201606355329,77,67,9,1
"A bit young for that complex, aren’t you?",1.1428571428571428,0.038409489852704655,84,72,12,0
"Don’t forget your 3 o’clock play date with Izzy Fitzsimmons, General Bonaparte.",1.1428571428571428,0.0421262731871135,70,60,10,0
"If you dont get off that horse right now Napoleon Bonaparte, mommy is going to send you into exile""",1.1428571428571428,0.04790300390810151,77,68,7,2
"This is your Waterloo, Napoleon. Off the horse and get in the car!",1.1428571428571428,0.04197797807648538,84,73,10,1
"OK Napoleon, it’s time for your nap.",1.1428571428571428,0.05101745037270873,70,62,6,2
"We go now, or it’s Elba for you.",1.1428571428571428,0.04013939192492975,77,66,11,0
He has a big personality.,1.1428571428571428,0.045266017894605576,84,74,8,2
Imperialism Summer Sales 2022,1.1428571428571428,0.04790300390810151,77,68,7,2
"Come on Napolean.”

“I’ll do what I want, gosh!",1.1428571428571428,0.04005926187397017,91,79,11,1
50 cents for directions to Mall's Water-Loo,1.1428571428571428,0.05134648267484176,77,69,5,3
"Enjoy, Emmanuel! Your chauffeur will bring you back to l'Élysée when it's over.",1.1428571428571428,0.05101745037270873,70,62,6,2
"You climb off that horse this instant or I will exile you to Elba, young man.",1.1428571428571428,0.04419201606355329,77,67,9,1
"No, we have Conquest at Home",1.1428571428571428,0.04013939192492975,77,66,11,0
Russia ‘s that way.,1.1414141414141414,0.04063528958247828,99,87,10,2
"Knock it off, you may not like what's going on, but you were born an American, no moving to France.",1.1414141414141414,0.03801425648577053,99,86,12,1
"No, you can't brutally overthrow Papi's Deli.",1.141304347826087,0.04255774228461488,92,81,9,2
"No, another 50 cents won't fund your armies.",1.141304347826087,0.04255774228461488,92,81,9,2
Waterloo’s the other way.,1.1411764705882352,0.04151521329086001,85,74,10,1
"Forget them. I’m warning YOU right now,buddy",1.1411764705882352,0.04476186970406316,85,75,8,2
"Time for your nap now, Leon.",1.1411764705882352,0.04476186970406316,85,75,8,2
You are not in Boston anymore!,1.1411764705882352,0.05063446522912413,85,77,4,4
Look Mom. The British are coming! Another 50 cents or they'll get me!,1.1411764705882352,0.04476186970406316,85,75,8,2
Little generals have to start young and dream big.,1.1411764705882352,0.04778846120374095,85,76,6,3
You’re still mowing the yard.,1.1411764705882352,0.03799211615279771,85,73,12,0
"Oh well, his father thought that he was  Casanova.",1.1411764705882352,0.04476186970406316,85,75,8,2
"That’s not what I meant by, “Make it short.”",1.1411764705882352,0.04476186970406316,85,75,8,2
Don't wear those short pants to Russia.,1.141025641025641,0.03966375060019729,78,67,11,0
"sweetheart, take my picture!",1.141025641025641,0.04366020435906118,78,68,9,1
You're forgetting Russian winters.,1.141025641025641,0.047320331546548966,78,69,7,2
No I won'r get out there so you can 'take' me alive.,1.141025641025641,0.047320331546548966,78,69,7,2
"Hey Napoleon, unless you brought a lot of change with you, you'll never make it to Moscow",1.141025641025641,0.04366020435906118,78,68,9,1
At least you haven't dyed your hair orange.,1.141025641025641,0.047320331546548966,78,69,7,2
"50c for your kingdom? Not today, Napoleon.",1.141025641025641,0.05071700021369216,78,70,5,3
Let's go. Maybe you can conquer your messy room next.,1.141025641025641,0.04366020435906118,78,68,9,1
"Good, get that Napoleon complex out of the way now before you get older.",1.141025641025641,0.04366020435906118,78,68,9,1
"If chivalry is dead, help mom to the car.",1.141025641025641,0.05071700021369216,78,70,5,3
"Alright, time to cross the Aldi.",1.141025641025641,0.03966375060019729,78,67,11,0
Tell Marengo we'll see him next week—we have to go find you some gym shorts for Waterloo now.,1.141025641025641,0.04366020435906118,78,68,9,1
It's your sister's turn to choose and she decided on eclairs.,1.141025641025641,0.04366020435906118,78,68,9,1
"Able were you ere I put you in time out. Now come on, let's go!",1.141025641025641,0.047320331546548966,78,69,7,2
"Careful, you could fall and crack a rib.",1.141025641025641,0.04366020435906118,78,68,9,1
"I thought you were a ""big kid?""",1.141025641025641,0.04366020435906118,78,68,9,1
"Get in the car, you little autocrat!",1.141025641025641,0.047320331546548966,78,69,7,2
Come along now or I’m taking you to Elba!,1.141025641025641,0.04366020435906118,78,68,9,1
No one likes a little Napoleon!,1.141025641025641,0.047320331546548966,78,69,7,2
"Oh honey,I meant the bargain ride was ‘bonafide’.",1.141025641025641,0.047320331546548966,78,69,7,2
I always said you were a ‘complex kid’,1.141025641025641,0.05071700021369216,78,70,5,3
I don’t care if your about to win the Battle of Waterloo it’s time to go home for dinner.,1.141025641025641,0.047320331546548966,78,69,7,2
I bet you wish you were me right now.,1.1408450704225352,0.046163800079517044,71,62,8,1
Hurry up Little Guy you'll be late for your ballet lesson!,1.1408450704225352,0.046163800079517044,71,62,8,1
Damn inflation!  This used to be a quarter!,1.1408450704225352,0.046163800079517044,71,62,8,1
"We're heading back to port now, Captain!",1.1408450704225352,0.046163800079517044,71,62,8,1
"Amateurs talk tactics, professionals talk logistics.  And Mom's out of quarters, so let's go General Bonaparte.",1.1408450704225352,0.046163800079517044,71,62,8,1
"If you don't stop horsing around, I'm going to exile you to your room when we get home.",1.1408450704225352,0.05033399372892188,71,63,6,2
"Yeah, well I say it’s time to stop thinking and go.",1.1408450704225352,0.046163800079517044,71,62,8,1
"Mom, I already told you...the gun I want for my birthday is that way!",1.1408450704225352,0.046163800079517044,71,62,8,1
"OK, Napolean.
At nightfall, you will be exiled to your bedroom.",1.1408450704225352,0.04157742116654289,71,61,10,0
We can be Napoleon just for one day,1.1408450704225352,0.04157742116654289,71,61,10,0
You dogs care too much about what the humans think,1.140625,0.04913531839612815,64,56,7,1
Parking is that way,1.1403508771929824,0.046416689667799826,57,49,8,0
Follow me through frozen foods and we will finish off these barbarians of the North!,1.1403508771929824,0.05273590328947571,57,50,6,1
"While you're in there, pick me up a Napoleon?",1.1397849462365592,0.04212505550639785,93,82,9,2
Stay on any longer and it’ll be your Waterloo.,1.1397849462365592,0.04212505550639785,93,82,9,2
Don’t attack Russia!,1.1397849462365592,0.03615262258846411,93,80,13,0
"Young man,you put your hand back in you jacket where it belongs!",1.1397849462365592,0.03925259495524484,93,81,11,1
Come on General. The British already left.,1.1397849462365592,0.04481377458007401,93,83,7,3
After you've crossed the Alps you're still going back to Elba.,1.1397849462365592,0.04212505550639785,93,82,9,2
Something tells me you didn't watch Napoleon Dynamite.,1.1397849462365592,0.04481377458007401,93,83,7,3
"Weeeeeeee!”
“He really is little.",1.1397849462365592,0.03925259495524484,93,81,11,1
You can’t launch a coup on nap time Brian.,1.1395348837209303,0.041062465170461374,86,75,10,1
"With his mother's request for help carrying groceries, Leon met his Waterloo.",1.1395348837209303,0.037583616572355615,86,74,12,0
When you’re finished we will need to outflank the line at the butcher shop,1.1395348837209303,0.041062465170461374,86,75,10,1
"I have promised my son a ride, won't you soon have finished?You have been riding for more than 200 years!",1.1395348837209303,0.04426876841626457,86,76,8,2
"Well, George Washington had a hard time getting financial support from The Continental Congress… So you will just have to make do without $.50 …and these groceries",1.1395348837209303,0.037583616572355615,86,74,12,0
You can cross the Alps after you help me make dinner.,1.1395348837209303,0.04426876841626457,86,76,8,2
I'm giving you six quarters to capture the storefront.,1.1395348837209303,0.041062465170461374,86,75,10,1
Forget Moscow; you have homework to do Napoleon,1.1395348837209303,0.041062465170461374,86,75,10,1
Let's just see how you feel when you get a little taller.,1.139240506329114,0.043140950178920556,79,69,9,1
You’re too tall for that ride,1.139240506329114,0.043140950178920556,79,69,9,1
I’m doing this for you.,1.139240506329114,0.043140950178920556,79,69,9,1
"Timmy,if you really wanted to be a hero,you could help me with these bags.",1.139240506329114,0.043140950178920556,79,69,9,1
"Impressive, but you can’t turn that in as your history project.",1.139240506329114,0.039199128019855194,79,68,11,0
It will be Waterloo all over again young man if you don’t dismount and get in the car!,1.139240506329114,0.046751593846233896,79,70,7,2
Fine. Got it. French fries tonight.,1.139240506329114,0.039199128019855194,79,68,11,0
"Yes, it runs on electricity.  No, you're not Elon Musk.",1.139240506329114,0.046751593846233896,79,70,7,2
"Just pretend Mom, it's cheap! I can show a picture to my French history class for extra credit.",1.139240506329114,0.039199128019855194,79,68,11,0
"No, we’re going to the water PARK.",1.139240506329114,0.039199128019855194,79,68,11,0
"Napoleon, get off that horse and come help me conquer this store!",1.139240506329114,0.043140950178920556,79,69,9,1
"On some days I really hope you will 
meet your Waterloo.",1.139240506329114,0.043140950178920556,79,69,9,1
"Glad you’re not my kid, weirdo. Smell ya later!",1.1388888888888888,0.05346212279886589,72,65,4,3
"Cavalry also ride on their stomach, young man.",1.1388888888888888,0.04556013565281042,72,63,8,1
"If you're still that size at 18, then you can have a Napoleon Complex.""",1.1388888888888888,0.04104253469235572,72,62,10,0
"I know Russia is that way, but Josephine awaits us at after school care.",1.1388888888888888,0.04556013565281042,72,63,8,1
You’d be worth lots more than fifty cents if you hadn’t botched everything  up at Waterloo.,1.1388888888888888,0.03826076324884866,108,95,11,2
Moscow's in Russia Sweetie. It's a long way away and no one wants to conquer it anymore.,1.1388888888888888,0.05346212279886589,72,65,4,3
"Let’s go Napoleon, now!

(For want of a quarter the ride was over.)",1.1388888888888888,0.04966852391033734,72,64,6,2
"his mother didn't have to power his horse, though.",1.1386138613861385,0.03987530805069758,101,89,10,2
"And no, I am not going to help you recreate 'Liberty leading the people' by Delacroix.",1.1384615384615384,0.043172969847391635,65,56,9,0
I bought you a tasty Bass Napoleon.,1.1384615384615384,0.043172969847391635,65,56,9,0
"Time to get off your high horse, sweetheart !",1.1384615384615384,0.053154903696481744,65,58,5,2
ONE FINGER MEANS BY LAND.,1.1384615384615384,0.04842183966159297,65,57,7,1
You're going to be exiled to your room for the rest of the day if you don't get off of there right now!,1.1379310344827587,0.040619414815555276,87,76,10,1
"Yes, I just bought bandaids, but I am not Florence Nightingale.",1.1379310344827587,0.05187515763323573,58,51,6,1
J'en ai marre de ce petit morveux de merde !,1.1379310344827587,0.03718371489773737,87,75,12,0
I don't think a second French Revolution would be too popular today. Can't you just play cowboys and Indians like the other boys?,1.1379310344827587,0.040619414815555276,87,76,10,1
"Follow me, Madame!",1.1379310344827587,0.040619414815555276,87,76,10,1
"No, that's not a ""MAGA"" hat and you're too young to vote for Trump!",1.1379310344827587,0.040619414815555276,87,76,10,1
"When I asked for a pony, I didn't mean this, Mom.",1.1379310344827587,0.040619414815555276,87,76,10,1
Hop in your booster seat.,1.1379310344827587,0.04378635707980383,87,77,8,2
The rainbow is this way.,1.1379310344827587,0.04378635707980383,87,77,8,2
Napoleon historic reenactment  is the latest tik tok challenge y’all!,1.1379310344827587,0.03718371489773737,87,75,12,0
"While you’re expanding your empire, I’ll pack the groceries.",1.1375,0.042633817622437835,80,70,9,1
"Not now, Mother, I'm invading the Iberian Peninsula.",1.1375,0.04619629964906088,80,71,7,2
"I hope you realize that if you keep this up, you’re headed for a long “time-out” on the coin-operated island of St. Helena on the other side of the parking lot.",1.1375,0.04619629964906088,80,71,7,2
"It's time for your nap, oh Leon.",1.1375,0.042633817622437835,80,70,9,1
Running late for Austerlitz?  You were the one who insisted on being paid your allowance in francs.,1.1375,0.042633817622437835,80,70,9,1
You need help...,1.1375,0.03874515077865563,80,69,11,0
How much do they charge?,1.1375,0.03874515077865563,80,69,11,0
"You may be the same size as Napoleon, but at least he had a real horse""",1.1375,0.042633817622437835,80,70,9,1
Down Napoleon.  We have your room invasion before we’re both exiled!,1.1375,0.03874515077865563,80,69,11,0
Costly for little ambition.,1.1375,0.04619629964906088,80,71,7,2
"When you grow up, you won't care.",1.1375,0.042633817622437835,80,70,9,1
"You'll need another wing, Napoleon!",1.1375,0.03874515077865563,80,69,11,0
Able was I ere I saw those prices.,1.1375,0.04619629964906088,80,71,7,2
You get your Napoleon complex from your father.,1.1375,0.049503068566184395,80,72,5,3
"Of course we want to drive the Russians out of Ukraine, but Mommy doesn't have enough quarters.",1.1375,0.042633817622437835,80,70,9,1
You're not Washington. You're more like a Napoleon.,1.1375,0.042633817622437835,80,70,9,1
If you help me with the shopping I’ll buy you a real one.,1.1375,0.042633817622437835,80,70,9,1
So your Dad's still watching Yellowstone.,1.1372549019607843,0.03950581861179962,102,90,10,2
The hat is definitely going to disappear.,1.1369863013698631,0.04497195343285888,73,64,8,1
"Come with me right now, mister, or it’s back to Elba for you.",1.1369863013698631,0.04052109440479185,73,63,10,0
"One more minute, mom. I'm spearheading the American Revolution.",1.1369863013698631,0.04497195343285888,73,64,8,1
You're too short for that gesture.,1.1369863013698631,0.04497195343285888,73,64,8,1
I’m not worried.  Napoleon complex is just a stage all kids go through.  Most eventually grow out of it…unless they don’t.,1.1369863013698631,0.04052109440479185,73,63,10,0
Enough already.  I want to get home and try this new dildo I just bought.,1.1369863013698631,0.04902034372964355,73,65,6,2
«Those trees do grow money.»,1.1369863013698631,0.04497195343285888,73,64,8,1
"I told your Dad we shouldn’t have named you Napoleon, but Aiden wasn’t classy enough for him.",1.1369863013698631,0.04052109440479185,73,63,10,0
"Inflation is coming, inflation is coming!",1.1369863013698631,0.04052109440479185,73,63,10,0
Get in the car Bobby.  It’s time I tell you about a place called Waterloo.,1.1368421052631579,0.038477539050399544,95,83,11,1
Grow up.,1.1363636363636365,0.040185756578953784,88,77,10,1
Don’t make me send you back to St. Helena!,1.1363636363636365,0.0523853555060782,66,59,5,2
"You really think you're something, eh? Don't you know what Napoleon did? Sending soldiers to squash a slave rebellion in Haiti? Is that your idol? A champion of slavery? You sicken me. And no, I don't have a fifty cents.",1.1363636363636365,0.043314293849451554,88,78,8,2
Another 50 cents will be your Waterloo.,1.1363636363636365,0.040185756578953784,88,77,10,1
"Why are you pointing to the water, Lou?",1.1363636363636365,0.043314293849451554,88,78,8,2
"Enough, Napoleon, we have to go, NOW!",1.1363636363636365,0.04772866020849245,66,58,7,1
Aren’t you a little tall for that ride?,1.1363636363636365,0.04772866020849245,66,58,7,1
"Come along, dear, it's time for dinner.  You can finish conquering Europe tomorrow, sweetheart.",1.1363636363636365,0.040185756578953784,88,77,10,1
It’s a bird! …,1.1363636363636365,0.03679214606365355,88,76,12,0
I said 'No conquering.',1.1363636363636365,0.040185756578953784,88,77,10,1
"Paul,stop with the “recession is coming!” These prices are screaming that already.",1.1363636363636365,0.040185756578953784,88,77,10,1
Going straight for less than a buck. C’mon i’m also wearing a cape …,1.1363636363636365,0.04772866020849245,66,58,7,1
Kids will beat you up if you keep acting like that.,1.1363636363636365,0.04772866020849245,66,58,7,1
