caption,mean,precision,votes,not_funny,somewhat_funny,funny
"You have a choice. Stay here and face the  harsh Russian winter with your entire army stranded and in disarray, or come home for lunch.",1.7975206611570247,0.01918466137647,1694,734,569,391
"Sign the treaty, I’m out of quarters.",1.7798081315669256,0.016763110833672688,2189,967,737,485
"You know he lost, right?",1.7398884239888424,0.02057579193756975,1434,670,467,297
"Get over it, Donald. You lost the school election.",1.7221880762138906,0.02003991676478665,1627,820,439,368
Does somebody need to be put in exile?,1.7205263157894737,0.017560227668405985,1900,896,639,365
No.  No quarter will be given,1.719077568134172,0.025576022245300135,954,469,284,201
"'Cause je suis la maman, that's why.",1.7163299663299663,0.022365835817786776,1188,569,387,232
"If Napoleon listens to his mother he’ll avoid another a long, hungry march home.",1.7119244391971664,0.025107458636260425,847,383,325,139
I will give you no quarter.,1.710022271714922,0.016383428910584343,2245,1096,704,445
Let's go. Mommy doesn't have enough quarters to invade Russia.,1.7026128266033254,0.016758401019656376,2105,1028,675,402
C'mon. We have to pick up Josephine from daycare,1.7003610108303249,0.02043752838944588,1385,670,460,255
"Your supply line, with the ice cream, is going this way.",1.6923076923076923,0.022933045716965066,1066,513,368,185
You'll be happy to know that we're having Beef Wellington for dinner.,1.6874621441550575,0.0185632899326034,1651,808,551,292
Just stay out of Belgium until I finish shopping.,1.6836609336609336,0.018495393897289096,1628,792,559,277
If you don't get in the car you're going to have bigger problems than Waterloo.,1.678837555886736,0.020638959948865866,1342,668,437,237
"Let’s go before you fall off 
and break a Bonaparte",1.6781137878011276,0.01780334822341357,1951,1018,543,390
"The British may be coming, but I'm leaving.",1.6699604743083003,0.016711724551897594,2024,1016,660,348
"You've conquered Austria and Prussia, that's all we have time for.",1.6693766937669376,0.016922795908020056,1845,893,669,283
"When I was a kid, conquering all of Europe and crowning yourself Emperor only cost 10¢.",1.6686217008797655,0.01800427881539259,1705,847,576,282
"Well, at least you fit the height requirement.",1.6680637049455156,0.021682514486497384,1193,598,393,202
No more quarters? Then you've met your Waterloo.,1.667853962600178,0.022627179472581502,1123,571,354,198
Now you know why its called a quarter horse!,1.6628571428571428,0.017391169011760445,1925,994,586,345
You can't invade Russia today. Soccer practice at 2:30.,1.6623376623376624,0.016680543695599306,1925,950,675,300
"I know, but you’ll serve your country even better after your nap.",1.662280701754386,0.027874496960781595,684,336,243,105
We have to go. You can invade Russia tomorrow.,1.6580538757559098,0.017049762374741147,1819,898,645,276
The Russian invasion will have to wait; I'm out of quarters.,1.6573241671073506,0.01643992270288453,1891,918,703,270
"I don't 
have enough change for
you to  conquer the world.""",1.6551020408163266,0.016715679769601605,1960,991,654,315
"I'm all out of quarters,you can try to cross the Alps next week when you get your allowance.",1.6492395437262357,0.022416093399969222,1052,527,367,158
Your revolution is out of funding.,1.644368600682594,0.019406177673206237,1465,757,472,236
Why can't you pretend to be an American fascist like other boys your age?,1.6439490445859872,0.018878953893805984,1570,818,493,259
"No Jeremy, I said I'll meet you in the ""eggs aisle""",1.6436314363143631,0.019719102881864396,1476,780,442,254
Get off before you develop a complex.,1.6409326424870467,0.01712772264959454,1930,1017,589,324
First you need to learn how to cross the street by yourself.,1.6393831553973903,0.01768723057115861,1686,858,578,250
No more binge-watching the History channel.,1.6352749047359825,0.017129568696217377,1837,952,603,282
"If  Waterloo means anything to you, you better get into the car right now.",1.6318435754189944,0.01744349842597942,1790,938,573,279
"Sometimes, heroes carry groceries.",1.6317093311312965,0.020598731302061257,1211,616,425,170
Now now don’t get short with me,1.630669546436285,0.017462763455010678,1852,991,554,307
"Careful, you don't want to break a bone apart",1.6222403924775144,0.021322490485177165,1223,658,369,196
Now let’ s conquer the mess in your room.,1.6204492641363284,0.019997960425170724,1291,671,439,181
"OK, one more ... but I'm not paying for a land war in Asia.",1.6202393906420023,0.01732055334385362,1838,988,560,290
Time to get off your high horse.,1.6093394077448746,0.017520492929301423,1756,950,542,264
"Don’t call me Josephine, I’m your mother>",1.608190370780299,0.01742251895435656,1807,988,539,280
"- Come on, Donald! It’s time to go.",1.6055603822762814,0.022311625791337445,1151,646,313,192
"Let's go Napoleon, Waterloo is this way.",1.6052344601962922,0.02383252025628575,917,491,297,129
"Donald, it's time to go home.",1.6041114058355437,0.019863476985525617,1508,865,375,268
Moscow is the other direction!,1.6029159519725558,0.020966672502874515,1166,622,385,159
"We can't wait for you to conquer Europe, you have a violin lesson and I have a yoga class.",1.594392523364486,0.030798080229841006,535,288,176,71
I’ll pick you up after Waterloo.,1.593241551939925,0.018203019796897525,1598,880,488,230
"Come on, Leon.  We need to seize the parking lot.",1.5879120879120878,0.018515407400990107,1820,1097,376,347
I’m going to count to trois.,1.5805837563451777,0.01903909804663028,1576,919,399,258
Do you even know how to pillage?,1.5791624106230848,0.02259033055124783,979,537,317,125
"If we leave now, I’ll get you a treaty.",1.5748138117806365,0.019215865396783605,1477,850,405,222
"Remember, like all conquerors, your time is limited.",1.5662759242560866,0.021695541764297086,1109,634,322,153
Why can't you have gender confusion like the rest of your friends?,1.5492170022371365,0.024605340957554237,894,534,229,131
The 23andMe results really got to your head.,1.5479951397326852,0.02363340492110589,823,459,277,87
Look both ways before you cross the Alps.,1.5421166306695464,0.024635749357504833,926,569,212,145
And I'm Marie Antoinette. Now get into the car.,1.5412748171368862,0.024331130549576408,957,591,214,152
"If you’re done conquering Europe, I could use some help with these bags.",1.5381400208986415,0.02318648446167838,957,569,261,127
"Let's go, Winter is coming!",1.5334143377885783,0.02476280459777269,823,489,229,105
"Get to the car now, or you're history.",1.5326215895610913,0.023911922643927382,843,492,253,98
I will give no quarters.,1.5274212368728122,0.025247161546377437,857,532,198,127
Not until you've conquered your homework.,1.5262515262515262,0.0252811847388851,819,500,207,112
Napoleon wouldn't have had fifty cents either. He was always a little short.,1.524234693877551,0.026575132851198755,784,492,173,119
There will be no quarter given to you either.,1.5143288084464555,0.027898573186139513,663,410,165,88
And I say it's time to put the Nap in Napoleon.,1.5139275766016713,0.026858155571970393,718,445,177,96
"It's nap time, Napoleon.""",1.5114503816793894,0.027741268655939268,655,403,169,83
"Sorry, but I give no quarter.",1.5085271317829458,0.028322509174091452,645,403,156,86
"Just come off it, Donald.",1.5078864353312302,0.029381936950186708,634,406,134,94
"If you don't come now, your room will be Elba for a week.",1.505,0.04807735600887408,200,120,59,21
"Sorry, I do not have enough quarters to get you over the Alps.",1.5026086956521738,0.029526695454324424,575,358,145,72
I didn’t bring enough quarters for you to cross the Alps.,1.502377179080824,0.027642074925175945,631,387,171,73
"The Alps may await, but so does your bath.",1.5015923566878981,0.028729430974075876,628,397,147,84
You'd better retreat. I'm out of quarters.,1.499227202472952,0.027659008949244182,647,403,165,79
You cross the Alps while Mommy stops in Boucherie and conquers a Bourbon.,1.4972972972972973,0.029674240163932566,555,345,144,66
Look both ways before crossing the Alps.,1.4972875226039783,0.030515115908933837,553,351,129,73
"Get in the car little man, or Whole Foods will be your Waterloo.",1.4963369963369964,0.029700517808892185,546,338,145,63
Let’s go home and eat cake.,1.4956217162872154,0.028841641336068643,571,352,155,64
Making you get off your little horse and get in the car is not going to give you a complex.,1.4940944881889764,0.03007638343843666,508,310,145,53
You can conqueror Europe on your own time. Mommy’s got ice cream melting.,1.4938271604938271,0.028666765965874995,567,348,158,61
"Fine, go ahead and conquer. But your supply line is heading home.",1.4926470588235294,0.03078625343807227,544,348,124,72
"No more quarters!
And stop calling me Josephine.",1.4901960784313726,0.029600559998898327,510,310,150,50
"He didn’t win, you know.",1.490066225165563,0.028840412648786045,604,384,144,76
Can you get off the horse? Of CORSICAN !,1.4896810506566605,0.03069681502240049,533,339,127,67
"Because mommy is the Empress and the Empress rules, that's why.”",1.4878504672897197,0.030723424810420598,535,342,125,68
I give you no quarter. Let’s go.,1.485239852398524,0.029511874613253518,542,339,143,60
"The British may be coming, but your ride is leaving.",1.484472049689441,0.03133811617465125,483,303,126,54
"Liberty, equality, and get in the car right now.",1.4841269841269842,0.03139499502345154,504,322,120,62
Try conquering the mess in your bedroom first.,1.4820415879017013,0.02832410296104128,529,320,163,46
"No. L'état, c'est Mom.",1.4809322033898304,0.03298163561391444,472,307,103,62
"Actually, I outrank you. Let’s go.",1.4787018255578093,0.0313918489696402,493,315,120,58
I give no quarter.,1.477366255144033,0.030359311409524192,486,302,136,48
"For the last time, your hipster father thought it was a unique name. It means nothing about your past life.",1.476923076923077,0.029805301004854654,455,273,147,35
I’m taking you out of Military School.,1.4761904761904763,0.03193717828047491,462,293,118,51
You can cross the Alps after lunch.,1.4739039665970772,0.03123798496898434,479,304,123,52
I buy him one baguette and the kid thinks he’s Napoleon,1.4732334047109208,0.03124220078458446,467,294,125,48
Napoleon at least acted like he was a big boy.,1.4727272727272727,0.0328191116797539,495,331,94,70
"Let's go, Donald!",1.4714548802946592,0.0302499531897184,543,354,122,67
"come on now, were late for your therapist.",1.470449172576832,0.03358786677258653,423,272,103,48
Napoleon's greatest tactical blunder was not listening to his mother.,1.4690476190476192,0.03325348024563027,420,268,107,45
I bet Mrs. Bonaparte didn't have to ask her son for help with the groceries.,1.4680851063829787,0.047943399304520906,188,117,54,17
"Honestly Billy, the doctor said you were 
normal height for your age!",1.4660633484162895,0.032191078469266284,442,282,114,46
You and what army?,1.4659090909090908,0.032932267660766554,440,285,105,50
"C'mon, I think we've both charged enough.",1.4658536585365853,0.034189974082246985,410,266,97,47
Napoleon didn't listen to his Mother and look how that turned out,1.4642857142857142,0.03249294452791893,448,290,108,50
"Yes, dear. Remember to invade the restroom before we leave.",1.463529411764706,0.03362031799092714,425,277,99,49
You can't invade Poland if I'm out of quarters.,1.4609929078014185,0.03406201476131651,423,279,93,51
Let’s go Napoleon…Elba is waiting.,1.4605911330049262,0.033530656432668976,406,261,103,42
I give you no quarter.,1.460136674259681,0.031356080644500635,439,277,122,40
"I'm your Waterloo, young man.",1.4598214285714286,0.03293926433299454,448,295,100,53
"If I wanted to deal with a Napoleon complex, I wouldn’t have divorced your father.",1.4591836734693877,0.034961647391030255,392,257,90,45
"I've got the provisions for your retreat, emperor.",1.4566326530612246,0.0326371440503037,392,246,113,33
They didn’t have 'flaky puff pastry layered with rich vanilla cream.' I got Oreos.,1.4564220183486238,0.034226052100012304,436,294,85,57
I don't care what 23 and Me found. Get in the car.,1.456140350877193,0.03504045884582831,399,265,86,48
Napoleon Crossing his Mother,1.455497382198953,0.03465024346410878,382,248,94,40
"Emperor or not, your bedtime is still 8 o'clock.",1.4545454545454546,0.03375091508624309,396,256,100,40
"Nice try, but the ice cream you want is actually Neapolitan.",1.4543269230769231,0.033791547688659974,416,274,95,47
"Either way, this doesn’t end well for you.",1.4536082474226804,0.03425219479578587,388,252,96,40
Keep that up and you're going to wish the British were coming,1.452970297029703,0.033259936070909726,404,261,103,40
"Do as you're told Emperor, or I will gladly send you into exile.",1.4523809523809523,0.03367919357854176,378,241,103,34
I’m not waiting for them to finish your portrait.,1.452127659574468,0.03295583740330033,376,236,110,30
"Young man, when we get home you go straight into exile.",1.4515306122448979,0.034181492124943195,392,256,95,41
"Lest you forget, Napoleon's penis is in a jar in New Jersey.",1.451523545706371,0.037566158123349784,361,245,69,47
"Even Napolean had to listen to his mother, now let's go.",1.4513064133016627,0.031928174598289345,421,269,114,38
"No, you can’t invade Russia today. I have Pilates.",1.4510739856801909,0.03203580881218268,419,268,113,38
Call me Josephine once more and you're walking home.,1.45,0.03632641446281105,380,257,75,48
No more History Channel for you.,1.449591280653951,0.03394973309225008,367,234,101,32
Let’s pretend Russia is in this direction.,1.4492385786802031,0.03189149631266978,394,247,117,30
NO! You can't go to Moscow,1.4490861618798956,0.03376068135120369,383,247,100,36
And I’m Joan of Arc. Come on—we’re late.,1.4454022988505748,0.0354743184877455,348,226,89,33
We can do this the easy way or the Waterloo way.,1.4444444444444444,0.03486992855704298,369,242,90,37
I don't have enough quarters for you to cross the Alps.,1.4435483870967742,0.03528348723228541,372,247,85,40
"You're one minute away from exile, young man!",1.443213296398892,0.03542446658731972,361,238,86,37
Your father wants his hat back.,1.4421965317919074,0.035133266390561434,346,224,91,31
"France might be that way, but the car is this way.",1.4415584415584415,0.034398733929248526,385,255,90,40
Spain will still be there tomorrow.,1.441340782122905,0.034289239874169146,358,231,96,31
"It's tine to go home, dear. You'll have to invade Russia tomorrow.",1.4404761904761905,0.0363599536774718,336,221,82,33
Stop re-enacting up.,1.440203562340967,0.033495682403835776,393,258,97,38
Rally the troops after your sister’s swim lesson.,1.43943661971831,0.03471489069409707,355,231,92,32
You need to conquer your homework first.,1.4391691394658754,0.035037043034734934,337,217,92,28
"That doesn't qualify as a ""History Report""",1.4388059701492537,0.0354352584599331,335,217,89,29
Non means no!,1.4385964912280702,0.035407810942119776,342,223,88,31
Sometimes I wish you inherited your father's inferiority complex.,1.4378378378378378,0.034559969488261885,370,244,90,36
Russia's the other way. You're attacking Canada.,1.4336283185840708,0.03681009076813008,339,228,75,36
Keep it up and winter will be the least of your concerns.,1.4325842696629214,0.034380326124595365,356,233,92,31
"Okay, Napoleon, time to conquer your homework.",1.4299674267100977,0.03794281809177258,307,205,72,30
If you're going to conquer Russia too you'll need more than fifty-cents...,1.4298245614035088,0.03655236566623872,342,231,75,36
"Very exciting, but did you notice that the horse isn't going anywhere?",1.4295774647887325,0.037594180626239565,284,184,78,22
"All emperors run out of time, dear.",1.429530201342282,0.03818056826641126,298,198,72,28
"No, you can't have another 50 cents to escape from Elba.",1.429032258064516,0.03654608807634961,310,203,81,26
"You have about as much chance of winning the Battle of Waterloo as I have of winning the NEW YORKER Cartoon Caption Contest. Now get off your high horse and help Mommy carry the groceries.""",1.4281345565749235,0.039230172280220764,327,229,56,42
That’s enough imperialism for today.,1.4267515923566878,0.03592103246982434,314,205,84,25
You know what else Napoleon was good at? Unloading the groceries.,1.4252491694352158,0.03959486223372648,301,207,60,34
I'm the only dictator around here. Get off the horse.,1.423780487804878,0.03814898778757892,328,227,63,38
That's not really what fight for change means.,1.4234875444839858,0.041361701099255695,281,195,53,33
"Yes, victory is ours. Now get in the car.",1.4212121212121211,0.03571033608188393,330,220,81,29
"Yes, you’re quite the little tyrant.",1.4201954397394136,0.03525996126583159,307,199,87,21
Just look both ways before you cross the Alps.,1.4197952218430034,0.03607858455272651,293,190,83,20
"That’s right, Timmy. Dress for the job you want - not the job you have.",1.4181818181818182,0.040387816546610514,275,188,59,28
That's it. No more Fox News.,1.4179104477611941,0.04149271024197738,268,185,54,29
And I'm Joan of Arc but the groceries aren't going to carry themselves to the car.,1.4171974522292994,0.03641780365323363,314,210,77,27
Everything is a battle with you,1.416083916083916,0.03892274307742839,286,194,65,27
"Come on,Your Highness - it’s time to put the “Nap” in Napoleon.",1.4158415841584158,0.03988979534807742,303,213,54,36
School starts next week. No revolution is going to change that.,1.4157706093189963,0.03863444341024479,279,187,68,24
"Fine, hurry up and go to the bathroom. And stop calling it the ""water loo""!",1.4153846153846155,0.0368414736106877,325,222,71,32
I think Elba is that direction.,1.4148936170212767,0.03800531293408422,282,188,71,23
"If you keep that up, you are going to develop a complex.",1.414715719063545,0.037986997127364794,299,203,68,28
"I'll only be a minute, so don't start anything.",1.414448669201521,0.04239121019757321,263,184,49,30
Help me with the bags or I'm sending you to Elba.,1.413919413919414,0.039221013487491935,273,184,65,24
You are acting more and more like your father,1.4128787878787878,0.04087352240876391,264,181,57,26
"Allons-y, mon peu general! Sans moi - no dinner!",1.4126984126984128,0.03630229609182918,315,212,76,27
"When you're finished at Waterloo,, meet me at the checkout line.",1.4125874125874125,0.03560209723976974,286,185,84,17
Waterloo is the other direction.,1.411764705882353,0.03749703295348912,323,224,65,34
"Ok Napoleon. You can go to Waterloo, but I'm going to Macy's.",1.411764705882353,0.03635391415242972,289,190,79,20
"You know, Napoleon didn't take his blankie to Waterloo.",1.41,0.03873271182657312,300,208,61,31
"With an attitude like that young man, you can just go straight to exile.",1.4093959731543624,0.03713548518594538,298,201,72,25
It’s time to conquer your homework.,1.4092526690391458,0.03491873474007493,281,180,87,14
Conquer quickly.  I'm out of change.,1.4087591240875912,0.03907621857722541,274,186,64,24
Courage isn't having the 50c to go on - it is going on when you don't have 50c,1.407843137254902,0.040375020160733334,255,173,60,22
"I'm warning you, this is not going to end well.",1.4076433121019107,0.0357800304393915,314,211,78,25
It’s fun now but wait until winter comes.,1.407017543859649,0.04019749319925726,285,200,54,31
Have fun in Moscow. I’ll be at the food court.,1.4067796610169492,0.0382944409419434,295,203,64,28
"Conquer the world with your own money, mister.",1.4053030303030303,0.04009734664748772,264,181,59,24
"We're not retreating, just advancing in a different direction.",1.4049295774647887,0.038386998718654156,284,194,65,25
You got about a minute and a half left to conquer the rest of Europe.,1.4049295774647887,0.04028482839716544,284,200,53,31
Stop calling me Josephine!,1.4048442906574394,0.03791235193409705,289,197,67,25
"Dreams of empire may be that way, but the Oreos are heading home.",1.404,0.04169038682254766,250,173,53,24
"If you're going to conquer the world, you'll have to use your own allowance.",1.4024896265560165,0.041571503961647056,241,165,55,21
"Well, at least you’re passed your Robespierre phase.",1.4022556390977443,0.03650939371490978,266,174,77,15
You can't go to Waterloo. It's almost time for dinner.,1.4021739130434783,0.04015101526783431,276,193,55,28
I’ll “l’état c’est moi” you if you don’t get your butt in the car right now!,1.4008264462809918,0.04265619156902401,242,169,49,24
"I don’t have any more quarters, and my name isn’t Josephine",1.4006734006734007,0.03745350278382969,297,204,67,26
"Sorry Tim, I already spent my spare quarters on the Louisiana Territory.",1.4,0.039580418026314394,265,182,60,23
At least this is better than the last time when you were Lady Godiva.,1.3993055555555556,0.04101993160522689,288,208,45,35
"The insurrection was two years ago honey, it's time to move on.",1.3992094861660078,0.04166522525216807,253,177,51,25
Get down this minute or it’ll be Elba with no dessert.,1.3972602739726028,0.037878751239347384,292,202,64,26
We have territory at home.,1.3971631205673758,0.037848976142474684,282,193,66,23
I'll give you a buck to invade Russia again. Another ten if you get it right.,1.3964912280701753,0.038213840987855414,285,197,63,25
"Now, or I exile you to your room.",1.3963636363636365,0.03920178408862833,275,191,59,25
Fifty cents per minute beats my therapist.”,1.3954372623574145,0.043581185404764834,263,193,36,34
Put your hand in your shirt.,1.3948339483394834,0.0381964537520918,271,185,65,21
Dismount or it's Elba for you.,1.394736842105263,0.03978104201038938,266,185,57,24
"Enough horsing around, we’re leaving.",1.394736842105263,0.04226965743245152,228,157,52,19
"""I know destiny lies that way. But the car lies this way. Let's go.",1.394736842105263,0.036188651487388805,304,208,72,24
I think we're done with the French lessons.,1.39453125,0.04163338322922507,256,181,49,26
Russia? In the winter?,1.3941908713692945,0.04064484268463676,241,165,57,19
"Your revolution will be over in 3 minutes, so enjoy the ride.",1.3941605839416058,0.03859630596338505,274,189,62,23
I'm taking the car home.,1.393939393939394,0.04003375085405176,231,155,61,15
"If you’re done conquering Europe, I could use some help loading the car.",1.3929961089494163,0.03924045418585594,257,176,61,20
Let's go conquer lunch.”,1.3927125506072875,0.040751571820289954,247,171,55,21
How about conquering your homework?,1.3923076923076922,0.03814541903734355,260,176,66,18
Okay.  Conquer Europe!  I’m heading home.,1.3918918918918919,0.04351588970420706,222,155,47,20
You can conquer Europe after lunch.,1.3911290322580645,0.04021387331680447,248,171,57,20
You can cross the Alps tomorrow. I have yoga class in an hour.,1.3909465020576133,0.04161895693280472,243,170,51,22
I’m heading to the car. Don’t forget your army in Egypt this time.,1.3904761904761904,0.03666562280636004,315,221,65,29
"Time to go, sweetie, or we'll be late for your therapist.",1.3902439024390243,0.04204349304250413,246,174,48,24
You are just short because of your age!,1.3901515151515151,0.03958797944353482,264,184,57,23
"Okay, but straight home before winter.",1.3888888888888888,0.03894637870162451,270,188,59,23
One revolution and then we're going!,1.3888888888888888,0.03859123713305319,270,187,61,22
"Okay young man, it's time to put the nap in Napoleon for you.",1.3878504672897196,0.047491691218870195,214,157,31,26
I bet you didn't know that Napoleon always helped his mom carry her bags.,1.3875968992248062,0.04021634666674698,258,181,54,23
"That's enough, Junior. It's your father's turn.",1.3875,0.041114719425249836,240,167,53,20
And stop calling me Josephine.,1.3873239436619718,0.03789133574454504,284,198,62,24
"You already have 5 minutes in exile, want to go for 10?",1.3865546218487395,0.04134844080789739,238,166,52,20
"Mommy's getting the dry-cleaning, don't invade Russia while I'm gone.",1.3865546218487395,0.04177500183252208,238,167,50,21
"I don’t care how many quarters Dad gave you, you’re not to invade Russia!",1.3858267716535433,0.03908897184535634,254,175,60,19
Enjoy your exile. I'm going home.,1.384313725490196,0.0377573522051689,255,173,66,16
Don't make me send you to your island without supper.,1.384313725490196,0.03974934101583131,255,178,56,21
"We’ll, hurry up and conquer Austria, then. I need to get home and start dinner.",1.3840304182509506,0.03851451153408503,263,182,61,20
Charge is my favorite word too!,1.3837209302325582,0.039796261951873725,258,181,55,22
"Russia is this way, Son.",1.3836206896551724,0.042949231508551254,232,165,45,22
Dismount right now or you're going into exile!,1.3828125,0.03844487216087064,256,176,62,18
"Dismount and be in car in 5 minutes, or this means war.",1.3823529411764706,0.045085018635319746,204,144,42,18
"And I'm Mary, Queen of Scots.",1.3822222222222222,0.04298599090938908,225,159,46,20
Delusions of grandeur just like your father,1.3817427385892116,0.04298663066348218,241,174,42,25
Enough! You’’ll give yourself a complex!,1.3807531380753137,0.04029345094438901,239,166,55,18
We'll see how you handle a two-front war when your dad gets home.,1.3803418803418803,0.04264415705132804,234,167,45,22
I predict a period of exile to your room.,1.3802083333333333,0.04407671936366513,192,132,47,13
It's time to go home.  You can take Vienna tomorrow.,1.3800738007380073,0.03767400040431327,271,188,63,20
"'If you make it to England, remember to ride on the left.'",1.38,0.046246010285609325,200,143,38,19
This phase is turning into a complex.,1.3791469194312795,0.04240252843448193,211,146,50,15
"OK, time to go.  And stop calling me Josephine.",1.3788546255506609,0.041279509902053764,227,158,52,17
"After you’re done conquering Europe, maybe you could help me load the car.",1.3786407766990292,0.044722953154879834,206,146,42,18
"Timeless, but dimeless.",1.3783783783783783,0.04771928587298619,185,132,36,17
"It's your Waterloo, Timmy.  I'm out of quarters",1.3779527559055118,0.04055966338772004,254,181,50,23
