caption,mean,precision,votes,not_funny,somewhat_funny,funny
Hello! You’ve reached the office of the landline lobby. I apologize for the echo on the line.,1.2073170731707317,0.04504273750296657,82,65,17,0
"Still more reliable than Bluetooth""",1.2073170731707317,0.04504273750296657,82,65,17,0
Your auto warranty is about to expire. Please press 1 to renew your warranty. Press 2 to be put on the do not call list.,1.2073170731707317,0.05129401959552223,82,67,13,2
This is how I pretend I have friends to call.,1.2073170731707317,0.054149705156336284,82,68,11,3
There’s no wireless connection out here.,1.2073170731707317,0.048269683280641955,82,66,15,1
"No, for the last time, I don't need flood insurance.",1.2073170731707317,0.05129401959552223,82,67,13,2
"Gerald, do you STILL think the smartphone makes us slaves to modernity?",1.2073170731707317,0.05129401959552223,82,67,13,2
Nowhere to hide.,1.206896551724138,0.049423111543959376,87,71,14,2
"Mr. Davidson, this is not Verizon.  We are HORIZON COMMUNICATIONS.  Our brochure illustrated why our rates are so heavenly.  Mr. Davidson?  Hello?",1.206896551724138,0.049423111543959376,87,71,14,2
Demonstration of long distance communication device where there is no cell phone reception. Patent pending.,1.206896551724138,0.06851029433095054,58,49,6,3
Can you start the meeting without me?,1.206896551724138,0.04664049472641468,87,70,16,1
Guess we have poor connection!,1.206896551724138,0.05902320792875932,58,47,10,1
Please hold for the next available representative”,1.206896551724138,0.053654248635551675,58,46,12,0
"Mr. Watson, come here. I want you to bring your phone.",1.206896551724138,0.049423111543959376,87,71,14,2
"Sure, I can hear you.",1.2063492063492063,0.05615578032096342,63,51,11,1
"Yes, you could call me a late adopter.",1.2063492063492063,0.06054340949726558,63,52,9,2
I’m loving this game telephone … but can you hear me now??,1.2063492063492063,0.06054340949726558,63,52,9,2
Our conversation is taking a strange twist.,1.2063492063492063,0.06054340949726558,63,52,9,2
No he's not here. Is there a message?,1.2063492063492063,0.06054340949726558,63,52,9,2
I can’t guarantee no one else is on this line.,1.2063492063492063,0.06054340949726558,63,52,9,2
"You can’t hear me now? Well, I’m not surprised, we’ve been disconnected!",1.2061855670103092,0.05063629562986729,97,81,12,4
'My car warranty? 'Do tell'.,1.2061855670103092,0.048469142790159916,97,80,14,3
"Sure it’s inconvenient, but the rates are much cheaper.",1.2058823529411764,0.061295723573926195,68,57,8,3
"I hear you, but it doesn’t work with no strings attached.",1.2058823529411764,0.061295723573926195,68,57,8,3
"I call it, the ‘canned-line.’",1.2058823529411764,0.05760368187604684,68,56,10,2
What's that? Something about brown paper packages?,1.2058823529411764,0.05760368187604684,68,56,10,2
That was a straight answer.,1.2058823529411764,0.04939859350354098,68,54,14,0
Can you hear me Mr. Watson?,1.2058823529411764,0.053658201636864834,68,55,12,1
Try the bin.,1.2058823529411764,0.04939859350354098,68,54,14,0
"The long and the short of it, Mom, is I can't hear you",1.2058823529411764,0.04939859350354098,68,54,14,0
"It's been a while since I've used a landline, boss.",1.2058823529411764,0.05760368187604684,68,56,10,2
Thanks for taking my call. For a minute I thought you were trying to avoid me!,1.2054794520547945,0.05145857383371985,73,59,13,1
Seymour Butts.,1.2054794520547945,0.05145857383371985,73,59,13,1
"Sorry, what did you say? January 6th was just a peaceful protest?",1.2054794520547945,0.06155921809457883,73,62,7,4
Are you happy with your health insurance provider?,1.2054794520547945,0.055031830105908446,73,60,11,2
"Hello, this is Precision Electronics. Your smartphone has been repaired and is ready for pickup.",1.2054794520547945,0.055031830105908446,73,60,11,2
Your fly is down!,1.2054794520547945,0.055031830105908446,73,60,11,2
"It's a nice setting, but the technology could use an upgrade.",1.2054794520547945,0.05145857383371985,73,59,13,1
Come again?,1.2054794520547945,0.05145857383371985,73,59,13,1
We've implemented a new cyber-security system.,1.2054794520547945,0.06155921809457883,73,62,7,4
"We're sorry, but we're experiencing an unusually high volume of cans",1.2054794520547945,0.055031830105908446,73,60,11,2
Can you Zoom in a bit?,1.2054794520547945,0.05838681211207499,73,61,9,3
'All lines are currently busy. Check the number you're calling and try again. This is a recording.',1.2054794520547945,0.05145857383371985,73,59,13,1
"I hate to tell you, but your goat just wandered off.",1.2054794520547945,0.055031830105908446,73,60,11,2
Maybe we'll get better reception if we take one step closer to each other.,1.2054794520547945,0.05838681211207499,73,61,9,3
"Sorry kiddo, daddy was told he has to find his way back into the office again.",1.2054794520547945,0.055031830105908446,73,60,11,2
That sounds kinky.,1.205128205128205,0.052759276388894,78,64,12,2
"Get $10 off a 1-liter bottle of Poland Spring! Just follow the line to Joe's  Eats & Drinks and say Sally-Ann sends you.""",1.205128205128205,0.055825993749149164,78,65,10,3
We've be trying to reach you as your auto warranty has expired.,1.205128205128205,0.052759276388894,78,64,12,2
I don't think it has FaceTime.,1.205128205128205,0.052759276388894,78,64,12,2
"Once we get rid of the cellulite, we will hear each other better.",1.205128205128205,0.052759276388894,78,64,12,2
I knew those smart phones wouldn't last long. Now we can get back to basics,1.205128205128205,0.0460167423779546,78,62,16,0
I not only can hear you but also the person standing next to you.,1.205128205128205,0.04950293841863709,78,63,14,1
"What do you mean """"the line has been cut""?",1.205128205128205,0.04950293841863709,78,63,14,1
"Much clearer, but best thing is no roaming charges on the land line.",1.205128205128205,0.04950293841863709,78,63,14,1
"To hear these options again,press 5",1.2048192771084338,0.058783425213282295,83,71,7,5
this could have been an email,1.2048192771084338,0.04774994909656086,83,67,15,1
"Hello Sir,  don’t you want to change your line provider?",1.2048192771084338,0.04774994909656086,83,67,15,1
I just want to show you how far I'll go to secure your business.,1.2048192771084338,0.04774994909656086,83,67,15,1
You get full coverage with this land line.,1.2048192771084338,0.05073377572184534,83,68,13,2
"Yes, I can hear you now, Satan",1.2048192771084338,0.05355160463762831,83,69,11,3
"Can"" string be attached now, sweety",1.2048192771084338,0.05073377572184534,83,68,13,2
„Mind the gap!“,1.2048192771084338,0.04774994909656086,83,67,15,1
"No, I didn't quite get all of that.",1.2045454545454546,0.053991879176445545,88,74,10,4
You still there?,1.2045454545454546,0.04616734730784048,88,71,16,1
Bask in the dynamic life of a bespoke tree house salesman.,1.2043010752688172,0.04968140616939365,93,77,13,3
I can't wait until we get wireless service!,1.2043010752688172,0.05418256454212406,93,79,9,5
"You've reached me on my landline, I'll have to get back to you when my cell service works.",1.2043010752688172,0.04727037156900375,93,76,15,2
I must have made the wrong turn in Albuquerque,1.2037037037037037,0.055322127819126744,54,43,11,0
"I'm not from the NSA, I sell insurance.",1.2033898305084745,0.05812007671977909,59,48,10,1
There are some kinks to be worked out.,1.2033898305084745,0.05812007671977909,59,48,10,1
Over the hills and through the wire to further obfuscation we go,1.2033898305084745,0.05812007671977909,59,48,10,1
Why didn’t I get a plan with no strings attached?,1.2033898305084745,0.06294757226340743,59,49,8,2
Oh really? There's an oasis on your side?,1.203125,0.05536534277465963,64,52,11,1
Butt cheek,1.203125,0.06369760335066812,64,54,7,3
"Hello, your auto warranty service is about to expired...",1.203125,0.05536534277465963,64,52,11,1
Your audio is amazing.,1.203125,0.05967707203430227,64,53,9,2
"Really,   2022?",1.203125,0.05967707203430227,64,53,9,2
"I won free nights at the Radisson Hotel? Neato!""",1.203125,0.06369760335066812,64,54,7,3
"Sorry, but I don't need any information on Medicare enrollment plans.",1.203125,0.050688158720985414,64,51,13,0
"No, I don't need a car warranty!",1.203125,0.05967707203430227,64,53,9,2
"Sorry, I must’ve missed your text.",1.203125,0.050688158720985414,64,51,13,0
Can I take a message?,1.2028985507246377,0.05295895137424503,69,56,12,1
"Paul Marcarelli, can you hear me now?",1.2028985507246377,0.05295895137424503,69,56,12,1
"I can tell you right now, the folks out here won’t be keen on any development projects.",1.2028985507246377,0.05684107660983553,69,57,10,2
"Ugh,this phone expired in 2002 and it sounds like you're still saying ""wassup!""",1.2028985507246377,0.06715415377087121,69,60,4,5
"Ni hao, wo bu zhi dou",1.2028985507246377,0.06390166593427964,69,59,6,4
"I told you to take a left, not a right.",1.2028985507246377,0.05684107660983553,69,57,10,2
No more aggregating user data for Wayne.,1.2028985507246377,0.05684107660983553,69,57,10,2
"Sorry Gondor, you’ve actually reached ‘Johan’.",1.2028985507246377,0.05295895137424503,69,56,12,1
Red Wave Coming!!!,1.2028985507246377,0.06390166593427964,69,59,6,4
"No, I can't turn on my camera",1.2028985507246377,0.05295895137424503,69,56,12,1
I'd like to place a collect call to the President of the United States!,1.2027027027027026,0.05435403616647048,74,61,11,2
"You've run out of high-speed data""",1.2027027027027026,0.05435403616647048,74,61,11,2
At least it is dependable.  And the only costs are a can of beans and string.,1.2027027027027026,0.05435403616647048,74,61,11,2
Can you hold? I'm getting a call on the other line.,1.2027027027027026,0.05765929668779837,74,62,9,3
I don t trust cell phones.,1.2027027027027026,0.05435403616647048,74,61,11,2
"I hear the Sea, that's it.",1.2027027027027026,0.05765929668779837,74,62,9,3
"Yes, roaming charges do apply.",1.2027027027027026,0.05765929668779837,74,62,9,3
So you're sure this a secure line?,1.2027027027027026,0.05435403616647048,74,61,11,2
I get the feeling you're just stringing me along.,1.2027027027027026,0.05083431912242363,74,60,13,1
"All these dunes look the same, I don't see how I'm ever going to find you.",1.2027027027027026,0.05083431912242363,74,60,13,1
So glad you picked up. Do you know that your vehicle's warranty is about to expire?,1.2027027027027026,0.05083431912242363,74,60,13,1
The Hills have........ opinions,1.2027027027027026,0.05765929668779837,74,62,9,3
Your call cannot be completed as dialed.  Please check the number and dial again.,1.2027027027027026,0.05435403616647048,74,61,11,2
"In the post Information Age , this    will be the  number 1 form of communication.",1.2025316455696202,0.05215183571084887,79,65,12,2
"No, I’m not trying to string you along.",1.2025316455696202,0.05215183571084887,79,65,12,2
"Surprisingly, I get service out here!",1.2025316455696202,0.05215183571084887,79,65,12,2
"I don't even have a car, much less an extended warranty.",1.2025316455696202,0.06077436797269635,79,68,6,5
"With inflation rates what they are
the new iPhone has trimmed 
a few options to keep them just 
as affordable as ever!",1.2025316455696202,0.04894123029908691,79,64,14,1
So you're saying there's an easier way to work remotely?,1.2025316455696202,0.055175935994185736,79,66,10,3
I ran out of breadcrumbs,1.2025316455696202,0.04550465996318567,79,63,16,0
Let me tell you about the extended warranty.,1.2025316455696202,0.05215183571084887,79,65,12,2
Can do!,1.2023809523809523,0.05018543326712824,84,69,13,2
No thanks - I prefer to stick with my land line.,1.2023809523809523,0.05296639920604616,84,70,11,3
"It's a bit rural,  but I can still hear you",1.2023809523809523,0.04724104126249248,84,68,15,1
"Sir, cow tools",1.2023809523809523,0.05018543326712824,84,69,13,2
What do you mean this is not working? We have a more direct connection than anyone I know!,1.202247191011236,0.04841664403947964,89,73,14,2
Gotcha! Isn’t it great living in a world of wireless technology?,1.202127659574468,0.04919806972822639,94,78,13,3
Your car's extended warranty is about to expire...,1.2,0.05883484054145522,65,54,9,2
"No, but since the flight was cancelled...",1.2,0.056098109857700425,70,58,10,2
"Yes, I can hear you now.",1.2,0.05369248441712195,75,62,11,2
Yes - I can hear you.,1.2,0.0545964214099169,65,53,11,1
"Sandy, is that you?",1.2,0.05046599329648382,90,75,12,3
"Oh, yes, I heartily agree; Campbell’s tomato soup has much better
sonic values than the clam chowder!",1.2,0.056098109857700425,70,58,10,2
If this is a car phone call please pull ahead a few kilometers to tighten the string,1.2,0.056098109857700425,70,58,10,2
I’m from Guinness to certify the world’s longest extension cord. What State did you say you are in?,1.2,0.05227733021739333,70,57,12,1
Still no sign of Amelia Earhart and I’m running out of string.,1.2,0.06278779891274812,65,55,7,3
Speak up.  I think you are in a dead zone.,1.2,0.06278779891274812,65,55,7,3
Pwess two to speak to a wepwesntative,1.2,0.05454065955141906,80,67,10,3
That’s better!,1.2,0.06304883249912806,70,60,6,4
I know you're having trouble hearing me.  The connectivity up here seems kind of antiquated.,1.2,0.0545964214099169,65,53,11,1
Buying a VPN was too expensive.,1.2,0.05155800469472483,80,66,12,2
I'm glad you called. The Internet service here is terrible.,1.2,0.05369248441712195,75,62,11,2
Hold on. There seems to be a kink in the cable.,1.2,0.05454065955141906,80,67,10,3
We’ve gone to great lengths to establish a secure network connection.,1.2,0.0545964214099169,65,53,11,1
The new low cost plan from your wireless provider; the land line.,1.2,0.048391860388899456,80,65,14,1
"Authorities are on their way. 
Burn all our incriminating high tech defamation documents, now! 
We need to tighten up loose ends. Can you hear me? 
We need to tighten up loose ends. . .",1.2,0.06003002251876642,75,64,7,4
"The bus is running 43 minutes late, today.",1.2,0.0663835797544615,60,51,6,3
"Here we go loop de loop, here we go loop de lie...",1.2,0.05155800469472483,80,66,12,2
Did you have garlic for lunch? The line is starting to curl.,1.2,0.06003002251876642,75,64,7,4
"Hi, Claire. The reception is very bad out here. Can you ask them to leave a message?",1.2,0.05724365605193376,60,49,10,1
"Hi. I'm Marion. Your automobile warranty has expired. To extend it, rap your can once.",1.2,0.048391860388899456,80,65,14,1
"I am not sure where I am, I thought you said make a right",1.2,0.05022472023339227,75,61,13,1
"Bob, we have some absolutely terrible news for you.  If we lose the connec",1.2,0.0528819853025402,90,76,10,4
"I can't talk to you now, I'm on a long-distance call.",1.2,0.04649905549752771,75,60,15,0
"Our plan covers the gaps in your cell phone coverage.  You can enroll at the nearest lemonaid stand.""",1.2,0.05724365605193376,60,49,10,1
I feel wired!,1.2,0.06296001877353567,75,65,5,5
404…Connection not found,1.2,0.05967475684537697,70,59,8,3
"Alex, I promise you that the defense cannot get copies of these calls!",1.2,0.056098109857700425,70,58,10,2
Herb really wishes they would play something besides the Can Can song while he’s on hold.,1.2,0.056098109857700425,70,58,10,2
"Alexander Graham Bell: ""Come here, Mr Watson, I told you we can't work from home anymore.""",1.2,0.04792836935744237,90,74,14,2
Am I hearing you say that I can't get a line of credit,1.2,0.05967475684537697,70,59,8,3
"Even while on long business trips,Rick still managed to find a way to play clubhouse with his kids",1.2,0.05883484054145522,65,54,9,2
"I just saw your text, so the Wilsons really are coming over tonight?",1.2,0.04674263524428028,85,69,15,1
Hello? Hello? You must get 2G,1.2,0.04649905549752771,75,60,15,0
I'm on the road just now.  Can I get back to you later today?,1.2,0.05967475684537697,70,59,8,3
"As a new manager, the first thing to do is go on a listening tour.",1.2,0.056098109857700425,70,58,10,2
Seems like we're not as tight as we used to be.,1.2,0.06198231933063268,60,50,8,2
I think I can hear the Ocean where you are.,1.2,0.056098109857700425,70,58,10,2
My smart phone is caught up in the supply chain.”,1.2,0.06198231933063268,60,50,8,2
"3G, why?",1.2,0.06003002251876642,75,64,7,4
Did something change? These long calls used to be much more tense.,1.2,0.056098109857700425,70,58,10,2
You say - I only hear what I want to.,1.2,0.05724365605193376,60,49,10,1
"I know it's a long line but I am in Green Bank, West Virginia.",1.2,0.056098109857700425,70,58,10,2
"Yes, but think about how much we are saving you on your cellular bill",1.2,0.06198231933063268,60,50,8,2
"I should paid for 5G, dang….",1.2,0.04674263524428028,85,69,15,1
"I got so sick of dropped calls, I ran my own line.",1.2,0.05369248441712195,75,62,11,2
"Sorry, can't hear you.  There must be a sand storm on the wire!",1.2,0.04792836935744237,90,74,14,2
"At the end of this call, would you mind
 taking a brief survey?",1.2,0.0545964214099169,65,53,11,1
"Yes, the Titanic has to be around here somewhere…",1.2,0.05454065955141906,80,67,10,3
I can’t hear you very well—are you on speaker?,1.2,0.05724365605193376,60,49,10,1
This manual telecommute is not all it’s chalked up to be.,1.2,0.04964862530219503,85,70,13,2
my video isn’t working for some reason.,1.2,0.04649905549752771,75,60,15,0
"For more information, at no obligation, simply press one on your touch tone now…",1.2,0.05694947974514994,75,63,9,3
"No Sharon, I can't see it here either.",1.2,0.05227733021739333,70,57,12,1
"Thanks for holding, Jan. I just needed to step out of the office.",1.2,0.056098109857700425,70,58,10,2
"I thought I was consulting for Dune, not dunes.",1.1978021978021978,0.0419889520319622,91,73,18,0
"Sorry, you got the wrong number!",1.1978021978021978,0.0499567095127687,91,76,12,3
Are you sure this string is long enough to get us to Mars?,1.197674418604651,0.04912299937443241,86,71,13,2
The line needs to be tighter. Try again in the next state.,1.197674418604651,0.04319575725815518,86,69,17,0
I can barely hear you. Are you driving through a tunnel?,1.197674418604651,0.05183306742570805,86,72,11,3
I agree. They need to increase the access fee to allow faster service in rural areas.,1.197674418604651,0.054408314529817106,86,73,9,4
"What do you mean ""bring it back?""",1.197674418604651,0.046254418776188036,86,70,15,1
The IT dept receiving word that internal communications are down.,1.197674418604651,0.046254418776188036,86,70,15,1
"Hi there, this is Shasta calling in regards to your Volkswagen warranty",1.1975308641975309,0.04785443813164026,81,66,14,1
You say there is something called a mobile phone with no cord which can tell me where I am?  Amazing!,1.1975308641975309,0.04785443813164026,81,66,14,1
"Honey get off of that, they don’t have a vaccine yet for short man’s disease",1.1975308641975309,0.05391967358499372,81,68,10,3
"The number you have reached, 911, is not in service at this time...",1.1975308641975309,0.05097734030138908,81,67,12,2
I understand your car warranty has expired,1.1973684210526316,0.05625673243797881,76,64,9,3
My wifi wasn’t working,1.1973684210526316,0.04962928126251099,76,62,13,1
Hello could I speak with Reverend Mother Lucilla?,1.1973684210526316,0.0459585505172973,76,61,15,0
"Mister Trump, I can't hear you. You've got to pull the string taut.",1.1973684210526316,0.05929331444253048,76,65,7,4
MAY I SPEAK TO THE HEAD SAND WORM MITCH,1.1973684210526316,0.04962928126251099,76,62,13,1
You want me to bring home some creme brûlée?,1.1973684210526316,0.0530466092376872,76,63,11,2
Visit cancelled due to poor connection .,1.1973684210526316,0.05625673243797881,76,64,9,3
"Best part is, I can expense all the roaming charges.",1.1973684210526316,0.0530466092376872,76,63,11,2
"Hello, hellooo, anybody there?  Hmmm, this is going to take centuries, that line has no end.",1.1973684210526316,0.0530466092376872,76,63,11,2
Evidently my phone's GPS isn't working.,1.1971830985915493,0.055374046575526296,71,59,10,2
"Take a few more steps, it has to be taut",1.1971830985915493,0.047554769059532785,71,57,14,0
See? Long distance isn't so bad!,1.1971830985915493,0.055374046575526296,71,59,10,2
Right? And it cost so much less than our old land line,1.1971830985915493,0.051612697538755185,71,58,12,1
I don't have a student loan.,1.1971830985915493,0.055374046575526296,71,59,10,2
"Eh?…What? I don’t hear anything!”
I don’t have the heart to tell him, NOW, that the string has to be straight in order to work",1.1971830985915493,0.055374046575526296,71,59,10,2
Bike on over. I've got a deck of cards and some clothes pins in my briefcase.,1.1971830985915493,0.047554769059532785,71,57,14,0
"I'm sorry, but I can't accept long-distance calls that aren't business related.",1.1971830985915493,0.047554769059532785,71,57,14,0
Your car warranty has expired.,1.1971830985915493,0.051612697538755185,71,58,12,1
Bottled or tap?,1.1971830985915493,0.05889566640314111,71,60,8,3
It's uncanny that more people aren't using the new network.,1.1971830985915493,0.055374046575526296,71,59,10,2
I know they won’t be able to track us but isn’t this a bit much?,1.1971830985915493,0.051612697538755185,71,58,12,1
"Stop whining,  in a month or two we'll get cel phones.",1.1971830985915493,0.047554769059532785,71,57,14,0
"Why, yes. I am interested in saving money on long distance.",1.1971830985915493,0.055374046575526296,71,59,10,2
"The meeting just now got Cancelled-- but on your end, about half an hour ago

*{Typo on original; resubmitted with 2nd E-address}",1.1971830985915493,0.055374046575526296,71,59,10,2
"It's supper time.  And we're having canned yams thanks to you.""",1.1971830985915493,0.055374046575526296,71,59,10,2
"I really don't trust 5G"" #thenewyorke",1.1971830985915493,0.051612697538755185,71,58,12,1
I understand. I’ll be right there.,1.1971830985915493,0.055374046575526296,71,59,10,2
It still sounds like the ocean.,1.196969696969697,0.0538481719921703,66,54,11,1
"True, the tin-can telephone is also known as the 'lover's phone,' but as your attorney, I have news that will elicit anything but love.",1.196969696969697,0.0538481719921703,66,54,11,1
"This could have been an email,Todd.",1.196969696969697,0.0538481719921703,66,54,11,1
The original land line,1.196969696969697,0.05801574004611869,66,55,9,2
Did you just put me on hold?,1.196969696969697,0.0538481719921703,66,54,11,1
"Yes  Mr Trump,I’m nearby.",1.196969696969697,0.05801574004611869,66,55,9,2
"It's a long walk, I know. But the punchline is totally worth it!",1.196969696969697,0.05801574004611869,66,55,9,2
My can was a size 2 and a half with peaches. What was in yours?,1.196969696969697,0.0538481719921703,66,54,11,1
So it’s really not a jungle out there?,1.196969696969697,0.0538481719921703,66,54,11,1
Hello? Hello? What’s the next clue?,1.196969696969697,0.06190336468479953,66,56,7,3
I'd like to have a drink in a cup without a hole in the bottom,1.196969696969697,0.05801574004611869,66,55,9,2
How’s your electromagnetic phone coming along.,1.196969696969697,0.06190336468479953,66,56,7,3
"If you can hear the 60s, you weren’t there.",1.196969696969697,0.0538481719921703,66,54,11,1
Scan through beer me towel?,1.196969696969697,0.06190336468479953,66,56,7,3
"Tighter, tighter!  You have to stretch the string tighter!
“Can you hear me now?",1.1967213114754098,0.05639280721461829,61,50,10,1
Purple monkey dishwasher? What the hell does that mean,1.1967213114754098,0.0610458581148369,61,51,8,2
"If you’re so smart Mr. Graham Bell, why don’t you build a better one?",1.1967213114754098,0.05639280721461829,61,50,10,1
Is this a private line?,1.1967213114754098,0.0610458581148369,61,51,8,2
This conversation is going over the mountains and through the hills.,1.1967213114754098,0.051319592926224684,61,49,12,0
no trees for a house,1.1967213114754098,0.06536853127008815,61,52,6,3
George grows concerned about his new online navigation system.,1.1956521739130435,0.044365060402479714,92,75,16,1
"No, you're a poopy-pants!",1.1956521739130435,0.046980316386280786,92,76,14,2
Can you repeat that? You sound a little tinny.,1.1954022988505748,0.04275678110973868,87,70,17,0
I think we have a few kinks in the plan.,1.1951219512195121,0.04732858860859888,82,67,14,1
Wow!  The sound of your voice is just uncanny.,1.1951219512195121,0.04732858860859888,82,67,14,1
"Say what you will, I just don't trust cellular service out here",1.1951219512195121,0.053312508327658555,82,69,10,3
"''You are instructed to go to the nearest cafe and get your wife a ham sandwich for lunch,''",1.1951219512195121,0.04732858860859888,82,67,14,1
This is how you're supposed to wire the money.,1.1948051948051948,0.05241587029031893,77,64,11,2
Hominidae latus adoptus.,1.1948051948051948,0.05241587029031893,77,64,11,2
"I no longer have a landline,but I’m plugged into my power cord most of the time.",1.1948051948051948,0.05558045481956562,77,65,9,3
Sorry.  No you go.,1.1948051948051948,0.05241587029031893,77,64,11,2
I’m calling from a land line—cell reception stinks out here.”,1.1948051948051948,0.05241587029031893,77,64,11,2
Can we interest you in signing up for our unlimited miles plan?,1.1948051948051948,0.05241587029031893,77,64,11,2
Actually we're quite close.  I'll come over.,1.1948051948051948,0.05857431568194384,77,66,7,4
"Two minds,two thoughts,one two help the other but two busy two help even themselves",1.1948051948051948,0.045430127217245,77,62,15,0
Sorry you’re breaking up… Alexander who?,1.1948051948051948,0.05241587029031893,77,64,11,2
"Yes sir. Good news! Now that we’ve stopped kicking it, I’ve finally found the end.",1.1948051948051948,0.04904752754862677,77,63,13,1
Let me guess - long distance?,1.1948051948051948,0.04904752754862677,77,63,13,1
"Sorry, but no one by that name lives here.",1.1948051948051948,0.045430127217245,77,62,15,0
I'm getting on the train right now.,1.1944444444444444,0.04696954399337486,72,58,14,0
