caption,mean,precision,votes,not_funny,somewhat_funny,funny
"If you listen closely, you can hear my regret",1.2615384615384615,0.07029102647114255,65,52,9,4
I think it's for you.,1.2615384615384615,0.06678367443917438,65,51,11,3
"Yeah, No bars. Cans.",1.2615384615384615,0.06678367443917438,65,51,11,3
"Well, it's harder to bug 
and easier to recycle.",1.2615384615384615,0.06678367443917438,65,51,11,3
We've been trying to reach you about your tree house's extended warranty.,1.2615384615384615,0.06678367443917438,65,51,11,3
"Hold for a long distance call, please.",1.2615384615384615,0.06308161333406433,65,50,13,2
Time for tubby tax returns,1.2615384615384615,0.07363149891952556,65,53,7,5
Don't you just love this new technology!,1.2613636363636365,0.05937307040656715,88,70,13,5
"Yes, delivery's free but you have to give me an address",1.2613636363636365,0.05713080140913018,88,69,15,4
In point 5 miles make a left .....,1.2613636363636365,0.05937307040656715,88,70,13,5
You know you can get stringless cans these days?,1.2613636363636365,0.05937307040656715,88,70,13,5
A world without cell phones.,1.2613636363636365,0.05479685620357943,88,68,17,3
"Listen, Ariadne. I appreciate what you’ve done for me, but it’s over.”",1.2613636363636365,0.0615336859724565,88,71,11,6
I've been what? Canned?,1.2608695652173914,0.053249777017025594,92,71,18,3
I hope I've reached the right person.,1.2608695652173914,0.05711213716775524,69,52,16,1
"Hi, Mom. Yes, yes; I AM on my landline!",1.2608695652173914,0.06414289618406369,69,54,12,3
I knew I should have stayed with one of the big telcos.,1.2608695652173914,0.0673837412910942,69,55,10,4
"“Mr. Watson, come here, I want to see you!”",1.2608695652173914,0.05756146140293596,92,73,14,5
A charge of $299.95 has been made to your Amazon account.,1.2608695652173914,0.06414289618406369,69,54,12,3
"You will never find me, I left no trail, ha,ha.",1.2608695652173914,0.055447545442538,92,72,16,4
You're breaking up. Can I call you back next year?,1.2608695652173914,0.0673837412910942,69,55,10,4
"Hello, can you her me now?",1.2608695652173914,0.06414289618406369,69,54,12,3
This way I am sure the government is not listening,1.2608695652173914,0.05711213716775524,69,52,16,1
"I said coiled again
Not foiled again !",1.2604166666666667,0.05389396604466394,96,75,17,4
"Yes, yes, yes... I can hear you now.",1.2604166666666667,0.0518195072381951,96,74,19,3
IN THE ERA BEFORE WIRELESS . . . . .,1.2604166666666667,0.0518195072381951,96,74,19,3
Answering your call would be a stretch,1.2604166666666667,0.05389396604466394,96,75,17,4
"I've heard cell phones cause tumors, so I'm trying a different approach",1.2604166666666667,0.0518195072381951,96,74,19,3
May I ask how you got this number?  I don't usually give out my landline.,1.2602739726027397,0.061770544559217745,73,57,13,3
Thanks for picking-up Dad. This is going to be my audio-art project.  I'll call it 'Running Wire,1.2602739726027397,0.061770544559217745,73,57,13,3
"Yes, they’re kinda like white elephants….",1.2602739726027397,0.05860957832417096,73,56,15,2
"Now, bury the ransom in the sand and walk away.",1.2602739726027397,0.06477744730187722,73,58,11,4
I told you we didn't need to be next-door neighbours to still do this!,1.2602739726027397,0.061770544559217745,73,57,13,3
"Sorry, I don't have time to answer a survey about land-line security.",1.2602739726027397,0.06477744730187722,73,58,11,4
I’m lost.  Which way to my office?,1.2602739726027397,0.061770544559217745,73,57,13,3
Have you found my cell?,1.2602739726027397,0.07040704997766793,73,60,7,6
The warranty on the Honda is about to expire.,1.2602739726027397,0.061770544559217745,73,57,13,3
Thank you for completing our 7 factor security protocol.,1.2602739726027397,0.06477744730187722,73,58,11,4
"In Slodokia, this is the best outside line they have.",1.26,0.054346438278284205,100,79,16,5
"Please hold, all available operators are on the beach.",1.26,0.05617433182117573,100,80,14,6
Let them try and trace this.,1.2597402597402598,0.056687428890267476,77,59,16,2
We would like to offer you an extended warranty on your car.,1.2597402597402598,0.059625733486870995,77,60,14,3
"Is that you, Christo?",1.2597402597402598,0.06767952860963261,77,63,8,6
OK - So I will buy a cell phone.,1.2597402597402598,0.05358825519207446,77,58,18,1
I still think you're overly concerned about a wiretap.,1.2597402597402598,0.059625733486870995,77,60,14,3
James Webb Space Telescope??,1.2597402597402598,0.06510572243024297,77,62,10,5
We think we may need to upgrade our cloud infrastructure,1.2597402597402598,0.059625733486870995,77,60,14,3
Press one to speak to a representative,1.2597402597402598,0.06242588880829495,77,61,12,4
Burner phones got too expensive,1.2597402597402598,0.05358825519207446,77,58,18,1
Yes..pull the cord tight!,1.2597402597402598,0.06242588880829495,77,61,12,4
"Still nope.  Hold on, I’ll call you back on my cell.",1.2597402597402598,0.059625733486870995,77,60,14,3
Is this thing on?,1.2597402597402598,0.06242588880829495,77,61,12,4
What's a cell phone?,1.2597402597402598,0.059625733486870995,77,60,14,3
I can't believe we have reception out here!,1.2597402597402598,0.06242588880829495,77,61,12,4
I won the Nobel? Pull the other one.,1.2597402597402598,0.059625733486870995,77,60,14,3
"For the love of god, I don't need car insurance...but how did you get this number?",1.2597402597402598,0.06510572243024297,77,62,10,5
"I regret to inform you that I’ll be out of the office with limited access to calls and emails, but feel free to reach me by tin can.",1.2597402597402598,0.059625733486870995,77,60,14,3
I call it the mePhone.,1.2597402597402598,0.06242588880829495,77,61,12,4
Is there any 'sound of music' on your end?,1.2592592592592593,0.0602919281337026,81,64,13,4
I'm on the Proggreso friends and family plan you?,1.2592592592592593,0.06521043282095929,81,66,9,6
At least make your story believable!,1.2592592592592593,0.057675598157027524,81,63,15,3
They said it a long distance call.  But really???,1.2592592592592593,0.057675598157027524,81,63,15,3
"Sorry, I’ve gotta go — the hills are calling.",1.2592592592592593,0.057675598157027524,81,63,15,3
I SAAAAAID: ‘WE’RE LETTING YOU GOOO!!!’,1.2592592592592593,0.054934803608116006,81,62,17,2
They’re called breasts and we all have them.,1.2588235294117647,0.06069841223879822,85,68,12,5
"I can't hear you, can you yodel louder?",1.2588235294117647,0.05834539573516631,85,67,14,4
Is anyone there?,1.2588235294117647,0.05834539573516631,85,67,14,4
Where exactly did you lose your keys?,1.2588235294117647,0.053328801916575144,85,65,18,2
Let’s try a chicken noodle soup can,1.2588235294117647,0.055893408901902156,85,66,16,3
I’m over dressed as usual,1.2588235294117647,0.055893408901902156,85,66,16,3
"Yes,I still have a landline.",1.2586206896551724,0.05212240473863416,116,93,16,7
I'll Hold,1.2584269662921348,0.056561522199947825,89,70,15,4
Your other option is our premium long distance plan.,1.2584269662921348,0.058775576632546685,89,71,13,5
I’m Sorry. I thought this was a whistleblower tip line.,1.2584269662921348,0.056561522199947825,89,70,15,4
"The unsuspecting passerby grabbed the wire like alien by its sex organ, thus dooming Earth and all its inhabitants.",1.2584269662921348,0.056561522199947825,89,70,15,4
Sounds good - text me with any updates.,1.2584269662921348,0.05425719471795436,89,69,17,3
Hello? Internet of 1995? I’d like my life back please.,1.2584269662921348,0.05425719471795436,89,69,17,3
I told you to never call me here!,1.2584269662921348,0.05425719471795436,89,69,17,3
keep going the line has to be taut for it to work,1.2584269662921348,0.05185055991740916,89,68,19,2
I'm sorry could you repeat THAT there's still some corn in my can . . .,1.2584269662921348,0.056561522199947825,89,70,15,4
How did you know to reach me here?,1.2584269662921348,0.056561522199947825,89,70,15,4
The signal is up and down.,1.2584269662921348,0.058775576632546685,89,71,13,5
I’ve gotta let you go now….I’m outta string,1.2584269662921348,0.058775576632546685,89,71,13,5
Can you repeat that. You're cutting in and out.,1.2580645161290323,0.06477999978190735,62,48,12,2
I was told this would be a hybrid meeting.,1.2580645161290323,0.054919776177983784,93,73,16,4
"Hello, I am here to pick up the U.S. nuclear codes.",1.2580645161290323,0.054919776177983784,93,73,16,4
Can't talk much longer. I'll be winding it up here soon.,1.2580645161290323,0.06874059282197471,62,49,10,3
"I think we got our wires crossed, because I can hear you and I said, 'Can do!",1.2580645161290323,0.0605609415545309,62,47,14,1
"Yes, do you deliver?",1.2580645161290323,0.06874059282197471,62,49,10,3
Yes I think you could absolutely hide here. Sorry they took your phone Congressman.,1.2580645161290323,0.07248510075380409,62,50,8,4
your call is important. please stay on the line for the next can.,1.2577319587628866,0.055377396458705555,97,77,15,5
There's no cell service out here!,1.2575757575757576,0.06933115715364845,66,53,9,4
So this is how you get the sound of sand effect,1.2575757575757576,0.062244746122568174,66,51,13,2
"Yes, I finally found a location for our vacation tree house with good landline reception.",1.2575757575757576,0.06933115715364845,66,53,9,4
Now I just need to set up the WiFi,1.2571428571428571,0.06332967501381806,70,55,12,3
You tell me what you’re wearing first.,1.2571428571428571,0.05997140203803452,70,54,14,2
"Hello, . . . Bill Gates?",1.2571428571428571,0.06651861703541385,70,56,10,4
Are you okay? You sound a little loopy.,1.2571428571428571,0.06651861703541385,70,56,10,4
You’ve taken this too far,1.2571428571428571,0.06651861703541385,70,56,10,4
Why do you say that it sounds like I'm calling from 1956?,1.2571428571428571,0.06332967501381806,70,55,12,3
You're breaking up with me? Here?,1.2571428571428571,0.06651861703541385,70,56,10,4
Rosebud?,1.2567567567567568,0.06103152180137437,74,58,13,3
How about now?  Can you hear me now?,1.2567567567567568,0.06953809311613572,74,61,7,6
We were stupid to get rid of our smartphones.,1.2567567567567568,0.06103152180137437,74,58,13,3
"Hi, we've been trying to reach you about your car's extended warranty!",1.2567567567567568,0.05791902456400711,74,57,15,2
Please listen carefully as our option menus have recently changed............,1.2567567567567568,0.05791902456400711,74,57,15,2
Yes....I can hear you....faint but audible.,1.2567567567567568,0.05791902456400711,74,57,15,2
I told you to call my cell.,1.2567567567567568,0.06103152180137437,74,58,13,3
YOUR SAYING THE I.R.S. IS SAVING MONEY TO COMMUNICATE WITH THE PUBLIC?,1.2567567567567568,0.05791902456400711,74,57,15,2
We’d like to talk about your cars extended warranty.,1.2567567567567568,0.06103152180137437,74,58,13,3
I've told you never call me at this number!,1.2567567567567568,0.06103152180137437,74,58,13,3
So…what did you need me this far from my desk to tell me?,1.2567567567567568,0.06399281131765669,74,59,11,4
Explain to me again why we chose not to go wireless?,1.2567567567567568,0.06399281131765669,74,59,11,4
You want a safe call- that is it!,1.2567567567567568,0.06103152180137437,74,58,13,3
"Yes, yes, I’ve taken every precaution to not be traced. I have the briefcase, where do we make the exchange?",1.2567567567567568,0.05791902456400711,74,57,15,2
"Yes, if our line drops, gimmie a smidge, and I’ll pick it up.",1.2564102564102564,0.05300147785968333,78,59,18,1
"Loud and clear, Noah!",1.2564102564102564,0.05895046497960103,78,61,14,3
Still better than Skype.,1.2564102564102564,0.0643518297122299,78,63,10,5
Too bad I’m deaf and mute.,1.2564102564102564,0.056054946153848324,78,60,16,2
Hello?  Hello?  Maybe you should have paid for the roaming charges.,1.2564102564102564,0.05895046497960103,78,61,14,3
Look for your driver in an 1822 Oxen Wagon arriving in 2 hours.,1.2564102564102564,0.0693336761848995,78,65,6,7
这个设备被窃听了。,1.2564102564102564,0.06688914949610412,78,64,8,6
A landline does has its limitations…,1.2564102564102564,0.056054946153848324,78,60,16,2
The service out here is actually pretty good.,1.2564102564102564,0.0643518297122299,78,63,10,5
"Not all who wander at lost, but sure looks like I am...",1.2564102564102564,0.056054946153848324,78,60,16,2
"Miriam, the reception is really bad out here. I only have one bar.",1.2564102564102564,0.056054946153848324,78,60,16,2
"No, I don’t see any juice bars.",1.2564102564102564,0.05895046497960103,78,61,14,3
"Sorry, I’m running about a century and a half late.",1.2564102564102564,0.061710271870341823,78,62,12,4
"It looks like a Cezanne from here, too",1.2564102564102564,0.05895046497960103,78,61,14,3
Sorry I'm running late. Can you give me another extension?,1.2560975609756098,0.05705556442121219,82,64,15,3
The mountains are calling me.,1.2560975609756098,0.05963599209936419,82,65,13,4
Act now. Your car warranty is about to expire!,1.2560975609756098,0.06210930426214548,82,66,11,5
"Well, it certainly took long enough..",1.2560975609756098,0.05705556442121219,82,64,15,3
There’s not enough tension in this conversation.,1.2560975609756098,0.05705556442121219,82,64,15,3
Surely this could have been an email...,1.2560975609756098,0.06210930426214548,82,66,11,5
"Yes,I can hear you now- but you’ll have to hold on because I have another call I’m expecting to come in via Smoke signals",1.2560975609756098,0.05963599209936419,82,65,13,4
"Hang on a sec, I need to get the other line",1.2560975609756098,0.05435276726322922,82,63,17,2
Uber runs camels ?,1.2560975609756098,0.05435276726322922,82,63,17,2
I’m sorry — how did you get this number?,1.2560975609756098,0.06210930426214548,82,66,11,5
"No, it’s okay, I have roaming turned on.",1.2560975609756098,0.05705556442121219,82,64,15,3
Did you not see my out of office?,1.2560975609756098,0.05963599209936419,82,65,13,4
Bars?  None yet.,1.255813953488372,0.06006391149595306,86,69,12,5
I still don't see the dessert.,1.255813953488372,0.06006391149595306,86,69,12,5
Maybe if you emptied the can?,1.255813953488372,0.05532158567646685,86,67,16,3
It sounds like you have sand in your mouth.,1.255813953488372,0.05774145523777671,86,68,14,4
"Hello,I need a taxi. I do not seem to know where I am.",1.255813953488372,0.06006391149595306,86,69,12,5
"What,when,why!!!",1.255813953488372,0.062299849722219976,86,70,10,6
"So, how do I find you?",1.255813953488372,0.05774145523777671,86,68,14,4
I don't have that document. Can you share your screen?,1.255813953488372,0.05774145523777671,86,68,14,4
"Sorry, you've got the wrong can.",1.255813953488372,0.05013264624297865,86,65,20,1
The hills are alive?,1.255813953488372,0.062299849722219976,86,70,10,6
We will not string you along. Please hold for the next available can.,1.255813953488372,0.05532158567646685,86,67,16,3
Is the only game on this self-phone kick the can?,1.2555555555555555,0.056003190365495135,90,71,15,4
These hills always cause interference.,1.2555555555555555,0.056003190365495135,90,71,15,4
"Sorry, I can't hear you.  There must be a kink in the cord!",1.2555555555555555,0.05372773437412524,90,70,17,3
I can't hear you.  You need to taut the string.,1.2555555555555555,0.056003190365495135,90,71,15,4
Watson.  Can you hear the sea?,1.2555555555555555,0.05818973467245933,90,72,13,5
"What do you mean, I need to go back and get the eggs?",1.2555555555555555,0.056003190365495135,90,71,15,4
"Hello, is this MCI?",1.2555555555555555,0.05818973467245933,90,72,13,5
"Look, 'dumb phones' are making a comeback, it's only a matter of time...",1.2555555555555555,0.06029704065199671,90,73,11,6
"Hold on, my other line is ringing.",1.2553191489361701,0.052256714170322044,94,73,18,3
"Hey, boss, this sales territory is really hot!
Anyway you could join me?",1.2553191489361701,0.05001983183172017,94,72,20,2
I can barely hear you ... Are you pulling the string tight?,1.2553191489361701,0.052256714170322044,94,73,18,3
"SPAM CALLS…From Canned Meat…
To Telecommunications",1.2553191489361701,0.05646525812115869,94,75,14,5
We are calling to reach you about your extended warranty,1.2553191489361701,0.05646525812115869,94,75,14,5
Do you have any idea where I can find the subway?,1.2553191489361701,0.05440169827573315,94,74,16,4
This is the earth calling. Fix your shit or else!,1.2553191489361701,0.05845601743271815,94,76,12,6
Your car warranty is about to expire.,1.2551020408163265,0.05292064109695132,98,77,17,4
She sells sea shells by the seashore.  Can you hear me now?,1.2549019607843137,0.047631281576555405,102,78,22,2
I've been telling Marge we need to get rid of our landline...,1.2547169811320755,0.04844633891911878,106,82,21,3
I’d advise against Enron at this point.,1.2542372881355932,0.0666174487376973,59,46,11,2
"No, “mountain time” was NOT just figurative.",1.2542372881355932,0.0666174487376973,59,46,11,2
"Hey, this actually works and it’s better than Zoom!",1.2542372881355932,0.0620760093786306,59,45,13,1
Arrived. The destination is on your left.,1.253968253968254,0.06776459195111455,63,50,10,3
"Long Distance, this is Erin, how may I direct your call?",1.253968253968254,0.06776459195111455,63,50,10,3
"Hello, Stone Age? It's the Republican National Committee. You are no longer on hold.",1.2537313432835822,0.06500629194781038,67,53,11,3
"The service is bad, I'll text you.",1.2537313432835822,0.06839665216351999,67,54,9,4
You’ve reached the afterlife. Please keep holding — your call will be answered in the order it was received.,1.2537313432835822,0.06142909700158688,67,52,13,2
See! Doesn’t this make getting fired more fun?,1.2537313432835822,0.057630286517219256,67,51,15,1
"You can tell me, it’s a secure landline.",1.2535211267605635,0.06253629886486937,71,56,12,3
I'm near the top. Speak up.,1.2535211267605635,0.07154042309408612,71,59,6,6
"It's been thirty years of extending the line, but I can still hear you, Bobby!",1.2535211267605635,0.06567498125342551,71,57,10,4
The FBI has wiretapped all my phones!,1.2535211267605635,0.07154042309408612,71,59,6,6
Busy Signal.,1.2535211267605635,0.06253629886486937,71,56,12,3
Are you working remotely today?,1.2535211267605635,0.05923153036006021,71,55,14,2
Customer Service? You lied to me. The string is costing me way more than cellphone service ever did.,1.2535211267605635,0.06253629886486937,71,56,12,3
"You sound a bit muffled, try using an empty can.",1.2535211267605635,0.06253629886486937,71,56,12,3
Does your landline line too much land?,1.2535211267605635,0.05923153036006021,71,55,14,2
"Yes, clear as a bell on a distant hill.",1.2535211267605635,0.06567498125342551,71,57,10,4
"Follow me to your destination.  If you’d like, tie you briefcase on me, so you won’t have to carry it.",1.2535211267605635,0.07154042309408612,71,59,6,6
I don't get it. She said I had lousy communication skills and she needed some space.,1.2535211267605635,0.05573113763304321,71,54,16,1
I’d like to make a collect can please.,1.2535211267605635,0.05199562688295695,71,53,18,0
Climate cataclysm? Pah! A sales target's a sales target!,1.2535211267605635,0.05573113763304321,71,54,16,1
I think I’m in a dead zone,1.2535211267605635,0.06567498125342551,71,57,10,4
"Yes, we do still make long distance calls.",1.2535211267605635,0.06253629886486937,71,56,12,3
I might be a little late for dinner.,1.2533333333333334,0.05400478234857089,75,57,17,1
"Sorry, you must have the wrong can.",1.2533333333333334,0.05400478234857089,75,57,17,1
Long distance please operator.,1.2533333333333334,0.057244011711941316,75,58,15,2
"No, I don’t have Prince Albert in a can.",1.2533333333333334,0.060309511996344614,75,59,13,3
I don’t need a cellphone plan.,1.2533333333333334,0.0632265576921407,75,60,11,4
"With a  long enough cord, you can use your Landline anywhere",1.2533333333333334,0.05400478234857089,75,57,17,1
"Hello, and welcome to Moviefone.",1.2533333333333334,0.06601483134840197,75,61,9,5
"This is a long distance call,please keep it short. Thx",1.2533333333333334,0.057244011711941316,75,58,15,2
Dennis begins to have second thoughts about his investment in an analog GPS.,1.2533333333333334,0.0632265576921407,75,60,11,4
"You thought I was dead, didn't you?",1.2533333333333334,0.057244011711941316,75,58,15,2
"No... I say: ""We definitely have to improve coverage"".",1.2533333333333334,0.057244011711941316,75,58,15,2
I didn’t think a trail of breadcrumbs would work.,1.2533333333333334,0.060309511996344614,75,59,13,3
"Yah, amazing! Full landline service throughout the southwest for only two bucks a month.",1.2533333333333334,0.0632265576921407,75,60,11,4
"go ahead, I hear you loud and clear!!",1.2533333333333334,0.0632265576921407,75,60,11,4
"It’s a little isolated, but I’m the head of the whole department!",1.2533333333333334,0.060309511996344614,75,59,13,3
5G?? i'm still using 2G?,1.2533333333333334,0.057244011711941316,75,58,15,2
« There’s no place like home »,1.2533333333333334,0.057244011711941316,75,58,15,2
I didn't realize my auto warranty was about to expire.,1.2531645569620253,0.0610105168366915,79,63,12,4
Did you know your car warranty is about to expire?,1.2531645569620253,0.05242683788109758,79,60,18,1
To speak to a customer service representative stomp eight times.,1.2531645569620253,0.058289906672228484,79,62,14,3
Hello? I'm waiting for a system update.,1.2531645569620253,0.058289906672228484,79,62,14,3
You'll have to excuse me if I sound a bit out of line this morning.,1.2531645569620253,0.0610105168366915,79,63,12,4
I think someone’s tapped this line Mr. Trump,1.2531645569620253,0.05242683788109758,79,60,18,1
We should've just used our cell phones,1.2531645569620253,0.05242683788109758,79,60,18,1
Lewis' test of the new land line design had remarkably good results.,1.2531645569620253,0.05242683788109758,79,60,18,1
What do you mean wireless?,1.2531645569620253,0.05543593847887846,79,61,16,2
I can’t hear you! The string has to be straight!,1.2531645569620253,0.0610105168366915,79,63,12,4
"Honey, it happened again. I’ll be late for dinner",1.2531645569620253,0.05242683788109758,79,60,18,1
"Morpheus, the line was traced.  I don't know how.",1.2531645569620253,0.05242683788109758,79,60,18,1
"Okay, I moved a bit. Can you hear me now?",1.2531645569620253,0.05242683788109758,79,60,18,1
"Amazing, no matter where I call from, I still get the little girl next door.",1.2531645569620253,0.06361488119538797,79,64,10,5
Please say or enter your Wire-Fi code.,1.2530120481927711,0.058993849806645786,83,66,13,4
What is your soup of the day?,1.2530120481927711,0.061433970043286566,83,67,11,5
"Hello,this is Robert. You have miles to go before you sleep. Walk faster!",1.2530120481927711,0.05378250267948101,83,64,17,2
"Despite being one of the top wireless phone and internet salespeople in underserved communities, he just couldn't let it go.",1.2530120481927711,0.05378250267948101,83,64,17,2
"Sorry, my name's not 'Watson.'",1.2530120481927711,0.05378250267948101,83,64,17,2
"Martha, I'm sorry I'm late; I have been on the can.",1.2530120481927711,0.058993849806645786,83,66,13,4
I don’t see that you left your water bottle here.,1.2530120481927711,0.058993849806645786,83,66,13,4
Are you're saying you want to eat a fried clam?,1.2530120481927711,0.058993849806645786,83,66,13,4
It's Mom.  Did you eat a good breakfast?,1.2530120481927711,0.05644834767058051,83,65,15,3
I should’ve splurged for the iPhone,1.2530120481927711,0.048008758304372776,83,62,21,0
"He says he's standing on a corner in Winslow, Arizona . . . he says he's a fine sight to see . . . oh, he says a girl in a flatbed Ford has just pulled up, and he wants to know if he should climb in.",1.2528735632183907,0.061649757041938535,87,71,10,6
Landlines aren’t what they used to be.,1.2528735632183907,0.059442277353480615,87,70,12,5
"Dear, how can I miss you when you call every day!",1.2528735632183907,0.05226336879576659,87,67,18,2
Sounds like the ocean's calling.,1.2528735632183907,0.05226336879576659,87,67,18,2
So this is what peak times means.,1.2528735632183907,0.05714959431707437,87,69,14,4
The service is bad! You sound really far away!!,1.2528735632183907,0.05714959431707437,87,69,14,4
Now I’m both tired and wired,1.2528735632183907,0.05714959431707437,87,69,14,4
That'll be 25 cents please.,1.2527472527472527,0.055455504374433896,91,72,15,4
Can you speak up? I think the lines are crossed.,1.2527472527472527,0.055455504374433896,91,72,15,4
"Hello, Uber.  That's right.  Just follow the string.",1.2527472527472527,0.055455504374433896,91,72,15,4
"Damn, they cut the secure line!",1.2527472527472527,0.05086169950977227,91,70,19,2
"This isn't funny, John. I know what you're doing.",1.2527472527472527,0.055455504374433896,91,72,15,4
"Please hang up, and try your call again.",1.2527472527472527,0.0532082016349229,91,71,17,3
Hello Donald…I’m on the secure line…say again?!,1.2527472527472527,0.057615216823536305,91,73,13,5
Looks like a new twist on telephony!,1.2526315789473683,0.04725006989129985,95,72,22,1
And no roaming charges!,1.2526315789473683,0.05593233204209039,95,76,14,5
"Give me a minute, I’ve just got to wrap something up.",1.2524271844660195,0.047231454755101675,103,79,22,2
"Don't say anything incriminating, I think the line's been tapped.",1.2524271844660195,0.045171261983518396,103,78,24,1
"Hold on a sec, honey, I’m getting another Spam call.",1.25,0.058509124791617455,72,56,14,2
"I can offer you the whole system for a very reasonable price, Mr. Musk.",1.25,0.06247806632675042,76,61,11,4
"Can I reach or leave, what""s your openion",1.25,0.050380776561286734,92,71,19,2
I hear you fine. I have my phone set on Wire-Fi calling.....,1.25,0.05836508438405426,84,67,13,4
Hold on while I untangle things here.,1.25,0.05506433852460047,72,55,16,1
"I know, I know. But it's only $2.75 a month.",1.25,0.06176207566630455,72,57,12,3
"Patent #RE000538, failsafe communications cybersecurity.",1.25,0.05421135926495693,88,69,16,3
It’s times like this I’m glad I kept my landline.,1.25,0.05491817307046037,92,73,15,4
