caption,mean,precision,votes,not_funny,somewhat_funny,funny
I'm calling about your car warranty.,1.336,0.05321168923242092,125,91,26,8
I'd like a divorce.,1.336,0.05198510953054946,125,90,28,7
"No, I'm calling from my home phone.  Why do you ask?",1.336,0.05198510953054946,125,90,28,7
...Just because I'm not tech-savvy doesn't mean I can't work remotely.  Then my boss said....prove it.,1.336,0.05198510953054946,125,90,28,7
Sisyphus,1.3359375,0.05116427888487294,128,92,29,7
"Your're tin can is full. Would you like to purchase more string?""",1.3358778625954197,0.05265771213634363,131,96,26,9
I may have to pull some strings to make this work.,1.3352941176470587,0.04330910090462101,170,121,41,8
"Boss, boss, it's good, there's no competition.",1.3333333333333333,0.055249462010983,105,75,25,5
I just realized we've been playing this for 40 years now.,1.3333333333333333,0.060456354175834316,96,70,20,6
Every time I power this thing up my cat comes running.,1.3333333333333333,0.059868434008924984,93,67,21,5
Can we make this quick? I'm roaming.,1.3333333333333333,0.055249462010983,105,75,25,5
I’m listening.,1.3333333333333333,0.05800898539529546,102,74,22,6
"If you wish to speak to a representative, please press 1",1.3333333333333333,0.05631079226779448,102,73,24,5
Were your ears burning?,1.3333333333333333,0.06412242068556367,84,61,18,5
We won't give up the land line!,1.3333333333333333,0.052010608140773816,129,94,27,8
Hello ?  Hello?  911 ? I think I'm lost.,1.3333333333333333,0.06258368958788295,99,74,17,8
Not working.  I need the kind of can you can drink from.,1.3333333333333333,0.06573421981221796,81,59,17,5
The mountains are calling and I must go,1.3333333333333333,0.06170531471130043,108,82,16,10
"Yes, I have the money. No, I haven't been followed.",1.3333333333333333,0.06443139104042495,105,81,13,11
"Operator, ....all I hear is the sound of music.",1.3333333333333333,0.06515131719569899,90,67,16,7
I'll be over in a second.,1.3333333333333333,0.059198243857910574,99,72,21,6
"What's that? It's not a phone it's a seismic charge?""",1.3333333333333333,0.06178983315544389,93,68,19,6
You have reached customer service. Press one to not be helped.,1.3333333333333333,0.061822356975481156,111,85,15,11
"Yeah, I've got time for a survey!",1.3333333333333333,0.05912385696081233,90,64,22,4
"Phil wanted to join us, but he got tangled up.",1.3333333333333333,0.06573421981221796,81,59,17,5
You stopped the subpoena but not the search warrant. You are fired!,1.3333333333333333,0.06872004786858678,87,66,13,8
I'm not getting good vibrations.,1.3333333333333333,0.05664460697409419,114,84,22,8
"Sir, you can download Find my iPhone in the app store.",1.3333333333333333,0.060456354175834316,96,70,20,6
"Yes, that's me.",1.3333333333333333,0.07051432501634684,84,64,12,8
no silly goose you hang up first,1.3333333333333333,0.059113479802863036,111,83,19,9
"The fees are reasonable,but the service could be better.",1.3333333333333333,0.056882802635359275,105,76,23,6
"To return to the main menu, say, ""God damn son of a bitch!""",1.3333333333333333,0.05961655728063101,123,95,15,13
I can hardly hear you. It sounds like you’re calling from the ocean.,1.3333333333333333,0.060483085719923876,111,84,17,10
At least I'll never have to call Comcast,1.3333333333333333,0.05800898539529546,102,74,22,6
I don't know where he is.  I was just walking by and picked this up.,1.3333333333333333,0.059868434008924984,93,67,21,5
Hold on I’m stepping into an elevator,1.3333333333333333,0.060456354175834316,96,70,20,6
Can’t hear you.  Pull the string tighter.,1.3333333333333333,0.055607067440108786,99,70,25,4
Why yes — I am alone.,1.3333333333333333,0.05800898539529546,102,74,22,6
Feel like she misinterpreted my desire for a direct connection.,1.3333333333333333,0.06872004786858678,87,66,13,8
So is this phone the 13 or the 12?,1.3333333333333333,0.05428852849870469,117,85,25,7
Fuck cell phones.,1.3333333333333333,0.06420951071078496,99,75,15,9
The current wait time is two seasons.,1.3333333333333333,0.06804138174397717,81,60,15,6
My phone works just fine!  Why pay for an upgrade?,1.3333333333333333,0.0562743562095842,111,81,23,7
"No, this can did not come with GPS.",1.3333333333333333,0.05912385696081233,90,64,22,4
I CAN hear you but it sounds a bit tinny.,1.3333333333333333,0.06184515423160927,84,60,20,4
What's that? The Campbells are coming?,1.3333333333333333,0.06320606175199696,90,66,18,6
This call may be monitored for string tension purposes.,1.3333333333333333,0.05383401070884129,114,82,26,6
I can’t believe how long it takes to make a long distance call out here,1.3333333333333333,0.05631079226779448,102,73,24,5
yes...The string is end-to-end encrypted,1.3333333333333333,0.056938289043578914,117,87,21,9
My 6 year old says these cans have the best reception.,1.3333333333333333,0.06632153924044035,84,62,16,6
"Honey, you forgot your passport !!",1.3333333333333333,0.06845004236570007,84,63,14,7
"Today will definitely be my highest number of steps taken, thanks Ican Phone",1.3333333333333333,0.0532841706250819,111,79,27,5
"Sorry, repeat that. Must be a bad connection.",1.3306451612903225,0.04954788272046373,124,88,31,5
"Now you can't hang up.""",1.3305084745762712,0.052539568976509424,118,85,27,6
Hello. We’ve been trying to reach you about your expiring car warranty.,1.3305084745762712,0.05390056455995247,118,86,25,7
Where are you? You sound so far away.,1.3305084745762712,0.052539568976509424,118,85,27,6
"What do you mean, ""Long distance charges may apply?""",1.3304347826086957,0.05622464901122559,115,85,22,8
"Your mission, should you agree to accept it.",1.3304347826086957,0.05344249763850928,115,83,26,6
"Hold on, I’ve got another call",1.3304347826086957,0.05199562724446499,115,82,28,5
Calling very long distance from your seven year-old self.,1.3304347826086957,0.05756532339640098,115,86,20,9
It’s lithium-free AND environmentally friendly,1.3303571428571428,0.052890079393524796,112,80,27,5
'Press '1' if you want to file a complaint.',1.3303571428571428,0.05584900017013445,112,82,23,7
"Long distances, old ways",1.3303571428571428,0.05438966500290764,112,81,25,6
"On the plus side, there are no roaming charges!",1.3302752293577982,0.05057442020960619,109,76,30,3
The biggest nudge to get people back in the office are the new company phones.,1.3302752293577982,0.05837161387245833,109,81,20,8
Press one for camel. Press two for water.,1.330188679245283,0.05481603328059687,106,76,25,5
"I don't like getting strung along, okay?",1.330188679245283,0.05481603328059687,106,76,25,5
Hold on. We're replacing the dixi-cup with a mic.,1.330188679245283,0.05481603328059687,106,76,25,5
The Earth does speak. All you have to do is listen.,1.330188679245283,0.05800160810920526,106,78,21,7
Ted's job required limited travel.,1.330188679245283,0.05800160810920526,106,78,21,7
I think I lost you.,1.3300970873786409,0.05585523821903766,103,74,24,5
And Comcast is only charging $99/month for this!,1.33,0.05869799439039245,100,73,21,6
Who says they don't make 'em like they used to?,1.33,0.060394327113353505,100,74,19,7
There’s no cell service out here but I’ve found a workaround.,1.3298969072164948,0.056230474817709875,97,69,24,4
"Bob, you’re pixilated. Try restarting your can”",1.3298969072164948,0.0542871040480398,97,68,26,3
"Hello? I'm here to oversee that cellphone tower installation.""",1.3297872340425532,0.05323722581844251,94,65,27,2
"Yea. Okay. Ok, I will. Yep. Ok, bye Mom. Bye. Ya, okay. Bye.",1.3297872340425532,0.06307222217323323,94,70,17,7
"OK, what's your fax number?",1.3297872340425532,0.06307222217323323,94,70,17,7
But I don't own a car....,1.3297872340425532,0.06307222217323323,94,70,17,7
You’re telling me she’s finally coming around the mountain?,1.3297872340425532,0.06307222217323323,94,70,17,7
We do business the old-fashioned way.,1.3296703296703296,0.06453543017009596,91,68,16,7
"Mom, I'm at work!  You can't keep calling me like this.",1.3296703296703296,0.060633499477094704,91,66,20,5
Ma? Ma Bell? How do I open GPS on this thing?,1.3296703296703296,0.06261486646986551,91,67,18,6
"I’d like to order another roll of dental floss, please.",1.3296703296703296,0.06261486646986551,91,67,18,6
I told you two cans and a string wouldn't work.,1.3296703296703296,0.06453543017009596,91,68,16,7
"What I really need is soup.""",1.3295454545454546,0.06609259935832569,88,66,15,7
It must be your cell. I’m on a land line.,1.3295454545454546,0.06408586950402127,88,65,17,6
I think I hear a sea shell.,1.3294117647058823,0.0677535393849843,85,64,14,7
It didn’t go well. She seemed offended when I told her I was calling from the can.,1.3294117647058823,0.06123892524153928,85,61,20,4
- Do you want to know what’s up on Twitter today?,1.3294117647058823,0.0656538654945365,85,63,16,6
"Please hold, I got someone on the other line",1.3294117647058823,0.05890750308679626,85,60,22,3
"Reaches where cellphone coverage doesn't. Act now, this week only $35.95/mo.",1.329268292682927,0.06952949382475608,82,62,13,7
I think I've gone as far as I can. You are going to have to pull some strings if you want me to go further.,1.3291139240506329,0.06425747206191397,79,57,18,4
They put me on hold.,1.3289473684210527,0.06853903458111422,76,56,15,5
"We’re expected at your mother’s house? Sure, I’d love to go - just text me the address.",1.3289473684210527,0.07105263157894735,76,57,13,6
We’re calling about your car’s expired warranty.,1.3282442748091603,0.050181991856702655,131,95,29,7
I wish they would just pay my roaming charges.,1.328125,0.05332148703225285,128,95,24,9
"Thanks for picking up, I was wondering if I could interest you in our new cellular plan.",1.328,0.056541163994088865,125,95,19,11
"Yes, dear. Milk and bread.  Over and out.",1.3278688524590163,0.052627253600624674,122,89,26,7
She wants you to pick up a quart of vanilla ice cream on the way home.,1.3278688524590163,0.052627253600624674,122,89,26,7
Oh wonderful! I have been concerned about my vehicle’s warranty expiring.,1.3278688524590163,0.05389907994046238,122,90,24,8
I can barely hear you and your words are all twisted.,1.3277310924369747,0.05859928363845082,119,91,17,11
I hope there’s no roaming charges.,1.3274336283185841,0.05398540953930765,113,82,25,6
What do you mean I'm not plugged in?,1.3274336283185841,0.0554297055379319,113,83,23,7
"Seriously, can you hear me now?",1.3274336283185841,0.05821089143632811,113,85,19,9
Your story line has too many twists in it.,1.3274336283185841,0.05398540953930765,113,82,25,6
Where did you get this number?,1.3274336283185841,0.04608997047787535,113,77,35,1
"Please hold, a representative working remotely will be with you shortly.",1.3272727272727274,0.05342184380954878,110,79,26,5
"No, he's not here. I'll take a message.",1.3272727272727274,0.05496088670504373,110,80,24,6
Now I understand about roaming charges.,1.3272727272727274,0.05645799092066136,110,81,22,7
You've got to pull the string taut! Don't you know how to use a land-line?,1.3271028037383177,0.05753978779449598,107,79,21,7
So I should bury it here?,1.3271028037383177,0.05598652905994861,107,78,23,6
"You have to admit, it works.",1.3269230769230769,0.05540654905492172,104,75,24,5
Please give it to me straight.,1.3269230769230769,0.04819812951382046,104,71,32,1
I’m calling you back on the landline.,1.3267326732673268,0.05469792996805201,101,72,25,4
Can’t believe I get service out here!,1.3267326732673268,0.05988257633678194,101,75,19,7
They’ve got great coverage here.,1.3267326732673268,0.05820569685821413,101,74,21,6
"Yes, I can hear you now. But how did you get this number? It’s unlisted.",1.3267326732673268,0.052856823029857974,101,71,27,3
I'm sorry; I was on butte.,1.3267326732673268,0.06151376066142205,101,76,17,8
The connection is poor; you sound like you’re talking in a can.,1.3265306122448979,0.05383564730454025,98,69,26,3
"The best part is, I can't check Twitter on it.",1.3265306122448979,0.05940923520693788,98,72,20,6
"”Patriot, this is the last time we will ask you. Will you send money to the Trump team?",1.3265306122448979,0.06115431843785092,98,73,18,7
"Why yes, I am considering a different long-distance plan.",1.3265306122448979,0.05940923520693788,98,72,20,6
Hello. Is your refrigerator running?,1.3263157894736841,0.06426796028840678,95,72,15,8
I have been trying to contact you about your car warrenty,1.3263157894736841,0.05880882775937456,95,69,21,5
"Uh, can you hold a sec?  She's behind a tree . . .",1.3263157894736841,0.06250125241864157,95,71,17,7
Is this a 'party' line?,1.326086956521739,0.06007777975825822,92,67,20,5
"I'll be in a meeting at 3, so I won't be able to talk. Can I smoke signal you the address?",1.326086956521739,0.06393060853112943,92,69,16,7
"Okay, now pull!",1.326086956521739,0.062034112905087556,92,68,18,6
I thought there would be a cell tower up here by now!,1.326086956521739,0.05805556026292755,92,66,22,4
"Well, I can hear you yelling, just not through the can.",1.3258426966292134,0.0634698115746925,89,66,17,6
"Yes Honey, I know. I hate this whole 6ft apart thing too…",1.3258426966292134,0.06142519325499753,89,65,19,5
Don’t forget to take the trash out.,1.3258426966292134,0.06142519325499753,89,65,19,5
"Well, you did implement the work-from-anywhere-policy...",1.3255813953488371,0.06285905991314628,86,63,18,5
"Wait, sorry, the hills are alive with the sound of what?",1.3255813953488371,0.06285905991314628,86,63,18,5
The reception on my new I-Can isn't great but the soup was excellent.,1.3255813953488371,0.06285905991314628,86,63,18,5
"Yes, mine's broken so I'm using my son's phone.",1.3255813953488371,0.0670705377613713,86,65,14,7
Would you give me that address again please.,1.3253012048192772,0.06206466662330453,83,60,19,4
"Can you hold, please?  I getting another call through this line",1.3253012048192772,0.06438851763577323,83,61,17,5
"Yeah,yeah,I'm pretty sure it's a secure line...",1.3253012048192772,0.0596503519083633,83,59,21,3
Do you really think I need car insurance if I use a string telephone?,1.3253012048192772,0.0666313707168225,83,62,15,6
Yes… This is Mr. Godot. I believe they’re still waiting on me.,1.3253012048192772,0.06206466662330453,83,60,19,4
"To speak with an operator, follow the cord.",1.3253012048192772,0.0596503519083633,83,59,21,3
"Sorry, reception not so good out here",1.3252032520325203,0.05475635754050396,123,92,22,9
Can you hear me now?,1.325,0.06837859980573166,80,60,14,6
I think the line is kinky.,1.325,0.06358239944345717,80,58,18,4
Do you have a moment to talk about your long distance service?,1.325,0.06837859980573166,80,60,14,6
What?,1.3247863247863247,0.06287757723067597,117,93,10,14
Is more string included with roaming charges? Or is that extra?,1.3247863247863247,0.05405602837894666,117,86,24,7
I just switched to a new carrier.,1.3247863247863247,0.05405602837894666,117,86,24,7
"OK, so, I put the briefcase down and wait to see what happens next?",1.3246753246753247,0.05973728780981787,77,54,21,2
Collect call from Lawrence of Arabia.,1.3246753246753247,0.06777782863036942,77,57,15,5
This is Donald. Send money now!,1.3246753246753247,0.06777782863036942,77,57,15,5
"Yes, you can.",1.3245614035087718,0.05776945603406374,114,86,19,9
Hello. This is your operator speaking. You are about to run out of wire length. Please submit all account information to extend its length. Thank you,1.3245614035087718,0.056409703556627944,114,85,21,8
We've started the meeting without you.,1.3243243243243243,0.058875849280734714,111,84,18,9
The roaming fees are outrageous.,1.3243243243243243,0.06966388896823443,74,55,14,5
I don't want life insurance.  I'm only eight years old.,1.3243243243243243,0.06966388896823443,74,55,14,5
"Hello, welcome to the help line. Press 1 for directions.",1.3243243243243243,0.05454324098481222,111,81,24,6
So I took a break from social media...,1.3243243243243243,0.06695389592273865,74,54,16,4
"Actually, I am on my hill and dale line.",1.3240740740740742,0.05708492592953679,108,80,21,7
I'll hold. There's a line to the can.,1.3238095238095238,0.058201428200252106,105,78,20,7
You're saying I've been canned?,1.3238095238095238,0.06274437659264494,105,81,14,10
What’s for dinner?,1.3238095238095238,0.05660614861831635,105,77,22,6
You're breaking up.  We must have a kinked connection.,1.3238095238095238,0.051524804822030805,105,74,28,3
Deposit 15¢ please.,1.3235294117647058,0.06256313403142062,102,78,15,9
I hear the ocean.,1.3235294117647058,0.06099187387733386,102,77,17,8
"Dang, spam call.",1.3235294117647058,0.057721179453808814,102,75,21,6
"Well, the roaming charges aren’t great.",1.3233082706766917,0.04954667149963756,133,97,29,7
My new plan offers unlimited calls and string.,1.3229166666666667,0.061940109136835064,96,72,17,7
It works.,1.3229166666666667,0.056379804744615195,96,69,23,4
New tin can... who dis?,1.3229166666666667,0.0544002218508978,96,68,25,3
Maybe we should go cordless.,1.3229166666666667,0.056379804744615195,96,69,23,4
"I will not capitulate and buy a ""smart phone"".",1.3229166666666667,0.06538481177698005,96,74,13,9
I think the can is bugged.,1.3229166666666667,0.061940109136835064,96,72,17,7
You’ll never guess what I’m calling from.,1.3229166666666667,0.056379804744615195,96,69,23,4
"No, I can't hear you",1.3225806451612903,0.059531618768027865,93,68,20,5
"New can, who dis?",1.3225806451612903,0.05190873779658581,124,91,26,7
Can you speak a little louder?,1.3225806451612903,0.06333657564579082,93,70,16,7
"Honey, can you put the dog on?",1.3225806451612903,0.06333657564579082,93,70,16,7
"It’s not you, it’s me.",1.3225806451612903,0.06333657564579082,93,70,16,7
So you are telling me that the warranty on my car has expired?,1.3222222222222222,0.06286496988701916,90,67,17,6
"can you hear me now? Yes, I said to take the fifth!",1.3222222222222222,0.06084666423690372,90,66,19,5
Did you say pull it tight?,1.3222222222222222,0.06084666423690372,90,66,19,5
"Mother, I really think it’s time to cut the cord.",1.3222222222222222,0.05875907298980447,90,65,21,4
hang on it’s going through a tunnel,1.3222222222222222,0.06286496988701916,90,67,17,6
I am on the national do not call list!,1.3218390804597702,0.06224494146666465,87,64,18,5
Why does nature call every time I have a deadline?,1.3218390804597702,0.06224494146666465,87,64,18,5
The sound quality is uncanny.,1.3218390804597702,0.055430209444874944,87,61,24,2
"Hang on, I’m getting an echo.",1.3218390804597702,0.06005934175319085,87,63,20,4
I'll bring home canned peas but you are not getting your own phone.,1.3218390804597702,0.06435635900632077,87,65,16,6
"Your call is important to us, but not important enough to pull the string taut.",1.3218390804597702,0.06435635900632077,87,65,16,6
LOST ?? Follow the line home.,1.3217391304347825,0.05864972636152447,115,88,17,10
Once I find another tin can we'll set up the conference call.,1.3214285714285714,0.061443513106299766,84,61,19,4
Just give it to me straight.,1.3214285714285714,0.04781971874667621,112,78,32,2
"...Funny thing is, I'm not missing my smart phone at all!",1.3214285714285714,0.06373513187786542,84,62,17,5
Are you in the tunnel,1.3214285714285714,0.061443513106299766,84,61,19,4
"Yes, I heard it through the grapevine.",1.3211009174311927,0.05956110563910925,109,83,17,9
Collect call? Will I accept the charges? What are you talking about?,1.3211009174311927,0.05355321319699775,109,79,25,5
"Hi Jimmy.  Yeah, I can hear you.  Now close the door and let’s see if it still works.",1.3211009174311927,0.056636878218508054,109,81,21,7
Hey Siri?,1.3209876543209877,0.06764823798912335,81,61,14,6
The land line. According to millenials,1.3209876543209877,0.06989224619613904,81,62,12,7
Wait. Are you me as a child?,1.3209876543209877,0.06989224619613904,81,62,12,7
The basic cell phone plan was about to outlive it’s usefulness.,1.3209876543209877,0.06292058607813335,81,59,18,4
Your call is important to us. Please hold.,1.320754716981132,0.05615274031266755,106,78,22,6
"Do not say anything about your whereabouts, this line may not be secure.",1.320754716981132,0.045775917863392517,159,117,33,9
Alright. I’ve moved to a secure location.,1.320754716981132,0.052855853091096326,106,76,26,4
"Steve,you should really upgrade to 5G.",1.3205128205128205,0.06703260309718895,78,58,15,5
"Can you hold the line, please?",1.3203883495145632,0.055556633677670234,103,75,23,5
I thought you said turn left after the sixth dune.,1.3203883495145632,0.05381609551514566,103,74,25,4
"Yes, this is a secure line",1.3203125,0.0495223167973229,128,93,29,6
Why would I want to upgrade? This phone has served me well since I was six.,1.32,0.060508356953905634,75,53,20,2
"Well when I facetimed you, you were just a black circle.",1.32,0.05839607015973771,100,74,20,6
It's not exactly a level playing field.,1.32,0.05839607015973771,100,74,20,6
"Finally, Jared realized the perils of not paying attention to your surroundings while talking on your phone.",1.32,0.06886466686438221,75,56,14,5
"Yeah I'm stuck using a landline,  my battery is flat",1.3195876288659794,0.05393930292901122,97,69,25,3
Do you feel lost with the high cost of long distance calls.  Spectum can lower you long distance call prices.,1.3195876288659794,0.055894767490079454,97,70,23,4
You say my car warranty has expired?,1.3195876288659794,0.059613574774331844,97,72,19,6
"Sure, I have the occasional dropped call,
but my monthly bill is only $14.99.""",1.3195876288659794,0.057784095260481914,97,71,21,5
I thought it would be safer to talk on a sandline.,1.3195876288659794,0.0613885569929548,97,73,17,7
Stephen Johnson? This is your student loan officer.,1.3194444444444444,0.06802141361977786,72,53,15,4
The landlines are more reliable out in the country,1.3191489361702127,0.054980219311538896,94,67,24,3
Press #1 to continue.,1.3191489361702127,0.057022847306584794,94,68,22,4
I hear America singing!,1.3186813186813187,0.0582175635694764,91,66,21,4
"OK, now pull it tight and talk directly into the can.",1.3186813186813187,0.06420191150243705,91,69,15,7
"Operator, I'd like to make a long distance call.",1.3185840707964602,0.05659072843240931,113,85,20,8
I can’t hear you. Can you pull the string tighter?,1.3181818181818181,0.06164213669280095,88,65,18,5
We'll need to work out a few kinks.,1.3181818181818181,0.06164213669280095,88,65,18,5
Please hang up and dial again.,1.3181818181818181,0.06372586630174333,88,66,16,6
"Sure, I'll hold.",1.317829457364341,0.05041554085011072,129,95,27,7
Can I call you right back,1.3177570093457944,0.054100311815326124,107,78,24,5
"Okay,now what’s the surprise.",1.3177570093457944,0.057267051827607045,107,80,20,7
"If this isn’t Watson, you got the wrong number.",1.3177570093457944,0.057267051827607045,107,80,20,7
Yes…over the mountains AND through the woods!,1.3177570093457944,0.05073630112656223,107,76,28,3
"That's right, it's a mobile AND a landline.",1.3176470588235294,0.06083399072408474,85,62,19,4
"Yes, I’d like to upgrade to a thicker aluminum.",1.3176470588235294,0.06738776270118936,85,65,13,7
What do you mean by 'I've lost the thread of our conversation'?,1.3176470588235294,0.06083399072408474,85,62,19,4
Green Technology has indeed come a long way.,1.3176470588235294,0.06738776270118936,85,65,13,7
"Yes, you've reached The Cloud....",1.3176470588235294,0.058486429046404435,85,61,21,3
Could you fax that to me?,1.3174603174603174,0.05363106615799875,126,95,22,9
"We’re breaking up. No, I mean literally - I don’t want to see you anymore.",1.3173076923076923,0.053385081879791116,104,75,25,4
"Really,you can hear me now?!",1.3173076923076923,0.05677481802775082,104,77,21,6
Say that again; the line's a little squirrely.,1.3173076923076923,0.05160678705292447,104,74,27,3
"Yeah, I can hear you through these cracks.",1.3173076923076923,0.05677481802775082,104,77,21,6
Sorry about this. The FBI has my other phone.,1.3170731707317074,0.062271681805290274,82,60,18,4
I’m at the end of my rope… There’s really no where to go from here,1.3170731707317074,0.07128968259060112,82,64,10,8
Can't text. Forgot my typewriter.,1.316831683168317,0.05790174858302354,101,75,20,6
I am trying to reach the last person with a Land Line.,1.316831683168317,0.05616576080666468,101,74,22,5
Didn’t anyone teach you that it has to be taut.,1.316831683168317,0.0628225428879814,101,78,14,9
"Yes, my phone's in my pocket, but I'm getting better reception with this.",1.316831683168317,0.05616576080666468,101,74,22,5
This is 911 … can you tell me where you are?,1.316831683168317,0.05437437709998408,101,73,24,4
"You're missing the point, Alexa.",1.316831683168317,0.05958718227061813,101,76,18,7
Can you speak up?  I think a cow may be on the line again.,1.316831683168317,0.05437437709998408,101,73,24,4
A little tinny but otherwise a decent connection,1.316831683168317,0.05252192954405878,101,72,26,3
I hear you. Why can't you hear me?,1.3164556962025316,0.06121220504577104,79,57,19,3
"I CAN hear you, CAN you hear me?",1.3164556962025316,0.06380833794566841,79,58,17,4
"Honey, put mommy on the phone.",1.3164556962025316,0.068706942014871,79,60,13,6
"Can you hear me? Wassup, bruh? Wassuuppp?",1.3164556962025316,0.06630289538332196,79,59,15,5
"I have a better idea, Mr. Watson.  You come here.",1.316326530612245,0.057284321901974446,98,72,21,5
"Hello Democracy, is anybody there?",1.316326530612245,0.060846367247508214,98,74,17,7
You're calling about my extended what?,1.316326530612245,0.060846367247508214,98,74,17,7
"Hello, Yesterday this was a local call... Today it's long distance...",1.316326530612245,0.05348557435719858,98,70,25,3
Can you hold please? I have a call on the other line.,1.316326530612245,0.060846367247508214,98,74,17,7
Don't forget the toilet paper.,1.316326530612245,0.05909219044420197,98,73,19,6
The new job isn’t bad. Just have to get over a couple of hills first…,1.316326530612245,0.057284321901974446,98,72,21,5
"Yup, I'm on the 'Friends and 6 cans plan""",1.3162393162393162,0.0551630926604154,117,88,21,8
