caption,mean,precision,votes,not_funny,somewhat_funny,funny
I heard you were down to clown.,1.1777777777777778,0.07309112127323451,45,39,4,2
Your wife filed for divorce. She sent us over to cheer you up!,1.1777777777777778,0.06581953356624205,45,38,6,1
The apolitical circus is in town!,1.1777777777777778,0.07309112127323451,45,39,4,2
"Be careful entering a contest where the winner is declared ""The Lord of the Three Rings.""",1.1777777777777778,0.07970202644274288,45,40,2,3
Can we leave the Beetle parked over the manhole?,1.1777777777777778,0.05763774795025092,45,37,8,0
your wife called,1.1777777777777778,0.07970202644274288,45,40,2,3
"One Thursday, Janice realized she did not want to run away at all. She just wanted to join the circus.",1.1777777777777778,0.06581953356624205,45,38,6,1
"Tell Sondheim, They’re here, Apt 202!",1.1777777777777778,0.07309112127323451,45,39,4,2
Three rings and you still can't take the hint.,1.1777777777777778,0.07970202644274288,45,40,2,3
I think I ordered the wrong home entertainment package.,1.1777777777777778,0.07970202644274288,45,40,2,3
These Disney+ updates are getting out of hand.,1.1777777777777778,0.07309112127323451,45,39,4,2
These delivery apps are really getting competitive.,1.1777777777777778,0.06581953356624205,45,38,6,1
"And for $9.99 a month, the circus will come to you with Circus+",1.1777777777777778,0.06581953356624205,45,38,6,1
The elephant is running late. He decided to take the stairs.,1.1777777777777778,0.07309112127323451,45,39,4,2
Now send in the clowns!,1.1777777777777778,0.06581953356624205,45,38,6,1
Iiiiiiiiiiiiit's Tuesday!,1.1777777777777778,0.06581953356624205,45,38,6,1
- I’m sure it said “on line” tickets,1.1777777777777778,0.06581953356624205,45,38,6,1
Where's the bread?,1.1777777777777778,0.05763774795025092,45,37,8,0
"When you ordered your pizza, you must have clicked on ""Add Fanfare.""  No worries -- it's only three bucks more.",1.1777777777777778,0.07970202644274288,45,40,2,3
We're returning the visit you paid to our Facebook page!,1.1777777777777778,0.06581953356624205,45,38,6,1
"(no quotation marks) Mildred was trying to relax, but the her living room became two tents.",1.1777777777777778,0.05763774795025092,45,37,8,0
"apparently it IS my circus, but are those my monkeys too?",1.1777777777777778,0.06581953356624205,45,38,6,1
Huh! My mind improves its creative manifestations of blocked memories at an escalating rate of alarm! Or are you seeing this one too Mr. Boots?,1.1777777777777778,0.06581953356624205,45,38,6,1
Not my monkeys…,1.1777777777777778,0.07309112127323451,45,39,4,2
This is not the bandwidth I signed up for!,1.1774193548387097,0.058737796974655074,62,53,7,2
"'Work from home' just came home, Honey.",1.1764705882352942,0.05391265523477457,51,42,9,0
"Cheer up, you look like you've never seen Congress on recess before.",1.1764705882352942,0.06075267994050848,51,43,7,1
Hey.  We're your circus; they're your clowns. The bear's a bonus.,1.1764705882352942,0.06075267994050848,51,43,7,1
We heard you have a cat.,1.1764705882352942,0.06689694944796853,51,44,5,2
Your meds are kicking in!,1.1764705882352942,0.07252251768198795,51,45,3,3
Your Pay-per-View is here!,1.1764705882352942,0.06689694944796853,51,44,5,2
Ah! The circus has come to townhouse.,1.1764705882352942,0.06689694944796853,51,44,5,2
You always wanted to join the circus so we brought it to you!!!!,1.1764705882352942,0.07252251768198795,51,45,3,3
"Mom, why couldn't you just call and tell me you were coming with family.",1.1764705882352942,0.06075267994050848,51,43,7,1
Door-to-door sales has gotten out of control,1.1764705882352942,0.06689694944796853,51,44,5,2
I'm a three ring circus!,1.1764705882352942,0.06689694944796853,51,44,5,2
"Your Vote may count this November 8th,but then again...",1.1764705882352942,0.06689694944796853,51,44,5,2
"Finally, you found mom's purse!",1.1764705882352942,0.07252251768198795,51,45,3,3
Really...  a gender reveal for your third litter,1.1764705882352942,0.06075267994050848,51,43,7,1
We're not actually here.  This is your brain's interpretation of your pithy social media post going viral.,1.1764705882352942,0.07252251768198795,51,45,3,3
Your Amazon order is on its way!,1.1764705882352942,0.06689694944796853,51,44,5,2
"When they said they bring the news to you, I didn’t think being republican was this much.",1.1764705882352942,0.06075267994050848,51,43,7,1
Did you call the Geek Squad?,1.1754385964912282,0.06193823737472377,57,49,6,2
"The circus is coming to you.
The pandemic is over!",1.1754385964912282,0.0566549100524176,57,48,8,1
Not my circus. Not my cat.,1.1754385964912282,0.06193823737472377,57,49,6,2
I said you could invite a few friends for a sleepover.,1.1754385964912282,0.06193823737472377,57,49,6,2
They were out of chips.,1.1754385964912282,0.07134057808265805,57,51,2,4
I think you've got the wrong party,1.1746031746031746,0.057866499516996066,63,54,7,2
"Okay, as long as everyone wiped their feet.",1.173913043478261,0.07804586677006524,46,41,2,3
You’re back.,1.173913043478261,0.0715889219433534,46,40,4,2
Your Around the World pizza has arrived!,1.173913043478261,0.0715889219433534,46,40,4,2
Mom must be having a great hair day.,1.173913043478261,0.07804586677006524,46,41,2,3
You’ve just been offered a lifetime subscription to every lottery in the country.,1.173913043478261,0.0715889219433534,46,40,4,2
Circus hire for a Mr. Cat?,1.173913043478261,0.06448868249648397,46,39,6,1
"Im not just a clown, honey, I’m the entire circus!",1.173913043478261,0.0715889219433534,46,40,4,2
This is the live circus?!,1.173913043478261,0.07804586677006524,46,41,2,3
Are you ready for the midterms?,1.173913043478261,0.0715889219433534,46,40,4,2
8 weeks to the midterms!,1.173913043478261,0.06448868249648397,46,39,6,1
"Honey, your family is here early",1.173913043478261,0.0715889219433534,46,40,4,2
Trump is wearing an orange jump suit. Pass it on.,1.173913043478261,0.07804586677006524,46,41,2,3
Only 60 days 'til the midterms,1.173913043478261,0.06448868249648397,46,39,6,1
Looks like the circus is in town.,1.173913043478261,0.05650315562208089,46,38,8,0
It was just a neighborly visit.” Rep. Andrew Clyde (Ga.),1.173913043478261,0.06448868249648397,46,39,6,1
We're all of your imaginary friends. You didn't think we wouldn't find you?,1.173913043478261,0.06448868249648397,46,39,6,1
My DNA test showed I’m 97% circus person.,1.173913043478261,0.06448868249648397,46,39,6,1
"Yes, I  KNOW our anniversary is tomorrow!",1.173913043478261,0.05650315562208089,46,38,8,0
We're from your REIT contracted to serve your eviction notice.,1.173913043478261,0.0715889219433534,46,40,4,2
"Ugh, Is this the birthday
surprise I was promised?",1.173913043478261,0.06448868249648397,46,39,6,1
"Oh dear, and he brought friends.",1.173913043478261,0.0715889219433534,46,40,4,2
"I’m leaving you, Frank, and I’m taking Mr. Chester with me.",1.173913043478261,0.06448868249648397,46,39,6,1
Most run away to join the circus. I just ran home.,1.173913043478261,0.0715889219433534,46,40,4,2
The circus is here.,1.173913043478261,0.06448868249648397,46,39,6,1
"Boopsie, it's time to get back in the real world!""",1.173913043478261,0.06448868249648397,46,39,6,1
Can you believe it ? We all fit in the clowns car.,1.173913043478261,0.0715889219433534,46,40,4,2
We heard your Wi-Fi was out…,1.173913043478261,0.0715889219433534,46,40,4,2
"Oh, gosh, I forgot I offered to host this month's HOA meeting.",1.173913043478261,0.0715889219433534,46,40,4,2
Mom! The bridge club is early!,1.173913043478261,0.0715889219433534,46,40,4,2
Where’s the bathroom?,1.173913043478261,0.0715889219433534,46,40,4,2
This is not Desolation Row!,1.173913043478261,0.0715889219433534,46,40,4,2
I told you not to move to Mar-a-Lago!,1.173913043478261,0.0715889219433534,46,40,4,2
Life is a circus.  Crazy and cool.,1.173913043478261,0.06448868249648397,46,39,6,1
"Come on...join the Circus...
Trump will win anyway...
You may as well enjoy the lead-up!!",1.173913043478261,0.06448868249648397,46,39,6,1
I brought a few friends home from clown college.,1.173913043478261,0.06448868249648397,46,39,6,1
Why waste your Sunday unwinding when you can join a parade?,1.173913043478261,0.06448868249648397,46,39,6,1
I think I ordered the wrong service,1.173913043478261,0.06448868249648397,46,39,6,1
"Honey, the insurrectionists are here!",1.173913043478261,0.0715889219433534,46,40,4,2
I went ring shopping and found a great deal on a set of three!,1.173913043478261,0.06448868249648397,46,39,6,1
Congress is getting weirder by the day.,1.173913043478261,0.07804586677006524,46,41,2,3
"See, Darling? I do have great leadership ability.",1.173913043478261,0.0715889219433534,46,40,4,2
Your boss sent us in lieu of your 401k.,1.173913043478261,0.06448868249648397,46,39,6,1
We won!,1.173913043478261,0.07804586677006524,46,41,2,3
We’re doing a residency.,1.173913043478261,0.0715889219433534,46,40,4,2
"Well,you were right- running away with the circus was not such a good idea.",1.173913043478261,0.0715889219433534,46,40,4,2
You think that’s the new Louis Vuitton?,1.173913043478261,0.0715889219433534,46,40,4,2
The 101 was jammed!,1.173913043478261,0.06448868249648397,46,39,6,1
Now it’s my circus!,1.173913043478261,0.05650315562208089,46,38,8,0
The entertainment is free—you’re charged only if you want cleanup.,1.173913043478261,0.0715889219433534,46,40,4,2
"We saw your resume.  Yes, we can offer you an interesting, fun and challenging job.",1.173913043478261,0.06448868249648397,46,39,6,1
Your Door Dash order is here!,1.173913043478261,0.06448868249648397,46,39,6,1
Sometimes my friends can be such clowns,1.173913043478261,0.07804586677006524,46,41,2,3
We heard your quarantine is over.,1.173913043478261,0.0715889219433534,46,40,4,2
Clown school is out.,1.173913043478261,0.06448868249648397,46,39,6,1
Dude looks like a lady!!,1.173913043478261,0.0715889219433534,46,40,4,2
Congrats! You’ve won ten minutes of daily optimism.,1.173913043478261,0.05650315562208089,46,38,8,0
"It's me, Steven! Your ex-girlfriend who ran ff and joined the circus.",1.173913043478261,0.06448868249648397,46,39,6,1
I said...I do Not want to donate to your Political Party!,1.173913043478261,0.0715889219433534,46,40,4,2
The word is out; the party is here!,1.173913043478261,0.05650315562208089,46,38,8,0
Those are not my monkeys but this is my circus,1.173913043478261,0.06448868249648397,46,39,6,1
I think I forgot to disable comments on that last tweet,1.173913043478261,0.06448868249648397,46,39,6,1
Now the inside reflects the outside!,1.173913043478261,0.06448868249648397,46,39,6,1
"Send in the politicians; oops, I mean clowns.",1.173913043478261,0.07804586677006524,46,41,2,3
"Oh no, the food is not ready yet!",1.173913043478261,0.06448868249648397,46,39,6,1
"Perhaps declaring ""not my monkeys, not my circus"" had been too specific.",1.173913043478261,0.06448868249648397,46,39,6,1
"You blew the whistle, didn't you?",1.173913043478261,0.06448868249648397,46,39,6,1
What a bazaar experience!,1.173913043478261,0.05650315562208089,46,38,8,0
Make Room for the Elephant!!,1.173913043478261,0.06448868249648397,46,39,6,1
"Goodbye, Henry.  I'm running away to join the circus!",1.173913043478261,0.0715889219433534,46,40,4,2
We came up as soon as you gave us three rings.,1.173913043478261,0.0715889219433534,46,40,4,2
I warned you not to get a pool.',1.173913043478261,0.0715889219433534,46,40,4,2
"Not my circus, not my monkeys. Not my circus, not my monkeys. Not my circus, not my monkeys.",1.173913043478261,0.06448868249648397,46,39,6,1
Wonder food ordering apps will go to any limits for marketing.  I just asked for chicken salad that's all,1.173913043478261,0.0715889219433534,46,40,4,2
"What, no trapeze?",1.173913043478261,0.06448868249648397,46,39,6,1
Is that Bear carrying a handbag?! Weird.,1.173913043478261,0.05650315562208089,46,38,8,0
Interesting.,1.173913043478261,0.06448868249648397,46,39,6,1
That new detour on Main Street is a real problem.,1.1730769230769231,0.05966948841558946,52,44,7,1
How's this for a daily distraction?,1.1730769230769231,0.06568558183307435,52,45,5,2
Don’t get up for us.,1.1730769230769231,0.05966948841558946,52,44,7,1
This live entertainment comes with compliments of your TV repair shop.,1.1730769230769231,0.07119510849574463,52,46,3,3
Just one of the risks of living in Baraboo.,1.1730769230769231,0.06568558183307435,52,45,5,2
This election year stuff is getting a little out of hand.,1.1730769230769231,0.05966948841558946,52,44,7,1
It seems that you live on the sunny side of the street.,1.1730769230769231,0.06568558183307435,52,45,5,2
How about this for a notification Joey?!,1.1730769230769231,0.05966948841558946,52,44,7,1
"Well, you look different than your profile picture, too.",1.1730769230769231,0.05966948841558946,52,44,7,1
"I'm returning to the office tomorrow, too many distractions working from home.",1.1730769230769231,0.06568558183307435,52,45,5,2
"The trapeze artist will swing by later.""",1.1730769230769231,0.05966948841558946,52,44,7,1
Enthrall me with your acumen.,1.1730769230769231,0.06568558183307435,52,45,5,2
Where’s Waldo?,1.1730769230769231,0.06568558183307435,52,45,5,2
You could have swiped left a couple of times.,1.1730769230769231,0.06568558183307435,52,45,5,2
You said you wanted me to make it more interesting,1.1730769230769231,0.05966948841558946,52,44,7,1
Didn't realize dad's side of the family was in town.,1.1730769230769231,0.05297452250664297,52,43,9,0
"Those may not be your monkeys, but the rest of the circus definitely is.",1.1730769230769231,0.05966948841558946,52,44,7,1
"Well, at least we won't have to talk about the elephant in the room!",1.1730769230769231,0.05966948841558946,52,44,7,1
I guess he’s back from Obedience School,1.1730769230769231,0.07119510849574463,52,46,3,3
We’re looking for the elephant in the room.,1.1730769230769231,0.06568558183307435,52,45,5,2
Just when I thought I was going to run away.,1.1730769230769231,0.06568558183307435,52,45,5,2
But I just wanted Alexa to play the Britney Spears song. . .,1.1730769230769231,0.05966948841558946,52,44,7,1
"I said you should run away and join the circus, not bring the circus home",1.1724137931034482,0.05575164786673556,58,49,8,1
"Maude, looks like the circus is in town.",1.1724137931034482,0.06571276584476107,58,51,4,3
Ignore the umbrella.  It's not going to rain on this parade.,1.1724137931034482,0.06093608879319741,58,50,6,2
You're interested in renting the clown-sized room?,1.171875,0.05249096435850378,64,54,9,1
We're all working at home now!,1.1702127659574468,0.08228438837349525,47,43,0,4
I always thought life was a circus!,1.1702127659574468,0.0632100658866106,47,40,6,1
"And now, in political news...",1.1702127659574468,0.0632100658866106,47,40,6,1
"Honey, I told you my support group was meeting here tonight.",1.1702127659574468,0.0632100658866106,47,40,6,1
The kids are home from school.,1.1702127659574468,0.07014685887189226,47,41,4,2
Ask Barnum.,1.1702127659574468,0.08228438837349525,47,43,0,4
We've come to save you from your NFT addiction!,1.1702127659574468,0.0764568583568321,47,42,2,3
We need your vote in November.,1.1702127659574468,0.055411578656325414,47,39,8,0
You may have already won!,1.1702127659574468,0.0632100658866106,47,40,6,1
Oops. You selected the wrong size button on your instant celebration delivery app.,1.1702127659574468,0.0632100658866106,47,40,6,1
It's so quiet now that the kids are in school. I decided I was going to work from home too!,1.1702127659574468,0.0632100658866106,47,40,6,1
I didn't hear the bell.,1.1702127659574468,0.07014685887189226,47,41,4,2
What's the occasion?   Uh!,1.1702127659574468,0.055411578656325414,47,39,8,0
This isn’t 3958 Ferdinand Drive?,1.1702127659574468,0.0632100658866106,47,40,6,1
We heard you've been needing a booster.,1.1702127659574468,0.07014685887189226,47,41,4,2
Oh no Alexa. I said order a little Caesars!,1.1702127659574468,0.0632100658866106,47,40,6,1
Who invited Congress?,1.1702127659574468,0.0632100658866106,47,40,6,1
"If you can't come to the circus,  we'll come to you",1.1702127659574468,0.07014685887189226,47,41,4,2
Have you been calling 800 numbers again?,1.1702127659574468,0.0632100658866106,47,40,6,1
I hate Mondays,1.1702127659574468,0.0632100658866106,47,40,6,1
I’m doing Burning Man remotely this year.,1.1702127659574468,0.0632100658866106,47,40,6,1
Can everyone see my screen?,1.1702127659574468,0.07014685887189226,47,41,4,2
We heard that SOMEBODY here completed their millionth hour of Netflix!,1.1702127659574468,0.07014685887189226,47,41,4,2
"The cat can continue to work from home. You, on the other hand, have to parade yourself back into the office.",1.1702127659574468,0.0632100658866106,47,40,6,1
"When I said ""let your freak flag fly,"" I didn't mean to invite the entire circus.",1.1702127659574468,0.055411578656325414,47,39,8,0
"I couldn't beat 'em, so I joined 'em.",1.1702127659574468,0.055411578656325414,47,39,8,0
"Clown show? No, babe, I went to one of those lavish Urbit parties thrown by Curtis Yarvin. These are the post-left reactionaries who are going to revitalize American culture — not a clown show.",1.1702127659574468,0.07014685887189226,47,41,4,2
Guess what was half off at Macy's?,1.1702127659574468,0.07014685887189226,47,41,4,2
Are you saying this ISN’T the Smith residence?,1.1702127659574468,0.07014685887189226,47,41,4,2
It’s always a circus around here on Mondays!,1.1702127659574468,0.07014685887189226,47,41,4,2
"Whoa, are you seeing what I'm seeing? That bear is carrying a purse.",1.1702127659574468,0.0632100658866106,47,40,6,1
Any chance an elephant just came through here?,1.1702127659574468,0.07014685887189226,47,41,4,2
I’ve decided that the whole company is going to work with me from home.,1.1702127659574468,0.0632100658866106,47,40,6,1
A young Stephen Sondheim gets lyric inspiration.,1.1702127659574468,0.0632100658866106,47,40,6,1
"Hey, at least you can’t say I’m running away to the circus.”",1.1702127659574468,0.07014685887189226,47,41,4,2
Can any of them guess my weight?,1.1702127659574468,0.055411578656325414,47,39,8,0
"No... I ordered a ""Surface"" tablet.",1.1702127659574468,0.0632100658866106,47,40,6,1
Damn. Do we have to celebrate Hieronymus Bosch Day EVERY year?,1.1702127659574468,0.055411578656325414,47,39,8,0
"Is your last name, Ringmaster?",1.1702127659574468,0.07014685887189226,47,41,4,2
"Okay, I get it. I'll put my computer down!",1.1702127659574468,0.07014685887189226,47,41,4,2
The ad said pet friendly.,1.1702127659574468,0.055411578656325414,47,39,8,0
You rang?,1.1702127659574468,0.055411578656325414,47,39,8,0
Damien quickly learned exactly what Remote Clown School enrollment was all about.,1.1702127659574468,0.07014685887189226,47,41,4,2
"Oh, not a moveable beast again.",1.1702127659574468,0.0632100658866106,47,40,6,1
It’s a real circus outside with all the television cameras.,1.1702127659574468,0.0632100658866106,47,40,6,1
We need another cat!,1.1702127659574468,0.0632100658866106,47,40,6,1
The clowns are coming - we're pretty much a package deal.,1.1702127659574468,0.0632100658866106,47,40,6,1
We're here to please some of the people some of the time.,1.1702127659574468,0.0632100658866106,47,40,6,1
"Yes, my friends lack a certain subtlety",1.1702127659574468,0.07014685887189226,47,41,4,2
"If you're not busy, we could really use a lion tamer.",1.1702127659574468,0.055411578656325414,47,39,8,0
Didn't the human cannonball warn you we were coming?  I guess we shot her into the wrong apartment!,1.1702127659574468,0.0632100658866106,47,40,6,1
Actually I just wanted a cat sitter.,1.1702127659574468,0.0632100658866106,47,40,6,1
"Doo, Doo, Doo, Lookin' out my back door.",1.1702127659574468,0.0632100658866106,47,40,6,1
why isn't the bear dancing?,1.1702127659574468,0.07014685887189226,47,41,4,2
They didn’t have cotton candy!?!,1.1702127659574468,0.0632100658866106,47,40,6,1
I said you can invite as many friends as how old you are getting - but in human years!,1.1702127659574468,0.0764568583568321,47,42,2,3
Mom I thought you said a few friends were coming for dinner?,1.1702127659574468,0.0632100658866106,47,40,6,1
Oh? Tuesday already?,1.1702127659574468,0.055411578656325414,47,39,8,0
Phew! There’s not a single skeleton in my closet.,1.1702127659574468,0.07014685887189226,47,41,4,2
"Sorry….wrong house…..not my monkeys, not my circus”",1.1702127659574468,0.07014685887189226,47,41,4,2
"I'm sorry, but Mr McConnell lives next door.",1.1702127659574468,0.0632100658866106,47,40,6,1
We are a physical manifestation of your TikTok history.,1.169811320754717,0.0586238473980282,53,45,7,1
We heard that one of you wanted to join the circus.,1.169811320754717,0.05206789873629057,53,44,9,0
She just loves a bear market!,1.169811320754717,0.05206789873629057,53,44,9,0
"It’s a circus out there, so we decided to come back home.",1.169811320754717,0.0586238473980282,53,45,7,1
It's a vibe.,1.169811320754717,0.06451701239736683,53,46,5,2
isn’t this better than anything on cable?”,1.169811320754717,0.06451701239736683,53,46,5,2
Turns out that it *was* my circus!,1.169811320754717,0.06991519358205821,53,47,3,3
Your mother wished to express her amazement that you finally remembered to call her on her birthday.,1.169811320754717,0.05206789873629057,53,44,9,0
"Well, if you can't bring yourself to the circus, we thought, why not, you know, ...",1.169811320754717,0.06451701239736683,53,46,5,2
Looks like our lost luggage finally arrived.,1.169811320754717,0.06451701239736683,53,46,5,2
I thought my in-laws weren't supposed to be here til next week!,1.169811320754717,0.06451701239736683,53,46,5,2
I thought I ordered just the bread.,1.169811320754717,0.0586238473980282,53,45,7,1
"I've heard of  ""the circus is coming to a town near you"" but never a ""townhouse""!",1.169811320754717,0.0586238473980282,53,45,7,1
"quiet night in, cup of tea, get some work done, hit of acid, off to bed!!",1.169811320754717,0.06451701239736683,53,46,5,2
You've just been admitted to MIT!,1.169811320754717,0.06991519358205821,53,47,3,3
"If you agree to a survey after the Cat-in-the-hat’s clean-up car finishes here, say “yes.”",1.169811320754717,0.05206789873629057,53,44,9,0
@!@# did I doze off during another zoom? will have to do more quiet quitting next week to catch up on sleep.,1.169811320754717,0.06451701239736683,53,46,5,2
Happy Birthday Baby,1.1666666666666667,0.05436067275445348,48,40,8,0
Your cousin is on the bass drum.,1.1666666666666667,0.06876141641725286,48,42,4,2
You have to sing Send in The Clowns if you want ‘em.,1.1666666666666667,0.06198070316648413,48,41,6,1
"When you asked to invite over a few friends, I assumed they would be cats.",1.1666666666666667,0.06876141641725286,48,42,4,2
"Honey,my circus group was just quarantined, they’ll be here for the week.",1.1666666666666667,0.06198070316648413,48,41,6,1
The Day Compulsory Fun Became Mandatory,1.1666666666666667,0.06876141641725286,48,42,4,2
And you though you could avoid the circus by working from home!,1.1666666666666667,0.04969660420745535,78,67,9,2
It was either this or we'd be left with a ton of worthless Bitcoins.,1.1666666666666667,0.07493101634438096,48,43,2,3
I miss the old days of “A chicken in every pot.”,1.1666666666666667,0.06876141641725286,48,42,4,2
"Shoot, the AA meeting already?",1.1666666666666667,0.06876141641725286,48,42,4,2
Don’t be alarmed. We had to move indoors because of the heat. We’ll be outta here next week.,1.1666666666666667,0.06876141641725286,48,42,4,2
"Good evening, Mr. Barnum.",1.1666666666666667,0.06876141641725286,48,42,4,2
Wouldn't it be simpler just to watch the news?,1.1666666666666667,0.06198070316648413,48,41,6,1
whos circus is this,1.1666666666666667,0.06876141641725286,48,42,4,2
"Don't worry, the clowns couldn't make it.",1.1666666666666667,0.06876141641725286,48,42,4,2
"Damn, the family is early!",1.1666666666666667,0.04427439259594547,84,71,12,1
what have you been drinking?,1.1666666666666667,0.08062990780781609,48,44,0,4
You said you wanted more excitement in our sex life.,1.1666666666666667,0.06876141641725286,48,42,4,2
Looks like the midterms are in town.,1.1666666666666667,0.05436067275445348,48,40,8,0
It's the cats' wedding anniversary.,1.1666666666666667,0.07493101634438096,48,43,2,3
What? no elephant???,1.1666666666666667,0.05402796234942498,60,51,8,1
Free checking and circus included.,1.1666666666666667,0.06876141641725286,48,42,4,2
"Oh, the presidential campaign is starting",1.1666666666666667,0.06198070316648413,48,41,6,1
"After deciding what to stream, Mortimer realized that Live Action  meant something completely different.",1.1666666666666667,0.06198070316648413,48,41,6,1
Run! It’s the Republican candidates.,1.1666666666666667,0.06876141641725286,48,42,4,2
"Congratulations, kid!  That eBay auction wasn't a gag after all!",1.1666666666666667,0.06198070316648413,48,41,6,1
We were going to parade outside but it’s raining and the gymnasts need the restroom,1.1666666666666667,0.06198070316648413,48,41,6,1
This was my sixth life.,1.1666666666666667,0.06876141641725286,48,42,4,2
"Oh, look, the Republican convention has started.",1.1666666666666667,0.06876141641725286,48,42,4,2
"They weren't my monkeys, but the rest of the circus actually is mine, it turns out.",1.1666666666666667,0.06198070316648413,48,41,6,1
"Hi Hon! Guess what's come to town!""",1.1666666666666667,0.06876141641725286,48,42,4,2
"Yes, we held the Senate.",1.1666666666666667,0.06198070316648413,48,41,6,1
We have the Airbnb rental tonight.,1.1666666666666667,0.06198070316648413,48,41,6,1
"Now, promise you won’t get upset…",1.1666666666666667,0.05436067275445348,48,40,8,0
The circus always arrives without warning.,1.1666666666666667,0.06198070316648413,48,41,6,1
I guess those weren't normal mushrooms,1.1666666666666667,0.06198070316648413,48,41,6,1
your upstairs neighbor is on vacation so we’re filling in.,1.1666666666666667,0.0576138619860012,54,46,7,1
