caption,mean,precision,votes,not_funny,somewhat_funny,funny
"But where are the clowns
Send in the clowns
Don't bother, they're here",1.2535211267605635,0.06253629886486937,71,56,12,3
She’ll never believe this. Safer to go with the dog ate my homework.,1.2535211267605635,0.06867035495437111,71,58,8,5
"I said I wanted pizza, not pizzazz!",1.2535211267605635,0.05923153036006021,71,55,14,2
It can't get more virtual than this.,1.2533333333333334,0.057244011711941316,75,58,15,2
"If you were a dog, you'd be much more excited right now.",1.2533333333333334,0.0632265576921407,75,60,11,4
It’s time to get real.,1.25,0.0668153104781061,64,51,10,3
Did you happen to see a lion?,1.25,0.06063390625908324,68,53,13,2
"Sorry to be late, Mr. Ringling",1.25,0.07066410175300032,68,56,7,5
"Uh-oh, looks like someone wants my vote.",1.25,0.07386710503565985,64,53,6,5
We’re here from the new IRS…to help !,1.25,0.07042952122737638,64,52,8,4
I decided to switch parties!,1.25,0.07066410175300032,68,56,7,5
"Hey, computer guy, maybe you can help us get more band width.",1.25,0.0668153104781061,64,51,10,3
It’s a less threatening way to discuss our household division of labor.,1.25,0.06299407883487121,64,50,12,2
You said you wanted to liven things up,1.25,0.07042952122737638,64,52,8,4
We heard your cat needed some cheering up.,1.25,0.0668153104781061,64,51,10,3
A circus Airbnb in a one bedroom apartment?!  You can’t even deal with my litter box!!!,1.25,0.0668153104781061,64,51,10,3
Your ex-wife sent us to celebrate the divorce :-),1.25,0.0668153104781061,64,51,10,3
Did someone say superspreader event!,1.25,0.0674865446869524,68,55,9,4
"Richard, it's time we rediscovered joy!",1.25,0.07042952122737638,64,52,8,4
party planning gone wrong,1.25,0.07386710503565985,64,53,6,5
"Hi, I’m Mary, president of the HOA. Welcome to the Haciendas.",1.25,0.0668153104781061,64,51,10,3
You can drop the act. Barnum and Bailey already left.,1.25,0.0668153104781061,64,51,10,3
Do you mind if we crash? Our place is tented.,1.25,0.0668153104781061,64,51,10,3
Let us entertain you,1.25,0.05892556509887896,64,49,14,1
We heard you were used to juggling alot,1.25,0.06063390625908324,68,53,13,2
Now I've finally got your attention - can you please do the dishes?,1.25,0.07042952122737638,64,52,8,4
I guess you were right when you said doing Airbnb could become a circus,1.25,0.0678013761222356,72,59,8,5
"Wait, what?! This is 4 Pennsylvania STREET, not Avenue!",1.25,0.05892556509887896,64,49,14,1
We need a fully vaccinated Ringmaster and another trained cat,1.25,0.06415178992833838,68,54,11,3
"Oh good, the cat-sitters are here.",1.25,0.0674865446869524,68,55,9,4
We heard you had a clownfish.,1.25,0.06415178992833838,68,54,11,3
YOU won’t believe who I met shopping today!,1.25,0.07386710503565985,64,53,6,5
Bathroom stop.,1.25,0.07386710503565985,64,53,6,5
"Oh shoot! 
I ordered 3 rings with this.",1.25,0.07386710503565985,64,53,6,5
"I'll be working from home today, hope it's ok.",1.25,0.07386710503565985,64,53,6,5
I need to force quit Acrobat.,1.25,0.07066410175300032,68,56,7,5
And Jerry realized he accidentally signed up for AirBarnum'nBailey,1.25,0.07042952122737638,64,52,8,4
Must be election campaign season again!,1.25,0.07386710503565985,64,53,6,5
The bear is actually totally unaffiliated with us,1.25,0.06299407883487121,64,50,12,2
Stay inside. It's a circus out there.,1.25,0.0674865446869524,68,55,9,4
"I said, ‘my life is a circus’, not ‘I want a circus in my life’ !",1.25,0.0668153104781061,64,51,10,3
"Well, that’s not exactly what I had in mind for a fun stay at home date",1.25,0.0668153104781061,64,51,10,3
"I understand you just googled ""freak show.""",1.2465753424657535,0.06100634345154056,73,58,12,3
"Sorry, I only have 1 ring.",1.2463768115942029,0.06659991468908871,69,56,9,4
I'm working from home tonight.,1.2463768115942029,0.06331896380302154,69,55,11,3
Sometimes you wish the parade would just pass you by.,1.2463768115942029,0.06659991468908871,69,56,9,4
I don't go to Bingo anymore.,1.2461538461538462,0.06944411571256842,65,53,8,4
Oh look! It’s the new CNN!,1.2461538461538462,0.07282344703369803,65,54,6,5
"Well I did ask my little sister to drop by, but ...",1.2461538461538462,0.06589169884235313,65,52,10,3
My new home is closer to the parade route than I thought.,1.2461538461538462,0.06213651700539812,65,51,12,2
I hope my pizza is in there somewhere.,1.2461538461538462,0.06589169884235313,65,52,10,3
I didn’t realize I’d be such a tough act to follow.,1.2461538461538462,0.06213651700539812,65,51,12,2
I think we messed up our DoorDash order.,1.2461538461538462,0.07282344703369803,65,54,6,5
We decided to run away with YOU for a change!,1.2461538461538462,0.07282344703369803,65,54,6,5
We are an intervention to help cure you from being an introvert.,1.2461538461538462,0.06213651700539812,65,51,12,2
Sorry. Congress booked every 3rd ring right through '24.,1.2461538461538462,0.06589169884235313,65,52,10,3
You wanted company.,1.2461538461538462,0.06944411571256842,65,53,8,4
"To be honest, 'No Solicitors' is a little vague.",1.2461538461538462,0.06589169884235313,65,52,10,3
And you thought your coworkers are in’tents.,1.2461538461538462,0.06213651700539812,65,51,12,2
"Honey, come run away with me and join the circus. We could use another clown.",1.2461538461538462,0.06589169884235313,65,52,10,3
Do you want to run away with me?,1.2461538461538462,0.05813929406858067,65,50,14,1
Remember when I said “fuck around and find out?”,1.2461538461538462,0.06213651700539812,65,51,12,2
I'm leaving your cheating ass! Woo!,1.2461538461538462,0.06589169884235313,65,52,10,3
Don’t you just love it when I bring my work home?,1.2461538461538462,0.06589169884235313,65,52,10,3
How did you know it was my birthday?,1.2461538461538462,0.06589169884235313,65,52,10,3
Who says we need a reason?,1.2461538461538462,0.06589169884235313,65,52,10,3
Still bored?,1.2459016393442623,0.07630732264354612,61,51,5,5
We've been trying to reach you about your car's extended warranty.,1.2459016393442623,0.0726385531353327,61,50,7,4
Changing with the times.  We now make house calls.,1.2459016393442623,0.055592868714141534,61,46,15,0
You said you would stop bringing your work home with you.,1.2459016393442623,0.06877435069968206,61,49,9,3
You said we never entertain!,1.2459016393442623,0.06877435069968206,61,49,9,3
Your work-from-home parade is now over.,1.2459016393442623,0.07630732264354612,61,51,5,5
"You the one that ordered one circus, no clowns?",1.2459016393442623,0.06467969717562974,61,48,11,2
Couples therapy has finally paid off.,1.2459016393442623,0.06030767065058533,61,47,13,1
Hi!  Guess which lottery you just won!,1.2459016393442623,0.0726385531353327,61,50,7,4
My new outfit is a hit!,1.2459016393442623,0.06877435069968206,61,49,9,3
One night only!,1.2459016393442623,0.06467969717562974,61,48,11,2
Your insurance company feels that this will be just as effective as your current high-priced medication.,1.2459016393442623,0.06467969717562974,61,48,11,2
What kind of a bear carries a purse?,1.2459016393442623,0.0726385531353327,61,50,7,4
"Hi,we're your new next door neighbors.",1.2459016393442623,0.06877435069968206,61,49,9,3
See- I really did run off to join the circus,1.2459016393442623,0.06467969717562974,61,48,11,2
"Sorry to cut through, but we had to detour around the kitchen renovations in 12B.",1.2459016393442623,0.0726385531353327,61,50,7,4
I want to entertain more!,1.2428571428571429,0.06250702415424006,70,56,11,3
I hate the Midterms,1.2428571428571429,0.06250702415424006,70,56,11,3
Remote work turns your home into a circus.,1.2424242424242424,0.06848546733222884,66,54,8,4
"They're coming to take me away, Ha Ha...",1.2424242424242424,0.061301372768583655,66,52,12,2
"Tonite, I thought we would do something different!",1.2424242424242424,0.061301372768583655,66,52,12,2
I guess it IS my circus.  And my monkeys.”,1.2424242424242424,0.0649927593622037,66,53,10,3
The kids are asleep!,1.2424242424242424,0.061301372768583655,66,52,12,2
"Hi,we're the pizza, chocolate cake and herring you just ate!",1.2424242424242424,0.06848546733222884,66,54,8,4
"I guess for a cat,life is a cabaret.",1.2424242424242424,0.05737297131151901,66,51,14,1
"''When I said,'Come what may.' I had no idea!",1.2424242424242424,0.061301372768583655,66,52,12,2
"Oh, for Pete's sake. Midterms again already?",1.2424242424242424,0.061301372768583655,66,52,12,2
"Sorry Ed, they’re making us work from home again this week.",1.2424242424242424,0.0649927593622037,66,53,10,3
Huh. Didn’t expect my horoscope to be quite so literal.,1.2424242424242424,0.05737297131151901,66,51,14,1
You're not until next week's cartoon.,1.2419354838709677,0.06375141715523479,62,49,11,2
"Hello Dad, 23 & me says we're 100% family.",1.2419354838709677,0.06375141715523479,62,49,11,2
Idioms can come to life.,1.2419354838709677,0.06375141715523479,62,49,11,2
Did I tell you I was a baton twirler in high school?,1.2419354838709677,0.06777214707439459,62,50,9,3
"Sorry,wrong apartment.",1.2419354838709677,0.06777214707439459,62,50,9,3
The Big Top got flooded...we're moving in baby!,1.2419354838709677,0.06375141715523479,62,49,11,2
Maybe I shouldn't have advertised my home on Airbnb as being fun for all ages and pet friendly' after all...,1.2419354838709677,0.06375141715523479,62,49,11,2
Looks like Fellini is home.,1.2419354838709677,0.07517117385420148,62,52,5,5
"Well, you did say this time we could have the whole family circus for the holidays.",1.2419354838709677,0.07156734345248521,62,51,7,4
My new place is really starting to grow on me.,1.2419354838709677,0.05945941859392973,62,48,13,1
I then learned the true meaning of 'kit and caboodle'.,1.2419354838709677,0.07156734345248521,62,51,7,4
"This time, the circus is joining you!",1.2419354838709677,0.06777214707439459,62,50,9,3
Yep. I figured. The third doorbell ring gave it away.,1.2419354838709677,0.05945941859392973,62,48,13,1
"Who here ordered the ""virtual"" Zoom background?",1.2419354838709677,0.07156734345248521,62,51,7,4
We're from Circuses Without Tents.,1.2419354838709677,0.06777214707439459,62,50,9,3
"No, I ordered 'supplies'.",1.2419354838709677,0.05483248790412076,62,47,15,0
You can't run from your past Bozo,1.2419354838709677,0.06375141715523479,62,49,11,2
"If circuses are considered dead, than this is a zombie apocalypse!",1.2419354838709677,0.06375141715523479,62,49,11,2
"Dave was caught by surprise by Julia's mid-life crisis, but Boots the cat had seen it coming for some time.",1.2419354838709677,0.07156734345248521,62,51,7,4
"What, no bearded lady?",1.2419354838709677,0.05945941859392973,62,48,13,1
We heard you're a party animal.,1.2419354838709677,0.07156734345248521,62,51,7,4
It's finally time you met my emotional support circus!,1.2419354838709677,0.06777214707439459,62,50,9,3
Anything to afford rent in this city…,1.2419354838709677,0.06375141715523479,62,49,11,2
"Darling, did you mention the family is coming for diner?",1.2419354838709677,0.05945941859392973,62,48,13,1
Can our bear use your toilet? He has to take a huge dump.,1.2419354838709677,0.07517117385420148,62,52,5,5
When you said the circus was in town I thought you meant it metaphorically.,1.2413793103448276,0.05667935960252491,58,44,14,0
Can we borrow a tent? A big one?,1.2394366197183098,0.06489362517604236,71,58,9,4
That's the last time I'm going to order from Circus Pizza.,1.2388059701492538,0.06411754328743913,67,54,10,3
I didn't answer the door but Trump's campaign team just let themselves in.,1.2388059701492538,0.06411754328743913,67,54,10,3
"Good news--They finally said I could work from home!""",1.2388059701492538,0.06048781135768631,67,53,12,2
The elephant’s stuck in the elevator again.,1.2388059701492538,0.06411754328743913,67,54,10,3
And I was worried you had forgotten my birthday.,1.2380952380952381,0.06284876358057999,63,50,11,2
It’s the turn-off-your-computer-and-come-back-to-life parade!,1.2380952380952381,0.07052682201689092,63,52,7,4
It's fashion week again,1.2380952380952381,0.06679820247360646,63,51,9,3
"If you thought my relatives coming over was a circus, just wait.",1.2380952380952381,0.06679820247360646,63,51,9,3
Family reunion: they all tested positive for Covid and are all stuck here for the  next week.,1.2380952380952381,0.06284876358057999,63,50,11,2
"So, that app really works!",1.2380952380952381,0.07052682201689092,63,52,7,4
Maybe I’m not ready to return to pre-pandemic days.,1.2380952380952381,0.06679820247360646,63,51,9,3
No quiet quitting for you!,1.2380952380952381,0.060165786493056504,84,69,10,5
This is some pretty wild catnip.,1.2380952380952381,0.06679820247360646,63,51,9,3
When you said you did time in the ring I thought you were a boxer.,1.2380952380952381,0.06284876358057999,63,50,11,2
Didn't you hear the three rings?,1.2380952380952381,0.0586339007188704,63,49,13,1
We need you to come back to the circus -- remote-lion-taming just isn't working.,1.2380952380952381,0.07052682201689092,63,52,7,4
We have exciting news about your expiring car warranty!,1.2380952380952381,0.06679820247360646,63,51,9,3
Where’s the barrel of monkeys ?,1.2380952380952381,0.0586339007188704,63,49,13,1
"Out of the blue, a bus load of republican convention delegates decided to parade on over and through Jim's house.",1.2380952380952381,0.06679820247360646,63,51,9,3
Hope you mind I invited a few friends over.,1.2380952380952381,0.06679820247360646,63,51,9,3
"We're in town""",1.2380952380952381,0.06284876358057999,63,50,11,2
Bobby’s online order had gone horribly wrong.,1.2380952380952381,0.0586339007188704,63,49,13,1
I'm thinking we can set up the trapeze in the bedroom.,1.2380952380952381,0.06679820247360646,63,51,9,3
"These pop-up ads are really getting out of hand!""",1.2380952380952381,0.06679820247360646,63,51,9,3
"Cartoon Editor: Please consider revealing the caption that you’ve rejected for this, and all future, Caption Contest illustrations. I believe that most readers would find that revelation interesting.",1.2372881355932204,0.07387964311085886,59,49,6,4
'We wanted to run away to a stable home.',1.2372881355932204,0.06549270642063962,59,47,10,2
"What was that drug I took, anyway?",1.2372881355932204,0.06981223481771645,59,48,8,3
Time for mid-term elections!,1.2372881355932204,0.06549270642063962,59,47,10,2
Hope you don't mind. Our elephant is home with a cold.,1.2372881355932204,0.0777345174432296,59,50,4,5
"And you think it's the PURSE that's a bit over the top??!!""",1.2372881355932204,0.06981223481771645,59,48,8,3
If Tommy will not come to the circus then the circus must come to Tommy.,1.2372881355932204,0.06549270642063962,59,47,10,2
"Bob’s childhood dream of joining the circus was so close but, somehow he knew his cat never would allow it.",1.2372881355932204,0.06981223481771645,59,48,8,3
"Finally, my clowns, my circus!",1.2372881355932204,0.07387964311085886,59,49,6,4
Uber circus at your disposal!,1.2372881355932204,0.06981223481771645,59,48,8,3
Have you seen my ring?,1.2372881355932204,0.06981223481771645,59,48,8,3
"Your Ex sends her regards!""",1.2372881355932204,0.060867405549737345,59,46,12,1
"Kids, this is the last time I till you it's time for bed!",1.2372881355932204,0.06981223481771645,59,48,8,3
When you know election season has started.,1.2372881355932204,0.06549270642063962,59,47,10,2
Guess who graduated from circus school? Magna Cum Laugh!,1.2372881355932204,0.07387964311085886,59,49,6,4
Running for Chicago's  Next Mayor,1.2372881355932204,0.07387964311085886,59,49,6,4
"For the last time, it's not a sex thing.",1.2372881355932204,0.06981223481771645,59,48,8,3
"My question ""where are the clowns"" was meant rhetorically.",1.2372881355932204,0.060867405549737345,59,46,12,1
“Mind if we make a pit stop?’,1.2372881355932204,0.06981223481771645,59,48,8,3
I should really check my lease...,1.2372881355932204,0.06549270642063962,59,47,10,2
"John, who has issues with impulsive online shopping.",1.2372881355932204,0.07387964311085886,59,49,6,4
"I meant, ""party animals,"" not ""circus freaks""!",1.2372881355932204,0.06549270642063962,59,47,10,2
Best thing you’ve dragged in all week.,1.2372881355932204,0.06549270642063962,59,47,10,2
... and just when he thought it was safe to go barefoot around the house ...,1.2372881355932204,0.0777345174432296,59,50,4,5
Lucky for you.  We’re the new circus next door.,1.2372881355932204,0.060867405549737345,59,46,12,1
This new home theater system really makes the show come to you.,1.2372881355932204,0.060867405549737345,59,46,12,1
It was too hot at Burning Man.,1.2372881355932204,0.07387964311085886,59,49,6,4
Didn't you call the suicide hotline?,1.2372881355932204,0.07387964311085886,59,49,6,4
You clicked on one too many emojis.,1.2372881355932204,0.06981223481771645,59,48,8,3
Wait. This is NOT my circus.,1.2372881355932204,0.0777345174432296,59,50,4,5
"After 2 years in hibernation, they say that the show must go on.",1.2372881355932204,0.07387964311085886,59,49,6,4
".....and this is the living space. Needs some work,  but the low price leaves some room in your budget.",1.2372881355932204,0.05586042894941198,59,45,14,0
Does this mean I’m the clown?,1.2372881355932204,0.07387964311085886,59,49,6,4
If I'm imagining this…why is it in black & white?,1.2352941176470589,0.0632651480256502,68,55,10,3
"Actually,this IS your circus and these ARE your clowns",1.2352941176470589,0.05969503657703099,68,54,12,2
When Muhammad wouldn't go to the circus...,1.234375,0.061970725215460876,64,51,11,2
Someone order a cat video with all the extras?”,1.234375,0.06951571243822256,64,53,7,4
You’re never too old to reinvent yourself.” Isn’t that what you said,1.234375,0.06951571243822256,64,53,7,4
Hope you can pitch a tent.,1.234375,0.061970725215460876,64,51,11,2
Good news! I convinced the Circus to run away with me instead!,1.234375,0.06585136695439135,64,52,9,3
We talked about not bringing work home!,1.234375,0.06585136695439135,64,52,9,3
We hear you were looking for your charging horde.,1.234375,0.061970725215460876,64,51,11,2
Did you remember the milk?,1.234375,0.06585136695439135,64,52,9,3
Oops I opened up the news page again!,1.234375,0.06951571243822256,64,53,7,4
"My lows are really low, but my highs are incredible.",1.2333333333333334,0.0687526750036001,60,49,8,3
"When the pet sitter said she'd keep you entertained, I had no idea.",1.2333333333333334,0.0687526750036001,60,49,8,3
"January 6, the Musical.",1.2333333333333334,0.0687526750036001,60,49,8,3
They're just stopping by.,1.2333333333333334,0.06451324335931523,60,48,10,2
Looks like it time for the midterm elections.,1.2333333333333334,0.059974884887974575,60,47,12,1
*insert screaming effect*,1.2333333333333334,0.0687526750036001,60,49,8,3
We’ve run away to join you!,1.2333333333333334,0.0687526750036001,60,49,8,3
Holiday season is coming and I wanted to prepare for the in-laws,1.2333333333333334,0.07274546083133358,60,50,6,4
"Alexa, I said use recorder for America's Got Talent, not please order America's Got Talent.",1.2333333333333334,0.06451324335931523,60,48,10,2
The strangest part of my dream was the circus bear that carried hot sauce in her purse as an homage to Hillary Clinton.,1.2333333333333334,0.07653021509819188,60,51,4,5
"Welcome to working from home, Ringmaster.",1.2333333333333334,0.0687526750036001,60,49,8,3
Guess how I spent all your alimony payments.,1.2333333333333334,0.0687526750036001,60,49,8,3
Can you open the window to let in the trapeze artists?,1.2333333333333334,0.07274546083133358,60,50,6,4
Unemployment is at an all time high.,1.2333333333333334,0.06451324335931523,60,48,10,2
Looks like the circus ran away to join me!,1.2333333333333334,0.06451324335931523,60,48,10,2
"Same old, same old.",1.2333333333333334,0.0687526750036001,60,49,8,3
You've won a free trial of 'Circus'!,1.2333333333333334,0.055063736396228795,60,46,14,0
"Yeah? Well...I put up with your poker night every week so, suck it up.""",1.2333333333333334,0.0687526750036001,60,49,8,3
When a surprise party is planned by a cat!,1.2333333333333334,0.0687526750036001,60,49,8,3
Congratulations...you were sent a circus-gram!,1.2333333333333334,0.06451324335931523,60,48,10,2
I didn’t run away to the circus. The circus ran away to me.,1.2333333333333334,0.059974884887974575,60,47,12,1
You asked for more excitement? Presto!,1.2333333333333334,0.0687526750036001,60,49,8,3
You've reached a thousand COVID-free days!,1.2333333333333334,0.06451324335931523,60,48,10,2
"Kitty, I think I took to many.",1.2333333333333334,0.0687526750036001,60,49,8,3
I think I right clicked when I should have left clicked...,1.2333333333333334,0.059974884887974575,60,47,12,1
We’re here to say “Happy Day!”  And also to tell you that your wife is leaving you.,1.2333333333333334,0.059974884887974575,60,47,12,1
"You were amazing last night, I really think you should join us!",1.2333333333333334,0.07653021509819188,60,51,4,5
"It's getting to be a regular circus around here, it seems.",1.2333333333333334,0.059974884887974575,60,47,12,1
I’m leaving you and joining the circus. Just passing through.,1.2333333333333334,0.07274546083133358,60,50,6,4
Whoops! Our Parade GPS brought us to your home.,1.2333333333333334,0.06451324335931523,60,48,10,2
I guess they were my monkeys.,1.2333333333333334,0.06451324335931523,60,48,10,2
Sometimes it is my circus.,1.2333333333333334,0.0687526750036001,60,49,8,3
"I think, AI misheard, 'animate the circle' command",1.2333333333333334,0.0687526750036001,60,49,8,3
I thought you'd enjoy some analog entertainment,1.2321428571428572,0.06737697508644645,56,45,9,2
We just beat the Village People 21-7.Yeaaaa.,1.2321428571428572,0.08054631412952162,56,48,3,5
Alexa sent us..,1.2321428571428572,0.07203476536472007,56,46,7,3
I’m leaving you! I joined the circus!,1.2321428571428572,0.07203476536472007,56,46,7,3
I couldn't find anything on Netflix so I joined Disney Interactive.,1.2321428571428572,0.07640914912823546,56,47,5,4
I thought you told me only your uncle The Cat in the Hat was coming to visit.,1.2321428571428572,0.08054631412952162,56,48,3,5
"Hello, Josh. Remote learning is over. We're going to introduce you to a big, brick building known as a school.",1.2321428571428572,0.07203476536472007,56,46,7,3
"All I said was, ""Siri, show me Syracuse.""",1.2321428571428572,0.07203476536472007,56,46,7,3
Thanks for finally cleaning the litter box.,1.2321428571428572,0.07640914912823546,56,47,5,4
My last day of therapy. I’ve been declared circus mentis.,1.2321428571428572,0.07640914912823546,56,47,5,4
mom! your friends are here...,1.2321428571428572,0.07203476536472007,56,46,7,3
"Didn't you hear? The circus got cancelled,we're camping out here!",1.2321428571428572,0.06737697508644645,56,45,9,2
The landlord has added streaming entertainment.,1.2321428571428572,0.06737697508644645,56,45,9,2
Mom I swear I only invited 2 people!,1.2321428571428572,0.06737697508644645,56,45,9,2
"Ahh Jeez , who invited Biden's family and friends",1.2321428571428572,0.07640914912823546,56,47,5,4
"The good news is, I haven't run away to join the circus!""",1.2321428571428572,0.07640914912823546,56,47,5,4
We missed working from home.,1.2321428571428572,0.06737697508644645,56,45,9,2
I'm not sure that I want the television of tomorrow.,1.2321428571428572,0.06237231855918919,56,44,11,1
The Building Department sent us to thank you for cutting your grass.,1.2321428571428572,0.06237231855918919,56,44,11,1
Can you juggle?,1.2321428571428572,0.06237231855918919,56,44,11,1
Are you as horny as I am right now?,1.2321428571428572,0.07203476536472007,56,46,7,3
"'Don't look surprised Jamie, you're part of the circus too, well maybe not this one...'",1.2321428571428572,0.07640914912823546,56,47,5,4
And we’re off to Buckingham Palace!,1.2318840579710144,0.06243471453411535,69,56,10,3
"Guess, what I joined?",1.2307692307692308,0.06853280646617484,65,54,7,4
Mom said dad was coming home with work colleagues. Mom always said that where dad works is a real circus but I thought she meant that his office was just super busy. Whoa.,1.2307692307692308,0.0545104355767976,78,62,14,2
Thank god I cancelled Netflix.,1.2307692307692308,0.06493055006205434,65,53,9,3
"We're the PCH Prize Patrol, sir.  You're on-camera.  Please look excited.",1.2307692307692308,0.07195494974565271,65,55,5,5
OK if I work from home today?,1.2307692307692308,0.06853280646617484,65,54,7,4
All of Donald Trump's endorsed candidates have been seen rehearsing for his next rally.,1.2295081967213115,0.07164515863413823,61,51,6,4
They were out of crackers.,1.2295081967213115,0.05910739795842607,61,48,12,1
Where are the clowns?,1.2295081967213115,0.063562037261619,61,49,10,2
"Don't worry, we've all been boosted.",1.2295081967213115,0.063562037261619,61,49,10,2
Now what have you dragged in?,1.2295081967213115,0.07164515863413823,61,51,6,4
I'll be working at home now.  We've gone Zoom.,1.2295081967213115,0.063562037261619,61,49,10,2
We're here for the Democrats' Big Tent rally.,1.2295081967213115,0.06772429895007506,61,50,8,3
Even my cat is bored with my dream interpretations.,1.2295081967213115,0.063562037261619,61,49,10,2
You look surprised. I meowed that I was having friends over.,1.2295081967213115,0.07164515863413823,61,51,6,4
Cirque du Sofa- they're starting to get desperate.,1.2295081967213115,0.063562037261619,61,49,10,2
I guess you can buy anything on Amazon.,1.2295081967213115,0.07164515863413823,61,51,6,4
I never thought the circus would run away to ME.,1.2295081967213115,0.07536230386036859,61,52,4,5
These promposals are getting out of hand...,1.2295081967213115,0.07164515863413823,61,51,6,4
I'm sorry—were you on a call?,1.2295081967213115,0.05910739795842607,61,48,12,1
It's mid-terms!,1.2295081967213115,0.05910739795842607,61,48,12,1
Don't you just love virtual reality.,1.2295081967213115,0.07164515863413823,61,51,6,4
Join the circus! We're going à la mode!,1.2295081967213115,0.05428845554981331,61,47,14,0
