caption,mean,precision,votes,not_funny,somewhat_funny,funny
"Come on, Bob. We are going on the road again.",1.1136363636363635,0.04839833278309262,44,39,5,0
"Sweetie, you told me to jazz up my act...how do ya like it??!!",1.1136363636363635,0.058305068978728315,44,40,3,1
Aren't you guys supposed to have an elephant with you?,1.1136363636363635,0.058305068978728315,44,40,3,1
"In the Age of Working from Home, we're here to save you the trouble of running away to join us.",1.1136363636363635,0.04839833278309262,44,39,5,0
Thank you for adding your 100th item to 'Subscribe and Save' !!,1.1136363636363635,0.058305068978728315,44,40,3,1
You quit cable?,1.1136363636363635,0.04839833278309262,44,39,5,0
"Honey, guess what I joined.",1.1136363636363635,0.058305068978728315,44,40,3,1
"Hi, I'm Samantha from Match.com. I told you I was fun!",1.1136363636363635,0.04839833278309262,44,39,5,0
"I know it might seem like helicopter parenting honey, but now you never have to run off to join anything!",1.1136363636363635,0.04839833278309262,44,39,5,0
"Usually we come to town, but sometimes to a studio apartment.",1.1136363636363635,0.04839833278309262,44,39,5,0
Putin's here for the referendum! Hooray!,1.1136363636363635,0.06675749786387711,44,41,1,2
Sometimes work follows you home,1.1136363636363635,0.058305068978728315,44,40,3,1
"Welcome to social media.
Someone who thinks they’re funny will contact you shortly.",1.1136363636363635,0.058305068978728315,44,40,3,1
We are here to announce the latest streaming service!,1.1136363636363635,0.058305068978728315,44,40,3,1
These gatherings always turn into a circus.,1.1136363636363635,0.058305068978728315,44,40,3,1
"Well, that completes my bucket list!",1.1136363636363635,0.058305068978728315,44,40,3,1
YOU WON!!  Fifty thousand dollars every week for the rest of your wretched life.,1.1136363636363635,0.058305068978728315,44,40,3,1
"The cat was a bit expensive, but the pet store threw in everyone else as a bonus.",1.1136363636363635,0.04839833278309262,44,39,5,0
Good kitty!,1.1136363636363635,0.058305068978728315,44,40,3,1
The day I let my guard down. .,1.1136363636363635,0.058305068978728315,44,40,3,1
This wasn’t what I had in mind when I said we should welcome strays,1.1136363636363635,0.04839833278309262,44,39,5,0
"The carnival is thinking of going boring, and YOU look like just the kind of guy we’re looking for!",1.1136363636363635,0.058305068978728315,44,40,3,1
"Get ready to meet your precinct's Independent candidate for township assistant clerk, the one, the only...",1.1132075471698113,0.043938680706010445,53,47,6,0
Remember that childhood you never had?,1.1111111111111112,0.057050590894718936,45,41,3,1
‘“We had this compulsion to join you!”,1.1111111111111112,0.047377936967913425,45,40,5,0
Instacart really delivers!,1.1111111111111112,0.05312127152597306,36,32,4,0
"You misspelled your Cirrus order from the cloud again, Brandon.",1.1111111111111112,0.057050590894718936,45,41,3,1
These pandemic era government-funded programs to provide services for people who are self-quarantining may be getting a bit excessive.,1.1111111111111112,0.047377936967913425,45,40,5,0
I didn’t think my wishes carried that much weight…,1.1111111111111112,0.07743689471524107,36,34,0,2
We'll Play for food,1.1111111111111112,0.06640158940746632,36,33,2,1
It looks like the summer is over.,1.1111111111111112,0.05312127152597306,36,32,4,0
"We're here to give the nightly news, here are today's top stories.",1.1111111111111112,0.05312127152597306,36,32,4,0
I miss when it was just the monkey with the cymbals.,1.1111111111111112,0.05312127152597306,36,32,4,0
"Oh, no! 2 months of this til the election.",1.1111111111111112,0.06640158940746632,36,33,2,1
"Hair-raisingly clever



























































































""Hair-raisingly clever!  No go home and let the cat and me get back to what were doing.""",1.1111111111111112,0.057050590894718936,45,41,3,1
"From that moment forward,Tim was much more careful about what he Googled.",1.1111111111111112,0.06640158940746632,36,33,2,1
It's midterm election time!,1.1111111111111112,0.057050590894718936,45,41,3,1
One Target trip later,1.1111111111111112,0.06640158940746632,36,33,2,1
"Oh, you said come by “circa” 7?",1.1111111111111112,0.06640158940746632,36,33,2,1
I guess the mid-terms are here.,1.1111111111111112,0.05312127152597306,36,32,4,0
"Well, you just never know what will walk in the door if you don't lock it!",1.1111111111111112,0.05312127152597306,36,32,4,0
"Oh crap, the Legislature is in session.",1.1111111111111112,0.06640158940746632,36,33,2,1
Were you raised in a Barnum? Close the door behind you.,1.1111111111111112,0.057050590894718936,45,41,3,1
Tell your ringmaster that I revoked my employment application and nothing you do will change my mind.,1.1111111111111112,0.05312127152597306,36,32,4,0
No no no... I ordered a pair-aide.,1.1111111111111112,0.05312127152597306,36,32,4,0
They really weren’t kidding about same day shipping,1.1111111111111112,0.057050590894718936,45,41,3,1
Harry Hickenlooper!  This Is Your Life!,1.1111111111111112,0.047377936967913425,45,40,5,0
That's my brother with the balloon....,1.1111111111111112,0.05312127152597306,36,32,4,0
Does your Cat Have a Hat?,1.1111111111111112,0.047377936967913425,45,40,5,0
Introducing midterm election season!,1.1111111111111112,0.05312127152597306,36,32,4,0
"It's politics time ! """,1.1111111111111112,0.057050590894718936,45,41,3,1
"Now I'll tell dad of something no one can beat.
I'll say that I saw it on Mulberry Street.",1.1111111111111112,0.047377936967913425,45,40,5,0
"You clicked ""Lord of The Three Rings""",1.1111111111111112,0.06640158940746632,36,33,2,1
"So, tell me again about your dysfunctional family.",1.1111111111111112,0.05312127152597306,36,32,4,0
"Come big, come small. Come one and all! You are invited to Susan’s divorce!",1.1111111111111112,0.06640158940746632,36,33,2,1
We ran out of bread.,1.1111111111111112,0.05312127152597306,36,32,4,0
"When I told you I'd get your attention away from the damned laptop, I meant it!",1.1111111111111112,0.057050590894718936,45,41,3,1
It started to rain.,1.1111111111111112,0.05312127152597306,36,32,4,0
When the relatives show up a week early for Thanksgiving,1.1111111111111112,0.057050590894718936,45,41,3,1
What kind of a clown put a thoroughfare through my living room?,1.1111111111111112,0.057050590894718936,45,41,3,1
It’s a real circus out there!,1.1111111111111112,0.050619272401046675,54,49,4,1
Not the thank you gift he expected for his donation to the classical music station,1.1111111111111112,0.06640158940746632,36,33,2,1
I finally got approval to work from home!,1.1111111111111112,0.057050590894718936,45,41,3,1
mom was right i should’ve shut the door,1.1111111111111112,0.06530597929391763,45,42,1,2
I thought this job is telecommute,1.1111111111111112,0.043168260549211725,54,48,6,0
Never known a cat-lover who doesn’t need a little more excitement in their life!,1.1111111111111112,0.05312127152597306,36,32,4,0
Another political season afoot 🤡 🎪,1.1111111111111112,0.047377936967913425,45,40,5,0
"I've heard of elephant in the room, but this is ridiculous",1.1111111111111112,0.057050590894718936,45,41,3,1
Guess it’s time to vote again,1.1111111111111112,0.05312127152597306,36,32,4,0
What’s with an umbrella indoors?,1.1111111111111112,0.057050590894718936,45,41,3,1
My amazing and awesome new girlfriend said she’d bring some friends from work home for a soirée…”  ❤️🔥,1.1090909090909091,0.056094720714807346,55,51,2,2
What the -- ??,1.108695652173913,0.046399450995890185,46,41,5,0
"I, too, decided to work from home.",1.108695652173913,0.06391616542376795,46,43,1,2
You know the song.  You had your pie and now comes the parade passing by.,1.108695652173913,0.046399450995890185,46,41,5,0
TikTok is really getting better.,1.108695652173913,0.05584883729854402,46,42,3,1
Your ex-wife said it's your birthday.,1.108695652173913,0.046399450995890185,46,41,5,0
During the pandemic we learned it was cheaper to bring the circus to you.,1.108695652173913,0.05584883729854402,46,42,3,1
Stop clowning around!,1.108695652173913,0.046399450995890185,46,41,5,0
"At least, he dragged in something living this time",1.108695652173913,0.05584883729854402,46,42,3,1
"Our new Room Service chief is P.T.  Barnum!   
Your lunch is coming!",1.108695652173913,0.06391616542376795,46,43,1,2
"The APA recently announced that ""morbid introspection"" can now be effectively treated.",1.108695652173913,0.06391616542376795,46,43,1,2
The amount of diverse entertainment at the comfort of our own home!,1.108695652173913,0.046399450995890185,46,41,5,0
Does this surprise include a poo poo clean up crew.,1.108695652173913,0.05584883729854402,46,42,3,1
Working from home con: letting the office circus into your home,1.108695652173913,0.05584883729854402,46,42,3,1
"Don't worry, there are no clowns.",1.1081081081081081,0.05175281663547772,37,33,4,0
"You didn't believe I'd really do it, did you, Dad?",1.1081081081081081,0.06465180222706,37,34,2,1
"Let's just start with ""sit""",1.1081081081081081,0.06465180222706,37,34,2,1
West Hollywood is 3 miles in that direction.,1.1081081081081081,0.05175281663547772,37,33,4,0
I was bored until my life became a circus.,1.1081081081081081,0.06465180222706,37,34,2,1
You ordered the pizza with the works.,1.1081081081081081,0.05175281663547772,37,33,4,0
It's the Republican slate of candidates!,1.1081081081081081,0.07537477716523201,37,35,0,2
"I ran away, I joined, I'm came back!",1.1081081081081081,0.06465180222706,37,34,2,1
There’s a circus somewhere without a clown. Not today!,1.1081081081081081,0.06465180222706,37,34,2,1
Have you seen a cat in a pet costume?,1.1081081081081081,0.05175281663547772,37,33,4,0
"Harry finally got proof, his life really is a three-ring circus.",1.1081081081081081,0.05175281663547772,37,33,4,0
"Well, it looks like the neighborhood has finally gone to the dogs.....cats, bears, clowns, turtles, seals, snakes......",1.1081081081081081,0.06465180222706,37,34,2,1
These pop-up ads are getting out of hand.,1.1081081081081081,0.06465180222706,37,34,2,1
"When I mentioned that you were offering $500.00 prize to the winner of the talent show at the party, they were very excited. I just hope we have enough food for everybody.",1.1081081081081081,0.06465180222706,37,34,2,1
"No, you go ‘Huh?!’ on the downbeat.",1.1081081081081081,0.06465180222706,37,34,2,1
Is that a turtle with a party hat on?!?!,1.1081081081081081,0.05175281663547772,37,33,4,0
"Just when he thought he was out, they pulled him back in.",1.1081081081081081,0.07537477716523201,37,35,0,2
"Doctor, I am the Great Clown Pagliacci.",1.1081081081081081,0.05175281663547772,37,33,4,0
"Hey, this is great, but I think you got it mixed up: The arena is next door!",1.1081081081081081,0.06465180222706,37,34,2,1
Where are your parents? It's a school night!,1.1081081081081081,0.06465180222706,37,34,2,1
You said you'd like to meet the clowns that blocked your driveway.,1.1081081081081081,0.07537477716523201,37,35,0,2
We finally have proper funding! You're being audited.,1.1081081081081081,0.05175281663547772,37,33,4,0
Five day week resumes on Wall Street.,1.1081081081081081,0.06465180222706,37,34,2,1
We're here for the AirB(arnum)nB(ailey)?,1.1081081081081081,0.05175281663547772,37,33,4,0
"It's not so much the noise, but the... you know what, it is the noise.",1.1081081081081081,0.06465180222706,37,34,2,1
You're barking up the wrong tree.,1.1081081081081081,0.06465180222706,37,34,2,1
"No charge! Everyday is a circus, but we are here to stay.",1.1081081081081081,0.06465180222706,37,34,2,1
Not my circus... cuz where's my monkey?,1.1081081081081081,0.05175281663547772,37,33,4,0
You got the raise?,1.1081081081081081,0.05175281663547772,37,33,4,0
"It's your birthday, you can cry if you want to.",1.1081081081081081,0.05175281663547772,37,33,4,0
I didn’t know Congress is in session.,1.1081081081081081,0.06465180222706,37,34,2,1
"Seven years of medical school for this?""  thought Dr. Bear MD as he ambled into the room. Though she was gone, his mother's last words still echoed in his head, ""Where did I go wrong with you? Why didn't you study dentistry like your brother?",1.1081081081081081,0.05175281663547772,37,33,4,0
Those damn new neighbors have GOT to go!,1.1081081081081081,0.06465180222706,37,34,2,1
The end is near!,1.1081081081081081,0.06465180222706,37,34,2,1
"Hey, wanna be the new target for our knife thrower?",1.1081081081081081,0.05175281663547772,37,33,4,0
Did you enter the Publishers Clearing House contest,1.1081081081081081,0.05175281663547772,37,33,4,0
"Kevin, your circus tickets are, in fact, non-refundable!",1.1081081081081081,0.06465180222706,37,34,2,1
Surprise!  The circus ran away to join us!,1.1081081081081081,0.05175281663547772,37,33,4,0
We're making America grin again.,1.1081081081081081,0.06465180222706,37,34,2,1
"I didn't know ""Cirque de Soleil"" made house calls",1.1081081081081081,0.06465180222706,37,34,2,1
"Dad, this isn't what they mean by a ""watch party"".",1.1081081081081081,0.05175281663547772,37,33,4,0
This is my circus!  I left the monkeys with the last president.,1.1081081081081081,0.06465180222706,37,34,2,1
Fiesta invaders,1.1081081081081081,0.06465180222706,37,34,2,1
"Guys, book group is not til tomorrow!",1.1081081081081081,0.06465180222706,37,34,2,1
Hey Ho ! Warrant for your unrest !,1.1081081081081081,0.06465180222706,37,34,2,1
"Finally, some recognition for my clever tweets.",1.1081081081081081,0.06465180222706,37,34,2,1
"Uh oh, Fluffy, I don't think the big top I ordered online is a going to match those pants afterall.",1.1081081081081081,0.06465180222706,37,34,2,1
Autumn comes to New Hampshire.,1.1081081081081081,0.06465180222706,37,34,2,1
Did I microdose twice today?,1.1081081081081081,0.05175281663547772,37,33,4,0
I forgot how life could be such a circus.,1.1081081081081081,0.05175281663547772,37,33,4,0
Damn latch.,1.1081081081081081,0.06465180222706,37,34,2,1
"I just wanted to read about it, not bring it home.",1.1081081081081081,0.06465180222706,37,34,2,1
"I knew my life was a circus, but….",1.1081081081081081,0.06465180222706,37,34,2,1
Don’t worry! He’s non-venomous.,1.1081081081081081,0.05175281663547772,37,33,4,0
who opened the door?,1.1081081081081081,0.06465180222706,37,34,2,1
"You ""Liked"" your experience with your bank teller",1.1081081081081081,0.07537477716523201,37,35,0,2
"Man: ""Wha' the F---?""
“Lord Over All: “It’s MY birthday! You don't know WHEN it is or how old I am! Do I forget YOURS? Every year I offer to let you pet me, or gift a robin, mouse, even the neighbor’s yappy dog! It’s MY birthday & YOU’RE NOT INVITE",1.1081081081081081,0.05175281663547772,37,33,4,0
Who invited people from work?,1.1081081081081081,0.06465180222706,37,34,2,1
Introducing the latest streaming service. We bring the content right in your house.,1.1081081081081081,0.05175281663547772,37,33,4,0
The guy at the agency said this works. #guerillamarketing,1.1081081081081081,0.06465180222706,37,34,2,1
"Yes, I'm returning and they all decided to run away to a home.",1.1063829787234043,0.05469656058869374,47,43,3,1
"Just letting you know, we are doing a revival of  the  musical Barnum.",1.1063829787234043,0.05469656058869374,47,43,3,1
"Oh no, the midterms are coming!",1.1063829787234043,0.04546036031565445,47,42,5,0
I thought I was buying a painting!,1.1063829787234043,0.04546036031565445,47,42,5,0
"Oh, no. The kids found another cat.",1.1063829787234043,0.05469656058869374,47,43,3,1
I don't actually see the kitchen sink.,1.1063829787234043,0.05469656058869374,47,43,3,1
That had to be the hardest crossword EVER.,1.1063829787234043,0.04546036031565445,47,42,5,0
"This is not so much a caption as a comment !
I am the Director of New York's Village Halloween Parade and basically this is my living room!
I recognized it right away!",1.1063829787234043,0.05469656058869374,47,43,3,1
"To prepare for the next housing crisis, the condo complex is exploring ways to make eviction more fun. Does this feel fun to you, John?",1.1063829787234043,0.05469656058869374,47,43,3,1
"Don't worry honey, I didn't forget the bread!",1.1063829787234043,0.05469656058869374,47,43,3,1
Family dinner,1.1063829787234043,0.04546036031565445,47,42,5,0
It’s not your birthday? Oops!,1.105263157894737,0.05045276771256948,38,34,4,0
What a surprise without my iPhone!,1.105263157894737,0.05045276771256948,38,34,4,0
But we don't live in a town,1.105263157894737,0.0629917206983912,38,35,2,1
I knew I should've ordered more than one pizza...,1.105263157894737,0.05045276771256948,38,34,4,0
Since when was the door over there?,1.105263157894737,0.05045276771256948,38,34,4,0
I thought we agreed you wouldn't take your work home with you anymore.,1.105263157894737,0.0629917206983912,38,35,2,1
Do any of you know how to do Uber Eats?,1.105263157894737,0.041010195919683065,57,51,6,0
The US political system is here!,1.105263157894737,0.0629917206983912,38,35,2,1
Since you wouldn't run away and join us ...!!,1.105263157894737,0.05045276771256948,38,34,4,0
I guess it IS my problem and my circus!,1.105263157894737,0.05045276771256948,38,34,4,0
Let the party begin !,1.105263157894737,0.0629917206983912,38,35,2,1
Purrrrrrrr...,1.105263157894737,0.0629917206983912,38,35,2,1
The divorce is final ! The divorce is  final !”,1.105263157894737,0.05045276771256948,38,34,4,0
The midterm elections are an absolute circus!,1.105263157894737,0.05045276771256948,38,34,4,0
The experience of life is like having a front-row seat to the most spectacular spectacle in the universe.,1.105263157894737,0.05045276771256948,38,34,4,0
Do you mind if I brought over a few friends for movie night?,1.105263157894737,0.0629917206983912,38,35,2,1
"I thought they said my roommate would be a ""troop"".",1.105263157894737,0.0629917206983912,38,35,2,1
I'm optimistic for the Midterms!,1.105263157894737,0.0629917206983912,38,35,2,1
It must be an election year.,1.105263157894737,0.0629917206983912,38,35,2,1
"Honey, I'm home! Bear with me!",1.105263157894737,0.0629917206983912,38,35,2,1
"Covid is over.
Get with the program!",1.105263157894737,0.05045276771256948,38,34,4,0
I told you when you married me that I loved the circus.,1.105263157894737,0.05045276771256948,38,34,4,0
The Republican members of congress sure know how to cover up being un-American. They are all clowns and march to a different tune: 'Constituents Be Damned.',1.105263157894737,0.05045276771256948,38,34,4,0
And no one believed I was adopted.,1.105263157894737,0.0629917206983912,38,35,2,1
"Snowball, will you go to prom with Whiskers?",1.105263157894737,0.05045276771256948,38,34,4,0
"You couldn't come to the circus, Bobby, so we're bringing the circus to you!",1.105263157894737,0.05045276771256948,38,34,4,0
It must be campaign season.,1.105263157894737,0.0629917206983912,38,35,2,1
The co-op board is meeting HERE?,1.105263157894737,0.05045276771256948,38,34,4,0
"Oh, no! The birthday boy lives next door.",1.105263157894737,0.05045276771256948,38,34,4,0
When you say “circus” and Alexa is listening.,1.105263157894737,0.05045276771256948,38,34,4,0
Who says I'm a few clowns short of a circus?!,1.105263157894737,0.0629917206983912,38,35,2,1
Aha! I knew I saw the clown walk in here.,1.105263157894737,0.0629917206983912,38,35,2,1
Ive already told you -- your elephant is not in my room.,1.105263157894737,0.0629917206983912,38,35,2,1
"Look,the kitty is holding a balloon.",1.105263157894737,0.0629917206983912,38,35,2,1
"PAC's, it's cheaper by the dozen.",1.105263157894737,0.05045276771256948,38,34,4,0
Hmmm...How did they get a bear to carry a purse?,1.105263157894737,0.0629917206983912,38,35,2,1
"Yes,that CBN oil does contain THC!",1.105263157894737,0.0629917206983912,38,35,2,1
Fun will never walk in through your door.,1.105263157894737,0.05045276771256948,38,34,4,0
You really have to stop bringing your work home.,1.105263157894737,0.05045276771256948,38,34,4,0
"I've already told you, those weren't my monkeys.",1.105263157894737,0.0629917206983912,38,35,2,1
"What, happy days are here again? That's not what is in the news""",1.105263157894737,0.0629917206983912,38,35,2,1
"I know all these folk, but never imagined all their talent...my laptop needs tossing.",1.1041666666666667,0.053590773834580184,48,44,3,1
I decided to bring home other peoples work.,1.1041666666666667,0.053590773834580184,48,44,3,1
Either my animal crackers have come to life or I’m drunk.,1.1041666666666667,0.053590773834580184,48,44,3,1
"Sir Purrington, the fun will really start when they unload the tiny car full of politicians.",1.1041666666666667,0.044558346215878446,48,43,5,0
Looks like the circus is joining US.,1.1041666666666667,0.053590773834580184,48,44,3,1
"Be calm! Can’t you feel them coming? They’re all up their in their favorite cloud, waiting for the music to start so they can march in and we can get this ritual of Halloween underway. So, let’s go!  Chose your costumes!",1.1041666666666667,0.053590773834580184,48,44,3,1
"It’s raining out there, and we got the memo.",1.1041666666666667,0.044558346215878446,48,43,5,0
"Honey, I hope we are not annoying you during your business call!",1.1041666666666667,0.053590773834580184,48,44,3,1
"In the words of that great philosopher George Carlin,just because you got the monkey off your back doesn't mean the circus has left town",1.103448275862069,0.053264030739395375,58,54,2,2
"You left the door open again, didn't you?",1.1025641025641026,0.04921614717627653,39,35,4,0
It seems that A SPECIAL TREAT FOR YOUR FAVORITE  CAT is more than just a food order.,1.1025641025641026,0.06141463024552091,39,36,2,1
"I should have never put my name, P. T. Barnum, on the mail box.",1.1025641025641026,0.04921614717627653,39,35,4,0
"Unbeknownst to Bill, his cat invited the whole circus cast to their living room for an encore performance.",1.1025641025641026,0.06141463024552091,39,36,2,1
Do you feel like your life is becoming a circus,1.1025641025641026,0.04921614717627653,39,35,4,0
"Oh my, look what the cat dragged in.",1.1025641025641026,0.06141463024552091,39,36,2,1
"WOW, that was some hibernation.",1.1025641025641026,0.06141463024552091,39,36,2,1
"Welcome to Congress, freshman!",1.1025641025641026,0.04921614717627653,39,35,4,0
The yoga class was full but the circus had an opening!,1.1025641025641026,0.04921614717627653,39,35,4,0
If confetti came to life.,1.1025641025641026,0.04921614717627653,39,35,4,0
The newspaper said the circus was coming to Town.,1.1025641025641026,0.06141463024552091,39,36,2,1
Not another Trump rally.,1.1025641025641026,0.04921614717627653,39,35,4,0
It's my turn at work to host the Friday happy hour.,1.1025641025641026,0.06141463024552091,39,36,2,1
I googled “ Who is on Trump’s current  legal team?” I wasn’t expecting you to show up in person!,1.1025641025641026,0.06141463024552091,39,36,2,1
—-but I typed “See parade OF homes”.,1.1025641025641026,0.04921614717627653,39,35,4,0
"BNB. That's Barnum and Bailey, right?",1.1025641025641026,0.06141463024552091,39,36,2,1
Home entertainment,1.1025641025641026,0.06141463024552091,39,36,2,1
The Circus - without the Elephants - tries harder.,1.1025641025641026,0.06141463024552091,39,36,2,1
"""Who ordered Fluffy's Traveling Circus on their laptop?""",1.1025641025641026,0.04921614717627653,39,35,4,0
"It was a lot of effort,but I got the birken",1.1025641025641026,0.06141463024552091,39,36,2,1
Welcome to the Mad House,1.1025641025641026,0.04921614717627653,39,35,4,0
Don't you remember ordering the Circus Burger El Grande'.,1.1025641025641026,0.04921614717627653,39,35,4,0
The circus is running away to join me?,1.1025641025641026,0.04921614717627653,39,35,4,0
Presenting the psilocybin parade!,1.1025641025641026,0.06141463024552091,39,36,2,1
"This is a TENEMENT, not a 'tent-i-ment!'",1.1025641025641026,0.06141463024552091,39,36,2,1
"Just the clowns, guys. I said just send in the clowns !",1.1025641025641026,0.04921614717627653,39,35,4,0
mom always said if you fed one more would come,1.1025641025641026,0.04921614717627653,39,35,4,0
"Your last can of tuna DID smell funny! 
Sydney Davis   Allentown  PA",1.1025641025641026,0.04921614717627653,39,35,4,0
Your cable package comes with the greatest show on earth!,1.1025641025641026,0.04921614717627653,39,35,4,0
"All I said was, ""Was a thank you too much to ask!""",1.1025641025641026,0.04921614717627653,39,35,4,0
"Wait, I wanted the zoo party!",1.1025641025641026,0.06141463024552091,39,36,2,1
"Jimmy, what's all that ruckus?!",1.1025641025641026,0.06141463024552091,39,36,2,1
Another election year!,1.1025641025641026,0.06141463024552091,39,36,2,1
I think I'm a daddy.,1.1025641025641026,0.06141463024552091,39,36,2,1
"Ohhhh, I thought you said you were into The Crown.",1.1025641025641026,0.04921614717627653,39,35,4,0
"It's the circus, Morty *burp*.",1.1025641025641026,0.06141463024552091,39,36,2,1
Donald Trump Sucks,1.1025641025641026,0.04921614717627653,39,35,4,0
What next?,1.1025641025641026,0.06141463024552091,39,36,2,1
DoorDash has become such a circus to order,1.1025641025641026,0.06141463024552091,39,36,2,1
I joined the circus - bring the cat!,1.1025641025641026,0.06141463024552091,39,36,2,1
"Thank you,I really purrfur working from Home.",1.1025641025641026,0.04921614717627653,39,35,4,0
"You pressed ""Circus"" on your laptop and here we are!",1.1025641025641026,0.04921614717627653,39,35,4,0
"Actually, the elephant is right outside the room!",1.1025641025641026,0.06141463024552091,39,36,2,1
Another election year has finally arrived.,1.1025641025641026,0.04921614717627653,39,35,4,0
"Come on, let's get the show on the road.",1.1025641025641026,0.04921614717627653,39,35,4,0
"Yea,just the family !",1.1025641025641026,0.06141463024552091,39,36,2,1
Take your shenanigans outside please,1.1025641025641026,0.04921614717627653,39,35,4,0
