caption,mean,precision,votes,not_funny,somewhat_funny,funny
I’m blue and I’m worried it’s permanent.,1.1081081081081081,0.05175281663547772,37,33,4,0
I see grandma,1.1081081081081081,0.05175281663547772,37,33,4,0
It must have been something I ate.,1.1081081081081081,0.05175281663547772,37,33,4,0
"All right, all right.  It is my child.",1.1081081081081081,0.05175281663547772,37,33,4,0
"Alas poor Yorick. I knew him well, Horatio.",1.1081081081081081,0.06465180222706,37,34,2,1
why do you have my used toilet paper?,1.1081081081081081,0.06465180222706,37,34,2,1
"Doc, I told you I find Rorschach's work offensive and highly subjective...",1.1081081081081081,0.06465180222706,37,34,2,1
Why on earth would you show me a nude picture of my mother?,1.1081081081081081,0.06465180222706,37,34,2,1
black raspberry,1.1081081081081081,0.05175281663547772,37,33,4,0
"After that, I was demoted and they started using bics.",1.1081081081081081,0.05175281663547772,37,33,4,0
You know this is a blotch on your career!,1.1081081081081081,0.05175281663547772,37,33,4,0
I see my squirrel doc….everywhere i look!,1.1081081081081081,0.06465180222706,37,34,2,1
"Daddy! Er, Mommy?
No, it's definitely Daddy.",1.1081081081081081,0.06465180222706,37,34,2,1
He was so young.,1.1081081081081081,0.05175281663547772,37,33,4,0
My father hitting rock bottom.,1.1081081081081081,0.06465180222706,37,34,2,1
How did you get a picture of Uncle Fred?,1.1081081081081081,0.05175281663547772,37,33,4,0
I don’t understand why you’re showing me a picture of my mother.,1.1081081081081081,0.05175281663547772,37,33,4,0
"I can't do this anymore, everyone only sees a blob monster.",1.1081081081081081,0.05175281663547772,37,33,4,0
That Red Sharpie at the June Picnic?,1.1081081081081081,0.05175281663547772,37,33,4,0
That's my pal Kenny's. I'd recognise his work anywhere.,1.1081081081081081,0.05175281663547772,37,33,4,0
A hotel room with video on demand,1.1081081081081081,0.05175281663547772,37,33,4,0
You may think you’re well. Though clearly not inkwell well.,1.1081081081081081,0.06465180222706,37,34,2,1
..in abstract..?,1.1081081081081081,0.05175281663547772,37,33,4,0
"Yes, I’m Banksy , please keep it to yourself !",1.1081081081081081,0.06465180222706,37,34,2,1
"It’s the TRUTH, you coward.",1.1081081081081081,0.05175281663547772,37,33,4,0
Can’t we start with something easier like my fear of abandonment?,1.1081081081081081,0.05175281663547772,37,33,4,0
I see my life ebbing away.,1.1063829787234043,0.04546036031565445,47,42,5,0
I see my brother after he was in that terrible accident.,1.1063829787234043,0.05469656058869374,47,43,3,1
"Sorry, I didn't have a tissue.",1.1063829787234043,0.04546036031565445,47,42,5,0
Handkerchief.,1.1063829787234043,0.04546036031565445,47,42,5,0
My breakfast didn't agree with me.,1.1063829787234043,0.05469656058869374,47,43,3,1
A troubled adulthood,1.1063829787234043,0.06258420823527418,47,44,1,2
"No, I don’t recognize any of these people.",1.1063829787234043,0.05469656058869374,47,43,3,1
What does she have to do with anything?,1.1063829787234043,0.05469656058869374,47,43,3,1
Another recycled baby bottle.,1.1063829787234043,0.04546036031565445,47,42,5,0
I didn't realize how creative I was.,1.1063829787234043,0.06258420823527418,47,44,1,2
"Carpet stain. Which, let me just say, was not my fault!",1.1063829787234043,0.04546036031565445,47,42,5,0
Another ballpoint pen mess.,1.1063829787234043,0.04546036031565445,47,42,5,0
Rorschach’s the name,1.1063829787234043,0.05469656058869374,47,43,3,1
Kinda like a dream of mine,1.1063829787234043,0.06258420823527418,47,44,1,2
That's cousin Arthur.,1.1063829787234043,0.04546036031565445,47,42,5,0
"No matter what you think, I still need to take a leak.",1.1063829787234043,0.06258420823527418,47,44,1,2
I don't think I've got it in me to do another one of these!,1.1063829787234043,0.04546036031565445,47,42,5,0
I don't want to talk about the past.,1.1063829787234043,0.04546036031565445,47,42,5,0
"I see an iPhone, and obsolescence...",1.1063829787234043,0.05469656058869374,47,43,3,1
Your lab results demonstrate that you are clearly dehydrated.,1.1063829787234043,0.04546036031565445,47,42,5,0
Looks like the reason Sally replaced me with a glue stick!,1.1063829787234043,0.05469656058869374,47,43,3,1
Poor Uncle Morry,1.1063829787234043,0.04546036031565445,47,42,5,0
"Doc, it’s like I told you before.
Deep inside I’m blue. And if you look closer, you’ll see it’s the tracks of my tears.",1.1063829787234043,0.06258420823527418,47,44,1,2
I just feel blue.,1.1063829787234043,0.05469656058869374,47,43,3,1
Err...is that not where I was supposed to finish?,1.1063829787234043,0.04546036031565445,47,42,5,0
It means I’m done going with the flow.,1.1063829787234043,0.05469656058869374,47,43,3,1
Disgusting!,1.1063829787234043,0.04546036031565445,47,42,5,0
I stand behind the supreme courts roe v. wade decision.,1.1063829787234043,0.04546036031565445,47,42,5,0
I’m just really not in a place where I can talk about work today,1.1063829787234043,0.04546036031565445,47,42,5,0
Beethoven’s first movement?,1.1063829787234043,0.05469656058869374,47,43,3,1
What diet should I follow in order to avoid all the blotting?,1.1063829787234043,0.04546036031565445,47,42,5,0
"I'm not sorry, I told you I'm a mess inside",1.105263157894737,0.0629917206983912,38,35,2,1
Maybe I am crazy because that looks like the stool sample you requested.,1.105263157894737,0.05045276771256948,38,34,4,0
That dark cloud started when I became obsolete.,1.105263157894737,0.05045276771256948,38,34,4,0
It reminds me of my squandered potential.,1.105263157894737,0.048045838377646095,57,52,4,1
I see another sneeze.,1.105263157894737,0.0629917206983912,38,35,2,1
Junior!,1.105263157894737,0.05045276771256948,38,34,4,0
"Yes, I did it.  But it was non-voluntary.",1.105263157894737,0.0629917206983912,38,35,2,1
The horror...the horror,1.105263157894737,0.0629917206983912,38,35,2,1
"Do I seem unhappy or not? What does this inkblot suggest to you, doctor?",1.105263157894737,0.05045276771256948,38,34,4,0
"Of course, I know what it stands for, I made it.",1.105263157894737,0.0629917206983912,38,35,2,1
That used to be my brother.,1.105263157894737,0.05045276771256948,38,34,4,0
"Once more, I see the blood of the innocent. Can we please stop now?""",1.105263157894737,0.05045276771256948,38,34,4,0
My old man's last cough--he was a bit phlegmy in his later years,1.105263157894737,0.05045276771256948,38,34,4,0
I refuse to say anything before meeting an attorney!,1.105263157894737,0.05045276771256948,38,34,4,0
The criticism is non-stop.  It’s never the pen.,1.105263157894737,0.0629917206983912,38,35,2,1
It says you're in trouble.,1.105263157894737,0.05045276771256948,38,34,4,0
It looks like user error.,1.105263157894737,0.05045276771256948,38,34,4,0
I want you to find my mother's killer.,1.105263157894737,0.05045276771256948,38,34,4,0
Mother's shroud...,1.105263157894737,0.0734195613118858,38,36,0,2
Pro choice,1.105263157894737,0.05045276771256948,38,34,4,0
Mother again! Where did you get these pictures?,1.105263157894737,0.05045276771256948,38,34,4,0
That test has been nothing but a blot on our family history.,1.105263157894737,0.0629917206983912,38,35,2,1
"Well, in our family, it definitely has to be granny and The Accident.",1.105263157894737,0.0629917206983912,38,35,2,1
I'm sorry. You were out of toilet paper.,1.105263157894737,0.0629917206983912,38,35,2,1
"Doc, I have to be honest. These sessions are draining.""


                                            Joshua Ster",1.105263157894737,0.05045276771256948,38,34,4,0
That's my handkerchief.,1.105263157894737,0.048045838377646095,57,52,4,1
Rorschach? Wasn't he one of the Sweathogs?,1.105263157894737,0.0629917206983912,38,35,2,1
"Can’t look now, I’m drained.",1.105263157894737,0.0629917206983912,38,35,2,1
Where did you get a letter from my ex-wife Cindy?,1.105263157894737,0.05045276771256948,38,34,4,0
I'm sorry I spilled it. I was thinking about Elmer's glue when he betrayed me online.,1.105263157894737,0.05045276771256948,38,34,4,0
I just see my parents.,1.105263157894737,0.0629917206983912,38,35,2,1
I just can't control my bladder anymore,1.105263157894737,0.05045276771256948,38,34,4,0
Mon Blanc!,1.105263157894737,0.05045276771256948,38,34,4,0
"If you are implying that I did that, then I want my union rep.",1.105263157894737,0.0629917206983912,38,35,2,1
"Dr. Freud, why the violence?!""",1.105263157894737,0.0629917206983912,38,35,2,1
Butterfly? That’s my autobiography!,1.105263157894737,0.05045276771256948,38,34,4,0
"Yes, it IS one of my earlier works, but I still feel it explains me.",1.105263157894737,0.05045276771256948,38,34,4,0
"You're the editor,not me.  It's up to you to say what I meant with that ink blot.",1.105263157894737,0.05045276771256948,38,34,4,0
Is that the corpse of my mother?,1.105263157894737,0.05045276771256948,38,34,4,0
I always told my brother he needed a more permanent line of work.,1.105263157894737,0.05045276771256948,38,34,4,0
Premature inkulation is really effecting my quality of life,1.105263157894737,0.05045276771256948,38,34,4,0
I am not fixated on her.  You literally just keep holding up pictures of my mom.,1.105263157894737,0.05045276771256948,38,34,4,0
My work is always misinterpreted.,1.105263157894737,0.0629917206983912,38,35,2,1
"Not today death, Not today.""",1.105263157894737,0.0629917206983912,38,35,2,1
Please explain why you think these tests are rigged.,1.105263157894737,0.05045276771256948,38,34,4,0
"Look, doc, I don't really get this whole therapy thing. And I certainly don't understand what a photo of my dad's penis has to do with it",1.105263157894737,0.0629917206983912,38,35,2,1
"What is this, Dr. Rorschach? Some kind of test?",1.105263157894737,0.0629917206983912,38,35,2,1
"Same thing I always see. Ivory, Jerry, Charles, and Orville.",1.105263157894737,0.05045276771256948,38,34,4,0
That's a picture of my first born.,1.105263157894737,0.05045276771256948,38,34,4,0
"Sorry, I couldn't hold it",1.105263157894737,0.05045276771256948,38,34,4,0
"I’ve told the officers my alibi, and as for other suspects, well- inks don’t fink!",1.105263157894737,0.0629917206983912,38,35,2,1
"Oh, that's my Auntie India.",1.105263157894737,0.05045276771256948,38,34,4,0
"Are you saying I have ""mommy issues?""",1.1041666666666667,0.053590773834580184,48,44,3,1
I can't help it -- they all look like soiled diapers!,1.1041666666666667,0.06130657275434796,48,45,1,2
"That looks just like my autobiography, doctor!",1.1041666666666667,0.044558346215878446,48,43,5,0
It looks like my mother expressing happiness,1.1041666666666667,0.044558346215878446,48,43,5,0
It reminds me a lot of my mom…is that my mom?,1.1041666666666667,0.053590773834580184,48,44,3,1
"It's a dark, evil,,, no, it's a picture of my wife!",1.1041666666666667,0.053590773834580184,48,44,3,1
"It's not a conventional résumé, but I hope you can see potential.",1.1041666666666667,0.053590773834580184,48,44,3,1
"My mother's best work, indeed.",1.1025641025641026,0.06141463024552091,39,36,2,1
The forensics just came back. We have a problem.,1.1025641025641026,0.06141463024552091,39,36,2,1
All I see is a receding hairline.,1.1025641025641026,0.06141463024552091,39,36,2,1
I see my ex-wife.,1.1025641025641026,0.04921614717627653,39,35,4,0
"Don't act so surprised, you voted for this!",1.1025641025641026,0.04921614717627653,39,35,4,0
Sorry for that. It must have been something I ate.,1.1025641025641026,0.04921614717627653,39,35,4,0
Vulva.,1.1025641025641026,0.06141463024552091,39,36,2,1
Who's this sucker?,1.1025641025641026,0.06141463024552091,39,36,2,1
This has gone far enough Dr. Rorschach.,1.1025641025641026,0.06141463024552091,39,36,2,1
If you don't want me as a patient just say so!,1.1025641025641026,0.04921614717627653,39,35,4,0
"Mother ! Oh, no!",1.1025641025641026,0.06141463024552091,39,36,2,1
Look what they did to my boy.,1.1025641025641026,0.04921614717627653,39,35,4,0
"Also bedwetting. But doc, I'm not sure exposure therapy is helping.",1.1025641025641026,0.04921614717627653,39,35,4,0
I see guilt.,1.1025641025641026,0.06141463024552091,39,36,2,1
"Yes, that one looks like my mother too",1.1025641025641026,0.04921614717627653,39,35,4,0
"All I see is whining babies.  What’s wrong with me, Doc?",1.1025641025641026,0.06141463024552091,39,36,2,1
I couldn't help it; they made me do it.,1.1025641025641026,0.04921614717627653,39,35,4,0
That’s very inappropriate. Have you no sense of decency?,1.1025641025641026,0.04921614717627653,39,35,4,0
That's my cousin Mort - he was never very photogenic.,1.1025641025641026,0.04921614717627653,39,35,4,0
Are you asking me if I did that?,1.1025641025641026,0.06141463024552091,39,36,2,1
You murderer! What did you do to my brother?,1.1025641025641026,0.04921614717627653,39,35,4,0
Not even an inkling of emotion?,1.1025641025641026,0.06141463024552091,39,36,2,1
Evil Dr. Kool-Aid catches me.,1.1025641025641026,0.04921614717627653,39,35,4,0
"Good lord! Please, stop showing me crime scene photos!",1.1025641025641026,0.04921614717627653,39,35,4,0
Do you have any idea how much ink my people have spilled for you Dr R.?,1.1025641025641026,0.04921614717627653,39,35,4,0
Will this really help solve my self esteem issues?,1.1025641025641026,0.04921614717627653,39,35,4,0
I see a man under pressure.,1.1025641025641026,0.04921614717627653,39,35,4,0
"Oh don't give me any more of that Freudian nonsense, of course it reminds me of my mother",1.1025641025641026,0.04921614717627653,39,35,4,0
You don't say a word while I spill my guts.,1.1025641025641026,0.04921614717627653,39,35,4,0
Nobody’s gonna fall for this Hermann.,1.1025641025641026,0.04921614717627653,39,35,4,0
Is that a threat?,1.1025641025641026,0.06141463024552091,39,36,2,1
I believe I’ve hit the spot right there,1.1025641025641026,0.06141463024552091,39,36,2,1
Ship carrying formula.,1.1025641025641026,0.04921614717627653,39,35,4,0
"Doc, this is exactly why it's so hard for me to open up around others.",1.1025641025641026,0.04921614717627653,39,35,4,0
Yes I have made some mistakes in my past,1.1025641025641026,0.04921614717627653,39,35,4,0
Why must you always bring up my Oedipal complex?,1.1025641025641026,0.06141463024552091,39,36,2,1
"Ya, so? I sneezed ?",1.1025641025641026,0.04921614717627653,39,35,4,0
It’s just a means of expression.,1.1025641025641026,0.04921614717627653,39,35,4,0
"Well, it has three meanings.  Four, if you count 'nothing.'",1.1025641025641026,0.04921614717627653,39,35,4,0
It's no use. You can't shrink an ink.,1.1025641025641026,0.04921614717627653,39,35,4,0
I am tired of being babied.,1.1025641025641026,0.04921614717627653,39,35,4,0
how am i supposed to know?,1.1025641025641026,0.06141463024552091,39,36,2,1
Excuse me....Aren't you going to say gesundheit?,1.1025641025641026,0.06141463024552091,39,36,2,1
"Doc, what does it mean if I see a self-portrait?",1.1025641025641026,0.06141463024552091,39,36,2,1
You are going down Mr. Ink. We found your DNA at the crime scene.,1.1025641025641026,0.06141463024552091,39,36,2,1
I’m sad ‘cause that was Mom’s last inkblot.,1.1025641025641026,0.04921614717627653,39,35,4,0
And the artist still takes all the credit for the work!,1.1025641025641026,0.04921614717627653,39,35,4,0
This looks like one of my farts—silent but splashy.,1.1025641025641026,0.06141463024552091,39,36,2,1
I’m TIRED okay??,1.1025641025641026,0.06141463024552091,39,36,2,1
Sorry I got cocky!!!,1.1025641025641026,0.04921614717627653,39,35,4,0
"I’m not a Shrink, you are!",1.1025641025641026,0.06141463024552091,39,36,2,1
"Look, I had a sneeze coming, and the quarterly report on your desk was the closest thing to a tissue I could find. It won’t happen again.",1.1025641025641026,0.04921614717627653,39,35,4,0
"Alright Dr, I told you already. Rorschach is just frustrated",1.1025641025641026,0.04921614717627653,39,35,4,0
Roadkill,1.1020408163265305,0.04369126727437127,49,44,5,0
That was a blot on my career!,1.1020408163265305,0.04369126727437127,49,44,5,0
"These sessions go so long, I just couldn't hold it any longer.",1.1020408163265305,0.06008000589338677,49,46,1,2
well that's pretty dark... black even,1.1020408163265305,0.04369126727437127,49,44,5,0
"Wait,are you telling me,I’m spotting?",1.1020408163265305,0.04369126727437127,49,44,5,0
"That's Jimmy, my first born, pretending to be a bug.",1.1020408163265305,0.052528725209117416,49,45,3,1
You're a sick man.,1.1020408163265305,0.04369126727437127,49,44,5,0
Looks like pussy to me.,1.1020408163265305,0.06008000589338677,49,46,1,2
This is far too personal!,1.1020408163265305,0.04369126727437127,49,44,5,0
"Yes, that’s exactly what it looked like after she fell off the counter. It was horrific",1.1020408163265305,0.06008000589338677,49,46,1,2
2nd Day of period,1.1020408163265305,0.04369126727437127,49,44,5,0
The assignment was self-expression,1.1020408163265305,0.052528725209117416,49,45,3,1
Sorry?,1.1,0.05991446895152778,40,37,2,1
Yet another oil-spilt crab expiring upon the white sands of Pensacola. From my aquatic series.,1.1,0.0480384461415261,40,36,4,0
"But Doctor,  I feel responsible for my own issues.",1.1,0.0480384461415261,40,36,4,0
"Again, my mom.",1.1,0.05991446895152778,40,37,2,1
"I see my little brother.
After I beat him up!",1.1,0.0480384461415261,40,36,4,0
"That's NOT an ink blot, that's a butterfly!! Geez.",1.1,0.051507875363771216,50,46,3,1
It's obvious . I'm bleeding all over the page.,1.1,0.0480384461415261,40,36,4,0
A clumsy scribe.,1.1,0.04285714285714279,50,45,6,0
Nobody understands me Doc!,1.1,0.05991446895152778,40,37,2,1
Uncle Ted was very happy that day.,1.1,0.05991446895152778,40,37,2,1
I don't know how I folded that without any arms.,1.1,0.0480384461415261,40,36,4,0
Why do you psychiatrists always say everything traces back to my mother?,1.1,0.05991446895152778,40,37,2,1
"I tried to be a little more creative, but I feel all bottled up!",1.1,0.055708601453115514,30,27,3,0
"But,,, Doctor Rorschach,,, I only see that either your pen leaked or you didn't even use one.",1.1,0.0480384461415261,40,36,4,0
"Yes, doctor, I know I must confront my shame about leaks I was responsible for when I worked for the FBI.  This became a blot on my reputation.",1.1,0.05991446895152778,40,37,2,1
That's the last! You've drained me dry!,1.1,0.0480384461415261,40,36,4,0
That's my diaper.,1.1,0.05991446895152778,40,37,2,1
That's you if you don't get a ncouch.,1.1,0.05991446895152778,40,37,2,1
Is this some sort of reverse psychology?,1.1,0.05991446895152778,40,37,2,1
"Sadly, that's me, ejected from a baby burp.",1.1,0.05991446895152778,40,37,2,1
That’s a blot from my Splatter series.,1.1,0.0480384461415261,40,36,4,0
Every time I sneeze I have to do a free association.  It's draining me.,1.1,0.055708601453115514,30,27,3,0
Is this a joke! You know I am incontinent!!,1.1,0.05991446895152778,40,37,2,1
Look you sonofabitch.. it's a free country I'll blow my ink where I want!,1.1,0.06979824404521126,40,38,0,2
Diminishment. Loss of self. Feeling less- then.,1.1,0.05991446895152778,40,37,2,1
"OK, so there’s one blot on my record….",1.1,0.0480384461415261,40,36,4,0
I sharted.,1.1,0.04572084295183091,60,55,4,1
I miss Julie...,1.1,0.0480384461415261,40,36,4,0
I also DREAM I am an octopus . . .,1.1,0.0480384461415261,40,36,4,0
Impending emptiness.,1.1,0.055708601453115514,30,27,3,0
You want me to spill my guts?,1.1,0.0480384461415261,40,36,4,0
Yes it says; drop everything mom is coming,1.1,0.0480384461415261,40,36,4,0
Can I call a friend?,1.1,0.05991446895152778,40,37,2,1
"Yeah that's my work, you know sometimes an ink spot is just an ink spot.",1.1,0.058901508937395104,50,47,1,2
My mother insists I give her free artwork because I’m still living under her roof.,1.1,0.0480384461415261,40,36,4,0
I don't see an octopus. It looks like my tissue when I blow my nose.,1.1,0.055708601453115514,30,27,3,0
I’m not sure if I was happy or sad.,1.1,0.04285714285714279,50,45,5,0
I'm afraid I've started inking again.,1.1,0.055708601453115514,30,27,3,0
"Yeah, that was the only blot on my reputation.",1.1,0.05991446895152778,40,37,2,1
That is the last message I got from my Mother and then she dried up and went away.,1.1,0.0735003323160835,30,28,1,1
HOCK - TOOEY!!,1.1,0.05991446895152778,40,37,2,1
I see myself...I am ink blotting myself during 5th grade Art class.,1.1,0.0480384461415261,40,36,4,0
Self portrait of me during by blue period.,1.1,0.055708601453115514,30,27,3,0
Let me explain that gap in my resumé.,1.1,0.0735003323160835,30,28,1,1
All I see is blood,1.1,0.0480384461415261,40,36,4,0
I know it looks bad but I have an alibi.,1.1,0.051507875363771216,50,46,3,1
"Uh, how did you get my toilet paper?",1.1,0.0480384461415261,40,36,4,0
You look uncomfortable with children's art.,1.1,0.05991446895152778,40,37,2,1
"I don’t know what’s happened to me doctor, I used to be much more fun",1.1,0.05991446895152778,40,37,2,1
A miscarriage comes to mind.,1.1,0.05991446895152778,40,37,2,1
Wait a minute! How'd you get ahold of my family photos?!,1.1,0.05991446895152778,40,37,2,1
I'm aghast! Is that me?,1.1,0.0480384461415261,40,36,4,0
Far from my best. Like you could never dream...,1.1,0.05991446895152778,40,37,2,1
Oh great. I’d blotted her out of my memory.,1.1,0.0480384461415261,40,36,4,0
"Where did you find that photo
of my late father?",1.1,0.051507875363771216,50,46,3,1
"Yeah… I don’t know who did that, but that’s a nice butterfly.",1.1,0.0480384461415261,40,36,4,0
"Oh, the ""inkblot"" test: All the jokes I have to listen to...""",1.1,0.05991446895152778,40,37,2,1
"''It looks like blood.""",1.1,0.051507875363771216,50,46,3,1
Therein lies my issue with abstract “form.”  Some of my best work is produced of unambiguous SCRIPT,1.1,0.0480384461415261,40,36,4,0
"She looks familiar ... but, they all do.",1.1,0.0735003323160835,30,28,1,1
"I put my blood, sweat, and tears into it.",1.1,0.05991446895152778,40,37,2,1
You should see the signature on my driver's license.,1.1,0.0480384461415261,40,36,4,0
uncle roger,1.1,0.0480384461415261,40,36,4,0
What do you want from me? I don’t have socks,1.1,0.0480384461415261,40,36,4,0
"Wow this 23andMe test is really accurate, that’s definitely my great great great grandmother",1.1,0.0480384461415261,40,36,4,0
My father on the pavement.,1.1,0.0480384461415261,40,36,4,0
"My job is really draining, I’m starting to feel so empty inside",1.1,0.0480384461415261,40,36,4,0
You’re out of your element.,1.0980392156862746,0.05052587735970632,51,47,3,1
Again with this 'Oedipus complex' business...,1.0980392156862746,0.05776831318688714,51,48,1,2
I'm sorry.,1.0975609756097562,0.04691557088212523,41,37,4,0
I feel culturally appropriated...,1.0975609756097562,0.04691557088212523,41,37,4,0
What?! Are you kidding me?!,1.0975609756097562,0.04691557088212523,41,37,4,0
It’s sad to see AI imitations of your work.,1.0975609756097562,0.04691557088212523,41,37,4,0
"Yes, warrior. Stop milking the irony, Doc!",1.0975609756097562,0.04691557088212523,41,37,4,0
"Yes sir, that is my brother, did he die peacefully?",1.0975609756097562,0.04691557088212523,41,37,4,0
"Oh my God, Uncle Phil!",1.0975609756097562,0.04691557088212523,41,37,4,0
You killed Jimmy to make audiovisuals? You monster.,1.0975609756097562,0.04691557088212523,41,37,4,0
Rorschach caught red-handed is what I see.,1.0975609756097562,0.04691557088212523,41,37,4,0
Four-legged pen.,1.0975609756097562,0.05848575028430145,41,38,2,1
"Dude, gross.",1.0975609756097562,0.05848575028430145,41,38,2,1
M m mommy . . .,1.0975609756097562,0.05848575028430145,41,38,2,1
Another mess to clean up.,1.0975609756097562,0.04691557088212523,41,37,4,0
This is not an A+ paper?,1.0975609756097562,0.05848575028430145,41,38,2,1
"Great work.""  ""Thank you Mr. Rorschasch.",1.0975609756097562,0.05848575028430145,41,38,2,1
Pimple,1.0975609756097562,0.05848575028430145,41,38,2,1
That’s when I threw up when my brother was born.,1.0975609756097562,0.04691557088212523,41,37,4,0
23andMe found my 2nd cousin once removed?,1.0975609756097562,0.04691557088212523,41,37,4,0
Splish splash I was taking a bath.,1.0975609756097562,0.05848575028430145,41,38,2,1
"If you don't take me out, I do it on the paper...right?",1.0975609756097562,0.05848575028430145,41,38,2,1
My emotions are just spilling over!,1.0975609756097562,0.04691557088212523,41,37,4,0
"Listen, I have trauma from past ink blot tests…",1.0975609756097562,0.04691557088212523,41,37,4,0
Blotto?,1.0975609756097562,0.04691557088212523,41,37,4,0
"Drained""",1.0975609756097562,0.05848575028430145,41,38,2,1
Your asking my expert opinion?,1.0975609756097562,0.04691557088212523,41,37,4,0
It reminds me of Mom.,1.0975609756097562,0.05848575028430145,41,38,2,1
"Okay…Mary had a little lamb, it’s fleece was white as coal…and btw that’s Harold’s hue of black not mine.",1.0975609756097562,0.05848575028430145,41,38,2,1
A bar bathroom selfie.,1.0975609756097562,0.05848575028430145,41,38,2,1
"Me, off my meds.",1.0975609756097562,0.04691557088212523,41,37,4,0
Looks like a frog but that's my signature,1.0975609756097562,0.05848575028430145,41,38,2,1
The sportsfield of the boarding school I attended.,1.0975609756097562,0.05848575028430145,41,38,2,1
"I'm sorry, Doc, I but I think my well has run dry.",1.0975609756097562,0.04691557088212523,41,37,4,0
It haunts me every day,1.0975609756097562,0.04691557088212523,41,37,4,0
I'm looking at my self on the sidewalk from 100 stories up.,1.0975609756097562,0.04691557088212523,41,37,4,0
My parents having a temper tantrum,1.0975609756097562,0.05848575028430145,41,38,2,1
I'm a blurter...what can I say?,1.0975609756097562,0.04691557088212523,41,37,4,0
Am I hired. Dr. Freud?,1.0975609756097562,0.04691557088212523,41,37,4,0
"You're spot on, but I try to blot all of that out.",1.0975609756097562,0.04691557088212523,41,37,4,0
