caption,mean,precision,votes,not_funny,somewhat_funny,funny
"They all look like ""death"" to me.",1.0857142857142856,0.06313156292770741,35,33,1,1
"Mummy, again!",1.0857142857142856,0.04800960288096037,35,32,3,0
"I don't know.
It just makes me feel like I'm throwing my life away.",1.0857142857142856,0.06313156292770741,35,33,1,1
I must be a narcissist - all I see is myself.,1.0857142857142856,0.06313156292770741,35,33,1,1
My late sister's terrible accident.,1.0857142857142856,0.06313156292770741,35,33,1,1
It would be better in color.,1.0857142857142856,0.06313156292770741,35,33,1,1
It reminds me of the last time I spilled my secrets.,1.0857142857142856,0.04800960288096037,35,32,3,0
"You're right, my problem with premature ejaculation does look like I'm anally fixated.",1.0857142857142856,0.06313156292770741,35,33,1,1
You need a caption? What's a caption?,1.0857142857142856,0.06313156292770741,35,33,1,1
It’s.. too painful,1.0857142857142856,0.04800960288096037,35,32,3,0
I know I’m overcompensating…,1.0857142857142856,0.06313156292770741,35,33,1,1
You told me not to keep things bottled up.,1.0833333333333333,0.05763033956734376,24,22,2,0
Ink-ontinence.,1.0833333333333333,0.08333333333333336,24,23,0,1
"This is WAY to personal, Doc. Can we talk about my mother instead?",1.0833333333333333,0.05763033956734376,24,22,2,0
I see regrets and bad decisions...,1.0833333333333333,0.05763033956734376,24,22,2,0
"I’m the medium, not the message.",1.0833333333333333,0.05763033956734376,24,22,2,0
"Teeth, Teeth, they all look like Teeth! What's wrong with me?",1.0833333333333333,0.05763033956734376,24,22,2,0
"Oh, Mother, how could you?",1.0833333333333333,0.08333333333333336,24,23,0,1
Loose bladder.,1.0833333333333333,0.05763033956734376,24,22,2,0
That's what happens when I get too excited.,1.0833333333333333,0.05763033956734376,24,22,2,0
"It's my mother. No, wait, my father. No, definitely my mother. Ooh, a butterfly!",1.0833333333333333,0.05763033956734376,24,22,2,0
That's my brain on Drugs !,1.0833333333333333,0.05763033956734376,24,22,2,0
Self incrimination,1.0833333333333333,0.05763033956734376,24,22,2,0
Looks like a squeeze play.,1.0833333333333333,0.05763033956734376,24,22,2,0
"No, I feel like it was wider…",1.0833333333333333,0.08333333333333336,24,23,0,1
"Why, what do you think it is?",1.0833333333333333,0.05763033956734376,24,22,2,0
"That's acrylic, not ink.",1.0833333333333333,0.08333333333333336,24,23,0,1
That splash was caused by my using XLAX after dinner!,1.0833333333333333,0.06139903313441727,36,34,1,1
Remember those trigger warnings we talked about?,1.0833333333333333,0.05763033956734376,24,22,2,0
I can't imagine what everyone sees in me.,1.0833333333333333,0.05763033956734376,24,22,2,0
"I'm blue, and that makes me want to be black.",1.0833333333333333,0.05763033956734376,24,22,2,0
Too soon,1.0833333333333333,0.05763033956734376,24,22,2,0
I would like to see your parents tomorrow!,1.0833333333333333,0.05763033956734376,24,22,2,0
It doesn't look like anyone I know.,1.0833333333333333,0.05763033956734376,24,22,2,0
I'm trying my best - but all I see is myself.,1.0833333333333333,0.05763033956734376,24,22,2,0
"Ahh yes, I see the remnants of my dead brother.",1.0833333333333333,0.05763033956734376,24,22,2,0
Looks like a person threw up on the paper.,1.0833333333333333,0.05763033956734376,24,22,2,0
It looks like my mother. What's your point?,1.0833333333333333,0.08333333333333336,24,23,0,1
That's actually my tissue after I sneezed.,1.0833333333333333,0.08333333333333336,24,23,0,1
Why do you say that I have issues with my mom and you keep bringing up pictures of her?,1.0833333333333333,0.05763033956734376,24,22,2,0
The sucking can be difficult,1.0833333333333333,0.05763033956734376,24,22,2,0
"It's me, after my wife finds out about...",1.0833333333333333,0.04671765921511568,36,33,3,0
"Sometimes an inkblot is just an inkblot, Doc!",1.0833333333333333,0.05763033956734376,24,22,2,0
Adoption seemed like my only option at the time,1.0833333333333333,0.05763033956734376,24,22,2,0
"Hey Doc, haven't you got it backwards? I'm supposed to look at pictures of faces.",1.0833333333333333,0.05763033956734376,24,22,2,0
Cousin Dribble!,1.0833333333333333,0.04671765921511568,36,33,3,0
"Tragic accident, but expected, no doubt. He was usually tippy.",1.0833333333333333,0.05763033956734376,24,22,2,0
Looks just like my hat.,1.0833333333333333,0.05763033956734376,24,22,2,0
I see myself ... naked.,1.0833333333333333,0.05763033956734376,24,22,2,0
"I swear Doc, this never happens",1.0833333333333333,0.05763033956734376,24,22,2,0
Mom said I was a mistake,1.0833333333333333,0.05763033956734376,24,22,2,0
"Of course you'd bring up Dad's ""accident"" again!",1.0833333333333333,0.05763033956734376,24,22,2,0
"I know, I know, not my best work",1.0833333333333333,0.05763033956734376,24,22,2,0
"Honest, it wasn’t me.",1.0833333333333333,0.05763033956734376,24,22,2,0
I can't believe you killed my mother!,1.0833333333333333,0.05763033956734376,24,22,2,0
Blots are so over…tats are the future.,1.0833333333333333,0.05763033956734376,24,22,2,0
Ooh - that drains me...,1.0833333333333333,0.04671765921511568,36,33,3,0
I hope that’s not how others see me,1.0833333333333333,0.05763033956734376,24,22,2,0
"To me, Doc, it’s just another scrap book.",1.0833333333333333,0.08333333333333336,24,23,0,1
I see pen nibs.  I always see nibs.,1.0833333333333333,0.06139903313441727,36,34,1,1
Mom yelling at me for wetting the blotter.,1.0833333333333333,0.05763033956734376,24,22,2,0
"Easily my finest work, but the critics panned it as overly sentimental.",1.0833333333333333,0.05763033956734376,24,22,2,0
"Jane!  Oh, Jane.",1.0833333333333333,0.05763033956734376,24,22,2,0
Mommy killing Daddy...,1.0833333333333333,0.05763033956734376,24,22,2,0
I was obsessed with her before the internet.,1.0833333333333333,0.05763033956734376,24,22,2,0
That is the note my ex-girlfriend left me when she broke up with me,1.0833333333333333,0.05763033956734376,24,22,2,0
The First thing that comes to mind is Jimmy Durante.,1.0833333333333333,0.05763033956734376,24,22,2,0
My birth certificate?,1.0833333333333333,0.05763033956734376,24,22,2,0
If you show me one more corpse I'm getting a new therapist.,1.0833333333333333,0.08333333333333336,24,23,0,1
I asked you not to sign HR complaints.,1.0833333333333333,0.06139903313441727,36,34,1,1
Wait - that was a test? - I just sneezed into a tissue!,1.0833333333333333,0.05763033956734376,24,22,2,0
"If I say ""my mother"" you'll never let it go, will you?",1.0833333333333333,0.08333333333333336,24,23,0,1
"Yes, I blew my stack. I’m sorry.",1.0833333333333333,0.04671765921511568,36,33,3,0
That's my cousin Ernie,1.0833333333333333,0.04671765921511568,36,33,3,0
An ink splotch.,1.0833333333333333,0.05763033956734376,24,22,2,0
I see...failure,1.0833333333333333,0.05763033956734376,24,22,2,0
My teenage son.,1.0833333333333333,0.05763033956734376,24,22,2,0
It was a dark and stormy night...,1.0833333333333333,0.04671765921511568,36,33,3,0
Not even a D? Surely that's at least an inkling of the correct answer!,1.0833333333333333,0.05763033956734376,24,22,2,0
I’m not ready to talk about my wild youth.,1.0833333333333333,0.05763033956734376,24,22,2,0
"Alas poor Rorschach,I knew his well.",1.0833333333333333,0.05763033956734376,24,22,2,0
"""I see single use disposable plastic baby bottles.""",1.0833333333333333,0.05763033956734376,24,22,2,0
The investigation proved it was an accident.,1.0833333333333333,0.05763033956734376,24,22,2,0
I find this offensive.,1.0833333333333333,0.05763033956734376,24,22,2,0
I see a baby trying to suck the life out of me,1.0833333333333333,0.05763033956734376,24,22,2,0
"Listen Doc, all I see is my family.",1.0833333333333333,0.08333333333333336,24,23,0,1
So sorry.. I was just a baby.,1.0833333333333333,0.05763033956734376,24,22,2,0
"Are you accusing me of
plagiarism?""",1.0833333333333333,0.08333333333333336,24,23,0,1
Where’s the Whiteout when you need it?,1.0833333333333333,0.08333333333333336,24,23,0,1
"I spilled my guts out.  What more can I say, doc?",1.0833333333333333,0.05763033956734376,24,22,2,0
24th floor.,1.0833333333333333,0.05763033956734376,24,22,2,0
"Trust me, they’re all butterflies.",1.0833333333333333,0.05763033956734376,24,22,2,0
"Atchoo! Oh, sorry.",1.0833333333333333,0.05763033956734376,24,22,2,0
King Charles when I’m done with him,1.0833333333333333,0.05763033956734376,24,22,2,0
"I swear, I would never do such a thing with the photocopier.",1.0833333333333333,0.05763033956734376,24,22,2,0
It looks vaguely familiar.,1.0833333333333333,0.05763033956734376,24,22,2,0
Am I losing my mind?,1.0810810810810811,0.04549326548811748,37,34,3,0
"Sigh... once again, I see my soul draining slowly away.",1.0810810810810811,0.05975900523162883,37,35,1,1
I'd rather not say. You'll think I'm a narcissist.,1.0810810810810811,0.04549326548811748,37,34,3,0
It's my entire career...and it doesn't look good for the future.,1.0810810810810811,0.04549326548811748,37,34,3,0
"It's not a conventional résumé, but I hope you can see potential.",1.0810810810810811,0.05975900523162883,37,35,1,1
You got nothin'...I never seen 'im before in my life.,1.0810810810810811,0.05975900523162883,37,35,1,1
Looks like my cousin’s work!,1.0810810810810811,0.04549326548811748,37,34,3,0
Thanksgiving.,1.08,0.05537749241945378,25,23,2,0
"Again, my mom.",1.08,0.05537749241945378,25,23,2,0
"I see me, but the version of me that isn't afraid to be free and creative. Like I finally gave myself permission to leave this bottle prison behind and become the artist I always knew was inside.",1.08,0.05537749241945378,25,23,2,0
"It takes a lot out of me to do these tests """,1.08,0.05537749241945378,25,23,2,0
My carpet after I leaked.,1.08,0.05537749241945378,25,23,2,0
This is what I get after I open up to you?,1.08,0.05537749241945378,25,23,2,0
Yes...I am familiar with that particular blot.  It's my son!,1.08,0.05537749241945378,25,23,2,0
"Oh gosh, that reminds me. I need to call Mom!",1.08,0.05537749241945378,25,23,2,0
"I'm shaken, but not stirred.",1.08,0.05537749241945378,25,23,2,0
"All right, already!  I'll order the adult diapers.",1.08,0.05537749241945378,25,23,2,0
"But doctor, I already know I'm having an identity crisis.",1.08,0.05537749241945378,25,23,2,0
Guilt.  I feel real remorse.,1.08,0.05537749241945378,25,23,2,0
…More baby puke.,1.08,0.05537749241945378,25,23,2,0
"Christ, Lou, are we really going to dig through my trash and pretend to be scandalized?",1.08,0.05537749241945378,25,23,2,0
Why do you think they all remind you of your mother?,1.08,0.05537749241945378,25,23,2,0
Kinda insensitive to show me my dead cousin and ask me what I see.,1.08,0.05537749241945378,25,23,2,0
I see a sacrificial lamb.,1.08,0.05537749241945378,25,23,2,0
"I remember. I told Potsy to stay away from the edge of the desk. But he never listened.""",1.08,0.05537749241945378,25,23,2,0
"I know, doc, I know—use a condom...",1.08,0.05537749241945378,25,23,2,0
"Other than that, Mrs. Rorschach, what do you see.",1.08,0.05537749241945378,25,23,2,0
"Okay, okay.  It was me.  I did it.",1.08,0.05537749241945378,25,23,2,0
"My nephew, Burt...",1.08,0.05537749241945378,25,23,2,0
My gallbladder stones,1.08,0.05537749241945378,25,23,2,0
I see a sad ink-stained life.,1.08,0.07999999999999996,25,24,0,1
I'll verify that as  an original by Clement Schwartz. I can tell a leak from his Parker 51 anywhere.,1.08,0.05537749241945378,25,23,2,0
What did you expect me to do? I'm a pipette for crying out loud!,1.08,0.05537749241945378,25,23,2,0
It's the digital age. They're leaving me out to hang and dry.,1.08,0.05537749241945378,25,23,2,0
"No, pornography doesn’t really do it for me.",1.08,0.05537749241945378,25,23,2,0
It's a blank page to me.,1.08,0.07999999999999996,25,24,0,1
I’ll ‘tell you what I see in it’—it’s my Uncle Sal.,1.08,0.05537749241945378,25,23,2,0
Suicide!,1.08,0.05537749241945378,25,23,2,0
Roschach,1.08,0.05537749241945378,25,23,2,0
I came so fucking hard,1.08,0.07999999999999996,25,24,0,1
"I was never Mirandized, and I want an attorney.",1.08,0.05537749241945378,25,23,2,0
I can explain…,1.08,0.05537749241945378,25,23,2,0
"That one looks like my mother, too.",1.08,0.07999999999999996,25,24,0,1
"Sorry but I couldn't hold it any longer, Doc Rorshak.",1.08,0.07999999999999996,25,24,0,1
"All I ever wanted was his approval, but Dad always says I'd be nothing but a stain on our family's legacy.",1.08,0.05537749241945378,25,23,2,0
"Yes, I know her.",1.08,0.05537749241945378,25,23,2,0
"Whatever you're thinking, I had nothing to do with it.",1.08,0.05537749241945378,25,23,2,0
I told you I was depressed!,1.08,0.07999999999999996,25,24,0,1
You got me.,1.08,0.05537749241945378,25,23,2,0
I thought this would be a closed casket.,1.08,0.05537749241945378,25,23,2,0
My early attempts at Abstract Expressionism.,1.08,0.05537749241945378,25,23,2,0
I'm so ashamed! I just couldn't help it!,1.08,0.07999999999999996,25,24,0,1
Where did you get my underwear?,1.08,0.05537749241945378,25,23,2,0
"Me, in two hours.",1.08,0.05537749241945378,25,23,2,0
That’s my encounter with a centrefold.,1.08,0.05537749241945378,25,23,2,0
Prom night - 1976.,1.08,0.07999999999999996,25,24,0,1
"Yes, ink blots have always given me severe anxiety.",1.08,0.05537749241945378,25,23,2,0
"Sorry, Rorschach, that's the last sneeze I've got.",1.08,0.05537749241945378,25,23,2,0
Rorschawk is always putting the squeeze on me.,1.08,0.05537749241945378,25,23,2,0
Thanks for letting me spill my guts out.,1.08,0.05537749241945378,25,23,2,0
I see a boob.,1.08,0.07999999999999996,25,24,0,1
"What does it look like?
It looks like me...They all look like me...",1.08,0.05537749241945378,25,23,2,0
I don't want to see your expensive shit.,1.08,0.05537749241945378,25,23,2,0
I feel all used up and I haven't really become anything.,1.08,0.05537749241945378,25,23,2,0
Are you making fun of me?,1.08,0.05537749241945378,25,23,2,0
"What can I tell you, Larry David would be very disappointed in me",1.08,0.05537749241945378,25,23,2,0
Rohrschach test? Without me he'd never have made it!,1.08,0.07999999999999996,25,24,0,1
Inkblot... crown... King executes pen over inkblot.,1.08,0.05537749241945378,25,23,2,0
"Oh, doctor, this one makes me want to spill my guts. Skidamarink a dink a dink, skidamarink a doo, I love you!",1.08,0.05537749241945378,25,23,2,0
"Sorry, I've been sneezing all morning.",1.08,0.05537749241945378,25,23,2,0
"If you think you can coerce me into confessing by forcing me to look at the crime scene photos, you’re sorely mistaken.",1.08,0.05537749241945378,25,23,2,0
It’s definitely a sucking mouth.,1.08,0.07999999999999996,25,24,0,1
"It’s bad, Doc: all of them look like blood and guts!",1.08,0.07999999999999996,25,24,0,1
And you wonder why I have been feeling low lately?!?,1.08,0.05537749241945378,25,23,2,0
I just feel misunderstood.,1.08,0.07999999999999996,25,24,0,1
"Well, right off the top of my head...",1.08,0.07999999999999996,25,24,0,1
It just happens when get older…,1.08,0.05537749241945378,25,23,2,0
That looks like the times baby threw me up.,1.08,0.07999999999999996,25,24,0,1
She said it was sure to lead to a movie contract.,1.08,0.05537749241945378,25,23,2,0
Your blowing my mind!,1.08,0.05537749241945378,25,23,2,0
Did you try asking the printer?,1.08,0.05537749241945378,25,23,2,0
It looks like my uncle Louie who was hit by a truck.,1.08,0.05537749241945378,25,23,2,0
I give it one rotten tomato.,1.08,0.05537749241945378,25,23,2,0
It always disturbs me how well you can read my thoughts.,1.08,0.07999999999999996,25,24,0,1
"Yeah, I've got the blues. But I'm no good time Charlie!",1.08,0.05537749241945378,25,23,2,0
Sorry Dr. Rorschach. I didn't mean it. It was just a sneeze.,1.08,0.05537749241945378,25,23,2,0
I really suck at this.,1.08,0.07999999999999996,25,24,0,1
"Yeah, my bad.",1.08,0.05537749241945378,25,23,2,0
I can't. That's clearly from my mother.,1.08,0.05537749241945378,25,23,2,0
Must you bring up my incontinence issues?,1.08,0.07999999999999996,25,24,0,1
I see an accident waiting to happen.,1.08,0.05537749241945378,25,23,2,0
Seems like Dr. Rorschach is stuck in your head.  Let's cut back on your meds for awhile.,1.08,0.05537749241945378,25,23,2,0
Therein lies my issue with abstract “form.”  Some of my best work is produced of unambiguous SCRIPT,1.08,0.05537749241945378,25,23,2,0
That was during my artist phase.,1.08,0.05537749241945378,25,23,2,0
You tell me what I'm seeing.,1.08,0.05537749241945378,25,23,2,0
Tell me about your firstborn…,1.08,0.05537749241945378,25,23,2,0
That's my pal Kenny's. I'd recognise his work anywhere.,1.08,0.05537749241945378,25,23,2,0
No Hidden meaning there - I accidentally sneezed on that! Oops! I sharted again! Omg I see a killer quill pen!,1.08,0.05537749241945378,25,23,2,0
"my lifeblood on paper for your amusement, that is what i see",1.08,0.05537749241945378,25,23,2,0
It was something I ate.,1.08,0.05537749241945378,25,23,2,0
"''I'm sorry, but they just don't make adult diapers in my shape!''",1.08,0.05537749241945378,25,23,2,0
It was miscarriage.,1.08,0.05537749241945378,25,23,2,0
Not mine.,1.08,0.05537749241945378,25,23,2,0
"It’s always black and white with you, Doc.",1.08,0.05537749241945378,25,23,2,0
Do they make anything stronger than Fiber Tablets?,1.08,0.05537749241945378,25,23,2,0
I'm prescribing you less talk more action for today,1.08,0.05537749241945378,25,23,2,0
"Oh no, not my childhood!",1.08,0.07999999999999996,25,24,0,1
"Eh, oh, doc, that's some explicit stuff.",1.08,0.07999999999999996,25,24,0,1
There is too much projection of me on that,1.08,0.07999999999999996,25,24,0,1
There were no tissues in the waiting room.,1.08,0.05537749241945378,25,23,2,0
You may think you’re well. Though clearly not inkwell well.,1.08,0.05537749241945378,25,23,2,0
"Where you when the page was blank, doctor?",1.08,0.07999999999999996,25,24,0,1
"Call be a narcissist Doc, but…",1.08,0.05537749241945378,25,23,2,0
It’s the only picture I have of my mother.,1.08,0.05537749241945378,25,23,2,0
Nobody’s gonna fall for this Hermann.,1.0789473684210527,0.044331271812937195,38,35,3,0
Tell me how you feel after seeing this,1.0789473684210527,0.044331271812937195,38,35,3,0
I am sick and tired of cultural misappropriation against my kind by you psychologists.,1.0789473684210527,0.044331271812937195,38,35,3,0
That's a picture of me at 2 years old,1.0789473684210527,0.058204267603313695,38,36,1,1
"Sorry, man! I can't control it.",1.0789473684210527,0.044331271812937195,38,35,3,0
"I see a messy sketch pad, and a QUACK! Who overcharged me!",1.0789473684210527,0.044331271812937195,38,35,3,0
No one ever sees the real me,1.0789473684210527,0.044331271812937195,38,35,3,0
I don’t know what you mean? They said I needed drip in my next drop.,1.0789473684210527,0.044331271812937195,38,35,3,0
That was when I was in a very blue mood.,1.0769230769230769,0.05329387100211931,26,24,2,0
It's like looking into a mirror and seeing everything I've kept bottled up my entire life.,1.0769230769230769,0.05329387100211931,26,24,2,0
Where did yo get that picture of my mom?,1.0769230769230769,0.05329387100211931,26,24,2,0
I see my ex-wife.,1.0769230769230769,0.05329387100211931,26,24,2,0
That was a crazy night.,1.0769230769230769,0.05329387100211931,26,24,2,0
It’s a window.  A window into my soul.,1.0769230769230769,0.05329387100211931,26,24,2,0
Regression Therapy ?? That’s mine from 4th grade !!,1.0769230769230769,0.05329387100211931,26,24,2,0
Uncle Seymour!,1.0769230769230769,0.05329387100211931,26,24,2,0
Dont' you feel a utter fraud asking me here to analyse them for you?,1.0769230769230769,0.05329387100211931,26,24,2,0
Vulva.,1.0769230769230769,0.05329387100211931,26,24,2,0
No need to rub in the consequences of my stumbles.,1.0769230769230769,0.07692307692307693,26,25,0,1
Nobody understands me Doc!,1.0769230769230769,0.05329387100211931,26,24,2,0
I was feeling out of sorts that day,1.0769230769230769,0.05329387100211931,26,24,2,0
"My worst nightmare, Doc.",1.0769230769230769,0.05329387100211931,26,24,2,0
No I don't hate my mother. Why would you ask that?,1.0769230769230769,0.05329387100211931,26,24,2,0
"Mother again.  (Sigh) it always comes back to that, doesn't it?",1.0769230769230769,0.05329387100211931,26,24,2,0
Sometimes a blot it’s just a blot.,1.0769230769230769,0.05329387100211931,26,24,2,0
Why are you showing me my dead cousin?,1.0769230769230769,0.07692307692307693,26,25,0,1
I'm so sorry. I couldn't find any toilet paper.,1.0769230769230769,0.05329387100211931,26,24,2,0
So you’re saying that what I’ve been searching for has been inside of  me all along?,1.0769230769230769,0.05329387100211931,26,24,2,0
"How long have you held my youngest son in captivity like this, you fiend?",1.0769230769230769,0.05329387100211931,26,24,2,0
This is so like my mom's side of the squid family.,1.0769230769230769,0.05329387100211931,26,24,2,0
It’s not one of my better works,1.0769230769230769,0.05329387100211931,26,24,2,0
"You know, Doc, I'm getting pretty tired of talking about my mother.",1.0769230769230769,0.07692307692307693,26,25,0,1
Why do you keep saying I have an oral fixation?,1.0769230769230769,0.05329387100211931,26,24,2,0
"Oh,  the humanity!",1.0769230769230769,0.05329387100211931,26,24,2,0
My breakfast didn't agree with me.,1.0769230769230769,0.05329387100211931,26,24,2,0
"yeah,I ate some bad fish that day",1.0769230769230769,0.05329387100211931,26,24,2,0
A troubled adulthood,1.0769230769230769,0.07692307692307693,26,25,0,1
That one is my pride and joy.,1.0769230769230769,0.07692307692307693,26,25,0,1
"I don't care how long I get in the pen, I won't confess.",1.0769230769230769,0.05329387100211931,26,24,2,0
I had some bad tuna,1.0769230769230769,0.05329387100211931,26,24,2,0
Another pacifer,1.0769230769230769,0.05329387100211931,26,24,2,0
I don’t mean to sound egotistical…,1.0769230769230769,0.05329387100211931,26,24,2,0
"Sometimes, I just can't keep it all bottled up any longer.",1.0769230769230769,0.05329387100211931,26,24,2,0
It looks like user error.,1.0769230769230769,0.05329387100211931,26,24,2,0
"Sorry, I just blew my top.",1.0769230769230769,0.05329387100211931,26,24,2,0
It haunts me still.,1.0769230769230769,0.05329387100211931,26,24,2,0
"That's Jimmy, my first born, pretending to be a bug.",1.0769230769230769,0.056728338885246185,39,37,1,1
If you keep showing me pictures of penises I'm gonna keep getting erections,1.0769230769230769,0.05329387100211931,26,24,2,0
"Bad news, your ink blot test came back positive",1.0769230769230769,0.05329387100211931,26,24,2,0
Aren't you going to say gesundheit?,1.0769230769230769,0.07692307692307693,26,25,0,1
How depressing!!!!!!!,1.0769230769230769,0.07692307692307693,26,25,0,1
I’m not sure what my wife sees in these sessions.,1.0769230769230769,0.05329387100211931,26,24,2,0
That one night in college where I blew my top.,1.0769230769230769,0.05329387100211931,26,24,2,0
This isn't therapy.  It's cruelty!,1.0769230769230769,0.05329387100211931,26,24,2,0
"I appreciate what you're doing for the industry, but I'm actually investing in ballpoint pens.",1.0769230769230769,0.05329387100211931,26,24,2,0
"Looking for investors, I think it'll be big",1.0769230769230769,0.05329387100211931,26,24,2,0
My mother was a wonderful person but a little small over the place.,1.0769230769230769,0.05329387100211931,26,24,2,0
"Again, Aunt Agnes.",1.0769230769230769,0.05329387100211931,26,24,2,0
That looks like my Uncle George,1.0769230769230769,0.07692307692307693,26,25,0,1
I just couldn't help spilling my guts,1.0769230769230769,0.05329387100211931,26,24,2,0
I see a blot. How about you?,1.0769230769230769,0.05329387100211931,26,24,2,0
That's not my handwriting!,1.0769230769230769,0.05329387100211931,26,24,2,0
I never realized he was so unhappy - so depressed - enough to commit suicide - a wasted life.  It all makes me so sad.,1.0769230769230769,0.07692307692307693,26,25,0,1
I dunno but its kinda graphic doc,1.0769230769230769,0.05329387100211931,26,24,2,0
Are you sure my copyright expired?,1.0769230769230769,0.05329387100211931,26,24,2,0
We might make more progress if we stop analyzing my stool samples.,1.0769230769230769,0.07692307692307693,26,25,0,1
And that's from my head cold collection,1.0769230769230769,0.07692307692307693,26,25,0,1
"Not one of those ""bless you"" people, I see.",1.0769230769230769,0.05329387100211931,26,24,2,0
That’s my late uncle George! He was Parker’s top pen tester till someone forgot to replace the cap and he dried up.,1.0769230769230769,0.05329387100211931,26,24,2,0
How did you find my password?,1.0769230769230769,0.05329387100211931,26,24,2,0
What were you really thinking?,1.0769230769230769,0.05329387100211931,26,24,2,0
It must have been something I ate.,1.0769230769230769,0.05329387100211931,26,24,2,0
"My cousin, Paul, committed suicide and left this note.",1.0769230769230769,0.05329387100211931,26,24,2,0
"You’re right, of course. My mother said that  to everyday when I was a child.",1.0769230769230769,0.05329387100211931,26,24,2,0
"This is gruesome Doc, I can’t ink about this!",1.0769230769230769,0.05329387100211931,26,24,2,0
It was an accident. Those old quills always leave splatter,1.0769230769230769,0.05329387100211931,26,24,2,0
"The stupid pen blamed me, but we all knew he leaks. Why does the ink well ALWAYS get the blame. One day into a new Monarchy and this had to happen!! Ask Camilla she saw the whole thing.",1.0769230769230769,0.07692307692307693,26,25,0,1
I see...that time I was dropped from an office desk!,1.0769230769230769,0.05329387100211931,26,24,2,0
People make fun of me. They don't take me seriously.,1.0769230769230769,0.05329387100211931,26,24,2,0
This is such a shock Mr. Rohr. But it does resemble my aunt Blotty.,1.0769230769230769,0.05329387100211931,26,24,2,0
"I'm sorry, Doc, I but I think my well has run dry.",1.0769230769230769,0.05329387100211931,26,24,2,0
