caption,mean,precision,votes,not_funny,somewhat_funny,funny
I see ... a mishap.,1.2162162162162162,0.087808958061342,37,31,4,2
A trigger warning would have been appreciated.,1.2162162162162162,0.06861056852129646,37,29,8,0
I was young and foolish then.,1.2162162162162162,0.06861056852129646,37,29,8,0
Hmm ... maybe a little like my cousin Zeke.,1.2162162162162162,0.07879664722763918,37,30,6,1
Have you no shame?,1.2162162162162162,0.07879664722763918,37,30,6,1
It must have been a Freudian slip!,1.2162162162162162,0.087808958061342,37,31,4,2
A snake eating its own tail.,1.2162162162162162,0.07879664722763918,37,30,6,1
I admit there have been some blots on my record.,1.2162162162162162,0.087808958061342,37,31,4,2
"I did it, and I'd do it again.",1.2162162162162162,0.07879664722763918,37,30,6,1
My mother. Naked.,1.2162162162162162,0.07879664722763918,37,30,6,1
"After we’re done, may I take my family pictures home?",1.2162162162162162,0.07879664722763918,37,30,6,1
I just can't stop crying over spilled ink.,1.2162162162162162,0.07879664722763918,37,30,6,1
"Cousin Larry, after the fall.",1.2162162162162162,0.09597871960658791,37,32,2,3
"Sorry, I'm spotting",1.2162162162162162,0.07879664722763918,37,30,6,1
I ink it has something to do with my father.,1.2162162162162162,0.06861056852129646,37,29,8,0
Looks like a crime scene to me.,1.2162162162162162,0.07879664722763918,37,30,6,1
A blot of trouble.,1.2162162162162162,0.09597871960658791,37,32,2,3
"It's not my best work. It's from my ""blue period""",1.2162162162162162,0.07879664722763918,37,30,6,1
I was trying to think about baseball.,1.2162162162162162,0.087808958061342,37,31,4,2
"You know I gotta say, that seems like my last night's breakdown. Or you're just messing with my ocd-",1.2162162162162162,0.07879664722763918,37,30,6,1
"Sorry Doc, I got a cold",1.2162162162162162,0.07879664722763918,37,30,6,1
"I don’t think you would like it if I showed you your insides, would you Doc?",1.2162162162162162,0.087808958061342,37,31,4,2
No matter what I say…I know I nailed it.,1.2162162162162162,0.09597871960658791,37,32,2,3
"Basically, it’s a character piece",1.2162162162162162,0.09597871960658791,37,32,2,3
Oh shit!,1.2162162162162162,0.07879664722763918,37,30,6,1
Richard.,1.2162162162162162,0.087808958061342,37,31,4,2
I am horrified to see that I had that inside me.,1.2156862745098038,0.07573807025814891,51,43,5,3
Sometimes an ink splash is just an ink splash.,1.2142857142857142,0.0871254337982578,42,36,3,3
"All my past mistakes, back to haunt me.",1.2142857142857142,0.0871254337982578,42,36,3,3
Let me tell you about my mother.,1.2142857142857142,0.07258071949818176,42,34,7,1
Mom. They're all Mom.,1.2142857142857142,0.08018354587260514,42,35,5,2
I see my demise-what do you think it means?,1.2142857142857142,0.08018354587260514,42,35,5,2
"Oh dear, it's happened again.",1.2142857142857142,0.08018354587260514,42,35,5,2
I don't have an inkling what that is.,1.2142857142857142,0.06408213992247226,42,33,9,0
I have an inkling your not telling me something.,1.2142857142857142,0.07077624204383748,56,47,6,3
Tree pollen just makes me sneeze!,1.2142857142857142,0.08018354587260514,42,35,5,2
"That's a Diaper, probably early morning.",1.2142857142857142,0.08018354587260514,42,35,5,2
This is what I see every day when I go to the bathroom.,1.2142857142857142,0.07258071949818176,42,34,7,1
"It's Angela, and I think this is in very bad taste!",1.2142857142857142,0.08018354587260514,42,35,5,2
I see my breakfast.,1.2142857142857142,0.08018354587260514,42,35,5,2
That one was when I mixed too much craft beer and vintage wine during a comic con event.,1.2142857142857142,0.08018354587260514,42,35,5,2
How did you find a picture of my aunt Lucy  .,1.2142857142857142,0.08018354587260514,42,35,5,2
"Yes, that was my mother.",1.2142857142857142,0.08018354587260514,42,35,5,2
I recognize that ink --it's my mother!,1.2142857142857142,0.06408213992247226,42,33,9,0
Don't tell me you never wet yourself.,1.2142857142857142,0.08018354587260514,42,35,5,2
That's my toilet paper.,1.2142857142857142,0.07258071949818176,42,34,7,1
This one looks like how a heavy drinking night ends for me.,1.2142857142857142,0.07258071949818176,42,34,7,1
This is going to sound selfish.,1.2142857142857142,0.08018354587260514,42,35,5,2
I 'm sorry. I couldn't hold it.,1.2142857142857142,0.07258071949818176,42,34,7,1
"There are no mistakes, just happy accidents",1.2142857142857142,0.08018354587260514,42,35,5,2
I’m so self-involved I think you’re me.,1.2142857142857142,0.07258071949818176,42,34,7,1
You’re an animal.,1.2142857142857142,0.07258071949818176,42,34,7,1
I have an inkling that it's you!,1.2142857142857142,0.08018354587260514,42,35,5,2
"What do I see? I see how Rorschach gets all the credit for my family’s blood, sweat, and tears.",1.2127659574468086,0.08568260068364521,47,41,2,4
That's the ink blot calling the ink pot black.,1.2127659574468086,0.07410377385468278,47,39,6,2
Rorschach took all the credit and left me dry.,1.2127659574468086,0.07410377385468278,47,39,6,2
I said I was sorry,1.2115384615384615,0.0691280451233653,52,43,7,2
That resembles my late husband Harold…. Oh I’m so sad!,1.2115384615384615,0.08391144177936675,52,46,1,5
That proves nothing!,1.2105263157894737,0.06702258315442246,38,30,8,0
Sorry. Allergies.,1.2105263157894737,0.07690579795683228,38,31,6,1
"Iron Butterfly at Filmore East, '68.",1.2105263157894737,0.07690579795683228,38,31,6,1
I'm seeing last night's dinner again.,1.2105263157894737,0.08565615486386685,38,32,4,2
It looks like your shirt.,1.2105263157894737,0.07690579795683228,38,31,6,1
I was trying to be post-modern,1.2105263157894737,0.07690579795683228,38,31,6,1
"Oh, the horror!",1.2105263157894737,0.08565615486386685,38,32,4,2
It reminds me of myself.,1.2105263157894737,0.07690579795683228,38,31,6,1
I think I see my mother.,1.2105263157894737,0.06702258315442246,38,30,8,0
My incontinence issues.,1.2105263157894737,0.07690579795683228,38,31,6,1
How would you like your past mistakes shown to everyone?,1.2105263157894737,0.09359194395218198,38,33,2,3
My first white shirt.,1.2105263157894737,0.08565615486386685,38,32,4,2
That’s just cruel doc.,1.2105263157894737,0.07690579795683228,38,31,6,1
It’s my mother’s favorite splotch.,1.2105263157894737,0.07690579795683228,38,31,6,1
"Yeah, I did a centerfold when I was young, so what? We all did!",1.2105263157894737,0.08565615486386685,38,32,4,2
They all remind me of my mother.,1.2105263157894737,0.07690579795683228,38,31,6,1
They told me to consider how I felt on the inside.,1.2105263157894737,0.08565615486386685,38,32,4,2
Me crying over spilled ink!,1.2105263157894737,0.06702258315442246,38,30,8,0
I don’t just see my mother. That is my mother.,1.2105263157894737,0.09359194395218198,38,33,2,3
It's the only blot on my resume.,1.2105263157894737,0.08565615486386685,38,32,4,2
I'm afraid I do recognize who did that,1.2105263157894737,0.06702258315442246,38,30,8,0
I can't decide if it's a memoir or an autobiography.  What do you think it is?,1.2105263157894737,0.08565615486386685,38,32,4,2
It's not mine!,1.2105263157894737,0.08565615486386685,38,32,4,2
"So desirable.
So unattainable.",1.2105263157894737,0.09359194395218198,38,33,2,3
My mother-in-law.,1.2105263157894737,0.08565615486386685,38,32,4,2
"Yes, that looks like a sneeze to me",1.2105263157894737,0.08565615486386685,38,32,4,2
I feel like I'm invisible.,1.2105263157894737,0.08565615486386685,38,32,4,2
"I'll give it 6 out of10 the most, I'm afraid. Next, please.",1.2105263157894737,0.08565615486386685,38,32,4,2
"That was a long time ago, man. Six therapists and one cap later I feel like myself again.",1.2105263157894737,0.08565615486386685,38,32,4,2
"Aw cmon, they can’t all be great.",1.2105263157894737,0.06702258315442246,38,30,8,0
"Sorry Doc, this premature ejaculation is really embarrassing",1.2105263157894737,0.08565615486386685,38,32,4,2
I know what you’re thinking and it wasn’t me.,1.2105263157894737,0.06496983156298607,57,47,8,2
I've got an inkling I should look within,1.2105263157894737,0.06702258315442246,38,30,8,0
"That's right doc, they found me in an inkwell on their porch with only that note pinned to me.",1.2105263157894737,0.07690579795683228,38,31,6,1
Everybody loves the old stuff.,1.2105263157894737,0.08565615486386685,38,32,4,2
"Don't blame me, I'm just the messenger.",1.2105263157894737,0.06702258315442246,38,30,8,0
Here we go again- “What’s with you and the dirty pictures?,1.2105263157894737,0.07690579795683228,38,31,6,1
"How'd you get a hold of my diary, sir?",1.2105263157894737,0.06702258315442246,38,30,8,0
Tell me about your mother.,1.2105263157894737,0.08565615486386685,38,32,4,2
It looks like I made a lil mess on your page.,1.2105263157894737,0.07690579795683228,38,31,6,1
I've made so many of these they all look the same.,1.2105263157894737,0.06702258315442246,38,30,8,0
NO. It's not a Seurat !,1.2105263157894737,0.08565615486386685,38,32,4,2
"Ink blots? Well, if you want to know what I think that looks like, it's the stunning image of my cousin!",1.2105263157894737,0.07690579795683228,38,31,6,1
I put my heart and soul into that,1.2105263157894737,0.06702258315442246,38,30,8,0
My father of course.,1.2105263157894737,0.08565615486386685,38,32,4,2
I don't want to talk about it.,1.2105263157894737,0.08565615486386685,38,32,4,2
This is how she dyed,1.2105263157894737,0.08565615486386685,38,32,4,2
I already told the detective I found her like that.,1.2105263157894737,0.07690579795683228,38,31,6,1
I suppose we’ll need to schedule that colonoscopy then,1.2105263157894737,0.06702258315442246,38,30,8,0
Exploitation.,1.2105263157894737,0.08565615486386685,38,32,4,2
I like to come here and spill my guts.,1.2105263157894737,0.07690579795683228,38,31,6,1
That's also me.,1.2093023255813953,0.07845503988508755,43,36,5,2
It seems like everything reminds me of the accident.,1.2093023255813953,0.07845503988508755,43,36,5,2
"Wow, Murray has really let himself go!",1.2093023255813953,0.09148788284528409,43,38,1,4
"I don’t want to be negative, but spilling my guts and then trying to interpret it myself seems ludicrous.",1.2093023255813953,0.07845503988508755,43,36,5,2
"Alas poor Yorick! I knew him, Dr. Horatio...",1.2093023255813953,0.07845503988508755,43,36,5,2
But it always upsets me to see a picture of my long lost mother.,1.2093023255813953,0.0710476851931138,43,35,7,1
"So...
when you asked me to open up...
you didn't mean literally, did you?",1.2093023255813953,0.07845503988508755,43,36,5,2
Is that my Uncle Bob?,1.2093023255813953,0.07845503988508755,43,36,5,2
I'm feeling used.,1.2093023255813953,0.0710476851931138,43,35,7,1
This is my nightmare….I am certain I caused that!,1.2093023255813953,0.08522096570352598,43,37,3,3
"Roar shark, whatever.  I feel blotted at every turn.",1.2093023255813953,0.0710476851931138,43,35,7,1
This one’s also a gruesome crime scene.,1.2093023255813953,0.07845503988508755,43,36,5,2
"Sorry, I have allergies.",1.2093023255813953,0.07845503988508755,43,36,5,2
Also your mother.,1.2093023255813953,0.0710476851931138,43,35,7,1
The one time I take a selfie,1.2093023255813953,0.0710476851931138,43,35,7,1
"I didn’t get any royalties for that one, either.",1.2093023255813953,0.0710476851931138,43,35,7,1
I can’t quite explain it but that image evokes something inside of me.,1.2093023255813953,0.06277223796575146,43,34,9,0
Doc… i literally just came.,1.2093023255813953,0.07845503988508755,43,36,5,2
I told you it’s just a sneeze. They’re all sneezes.,1.2083333333333333,0.07854129630064868,48,41,4,3
... (sniff) Those were my mother's last words,1.2058823529411764,0.08207873882240854,34,28,5,1
What happens when I go potty.,1.2058823529411764,0.09230086977365412,34,29,3,2
I’m keeping my copay this week.,1.2058823529411764,0.07038741487212934,34,27,7,0
Describing an image in a therapy session,1.2058823529411764,0.09230086977365412,34,29,3,2
"Bob, in third grade",1.2058823529411764,0.08207873882240854,34,28,5,1
It reminds me of my dog.  His name was Spot.,1.2058823529411764,0.08207873882240854,34,28,5,1
"Now tell me, did you do this?",1.2058823529411764,0.1014986785887824,34,30,1,3
I can't read my own blood work.,1.2058823529411764,0.08207873882240854,34,28,5,1
"Uncle Ralph, rest his soul.",1.2058823529411764,0.08207873882240854,34,28,5,1
"That's what everyone remembers, but Mom was more than that.",1.2058823529411764,0.08207873882240854,34,28,5,1
"I see a woman in an endless dark tunnel of despair. Just kidding, that's my husband's signature.",1.2058823529411764,0.07038741487212934,34,27,7,0
"Of course, that’s mine. I always go on the inkpads.",1.2058823529411764,0.07038741487212934,34,27,7,0
Exploded pen in front of class again.,1.2058823529411764,0.08207873882240854,34,28,5,1
How do you explain this?,1.2058823529411764,0.08207873882240854,34,28,5,1
Allergies!,1.2058823529411764,0.09230086977365412,34,29,3,2
"I knew him, Horatio",1.2058823529411764,0.08207873882240854,34,28,5,1
I puked?,1.2058823529411764,0.08207873882240854,34,28,5,1
My bottled up emotions,1.2058823529411764,0.08207873882240854,34,28,5,1
It just means I’m a little clumsy.,1.2058823529411764,0.08207873882240854,34,28,5,1
"Yeah, I know that guy.",1.2058823529411764,0.08207873882240854,34,28,5,1
"Doctor - once again, the only thing I see is my mother.",1.2058823529411764,0.08207873882240854,34,28,5,1
"Actually, this one makes me think of ketchup.",1.2058823529411764,0.07038741487212934,34,27,7,0
I'm having trouble getting over the trauma of that spill.,1.2058823529411764,0.07038741487212934,34,27,7,0
oh that? That's nothing!,1.2058823529411764,0.08207873882240854,34,28,5,1
I just don't have it in me any more.,1.2058823529411764,0.08207873882240854,34,28,5,1
It's Covid 23,1.2058823529411764,0.08207873882240854,34,28,5,1
Riddle of the sphincter,1.2058823529411764,0.07038741487212934,34,27,7,0
This sense of feeling used keeps coming up for me.,1.2058823529411764,0.07038741487212934,34,27,7,0
"That? That's a spitting image of me, is what that is.",1.2058823529411764,0.08207873882240854,34,28,5,1
"Dude,seriously?",1.2058823529411764,0.1014986785887824,34,30,1,3
I don't believe a word of it.,1.2058823529411764,0.08207873882240854,34,28,5,1
I want you to go deep in the inkwell and tell me what you see.,1.2058823529411764,0.08207873882240854,34,28,5,1
"It reminds me of my childhood, when I was an innocent half-pint.""",1.2058823529411764,0.09230086977365412,34,29,3,2
Heidi Miller.,1.2058823529411764,0.09230086977365412,34,29,3,2
"C’mon Stan, you know how I hate to do centerfolds.",1.2058823529411764,0.07038741487212934,34,27,7,0
"Stop asking what it means, I told you, I sneezed.",1.2058823529411764,0.1014986785887824,34,30,1,3
Inky had to face the inequities it failed to blot out.,1.2058823529411764,0.09230086977365412,34,29,3,2
This has your handprints all over it.,1.2058823529411764,0.09230086977365412,34,29,3,2
I was wondering where i put that.,1.2058823529411764,0.08207873882240854,34,28,5,1
I fear you'll find my answer Narcissistic. -,1.2058823529411764,0.08207873882240854,34,28,5,1
"What do you mean ""twins?""",1.2058823529411764,0.08207873882240854,34,28,5,1
"Uh, I don’t know….sneeze?",1.2058823529411764,0.09230086977365412,34,29,3,2
I see a potential lawsuit.,1.205128205128205,0.09843229435255317,39,35,0,4
"Now that I’ve spilled my guts, you figure it out.",1.205128205128205,0.0751021542670798,39,32,6,1
Look what you did!,1.205128205128205,0.08360539002285312,39,33,4,2
Why do I keep having these thoughts?,1.205128205128205,0.0655042434521544,39,31,8,0
I UDDERly don’t know,1.205128205128205,0.0751021542670798,39,32,6,1
My piss?,1.205128205128205,0.08360539002285312,39,33,4,2
So after spilling my guts I have to diagnose myself?,1.205128205128205,0.0751021542670798,39,32,6,1
"Alas,poor Inky,I knew him well",1.205128205128205,0.08360539002285312,39,33,4,2
They told me to let it all out on the page.,1.205128205128205,0.08360539002285312,39,33,4,2
"OK, so I was a little premature, I get easily excited.",1.205128205128205,0.08360539002285312,39,33,4,2
I thought I was sick in the head but now I'm nausious.,1.205128205128205,0.0751021542670798,39,32,6,1
Are you a psychiatrist or a blackmailer?,1.205128205128205,0.0751021542670798,39,32,6,1
That one is my Uncle Dale after a New Year's party.,1.205128205128205,0.0751021542670798,39,32,6,1
That's the day I had diarrhea.,1.205128205128205,0.0751021542670798,39,32,6,1
I dis-stain this type of psychological testing.,1.205128205128205,0.09132025463275126,39,34,2,3
"Whenever I open up, this is what happens.",1.205128205128205,0.08360539002285312,39,33,4,2
What I see is that people use me. Something over which I have absolutely no control.,1.205128205128205,0.0751021542670798,39,32,6,1
OMG! Michelle!,1.205128205128205,0.09132025463275126,39,34,2,3
I’m too close to those blots to be “projective”!,1.205128205128205,0.08360539002285312,39,33,4,2
That's me after the brat ran me over with his trike!,1.205128205128205,0.0751021542670798,39,32,6,1
"""That was nothing more than a little indigestion.""",1.205128205128205,0.09132025463275126,39,34,2,3
I've been trying to hold that inside me.,1.205128205128205,0.0655042434521544,39,31,8,0
Looks like my cousin Rorschach was here.  Not his best work.,1.205128205128205,0.09132025463275126,39,34,2,3
I see incontinence.,1.205128205128205,0.0751021542670798,39,32,6,1
That's Uncle Louie right after he escaped from the pen.,1.205128205128205,0.09132025463275126,39,34,2,3
That one? That was from my Blue Period.,1.205128205128205,0.0751021542670798,39,32,6,1
I really put myself into it.,1.205128205128205,0.0655042434521544,39,31,8,0
I never had sex with that paper.,1.205128205128205,0.0751021542670798,39,32,6,1
...and that's a picture of my wife during happier times.,1.205128205128205,0.09132025463275126,39,34,2,3
I still see my big brother.,1.205128205128205,0.08360539002285312,39,33,4,2
Mommy in the White House...,1.205128205128205,0.0751021542670798,39,32,6,1
This is what we found in your son's locker today...,1.205128205128205,0.08360539002285312,39,33,4,2
Nobody uses fountain pens and I am out of work,1.205128205128205,0.08360539002285312,39,33,4,2
You can’t put me in the pen for this! Who knows how long my sentence will be.,1.205128205128205,0.08360539002285312,39,33,4,2
I did not have sexual relations with that piece of sheet,1.205128205128205,0.08360539002285312,39,30,7,2
Oh my God!  It's Uncle Frank!,1.205128205128205,0.08360539002285312,39,33,4,2
No I wouldn't say it's a squirt or a splatter. It's more of a spill.,1.205128205128205,0.0751021542670798,39,32,6,1
Doc she’s a babe but how’s this going to help me?,1.205128205128205,0.08360539002285312,39,33,4,2
"Boy o Boy, I really lost my head on that one, didn’t I?",1.205128205128205,0.0655042434521544,39,31,8,0
Now that I ink about it..,1.205128205128205,0.08360539002285312,39,33,4,2
I swear! Im innocent!,1.205128205128205,0.08360539002285312,39,33,4,2
I had a brain fart,1.205128205128205,0.0751021542670798,39,32,6,1
My mother’s final words,1.205128205128205,0.0751021542670798,39,32,6,1
A distant relative maybe but not of my kids.,1.205128205128205,0.09132025463275126,39,34,2,3
a car accident,1.205128205128205,0.0751021542670798,39,32,6,1
I see three punctuation errors.,1.205128205128205,0.0751021542670798,39,32,6,1
"I see my dad… wait, that *is* my dad.",1.205128205128205,0.0751021542670798,39,32,6,1
I feel like my life is dripping away,1.2045454545454546,0.0615132074247489,44,35,9,0
Death.,1.2045454545454546,0.06957698714453991,44,36,7,1
That one also looks like mom.,1.2045454545454546,0.07679869525286717,44,37,5,2
That bitch!,1.2045454545454546,0.07679869525286717,44,37,5,2
Reflux.,1.2045454545454546,0.06957698714453991,44,36,7,1
I did that one when I was just a little squirt!,1.2045454545454546,0.08339737432901621,44,38,3,3
"No ""Bless you""?",1.2045454545454546,0.08339737432901621,44,38,3,3
We really must analyze this blot on your record.,1.2045454545454546,0.08339737432901621,44,38,3,3
I told you already…that’s all I blot!,1.2045454545454546,0.07679869525286717,44,37,5,2
Maybe you are asking the wrong question?,1.2040816326530612,0.07130699079332185,49,41,6,2
"All I see is computers, again.",1.2040816326530612,0.07703912689051784,49,42,4,3
What brings you in today? Spill it.,1.2,0.07991592220483187,35,29,5,1
It's like my insides were poured out on each page.,1.2,0.08981774262781438,35,30,3,2
M-m-m-mother.,1.2,0.0733799385705343,40,33,6,1
"Sorry about that, I have a cold.",1.2,0.0733799385705343,40,33,6,1
"Again, I only see trauma",1.2,0.07991592220483187,35,29,5,1
"Yes, it's my mother again. It's always my mother.",1.2,0.07521014330903551,45,38,5,2
"Oh, Mom...",1.2,0.08981774262781438,35,30,3,2
My future.,1.2,0.08981774262781438,35,30,3,2
Once again all I see is my mother.,1.2,0.06816498108607269,45,37,7,1
"Death, again.",1.2,0.08981774262781438,35,30,3,2
Oh no! That’s my late sister! Why would you show me that??,1.2,0.07991592220483187,35,29,5,1
"This may sound weird, but I see a Quill . .somehow the Q is important . . .trying to put the kibosh on something in a Declaration ..",1.2,0.06859943405700354,35,28,7,0
Look like an autopsy.,1.2,0.08981774262781438,35,30,3,2
"Man, I told you, I ain’t ready to talk about Rorschach.",1.2,0.07991592220483187,35,29,5,1
Second cousin once removed.,1.2,0.06405126152203489,40,32,8,0
All I see is my dad.,1.2,0.06816498108607269,45,37,7,1
All I see is a pen taking me for granted.,1.2,0.08981774262781438,35,30,3,2
The pen did it.  Ask the pen.,1.2,0.06859943405700354,35,28,7,0
You say splat. I say shat.,1.2,0.0891555828241729,40,35,2,3
I see a failure in self-control.,1.2,0.08981774262781438,35,30,3,2
A mirror.  It’s like looking into a mirror.,1.2,0.06030226891555274,45,36,9,0
Again! Porn.,1.2,0.08164965809277262,40,34,4,2
"Same thing here. Colic.""",1.2,0.09873144969898835,35,31,1,3
Auntie Tusche from 2012 ...,1.2,0.06859943405700354,35,28,7,0
I'm sorry I didn't make a good first impression on you.,1.2,0.07991592220483187,35,29,5,1
"It gives me an empty feeling.""",1.2,0.0733799385705343,40,33,6,1
Good heavens! Poor cousin Leonard.,1.2,0.08981774262781438,35,30,3,2
I see a crushed burger.,1.2,0.0733799385705343,40,33,6,1
"You may roar, but are you shocked?",1.2,0.07991592220483187,35,29,5,1
I remember him well.,1.2,0.08164965809277262,40,34,4,2
''I see my mum abandoning me when I was just a coloured drop...'',1.2,0.08164965809277261,45,39,3,3
Do we have to discuss my mother again?,1.2,0.07991592220483187,35,29,5,1
"I ink; therefore, I am",1.2,0.07991592220483187,35,29,5,1
I've been told my pictures don't do me justice.,1.2,0.08981774262781438,35,30,3,2
That's the first thing that comes to me just off the top of my head.,1.2,0.08981774262781438,35,30,3,2
Am I on Candid Camera?,1.2,0.07991592220483187,35,29,5,1
It's a long story.,1.2,0.08981774262781438,35,30,3,2
I better have that DNA swab.,1.2,0.07991592220483187,35,29,5,1
My mother. They all look like my mother.,1.2,0.06859943405700354,35,28,7,0
It just came off the top of my head.,1.2,0.08164965809277262,40,34,4,2
I see a crime scene.  Lots of blood.,1.2,0.06859943405700354,35,28,7,0
Looks like a waste of ink to me.,1.2,0.07991592220483187,35,29,5,1
Looks like the lactating breast that I wish I were.,1.2,0.09873144969898835,35,31,1,3
It was my first period.,1.2,0.08981774262781438,35,30,3,2
"Uh, Terry, I thought I told you- no more sifting through my trash.",1.2,0.07991592220483187,35,29,5,1
"Well, Mr. Lenin, it says to me that the Capitalists will sell us the rope that we will use to hang them.",1.2,0.08164965809277262,40,34,4,2
"Looks like guts to me, doc.",1.2,0.08164965809277262,40,34,4,2
"""Pervert, you blotted my mother!""",1.2,0.07991592220483187,35,29,5,1
It isn't mine.,1.2,0.06859943405700354,35,28,7,0
"Lately, doc, it seems like it's always all about me.",1.2,0.0733799385705343,40,33,6,1
"I know, I know - the answer's inside me.",1.2,0.07991592220483187,35,29,5,1
I demand a PIGMENT test!,1.2,0.08981774262781438,35,30,3,2
"If it’s not one thing, it’s a mother.",1.2,0.06405126152203489,40,32,8,0
I was framed.,1.2,0.08981774262781438,35,30,3,2
"‘That was a dark moment in my past. ‘

Mira Dragisic 
Elmhurst, IL",1.2,0.07991592220483187,35,29,5,1
What caught my attention about #820 cartoon photo is that there’s a teacher/doctor who showing a Rorschach picture to person who like like a  bottle of ink. An in ink bottle is showing fear in his/her eyes. It has to do about the individuals past.,1.2,0.09873144969898835,35,31,1,3
"How about you tell me what YOU see.""
""That's my uncle. Not by blood.""
""By Ketchup?""
""Yes.",1.2,0.06859943405700354,35,28,7,0
I see a recurring nightmare.,1.2,0.06859943405700354,35,28,7,0
Now you're getting personal.,1.2,0.06030226891555274,45,36,9,0
"Don’t read too much into it, Doc. Two words... bowel movement.",1.2,0.0891555828241729,40,35,2,3
The King's to blame.,1.2,0.0733799385705343,40,33,6,1
Can't you just once show me a watercolor?,1.2,0.0733799385705343,40,33,6,1
What do I see? I see you committing a microaggression.,1.2,0.07991592220483187,35,29,5,1
I resemble that question,1.2,0.0733799385705343,40,33,6,1
What?No God bless you?,1.2,0.0733799385705343,40,33,6,1
"'It's just a self portrait, I didn't know it would be so controversial.'",1.2,0.08981774262781438,35,30,3,2
I ink I have a blot to explain here…,1.2,0.07991592220483187,35,29,5,1
You told me it happens to everyone.,1.2,0.09873144969898835,35,31,1,3
All she left was this note. What do you think it means?,1.2,0.07991592220483187,35,29,5,1
What do I see? I see a plagiarism lawsuit  buddy.,1.2,0.08981774262781438,35,30,3,2
"That is India, my late wife.",1.2,0.08981774262781438,35,30,3,2
That’s the first time I’ve seen her since we split up.,1.2,0.07991592220483187,35,29,5,1
Yes it’s mine! But it’s too late now. Dried and died.,1.2,0.06816498108607269,45,37,7,1
