caption,mean,precision,votes,not_funny,somewhat_funny,funny
When High Tech destroyed the Fountain pen,1.2333333333333334,0.06451324335931523,60,48,10,2
"What do you mean, ""what does it remind you of?""
What it reminds me of  is what an idiot I was
bring my graphic novel to you in the first place!",1.2333333333333334,0.0687526750036001,60,49,8,3
Those were the covid years,1.2333333333333334,0.06451324335931523,60,48,10,2
One of my earlier pieces. I’m more contained now!,1.2333333333333334,0.07274546083133358,60,50,6,4
Chipotle?,1.2333333333333334,0.07274546083133358,60,50,6,4
I’m too offended to say.,1.2328767123287672,0.06902381944215057,73,62,5,6
I can't help it. I cry over spilled ink.,1.2321428571428572,0.06237231855918919,56,44,11,1
I had to get that off my mind.,1.2321428571428572,0.06237231855918919,56,44,11,1
Yep...it's all about my Mother,1.2321428571428572,0.06737697508644645,56,45,9,2
It wasn't me--it was thet friggin' pen I live with.,1.2321428571428572,0.07203476536472007,56,46,7,3
"I swear, that's never happened before!",1.2321428571428572,0.06737697508644645,56,45,9,2
You're gonna say I'm a narcissist.,1.2321428571428572,0.05692939024000106,56,43,13,0
A shrink with ink on his face.,1.2321428571428572,0.05692939024000106,56,43,13,0
So you're saying this is about my mother...,1.2321428571428572,0.06737697508644645,56,45,9,2
This isn’t really making me want to open up.,1.2321428571428572,0.06737697508644645,56,45,9,2
It's the bad dream I had last night.,1.2321428571428572,0.06737697508644645,56,45,9,2
Absolutely not; it was the octopus.,1.2321428571428572,0.06737697508644645,56,45,9,2
That's me after the brat ran me over with his trike!,1.2321428571428572,0.06237231855918919,56,44,11,1
I dunno doc it’s just a blot to think about,1.2321428571428572,0.06737697508644645,56,45,9,2
Shouldn't have eaten those prawns...,1.2321428571428572,0.07203476536472007,56,46,7,3
"Yes, I was wrong.  That wasn't the way to make a splash.",1.2321428571428572,0.06237231855918919,56,44,11,1
It's my mother again.,1.2321428571428572,0.07203476536472007,56,46,7,3
I really put myself into it.,1.2321428571428572,0.05692939024000106,56,43,13,0
"So, now it is classified!",1.2321428571428572,0.07203476536472007,56,46,7,3
"No idea, I’m so bottled up.",1.2321428571428572,0.08054631412952162,56,48,3,5
That reminds of an embarrasing mess I once made when I was sick.,1.2321428571428572,0.06737697508644645,56,45,9,2
"How about you tell me what YOU see.""
""That's my uncle. Not by blood.""
""By Ketchup?""
""Yes.",1.2321428571428572,0.06737697508644645,56,45,9,2
Can you go over the doctor-patient confidentiality legalities again?,1.2321428571428572,0.06737697508644645,56,45,9,2
"No offense, but I don’t want to donate my body to science.",1.2321428571428572,0.07203476536472007,56,46,7,3
Et tu Brutus,1.2321428571428572,0.07203476536472007,56,46,7,3
. . . and they never call!,1.2318840579710144,0.06243471453411535,69,56,10,3
That's my ink...I already know what it means,1.2318840579710144,0.058922288817144,69,55,12,2
Swipe left. It's not my type.,1.2307692307692308,0.0757834127802906,52,43,6,3
I find these gory crime-scene photos very disturbing.,1.2307692307692308,0.05704768066996663,65,51,13,1
I thought this was a safe space.,1.2307692307692308,0.0757834127802906,52,43,6,3
Would you say this is premature or delayed?,1.2307692307692308,0.0757834127802906,52,43,6,3
That's my great uncle Fred. He was knocked off a table during the war.,1.2307692307692308,0.06111634070027192,65,52,11,2
This is my creative expression of Agh.,1.2307692307692308,0.06507557165853581,52,41,10,1
Uncle Ritchie. I forgot how much I miss him.,1.2307692307692308,0.07063269667552394,52,42,8,2
I see a Maxi-pad.,1.2307692307692308,0.0757834127802906,52,43,6,3
"Well doctor, I don’t really appreciate you bringing up my brother’s demise in this manner.",1.2307692307692308,0.06507557165853581,52,41,10,1
I think 'God bless you.' is appropriate.,1.2307692307692308,0.0757834127802906,52,43,6,3
"Jane!  Oh, Jane.",1.2307692307692308,0.07063269667552394,52,42,8,2
"'Just a sneeze, really.""",1.2307692307692308,0.06507557165853581,52,41,10,1
"it was an accident, i swear!",1.2307692307692308,0.06853280646617484,65,54,7,4
Looks like an early Pollock.,1.2307692307692308,0.0757834127802906,52,43,6,3
That’s cousin Louie.,1.2307692307692308,0.08060566646085904,52,44,4,4
That's my nephew after he got a job at the newspaper.,1.2307692307692308,0.06111634070027192,65,52,11,2
Where did it all start?  I was at a sleepover at Sigmund’s house and had an accident.,1.2307692307692308,0.07063269667552394,52,42,8,2
Meta… very meta.,1.2307692307692308,0.06493055006205434,65,53,9,3
"Judge, I declassified it with all my inner might.",1.2307692307692308,0.07063269667552394,52,42,8,2
So my existence is meaningful?,1.2307692307692308,0.08060566646085904,52,44,4,4
If you wanted to be in my guts you could have just asked,1.2307692307692308,0.06111634070027192,65,52,11,2
"If you must know, it’s not my best work.",1.2307692307692308,0.07063269667552394,52,42,8,2
You shouldn’t judge me just by a splash of my brain’s thoughts,1.2307692307692308,0.06507557165853581,52,41,10,1
I see nothing. I feel invisible.,1.2307692307692308,0.05704768066996663,65,51,13,1
Do I have to relive that?,1.2297297297297298,0.0653849628876873,74,62,7,5
I'm so tired of spilling my guts.,1.2295081967213115,0.063562037261619,61,49,10,2
I thought that you’d be happy with my portrait of you Dr. Rorschach.,1.2295081967213115,0.06772429895007506,61,50,8,3
"It looks like Uncle Eddie, just after the accident.",1.2295081967213115,0.06772429895007506,61,50,8,3
It hasn’t been easy being an icon,1.2295081967213115,0.063562037261619,61,49,10,2
She was fine when I dropped her off.,1.2295081967213115,0.06772429895007506,61,50,8,3
See? I just can't seem to blot it out of my memory.,1.2291666666666667,0.07437436055707791,48,39,7,2
My ex-wife.,1.2291666666666667,0.06815438860102255,48,38,9,1
You need a pen to write!,1.2291666666666667,0.07437436055707791,48,39,7,2
"Yes, I can absolutely verify that as one of my early works painted during my Jackson Pollack period: 'Untitled Splat (II)'.",1.2291666666666667,0.07437436055707791,48,39,7,2
Why do you always think we suffer from pens envy?,1.2291666666666667,0.07437436055707791,48,39,7,2
The Inkspots.,1.2291666666666667,0.08011285995999183,48,40,5,3
It’s my mother’s favorite splotch.,1.2291666666666667,0.06815438860102255,48,38,9,1
Why are you showing me this?,1.2291666666666667,0.07437436055707791,48,39,7,2
"Once again, it is spilled ink.",1.2291666666666667,0.07437436055707791,48,39,7,2
"As an artist,you just pour your heart out on the page.",1.2291666666666667,0.08011285995999183,48,40,5,3
That was my poor late cousin  Ernie's last splotch before he ran dry.,1.2291666666666667,0.08011285995999183,48,40,5,3
This is the incriminating evidence!,1.2291666666666667,0.07437436055707791,48,39,7,2
I did my best,1.2291666666666667,0.07437436055707791,48,39,7,2
"I'm sorry, I just waited too long to get to a bathroom.",1.2291666666666667,0.07437436055707791,48,39,7,2
I don't think that captures both sides of the question.,1.2291666666666667,0.08011285995999183,48,40,5,3
"Okay,but this time it actually IS my mother.",1.2291666666666667,0.08011285995999183,48,40,5,3
I've been replaced by a giant nipple.,1.2291666666666667,0.07437436055707791,48,39,7,2
My id on steroids.,1.2291666666666667,0.07437436055707791,48,39,7,2
That was me blowing my nose,1.2291666666666667,0.08011285995999183,48,40,5,3
"Apologies, could not find my tissues",1.2291666666666667,0.07437436055707791,48,39,7,2
"No, that’s not Grandpa either.",1.2291666666666667,0.07437436055707791,48,39,7,2
The King's to blame.,1.2291666666666667,0.06815438860102255,48,38,9,1
I’ve put all of me in there.,1.2291666666666667,0.07437436055707791,48,39,7,2
It’s not my color!,1.2291666666666667,0.07437436055707791,48,39,7,2
I don't want to talk about my mother.,1.2291666666666667,0.061306572754347935,48,37,11,0
But you asked me to really pour myself into my journal this week.,1.2285714285714286,0.05816884316617732,70,56,12,2
"Again, it is reminder that my life has been unremarkable.",1.2280701754385965,0.06140350877192983,57,45,11,1
"I really made a mess out of the last few years, Doc.""",1.2280701754385965,0.07087682076380587,57,47,7,3
That looks like my son's graduation picture. Or a crab.,1.2280701754385965,0.06140350877192983,57,45,11,1
Nobody I know.,1.2280701754385965,0.07087682076380587,57,47,7,3
I'm actually ketchup with a tall sombrero.,1.2280701754385965,0.06630955666828549,57,46,9,2
It looks like my signature,1.2280701754385965,0.07087682076380587,57,47,7,3
"But, that was long ago! A lot has changed since then.",1.2280701754385965,0.06140350877192983,57,45,11,1
Don't you bring my wife into this.,1.2280701754385965,0.07087682076380587,57,47,7,3
My first white shirt.,1.2280701754385965,0.07087682076380587,57,47,7,3
You didn’t tell me this was going to be so invasive.,1.2280701754385965,0.06630955666828549,57,46,9,2
I’m shocked! I didn’t know I had it in me!,1.2280701754385965,0.06630955666828549,57,46,9,2
"Indeed, a stain on my good name.",1.2280701754385965,0.06630955666828549,57,46,9,2
Do we have to talk about my mother?,1.2280701754385965,0.07087682076380587,57,47,7,3
We agreed not to talk about my mother.,1.2280701754385965,0.07087682076380587,57,47,7,3
"Yes, I am feeling a little “blue” these days.",1.2280701754385965,0.0751670814760342,57,48,5,4
It doesn't look like anything to me. I just used the paper to stop a sneeze.,1.2280701754385965,0.0751670814760342,57,48,5,4
"""I don't speak French.""",1.2280701754385965,0.07087682076380587,57,47,7,3
I did that one when I was just a little squirt!,1.2280701754385965,0.07922535297280073,57,49,3,5
I'm paying how much for this?!,1.2280701754385965,0.06630955666828549,57,46,9,2
The one time I take a selfie,1.2280701754385965,0.06140350877192983,57,45,11,1
It’s all black to me,1.2280701754385965,0.07087682076380587,57,47,7,3
"Yes, yes, we all agree my early work was a bit clichéd.",1.2280701754385965,0.06140350877192983,57,45,11,1
"It's just dawning on me that when they asked me to send the x-ray to my doctor, they meant my radiologist.",1.2280701754385965,0.07087682076380587,57,47,7,3
"Uh, I don’t know….sneeze?",1.2280701754385965,0.0751670814760342,57,48,5,4
Kleenex,1.2280701754385965,0.07087682076380587,57,47,7,3
"I'm sorry, I'm an inkapable",1.2280701754385965,0.07087682076380587,57,47,7,3
I thought we agreed we’d move on from talking about my mother,1.2280701754385965,0.06630955666828549,57,46,9,2
It’s like I’m spilling my guts!,1.2272727272727273,0.060284695763812665,66,53,11,2
Reminds me of my mother. They all do.,1.2272727272727273,0.06757695965146986,66,55,7,4
"""What do I see?  My ink splattered on a sheet of paper""",1.2272727272727273,0.060284695763812665,66,53,11,2
Stealing my best work again!,1.2272727272727273,0.06757695965146986,66,55,7,4
Sorry about the card. I sneezed in the middle of signing it. The whole department wishes you a happy retirement.,1.2272727272727273,0.06403471722070707,66,54,9,3
I can't believe I've been holding that in all this time.,1.2266666666666666,0.06457995486658823,75,63,7,5
It looks like one of my early efforts. I got better.,1.2264150943396226,0.058037007324041226,53,41,12,0
A troubling waste of my resources.,1.2264150943396226,0.06942386498172073,53,43,8,2
You're not funny Doc.,1.2264150943396226,0.06942386498172073,53,43,8,2
I UDDERly don’t know,1.2264150943396226,0.06942386498172073,53,43,8,2
I don’t see anything — it’s just an ink blot.,1.2264150943396226,0.06942386498172073,53,43,8,2
I see my twin brothers.,1.2264150943396226,0.06398424512382328,53,42,10,1
It looks like my parents having sex.,1.2264150943396226,0.07446719031852135,53,44,6,3
That’s what happens when I spill my guts.,1.2264150943396226,0.07446719031852135,53,44,6,3
"Yes Doctor, I’m not proud of some of the things I’ve done when I was blotto. That’s why  I’ve come to you.",1.2264150943396226,0.06942386498172073,53,43,8,2
Rorschach was a sick man.,1.2264150943396226,0.07446719031852135,53,44,6,3
I see a reminder of a night I would rather forget.,1.2264150943396226,0.07446719031852135,53,44,6,3
That’s when I farted.,1.2264150943396226,0.07918997309552243,53,45,4,4
I see a crime scene.  Lots of blood.,1.2264150943396226,0.06398424512382328,53,42,10,1
A black kettle.,1.2264150943396226,0.06942386498172073,53,43,8,2
It isn't my ink that has ruined your blotter!,1.2264150943396226,0.07446719031852135,53,44,6,3
Is your mother in the room with us now?,1.2264150943396226,0.06398424512382328,53,42,10,1
I don't know. Sometimes I feel like I'M just a blot of ink on a piece of paper.,1.2264150943396226,0.06942386498172073,53,43,8,2
What I see is a waste of good ink.,1.2264150943396226,0.06942386498172073,53,43,8,2
I’ve got nothing.,1.2264150943396226,0.06942386498172073,53,43,8,2
That one makes me want to spill my guts.,1.2264150943396226,0.06942386498172073,53,43,8,2
'Your report is not normal',1.2264150943396226,0.06942386498172073,53,43,8,2
I feel triggered.,1.2264150943396226,0.06942386498172073,53,43,8,2
Rorschach took all the credit and left me dry.,1.2264150943396226,0.07446719031852135,53,44,6,3
I see three punctuation errors.,1.2264150943396226,0.06942386498172073,53,43,8,2
Like you've never said anything you regret.,1.2258064516129032,0.06672577740289717,62,51,8,3
"I know it's a cliche, but it reminds me of my mother.",1.2258064516129032,0.07057726333454416,62,52,6,4
"More pictures of my mother this week, Doctor?",1.2258064516129032,0.07057726333454416,62,52,6,4
"You think I have problems, but you are analyzing the mindset of an ink bottle.",1.2258064516129032,0.06263791695329896,62,50,10,2
That one was made by my cousin Ralph.,1.2258064516129032,0.06672577740289717,62,51,8,3
I refuse to answer on account of my bottled-up personality,1.2258064516129032,0.06672577740289717,62,51,8,3
"Now tell me, did you do this?",1.2253521126760563,0.07005942605037288,71,61,4,6
"That was some night.  I don't want to be reminded about it anymore, please.",1.2244897959183674,0.06691263800308161,49,39,9,1
So what if I blot. Is that a crime now?,1.2244897959183674,0.07860013611082545,49,41,5,3
I trusted you…,1.2244897959183674,0.08383508533242337,49,42,3,4
It's a long story.,1.2244897959183674,0.07299069297236371,49,40,7,2
That's the real me.  Everything else is just words.,1.2244897959183674,0.08383508533242337,49,42,3,4
"Yes I know him, but I had absolutely nothing to do with this",1.2244897959183674,0.07299069297236371,49,40,7,2
"Sorry, but I don't have an inkling.",1.2244897959183674,0.07299069297236371,49,40,7,2
That’s Me All Over,1.2244897959183674,0.07860013611082545,49,41,5,3
My mother...It's always my mother.,1.2244897959183674,0.06691263800308161,49,39,9,1
What do you mean ‘too self-aware’?,1.2244897959183674,0.06691263800308161,49,39,9,1
That was the day I had too much coffee.,1.2244897959183674,0.06691263800308161,49,39,9,1
"Yes, I do have PTSD from that incident.",1.2244897959183674,0.06691263800308161,49,39,9,1
That's when I knew I needed help.,1.2244897959183674,0.07860013611082545,49,41,5,3
What caught my attention about #820 cartoon photo is that there’s a teacher/doctor who showing a Rorschach picture to person who like like a  bottle of ink. An in ink bottle is showing fear in his/her eyes. It has to do about the individuals past.,1.2244897959183674,0.08876182551496521,49,43,1,5
So you think I’m skinny?,1.2244897959183674,0.07299069297236371,49,40,7,2
"I didn’t get any royalties for that one, either.",1.2244897959183674,0.06691263800308161,49,39,9,1
"I swear, I would never do such a thing with the photocopier.",1.2244897959183674,0.06691263800308161,49,39,9,1
Who leaked that?,1.2244897959183674,0.07860013611082545,49,41,5,3
It's from my Blue Period.,1.2244897959183674,0.07860013611082545,49,41,5,3
"And, yup...that's also my mother.",1.2241379310344827,0.06975500922314924,58,48,7,3
MY ERECTILE DISFUNCTION IS ONLY THE BEGINNING OF MY PROBLEMS.,1.2241379310344827,0.06975500922314924,58,48,7,3
Just another bad hair day,1.2241379310344827,0.06527480857241695,58,47,9,2
"What do I see? I see how Rorschach gets all the credit for my family’s blood, sweat, and tears.",1.2241379310344827,0.0779466655273563,58,50,3,5
Allergies!,1.2241379310344827,0.06975500922314924,58,48,7,3
Oh! God Bless You!,1.2241379310344827,0.060463542375630945,58,46,11,1
I'd say that's an inkblot!,1.2241379310344827,0.06975500922314924,58,48,7,3
"I don’t know how many times I have to tell you, I swear it wasn’t me!",1.2241379310344827,0.0779466655273563,58,50,3,5
This is from my blue period.,1.2241379310344827,0.06527480857241695,58,47,9,2
My desktop.  After drinking too much cheap ink.,1.2241379310344827,0.060463542375630945,58,46,11,1
I see a blot of me in that.,1.2241379310344827,0.0739643291680361,58,49,5,4
I just don't have it in me any more.,1.2241379310344827,0.06527480857241695,58,47,9,2
Do you really expect me to see something other than my life being wasted?,1.2241379310344827,0.060463542375630945,58,46,11,1
That's my toilet paper.,1.2241379310344827,0.06975500922314924,58,48,7,3
It looks like Mom. I’ve got some attachment issues.,1.2241379310344827,0.060463542375630945,58,46,11,1
I’m not paying without a DNA test.,1.2241379310344827,0.0739643291680361,58,49,5,4
Are you kidding me? My entire life is a Rorschach test!,1.2241379310344827,0.0739643291680361,58,49,5,4
"Look, I produced the sample, I'm tired, I just want my $50.",1.2238805970149254,0.06316288636259096,67,55,9,3
"Sorry, I'm just getting over a cold.",1.2238805970149254,0.06995797511649943,67,57,5,5
I don't want to talk about my childhood.,1.2222222222222223,0.05315633121839994,72,57,14,1
"That would be Uncle Ed, hit by a beer truck as he was crossing Fifth and Vine.",1.2222222222222223,0.06825501298155011,54,44,8,2
Guilt.,1.2222222222222223,0.06292801266165045,54,43,10,1
That’s my mom’s handwriting.,1.2222222222222223,0.06575585358598524,63,52,8,3
You'd be depressed too if psychologists were using your blood for their stupid tests all the time!,1.2222222222222223,0.05744359616725745,63,50,12,1
I’m sorry.  I lost my head for a moment.,1.2222222222222223,0.08218991942940318,54,47,2,5
I see the blood of my enemies.,1.2222222222222223,0.06173977251921359,63,51,10,2
A graveyard of relationships.,1.2222222222222223,0.0731953469605706,54,45,6,3
"Its not just me, EVERYONE thinks its a butterfly.",1.2222222222222223,0.06292801266165045,54,43,10,1
That’s just cruel doc.,1.2222222222222223,0.06292801266165045,54,43,10,1
Reminds me of the last time I was used,1.2222222222222223,0.0731953469605706,54,45,6,3
I was very angry that day and it was an out of control squirt.,1.2222222222222223,0.06292801266165045,54,43,10,1
Oh my God! That’s Hector!,1.2222222222222223,0.06825501298155011,54,44,8,2
"Yes, that was during my Jackson Pollock phase.""",1.2222222222222223,0.0731953469605706,54,45,6,3
It looks exactly like the wet dream I had two nights ago.,1.2222222222222223,0.06575585358598524,63,52,8,3
"Another failure! I was trying to blot it out of my memory, doctor.",1.2222222222222223,0.06825501298155011,54,44,8,2
"No, I don't have an inkling of what that might be.",1.2222222222222223,0.06324005430728245,72,60,8,4
"Listen, would I show you gory images of  YOUR blood splattered all over the place?  Who's the sick one here, Doc?",1.2222222222222223,0.06954038431673219,63,53,6,4
I was so young and carefree back then.,1.2222222222222223,0.06954038431673219,63,53,6,4
No one should be defined by their worst day.,1.2222222222222223,0.06292801266165045,54,43,10,1
Put it in the Guggenheim,1.2222222222222223,0.06825501298155011,54,44,8,2
"It doesn’t remind me of anything, really.",1.2222222222222223,0.06825501298155011,54,44,8,2
"Uh, I need to use your restroom!",1.2222222222222223,0.06825501298155011,54,44,8,2
I’m not proud of what I’ve done.,1.2222222222222223,0.06575585358598524,63,52,8,3
All she left was this note. What do you think it means?,1.2222222222222223,0.06292801266165045,54,43,10,1
Dr. Freud are telling me that the Rorschach ink blot indicates that I am depressed. Well what do you expect when all I am is a stain on society?,1.2207792207792207,0.06025514395462593,77,64,9,4
I see Donald Trump...,1.2205882352941178,0.06574216082516834,68,57,7,4
"An Inkblot, really?? ...  why bring up mistakes I made before ballpoint pens became popular!!??",1.2205882352941178,0.05868618733921613,68,55,11,2
And how would you like it if I showed you pictures of YOUR mother?,1.2205882352941178,0.06574216082516834,68,57,7,4
Elmer’s?,1.2203389830508475,0.059551198008116694,59,47,11,1
Looks like my Uncle Kevin.,1.2203389830508475,0.06427129001463884,59,48,9,2
I can explain that,1.2203389830508475,0.06427129001463884,59,48,9,2
"You say I have a dirty mind, but you continue to show me pornographic pictures.",1.2203389830508475,0.06427129001463884,59,48,9,2
I see a violent loss of my previous bodily fluids!,1.2203389830508475,0.06427129001463884,59,48,9,2
I told you I was all over the place.,1.2203389830508475,0.06427129001463884,59,48,9,2
"Yes, that’s one of my children, but he never calls.",1.2203389830508475,0.06866769441367393,59,49,7,3
"Sorry, I faint at the sight of blood.",1.2203389830508475,0.0727990782361535,59,50,5,4
Does this look familiar to you?,1.2203389830508475,0.06866769441367393,59,49,7,3
Self-reflecting on a self-“ink”flicted problem.,1.2203389830508475,0.06427129001463884,59,48,9,2
Are you positive the paternity test was valid…,1.2203389830508475,0.0727990782361535,59,50,5,4
My imperfections.,1.2203389830508475,0.059551198008116694,59,47,11,1
"I’m sorry, I can’t go that far back…. I was blotto.",1.2203389830508475,0.0727990782361535,59,50,5,4
That one was just a sneeze.,1.22,0.06571428571428571,50,40,9,1
It looks like my mother.,1.22,0.07714285714285714,50,42,5,3
I don't think I'm ready to look at my past quite yet,1.22,0.06571428571428571,50,40,9,1
"I just don't see the resemblance, doc.",1.22,0.07165677830848258,50,41,7,2
A cumulous cloud.,1.22,0.07714285714285714,50,42,5,3
That was my first blood donation,1.22,0.06571428571428571,50,40,9,1
It's a human being who was dropped from a considerable height.,1.22,0.06571428571428571,50,40,9,1
It reminds me of myself.,1.22,0.06571428571428571,50,40,9,1
"Next time, trigger warning.",1.22,0.06571428571428571,50,40,9,1
Explain THIS!?,1.22,0.07165677830848258,50,41,7,2
My poor cousin.,1.22,0.06571428571428571,50,40,9,1
I see my 6th grade math teacher Mr. Rorschach.”,1.22,0.07714285714285714,50,42,5,3
"I always spill my guts to you, Doc.",1.22,0.07714285714285714,50,42,5,3
I'm sorry to be so upset. That reminds me of my first child.,1.22,0.06571428571428571,50,40,9,1
"Doc, I've already spilled everything.",1.22,0.06571428571428571,50,40,9,1
Destiny.,1.22,0.07165677830848258,50,41,7,2
I ink it has something to do with my father.,1.22,0.059178043363451366,50,39,11,0
"I just keep seeing the ink, in shrink.",1.22,0.07714285714285714,50,42,5,3
That's when Dad dropped my brother Joey.,1.22,0.08226388599364554,50,43,3,4
Why have you been keeping the used tissues from our sessions…?,1.22,0.07165677830848258,50,41,7,2
"Honestly, not my best selfie",1.22,0.07714285714285714,50,42,5,3
Good heavens! Poor cousin Leonard.,1.21875,0.06853320797422294,64,54,6,4
I had to pee. You got a problem with that?,1.21875,0.06481333851304336,64,53,8,3
It's like my whole life just splashed before my eyes.,1.2181818181818183,0.061905266448664883,55,44,10,1
"No, that really is a naked picture of my mother.",1.2181818181818183,0.0719657096184116,55,46,6,3
"It looks like a breast, but then everything looks like a breast.",1.2181818181818183,0.0671242332357016,55,45,8,2
"Hey, I think I know that guy!",1.2181818181818183,0.0671242332357016,55,45,8,2
"it reminds me of my first love, Miss Eraser-but alas  it wasn't permanent.",1.2181818181818183,0.0671242332357016,55,45,8,2
"That's a Diaper, probably early morning.",1.2181818181818183,0.0719657096184116,55,46,6,3
I don’t see how any of this is open to interpretation.,1.2181818181818183,0.056203748457549704,55,43,12,0
Mother....can't you leave me alone?!?,1.2181818181818183,0.0719657096184116,55,46,6,3
I had nothing to do with King Charles and the Bloody pen.,1.2181818181818183,0.0719657096184116,55,46,6,3
Did you just fish my Kleenex out of the garbage?,1.2181818181818183,0.0671242332357016,55,45,8,2
Please stop bringing up my mother.,1.2181818181818183,0.056203748457549704,55,43,12,0
That's when I had an upset stomach.,1.2181818181818183,0.061905266448664883,55,44,10,1
Mother’s signature,1.2181818181818183,0.061905266448664883,55,44,10,1
How'd you like it if I showed you a paper splattered with human blood?,1.2181818181818183,0.0719657096184116,55,46,6,3
An obvious forgery; You won't get me in the pen with that!,1.2181818181818183,0.061905266448664883,55,44,10,1
My father having sex with my mother,1.2181818181818183,0.0719657096184116,55,46,6,3
"""The color is good, but the symmetry bores me.""",1.2181818181818183,0.0671242332357016,55,45,8,2
You'll say I'm projecting but I see bad penmanship.,1.2181818181818183,0.0671242332357016,55,45,8,2
"This is not going to end well, is it?",1.2181818181818183,0.061905266448664883,55,44,10,1
Splooge,1.2181818181818183,0.0765013989040868,55,47,4,4
My dismal future.,1.2181818181818183,0.0719657096184116,55,46,6,3
I don't want to talk about it.,1.2181818181818183,0.0719657096184116,55,46,6,3
"I dunno doc, I think I see a frog",1.2173913043478262,0.07558495542263939,46,38,6,2
"Please, stop showing me the biggest mistakes of my life.",1.2173913043478262,0.06889776419712874,46,37,8,1
Me using.,1.2173913043478262,0.08172679524563294,46,39,4,3
I see my parents criticizing me.,1.2173913043478262,0.08172679524563294,46,39,4,3
