caption,mean,precision,votes,not_funny,somewhat_funny,funny
"Mr. Gluey, this is a Rorschach ink blot,
not a torn sheet for you to repair! We’ll discuss this next session.",1.1379310344827587,0.06516628844986672,29,25,4,0
Maybe.  Maybe not.,1.1379310344827587,0.08191275442520139,29,26,2,1
Alice. Dallas Alice.,1.1379310344827587,0.06516628844986672,29,25,4,0
"Don't know doc, I'm more of a Monet kinda guy",1.1379310344827587,0.06516628844986672,29,25,4,0
Is this going to be a blot on my career?,1.1379310344827587,0.06516628844986672,29,25,4,0
Is your species emotionally insane? That's the tenth dead baby you've shown me!,1.1379310344827587,0.08191275442520139,29,26,2,1
"Doctor,  please,  may I just have the results? Do I have colon cancer cancer or not?",1.1379310344827587,0.08191275442520139,29,26,2,1
"What is it with you making me spit onto paper, man?",1.1379310344827587,0.06516628844986672,29,25,4,0
"Thanks for squishing that bug for me. Now, can we please get back to talking about my anxiety?",1.1379310344827587,0.06516628844986672,29,25,4,0
I see a strong influence by Jackson Pollock.,1.1379310344827587,0.08191275442520139,29,26,2,1
It reminds me of a character on that “Welcome Back Kotter”  TV show.,1.1379310344827587,0.06516628844986672,29,25,4,0
That is so not me!,1.1379310344827587,0.06516628844986672,29,25,4,0
"You must not be doing well, doctor, with no couch and no real Rorschach's Test.",1.1379310344827587,0.06516628844986672,29,25,4,0
If you think of my mom. Why do you ask?,1.1379310344827587,0.08191275442520139,29,26,2,1
I peaked when I was 17. My work has only gotten worse since then.,1.1379310344827587,0.06516628844986672,29,25,4,0
Sorry but someone surprised me.,1.1379310344827587,0.06516628844986672,29,25,4,0
It's where I see myself in 10 years.,1.1379310344827587,0.06516628844986672,29,25,4,0
I think it’s for my audience to decide what it means.,1.1379310344827587,0.06516628844986672,29,25,4,0
I had nothing to do with King Charles and the Bloody pen.,1.1379310344827587,0.06516628844986672,29,25,4,0
"I just spill it.

What's to interpret?",1.1379310344827587,0.06516628844986672,29,25,4,0
"I feel the angst, I feel the fear - the terror, and I understand that my therapy rests in just being a regular mustard kind of guy.",1.1379310344827587,0.06516628844986672,29,25,4,0
"I know he’s dead!,
Why do you keep showing pictures of the accident?",1.1379310344827587,0.08191275442520139,29,26,2,1
Same as the last one.  I see my mother.,1.1379310344827587,0.08191275442520139,29,26,2,1
"Before I answer, how many readers will know what an ink bottle looks like?",1.1379310344827587,0.06516628844986672,29,25,4,0
It looks like an impending crash into the Inkblot Nebula.,1.1379310344827587,0.06516628844986672,29,25,4,0
I'm just trying to express what's inside me.,1.1379310344827587,0.06516628844986672,29,25,4,0
"I know, I know Dr. Schmidt.    It's not my greatest work.",1.1379310344827587,0.06516628844986672,29,25,4,0
"Yes, that's my handkerchief.",1.1379310344827587,0.06516628844986672,29,25,4,0
"Well, I had a little ""accident""",1.1379310344827587,0.08191275442520139,29,26,2,1
What is this... some kind of a test?,1.1379310344827587,0.06516628844986672,29,25,4,0
"Oh, my poor son!",1.1379310344827587,0.08191275442520139,29,26,2,1
My cousin Zeke after the unfortunate defenestration.,1.1379310344827587,0.06516628844986672,29,25,4,0
How do I overcome this blot on my career as a calligraphist?,1.1379310344827587,0.08191275442520139,29,26,2,1
"Doc, this is taking a lot outta me.",1.1379310344827587,0.06516628844986672,29,25,4,0
skin color of Disney actors.,1.1379310344827587,0.08191275442520139,29,26,2,1
"Yes, as a kid I was all over the place!",1.1379310344827587,0.08191275442520139,29,26,2,1
"How dare you, sir?",1.1379310344827587,0.08191275442520139,29,26,2,1
Brains again.,1.1379310344827587,0.06516628844986672,29,25,4,0
"I see a derivative piece of art, Doc. Is that what you want to hear?",1.1379310344827587,0.08191275442520139,29,26,2,1
You should be happy none of it got on your carpet.,1.1379310344827587,0.06516628844986672,29,25,4,0
"Doc, this is exactly why it's so hard for me to open up around others.",1.1379310344827587,0.06516628844986672,29,25,4,0
I can’t believe you’re showing me a pornographic picture!,1.1379310344827587,0.08191275442520139,29,26,2,1
I see the money my parents wasted on my art degree,1.1379310344827587,0.06516628844986672,29,25,4,0
...A BIC pen!,1.1379310344827587,0.06516628844986672,29,25,4,0
"Yes, it reminds me of every time I made my dad angry.",1.1379310344827587,0.06516628844986672,29,25,4,0
Where did you get that picture? That's my grandmother.,1.1379310344827587,0.06516628844986672,29,25,4,0
You'll say I'm projecting but I see bad penmanship.,1.1379310344827587,0.06516628844986672,29,25,4,0
I wouldn't this to be a stain on my record.,1.1379310344827587,0.06516628844986672,29,25,4,0
"Doc, I told you I find Rorschach's work offensive and highly subjective...",1.1379310344827587,0.08191275442520139,29,26,2,1
Butterfly? That’s my autobiography!,1.1379310344827587,0.06516628844986672,29,25,4,0
black raspberry,1.1379310344827587,0.06516628844986672,29,25,4,0
So you can see why I bottle things up. My mother was all over the place.,1.1379310344827587,0.06516628844986672,29,25,4,0
You really are drawing me out,1.1379310344827587,0.06516628844986672,29,25,4,0
"Again, just tears.",1.1379310344827587,0.08191275442520139,29,26,2,1
A damn shame.,1.1379310344827587,0.08191275442520139,29,26,2,1
"Okay. Not my best work,but I needed the money.",1.1379310344827587,0.08191275442520139,29,26,2,1
What do you mean ‘too self-aware’?,1.1379310344827587,0.06516628844986672,29,25,4,0
It's a breast-fed baby.,1.1379310344827587,0.06516628844986672,29,25,4,0
"I have to admit, I feel a certain kinship.",1.1379310344827587,0.08191275442520139,29,26,2,1
I see this is all my life amounts to...,1.1379310344827587,0.06516628844986672,29,25,4,0
That's what happens when he drops me.,1.1379310344827587,0.06516628844986672,29,25,4,0
"I got caught and I spilled, so what?",1.1379310344827587,0.09577449307991909,29,27,0,2
I do blot everything out.,1.1379310344827587,0.08191275442520139,29,26,2,1
I have no remorse. He got what he deserved.,1.1379310344827587,0.08191275442520139,29,26,2,1
I vomited. That’s all there is to it.,1.1379310344827587,0.06516628844986672,29,25,4,0
That's going to be you if I don't get a passing grade.,1.1379310344827587,0.06516628844986672,29,25,4,0
And just why does this make you feel empty?,1.1379310344827587,0.06516628844986672,29,25,4,0
"Uhhhhh, I don't know how my son's art work got mixed in there.",1.1379310344827587,0.09577449307991909,29,27,0,2
"Me, blowing my top.",1.1379310344827587,0.06516628844986672,29,25,4,0
Do I get indignant when YOU have a bloody nose?,1.1379310344827587,0.06516628844986672,29,25,4,0
I see my younger days,1.1379310344827587,0.06516628844986672,29,25,4,0
"Yes, that’s my first-born, why do you ask?",1.1379310344827587,0.08191275442520139,29,26,2,1
"My guts,spilled,all over the place!",1.1379310344827587,0.06516628844986672,29,25,4,0
That's nothin' but a street taco that didn't agree with me!,1.1379310344827587,0.06516628844986672,29,25,4,0
- An artist never explains his work,1.1379310344827587,0.08191275442520139,29,26,2,1
It's what's on the inside that counts.,1.1379310344827587,0.06516628844986672,29,25,4,0
"That's my daughter Emily, I poured everything into her.",1.1379310344827587,0.06516628844986672,29,25,4,0
"No, that's not her.",1.1379310344827587,0.08191275442520139,29,26,2,1
New Years Eve 1999.,1.1379310344827587,0.06516628844986672,29,25,4,0
Are you color blind?,1.1379310344827587,0.08191275442520139,29,26,2,1
It’s inside out,1.1379310344827587,0.06516628844986672,29,25,4,0
This looks like one of my farts—silent but splashy.,1.1379310344827587,0.08191275442520139,29,26,2,1
"It’s a-me, Mario!",1.1379310344827587,0.08191275442520139,29,26,2,1
i’m a changed man i promise,1.1379310344827587,0.08191275442520139,29,26,2,1
*sniff* Excuse me.,1.1379310344827587,0.08191275442520139,29,26,2,1
I think it’s a bit early to be discussing my mother.,1.1379310344827587,0.08191275442520139,29,26,2,1
Last night’s beef stew?,1.1379310344827587,0.08191275442520139,29,26,2,1
"Ah, yes my family history.",1.1379310344827587,0.06516628844986672,29,25,4,0
"It’s a bit literal, don’t you think?",1.1379310344827587,0.08191275442520139,29,26,2,1
"I see myself how I am, not how I want to be.",1.1379310344827587,0.06516628844986672,29,25,4,0
"What is this, Dr. Rorschach? Some kind of test?",1.1379310344827587,0.08191275442520139,29,26,2,1
Is that me?,1.1379310344827587,0.06516628844986672,29,25,4,0
I didn’t know I had it in me,1.1379310344827587,0.08191275442520139,29,26,2,1
I swear it was consensual.,1.1379310344827587,0.06516628844986672,29,25,4,0
Jerry!? Is that you!?,1.1379310344827587,0.08191275442520139,29,26,2,1
Your first ultrasound. I found it for your baby book.”,1.1379310344827587,0.06516628844986672,29,25,4,0
I see the obvious.,1.1379310344827587,0.06516628844986672,29,25,4,0
It's the same as the last one doc - it just looks like a person to me,1.1379310344827587,0.06516628844986672,29,25,4,0
Et tu Brutus,1.1379310344827587,0.08191275442520139,29,26,2,1
Don't get me started.,1.1379310344827587,0.08191275442520139,29,26,2,1
"It was an accident, don't read into it.",1.1379310344827587,0.08191275442520139,29,26,2,1
I don't know how to inkterpret this.,1.1379310344827587,0.08191275442520139,29,26,2,1
I don't appreciate you showing me pornography,1.1363636363636365,0.06966325746551963,44,40,2,2
"And when I finally do try to open up, all she returns is an abstract expression!",1.1363636363636365,0.05233358898302978,44,38,6,0
"I swear, I've never seen it before...do I need to call a lawyer?",1.1363636363636365,0.061610770067221085,44,39,4,1
When I spilled my guts I didn’t expect you to throw it back in my face.,1.1363636363636365,0.05233358898302978,44,38,6,0
It definitely is not a bat; I see myself.,1.135135135135135,0.07905373321974883,37,34,1,2
"OMG, that's one of my kids!",1.135135135135135,0.06890566910260519,37,33,3,1
"These sessions go so long, I just couldn't hold it any longer.",1.135135135135135,0.07905373321974883,37,34,1,2
Sponge Bob,1.135135135135135,0.05697797585888971,37,32,5,0
Looks like my latest squeeze…,1.135135135135135,0.06890566910260519,37,33,3,1
That looks like my uncle Ralph.,1.135135135135135,0.06890566910260519,37,33,3,1
I kept at it until it became popular.,1.135135135135135,0.06890566910260519,37,33,3,1
"Really doctor, all I see is a cigar.",1.135135135135135,0.06890566910260519,37,33,3,1
I don't think I've got it in me to do another one of these!,1.135135135135135,0.05697797585888971,37,32,5,0
"Yes, doctor Freud, that is a picture of my dear mother when she was young.",1.135135135135135,0.07905373321974883,37,34,1,2
Looks like the story of my life.,1.135135135135135,0.05697797585888971,37,32,5,0
And then it all came spilling out.,1.135135135135135,0.06890566910260519,37,33,3,1
"OH, GOD! NOT COVID",1.135135135135135,0.06890566910260519,37,33,3,1
It really speaks to something inside of me.,1.135135135135135,0.06890566910260519,37,33,3,1
I only see me?,1.135135135135135,0.06890566910260519,37,33,3,1
I came here to heal from my trauma.,1.135135135135135,0.05697797585888971,37,32,5,0
That’s my brother’s signature.,1.135135135135135,0.05697797585888971,37,32,5,0
It looks like my mother . . . .,1.135135135135135,0.05697797585888971,37,32,5,0
"As you can see, Mr. Blotswell, your wife has already signed the divorce papers.",1.135135135135135,0.06890566910260519,37,33,3,1
"Yes, we were engaged to be married.",1.135135135135135,0.07905373321974883,37,34,1,2
It's my birth certificate!,1.135135135135135,0.06890566910260519,37,33,3,1
"Perhaps a little indelicate, but it looks look something I might have coughed up.",1.135135135135135,0.05697797585888971,37,32,5,0
That looks just like my Uncle Fred!,1.135135135135135,0.06890566910260519,37,33,3,1
It’s either (a) the Big Bang or (b) something I just spilled.,1.135135135135135,0.05697797585888971,37,32,5,0
"Are you stalking my Instagram feed, Doc?",1.135135135135135,0.05697797585888971,37,32,5,0
"Sorry, they all remind me of my mother.",1.1333333333333333,0.0792686880439847,30,27,2,1
"With all due respect doctor, I’m just not ready to talk about my mother",1.1333333333333333,0.06312427686319992,30,26,4,0
I see my future and I don't like it.,1.1333333333333333,0.0792686880439847,30,27,2,1
Care to explain yourself?,1.1333333333333333,0.06312427686319992,30,26,4,0
A trigger warning would've been nice.,1.1333333333333333,0.06312427686319992,30,26,4,0
"Pussy. Pussy again. Doc, I'm tellin' ya, I can't think of nothin' else!",1.1333333333333333,0.06312427686319992,30,26,4,0
Another oddly symmetrical blood stain.,1.1333333333333333,0.06312427686319992,30,26,4,0
Okay I get it -- fountain pens are messy!,1.1333333333333333,0.06312427686319992,30,26,4,0
"I know what that is, I see it every day.",1.1333333333333333,0.0792686880439847,30,27,2,1
"Yeah, content with no form. Exactly like I feel inside.",1.1333333333333333,0.06312427686319992,30,26,4,0
I didn't do it! I swear!,1.1333333333333333,0.0792686880439847,30,27,2,1
"It's actually a compliment when you think about it.""",1.1333333333333333,0.0792686880439847,30,27,2,1
Sorry for that. It must have been something I ate.,1.1333333333333333,0.06312427686319992,30,26,4,0
Lost a lot of work when they started folding the paper in half.  Now all I see is white space.,1.1333333333333333,0.06312427686319992,30,26,4,0
"Yes, warrior. Stop milking the irony, Doc!",1.1333333333333333,0.06312427686319992,30,26,4,0
Uncle Irving. He was a real mess.,1.1333333333333333,0.0792686880439847,30,27,2,1
My ex-wife.,1.1333333333333333,0.0792686880439847,30,27,2,1
"Once Again, that is my cousin India Black.",1.1333333333333333,0.09264111117062017,30,28,0,2
"Me, obviously.",1.1333333333333333,0.06312427686319992,30,26,4,0
"Swear to God, it was like that when I came in.",1.1333333333333333,0.0792686880439847,30,27,2,1
It's Mom again.,1.1333333333333333,0.0792686880439847,30,27,2,1
"Do I seem unhappy or not? What does this inkblot suggest to you, doctor?",1.1333333333333333,0.06312427686319992,30,26,4,0
"...my nephew, Sherman.",1.1333333333333333,0.06312427686319992,30,26,4,0
Spleen again,1.1333333333333333,0.06312427686319992,30,26,4,0
I'm the only one who survived.,1.1333333333333333,0.0792686880439847,30,27,2,1
I see the endless frustration of forgotten user names and passwords.,1.1333333333333333,0.06312427686319992,30,26,4,0
Yeah that also reminds me of my mom,1.1333333333333333,0.06312427686319992,30,26,4,0
I just can't blot like I used to,1.1333333333333333,0.0792686880439847,30,27,2,1
You never sharted?,1.1333333333333333,0.0792686880439847,30,27,2,1
Looks like indigestion,1.1333333333333333,0.06312427686319992,30,26,4,0
I suggest pinching your nose if the spray doesn’t work,1.1333333333333333,0.06312427686319992,30,26,4,0
It's like you're revealing my insides!,1.1333333333333333,0.06312427686319992,30,26,4,0
When I said pass the ketchup I didn't mean literally,1.1333333333333333,0.06312427686319992,30,26,4,0
"Professor Rorschach, could I just borrow a pen so I can show you what I’m capable of, already?",1.1333333333333333,0.0792686880439847,30,27,2,1
It looks like a shitty diaper to me.,1.1333333333333333,0.06312427686319992,30,26,4,0
I see… what’s inside of me,1.1333333333333333,0.06312427686319992,30,26,4,0
"I don't know who Rorschach is, or why he plagiarized my blots!",1.1333333333333333,0.06312427686319992,30,26,4,0
I'm sorry. I just can't control myself.,1.1333333333333333,0.0792686880439847,30,27,2,1
Ink think shrink,1.1333333333333333,0.06312427686319992,30,26,4,0
"Yes, that one looks like my mother too",1.1333333333333333,0.06312427686319992,30,26,4,0
Is this a test?,1.1333333333333333,0.0792686880439847,30,27,2,1
"That's me, listening to Trump talk.",1.1333333333333333,0.0792686880439847,30,27,2,1
"Mom, when Dad forgets their anniversary.",1.1333333333333333,0.06312427686319992,30,26,4,0
MY SON IS A SEINFELD EPISODE!,1.1333333333333333,0.06312427686319992,30,26,4,0
That reminds me of when I had urinary problem.,1.1333333333333333,0.06312427686319992,30,26,4,0
'It's not mine. I never touched her!',1.1333333333333333,0.09264111117062017,30,28,0,2
"Oh, I remember mama….",1.1333333333333333,0.06312427686319992,30,26,4,0
I think it's something I ate.,1.1333333333333333,0.0792686880439847,30,27,2,1
"It's not you,it's me.",1.1333333333333333,0.0792686880439847,30,27,2,1
"Indeed, a stain on my good name.",1.1333333333333333,0.06312427686319992,30,26,4,0
"I had COVID but I'm much better now, thank you.",1.1333333333333333,0.0792686880439847,30,27,2,1
These days I feel unglued.,1.1333333333333333,0.06312427686319992,30,26,4,0
"What does it remind me of? Ink, of course!",1.1333333333333333,0.06312427686319992,30,26,4,0
I'm pretty sure that is crazy uncle Jeff.,1.1333333333333333,0.0792686880439847,30,27,2,1
I miss Julie...,1.1333333333333333,0.06312427686319992,30,26,4,0
These images are disturbingly violent.,1.1333333333333333,0.06312427686319992,30,26,4,0
"Doc, this whole 'look within myself' thing is starting to freak me out.",1.1333333333333333,0.0792686880439847,30,27,2,1
"I see short term success, followed by long term ridicule where you become a laughingstock.",1.1333333333333333,0.0792686880439847,30,27,2,1
"That's my tissue, doc.",1.1333333333333333,0.06312427686319992,30,26,4,0
I spill my guts out to you and you shove it in my face?,1.1333333333333333,0.06312427686319992,30,26,4,0
Too Freudian.,1.1333333333333333,0.0792686880439847,30,27,2,1
"Okay, you got me.  I have mommy issues.",1.1333333333333333,0.0792686880439847,30,27,2,1
"I didn’t do it!   I told you, King Charles did it!!",1.1333333333333333,0.06312427686319992,30,26,4,0
Also my mother's face.,1.1333333333333333,0.0792686880439847,30,27,2,1
That's the real me.  Everything else is just words.,1.1333333333333333,0.0792686880439847,30,27,2,1
I know Doc! I shouldn’t cry over spilled milk chocolate!,1.1333333333333333,0.0792686880439847,30,27,2,1
Picnic overreach.,1.1333333333333333,0.06312427686319992,30,26,4,0
"Do you want me to tell you what it means, or how it’s pronounced?",1.1333333333333333,0.0792686880439847,30,27,2,1
OH NO!  Now she’ll never grow up to have a bottle of her own!,1.1333333333333333,0.0792686880439847,30,27,2,1
Sorry about your paper but you did ask me to spill my guts.,1.1333333333333333,0.0792686880439847,30,27,2,1
Octo-pussy,1.1333333333333333,0.0792686880439847,30,27,2,1
I told him not to ink and drive,1.1333333333333333,0.0792686880439847,30,27,2,1
If you think it’s modern art it’s snot,1.1333333333333333,0.06312427686319992,30,26,4,0
"I'm sorry, but I just had to burp!",1.1333333333333333,0.0792686880439847,30,27,2,1
"Don't overanalyse it, doc - an ink blot is just an ink blot. Period.",1.1333333333333333,0.06312427686319992,30,26,4,0
"I don't recognize that evidence detective, I can't eventh -INK!",1.1333333333333333,0.06312427686319992,30,26,4,0
ONE TIME I sneeze without my handkerchief and you guys go all psycho on me.,1.1333333333333333,0.0792686880439847,30,27,2,1
And now I'll commence with reading your mother's will.,1.1333333333333333,0.0792686880439847,30,27,2,1
that one looks like my sister.,1.1333333333333333,0.06312427686319992,30,26,4,0
"My chair, at the moment.""",1.1333333333333333,0.0792686880439847,30,27,2,1
I see a partnership. I make them. You sell them.,1.1333333333333333,0.0792686880439847,30,27,2,1
I put that sh*t on everything.,1.1333333333333333,0.09264111117062017,30,28,0,2
Ralph!! That’s my brother Ralph! Where did you find him???,1.1333333333333333,0.09264111117062017,30,28,0,2
"What are you doing with my memoirs?""",1.1333333333333333,0.06312427686319992,30,26,4,0
"Doctor:  Keep in mind,not everything is the byproduct of your mother.",1.1333333333333333,0.06312427686319992,30,26,4,0
"Yes, I knew him — before his dreadful accident. Jolly good fellow, if you ask me.",1.1333333333333333,0.06312427686319992,30,26,4,0
Is this supposed to mean something?,1.1333333333333333,0.0792686880439847,30,27,2,1
It’s the last time I saw my mother.,1.1333333333333333,0.06312427686319992,30,26,4,0
"Umh,Ink?!  Looks like Jerome.  Yes,definitely Jerome.  Oh my,is he ok?",1.1333333333333333,0.06312427686319992,30,26,4,0
Is that how you humans waste my bodily fluid!?,1.1333333333333333,0.06312427686319992,30,26,4,0
Why do you therapists always torment me with pictures of mothers nursing their babies?,1.1333333333333333,0.0792686880439847,30,27,2,1
You saved my tissue?,1.1333333333333333,0.06312427686319992,30,26,4,0
I feel drained.,1.1333333333333333,0.06312427686319992,30,26,4,0
Let’s discuss our buying the latest upgrade of the auto-correct software.,1.1333333333333333,0.09264111117062017,30,28,0,2
Makes me think of Mom.,1.1333333333333333,0.0792686880439847,30,27,2,1
"Alas, poor Sigmund! I knew him, a waterman: a fountain 
of infinite scribe.",1.1333333333333333,0.06312427686319992,30,26,4,0
I’m a drip.,1.1333333333333333,0.06312427686319992,30,26,4,0
My ultrasound,1.1333333333333333,0.06312427686319992,30,26,4,0
Patient shows signs of extreme narcissism.,1.1333333333333333,0.09264111117062017,30,28,0,2
Going from a Fountain Pen to a Blot has my self worth undermined,1.1333333333333333,0.06312427686319992,30,26,4,0
I’m afraid we need to take a DNA sample.,1.1333333333333333,0.06312427686319992,30,26,4,0
"I admit that is my inkblot, but I did not do the crime.",1.1333333333333333,0.06312427686319992,30,26,4,0
I see incontinence and old age.,1.1333333333333333,0.0792686880439847,30,27,2,1
I'm sorry but we can't approve your loan. None of your signatures match up.,1.1333333333333333,0.06312427686319992,30,26,4,0
An I missing something?,1.1333333333333333,0.06312427686319992,30,26,4,0
I see a horse finishing last at the Preakness.,1.1333333333333333,0.06312427686319992,30,26,4,0
Is it too late to mention that my cousin is Whiteout?,1.1333333333333333,0.06312427686319992,30,26,4,0
I don't remember leaving a specimen!,1.1333333333333333,0.06312427686319992,30,26,4,0
"What does my ultrasound tell you, Doctor?",1.1333333333333333,0.0792686880439847,30,27,2,1
"I'd say it looks like my father, but he was more the ""disappearing"" type.",1.1333333333333333,0.06312427686319992,30,26,4,0
That's the Ninth Amendment,1.1333333333333333,0.0792686880439847,30,27,2,1
"Still Larry, after the fall.",1.1333333333333333,0.06312427686319992,30,26,4,0
Poor Uncle Al,1.1333333333333333,0.0792686880439847,30,27,2,1
"I put my blood, sweat, and tears into it.",1.1333333333333333,0.0792686880439847,30,27,2,1
That would be a shart.,1.1333333333333333,0.06312427686319992,30,26,4,0
"'Gross,  just gross!' Was the first thing that popped into my head!",1.1333333333333333,0.06312427686319992,30,26,4,0
I see what you're trying to do here!,1.1333333333333333,0.06312427686319992,30,26,4,0
I used poor judgement in this message to anyone other than my wife in any kind of flirtatious manner.,1.1333333333333333,0.06312427686319992,30,26,4,0
"‘Yes, that’s my anxiety’",1.1333333333333333,0.06312427686319992,30,26,4,0
I usually only have to get up once at night.,1.1333333333333333,0.06312427686319992,30,26,4,0
What I see in it is what it is! I Made that stain myself!,1.1333333333333333,0.06312427686319992,30,26,4,0
I came. I saw. I concurred.,1.1333333333333333,0.0792686880439847,30,27,2,1
"It’s the TRUTH, you coward.",1.1333333333333333,0.06312427686319992,30,26,4,0
I did not have sexual relations with that piece of paper,1.1333333333333333,0.06312427686319992,30,26,4,0
Auntie Helen,1.1333333333333333,0.0792686880439847,30,27,2,1
It looks like someone's lid isn't  screwed on too tight.,1.131578947368421,0.05557219020090345,38,33,5,0
When I see that it reminds me that I am out of Depends.,1.131578947368421,0.05557219020090345,38,33,5,0
That’s from when I was a sperm donor.,1.131578947368421,0.05557219020090345,38,33,5,0
"Gasp...""Mom!""",1.131578947368421,0.06716206838991055,38,34,3,1
"Yes.  That was my mother, and Dr. Rorschach will rue the day!",1.131578947368421,0.05557219020090345,38,33,5,0
The blood of my ancestors is upon you!,1.131578947368421,0.05557219020090345,38,33,5,0
I see you're not waiting till I'm dry.,1.131578947368421,0.0770273882271537,38,35,1,2
"That’s my best effort, sir!",1.131578947368421,0.06716206838991055,38,34,3,1
"Zo, you zay zis reminds you of your vodder?",1.131578947368421,0.06716206838991055,38,34,3,1
That’s my intake paperwork.,1.131578947368421,0.06716206838991055,38,34,3,1
"I know you'd like to be a psychologist when you grow up, but putting Rorschach ink blots in every library book is not acceptable.",1.131578947368421,0.06716206838991055,38,34,3,1
This one also makes me feel empty.,1.131578947368421,0.06716206838991055,38,34,3,1
I'm sick of putting myself out there only to be misinterpreted.,1.131578947368421,0.06716206838991055,38,34,3,1
This is from my series of abstract drawings “Blot”. I’m not sure why I need to be analyzed.,1.131578947368421,0.05557219020090345,38,33,5,0
"Yeah, I know, Shaq’s paintings need some work.",1.1304347826086956,0.06672964888823969,46,42,2,2
Roadkill,1.1290322580645162,0.06120537406777503,31,27,4,0
The forensics just came back. We have a problem.,1.1290322580645162,0.07678955299508436,31,28,2,1
My world is a sea of gray.,1.1290322580645162,0.07678955299508436,31,28,2,1
"That's just a drop in the bucket""",1.1290322580645162,0.06120537406777503,31,27,4,0
Also my mother...,1.1290322580645162,0.07678955299508436,31,28,2,1
And that one looks like my sister's baby Natalie.,1.1290322580645162,0.06120537406777503,31,27,4,0
Crime scene.,1.1290322580645162,0.07678955299508436,31,28,2,1
