caption,mean,precision,votes,not_funny,somewhat_funny,funny
Makes me think of Mom.,1.1521739130434783,0.06927778784183837,46,41,3,2
I swear that's not my splotch.,1.1521739130434783,0.07593151824596947,46,42,1,3
Why is everything always about my mother!,1.1521739130434783,0.053544791889597564,46,39,7,0
I guess you will also tell me what to do with my body,1.1521739130434783,0.053544791889597564,46,39,7,0
I’ve really made a mess of things,1.1521739130434783,0.053544791889597564,46,39,7,0
I’ve never had someone see themselves in a rorschach test before.,1.1521739130434783,0.06927778784183837,46,41,3,2
I'm actually quite proud of that part of my body of work; I don't consider that incident a blot on my copybook.,1.1521739130434783,0.053544791889597564,46,39,7,0
"Don’t judge me, we all did weird things during lockdown",1.1521739130434783,0.061913070618242964,46,40,5,1
Maybe I’m over-inking things,1.1521739130434783,0.053544791889597564,46,39,7,0
I'm tired of myself enough,1.1521739130434783,0.06927778784183837,46,41,3,2
Nocturnal emission.,1.150943396226415,0.0732622900674831,53,49,0,4
"OK, so I’d hooked up with this Montblanc 
in Paris (Gawd, I was so full of myself 
back then) ….""",1.150943396226415,0.056482695855704056,53,46,6,1
"Obviously, it was both a difficult and exciting time in my career.",1.150943396226415,0.06257782623312075,53,47,4,2
"As you can see, Mr. Blotswell, your wife has already signed the divorce papers.",1.150943396226415,0.06257782623312075,53,47,4,2
The Holocaust.,1.15,0.057177187489686566,40,34,6,0
"No, that's not sublimation. I'm blotting it out.",1.15,0.07637626158259735,40,36,2,2
"Rorschach, what a quack.",1.15,0.057177187489686566,40,34,6,0
A trigger warning would've been nice.,1.15,0.057177187489686566,40,34,6,0
Bless you.,1.15,0.057177187489686566,40,34,6,0
I didn't do it! I swear!,1.15,0.06746319034319422,40,35,4,1
"Yes, I was pretty emotional that day.",1.15,0.06746319034319422,40,35,4,1
"Ah, Ah . . CHOO!",1.15,0.06746319034319422,40,35,4,1
"When you’re a nipple, everything looks like a mouth.",1.15,0.06746319034319422,40,35,4,1
"I keep telling you, they all look like my mother.",1.15,0.057177187489686566,40,34,6,0
My grandpa on his deathbed.,1.15,0.057177187489686566,40,34,6,0
It's my mother after the fountain pen explosion.,1.15,0.06746319034319422,40,35,4,1
Oh!  I thought for a moment that it was one of my offspring.,1.15,0.07637626158259735,40,36,2,2
That's just like looking in the mirror.,1.15,0.057177187489686566,40,34,6,0
Gazuntite!,1.15,0.07637626158259735,40,36,2,2
"What do I see?
I see my past. I see my present. I see my future. I also see why I’m running about a pint short",1.15,0.07637626158259735,40,36,2,2
I unwind on Fridays.,1.15,0.057177187489686566,40,34,6,0
So you’re saying that what I’ve been searching for has been inside of  me all along?,1.15,0.06746319034319422,40,35,4,1
"A ""bless you"" wouldn't hurt.",1.15,0.057177187489686566,40,34,6,0
Are you trying to blot my reputation?,1.15,0.07637626158259735,40,36,2,2
That’s my signature.,1.15,0.06746319034319422,40,35,4,1
"What is it with you making me spit onto paper, man?",1.15,0.057177187489686566,40,34,6,0
Me. Spit up.  Again. Sigh. Babies can't hold their milk.,1.15,0.06746319034319422,40,35,4,1
That’s not mine. I’m a lighter shade of pale blue.,1.15,0.06746319034319422,40,35,4,1
"Mom, when Dad forgets their anniversary.",1.15,0.057177187489686566,40,34,6,0
Mother?,1.15,0.06746319034319422,40,35,4,1
Apparently the copyright on the original Rorschach cards has expired.,1.15,0.06746319034319422,40,35,4,1
All I see is my imminent death,1.15,0.06746319034319422,40,35,4,1
My life is a mess.,1.15,0.06746319034319422,40,35,4,1
I see my relatives.  Drop by drop.,1.15,0.057177187489686566,40,34,6,0
"As I am an early model of typewriter cleaning fluid Doc, you should know, already, that inkblots are my specialty, and I might add, are therefore part of my problem!",1.15,0.06746319034319422,40,35,4,1
That's a picture of me floating above my body.,1.15,0.06746319034319422,40,35,4,1
It looks a lot like Aunt Betty!,1.15,0.06746319034319422,40,35,4,1
The splatter tells its own tale.,1.15,0.06746319034319422,40,35,4,1
"It was Covid 19, man.  I couldn't find any toilet paper either.",1.15,0.057177187489686566,40,34,6,0
That is a poor picture. My mother was beautiful.,1.15,0.057177187489686566,40,34,6,0
"Sometimes running out of ink, is just running out of ink",1.15,0.07637626158259735,40,36,2,2
Why do you insist on bringing up my childhood?,1.15,0.06746319034319422,40,35,4,1
She said she wanted a slick pic,1.15,0.057177187489686566,40,34,6,0
I see a suicide note.,1.15,0.06746319034319422,40,35,4,1
M . . . m . . . m . . . mom?,1.15,0.07637626158259735,40,36,2,2
Am I having a stroke?,1.15,0.057177187489686566,40,34,6,0
You don't see soft shell crab almandine?,1.15,0.057177187489686566,40,34,6,0
"You're pissing me off, Ted",1.15,0.07637626158259735,40,36,2,2
I dont want to talk about my mother any more.,1.15,0.07637626158259735,40,36,2,2
What advice do you wish you could give to your younger self?,1.15,0.06746319034319422,40,35,4,1
I spilled some ink. It looks like a bomb went off. So what?,1.15,0.07637626158259735,40,36,2,2
Are you listening? I’m spilling my guts here.,1.15,0.06746319034319422,40,35,4,1
I give it one rotten tomato.,1.15,0.06746319034319422,40,35,4,1
Tom Cruise.,1.15,0.06746319034319422,40,35,4,1
I see my parents fighting,1.15,0.057177187489686566,40,34,6,0
"I""ll never forget the day my father escaped from the pen.",1.15,0.06746319034319422,40,35,4,1
Going from a Fountain Pen to a Blot has my self worth undermined,1.15,0.06746319034319422,40,35,4,1
You can't tweet without it.,1.15,0.07637626158259735,40,36,2,2
Do you want me to spill my guts or not?,1.15,0.057177187489686566,40,34,6,0
I can't read that.,1.15,0.07637626158259735,40,36,2,2
"I’m sorry, I have a cold.",1.15,0.06746319034319422,40,35,4,1
Does your family have a history of childhood bed-wetting?,1.15,0.07637626158259735,40,36,2,2
"‘Yes, that’s my anxiety’",1.15,0.06746319034319422,40,35,4,1
It’s always sex with you shrinks.,1.15,0.06746319034319422,40,35,4,1
So THOSE are the “notes” you’re taking while I’m telling you I want to blow my brains out?!?,1.1492537313432836,0.0572778043940446,67,60,4,3
Are you afraid to tell me the truth?,1.148936170212766,0.06786504677504612,47,42,3,2
A butterfly...,1.148936170212766,0.06786504677504612,47,42,3,2
Yet again! A blood-spattered mess.,1.148936170212766,0.060667909091839334,47,41,5,1
I don’t see how showing me pictures of the accident is going to help me blot it from my memory .,1.148936170212766,0.06786504677504612,47,42,3,2
Hmmm....actually Doc I think it's my turn to ask you that question.,1.148936170212766,0.060667909091839334,47,41,5,1
I see Cousin George...,1.148936170212766,0.060667909091839334,47,41,5,1
Narcissistic Personality Disorder,1.148936170212766,0.060667909091839334,47,41,5,1
I see the inner pain of a once-beloved writing mate.,1.148936170212766,0.06786504677504612,47,42,3,2
That was after my first divorce.,1.148936170212766,0.052493102531400895,47,40,7,0
I'm not as well as I look.,1.148936170212766,0.052493102531400895,47,40,7,0
You call it an inkblot. I call it Mommie Dearest.,1.148936170212766,0.06786504677504612,47,42,3,2
Don't blame me. You are the one with the dirty pictures!,1.148936170212766,0.052493102531400895,47,40,7,0
I didn't come here to discuss my incontinence issues...,1.148936170212766,0.060667909091839334,47,41,5,1
So your saying my bloodwork indicates a repressed urge to do unspeakable things to my parents?,1.148936170212766,0.060667909091839334,47,41,5,1
The world is my mirror.,1.148936170212766,0.060667909091839334,47,41,5,1
Um ...Vomit?,1.148936170212766,0.060667909091839334,47,41,5,1
"I couldn't help myself. It's like an obsession.
Whenever I see a blank piece of paper...",1.148936170212766,0.060667909091839334,47,41,5,1
"Me, without the bottle.",1.148936170212766,0.06786504677504612,47,42,3,2
"A mouth, with sharp teeth.",1.148936170212766,0.052493102531400895,47,40,7,0
I feel my talents are not being used to their true potential,1.148936170212766,0.07436890448287317,47,43,1,3
"Yeah, those are my kids",1.148936170212766,0.060667909091839334,47,41,5,1
"Well, I see a very perverted psychologist if I’m being honest.",1.148936170212766,0.060667909091839334,47,41,5,1
Chocolate Milk,1.148936170212766,0.052493102531400895,47,40,7,0
Excrement!,1.148936170212766,0.060667909091839334,47,41,5,1
This one makes me feel very sad - it reminds me of the end of a relative who fell in a total spill.,1.148936170212766,0.052493102531400895,47,40,7,0
"Doc,you know I'm not ready to talk about her yet.",1.148936170212766,0.06786504677504612,47,42,3,2
That looks just like my Uncle Fred!,1.148936170212766,0.06786504677504612,47,42,3,2
How does spilling my guts improve my condition?,1.148936170212766,0.052493102531400895,47,40,7,0
Drunk splat,1.148936170212766,0.06786504677504612,47,42,3,2
"'Gross,  just gross!' Was the first thing that popped into my head!",1.148936170212766,0.052493102531400895,47,40,7,0
You told me it happens to everyone.,1.148936170212766,0.07436890448287317,47,43,1,3
Your first ultrasound. I found it for your baby book.”,1.148936170212766,0.052493102531400895,47,40,7,0
Post Roe vs Wade.,1.1481481481481481,0.06147162996855134,54,48,4,2
My first spill. What a wonderful memory!,1.1481481481481481,0.04879689797371372,54,46,8,0
It looks a lot like when my uncle Indigo dropped off the shelf at the printers.,1.1481481481481481,0.06147162996855134,54,48,4,2
Can I please have another tissue?,1.1481481481481481,0.06147162996855134,54,48,4,2
I’m keeping my copay this week.,1.1475409836065573,0.05140679705526445,61,53,7,1
I couldn't hold it in.,1.146341463414634,0.06589881017612832,41,36,4,1
Thanks,1.146341463414634,0.07457992610449105,41,37,2,2
You think I need help? You're the one talking to an oversized ink bottle.,1.146341463414634,0.06589881017612832,41,36,4,1
That one is also the spectre of my death,1.146341463414634,0.07457992610449105,41,37,2,2
"My son, Rorschach! I filed a missing persons report.",1.146341463414634,0.06589881017612832,41,36,4,1
"But is it art, Dr. Rorschach?",1.146341463414634,0.06589881017612832,41,36,4,1
I see the bottle as half empty.,1.146341463414634,0.05588506945068103,41,35,6,0
I was having a bad day,1.146341463414634,0.06589881017612832,41,36,4,1
My parents!,1.146341463414634,0.06589881017612832,41,36,4,1
It's the 1996 U.S. women's Olympic gymnastics team.,1.146341463414634,0.07457992610449105,41,37,2,2
I feel used.,1.146341463414634,0.05588506945068103,41,35,6,0
Can I be transparent with you?,1.146341463414634,0.06589881017612832,41,36,4,1
"Clearly, you're the one who needs help, doc.",1.146341463414634,0.05588506945068103,41,35,6,0
"No, that's not my dropper-print, and I'm not taking a polygraph!",1.146341463414634,0.06589881017612832,41,36,4,1
Looks like before I was in a well,1.146341463414634,0.06589881017612832,41,36,4,1
I see myself in black&white.,1.146341463414634,0.07457992610449105,41,37,2,2
Where did you find that picture of my Mom?,1.146341463414634,0.06589881017612832,41,36,4,1
This one also looks like my mother.,1.146341463414634,0.06589881017612832,41,36,4,1
My first born.,1.146341463414634,0.07457992610449105,41,37,2,2
It reminds me of a character on that “Welcome Back Kotter”  TV show.,1.146341463414634,0.05588506945068103,41,35,6,0
Your missing hairpiece?,1.146341463414634,0.07457992610449105,41,37,2,2
I peaked when I was 17. My work has only gotten worse since then.,1.146341463414634,0.05588506945068103,41,35,6,0
I think you might be projecting.,1.146341463414634,0.06589881017612832,41,36,4,1
"Sorry, I just blew my top.",1.146341463414634,0.06589881017612832,41,36,4,1
I feel like this is a hint.,1.146341463414634,0.05588506945068103,41,35,6,0
I was younger and needed the money.,1.146341463414634,0.06589881017612832,41,36,4,1
I love it when you talk dirty.,1.146341463414634,0.05588506945068103,41,35,6,0
"I see a splatter commemorating the end of ink, the bridge to what has become an endless and seemingly futile cycle of writing, revising, and changing printer cartridges.",1.146341463414634,0.06589881017612832,41,36,4,1
Murderer!,1.146341463414634,0.06589881017612832,41,36,4,1
"Oh, my poor son!",1.146341463414634,0.06589881017612832,41,36,4,1
"Uncle Roy, may he rest in peace.",1.146341463414634,0.06589881017612832,41,36,4,1
I see a stain on my reputation.,1.146341463414634,0.05588506945068103,41,35,6,0
My first period.,1.146341463414634,0.06589881017612832,41,36,4,1
I see a person sitting at a desk holding up an inkblot.,1.146341463414634,0.05588506945068103,41,35,6,0
"How long do I have, Doc?",1.146341463414634,0.06589881017612832,41,36,4,1
Rohrschach test? Without me he'd never have made it!,1.146341463414634,0.07457992610449105,41,37,2,2
I want an attorney.,1.146341463414634,0.06589881017612832,41,36,4,1
It looks like a case of hit and run to me.,1.146341463414634,0.05588506945068103,41,35,6,0
"Let's make a deal. I'll tell you what I see, and you tell me where you were the night my sister disappeared.",1.146341463414634,0.07457992610449105,41,37,2,2
I had a cousin who became an empty ink bottle.,1.146341463414634,0.06589881017612832,41,36,4,1
Now you're just being cruel...,1.146341463414634,0.06589881017612832,41,36,4,1
"Yeah,that one’s my mother too.",1.146341463414634,0.06589881017612832,41,36,4,1
"Then he said ""Goodbye cruel world"".  And that's all I have left to remember him by.",1.146341463414634,0.06589881017612832,41,36,4,1
Would you tell him to stop calling me Daddy?,1.146341463414634,0.06589881017612832,41,36,4,1
I used to be a poly-blot,1.146341463414634,0.06589881017612832,41,36,4,1
Why do you shrinks always blame me?,1.146341463414634,0.05588506945068103,41,35,6,0
"Yes, that is my Uncle Marvin.",1.146341463414634,0.05588506945068103,41,35,6,0
Sorry Dr. Rorschach. I didn't mean it. It was just a sneeze.,1.146341463414634,0.06589881017612832,41,36,4,1
"I drip, therefore I am.",1.146341463414634,0.05588506945068103,41,35,6,0
We got a blot to talk about.,1.146341463414634,0.06589881017612832,41,36,4,1
Jerry!? Is that you!?,1.146341463414634,0.06589881017612832,41,36,4,1
"Doc, my head must not be screwed on right.",1.146341463414634,0.06589881017612832,41,36,4,1
"Doc, I can't answer. I've Spilled my Guts too many times !",1.1458333333333333,0.0665085669662596,48,43,3,2
"I know Dr Freud, but it’s the best self portrait I could do",1.1458333333333333,0.05947154493714119,48,42,5,1
I see my life flashing before my eyes.,1.1458333333333333,0.05148145136372292,48,41,7,0
"I really spilled my guts out this time…didn’t I, Doc?",1.1458333333333333,0.05947154493714119,48,42,5,1
"What can I say, I made a mistake",1.1458333333333333,0.05148145136372292,48,41,7,0
What does that say to me? It says my head isn't screwed on tight. That's why I'm here.,1.1458333333333333,0.05148145136372292,48,41,7,0
"I don't know what it means, either.  It's the best I can do.",1.1458333333333333,0.0665085669662596,48,43,3,2
Auntie Tusche from 2012 ...,1.1458333333333333,0.05148145136372292,48,41,7,0
That’s my oldest boy. Very successful. He’s always in the paper.,1.1458333333333333,0.05148145136372292,48,41,7,0
My cousin.,1.1458333333333333,0.05947154493714119,48,42,5,1
"Just like his dad, A drip off the old blot.",1.1458333333333333,0.0665085669662596,48,43,3,2
"Sorry, all I see is an ink blot…. Hey!  You messin’ with me?",1.1458333333333333,0.05947154493714119,48,42,5,1
Same as the others…mom going back to the office,1.1458333333333333,0.0665085669662596,48,43,3,2
No one sees my art the way I see it.,1.1458333333333333,0.05947154493714119,48,42,5,1
"Again, looks like my father. You should be 
picking up on a theme here.",1.1458333333333333,0.05947154493714119,48,42,5,1
What do I see?  I see my father's drinking after my mother left him for a ball point.,1.1458333333333333,0.05947154493714119,48,42,5,1
"Well, you did say that this is where I could spill my guts...",1.1458333333333333,0.0665085669662596,48,43,3,2
ONE TIME I sneeze without my handkerchief and you guys go all psycho on me.,1.1458333333333333,0.05947154493714119,48,42,5,1
ACCIDENT.,1.1458333333333333,0.05947154493714119,48,42,5,1
It’s just me! Ya know? It’s who I am!,1.1458333333333333,0.05947154493714119,48,42,5,1
I see someone misusing me.,1.1458333333333333,0.05947154493714119,48,42,5,1
Why are you bringing up my mother again?,1.1458333333333333,0.05947154493714119,48,42,5,1
Yes! It was Rorschach! He asked me to do it!,1.1458333333333333,0.0665085669662596,48,43,3,2
"All I see is my parents fighting.""",1.1458333333333333,0.05947154493714119,48,42,5,1
I ran out of socks.,1.1458333333333333,0.05148145136372292,48,41,7,0
It reminds me of my younger days.,1.1458333333333333,0.05148145136372292,48,41,7,0
I couldn't find the bathroom.,1.1458333333333333,0.05947154493714119,48,42,5,1
Oh geez not this again,1.1458333333333333,0.0665085669662596,48,43,3,2
*sniff* Excuse me.,1.1458333333333333,0.0665085669662596,48,43,3,2
"Again. It’s my mother. Look, what are you tryin’ to get at?",1.1458333333333333,0.05947154493714119,48,42,5,1
"Daddy?""  @silverlb5",1.1458333333333333,0.0665085669662596,48,43,3,2
"Atchoo! Oh, sorry.",1.1458333333333333,0.05947154493714119,48,42,5,1
won’t you use tissue like everyone else for f*** sake ?,1.1458333333333333,0.05947154493714119,48,42,5,1
We've already talked about my mother.,1.1454545454545455,0.0604037025766709,55,49,4,2
I'm sorry.  I just couldn't hold it in any longer.,1.1454545454545455,0.0604037025766709,55,49,4,2
Yikes! Her parents must be proud.,1.1454545454545455,0.0604037025766709,55,49,4,2
"You’re wasting your time, doc—it all looks like loose-lid spillage to me.",1.1454545454545455,0.0604037025766709,55,49,4,2
"I swear, I've never seen it before...do I need to call a lawyer?",1.1451612903225807,0.050626817657001666,62,54,7,1
I have an inkling that I’m not going to pass with flying colors,1.1428571428571428,0.0644049739048166,42,37,4,1
"I know what that is, I see it every day.",1.1428571428571428,0.07267814558130979,35,31,3,1
"Dr. Rorschach, Stop it! I don't go around showing people your mistakes!",1.1428571428571428,0.0644049739048166,42,37,4,1
Poorly applied glue.,1.1428571428571428,0.0644049739048166,42,37,4,1
Are you sure that's appropriate?,1.1428571428571428,0.050507627227610534,49,42,7,0
"Your kidding right?  Pictures of spiders? Doc, I've got real lip problems at home!",1.1428571428571428,0.05464943254828616,42,36,6,0
I know—there's no use crying.,1.1428571428571428,0.05464943254828616,42,36,6,0
My girl would never do a centerfold.,1.1428571428571428,0.05464943254828616,42,36,6,0
"I'm sorry, Dr. Rorschach. I did that in a moment of angst.",1.1428571428571428,0.0644049739048166,42,37,4,1
"Yes, I remember, it was terrible. Some guy named Rorschach
smashed my grandma against a wall.",1.1428571428571428,0.07267814558130979,35,31,3,1
Oh my gosh! That's my sister.,1.1428571428571428,0.05832118435198043,49,43,5,1
"Oh, Dear.  That's my youngest.  She never found meaning.",1.1428571428571428,0.07286591006438153,42,38,2,2
"I'm being abused""",1.1428571428571428,0.07267814558130979,35,31,3,1
I definitely see a lot of me in there.,1.1428571428571428,0.07267814558130979,35,31,3,1
Self-loathing,1.1428571428571428,0.0644049739048166,42,37,4,1
I swear…It was just an accident!,1.1428571428571428,0.050507627227610534,49,42,7,0
"In the dream, it's me in all those pictures.",1.1428571428571428,0.0644049739048166,42,37,4,1
Again... my mother.,1.1428571428571428,0.0644049739048166,42,37,4,1
"Well, what were you expecting?",1.1428571428571428,0.05464943254828616,42,36,6,0
When I said pass the ketchup I didn't mean literally,1.1428571428571428,0.05464943254828616,42,36,6,0
You must be obsessed with pornography.,1.1428571428571428,0.0644049739048166,42,37,4,1
"Splat, splat, splat. Always my fault.",1.1428571428571428,0.0644049739048166,42,37,4,1
"Grandma, is that you?",1.1428571428571428,0.05464943254828616,42,36,6,0
Looks like a person threw up on the paper.,1.1428571428571428,0.060012003601200466,35,30,5,0
I see you're not waiting till I'm dry.,1.1428571428571428,0.07142857142857142,49,45,1,3
"Well, that's not what I see.",1.1428571428571428,0.05464943254828616,42,36,6,0
"Sorry, it's the ragweed.",1.1428571428571428,0.08344330478861454,35,32,1,2
Looks like my little brother Willie when Mom brought him home from the hospital.,1.1428571428571428,0.0644049739048166,42,37,4,1
"Well, I don’t wear socks.",1.1428571428571428,0.0644049739048166,42,37,4,1
Suicide!,1.1428571428571428,0.0644049739048166,42,37,4,1
"Yes Maury I confess.
I AM THE FATHER",1.1428571428571428,0.08344330478861454,35,32,1,2
I wish I was mustard.,1.1428571428571428,0.0644049739048166,42,37,4,1
"Alright, so I peed in your notebook.",1.1428571428571428,0.07286591006438153,42,38,2,2
"Formless, shapeless, but you, sir, are heartless.",1.1428571428571428,0.05464943254828616,42,36,6,0
It looks like my first wife.,1.1428571428571428,0.0644049739048166,42,37,4,1
If you don’t stop I’ll have to report you to HR,1.1428571428571428,0.05464943254828616,42,36,6,0
"You told us to express ourselves, professor.",1.1428571428571428,0.07286591006438153,42,38,2,2
I'm pretty sure that is crazy uncle Jeff.,1.1428571428571428,0.0644049739048166,42,37,4,1
"Gotta be my Uncle Mike, Doc.",1.1428571428571428,0.07286591006438153,42,38,2,2
"Johnnie Jones, 4th grade, 1959, trying to fill his fountain pen. Man, that kid was dumb.",1.1428571428571428,0.07267814558130979,35,31,3,1
"Whatever you're thinking, I had nothing to do with it.",1.1428571428571428,0.05464943254828616,42,36,6,0
"Doc, this whole 'look within myself' thing is starting to freak me out.",1.1428571428571428,0.07267814558130979,35,31,3,1
"Look, I don’t care if they found that at the scene, there’s nothing that connects me to the crime.",1.1428571428571428,0.0644049739048166,42,37,4,1
Too Freudian.,1.1428571428571428,0.0644049739048166,42,37,4,1
"Doc, this digital world is overwhelming that I can't recognize myself anymore!",1.1428571428571428,0.07267814558130979,35,31,3,1
"The truth:  Jackson Pollock, you are not.",1.1428571428571428,0.07267814558130979,35,31,3,1
"'Leaking is the world's most embarrassing problem. Whether it's a pen, an information, or just some liquid.'",1.1428571428571428,0.050507627227610534,49,42,7,0
Looks like the lactating breast that I wish I were.,1.1428571428571428,0.07142857142857142,49,45,1,3
Well… that’s a little ink-riminating.,1.1428571428571428,0.060012003601200466,35,30,5,0
I would have sneezed into a tissue if I could,1.1428571428571428,0.0644049739048166,42,37,4,1
"Bless you""
""Thank you",1.1428571428571428,0.07267814558130979,35,31,3,1
I’m such an imposter.,1.1428571428571428,0.050507627227610534,49,42,7,0
"Character, reputation - no matter how you cut it, it’s a blot.",1.1428571428571428,0.05464943254828616,42,36,6,0
I guess I better make that appointment with the urologist.,1.1428571428571428,0.06520506636966264,49,44,3,2
This one? This one reminds me of Fred.,1.1428571428571428,0.07286591006438153,42,38,2,2
"Inky, Dinky, that’s what I do!",1.1428571428571428,0.06520506636966264,49,44,3,2
"Not sure,it could be my mother or my underwear.",1.1428571428571428,0.060012003601200466,35,30,5,0
"Yes, doc, my son drives me crazy",1.1428571428571428,0.060012003601200466,35,30,5,0
My wife sent you a nude?,1.1428571428571428,0.05464943254828616,42,36,6,0
I know pornography when I see it.,1.1428571428571428,0.06520506636966264,49,44,3,2
That's from my abstract expressionism period.,1.1428571428571428,0.05464943254828616,42,36,6,0
"Doctor, I just don't want to talk about my kids today.",1.1428571428571428,0.050507627227610534,49,42,7,0
It looks like my ex-husband.,1.1428571428571428,0.060012003601200466,35,30,5,0
"No,no,not a Rocharch test. A self-portrait",1.1428571428571428,0.05832118435198043,49,43,5,1
Am I really just an ink splat Dr. ?,1.1428571428571428,0.05464943254828616,42,36,6,0
People make fun of me. They don't take me seriously.,1.1428571428571428,0.07286591006438153,42,38,2,2
I wouldn't this to be a stain on my record.,1.1428571428571428,0.060012003601200466,35,30,5,0
"Okay, I threw up, so what?",1.1428571428571428,0.0644049739048166,42,37,4,1
I don’t know Doc…It kind of looks like my cousin Joey.,1.1428571428571428,0.06520506636966264,49,44,3,2
It really speaks to something inside of me.,1.1428571428571428,0.05832118435198043,49,43,5,1
They leave home and then they never write.,1.1428571428571428,0.0644049739048166,42,37,4,1
That could be anybody's nocturnal emission.,1.1428571428571428,0.07267814558130979,35,31,3,1
"SIR, WHEN I GROW OLDER, I  AM SURE THAT YOU WILL BE PLEASED WITH MY WORK AT YOUR BOTTLING FACILITY!",1.1428571428571428,0.07267814558130979,35,31,3,1
It's all my hopes and dreams spilled on the sidewalk.  Or a vagina.,1.1428571428571428,0.05362551382353918,56,49,6,1
"Same as last time, a blood splatter from a bottle.",1.1428571428571428,0.05464943254828616,42,36,6,0
No that’s my sister on the left.,1.1428571428571428,0.07286591006438153,42,38,2,2
"Well, how would YOU feel if your innermost thoughts were splashed to all the world?",1.1428571428571428,0.0644049739048166,42,37,4,1
"Doc, where’s your compassion?  It was an accident I had in my youth yet I hear you go around showing it to everyone!",1.1428571428571428,0.050507627227610534,49,42,7,0
Let’s discuss our buying the latest upgrade of the auto-correct software.,1.1428571428571428,0.07286591006438153,42,38,2,2
Yeah … I’m not that photogenic,1.1428571428571428,0.07267814558130979,35,31,3,1
"I don't know. I understand about half of it.""",1.1428571428571428,0.05832118435198043,49,43,5,1
"Yes, we were engaged to be married.",1.1428571428571428,0.06520506636966264,49,44,3,2
