caption,mean,precision,votes,not_funny,somewhat_funny,funny
"now its time me to show you all 
The Avada Kedavra spell!",1.105263157894737,0.0629917206983912,38,35,2,1
"Don’t worry, I’m sure I know how to make the pilots reappear.",1.105263157894737,0.05045276771256948,38,34,4,0
"A comfortable seat with leg room? What do I look like, a magician?",1.105263157894737,0.05045276771256948,38,34,4,0
I am going to fool Penn & Teller by flying this plane with only my magic wand.,1.105263157894737,0.0629917206983912,38,35,2,1
I only entertain in the event of emergency.,1.105263157894737,0.0629917206983912,38,35,2,1
"For my next trick, I will require a volunteer from our audience willing to be bumped.",1.1041666666666667,0.044558346215878446,48,43,5,0
Now watch as I make your checked luggage disappear.,1.1041666666666667,0.053590773834580184,48,44,3,1
"And now, until we reach L.A. in two hours, it's Melvin the Mysterious.",1.1025641025641026,0.04921614717627653,39,35,4,0
The illusion of the tarmac taxing torture.,1.1025641025641026,0.04921614717627653,39,35,4,0
"Do not worry, the co-pilot has everything under control",1.1025641025641026,0.04921614717627653,39,35,4,0
"And now, with a wave of my corporate wand, I will make your leg room disappear",1.1025641025641026,0.06141463024552091,39,36,2,1
"Hi, I'm your pilot.",1.1025641025641026,0.06141463024552091,39,36,2,1
"For this next trick, FAA regulations require you to make your safety card appear.",1.1025641025641026,0.06141463024552091,39,36,2,1
You won't believe my next trick. I'll make a flight attendant appear in the aisle with a beverage cart.,1.1025641025641026,0.06141463024552091,39,36,2,1
"You have 3 choices, Lobster Newberg, Beef Stroganoff or Chateau Briand",1.1025641025641026,0.06141463024552091,39,36,2,1
"Before we takeoff, does anyone want an emotional support bunny?",1.1025641025641026,0.06141463024552091,39,36,2,1
"And for MY comfort and safety, you will be happy with everything about this flight!",1.1025641025641026,0.04921614717627653,39,35,4,0
"And now, I'll make all of the huge wheely bags, which you should have checked, but carried on instead, disappear",1.1025641025641026,0.04921614717627653,39,35,4,0
"Abracadabra

ETA on schedule !",1.1025641025641026,0.06141463024552091,39,36,2,1
"And in the event of an emergency, the emergency doors will open, I’ll sprinkle you all with pixie dust, and you’ll be able to fly out the doors to safety.",1.1025641025641026,0.06141463024552091,39,36,2,1
"Checked and boarded with nothing to fear, I will make your luggage disappear!",1.1025641025641026,0.04921614717627653,39,35,4,0
"And for my next trick, I will shift the position of the luggage in the overhead bins",1.1025641025641026,0.06141463024552091,39,36,2,1
"And now for my next trick, I will make this mechanical delay disappear.",1.1025641025641026,0.04921614717627653,39,35,4,0
Can you conjure up my pre-pandemic level of germaphobia?,1.1025641025641026,0.04921614717627653,39,35,4,0
"And if you become disorderly, Mr. Magic Wand will wrap you up in duct tape.",1.1025641025641026,0.04921614717627653,39,35,4,0
Thank you for flying Leprechaun Air. In the event of a loss of cabin pressure a harp will descend.,1.1025641025641026,0.04921614717627653,39,35,4,0
Allow me to explain how this thing stays in the air,1.1025641025641026,0.04921614717627653,39,35,4,0
"And, in the event of a water landing, magic tricks!",1.1025641025641026,0.04921614717627653,39,35,4,0
Liferabbits can be found under your seats.,1.1025641025641026,0.04921614717627653,39,35,4,0
"One of these days, my act will finally take off",1.1025641025641026,0.04921614717627653,39,35,4,0
"Abracadabra! Soon either chicken or beef dinner will appear, and if you preordered vegetarian, it will be that.",1.1025641025641026,0.04921614717627653,39,35,4,0
"I just peed, it was magical.",1.1025641025641026,0.04921614717627653,39,35,4,0
"‘and for my next trick, i’ll provide you with stress-free travel.’ @callahandalyjudge",1.1025641025641026,0.04921614717627653,39,35,4,0
I will now pull another object out of thin air....,1.1020408163265305,0.04369126727437127,49,44,5,0
Let me guess. You keep the rabbit underneath your seat?,1.1,0.0480384461415261,40,36,4,0
Hocus Pocus we are delayed in Ho-ho-kus,1.1,0.05991446895152778,40,37,2,1
I'm just a Broadway baby...,1.1,0.0480384461415261,40,36,4,0
"After the autopilot, here is my second magic trick...",1.1,0.0480384461415261,40,36,4,0
"Now for my final act, I’ll make the airplane disappear!",1.1,0.0480384461415261,40,36,4,0
"Also, your portable electronic devices must be set to ‘abracadabra’ mode until an announcement is made upon arrival. Thank you.”",1.1,0.0480384461415261,40,36,4,0
Don't worry! I'll learn how to make the flight crew reappear at my magic lesson next week.,1.1,0.05991446895152778,40,37,2,1
Can you magically move me and my wife to first class?,1.1,0.0480384461415261,40,36,4,0
First star on the right and straight until sunrise!,1.1,0.05991446895152778,40,37,2,1
poof ... I made your extra legroom and free soft drinks disappear.,1.1,0.06979824404521126,40,38,0,2
Now I shall pour a cup of coffee in turbulence.,1.1,0.0480384461415261,40,36,4,0
For my next trick....you will enjoy being packed in like sardines.,1.1,0.0480384461415261,40,36,4,0
"Hocus pocus
The guy who woke us",1.1,0.0480384461415261,40,36,4,0
"Ladies & gentleman,it is I the Great In-flight Entertainment",1.1,0.0480384461415261,40,36,4,0
"You can't see it, but everyone in first class has real food!",1.1,0.0480384461415261,40,36,4,0
"For my next trick, I will turn on the fasten seatbelt sign! Isn’t safety magical?",1.1,0.05991446895152778,40,37,2,1
...and then magically the oxygen mask will appear.,1.1,0.0480384461415261,40,36,4,0
I will now make your luggage disappear.,1.1,0.0480384461415261,40,36,4,0
This will help distract you from your fear of flying! Enjoy the show for those who remember Blackson the magician I am not nearly as good!,1.1,0.0480384461415261,40,36,4,0
Yes I do play for tips.,1.1,0.0480384461415261,40,36,4,0
"Abra carbonated water,tea or me?",1.1,0.0480384461415261,40,36,4,0
This show doesn’t fly in first class.,1.1,0.051507875363771216,50,46,3,1
"And for my next trick, I will turn your seat cushion into a floatation device.",1.1,0.0480384461415261,40,36,4,0
I’ll only give you three wishes if you smile like your daughter.,1.1,0.05991446895152778,40,37,2,1
"And for my next trick, I’ll make the bar cart reappear.",1.1,0.0480384461415261,40,36,4,0
Anyone who stands up before the plane has come to a complete stop will be turned into a toad!,1.0975609756097562,0.05848575028430145,41,38,2,1
"Well,  you shut them BOTH up. That's a good trick!",1.0975609756097562,0.05848575028430145,41,38,2,1
"""Abracadabra,  the frills have disappeared""",1.0975609756097562,0.04691557088212523,41,37,4,0
"This plane doesn’t have engines like Tesla’s, it flies with just magic",1.0975609756097562,0.05848575028430145,41,38,2,1
And for my neatest trick: a delicious home-cooked meal!,1.0975609756097562,0.05848575028430145,41,38,2,1
Abra-ca-dabra! You'll get to your destination on time and your luggage will not be lost in London.,1.0975609756097562,0.05848575028430145,41,38,2,1
Thank you for joining us on Spirits airlines.,1.0975609756097562,0.04691557088212523,41,37,4,0
The pilot and co-pilot should be back in the cockpit as soon as I figure out how to make them reappear.”,1.0975609756097562,0.05848575028430145,41,38,2,1
It's actually really easy to hack your 3DS did you know that,1.0975609756097562,0.04691557088212523,41,37,4,0
"If you’re expecting the rabbit, he left for first class",1.0975609756097562,0.05848575028430145,41,38,2,1
"Yes, ma'am, I did make your baby disappear. It wouldn't stop crying!"" -Maya Undaraa, 13 years ol",1.0975609756097562,0.04691557088212523,41,37,4,0
"Even though we’re not wearing masks, we won’t get sick and arrive on time.",1.0975609756097562,0.04691557088212523,41,37,4,0
The bunny wasn’t strapped in.,1.0975609756097562,0.05848575028430145,41,38,2,1
Are we being charged extra for the show ?,1.0975609756097562,0.04691557088212523,41,37,4,0
"And with a simple wave of the wand, this flight has magically been canceled.",1.0975609756097562,0.04691557088212523,41,37,4,0
And now your lunch will… reappear!,1.096774193548387,0.053978066228004884,31,28,3,0
"For my next trick, I will make your bags disappear!",1.096774193548387,0.053978066228004884,31,28,3,0
"And with a wave of this wand, free checked bags, drinks and friendly service will all disappear!",1.096774193548387,0.053978066228004884,31,28,3,0
"If you sign up for our credit card, 10,000 sky miles will magically appear!",1.096774193548387,0.053978066228004884,31,28,3,0
"And for my next trick,I will disappear until we land.",1.096774193548387,0.0711629768076314,31,29,1,1
"Watch, and the thirst is gone!",1.096774193548387,0.053978066228004884,31,28,3,0
"In the event of loss of a water landing  snap your fingers and say abracadabra 





Jill landsberg",1.096774193548387,0.053978066228004884,31,28,3,0
Your life vests are now toilet seat covers.,1.096774193548387,0.0711629768076314,31,29,1,1
"Now, who's the first passenger that thinks it is their right to be unruly on this flight?",1.096774193548387,0.0711629768076314,31,29,1,1
"And if you tip well, I'll make your baggage magical reappear.",1.096774193548387,0.053978066228004884,31,28,3,0
With a wave of my wand you will imagine having the best in-flight dining experience!,1.096774193548387,0.0711629768076314,31,29,1,1
"And for my next trick, I am going to land the plane from coach with my eyes closed.",1.096774193548387,0.053978066228004884,31,28,3,0
"...and with a wag of the wand, you're going to let me have your aisle seat.",1.096774193548387,0.053978066228004884,31,28,3,0
Fly Me To The Moon,1.096774193548387,0.053978066228004884,31,28,3,0
Someday I,1.096774193548387,0.0711629768076314,31,29,1,1
And in the unlikely event of a water landing ....,1.096774193548387,0.0711629768076314,31,29,1,1
"Don't worry! When we all say restorowingus"" the left wing will magically GROW back. Ready...",1.096774193548387,0.053978066228004884,31,28,3,0
"In the event that we lose cabin pressure, simply pull a rabbit from the hat above you, gently pull on it's tail and breathe normally.",1.096774193548387,0.053978066228004884,31,28,3,0
"Eyes on me, ladies and gentlemen! 
YOU DON’T NEED TO GO TO THE TOILET UNTIL WE LAND! “

(Emergency trick pulled out by the crew following the malfunctioning of the waste expulsion air compressor working in REVERSE",1.096774193548387,0.0711629768076314,31,29,1,1
"And for my next trick, you'll all fly.",1.096774193548387,0.0711629768076314,31,29,1,1
"Coffee please, put away the magic wand.",1.096774193548387,0.0711629768076314,31,29,1,1
"And now, 'Abra Cadabra', you may unfasten your seat belts and float around.",1.096774193548387,0.053978066228004884,31,28,3,0
"Abracadabra,all our masks just disappeared.",1.096774193548387,0.053978066228004884,31,28,3,0
"And for my last trick, with a quick wave of the wand, I will make all your legroom disappear...",1.096774193548387,0.053978066228004884,31,28,3,0
Watch me pull a life jacket out of this young man's ear.,1.096774193548387,0.0711629768076314,31,29,1,1
Please note. The rules clearly disqualify anyone from the search who attacks me on the way to the rainbow.,1.096774193548387,0.0711629768076314,31,29,1,1
"And for my next trick, I'll make your oxygen masks disappear due to  recent budget cuts.",1.096774193548387,0.0711629768076314,31,29,1,1
First it was in-flight meals. Now I can make your connecting flight disappear.,1.096774193548387,0.053978066228004884,31,28,3,0
"Repeat after me: ""I AM in first class, I WILL leave a good review...""",1.096774193548387,0.053978066228004884,31,28,3,0
Who said flying isn’t as much fun as it used to be?,1.096774193548387,0.0711629768076314,31,29,1,1
Accio Seat Back!,1.096774193548387,0.053978066228004884,31,28,3,0
"For my next trick, I will make the pilot and co-pilot reappear.",1.096774193548387,0.0711629768076314,31,29,1,1
"If the plane suddenly plummets from the sky, don't worry folks its all part of the act.",1.096774193548387,0.053978066228004884,31,28,3,0
Presto-Change-o! You're all cancelled,1.096774193548387,0.053978066228004884,31,28,3,0
"Hi folks. You heard right. The pilot apologizes for the unexpected delay . And so, for the next four hours on the tarmac, I'm here to entertain you. Please join in if the spirit moves you.",1.096774193548387,0.053978066228004884,31,28,3,0
And with magic I will make the flight arrive on time,1.096774193548387,0.053978066228004884,31,28,3,0
And...poof! There go your free amenities!,1.096774193548387,0.0711629768076314,31,29,1,1
And now I am pleased to introduce our advanced safety measures for this flight.,1.096774193548387,0.053978066228004884,31,28,3,0
"I'll be  your pilot  this  morning: up, up, up and away!",1.096774193548387,0.0711629768076314,31,29,1,1
Please don’t saw our plane in half.,1.096774193548387,0.053978066228004884,31,28,3,0
"If you want to see my vanishing act, just press the call button.",1.096774193548387,0.053978066228004884,31,28,3,0
"Don’t worry sir, there will be no crying babies on this flight.",1.096774193548387,0.0711629768076314,31,29,1,1
I’m afraid I don’t have the power to give you more leg room,1.096774193548387,0.053978066228004884,31,28,3,0
I can try using magic to help with your issue?,1.096774193548387,0.053978066228004884,31,28,3,0
"With my next trick, I will remove one olive from every salad!",1.096774193548387,0.053978066228004884,31,28,3,0
"for my next trick, keep your eyes fixed on me and don't look outside the window...",1.096774193548387,0.053978066228004884,31,28,3,0
So you give a coin then i go clean the front windows!,1.096774193548387,0.053978066228004884,31,28,3,0
"I will perform 3 tricks for you.  We will leave on time, your luggage will arrive with you, and you are now in first class!",1.096774193548387,0.053978066228004884,31,28,3,0
performance under pressure,1.096774193548387,0.053978066228004884,31,28,3,0
"Go ahead (snicker), try to punch me…",1.096774193548387,0.053978066228004884,31,28,3,0
"If the cabin pressure falls, your oxygen mask will magically appear.",1.0952380952380953,0.05712349652663379,42,39,2,1
And for my next trick I'll make you all appear,1.0952380952380953,0.045843796413450676,42,38,4,0
Presto! I just made your legroom disappear.,1.0952380952380953,0.045843796413450676,42,38,4,0
"For my next trick, I will give you real food.",1.0952380952380953,0.045843796413450676,42,38,4,0
"Et voila, your seat cost twice as much as last year.",1.0952380952380953,0.045843796413450676,42,38,4,0
"Watch carefully...I will use this magic 
Wand to immediately place a disorderly passenger on the wing of the plane. 
Good fortune is not expected. 
Don't even get me started on luck.",1.0952380952380953,0.05712349652663379,42,39,2,1
"And just like that, ladies, a 500,000 object is flying in mid-air!",1.0952380952380953,0.05712349652663379,42,39,2,1
Your airship will disappear,1.0952380952380953,0.045843796413450676,42,38,4,0
"Why yes, i am the first autistic flight attendant, why do you ask?",1.0952380952380953,0.045843796413450676,42,38,4,0
"And now there's only one exit, in the back.",1.0952380952380953,0.045843796413450676,42,38,4,0
"After the third screen reset attempt fails, this is the last hope…",1.0952380952380953,0.045843796413450676,42,38,4,0
I made our lunch disappear,1.09375,0.0689695906576505,32,30,1,1
"Hi, folks. Your on-board entertainment today will be 'Rabbits on a Plane'.",1.09375,0.052351460373382196,32,29,3,0
"Well folks, it sounds like the flight attendants are about to bring out the big guns, so that's my time. Again, my name is The Amazing Cayden, I live in Los Angeles, and I also do standup comedy and Zoom tarot reading!",1.09375,0.052351460373382196,32,29,3,0
See how easy it was to make your COVID masks disappear?,1.09375,0.052351460373382196,32,29,3,0
now is there anyone who knows the spell to make the pilot REAPPEAR on board?,1.09375,0.0689695906576505,32,30,1,1
And in the event of a water landing nonswimmers should remain in their seats,1.09375,0.052351460373382196,32,29,3,0
Say ‘abra-ka-dabra’…… or the plane crashes.,1.09375,0.052351460373382196,32,29,3,0
Pixie dust and magic my friend!,1.09375,0.0689695906576505,32,30,1,1
All your overhead luggage will now disappear along with your checked baggage.,1.09375,0.052351460373382196,32,29,3,0
"I need a volunteer. How bout you, 1D?",1.09375,0.052351460373382196,32,29,3,0
I double-majored in aviation and wizardry,1.09375,0.052351460373382196,32,29,3,0
"...and as a MAGA practitioner, I can make Liberty disappear... not just the freaking statue.",1.09375,0.052351460373382196,32,29,3,0
I’ll be doing your security theater!,1.09375,0.052351460373382196,32,29,3,0
"Snacks?  Once you had them, now you don’t”",1.09375,0.052351460373382196,32,29,3,0
"And now, for my next trick, with a stroke of this wand I will upgrade the gentleman in the front row to first class -where no one is subjected to any B-grade magic shows.",1.09375,0.052351460373382196,32,29,3,0
Gas prices have gone up so I need to collect more money.,1.09375,0.0689695906576505,32,30,1,1
"For my next trick, we will stay on the on the runway with no working bathrooms for five hours.",1.09375,0.052351460373382196,32,29,3,0
"And in case of emergency, I'll say the magic word and change your seat cushions into flying carpets.",1.09375,0.052351460373382196,32,29,3,0
"I’d stretch the plane too, but you’d have to pay triple for the extra two inches of legroom.",1.09375,0.052351460373382196,32,29,3,0
"And now, ladies and gentlemen, we will witness the apparition of complete apathy!",1.09375,0.052351460373382196,32,29,3,0
"No, first class passengers are NOT required to watch my magic show. Why do you ask?",1.09375,0.0689695906576505,32,30,1,1
"And now for our greatest trick, actually landing the plane.",1.09375,0.052351460373382196,32,29,3,0
Presto-chango!  Your fees just doubled!,1.09375,0.052351460373382196,32,29,3,0
"Abracadabra, and poof no more free meals, free seat selection, or free baggage checks!",1.09375,0.052351460373382196,32,29,3,0
"Ladies, gentlemen, and everyone in between, I now present to you my disappearing this plane into a black hole trick",1.09375,0.052351460373382196,32,29,3,0
Be grateful you're not in business class.   They have a mime.,1.09375,0.0689695906576505,32,30,1,1
"In the case of emergency, I do take Venmo, PayPal, and Apple Cash to make your oxygen masks appear out of thin air",1.09375,0.052351460373382196,32,29,3,0
What a magical trip we are on... where women become men and men become women.,1.09375,0.052351460373382196,32,29,3,0
"Flying is hard, but magic is easy.",1.09375,0.0689695906576505,32,30,1,1
And now a good meal will appear!,1.09375,0.052351460373382196,32,29,3,0
"And now, ladies and gentlemen, I will make your legroom DISAPPEAR!",1.09375,0.052351460373382196,32,29,3,0
"And our best workaround for delays is, as ever, performative.",1.09375,0.052351460373382196,32,29,3,0
"Now, ladies and gentlemen, watch as I make another inch of legroom disappear!",1.09375,0.052351460373382196,32,29,3,0
"The floatation vests never really worked, so the airline has turned to a sure thing in case of emergency.",1.09375,0.052351460373382196,32,29,3,0
"And now, all your masks will vanish, and some of you will be happy.",1.09375,0.052351460373382196,32,29,3,0
Babysitter?,1.09375,0.052351460373382196,32,29,3,0
Abra cadabra no snacks or wifi for this flight! I made them magically disappear!,1.09375,0.052351460373382196,32,29,3,0
"Due to rising gas prices,we will be using magic to fly this plane!",1.09375,0.052351460373382196,32,29,3,0
"For my next trick, I'm going to transfer all the surly TSA workers to a Gulag in Siberia ...",1.09375,0.052351460373382196,32,29,3,0
"And for my next trick, I’ll attempt to make the pilot reappear!",1.09375,0.052351460373382196,32,29,3,0
"For my next trick, I will make my service bunny appear!",1.09375,0.052351460373382196,32,29,3,0
"with a wave and an abracadabra, we'll all be flying!",1.09375,0.052351460373382196,32,29,3,0
"I thought our captain was a pilot, not a magician.  I hope he's both.",1.09375,0.052351460373382196,32,29,3,0
"By waving this magic wand, I can actually get you to watch me as I demonstrate how to buckle a seat belt and wear an oxygen mask.",1.09375,0.0689695906576505,32,30,1,1
"In the event of an emergency, we ask that you all clap your hands and say ""We believe.""",1.09375,0.052351460373382196,32,29,3,0
"If I was on that plane with my kids, it wouldn't have went down like it did.",1.09375,0.052351460373382196,32,29,3,0
let's fly to the moon!,1.09375,0.052351460373382196,32,29,3,0
Did someone ask for a second bag of cashews?,1.09375,0.052351460373382196,32,29,3,0
I can not be held responsible if your luggsge disappears!,1.09375,0.0689695906576505,32,30,1,1
"On the count of three, you will awaken feeling refreshed …as if you’ve just eaten a small bag of peanuts and been served a complimentary beverage.",1.09375,0.052351460373382196,32,29,3,0
It's thirty dollars to make the pilots reappear.,1.09375,0.0689695906576505,32,30,1,1
"Sure, and with this wand, I can bring you a hot meal and a roomier seat",1.09375,0.052351460373382196,32,29,3,0
"Three wishes, but I can’t fix leg room.",1.09375,0.052351460373382196,32,29,3,0
"Behold as I transform myself into your pilot, copilot and flight attendant.",1.09375,0.0689695906576505,32,30,1,1
Who needs safety features when we have magic?,1.09375,0.052351460373382196,32,29,3,0
"And for my next trick, I’m going to shrink your bag of peanuts.",1.09375,0.052351460373382196,32,29,3,0
"Sleep, pretty wantons, do not cry and you will get an extra snack!
Julie E Dawson, Saint Louis, MO",1.09375,0.052351460373382196,32,29,3,0
Hey...if I was good at magic we'd be there already.,1.09375,0.0689695906576505,32,30,1,1
My automatic pilot said I could try a new trick...,1.09375,0.052351460373382196,32,29,3,0
"Let me tell you that story, where I once thought I couldn‘t fly a plane, spoke a magic spell, and all of a sudden could! It was magnificent! And today I will be trying it for the second time! … and you ALL will be witnesses to this moment of magic - Abracadabra!",1.09375,0.052351460373382196,32,29,3,0
would you like to teleport,1.09375,0.0689695906576505,32,30,1,1
"And for my next trick, I’ll make your flight anxiety skyrocket as I point out the exits and make you realize there is no safe way out of here in the case of a crash landing.",1.09375,0.052351460373382196,32,29,3,0
"Should we experience a sudden drop in cabin pressure,face masks will magically appear for each passenger.",1.0930232558139534,0.055823181223160837,43,40,2,1
Dwane had to pull out all the stops to distract the passengers from the strain of rapid onset airborne ebola that was working its way toward the front of the plane. He could barely look them in the eyes.,1.0930232558139534,0.04481972612369448,43,39,4,0
"""Wanna see me disappear that building over there?",1.0930232558139534,0.055823181223160837,43,40,2,1
"In the event of a sudden loss of cabin pressure, you will magically realize why you should have paid attention during the safety demonstration.",1.0930232558139534,0.055823181223160837,43,40,2,1
"And with a simple wave of my wand, I will disable the 'call flight attendant button.'",1.0930232558139534,0.055823181223160837,43,40,2,1
"We apologize that Wi-Fi is unavailable on this flight,but we hope you enjoy our alternative in flight entertainment",1.0930232558139534,0.04481972612369448,43,39,4,0
And now… we will take off on time!,1.0930232558139534,0.04481972612369448,43,39,4,0
"Due to the pilot shortage, I bestow upon you the ability to fly this plane.",1.0930232558139534,0.055823181223160837,43,40,2,1
Oh no…I was warned about sitting in the front row.,1.0909090909090908,0.050819726761358916,33,30,3,0
I can make your bags disappear and save you $100.....,1.0909090909090908,0.050819726761358916,33,30,3,0
"For my next trick, I will make extra leg room & a hot meal appear!",1.0909090909090908,0.050819726761358916,33,30,3,0
"And now, ladies, gentlemen, children of all ages, a rarely seen feat...this plane will magically take off on time and arrive on time with all your luggage!",1.0909090909090908,0.050819726761358916,33,30,3,0
I'd like to entertain you unless you're using miles,1.0909090909090908,0.050819726761358916,33,30,3,0
"Well I can’t revive the dead, but I can technically make that bird that got sucked into the engine reappear…",1.0909090909090908,0.06690727929036253,33,31,1,1
"The rabbit is in the hole,and we are cleated for take off.",1.0909090909090908,0.050819726761358916,33,30,3,0
"For my first trick, I'll take away most of your leg room.",1.0909090909090908,0.050819726761358916,33,30,3,0
"And now,  you and your baggage will disappear into thin air!",1.0909090909090908,0.050819726761358916,33,30,3,0
it's probably the gluten,1.0909090909090908,0.06690727929036253,33,31,1,1
"Due to budget cuts, I will be tonight's in-flight entertainment.",1.0909090909090908,0.06690727929036253,33,31,1,1
"and for my next trick, i'll make your luggage disappear",1.0909090909090908,0.050819726761358916,33,30,3,0
"Behold,as I trick the captain into staying awake!",1.0909090909090908,0.043840256560946575,44,40,4,0
"Abracadabra, no more leg room!",1.0909090909090908,0.06690727929036253,33,31,1,1
I would pull a rabbit out of my hat but he's busy dealing with a drunk back in coach.,1.0909090909090908,0.06690727929036253,33,31,1,1
And for my next trick I will stuff a screaming baby into the overhead compartment. Cover your ears.,1.0909090909090908,0.050819726761358916,33,30,3,0
And for my next trick. I'll make the plane disappear.,1.0909090909090908,0.050819726761358916,33,30,3,0
