caption,mean,precision,votes,not_funny,somewhat_funny,funny
I thought we already left Vegas!,1.170731707317073,0.06898602743283394,41,35,5,1
"hippity dippity ding, the plane has lost a wing",1.170731707317073,0.06898602743283394,41,35,5,1
AAAAND poof! your luggage is gone!,1.170731707317073,0.06898602743283394,41,35,5,1
"watch you're oxygen masks will magically appear as we
hurdle toward the ground.",1.170731707317073,0.06898602743283394,41,35,5,1
"Poof, no more dignity.",1.170731707317073,0.07732130480071885,41,36,3,2
And now I’ll try to conjure up a good meal.,1.170731707317073,0.07732130480071885,41,36,3,2
Can you check under your seats for a rabbit?,1.170731707317073,0.07732130480071885,41,36,3,2
For my next trick; a flight without incident.,1.170731707317073,0.06898602743283394,41,35,5,1
You're in luck today with an all-gay flight crew.,1.170731707317073,0.06898602743283394,41,35,5,1
"And just like that, the bag of salted almonds has disappeared and been replaced with a tiny bag of pretzels.",1.170731707317073,0.059494199598295,41,34,7,0
Song and Dance Airlines proudly presents . . . a take off.,1.170731707317073,0.07732130480071885,41,36,3,2
My next trick is to give you a bag of peanuts and a free glass of water!,1.170731707317073,0.07732130480071885,41,36,3,2
Yes! We do so much more than serve you  food and beverages!,1.170731707317073,0.06898602743283394,41,35,5,1
"And then your luggage will reappear, just like that!",1.170731707317073,0.059494199598295,41,34,7,0
Watch me pull a complimentary bag of peanuts out of my hat...,1.170731707317073,0.06898602743283394,41,35,5,1
All waits over two hours on the tarmac now come with entertainment.,1.170731707317073,0.07732130480071885,41,36,3,2
"And for my next trick, I’ll make that child who keeps kicking your seat, fall asleep!",1.170731707317073,0.06898602743283394,41,35,5,1
Welcome to Oz!,1.170731707317073,0.06898602743283394,41,35,5,1
"And with a flick of my wand, the cabin will lose pressure and the oxygen masks will magically appear.",1.170731707317073,0.06898602743283394,41,35,5,1
"Welcome to Magic Airlines. We'll  get you there one way
or another!""",1.170731707317073,0.059494199598295,41,34,7,0
And your luggage disappears!,1.170731707317073,0.07732130480071885,41,36,3,2
When I wave this wane you'll feel like your flying!,1.170731707317073,0.06898602743283394,41,35,5,1
Crampacadabra.,1.170731707317073,0.059494199598295,41,34,7,0
"I can’t bring back free check baggage with the wave of my wand, lady, but I can make your leg room go poof.",1.170731707317073,0.06898602743283394,41,35,5,1
And for my final trick I shall conjure some spirits. Presto! Eight Spirit flights on the taxiway before us.,1.170731707317073,0.08484159576061508,41,37,1,3
Prepare to be astounded as I make your hope for arriving on time disappear!,1.1702127659574468,0.055411578656325414,47,39,8,0
And now I will conclusively prove that 95% of people put oversized bags into the overhead bins.,1.1702127659574468,0.055411578656325414,47,39,8,0
"Since you ask, I'll admit that the Astounding Anton, entertaining in first-class, possesses some great magic--therefore I, Perplexing Lyle, am currently short one Beautiful Assistant.",1.1702127659574468,0.055411578656325414,47,39,8,0
And now watch as I make your luggage disappear!,1.1702127659574468,0.07014685887189226,47,41,4,2
And just like that this all becomes first class.”,1.1702127659574468,0.07014685887189226,47,41,4,2
"Buckle up, folks, I'm running for Congress!",1.1702127659574468,0.055411578656325414,47,39,8,0
"look out your windows folks, that's right, i made the wings disappear!",1.1702127659574468,0.07014685887189226,47,41,4,2
Hey presto 250 people fit into this tiny metal box!,1.1702127659574468,0.0632100658866106,47,40,6,1
Stay calm! I'm the only member of the flight crew that relies on a magic wand.,1.1702127659574468,0.07014685887189226,47,41,4,2
When I count to three you’ll magically appreciate how hundreds of dollars for your seat justifies one pack of peanuts!,1.1702127659574468,0.0632100658866106,47,40,6,1
"Sorry, this is the Entertainment you get for not booking business class.",1.1702127659574468,0.0632100658866106,47,40,6,1
"And now for my next trick, everybody's   check-in luggage will magically disappear!",1.1702127659574468,0.0632100658866106,47,40,6,1
"We are experiencing a staff shortage , so 
we multi task on all our economy flights.",1.1702127659574468,0.0632100658866106,47,40,6,1
"No cancellations, no delays and free peanuts.",1.1702127659574468,0.07014685887189226,47,41,4,2
"Actually, rows 17 through 34 bet me I couldn’t get your daughter to stop crying.",1.1702127659574468,0.0632100658866106,47,40,6,1
Your carry-on is now complimentary.,1.1702127659574468,0.055411578656325414,47,39,8,0
"Well, how about YOU come up with a better idea for people to pay attention to the pre-flight safety demonstration?",1.1702127659574468,0.07014685887189226,47,41,4,2
"And presto, shoes have reappeared on the feet of the gentleman in 9-A.",1.1666666666666667,0.07556728291396754,42,37,3,2
"For my next trick, the plane will circle the airport for an hour.",1.1666666666666667,0.06876141641725286,48,42,4,2
"Don’t worry folks, every magic trick keeps the wings of the plane",1.1666666666666667,0.05436067275445348,48,40,8,0
"For my next trick, I'm going to make your luggage disappear for three days.",1.1666666666666667,0.05820252464746482,42,35,7,0
Life rafts are located below your seats... or are they?,1.1666666666666667,0.05436067275445348,48,40,8,0
And now to chop your legroom in half.,1.1666666666666667,0.06744608262285645,42,36,5,1
"For my next trick, I will make your connecting flights disappear!”",1.1666666666666667,0.06876141641725286,48,42,4,2
"At this point in the flight, we now invite our Platinum Globalist passengers to pick a card, any card.",1.1666666666666667,0.06744608262285645,42,36,5,1
"See how easily legroom, food options, and luggage disappear!",1.1666666666666667,0.06868028197434448,54,48,3,3
Voila!  An extra two inches.,1.1666666666666667,0.07556728291396754,42,37,3,2
No Covid droplets here.,1.1666666666666667,0.07556728291396754,42,37,3,2
I just made 8.3% of the checked bags on this flight disappear!,1.1666666666666667,0.05436067275445348,48,40,8,0
Watch me pull a safe landing out of my hat.,1.1666666666666667,0.06744608262285645,42,36,5,1
"Now close your eyes for two hours, then look out the window again!",1.1666666666666667,0.05820252464746482,42,35,7,0
"And for my next trick, I will pull your warm towel out of my hat.",1.1666666666666667,0.06744608262285645,42,36,5,1
"And now, I'll make your luggage reappear...in Tacoma.",1.1666666666666667,0.06876141641725286,48,42,4,2
And for my next trick I will appear to be a happy and pleasant employee!,1.1666666666666667,0.07556728291396754,42,37,3,2
Abracadabra hocus pocus - your luggage will appear on carousel 5B.,1.1666666666666667,0.06744608262285645,42,36,5,1
The real trick is going an entire flight without a baby crying.,1.1666666666666667,0.05820252464746482,42,35,7,0
Alaca-no-more-crying-babies-zam,1.1666666666666667,0.05820252464746482,42,35,7,0
Presto! Just like that the stewardess is now the pilot.,1.1666666666666667,0.06744608262285645,42,36,5,1
"And now, defying all the laws of physics, common sense, and self-preservation, this plane will lift off the ground and hurtle through the sky.",1.1666666666666667,0.06744608262285645,42,36,5,1
So before TSA arrives...,1.1666666666666667,0.06744608262285645,42,36,5,1
"I’d love to make the crew appear, but that is not part of my act.",1.1666666666666667,0.05820252464746482,42,35,7,0
Give them the old razzle dazzle; razzle dazzle em,1.1666666666666667,0.05820252464746482,42,35,7,0
Buckle up! I will now levitate this plane and transport it to Chicago!,1.1666666666666667,0.06744608262285645,42,36,5,1
Now I'll make your leg room disappear!,1.1666666666666667,0.06198070316648413,48,41,6,1
"With just one wave of my wand, I'll make your leg room disappear.",1.1666666666666667,0.06744608262285645,42,36,5,1
Hold on tight for my next trick; the disappearing pilot!,1.1666666666666667,0.06744608262285645,42,36,5,1
Can I get a volunteer? A licensed pilot volunteer.,1.1666666666666667,0.07556728291396754,42,37,3,2
Did someone drop a vape pen in the first class loo?,1.1666666666666667,0.06338902990667021,54,47,5,2
Have to practice somewhere!,1.1666666666666667,0.06744608262285645,42,36,5,1
But clearly our left engine is even better at making doves disappear.,1.1666666666666667,0.06744608262285645,42,36,5,1
And now I'll magically transport your checked luggage to Uzbekistan.,1.1666666666666667,0.08289664910495502,42,38,1,3
Presto!  Your leg room has disappeared.,1.1666666666666667,0.05820252464746482,42,35,7,0
I wave my magic wand and PRESTO! The flight isn't cancelled and the landing gear stays on.,1.1666666666666667,0.05820252464746482,42,35,7,0
This is your in-flight entertainment,1.1666666666666667,0.06744608262285645,42,36,5,1
And for my next trick...even those peanuts will disappear!,1.1666666666666667,0.05820252464746482,42,35,7,0
"Remember folks, treat me nice and and I'll make sure you can use the Crew's bathroom!",1.1666666666666667,0.05820252464746482,42,35,7,0
Abracadabra!  Your seats are smaller.,1.1666666666666667,0.05820252464746482,42,35,7,0
Voila! No more emotional support bunny in first class.,1.1666666666666667,0.06198070316648413,48,41,6,1
Now……check your leg room.,1.1666666666666667,0.05820252464746482,42,35,7,0
"...and for my next trick, we will be sitting on the runway for another 3 hours before departure. Kazaam!",1.1666666666666667,0.06744608262285645,42,36,5,1
And voila! No more peanuts!,1.1666666666666667,0.06744608262285645,42,36,5,1
23 Ski Dooski,1.1666666666666667,0.06744608262285645,42,36,5,1
"Sirs and madams, a mere donation to keep the child from crying.",1.1666666666666667,0.06744608262285645,42,36,5,1
Would you believe the pilot’s name is Harvey?,1.1666666666666667,0.06198070316648413,48,41,6,1
When I snap my fingers you’ll have more legroom.,1.1666666666666667,0.05820252464746482,42,35,7,0
Watch closely as I make three hours of your day disappear right before your very eyes!,1.1666666666666667,0.06744608262285645,42,36,5,1
"Take-off will occur once the engine is fixed. Until then, just enjoy your captain with the magic wan!",1.1666666666666667,0.06744608262285645,42,36,5,1
And I can make your checked luggage appear!,1.1666666666666667,0.06744608262285645,42,36,5,1
"And for my next trick you'll all be enjoying flat-bed seats, Beef Wellington, and unlimited martinis on this one hour flight from San Francisco to Los Angeles.",1.1666666666666667,0.07493101634438096,48,43,2,3
And for my next trick I’ll make flying coach enjoyable.,1.1666666666666667,0.05820252464746482,42,35,7,0
Your carbon footprint is zero! This flight would be on with or without you.,1.1666666666666667,0.07493101634438096,48,43,2,3
"And for my next trick, I will make the in flight wifi work! 

-Jack Deneen, Bronxville, NY",1.1666666666666667,0.06198070316648413,48,41,6,1
Nothing up my sleeve—not even a little bag of peanuts.”,1.1666666666666667,0.05820252464746482,42,35,7,0
"Close your eyes, keep them shut, and, 
'Poof,' you're all upgraded to First Class!",1.1666666666666667,0.06198070316648413,48,41,6,1
The best way to sneak your bunny onto a plane.,1.1666666666666667,0.06744608262285645,42,36,5,1
"The Captain asks that everyone repeat after me, ""I believe I can fly.""",1.1666666666666667,0.07453559924999299,36,31,4,1
"Ahhhh folks, from the cockpit, just wanted to let you know that due to budget cuts we have merged our in-flight entertainment system with our Air Marshalls, so sit back and enjoy our new air magicians.",1.1666666666666667,0.06338902990667021,54,47,5,2
"And wah-lah, no pilot.”",1.1666666666666667,0.06744608262285645,42,36,5,1
No i will not trade seats with you back in coach if you show me a magic trick,1.1666666666666667,0.05436067275445348,48,40,8,0
I’m happy to make him stop kicking your seat.,1.163265306122449,0.060797833101086655,49,42,6,1
"Where we're going, we don't need roads.",1.163265306122449,0.060797833101086655,49,42,6,1
Watch closely as I make your leg room. . . disappear!,1.163265306122449,0.060797833101086655,49,42,6,1
"As your mid-flight entertainment, I will now attempt to saw your overhead luggage in half.",1.163265306122449,0.060797833101086655,49,42,6,1
"Sure, I'll just conjure up overhead bin space out of thin air.",1.163265306122449,0.060797833101086655,49,42,6,1
"Presto! And just like that, your oversized carry-on that you knew wouldn’t fit in the overhead is in Chicago.",1.163265306122449,0.06742934558367009,49,43,4,2
"Ladies, gentlemen, and... no one else, since no other genders exist! I will now show you an amazing Russian trick. This magic plane has not been inspected in months and lacks some parts, but it still flies!",1.163265306122449,0.05334825558285075,49,41,8,0
"I’m sorry, Sir, it’s part of our “No Tolerance” policy",1.163265306122449,0.05334825558285075,49,41,8,0
Hats will now replace life vests on every flight.,1.163265306122449,0.06742934558367009,49,43,4,2
"Anything is possible on the Hogwarts Express.""",1.1627906976744187,0.06597285053646279,43,37,5,1
"And magically, there goes another 2 inches of leg-room.",1.1627906976744187,0.06597285053646279,43,37,5,1
"Sure, my MAIN gig is airplane pilot, but with AI flying the plane, it's time for ""Enchantment at 30,000 Feet!",1.1627906976744187,0.06597285053646279,43,37,5,1
hocus pocus you CAN have the whole can of soda,1.1627906976744187,0.07389070794069667,43,38,3,2
I'm just here to distract you from the fact this plane has gone into an unrecoverable nose dive.,1.1627906976744187,0.05696487773914366,43,36,7,0
And who wants to get out of the middle seat ?,1.1627906976744187,0.07389070794069667,43,38,3,2
"And now, the small child behind you, sir, will begin kicking the back of your seat. Abracadabra!",1.1627906976744187,0.07389070794069667,43,38,3,2
"Yes, you have entered the nexus of employer desperation for warm bodies and the thriving gig economy.  For my next trick, your dissatisfaction will be silenced by your awareness of the futility of protest.",1.1627906976744187,0.07389070794069667,43,38,3,2
But our legroom wasn't here even before you waved you wand.,1.1627906976744187,0.07389070794069667,43,38,3,2
"Remember, the nearest door may not open!",1.1627906976744187,0.05696487773914366,43,36,7,0
"And for our last trick before take off, we will make all your luggage disappear!",1.1627906976744187,0.06597285053646279,43,37,5,1
And now the bulkhead passengers will disappear.,1.1627906976744187,0.05696487773914366,43,36,7,0
And now you'll think you're in your happy place,1.1627906976744187,0.05696487773914366,43,36,7,0
"Next, I shall make us fly.",1.1627906976744187,0.07389070794069667,43,38,3,2
I’ll grant any wish that does not involve seat size or legroom.,1.1627906976744187,0.06597285053646279,43,37,5,1
I’m here to tell you your luggage has disappeared!,1.1627906976744187,0.05696487773914366,43,36,7,0
"Fasten your seatbelts little boy, we are now on the way to Fantasy Island!",1.1627906976744187,0.06597285053646279,43,37,5,1
"And for my next trick, I shall make all your luggage disappear!",1.1627906976744187,0.05696487773914366,43,36,7,0
abracadabra your coke is now apple juice.,1.1627906976744187,0.06597285053646279,43,37,5,1
I used up two of my three wishes in speaking with the captain so dig deep,1.1627906976744187,0.07389070794069667,43,38,3,2
Watch me while I make two more inches from your seat pitch disappear!,1.1627906976744187,0.06597285053646279,43,37,5,1
Oh c'mon. This is your last chance to believe!,1.1627906976744187,0.07389070794069667,43,38,3,2
Our $14.95 cold burger or Covid. Your choice.,1.1627906976744187,0.07389070794069667,43,38,3,2
Does he have a delete button?,1.1627906976744187,0.06597285053646279,43,37,5,1
"And, voila, the free meal is gone but your bags miraculously show up at the terminal.",1.1627906976744187,0.05696487773914366,43,36,7,0
Presto! My luggage now takes up the entire overhead bin!,1.1627906976744187,0.06597285053646279,43,37,5,1
And that concludes the intermission act…now put your hands together for another 2 hour extravaganza of broadway cast-members singing songs that no one asked for,1.1627906976744187,0.07389070794069667,43,38,3,2
Presto: it’s 10 degrees in here.,1.1627906976744187,0.06597285053646279,43,37,5,1
I know most of you are used to flying Spirit. I promise we’re a more magical experience.,1.1627906976744187,0.07389070794069667,43,38,3,2
Prepare to be dazzled with the magic of condescension!,1.1627906976744187,0.06597285053646279,43,37,5,1
And just like that we are all gonna die in this plane,1.1627906976744187,0.07389070794069667,43,38,3,2
"And now for my next trick, I'll increase your legroom by 1 inch!",1.16,0.06614763944451561,50,44,4,2
"And for our next trick, we'll depart on time and arrive on time.",1.16,0.05965889433663176,50,43,6,1
...and for my next trick I will make human dignity disappear.,1.16,0.05965889433663176,50,43,6,1
"Alas, not even I can make your luggage appear.",1.16,0.06614763944451561,50,44,4,2
They've got room for this but not my carryon.,1.16,0.05965889433663176,50,43,6,1
And presto! You are connected to in-flight wi-fi!,1.16,0.06614763944451561,50,44,4,2
There’s no earthly way of knowing which direction we are going.,1.16,0.05237229365663822,50,42,8,0
I said I could make things fly...,1.16,0.07205440121667714,50,45,2,3
Behold! As I declassify documents without  a hat trick!,1.1590909090909092,0.07228658768525041,44,39,3,2
"The bad news is, we're leaking fuel.  The good news is, you have ""Ricky and his Tricky Sticky"" to keep this baby airborne!",1.1590909090909092,0.06456212749550704,44,38,5,1
"For my next trick, I'll find your luggage.",1.1590909090909092,0.07228658768525041,44,39,3,2
This is how we do it now.,1.1590909090909092,0.05577800511236321,44,37,7,0
If you upgraded to first class you would have seen Blue Man Group.,1.1590909090909092,0.05577800511236321,44,37,7,0
"Going to wave this, so we can guarantee your flight won’t be canceled",1.1590909090909092,0.06456212749550704,44,38,5,1
Enough with the jokes..I will now move onto magic.,1.1590909090909092,0.06456212749550704,44,38,5,1
"And for my final trick I'll unnoticeably move the seats three inches closer while raising airfare costs 15%""",1.1590909090909092,0.06456212749550704,44,38,5,1
"For my next trick, I'll make your tiny bit of legroom disappear.",1.1590909090909092,0.07228658768525041,44,39,3,2
"And for my next trick, I'm going to make your baggage instantly dissappear!",1.1590909090909092,0.05577800511236321,44,37,7,0
Comedy went out with leg room......,1.1590909090909092,0.05577800511236321,44,37,7,0
Now for some flight attendant magic...You may notice my right arm is turned totally backwards,1.1590909090909092,0.06456212749550704,44,38,5,1
"And with a flick of my wand, you'll feel the magic of flying in the 1930s.",1.1590909090909092,0.06456212749550704,44,38,5,1
If you cause a ruckus you will be sprinkled with fairy dust!,1.1590909090909092,0.05577800511236321,44,37,7,0
When I touch you with this wand you’ll be our pilot because we certainly need one.,1.1590909090909092,0.07228658768525041,44,39,3,2
"Pay us $18,000 more, and - poof! - you'll all be in flatbeds.",1.1590909090909092,0.05577800511236321,44,37,7,0
Everything will be just fine and please remember what I told you about your oxygen masks and life vests.,1.1590909090909092,0.06456212749550704,44,38,5,1
"For my next act,I will do the impossible: make your leg space disappear even more!",1.1590909090909092,0.06456212749550704,44,38,5,1
"Yes, I was an extra in the second Harry Potter movie.",1.1590909090909092,0.07228658768525041,44,39,3,2
"In the event of an emergency, the hidden door overhead will open and this magic wand will drop down; use it to grant your wish to land safely.",1.1590909090909092,0.07228658768525041,44,39,3,2
"And for my next trick, I will conjure up a bag of peanuts",1.1590909090909092,0.06456212749550704,44,38,5,1
"Abracadabra, increase their legroom!",1.1590909090909092,0.06456212749550704,44,38,5,1
"Now that you’ve agreed to it, I am going to make the fine print disappear.",1.1590909090909092,0.07228658768525041,44,39,3,2
Face it. It’s the only way I’ll keep you all happy between here and Fort Lauderdale.,1.1590909090909092,0.05577800511236321,44,37,7,0
"Ladies and gentlemen, allow me to distract you from your lingering climate guilt!",1.1590909090909092,0.06456212749550704,44,38,5,1
You must believe in me because I have the miracle of making man fly.,1.1578947368421053,0.05994682078436837,38,32,6,0
Would you like me to saw you in half?,1.1578947368421053,0.07082440560173317,38,33,4,1
"We can make your luggage, your connecting flight and your peace of mind all magically disappear.",1.1578947368421053,0.07082440560173317,38,33,4,1
"Surviving check-in, TSA and boarding may seem like enough magic, but just humor me a minute.""",1.1578947368421053,0.05994682078436837,38,32,6,0
"And for my next trick, you get a free bag of nuts",1.1578947368421053,0.05994682078436837,38,32,6,0
"You are now getting very sleepy, and you'll stay asleep and not bother me until we get to our destination.",1.1578947368421053,0.07082440560173317,38,33,4,1
"If your luggage reappears, I have another trick. I saw it in half.",1.1578947368421053,0.07082440560173317,38,33,4,1
"We'll be landing in Los Angeles in 10 minutes. My name is Tom -- I'm an actor, but someday I hope to get into directing ...",1.1578947368421053,0.07082440560173317,38,33,4,1
"No, on this airline we rely on the power of *magic*!",1.1578947368421053,0.05994682078436837,38,32,6,0
Watch as I make legroom disappear.,1.1578947368421053,0.05994682078436837,38,32,6,0
"There's no business class, like show business class.",1.1578947368421053,0.07082440560173317,38,33,4,1
Voila! The train is now 30 minutes late.,1.1578947368421053,0.08024070996398552,38,34,2,2
It's better if you're not conscious for this . . .,1.1578947368421053,0.07082440560173317,38,33,4,1
And for my next trick I'll disappear all the small print to screw you out of frequent-flier mileage.,1.1578947368421053,0.07082440560173317,38,33,4,1
For my next trick I am going to make all your overhead bags disappear .,1.1578947368421053,0.07082440560173317,38,33,4,1
I bet you didn't know that I'm the one levitating this plane.,1.1578947368421053,0.05994682078436837,38,32,6,0
"No, your suitcases haven't disappeared.",1.1578947368421053,0.05994682078436837,38,32,6,0
"And now, Ladies and Gentlemen, if this works we will be taking off!",1.1578947368421053,0.07082440560173317,38,33,4,1
"For my next trick, I will now make you believe that you have leg room.",1.1578947368421053,0.08024070996398552,38,34,2,2
I got magic! Your plane will be on time.,1.1578947368421053,0.08024070996398552,38,34,2,2
"Now, for my next trick, I will make a friendly flight attendant appear and serve real food.",1.1578947368421053,0.07082440560173317,38,33,4,1
And poof! Good food disappears!,1.1578947368421053,0.08024070996398552,38,34,2,2
"And now... the plane will be going down, ta-daaa",1.1578947368421053,0.07082440560173317,38,33,4,1
"My name is Saucy Seward, your song and dance man",1.1578947368421053,0.07082440560173317,38,33,4,1
You're safe.  We will never land.,1.1578947368421053,0.05994682078436837,38,32,6,0
"Ear pop, anyone?”",1.1578947368421053,0.07082440560173317,38,33,4,1
"I'm the Frequent Flier Fairy.  Only 10,000 more miles, and you get to do this all over again!",1.1578947368421053,0.07082440560173317,38,33,4,1
"And for my next trip, I shall make your in-flight meal disappear.",1.1578947368421053,0.05994682078436837,38,32,6,0
and the yellow light means flap your arms to this beat and stay in your seat,1.1578947368421053,0.07082440560173317,38,33,4,1
And now I’ll make your leg space disappear.,1.1578947368421053,0.07082440560173317,38,33,4,1
I wouldn't fly without it.,1.1578947368421053,0.05994682078436837,38,32,6,0
If you lived here you’d be home by now,1.1578947368421053,0.08024070996398552,38,34,2,2
"And for my next trick, I'll make your luggage disappear... oh, wait.",1.1568627450980393,0.05856150793360027,51,44,6,1
"For my first trick, I will make all in-flight amenities disappear.",1.1568627450980393,0.05856150793360027,51,44,6,1
"For my first trick, I will make us all fly!",1.1555555555555554,0.07075034750641404,45,40,3,2
"For my last trick, even though I just got here myself, I'd like to welcome you all to Cleveland.",1.1555555555555554,0.05463890236888298,45,38,7,0
"After the merger with Spirit, *Poof* three inches of legroom have now disappeared.",1.1555555555555554,0.06321005190772537,45,39,5,1
Ta da! No more middle seat!,1.1555555555555554,0.06321005190772537,45,39,5,1
"For my next magic trick, everyone gets a free biscoff cookie!",1.1555555555555554,0.06321005190772537,45,39,5,1
Let me tell you about our magical seatbelts.,1.1555555555555554,0.05463890236888298,45,38,7,0
I only said I could make your bags disappear. I never said anything about making them show up again.,1.1555555555555554,0.06321005190772537,45,39,5,1
"Another one of Biden's hires. No qualifications, just checks a box.",1.1555555555555554,0.06321005190772537,45,39,5,1
"And for my next trick, I will show you how to fasten a seat belt.",1.1555555555555554,0.07075034750641404,45,40,3,2
Abraaaaacadaaaaabra!!!! If you now look at your connecting flight you will see it has indeed.... been cancelled!,1.1555555555555554,0.06321005190772537,45,39,5,1
The Rockettes flight was overbooked.,1.1555555555555554,0.06321005190772537,45,39,5,1
"And now, as requested by an anonymous passenger, I'll show you how to make your partner disappear!",1.1555555555555554,0.05463890236888298,45,38,7,0
