caption,mean,precision,votes,not_funny,somewhat_funny,funny
Voila!  Your seats are now even smaller!,1.2542372881355932,0.0666174487376973,59,46,11,2
Even this magic wand will not get you into first class.,1.2542372881355932,0.0748785119257021,59,48,7,4
"And now...nutless chow mix!!!""",1.2542372881355932,0.0666174487376973,59,46,11,2
Welcome! I'm here to distract you from the discomfort of flying with us today.,1.2542372881355932,0.0708684556926678,59,47,9,3
"If there is a change in cabin pressure,I will pull an oxygen mask out of my hat. Please secure your mask before assisting your child.",1.2542372881355932,0.0666174487376973,59,46,11,2
". . . and this flight will be smooth, we'll arrive on time, your baggage will be found, and an attendant at the gate will refund half of the outrageous fare you paid.",1.2542372881355932,0.0748785119257021,59,48,7,4
And we’re flying!,1.2542372881355932,0.0708684556926678,59,47,9,3
We're already there!,1.2542372881355932,0.0666174487376973,59,46,11,2
Everyone needs a side-hustle in this economy.,1.2542372881355932,0.0666174487376973,59,46,11,2
Come fly with me.,1.2542372881355932,0.0748785119257021,59,48,7,4
Thank you for flying Budget Airways!  Now who wants to see their dignity reappear?,1.2542372881355932,0.07868446532925927,59,49,5,5
He just wanted to get his emotional support rabbit on board,1.2542372881355932,0.07868446532925927,59,49,5,5
"Since we, at Cheapo Air, offer no streaming services to save 995 pounds, I'll be your entertainment for this five hour flight.",1.2542372881355932,0.0666174487376973,59,46,11,2
I can grant any wish—except get you into first class.,1.2542372881355932,0.08231463187122504,59,50,3,6
And now for my next trick I will produce something edible.,1.2542372881355932,0.0666174487376973,59,46,11,2
My next trick is turning on the seatbelt sign!,1.2542372881355932,0.0708684556926678,59,47,9,3
You are now in first class,1.2542372881355932,0.0620760093786306,59,45,13,1
"Presto; Less seat space, Less leg room!",1.2542372881355932,0.0666174487376973,59,46,11,2
Look at me! Not at the flaming engine!,1.2542372881355932,0.0748785119257021,59,48,7,4
I’ll be your anger management specialist for today’s flight.,1.2542372881355932,0.0666174487376973,59,46,11,2
"And now for my next trick, I'll make airplane food actually taste good.",1.2542372881355932,0.0620760093786306,59,45,13,1
"""Levitation is my specialty, but I'm still working on getting to cruising altitude.",1.2542372881355932,0.0666174487376973,59,46,11,2
In flight magic wands can be purchased for twelve dollars…,1.2542372881355932,0.0748785119257021,59,48,7,4
Not even I can make airline food edible.,1.2542372881355932,0.0708684556926678,59,47,9,3
"And for my next trick, I’ll make your legroom dissapear!",1.2542372881355932,0.0708684556926678,59,47,9,3
Watch me pull some peanuts out of my hat! -,1.2542372881355932,0.0748785119257021,59,48,7,4
And that is how this plane is able to fly!,1.2542372881355932,0.0708684556926678,59,47,9,3
I wear this in hopes of deterring angry customers from punching me in the face again. I just want to do my job.,1.2542372881355932,0.0708684556926678,59,47,9,3
Say “ abra cadabra “ and you’ll be in first class,1.253968253968254,0.07144279314527355,63,51,8,4
For twenty bucks I can make your luggage arrive at your destination.,1.253968253968254,0.059732523654257956,63,48,14,1
For my next trick I need a volunteer who has no fear of heights.,1.2537313432835822,0.07471726772256006,67,56,5,6
"And for my next trick, I'll make the landing gear disappear!",1.2537313432835822,0.06500629194781038,67,53,11,3
"I can't make your seat bigger, but I can saw you in half.",1.2537313432835822,0.06142909700158688,67,52,13,2
My first trick is to stop that child sitting behind you from kicking the back of your seat.,1.25,0.06861335298462105,56,44,10,2
"And now, 5 hours of your life will vanish before your eyes.",1.25,0.06563466770327837,60,47,11,2
What's it worth to make your legroom reappear?,1.25,0.06861335298462105,56,44,10,2
I’m told you have a complaint about legroom?,1.25,0.07374180027192605,60,49,7,4
"Presto!"" One more inch of leg room",1.25,0.07200532073519275,52,41,9,2
Abracadabra!  You deserve first class and have been chosen to lead the revolt!,1.25,0.07374180027192605,60,49,7,4
"More legroom? Unfortunately, there's no spell for that.",1.25,0.061179554208144936,60,46,13,1
"Quiet the baby? No, but I can pull a rabbit out of a barf bag!",1.25,0.07319250547113999,56,45,8,3
"Nothing up my sleeve, you will sleep…",1.25,0.06563466770327837,60,47,11,2
Can we have our TV screens back?,1.25,0.06656289057129833,52,40,11,1
"And just like that, we'll have a smooth landing.",1.25,0.07750157099371281,56,46,6,4
"This plane weighs 175,000 pounds at take off. Do you really think it gets off the ground on aeronautics alone? Wingardium Leviosa!",1.25,0.06563466770327837,60,47,11,2
With this magic wand I will upgrade your mind to business class.,1.25,0.05892556509887896,64,49,14,1
I'll make the airplane smell disappear!,1.25,0.061179554208144936,60,46,13,1
"In the unlikely event of a loss of air pressure in the cabin, masks will magically appear above your heads.",1.25,0.06861335298462105,56,44,10,2
Look carefully at my wand and you will stop caring that the seats were moved even closer to one another than the last time you flew.,1.25,0.07319250547113999,56,45,8,3
Watch me as I make in-flight service disappear!,1.25,0.07319250547113999,56,45,8,3
"... and if you think I'll be able to make free snacks and drinks for you, you've had too much to drink in the departure lounge.  Have a nice flight!",1.25,0.07750157099371281,56,46,6,4
"For my next trick, I'll shrink your legroom even more!",1.25,0.07750157099371281,56,46,6,4
"Ethel, that's why they named it  ""The Magical Mystery Tour""",1.25,0.07319250547113999,56,45,8,3
"My next trick will cost you $35 or 3,500 frequent flier miles",1.25,0.07386710503565985,64,53,6,5
Remember that crying baby in seat 10b?,1.25,0.07319250547113999,56,45,8,3
"Hazzah! The child is asleep! Jokes, what can I get you ma'am?",1.25,0.07319250547113999,56,45,8,3
"When I wave this wand, it will feel like someone is kicking the back of your seat.",1.25,0.07319250547113999,56,45,8,3
Shazamm! You’re in first class,1.25,0.07319250547113999,56,45,8,3
"No sir, I cannot put a Petrificus Totalus spell on that young lad kicking your seat.",1.25,0.06563466770327837,60,47,11,2
Relax and enjoy your flight while we wait on the tarmac.,1.25,0.07319250547113999,56,45,8,3
"For my next trick,I will make $150 appear for someone willing to take the next flight.",1.25,0.07374180027192605,60,49,7,4
I'm your pilot and this is my control stick.,1.25,0.07374180027192605,60,49,7,4
"Finally, watch as I make your luggage disappear.",1.25,0.058387420812114225,56,42,14,0
The meal choices are rabbit or pigeon,1.25,0.07319250547113999,56,45,8,3
"You're in Economy, you were expecting Hugh Jackman?",1.25,0.07319250547113999,56,45,8,3
"Et voila! Your child will now behave their self for the entire duration of the flight! Save that one meltdown, wait no, two, or maybe three…",1.25,0.06299407883487121,64,50,12,2
Even I can’t make your seat go back.,1.25,0.07319250547113999,56,45,8,3
"If ever off we lift,I command your belongings not to shift",1.25,0.06563466770327837,60,47,11,2
"Sir, prepare to be blown away... literally.",1.25,0.07319250547113999,56,45,8,3
"Be careful opening the overhead bins, items may have been transformed in flight",1.25,0.06980602664478336,60,48,9,3
"And yes sir, 'leg-room' is also an illusion.",1.25,0.07374180027192605,60,49,7,4
I've never failed to stick a landing.,1.25,0.06861335298462105,56,44,10,2
"And now, with a wave of my wand, you will have landed, happy and in good spirits.",1.25,0.07319250547113999,56,45,8,3
Recline your seats for the illusion of comfort.,1.25,0.06370589892970319,56,43,12,1
"And now, for my next trick, a flight with no drama, except mine.",1.25,0.06370589892970319,56,43,12,1
I’m here to fit the carry on bags into the overhead bins.,1.25,0.058387420812114225,56,42,14,0
At least something’s in the air.,1.25,0.07319250547113999,56,45,8,3
And my final trick will be to land on time.,1.25,0.06861335298462105,56,44,10,2
"And next, I'll make your luggage disappear!",1.25,0.06861335298462105,56,44,10,2
"And for my next trick, I am going to land the plane.",1.25,0.06861335298462105,56,44,10,2
Magicians  beyond borders,1.25,0.06861335298462105,56,44,10,2
"'This airline isn't so bad--sure, the entertainment isn't amazing, but the jugglers in baggage handling were fine with three bags a person, and the mime at the ticket counter never said anything about my support balloon animal.'",1.25,0.06563466770327837,60,47,11,2
"There is an additional fee of $35 per passenger for me to stop doing magic tricks on this flight. Otherwise, make sure your seat belts are buckled low & tight across your waist, and your tray table is in its upright and locked position and we are ready to depart.",1.25,0.06980602664478336,60,48,9,3
"And for our next trick, we make both your money and comfort disappear!",1.2465753424657535,0.06100634345154056,73,58,12,3
Next stop Hogwarts!,1.2463768115942029,0.06659991468908871,69,56,9,4
"Welcome to Houdini Airlines, where we have business class, economy class, and magic class.",1.2461538461538462,0.06213651700539812,65,51,12,2
And with a wave of my wand we will magically arrive at our destination without mentioning that we’re a tiiiiiiiiiiny bit short on fuel”,1.2461538461538462,0.06589169884235313,65,52,10,3
...and now in lieu of our in-flight movie...,1.2459016393442623,0.06877435069968206,61,49,9,3
"And like magic, you have 2 more inches of leg room.",1.2459016393442623,0.06030767065058533,61,47,13,1
"For my next trick, I'll make the crying baby in 11b stop crying.",1.2459016393442623,0.06877435069968206,61,49,9,3
"I'm part of the airline's effort to increase leg room""



Gerry Broderick, Milwaukee, WI",1.2459016393442623,0.06877435069968206,61,49,9,3
"Abracadabra, Bernoulli's principal is now a scientific fact.",1.2459016393442623,0.06030767065058533,61,47,13,1
Poof! Your checked bags have disappeared!,1.2459016393442623,0.06030767065058533,61,47,13,1
The captain says this works best for gaining altitude...,1.2459016393442623,0.06877435069968206,61,49,9,3
"And now, watch as I make all your luggage disappear!",1.2459016393442623,0.0726385531353327,61,50,7,4
Imagine a moment ago you were on this flight without any seats! Now for my next trick cabin space will become fully occupied and we will gate check your bag for free!,1.2459016393442623,0.06030767065058533,61,47,13,1
"You will all wake up when I count to three, and you will remember the flight turbulence as a happy romp in a bouncy castle.",1.2459016393442623,0.06467969717562974,61,48,11,2
Now watch as I make the pilots reappear. Presto... Presto... PRESTO!,1.2459016393442623,0.06877435069968206,61,49,9,3
"OK, and now, with the tip of my wand, masks are...NO LONGER REQUIRED!",1.2459016393442623,0.0726385531353327,61,50,7,4
and now I will attempt to fly,1.2456140350877194,0.07203061585563864,57,46,8,3
Behold ! …the flying stick !,1.2456140350877194,0.07203061585563864,57,46,8,3
Now watch as I make our estimated arrival time disappear.,1.2456140350877194,0.06754141843715218,57,45,10,2
Who needs wings?,1.2456140350877194,0.08025922035892687,57,48,4,5
"I apologize specifically to your child, but, due to airline regulations, I can't bring the rabbit back until we are off the plane and out of the airport.",1.2456140350877194,0.06754141843715218,57,45,10,2
"Alacazam, alacazin, your luggage has taken off for Berlin.",1.2456140350877194,0.0575213905640526,57,43,14,0
"To start the flow of oxygen, reach up and pull the rabbit toward you, fully extending its ears.",1.2456140350877194,0.07625599016852828,57,47,6,4
"You’ve been a great  audience, only three more hours til takeoff on our magic carpet!",1.2456140350877194,0.06754141843715218,57,45,10,2
When you wake the inflight meal will seem edible.,1.2456140350877194,0.06273178451520713,57,44,12,1
"A rabbit and doves, and I can't get a ham sandwich past security!",1.2456140350877194,0.07203061585563864,57,46,8,3
"What, did you really believe that this metal tube flies because of science?",1.2456140350877194,0.07625599016852828,57,47,6,4
Presto chango--now we're Delno.,1.2456140350877194,0.07203061585563864,57,46,8,3
"Well, that's my time, I have a show on another plane in a minute.",1.2456140350877194,0.07203061585563864,57,46,8,3
"And for my next trick, I will hypnotize the kid in the second aisle",1.2456140350877194,0.06754141843715218,57,45,10,2
"Rabbit, roses or almonds, sir?",1.2456140350877194,0.06754141843715218,57,45,10,2
And for my next trick... a three-hour delay!,1.2456140350877194,0.07625599016852828,57,47,6,4
"And now for a small fee, I’ll make your luggage reappear.",1.2456140350877194,0.06273178451520713,57,44,12,1
Ta-da! Your seat cushion is now a flotation device.,1.2456140350877194,0.06754141843715218,57,45,10,2
"Sorry, but making myself disappear is not an option.",1.2456140350877194,0.07203061585563864,57,46,8,3
And POOF ! Your luggage will reappear,1.2456140350877194,0.07203061585563864,57,46,8,3
"And if any of you opens a window on this red-eye, they'll get a little tap from the magic stun wand.",1.2456140350877194,0.06273178451520713,57,44,12,1
Now watch while I make your legroom disappear.,1.2456140350877194,0.07203061585563864,57,46,8,3
"My show will feature coins, scarves, cards, and whatever else was returned after my TSA screening.",1.2456140350877194,0.07203061585563864,57,46,8,3
And now for you folks in coach I'll make the free beverages disappear,1.2424242424242424,0.0649927593622037,66,53,10,3
"Well, you believed in magic when you packed your carry-on!",1.2419354838709677,0.06375141715523479,62,49,11,2
"I did it to your free meals and your leg room, so don't make me use this thing on what little dignity you have left!",1.2419354838709677,0.07156734345248521,62,51,7,4
"And, yes I am the reason for our emergency landing in Denver. Like magic.",1.2419354838709677,0.07156734345248521,62,51,7,4
For a small gratuity I can even change that seat-kicking kid to a different row.,1.2413793103448276,0.07504926725275983,58,48,6,4
now to predict our chances for an on-time takeoff,1.2413793103448276,0.07504926725275983,58,48,6,4
"Now I will levitate us all 30,000 feet into the air. And if that ain't magic, nothing is.",1.2413793103448276,0.06650166283683627,58,46,10,2
"For my next trick, I will turn tiny bags of mini-pretzels into lobster rolls.",1.2413793103448276,0.0789769155686149,58,49,4,5
Anybody see an escaped rabbit on this plane?,1.2413793103448276,0.06650166283683627,58,46,10,2
And voila!  Your legroom is gone.,1.2413793103448276,0.07090438517905794,58,47,8,3
"… and now I'll make your luggage disappear. Oops, too late.",1.2413793103448276,0.06650166283683627,58,46,10,2
Watch as I make these towers disappear!,1.2413793103448276,0.06650166283683627,58,46,10,2
"""Welcome to Hocus-Pocus Airlines!""",1.2413793103448276,0.07504926725275983,58,48,6,4
"And for my next trick, I'm going to need four or five volunteers to help me subdue the drunk in seat 23D!",1.2413793103448276,0.06650166283683627,58,46,10,2
Watch now as I make your will to live disappear!,1.2413793103448276,0.07090438517905794,58,47,8,3
I am here to explain what to do in the case of a water landing.,1.2413793103448276,0.06650166283683627,58,46,10,2
"And now, as we continue Economy Class's new form of in-flight entertainment...!",1.2413793103448276,0.06178600555553249,58,45,12,1
"I will make a flight crew appear, maybe.",1.2413793103448276,0.07090438517905794,58,47,8,3
"For those of you in economy, this is just a stick.",1.2413793103448276,0.07504926725275983,58,48,6,4
"If cabin pressure changes, a rabbit will drop from the panel above you.",1.2413793103448276,0.06650166283683627,58,46,10,2
And for our dinner entrée: pulled rabbit!,1.2407407407407407,0.06961602376844407,54,43,9,2
"And in the event of rude or drunken behaviour, I'll wave my magic wand and you will all dissapear.",1.2407407407407407,0.07446611836866017,54,44,7,3
"If you believe, and have a credit card, anything is possible!",1.2407407407407407,0.07446611836866017,54,44,7,3
"“Remember, if you really, really believe, your luggage will appear on the carousel!”",1.2407407407407407,0.07901907873711286,54,45,5,4
We make Newark a wonderland!,1.2407407407407407,0.07446611836866017,54,44,7,3
And with this in my hand we'll be able to land!,1.2407407407407407,0.07446611836866017,54,44,7,3
This is a pilot program.  He wants me to pull a landing gear out of my hat!,1.2407407407407407,0.07446611836866017,54,44,7,3
"We no longer offer seat belts, this is just as effective.",1.2407407407407407,0.06961602376844407,54,43,9,2
"For my next trick, I will keep the oxygen flowing-even if the bag does not inflate...",1.2407407407407407,0.05872620136016884,54,41,13,0
Not only will we take off on time but your baggage will be at your destination. Just kidding!,1.2407407407407407,0.06961602376844407,54,43,9,2
"And through my magic, we will get you to your destination safe and on time.",1.2407407407407407,0.06961602376844407,54,43,9,2
My mother would love this!,1.2407407407407407,0.06961602376844407,54,43,9,2
"For you in-flight meal this evening, we offer a choice of rabbit or dove.",1.2407407407407407,0.06961602376844407,54,43,9,2
Hang tight as I attempt to make the captain reappear after my scheduled break.,1.2407407407407407,0.06961602376844407,54,43,9,2
Watch me make your leg room disappear.,1.2407407407407407,0.07446611836866017,54,44,7,3
"And now for my most amazing magic trick, I will give you lower fares, more leg room, on-time flights and stellar service.",1.2407407407407407,0.07446611836866017,54,44,7,3
"Good afternoon,I am your captain. Do you want to see this plane land itself?  Abracadabra!",1.2407407407407407,0.06961602376844407,54,43,9,2
A chunk of metal this heavy ain't gonna fly itself.,1.2407407407407407,0.08332362704556721,54,46,3,5
On 3 everyone: ‘I can fly!’,1.2407407407407407,0.06961602376844407,54,43,9,2
"Sorry, TSA confiscated the rabbit in my hat",1.2407407407407407,0.06440169831426679,54,42,11,1
"Hey, Main Cabin, how about a big welcome cheer for the good folks in First and Business!",1.2407407407407407,0.07446611836866017,54,44,7,3
"And for my ultimate magic trick, we shall arrive on time.",1.2407407407407407,0.07446611836866017,54,44,7,3
"Standing room tickets aren’t bought, they’re earned",1.2407407407407407,0.06961602376844407,54,43,9,2
"I'm your Captain. Make a wish, any wish!",1.2407407407407407,0.07446611836866017,54,44,7,3
Pilot was my second choice,1.2407407407407407,0.06440169831426679,54,42,11,1
Watch very closely now and you will see the impossible . . . a smooth landing on time followed by all your luggage on a carousel within ten minutes!,1.2407407407407407,0.07446611836866017,54,44,7,3
Fasten your seat belts. The mariachi band is next.,1.2407407407407407,0.07446611836866017,54,44,7,3
"And,we will get you there,on time.",1.2407407407407407,0.07901907873711286,54,45,5,4
We pilots dress this way to make our passengers feel better.,1.2407407407407407,0.06961602376844407,54,43,9,2
"Hmm, that didn't bring the pilot back. Let's try again.",1.2407407407407407,0.05872620136016884,54,41,13,0
And for my next trick the captain will regain consciousness!,1.2407407407407407,0.06961602376844407,54,43,9,2
And for tonight's in flight entertainment we have...,1.2407407407407407,0.07446611836866017,54,44,7,3
...and there goes your leg room.,1.2407407407407407,0.07446611836866017,54,44,7,3
". ""Hello, I am your pilot. Captain Peter Pan...""",1.2407407407407407,0.07901907873711286,54,45,5,4
Trick or pretzels?,1.2388059701492538,0.06411754328743913,67,54,10,3
"When I wave my wand one more time, everyone not wearing  mask will vanish.",1.2380952380952381,0.07052682201689092,63,52,7,4
"For my next trick, all your luggage will disappear.",1.2380952380952381,0.06679820247360646,63,51,9,3
....And now to attempt a trick you will hardly ever see these days -- we will land this plane on time! -- and your luggage will appear in the terminal!!,1.2380952380952381,0.06679820247360646,63,51,9,3
inflight entertainment should be optional,1.2380952380952381,0.07052682201689092,63,52,7,4
"In the event of a decompression, a rabbit will automatically appear in front of you.",1.2380952380952381,0.06284876358057999,63,50,11,2
"And now for my next trick,""The Levitating Airplane!""",1.2372881355932204,0.06549270642063962,59,47,10,2
"When you wake, that feeling in your back will be a deep tissue massage.",1.2372881355932204,0.06981223481771645,59,48,8,3
For my next trick... landing.,1.2372881355932204,0.06981223481771645,59,48,8,3
And now . . . the trick of the disappearing luggage!,1.2372881355932204,0.06981223481771645,59,48,8,3
For my next trick...levitation.,1.2372881355932204,0.06981223481771645,59,48,8,3
We’re testing out a new form of in-flight entertainment.,1.2372881355932204,0.06981223481771645,59,48,8,3
"And just like that, I made all your reasonable flight expectations vanish.",1.2372881355932204,0.07387964311085886,59,49,6,4
Alacazam! WiFi is now available for purchase or free for our for airline card holders.,1.2372881355932204,0.06549270642063962,59,47,10,2
Tada! Your bags are now gone!,1.2363636363636363,0.07323058165814894,55,45,7,3
"It's okay, I'm an emotional support magician.",1.2363636363636363,0.07323058165814894,55,45,7,3
And...presto! The extra seat space you paid for is gone.,1.2363636363636363,0.06847859093607393,55,44,9,2
Who wants to see me pull a bag of pretzels from behind your ear.,1.2363636363636363,0.06337126117720455,55,43,11,1
"I can get us there in the blink of an eye, or we can sit for 6 hours on the tarmac - your call.",1.2363636363636363,0.06847859093607393,55,44,9,2
The pilot has just told me we’ll be making a brief stop in Hogwarts on our way to Heathrow in lieu’ of an actual meal.,1.2363636363636363,0.06847859093607393,55,44,9,2
"Our flight is on time,and it's magical!",1.2363636363636363,0.07323058165814894,55,45,7,3
This plane travels at Warp Speed so we will be in Los Angeles in four minutes.,1.2363636363636363,0.07769246271931077,55,46,5,4
"And like magic, the oxygen mask will appear and we recommend you put it on or you will disappear.",1.2363636363636363,0.06337126117720455,55,43,11,1
"Presto, Change-o, you're now in 1st class!!!!",1.2363636363636363,0.06847859093607393,55,44,9,2
POOF   You are now in economy seating,1.2363636363636363,0.06847859093607393,55,44,9,2
And for my next trick-- creating legroom and the chance at a beverage,1.2363636363636363,0.07323058165814894,55,45,7,3
Who says flying isn't what it used to be?,1.2363636363636363,0.06847859093607393,55,44,9,2
"Daddy, isn't torture covered by the Warsaw Convention?",1.2363636363636363,0.06847859093607393,55,44,9,2
I am here to bother you all flight long!,1.2363636363636363,0.07769246271931077,55,46,5,4
Surprise!!! Your destination has been changed to Mauna Loa,1.2363636363636363,0.06847859093607393,55,44,9,2
I actually made us fly btw.,1.2363636363636363,0.06847859093607393,55,44,9,2
"I've magically cut your legroom in half, and now I'll make your check-in luggage disappear!",1.2363636363636363,0.06847859093607393,55,44,9,2
"And now, I will magically increase leg room for the first two rows.",1.2363636363636363,0.06337126117720455,55,43,11,1
I'm here for the Berkowitz bar mitzvah.,1.2363636363636363,0.0819116562937911,55,47,3,5
I will now pull an emotional support animal out of my hat.,1.2363636363636363,0.06847859093607393,55,44,9,2
I'll be your inflight entertainment today,1.2363636363636363,0.06847859093607393,55,44,9,2
Watch me pull a therapy pet out of my hat!,1.2363636363636363,0.06337126117720455,55,43,11,1
"And with three waves of my wand, your baggage shall simply disappear!",1.2363636363636363,0.06847859093607393,55,44,9,2
"Sit back, relax and enjoy the illusion of great service.",1.2363636363636363,0.07323058165814894,55,45,7,3
"They send me on every Boeing 737 Max flight, just in case...",1.2363636363636363,0.06847859093607393,55,44,9,2
"Now what I can’t do is transport you to first class, but I can get you a pack of stale peanuts for the low low price of $3.99, your sanity, and your gut health.",1.2363636363636363,0.07769246271931077,55,46,5,4
With this wand I can make your reservation…disappear!,1.2363636363636363,0.07769246271931077,55,46,5,4
Abracadabra wheels down!,1.2363636363636363,0.06337126117720455,55,43,11,1
"Presto change-o!  For an additional fee, of course.",1.2363636363636363,0.07323058165814894,55,45,7,3
"Now, watch carefully as your legroom continues to disappear.",1.2363636363636363,0.06847859093607393,55,44,9,2
And poof! We lost your luggage!,1.2363636363636363,0.07323058165814894,55,45,7,3
And now I will make you levitate.,1.2363636363636363,0.07323058165814894,55,45,7,3
If you were a real magician we would have already taken off.,1.2363636363636363,0.07323058165814894,55,45,7,3
Just wait. The clown from business class will join me in a minute.,1.2363636363636363,0.06337126117720455,55,43,11,1
"So, relax and sit back. We’ll have you in Hell in just about… what am I talking about? You’re already there.",1.2363636363636363,0.06337126117720455,55,43,11,1
"Ladies and gentlemen my magic show will entertain you for the next three hours and 24 minutes, until our landing in Los Angeles!",1.2363636363636363,0.06847859093607393,55,44,9,2
For only $49.95 we can transform the child to a nice Louis Vuitton.,1.2363636363636363,0.07769246271931077,55,46,5,4
How else do you think this shit works?,1.2363636363636363,0.06337126117720455,55,43,11,1
And for my next trick... Your bags will magically appear on the luggage carousel on time and undamaged!,1.2363636363636363,0.07769246271931077,55,46,5,4
