caption,mean,precision,votes,not_funny,somewhat_funny,funny
Our numbers this quarter are terrifying.,2.0,1.0,2,1,0,1
We need to make a few cuts.,1.875,0.20155644370746376,16,6,6,4
I'm afraid we have to can 3 of you.,1.8181818181818181,0.1818181818181819,11,3,7,1
I’m afraid we’re going to need to make some additional cuts.,1.75,0.25,12,6,3,3
Oh Come on! Lighten up!,1.75,0.25,12,6,3,3
Thank you for carving out time to meet.,1.7272727272727273,0.23706190564373264,11,5,4,2
And there will have to be more cuts.,1.6666666666666667,0.23570226039551584,9,4,4,1
So - can any of you honestly say you were great this year,1.6666666666666667,0.28867513459481287,9,5,2,2
I’ll need that pie chart by the end of the month.,1.6666666666666667,0.28867513459481287,9,5,2,2
Let's carve out a solution here.,1.6666666666666667,0.28867513459481287,9,5,2,2
We'll be making some cuts.,1.6666666666666667,0.23570226039551584,9,4,4,1
Meeting's over. Let's get smashed.,1.6666666666666667,0.28867513459481287,9,5,2,2
"I see some of you aren't happy about our latest incisions, but there are going to be more cuts.",1.6666666666666667,0.23570226039551584,9,4,4,1
It  has been brought to my attention that someone has been leaving seeds on the toilet seat.,1.6666666666666667,0.28867513459481287,9,5,2,2
"Ok, so where's the chart?",1.6666666666666667,0.28867513459481287,9,5,2,2
"And lastly, you will all be working this weekend!",1.6666666666666667,0.28867513459481287,9,5,2,2
"Jack, ""pumpkin spiced pumpkins?"" Don't be ridiculous!",1.6666666666666667,0.28867513459481287,9,5,2,2
I’ll try and keep this brief. I realize we all have front porches to get home to.,1.6666666666666667,0.1880253582725887,12,5,6,1
I'm not seeing the fire in any of your eyes.,1.6666666666666667,0.23570226039551584,9,4,4,1
Some of you are about to get canned.,1.6666666666666667,0.28867513459481287,9,5,2,2
I’m very excited to announce our merger with the pie division.,1.6666666666666667,0.1880253582725887,12,5,6,1
The Board's going to look very different by Thanksgiving.,1.6666666666666667,0.28867513459481287,9,5,2,2
It seems we've really spooked the markets again.,1.6666666666666667,0.23570226039551584,9,4,4,1
". “ I’ll say it again, if you don’t get it right this time, heads will roll and it won’t be pretty.”",1.6666666666666667,0.28867513459481287,9,5,2,2
You can expect layoffs to come November 1,1.6666666666666667,0.28867513459481287,9,5,2,2
"Thank you for your service on this board of directors. We will be ceasing operations,however,on November 1st.",1.6363636363636365,0.27872199485010707,11,7,1,3
Good news… our pie chart shows a holiday increase!,1.6363636363636365,0.24393468845452246,11,6,3,2
"Effective November 1st, you are all terminated.",1.6363636363636365,0.2032789070454354,11,5,5,1
I'm afraid our only option is to make more cuts.,1.6363636363636365,0.24393468845452246,11,6,3,2
"- ""I understand your concerns, but I really think this could light a fire in all of us""",1.6363636363636365,0.2032789070454354,11,5,5,1
I'd like to start off by saying I'm pleased to see that everyone read the recent dress code memo.,1.625,0.3238992347717331,8,5,1,2
Competition. Squash 'em!,1.625,0.26305214040457564,8,4,3,1
"Gentlemen, it is time to make a pie.",1.625,0.3238992347717331,8,5,1,2
"And, I'm happy to announce, you're all slated to get smashed on October 31!",1.625,0.3238992347717331,8,5,1,2
"Come November 1st, you'll all be canned.",1.625,0.3238992347717331,8,5,1,2
You'll be seeing some new faces around here soon.,1.625,0.26305214040457564,8,4,3,1
The threat of being wiped out by the end of the month is real!,1.625,0.26305214040457564,8,4,3,1
We’re going to get so lit on halloween.,1.625,0.3238992347717331,8,5,1,2
"In order to grow the pie, one of you has to be canned.",1.625,0.26305214040457564,8,4,3,1
"Good Morning, Jack, Jackie, Jack-of-all Trades. Good to see you Jack Man, Jacko,  Jack-in-a-Million....",1.625,0.3238992347717331,8,5,1,2
It's nice to see so many new faces here.,1.625,0.26305214040457564,8,4,3,1
So... just how much is this new dental plan going to cost us?,1.625,0.3238992347717331,8,5,1,2
"Now, I believe we should spice things up.",1.625,0.26305214040457564,8,4,3,1
Next agenda item: Dental Benefits.,1.625,0.26305214040457564,8,4,3,1
Let’s start our meeting today by turning our frowns upside down!,1.625,0.3238992347717331,8,5,1,2
It’s unanimous. We’ll be adding dental benefits.,1.625,0.26305214040457564,8,4,3,1
We believe we can copyright that politician's color.,1.625,0.3238992347717331,8,5,1,2
First the good news. Nobody's getting canned.”,1.625,0.26305214040457564,8,4,3,1
"I promise you, if we can make it through this patch, we'll all get a head!",1.625,0.3238992347717331,8,5,1,2
"Well, I see by your faces you're not pleased with the cuts.",1.625,0.3238992347717331,8,5,1,2
Well.  I'm glad we're of the same mind.,1.625,0.18298126367784998,8,3,5,0
Think!  Show me you're not vegetables.,1.625,0.18298126367784998,8,3,5,0
We all have to make a few more cuts.,1.625,0.26305214040457564,8,4,3,1
Further cuts are coming.,1.625,0.3238992347717331,8,5,1,2
I don’t know about the rest of you but I’m lit!,1.625,0.3238992347717331,8,5,1,2
Last quarter’s earnings were smashing. It’s clearly after midnight. Let’s adjourn for the day.,1.625,0.26305214040457564,8,4,3,1
"Have you considered a pumpkin stem transplant, Jerry?",1.625,0.26305214040457564,8,4,3,1
Ok I think it's time for us to settle on an official face for our brand,1.625,0.26305214040457564,8,4,3,1
Flameless candle sales are down this year”,1.625,0.26305214040457564,8,4,3,1
"So, who volunteers to have their brains scooped out and eaten this year?",1.6,0.26666666666666666,10,6,2,2
I am happy to tell you that all of you will be transferred to our pie division.,1.6,0.26666666666666666,10,6,2,2
What we need around here is a little spice !,1.6,0.22110831935702663,10,5,4,1
I’m afraid we have to make a few more cuts,1.6,0.22110831935702663,10,5,4,1
"OK, who called the gourd meeting?",1.6,0.26666666666666666,10,6,2,2
"Remember, we're not looking to scare away investors.",1.6,0.16329931618554516,10,4,6,0
So what’s everyone doing this weekend?,1.6,0.39999999999999997,5,3,1,1
"Yes, we will squash the competition.",1.5714285714285714,0.2973808570665904,7,4,2,1
I’ve heard from HR that there have been some complaints about our new company dress code.,1.5714285714285714,0.2973808570665904,7,4,2,1
Why so glum? You will live on in pies.,1.5714285714285714,0.36885555678165877,7,5,0,2
"I'm open to any gourd ideas, Jacks.",1.5714285714285714,0.2973808570665904,7,4,2,1
keep your heads on straight,1.5714285714285714,0.20203050891044222,7,3,4,0
Why all the sad faces?,1.5714285714285714,0.2973808570665904,7,4,2,1
"Next week's dress code, seersucker.",1.5714285714285714,0.2973808570665904,7,4,2,1
"As all you know, his is our last board meeting...",1.5714285714285714,0.2973808570665904,7,4,2,1
Are you out of your gourds?,1.5714285714285714,0.2973808570665904,7,4,2,1
"I’m sorry, but the ghosts are getting the bonuses this year",1.5714285714285714,0.36885555678165877,7,5,0,2
It looks like we have some new faces.,1.5714285714285714,0.2973808570665904,7,4,2,1
"And finally, who will be going to Sleepy Hollow this year?",1.5714285714285714,0.2973808570665904,7,4,2,1
I know the outlook is grim but we don’t need to lose our heads over this.,1.5714285714285714,0.2973808570665904,7,4,2,1
"So, due to temporary supple-side shortages, we're asking for volunteers.",1.5714285714285714,0.36885555678165877,7,5,0,2
You've all been transferred to our new Thanksgiving pie division.,1.5714285714285714,0.36885555678165877,7,5,0,2
I called this gourd meeting to squash any rumors of  jackal interns taking over your jobs.,1.5714285714285714,0.2973808570665904,7,4,2,1
"Wasn't this fun? Next month we'll do this again, but with turkeys!",1.5714285714285714,0.36885555678165877,7,5,0,2
Not everyone is cut out to be an confident leader.,1.5714285714285714,0.2973808570665904,7,4,2,1
"I know, I know, you're all wondering how I maintain my youthful appearance.",1.5714285714285714,0.2973808570665904,7,4,2,1
I want to light a fire in each of you.,1.5714285714285714,0.2973808570665904,7,4,2,1
We have to get right to work before our heads start to rot.,1.5714285714285714,0.2973808570665904,7,4,2,1
"On the other hand, I'm glad we tested it on ourselves before we released it to the general public.",1.5714285714285714,0.2973808570665904,7,4,2,1
I'm afraid we're going to have to put our heads together over this seed shortage.,1.5714285714285714,0.2973808570665904,7,4,2,1
You should see what they’re making us wear for thanksgiving,1.5714285714285714,0.2973808570665904,7,4,2,1
Do I have to light a fire under you to get a reaction?,1.5714285714285714,0.2973808570665904,7,4,2,1
"Over to you, Jack.",1.5714285714285714,0.2973808570665904,7,4,2,1
I don't see that fire in some of your eyes anymore..,1.5714285714285714,0.2973808570665904,7,4,2,1
"now this won’t be easy to hear, but many of us may not be here come November",1.5714285714285714,0.36885555678165877,7,5,0,2
Let‘s talk about diversity in the workplace…,1.5555555555555556,0.2421610524189263,9,5,3,1
Take away the big chair and the permanent smile and I'm no different than any of you.,1.5555555555555556,0.2421610524189263,9,5,3,1
Let me remind you how fortunate you are to be picked for this!,1.5555555555555556,0.1756820922315766,9,4,5,0
Next on the agenda - Board diversification.,1.5555555555555556,0.2939723678960656,9,6,1,2
"By the first of November, you’ll all be out on the front porch",1.5555555555555556,0.2939723678960656,9,6,1,2
Smashing.,1.5555555555555556,0.2939723678960656,9,6,1,2
"If sales don’t pick up soon, you’re all going to get canned.",1.5555555555555556,0.2421610524189263,9,5,3,1
Projections show we’re going to get smashed,1.5555555555555556,0.2939723678960656,9,6,1,2
‘We’ve saved thousands by eliminating dental benefits.’,1.5555555555555556,0.2939723678960656,9,6,1,2
I don’t see that spark in your eyes anymore.,1.5555555555555556,0.2421610524189263,9,5,3,1
The good news is you've all been selected to be in the pumpkin pie eating contest.,1.5555555555555556,0.2939723678960656,9,6,1,2
I am not sure if any of you are really cut out for this,1.5555555555555556,0.2421610524189263,9,5,3,1
"Ok, with Monday’s deadline fast approaching, let’s get some faces glowing with new ideas …",1.5555555555555556,0.2421610524189263,9,5,3,1
"No Jack, I don't think we have a diversity problem at this company.",1.5555555555555556,0.2421610524189263,9,5,3,1
So no one has the guts to speak up?,1.5555555555555556,0.2939723678960656,9,6,1,2
They want our heads on a platter,1.5555555555555556,0.2421610524189263,9,5,3,1
I’m glad you could all carve out some time to be here today.,1.5555555555555556,0.1756820922315766,9,4,5,0
Let's go around the room and introduce ourselves. I'm seeing a bunch of new faces in the room this year.,1.5454545454545454,0.24729946379518986,11,7,2,2
"Gentlemen, let me begin by stating the obvious: diversity is an issue amongst our ranks.",1.5384615384615385,0.24325212770525995,13,9,1,3
Just once I'd like to see one of your heads light up with a good idea.,1.5384615384615385,0.21529302081726495,13,8,3,2
Thank you all for contributing to this morning's coffee.,1.5,0.22360679774997896,10,6,3,1
Heads are gonna roll.,1.5,0.32732683535398854,8,6,0,2
Dental? Why dental?,1.5,0.22360679774997896,10,6,3,1
"Let's patch up all our differences, carve out some time to try to illuminate the problems and make headway before the 31st.",1.5,0.1889822365046136,8,4,4,0
"I can't tell if you're all happy or sad about being off the porch and back 
in the office again",1.5,0.22360679774997896,6,3,3,0
Why was the Jack-o'-lantern afraid? It had no guts!,1.5,0.3415650255319866,6,4,1,1
"So, who's going to donate their seed for next year’s crop?",1.5,0.2672612419124244,8,5,2,1
We're throwing out the whole Board at the end of the month.,1.5,0.1889822365046136,8,4,4,0
You guys ought to sample some of the stuff that grows in the patch next to me.,1.5,0.7071067811865476,2,1,1,0
I can see right through that smile.,1.5,0.2672612419124244,8,5,2,1
I'm happy to see that none of you got smashed last night.,1.5,0.22360679774997896,6,3,3,0
"Come November 1st, you’re all fired!",1.5,0.3415650255319866,6,4,1,1
"If shareholders want a slice of the pie,heads will roll.",1.5,0.22360679774997896,10,6,3,1
Pumpkin Bobbleheads,1.5,0.2672612419124244,8,5,2,1
"If they hadn’t scooped my brains out , I’d remember why I called this meeting.",1.5,0.32732683535398854,8,6,0,2
"Sorry to say gentlemen, Jack-O-Lanterns are out and Pumpkin lattes are the latest.",1.5,0.3415650255319866,6,4,1,1
"I don't need to see light bulbs coming on over your heads, but a flicker or two from inside would be nice.",1.5,0.3415650255319866,6,4,1,1
We’re going to need to make more cuts.,1.5,0.22360679774997896,6,3,3,0
Turn those frowns upside down.,1.5,0.22360679774997896,6,3,3,0
"Ok, who has the pie chart?",1.5,0.32732683535398854,8,6,0,2
"Unfortunately, there will be candles only for some of you this year’s halloween bonus",1.5,0.3415650255319866,6,4,1,1
This is our quarter to capture emoji market share.,1.5,0.3415650255319866,6,4,1,1
Rest easy it is November 1. You will be safe for another year.,1.5,0.22360679774997896,6,3,3,0
Seize the moment gentlemen. This is our time to shine.,1.5,0.3415650255319866,6,4,1,1
I see good pumpkins in this room. But I don't see a great pumpkin.,1.5,0.2672612419124244,8,5,2,1
I have some very good news. This year's pumpkin spice kickoff has been moved up to July 4.,1.5,0.16666666666666669,10,5,5,0
"Okay, let's roll out the cut out plan.",1.5,0.3415650255319866,6,4,1,1
Wait until you see what I have planned for the November meeting.,1.5,0.2672612419124244,8,5,2,1
"All in favor of apple pie next year, smile.",1.5,0.3415650255319866,6,4,1,1
Let's squash that idea.,1.5,0.1889822365046136,8,4,4,0
"And if you have any great ideas, let us know and we'll scoop them right out!",1.5,0.2672612419124244,8,5,2,1
Most of you are new....and still a little orange.,1.5,0.3415650255319866,6,4,1,1
"Our Diversity and Inclusion initiative has been a complete failure, but I love what I'm seeing in this room!",1.5,0.3415650255319866,6,4,1,1
I'm glad you could all carve time out of your day to be here.,1.5,0.16666666666666669,10,5,5,0
Most of you won’t even be here a month from now.,1.5,0.22360679774997896,6,3,3,0
Consumer demand is waning.  We need to think bigger than Halloween and pie.,1.5,0.3415650255319866,6,4,1,1
"It was a Freudian slip, I meant craving not carving.",1.5,0.3415650255319866,6,4,1,1
"Yes, I know - this could have been an email",1.5,0.3415650255319866,6,4,1,1
"Gentlemen, I don't need to remind you that it's a scary time of the year",1.5,0.3415650255319866,6,4,1,1
We're ending the work-from-the-porch policy.,1.5,0.3415650255319866,6,4,1,1
Who's up for pie?,1.5,0.2672612419124244,8,5,2,1
We're giving out toothbrushes this year.,1.5,0.22360679774997896,6,3,3,0
Thank you all for carving time out for this meeting.,1.5,0.3415650255319866,6,4,1,1
"Sorry gentlemen, we don't use pie charts this time of the year.
Leo Lane
Petaluma, CA",1.5,0.3415650255319866,6,4,1,1
So glad to see all your faces light up.,1.5,0.3415650255319866,6,4,1,1
I appreciate you all staying late last night.,1.5,0.22360679774997896,6,3,3,0
Can I get a smile?,1.5,0.28867513459481287,4,2,2,0
"I have some good news, and some bad news.  The roasted pumpkin seeds are selling very well.",1.5,0.2672612419124244,8,5,2,1
At the end of the quarter we'll all be thrown out.,1.5,0.3415650255319866,6,4,1,1
Looks like we all have our work carved out for us.,1.5,0.2672612419124244,8,5,2,1
Ideas for Halloween?,1.5,0.26111648393354675,12,9,0,3
"Our new product will be called "" pumpkin spice.""",1.5,0.22360679774997896,6,3,3,0
I've just made a deal with the North Pole that's will make people's heads pop off.,1.5,0.22360679774997896,10,6,3,1
Of course there's risk. But we are not squash!,1.5,0.3415650255319866,6,4,1,1
I have a smashing idea for you.,1.5,0.28867513459481287,4,3,2,0
I'm being forced out. Jill O'Lantern starts on Monday.,1.5,0.3415650255319866,6,4,1,1
... of course there will be some downsizing as we transition into the holiday pie season.,1.5,0.3415650255319866,6,4,1,1
I think it's time we put a new face on things.,1.5,0.3415650255319866,6,4,1,1
Who's going to make my pumpkin spice latte?,1.5,0.5,4,3,0,1
You will all be canned by the end of next month.,1.5,0.19462473604038075,12,7,4,1
"And remember, you gotta have a winning smile to succeed in this business.",1.5,0.2672612419124244,8,5,2,1
Now put on a H A P P Y  F A C E,1.5,0.3415650255319866,6,4,1,1
I wish all of us could lighten up.,1.5,0.22360679774997896,6,3,3,0
"Due to budget cuts, some of you will be transferring to our bakery department.",1.5,0.2672612419124244,8,5,2,1
"The next one who says 'you don't know Jack"" will be fired.""",1.5,0.22360679774997896,6,3,3,0
Our next project involves carving out a new plan.,1.5,0.3415650255319866,6,4,1,1
"Pumpkin pies, gentlemen. Pumpkin pies. It's a no-brainer.",1.5,0.3415650255319866,6,4,1,1
"It goes without saying, we're gonna need to make some cuts.",1.5,0.2672612419124244,8,5,2,1
"And that, ladies and gentlemen, is Trick or Tweet--now let's get out there and sell it.",1.5,0.32732683535398854,8,6,0,2
Someone has been hollowing out our profits.,1.5,0.22360679774997896,6,3,3,0
"Gentlemen, it's time for another seed round.",1.5,0.22360679774997896,6,3,3,0
Thank you for carving out time for this meeting today.,1.5,0.22360679774997896,6,3,3,0
Seeing your little faces light up each day is what keeps me in the Jack-o'-lantern business.,1.5,0.3415650255319866,6,4,1,1
Today we're going to carve out the company's new mission statement,1.5,0.3415650255319866,6,4,1,1
So you miss working from your porch?,1.5,0.3415650255319866,6,4,1,1
All of us gone by Christmas? I don't see it.,1.5,0.3415650255319866,6,4,1,1
"If you don't have a smile on your face, maybe you just can't cut it.",1.5,0.22360679774997896,6,3,3,0
"Now, I have some gourd news, and some bad news",1.5,0.3415650255319866,6,4,1,1
Yes jack?,1.5,0.1889822365046136,8,4,4,0
"Without further adieu, here is our new Head of Human Resources, Billy Corgan.",1.5,0.1889822365046136,8,4,4,0
A little spice to stir things up? Smashing!,1.5,0.5,4,3,0,1
I had some great ideas in my head last week but they seem to have vanished. Anyone else feeling something similar?,1.5,0.2672612419124244,8,5,2,1
It doesn’t smell very gourd in here,1.5,0.3415650255319866,6,4,1,1
Let’s try to get through this meeting before anyone starts rotting from the inside out.,1.5,0.2672612419124244,8,5,2,1
And with that I will now turn the meeting over to Jack,1.5,0.22360679774997896,6,3,3,0
"So, I called this meeting because it seems SOME of us have mistaken the  spooky Halloween spirit for ‘workplace harassment.’",1.5,0.3415650255319866,6,4,1,1
"Unfortunately, we’ll need to make some cuts this month",1.5,0.28867513459481287,4,2,2,0
Nice to see some new faces around here,1.5,0.3415650255319866,6,4,1,1
"Pumpkin spice latte and pumpkin pie for everyone, it's on the company",1.5,0.22360679774997896,6,3,3,0
"Oh my gourd, is there anyone here with any guts? I’m carving up this committee, you’re all squashed!",1.5,0.3415650255319866,6,4,1,1
"Sorry, but it looks like we're going to have to make further cuts",1.5,0.3415650255319866,6,4,1,1
"That's the long and short of it, gentlemen. By November we'll all be dead and rotten.",1.5,0.3415650255319866,6,4,1,1
Let’s discuss all the ways we can squash the competition.,1.5,0.28867513459481287,4,2,2,0
I’ve ordered pumpkin spice lattes for the office!,1.5,0.3415650255319866,6,4,1,1
"So, there it is. I'm sorry to say that this year only one of you has made the cut. The rest of you are welcome to try again next year.",1.5,0.22360679774997896,6,3,3,0
The corporation simply cannot afford a dental plan for its managers.,1.4444444444444444,0.1756820922315766,9,5,4,0
"Well, we've gotten scooped again this year.",1.4444444444444444,0.2421610524189263,9,6,2,1
I can't help being optimistic. I was just carved that way.,1.4444444444444444,0.2421610524189263,9,6,2,1
Let’s turn those frowns upside down!,1.4444444444444444,0.2421610524189263,9,6,2,1
Nobody is smiling. I’m gonna have to make some cuts.,1.4444444444444444,0.2421610524189263,9,6,2,1
"Now that you've made me Head Man in Charge, I'm replacing yours.",1.4444444444444444,0.2421610524189263,9,6,2,1
Hey. I thought we were yams too.,1.4444444444444444,0.2421610524189263,9,6,2,1
What's with the empty faces? Lighten up!,1.4444444444444444,0.2421610524189263,9,6,2,1
One of you will have to be squashed.,1.4444444444444444,0.2421610524189263,9,6,2,1
"There is no easy way to say this, but our new board member is Acorn Squash.",1.4444444444444444,0.2939723678960656,9,7,0,2
"And on the 31st, all employees will participate in a candlelight vigil.",1.4444444444444444,0.2939723678960656,9,7,0,2
They will say our time has passed but I say that’s just squash….,1.4444444444444444,0.2939723678960656,9,7,0,2
Now if you take a look at this pumpkin pie chart…,1.4444444444444444,0.2421610524189263,9,6,2,1
"Due to budget cuts, your heads won’t last past October",1.4444444444444444,0.2421610524189263,9,6,2,1
"Gentlemen, I’ve been informed we have to make some cuts.",1.4444444444444444,0.2421610524189263,9,6,2,1
"Is it stuffy in here, or is it just me?",1.4444444444444444,0.2421610524189263,9,6,2,1
I see only gutless leadership in this room.,1.4285714285714286,0.2020305089104421,7,4,3,0
''Those in favor of disappointing Linus yet again?'',1.4285714285714286,0.29738085706659034,7,5,1,1
What can I do to light a fire in you guys?,1.4285714285714286,0.2020305089104421,7,4,3,0
"Well, Jacks, I’m afraid pumpkin pie season is upon us.",1.4285714285714286,0.29738085706659034,7,5,1,1
We need to discuss diversity.,1.4285714285714286,0.29738085706659034,7,5,1,1
"Let’s put our heads together, and come up with ways to cancel Halloween.”!",1.4285714285714286,0.29738085706659034,7,5,1,1
Some of you have expressed concerns about the company dental plan.,1.4285714285714286,0.29738085706659034,7,5,1,1
Any more bright ideas?,1.4285714285714286,0.29738085706659034,7,5,1,1
"Enjoy the lattes, I spiced them myself.",1.4285714285714286,0.29738085706659034,7,5,1,1
Hocus Pocus Group,1.4285714285714286,0.29738085706659034,7,5,1,1
I know you won't smile at today's news because you're not carved that way.,1.4285714285714286,0.2020305089104421,7,4,3,0
Anyone got any bright ideas.?,1.4285714285714286,0.29738085706659034,7,5,1,1
"It’s just business, nothing personal, but some of you will end up smashed.",1.4285714285714286,0.29738085706659034,7,5,1,1
Heads up. I'm afraid we are going to have to make some additional cuts.,1.4285714285714286,0.2020305089104421,7,4,3,0
I'm instituting a new dental plan!,1.4285714285714286,0.29738085706659034,7,5,1,1
Our corporate strategy only works for one month each year.  Your mission is to expand the market for carved gourds throughout the entire year.  Get to work.,1.4285714285714286,0.29738085706659034,7,5,1,1
Now I'll ask Jack to start the meeting...,1.4285714285714286,0.29738085706659034,7,5,1,1
"I can see it in your faces, last quarter's results were grim.",1.4285714285714286,0.2020305089104421,7,4,3,0
"Let's face it... Well, let me rephrase that.",1.4285714285714286,0.2020305089104421,7,4,3,0
"Well, once again, the Board has squashed our latest agricultural identity proposal.",1.4285714285714286,0.29738085706659034,7,5,1,1
"So I'm waiting for the train, and this gourd comes up to me. And, you know how gourds have those gross, fucked-up warts all over them? Not all gourds, of course. Just, you know, most of them. Oh, come on. Don't give me that look — you know it's true!",1.4285714285714286,0.29738085706659034,7,5,1,1
"Please, Gentlemen. My text concerning 'smashing news' simply meant that sales doubled this quarter.",1.4285714285714286,0.29738085706659034,7,5,1,1
I've called this meeting before our heads start caving in.,1.4285714285714286,0.29738085706659034,7,5,1,1
Can you all just lighten up?,1.4285714285714286,0.29738085706659034,7,5,1,1
"Okay everyone! Clap your hands and sing along with me: 
This little light of  mine, I’m gonna let it shine . . .",1.4285714285714286,0.29738085706659034,7,5,1,1
"As you know, the company is gearing up for its annual 'make a child smile' campaign.",1.4285714285714286,0.29738085706659034,7,5,1,1
"Okay, unless I'm told who's phone that is with the Smashing Pumpkins ring tone, you're all about to hit the street...literally!",1.4285714285714286,0.2020305089104421,7,4,3,0
The big day is upon us. Let's turn those frowns upside down!,1.4285714285714286,0.2020305089104421,7,4,3,0
Don't think for a second that I'm happy with the results.  I'm just carved that way.,1.4285714285714286,0.2020305089104421,7,4,3,0
I appreciate everyone carving time out of their schedule. It’s midnight. Let’s get started.,1.4285714285714286,0.29738085706659034,7,5,1,1
"What I’m proposing, is that we need a little more diversity on our board.",1.4285714285714286,0.29738085706659034,7,5,1,1
Human resources assures me that this will facilitate frank and candid discussion.,1.4285714285714286,0.29738085706659034,7,5,1,1
"So, from which branch office shall I carve out some expenses this quarter?",1.4285714285714286,0.29738085706659034,7,5,1,1
Projections for the fourth quarter are rotten.,1.4285714285714286,0.29738085706659034,7,5,1,1
I see you're all cut out for this job.,1.4285714285714286,0.29738085706659034,7,5,1,1
We're going to produce a YouTube video on 'How to dispose of your pumpkin.',1.4285714285714286,0.29738085706659034,7,5,1,1
It’s time for a changing of the gourd.,1.4285714285714286,0.2020305089104421,7,4,3,0
