caption,mean,precision,votes,not_funny,somewhat_funny,funny
I think we would make the right decision if we had any guts.,1.0,0.7071067811865476,2,2,0,0
Has it occurred to you that maybe he wants to look like us.,1.0,0.408248290463863,3,3,0,0
I'm afraid we have to carve back our workforce.,1.0,0.408248290463863,3,3,0,0
Cheer up! We'll put our heads together and fool those pumpkin pirates!,1.0,0.7071067811865476,2,2,0,0
"All in favor of booting the empty shell of a man, say ay!",1.0,0.28867513459481287,4,4,0,0
This year's bonuses will be paid in raisins and apples.,1.0,0.28867513459481287,4,4,0,0
"I’m Bumpkin, your new President.",1.0,0.7071067811865476,2,2,0,0
"I’m proud to announce that our new DEI coordinator will be ‘The Headless Horseman’ , originally from Sleepy Hollow.",1.0,0.7071067811865476,2,2,0,0
"The Evangelicals are boycotting all pagan holidays.
Mississippi barges are stranded with undelivered pumpkins.
Starbucks strikes are squashing pumpkin latte profits.
We're getting carved up.",1.0,0.22360679774997896,5,5,0,0
Any ideas to improve November sales?,1.0,1,1,1,0,0
So this is growing the pie.,1.0,0.28867513459481287,4,4,0,0
Next we'll hear from the spice latte division.,1.0,0.28867513459481287,4,4,0,0
So finally Charlie Brown and Linus will see the Great Pumpkin - me - rise up out of their worthy pumpkin patch,1.0,1,1,1,0,0
"I am happy to announce that to ensure diversity in our decisions on behalf of our shareholders Jack O. Lantern, Inc. will be adding an acorn squash head to the board.",1.0,1,1,1,0,0
"I'm sorry, but I'm going to be making some further cuts.",1.0,0.7071067811865476,2,2,0,0
"So, as you saw in my tweet, I'll be smashing 75% of you.",1.0,0.7071067811865476,2,2,0,0
I have a feeling next quarter will be a smashing success.,1.0,0.408248290463863,3,3,0,0
"C'mon, let's get all our gourds together on this one!",1.0,0.1336306209562122,8,8,0,0
Trick or settlement.,1.0,0.28867513459481287,4,4,0,0
The short-term outline is scary - but that can be a good thing.,1.0,0.18257418583505536,6,6,0,0
The resolution has passed. No more smiley faces on Halloweeen pumpkins,1.0,0.22360679774997896,5,5,0,0
...and we're going to sit here until we're all a slimy pile of moldy goo if we have to.,1.0,0.7071067811865476,2,2,0,0
So who do we think is going to get smashed at the holiday party this year?,1.0,0.408248290463863,3,3,0,0
"Okay,someone leaked that the CEO would be going as a pumpkin",1.0,0.7071067811865476,2,2,0,0
I've given the interns several Louisville Sluggers to share. No need to clean out your desks.,1.0,0.22360679774997896,5,5,0,0
"Diversity? Why? Even though we're pumpkin heads, deep down we are still white men.",1.0,0.18257418583505536,6,6,0,0
There will come a day when we are all will soft in the head.,1.0,0.408248290463863,3,3,0,0
Stop jacking around this is serious business,1.0,0.28867513459481287,4,4,0,0
Despite the fact that many of you have lost close friends and family our Pumpkin Spice  Latte is selling gangbusters.,1.0,0.408248290463863,3,3,0,0
I believe the seeds of greatness are in all of us.,1.0,0.408248290463863,3,3,0,0
So my response to the supply chain shortage of pie filling is…,1.0,0.22360679774997896,5,5,0,0
I’m pleased to report that our plans for world domination via the annual “pumpkin spice latte” program have exceeded our third quarter projections once again.,1.0,0.7071067811865476,2,2,0,0
"Agreed ! Ichabod Crane is to blame
 for this year’s downturn ! Headless from HR will deal with it !",1.0,0.7071067811865476,2,2,0,0
Excellent!  Everyone is onboard with the corporate dress code.,1.0,0.408248290463863,3,3,0,0
"Allright then, all those in favor of holding Halloween via teleconference this year, say aye.",1.0,0.1543033499620919,7,7,0,0
I'm optimistic that all of you will be able to shed some light on the issue at hand,1.0,0.7071067811865476,2,2,0,0
I have gained control of  over 51% of all pumpkin spice stocks. essentially giving me control of the world - at least until November 1.,1.0,1,1,1,0,0
"A cyberattack exploited weaknesses in our face id system""",1.0,0.28867513459481287,4,4,0,0
You heard correctly. All month. We'll switch to turkey heads November 1.,1.0,0.28867513459481287,4,4,0,0
Talk fast .  Our time is up by November first.,1.0,0.28867513459481287,4,4,0,0
"Is it just me,or is this diversity training seminar getting bogged down in groupthink?",1.0,0.28867513459481287,4,4,0,0
"Gentlemen! We're facing crashing numbers, our stock has tanked, our brand is hated, and we have seeds and goo for brains.",1.0,0.7071067811865476,2,2,0,0
"sales are down , any bright ideas?",1.0,0.7071067811865476,2,2,0,0
We can't keep masking this divesity issue any longer',1.0,1,1,1,0,0
Let's put out heads together and come up with a smashing new idea.,1.0,0.28867513459481287,4,4,0,0
"Jack,what do you think?",1.0,0.408248290463863,3,3,0,0
I’d like to carve out meeting times with a few of you.,1.0,0.408248290463863,3,3,0,0
Who's up for a game of squash?,1.0,0.408248290463863,3,3,0,0
"Gentlemen, how can pumpkin juice crush the apple cider market?",1.0,0.408248290463863,3,3,0,0
I know! Let's have a pumpkin pie eating contest at the holiday party!,1.0,0.7071067811865476,2,2,0,0
"OK, guys, Lets get pumped.",1.0,0.28867513459481287,4,4,0,0
I'm not cutting heads in October,1.0,1,1,1,0,0
Why so glum?  Our profits increased 100% and your November bonus will be twice what it was last year.,1.0,0.408248290463863,3,3,0,0
We need a volunteer for the city catapult contest.,1.0,0.7071067811865476,2,2,0,0
Today's agenda: equity carve-out.,1.0,0.18257418583505536,6,6,0,0
"Thanks again to Executive Vice President, Ruddy Pumpkin Head, for the success of the pumpkin spice campaign. Next month we launch pumpkin weed gummies and should have market domination by Halloween 2023.",1.0,0.18257418583505536,6,6,0,0
"Gentlemen, as chairman of the O'Lantern Corporation, and after the successful hostile takeover of Christmas, Inc., I say it's OUR TURN to do the carving up!",1.0,0.18257418583505536,6,6,0,0
"I need you to find 11,780 more votes to keep me from being baked into a pie.",1.0,1,1,1,0,0
Heads will roll.,1.0,0.408248290463863,3,3,0,0
Which one is Shannon?,1.0,1,1,1,0,0
"Simply stand on your head and smile""",1.0,0.7071067811865476,2,2,0,0
How many times have I told you…no lit candles in the Boardroom!,1.0,0.22360679774997896,5,5,0,0
Beware! Starbucks baristas are at it again this year pushing their pumpkin spice lattes.,1.0,0.28867513459481287,4,4,0,0
All right now. All at once. What's your favorite holiday,1.0,0.408248290463863,3,3,0,0
One of you has lost their inner flame,1.0,0.28867513459481287,4,4,0,0
Not one of you has what it takes inside.,1.0,0.28867513459481287,4,4,0,0
Who's up for some lit candles?,1.0,0.18257418583505536,6,6,0,0
Your performance this Halloween will be reflected in Thanksgiving’s pie chart.,1.0,0.408248290463863,3,3,0,0
I know you're all very upset that Gourdon is leaving the company...,1.0,0.408248290463863,3,3,0,0
Who agrees that our company’s whole identity changed since the hostile takeover?,1.0,0.1543033499620919,7,7,0,0
"So, who wants pie?",1.0,0.7071067811865476,2,2,0,0
I'm pleased to announce that next Monday we will be welcoming  a Zucchini to the Board.,1.0,0.18257418583505536,6,6,0,0
"Gate Night, schmate night. I’m going out. Who’s with me?",1.0,1,1,1,0,0
The treat is my bonus and the trick is you're all being let go.,1.0,1,1,1,0,0
Let's not lose our heads just because Halloween is coming.,1.0,1,1,1,0,0
It does not really matter because none of us will be around this time next year,1.0,0.408248290463863,3,3,0,0
"Fellow Atheist Pumpkins, let us consider the motion that there is no Gourd...",1.0,0.22360679774997896,5,5,0,0
"Sorry fellows, there's only room for one Jack at the table.",1.0,1,1,1,0,0
If we put our heads together we can squash the competition.,1.0,0.7071067811865476,2,2,0,0
Who volunteers to retire on the White House Front Porch?,1.0,0.7071067811865476,2,2,0,0
Good news! This year’s bonus will be a lifetime supply of pumpkin pie!,1.0,0.22360679774997896,5,5,0,0
"Jones, why don't you have a stem?",1.0,0.408248290463863,3,3,0,0
OH FUGGGG A ENDERMAN :DDDDD,1.0,0.28867513459481287,4,4,0,0
"Starting November first, heads are going to roll.",1.0,0.408248290463863,3,3,0,0
I really feel that the claims of hypocrisy by our anti-pumpkin defamation board members will blow over,1.0,0.7071067811865476,2,2,0,0
No worries.  In a week it's all Santa hats and ho ho hos.,1.0,0.7071067811865476,2,2,0,0
Today we carve a new path.,1.0,0.408248290463863,3,3,0,0
I have negotiated an agreement for our buyout by Aardvark International.  All but one of the O'Lantern family will be removed from this board due to an apparent lack of diversity. Severance candles will be distributed based on seniority. Burrrrrrrrp!,1.0,0.408248290463863,3,3,0,0
Listen up! I just came up with a smashing idea...,1.0,0.7071067811865476,2,2,0,0
"Well, here’s something that may bring a smile to your face . . . .",1.0,0.18257418583505536,6,6,0,0
Our lawyers have told us we need more Jane O' Lanterns on the Board.,1.0,1,1,1,0,0
"We've hit a rough patch but not to worry gentlemen, they're saying cuts should start from the bottom.",1.0,0.18257418583505536,6,6,0,0
"I know, I know... its difficult being popular for only one month of the year !...",1.0,0.408248290463863,3,3,0,0
I thought that you all would be happy.,1.0,1,1,1,0,0
"I KNOW; LET’S PLAY DOZENS,",1.0,0.408248290463863,3,3,0,0
"This holiday season, we’re giving back to the community.",1.0,0.28867513459481287,4,4,0,0
let's all get smashed!,1.0,0.28867513459481287,4,4,0,0
We are going to have to gourd our loins.,1.0,0.22360679774997896,5,5,0,0
It has come to my attention that some of you are not in favor of our required seasonal headwear....,1.0,0.7071067811865476,2,2,0,0
And you all thought I was going to carve you a new asshole...well that ain't the half of it.,1.0,0.22360679774997896,5,5,0,0
I think we are all sick of being carved. I say we tell people to carve a grain of rice.,1.0,0.28867513459481287,4,4,0,0
Are you sure outlawing pumpkin soup is the answer?,1.0,0.7071067811865476,2,2,0,0
"Look, I'm Jack O'Lantern, and that's it. You're just going to have to get used to Fred O'Lantern, Bill O'Lamtern, Joe O'Lantern ...",1.0,0.408248290463863,3,3,0,0
"Due to supply-chain issues, they'll be using us again next year. So, hydrate, everyone.",1.0,0.408248290463863,3,3,0,0
Would it help if I spiced things up a bit?,1.0,0.7071067811865476,2,2,0,0
What do you mean you didn't bring a candle..?,1.0,1,1,1,0,0
Be glad someone cleaned all that goop and slime out. Now we can get down to shrinking down to size.,1.0,0.28867513459481287,4,4,0,0
"Such a relief to see the diversity, equity and inclusion efforts are paying off.",1.0,1,1,1,0,0
What about pies depresses you all?,1.0,0.7071067811865476,2,2,0,0
Executive meeting in the gourdroom,1.0,0.22360679774997896,5,5,0,0
"Ok,raise your hand if your name is not Jack.",1.0,0.7071067811865476,2,2,0,0
I can sense that some around this table are afraid of ending up in soup.,1.0,1,1,1,0,0
"Alright everyone, what’s the next great thing that we can seed.",1.0,0.7071067811865476,2,2,0,0
"Hit the road, Jack.",1.0,0.28867513459481287,4,4,0,0
who's stupid idea was it to put lite candles in our heads,1.0,0.408248290463863,3,3,0,0
"At the end of October, I want everyone to stop using self tanning cream.",1.0,0.408248290463863,3,3,0,0
"Next, let’s hear from Jack.",1.0,0.22360679774997896,5,5,0,0
"Halloween parties are coming, I hope this year you won´t lose your heads",1.0,0.7071067811865476,2,2,0,0
I'll be damned! Not one of you has any ideas for new ways to use Pumpkin Spice?,1.0,0.28867513459481287,4,4,0,0
"The outlook is bright for the end of October, but demand will fall rapidly in November.",1.0,0.22360679774997896,5,5,0,0
Boo---who said that,1.0,0.408248290463863,3,3,0,0
Don’t worry. Our new benefits package includes dental.,1.0,0.408248290463863,3,3,0,0
I know you all want to emmulate me but I'm the greatest orange pumpkin around here.,1.0,0.18257418583505536,6,6,0,0
One positive note - our merger with coffee is on again,1.0,0.28867513459481287,4,4,0,0
"Thank you all for ‘carving out’ some time for today’s special board meeting. Uh, sorry.",1.0,0.408248290463863,3,3,0,0
"Because of the deep cuts we've all had to make, our upcoming shareholder meeting is going to be a horror show.",1.0,0.7071067811865476,2,2,0,0
I want to focus on our goals for November,1.0,0.7071067811865476,2,2,0,0
"Hey, little Pumpkin heads, let's turn those frowns into smiles!",1.0,0.28867513459481287,4,4,0,0
I'll be working from home next Monday,1.0,0.28867513459481287,4,4,0,0
This is more orange heads than I can stand!,1.0,0.408248290463863,3,3,0,0
"I'm not going to lie, the candle will be tricky.",1.0,0.7071067811865476,2,2,0,0
"There will be a downturn in November. On the upside, I have a great retirement package.",1.0,0.7071067811865476,2,2,0,0
This would be a lot simpler if some of us weren’t named “Jack.”,1.0,0.28867513459481287,4,4,0,0
"Agreed, we cancel the dental plan?",1.0,0.28867513459481287,4,4,0,0
The good news is free admission to every haunted house from here to Sleepy Hollow.,1.0,0.7071067811865476,2,2,0,0
Is this the best you could do for an anonymous vote?,1.0,0.408248290463863,3,3,0,0
Why am I the only one whose happy about this?,1.0,0.7071067811865476,2,2,0,0
I’m off to the patch. Time to find someone with guts!,1.0,0.28867513459481287,4,4,0,0
Management will be thrilled to see you all taking to the Q4 'go big or gourd home' mentality.,1.0,0.7071067811865476,2,2,0,0
I started out in the mail room but I've always believed the only way to get anywhere in life is to pull yourself up by your own stem...,1.0,1,1,1,0,0
Come on! Time to bring out the best in you !,1.0,0.408248290463863,3,3,0,0
Alright listen up. He is going to run again but we have to be like a big loyal family… right down to the same hue.,1.0,0.22360679774997896,5,5,0,0
"I guess you didn't get the stem memo, Roberts?",1.0,0.7071067811865476,2,2,0,0
Gourds...,1.0,0.28867513459481287,4,4,0,0
One of you will take this seat when I rot.,1.0,0.7071067811865476,2,2,0,0
"All right, pumpkin heads, .....",1.0,1,1,1,0,0
I call this meeting of the Sleepy Hollow Town Council to order,1.0,0.7071067811865476,2,2,0,0
Who has a spicy idea?,1.0,0.7071067811865476,2,2,0,0
"We're carving our way, slit by slit, to a better future.",1.0,0.28867513459481287,4,4,0,0
H.R. has asked us to reevaluate our hiring practices.,1.0,1,1,1,0,0
We are being accused of insufficient diversity!,1.0,0.28867513459481287,4,4,0,0
"My fellow Pumpkins, how do we alter the myth so that we'r eating Peter and not vice versa?",1.0,0.22360679774997896,5,5,0,0
"Easter Pumpkin Hunts”, “Rosh Hashanah Pumpkin Hunts”, “Christmas Pumpkin Patch Caroling”,",1.0,0.28867513459481287,4,4,0,0
"As for this whole 'PC' Board initiative I told them 'Frankly, you couldn't FIND a more ""diverse"" group than us.'",1.0,0.22360679774997896,5,5,0,0
"And now the report from our new CPO. Ready, Jack?",1.0,0.28867513459481287,4,4,0,0
I’ve got an idea on how we can spice up this presentation.,1.0,1,1,1,0,0
"Yea or Nay, enlist zombies in revolt",1.0,0.22360679774997896,5,5,0,0
Ok...it's been moved and seconded that we leave the pumpkins at home beginning November 1st. All in favor say Boo!,1.0,0.22360679774997896,5,5,0,0
Our shareholders are calling the board 'A bunch of pumpkinheads'. How do we want to respond?,1.0,1,1,1,0,0
Profits are lagging. Ask staff to submit vegan recipes.,1.0,0.408248290463863,3,3,0,0
And to further mark the change in seasons you may now address me as Chairman of the Gourd,1.0,0.408248290463863,3,3,0,0
We had a very good quarter. Each one of you will get to be a piece of the pie.,1.0,0.28867513459481287,4,4,0,0
"Now that our heads aren't filled with meaty orange flesh, sticky pulp, lots of seeds, and handfuls of stringy stuff, I believe we can move on with our meeting.",1.0,0.408248290463863,3,3,0,0
"It's great to reunite the Trump Cabinet. 
Now tell me how much you love The Great Pumpkin.",1.0,0.408248290463863,3,3,0,0
"Well, we can’t all
Go by Jack!",1.0,1,1,1,0,0
"He's smiling because ... wait a second, why is he smiling?",1.0,0.408248290463863,3,3,0,0
"I know it's been a rough patch lately, but let's not lose our heads.",1.0,0.22360679774997896,5,5,0,0
I’m afraid we’re going to have to make a few more cuts.,1.0,0.408248290463863,3,3,0,0
"STOP LOOKING SO UPSET!
THE OLD KLAN OUTFITS ARE TOO IDENTIFIABLE",1.0,0.28867513459481287,4,4,0,0
I'm sorry to inform you that the hostile take over by Nabisco's Pie Division has just gone through.,1.0,1,1,1,0,0
Tonight! tonight! I think it's a smashing idea!,1.0,0.28867513459481287,4,4,0,0
Will the real Jack stand...,1.0,0.408248290463863,3,3,0,0
Can’t believe we all came to the office in the same thing!,1.0,1,1,1,0,0
We are getting lots of pressure to more diverse. Any ideas on other squash that would be a fit?,1.0,1,1,1,0,0
I’m concerned that we have an ingrained culture of negativity.,1.0,0.7071067811865476,2,2,0,0
I've asked Jack to update us on our workplace diversity initiative.,1.0,0.408248290463863,3,3,0,0
"I’ll just point. When I call on Jack, everyone speaks at once.",1.0,0.408248290463863,3,3,0,0
"ROLL CALL:
Jumping Jack Flash
Jack be Nimble
Jack Daniels
Jacqueline
Jack-O’-Lantern
Jack Frost 
Jack N.
Jack in the Beanstalk
Jack Rabbit
Jack The Ripper
Jill
Now who’s having the in office romance? You know that’s not allowed.",1.0,0.408248290463863,3,3,0,0
It's time for a major corporate image face lift.,1.0,0.408248290463863,3,3,0,0
All in favor of getting smashed after the meeting say aye!!,1.0,0.408248290463863,3,3,0,0
We’ll skip the pie charts.,1.0,0.7071067811865476,2,2,0,0
"You will  all notice that I don’t have ears, however, I can read lips!",1.0,0.7071067811865476,2,2,0,0
"Gentlemen, turn your heads around. You’re getting a raise.",1.0,0.28867513459481287,4,4,0,0
"Come on now, who's got that ol' fire in the belly?",1.0,0.22360679774997896,5,5,0,0
We've been bought out by Mr. Potato Head!,1.0,0.7071067811865476,2,2,0,0
"Well no matter how you are carved, I think this is a matter you can support.",1.0,0.28867513459481287,4,4,0,0
All in favor of more pumpkin pies?,1.0,0.22360679774997896,5,5,0,0
And they say we need more diversity!,1.0,0.408248290463863,3,3,0,0
And wipe that stupid grin off your face.,1.0,0.408248290463863,3,3,0,0
"We'll start things off with the layoff list: Jack, you're out.",1.0,0.7071067811865476,2,2,0,0
"Clearly, the charges of nepotism are groundless.",1.0,0.408248290463863,3,3,0,0
I have brought my best investigators together to find the fiend that chopped off the head of our beloved horseman,1.0,0.28867513459481287,4,4,0,0
Draw numbers to see who will become the first pie.,1.0,0.7071067811865476,2,2,0,0
You know the story: we're immensely popular once a year for less than a week. So let's make the most of it!,1.0,0.22360679774997896,5,5,0,0
"I understand your concerns about retention, but ultimately spooking from home is unsustainable.",1.0,0.28867513459481287,4,4,0,0
Great news! We’re going head first into the frozen pie market.,1.0,0.28867513459481287,4,4,0,0
"Gentlemen,it is essential that we squash the shareholder movement to unseed this board.",1.0,1,1,1,0,0
All in favor of making tomatoes the official symbol of Halloween vote aye.,1.0,1,1,1,0,0
"Let's welcome the guy without a stem on his head to our
Diversity Committee!",1.0,0.408248290463863,3,3,0,0
I don't think we can just squash the competition.,1.0,0.28867513459481287,4,4,0,0
"And in conclusion, gentlemen, I can assure you that, if sales don't improve by the end of the quarter, heads will roll!",1.0,0.7071067811865476,2,2,0,0
"Oh come on guys, lighten up.  Just think of all the bad karma you're  about to burn up.",1.0,0.1336306209562122,8,8,0,0
Now who would like a piece of pumpkin pie?,1.0,0.28867513459481287,4,4,0,0
"So, what you're saying is a ""gate"" is no longer consider an accepted work environment?",1.0,0.408248290463863,3,3,0,0
"All in favor of Linus as the Great Pumpkin, say aye.",1.0,0.408248290463863,3,3,0,0
do you know pi is eternal,1.0,0.1543033499620919,7,7,0,0
"You’re all canned, pumpkins!",1.0,0.1543033499620919,7,7,0,0
"Let’s squash the idle chatter, and light-up some good ideas for winter.",1.0,0.408248290463863,3,3,0,0
Better than being a bunch of knuckleheads.,1.0,0.408248290463863,3,3,0,0
I'm announcing a merger with American Candle.,1.0,1,1,1,0,0
Your bonus this year will be a 3-pack of mini Mars Bars.,1.0,0.28867513459481287,4,4,0,0
"With pumpkin pie season upon us, all employee life insurance policies will be terminated effective immediately.",1.0,0.7071067811865476,2,2,0,0
Corporate decided to sell out to Libby's so your heads are all on the chopping block.,1.0,1,1,1,0,0
The first item on the agenda is that we department heads have business cards  (and not pumpkin heads ) here at Pumpkin Patch.,1.0,0.7071067811865476,2,2,0,0
"Now, when Elon arrives, he'll know at a glance we're a fun group.",1.0,0.408248290463863,3,3,0,0
"With the pumpkin season in full swing, I've been informed there is a shortage this year...",1.0,0.28867513459481287,4,4,0,0
"Yes, Jack O'Lantern, we all need nicknames or these meetings will continue to drag on.",1.0,0.22360679774997896,5,5,0,0
"Our October revenues were through the roof,but unfortunately zero in every other month.",1.0,0.28867513459481287,4,4,0,0
"I’d like to introduce our new HR manager, Peter, Peter.",1.0,1,1,1,0,0
I see you all agree to table this conversation until the 31st.,1.0,1,1,1,0,0
To think everyone here is named Jack!,1.0,1,1,1,0,0
"And by switching from candle to LED last quarter, we’ve reduced the cost of the employee life insurance plan by 28%.",1.0,0.7071067811865476,2,2,0,0
I'm the pumpking and together we will squash them all,1.0,0.7071067811865476,2,2,0,0
Any smart aleck remarks and I'll carve you a new one.,1.0,0.408248290463863,3,3,0,0
I want to squash those rumors immediately.  You are not the hollow men!,1.0,0.408248290463863,3,3,0,0
Welcome to the last board meeting of The Jack O' Lantern Corporation,1.0,0.7071067811865476,2,2,0,0
"C'mon y'all, you should be thrilled to learn you are genetically modified!",1.0,0.7071067811865476,2,2,0,0
"Listen up, punkin’ heads. Sure, the dental plan has some holes, but, hey, look at your snazzy matching company suits.",1.0,0.408248290463863,3,3,0,0
Let's take a vote before our brains rot.”,1.0,0.408248290463863,3,3,0,0
I'm afraid some of you are not carved out for a career in lighting.,1.0,0.408248290463863,3,3,0,0
"Believe me, I'm more concerned about layoffs than you are. I was just carved this way.",1.0,0.7071067811865476,2,2,0,0
I can see you’ve all tried to carve out a place for yourselves. I just happened to have done it better.,1.0,0.28867513459481287,4,4,0,0
"Welcoming our new members Jack, Jack, Jack, Jack, Jack, Jack, Jack, Jack, Jack and Jack.”",1.0,0.28867513459481287,4,4,0,0
A secret ballot would be a lot more practical!,1.0,0.7071067811865476,2,2,0,0
"You’re right, Jack. We do need to put a new face on Halloween. Any suggestions?",1.0,0.408248290463863,3,3,0,0
Good news. The fellas over at Salmon Spice have accepted the merger offer.,1.0,0.408248290463863,3,3,0,0
Now to the dessert menu.  Pies. Who wants pork pie?  Who wants pumpkin?,1.0,0.7071067811865476,2,2,0,0
We’ll be working in person until the seed round closes.,1.0,0.7071067811865476,2,2,0,0
"As to the motion that ""The Ballad of Peter Pumpkinhead"", as performed by Crash Test Dummies, is better than that of XTC...do I have a seconder?",1.0,0.22360679774997896,5,5,0,0
Changes require us to put on a brave face.,1.0,0.408248290463863,3,3,0,0
Never forget:  We are pumpkins.  Not squash.,1.0,0.408248290463863,3,3,0,0
I think we need to squash the takeover bid!,1.0,0.28867513459481287,4,4,0,0
The ayes have it. Our competition will be squashed.,1.0,1,1,1,0,0
Any more pie-eyed suggestions?,1.0,0.22360679774997896,5,5,0,0
There's no sugar coating it. These projections are scary.,1.0,0.7071067811865476,2,2,0,0
"No News Is Gourd News, We've Got About A Week Left Though",1.0,0.28867513459481287,4,4,0,0
I'm told we need to rethink the way we carve our mouths.,1.0,0.28867513459481287,4,4,0,0
"I call this meeting of the New York Chapter of the Donald Trump ""Look-a-Likes"" to order",1.0,1,1,1,0,0
Who likes a trick? Today isn't the Halloween party -- it's the company photo.,1.0,0.28867513459481287,4,4,0,0
October is a make-it or smash-it month for our organization.,1.0,0.7071067811865476,2,2,0,0
"Given that we have been asked to be more inclusive, a carrot will be joining our team next week.",1.0,1,1,1,0,0
HR provided these IRL Zoom filters to aid in the transition back to the office.,1.0,0.408248290463863,3,3,0,0
"Okay,we all agree to have cookies for our coffee break,avoiding the problematic “pie.”",1.0,0.7071067811865476,2,2,0,0
I think we have a diversity issue here!,1.0,0.28867513459481287,4,4,0,0
After halloween you'll be replaced with Santas.,1.0,1,1,1,0,0
you are all allergic to pumpkin spice!,1.0,0.7071067811865476,2,2,0,0
"Listen, you country pumpkins! As chairman of the gourd, I'm going to squash these rumors...",1.0,0.7071067811865476,2,2,0,0
"My sources tell me that underneath, one of you is a cheese head and another has mutton head tendencies.",1.0,0.22360679774997896,5,5,0,0
Upper corporate says we have to keep these on until Christmas bonus’s go out.,1.0,0.408248290463863,3,3,0,0
Why are all of you so sad? Your brains were used to make delicious pies.,1.0,0.408248290463863,3,3,0,0
"This was supposed to be a FUN meeting, but apparently the kids had something else in mind.",1.0,0.7071067811865476,2,2,0,0
"It's pumpkin season - meaning, our sales will be going through the roof and we're going to have to make some sacrifices.",1.0,0.7071067811865476,2,2,0,0
