caption,mean,precision,votes,not_funny,somewhat_funny,funny
I'll pie to make this simple...,1.0,0.408248290463863,3,3,0,0
"After this morning's ""I'm not a Pumpkin Head, you're a Pumpkin Head"" name calling incident HR has banned the use of the term ""Pumpkin Head"" from now on.",1.0,0.408248290463863,3,3,0,0
Let's think outside the Patch. I'd like to shift the vibe to something more meta positive!,1.0,1,1,1,0,0
"Williams, that's enough empty-headed suggestions.",1.0,0.408248290463863,3,3,0,0
"Oh, fuck!",1.0,0.22360679774997896,5,5,0,0
"By 2025, 50% of management must be Jill O'Lanterns.",1.0,0.7071067811865476,2,2,0,0
"So, what kind of pie would you like for Thanksgiving?",1.0,0.28867513459481287,4,4,0,0
"And then she said ""Bippity boppity boo"" and next thing I know it's morning and I'm sitting on the side of the road!",1.0,0.28867513459481287,4,4,0,0
For our next presentation I’d like you to turn your frowns upside-down.,1.0,1,1,1,0,0
Let's have lunch; I'm treating.,1.0,0.28867513459481287,4,4,0,0
"But the good news is, one of you will be selected for a pumpkin pie!",1.0,0.7071067811865476,2,2,0,0
"Now, as we cap our fiscal year, you need to make appointments with your plastic surgeons. Christmas is coming.”",1.0,0.408248290463863,3,3,0,0
Don’t worry!  I’m gonna turn everything upside down.,1.0,0.408248290463863,3,3,0,0
Now the bad news for those of you with eyes carved pointing upwards.,1.0,0.7071067811865476,2,2,0,0
"So Day 1 of my business plan was the ""let that sink in"" gag, and Day 2 is this ""let that pumpk in"" bit – I see everyone got their pumpkin. And that's the extent of thought I put into running Twitter. Who wants to go next?",1.0,1,1,1,0,0
THE BUS TO TAKE US TO AN UNDISCLOSED LOCATION IS READY TO GO!,1.0,0.7071067811865476,2,2,0,0
"And now, gentlepumps, it is time to select a new Chairman of the Gourd",1.0,0.408248290463863,3,3,0,0
"Look,we work the 'seeds' angle with the health nuts,push bread,bread bread to everyone else - we can go all-seasonal by next year",1.0,0.7071067811865476,2,2,0,0
"You may have heard rumors, 
but we promise you: 
No layouts until Thanksgiving”",1.0,0.408248290463863,3,3,0,0
The vote is 6 to 5.  ‘Trick’ it is.,1.0,1,1,1,0,0
"The times have changed: we're no longer a scare your neighbor pumpkin, but plastic, consumerist pumpkin.",1.0,0.7071067811865476,2,2,0,0
OK. Now what do e do for the 4th of July?,1.0,0.7071067811865476,2,2,0,0
Pumpkin-spice of course... it's a no-brainer!,1.0,0.18257418583505536,6,6,0,0
"As the head Pumpkin, I deplore you to consider more originality at next year's board meeting.",1.0,0.7071067811865476,2,2,0,0
The lattes aren’t selling. People find the sriracha overwhelming.,1.0,0.7071067811865476,2,2,0,0
"OK!  Now looking ahead, where do you think we'll be by November 1st?",1.0,0.22360679774997896,5,5,0,0
Our latest coffee chain acquisition means heads will roll,1.0,1,1,1,0,0
"Looks like you just lost your stem-carrying membership in this patch, Peter.",1.0,0.408248290463863,3,3,0,0
I think we need more yes-men on the board.,1.0,0.28867513459481287,4,4,0,0
I know it’s controversial but switching to John O’Latern will really boost our brand,1.0,0.408248290463863,3,3,0,0
"Good news I am squashing your fears, this year's favorite pie is apple raisin.",1.0,0.28867513459481287,4,4,0,0
"On November 1, heads will mold.",1.0,0.22360679774997896,5,5,0,0
The motion to be recognized as a fruit is unanimously approved.,1.0,0.408248290463863,3,3,0,0
"So yes, we must electrify, but you fellas have to find us a way to keep the candle scent!",1.0,0.28867513459481287,4,4,0,0
"First, I'm sure we all agree that we've been through a rough patch.""",1.0,0.22360679774997896,5,5,0,0
"So I'll just tell you: we've been bought out by an anonymous party,we're relocating to the North Pole,and operations are henceforth subcontracted to elves.",1.0,0.408248290463863,3,3,0,0
Of all the empty headed suggestions.,1.0,0.7071067811865476,2,2,0,0
"Mother Goose urges us to rethink, 'put her in a pumpkin shell.'",1.0,0.7071067811865476,2,2,0,0
Just a reminder; Ha;oween is not for us Pumplin Heads!,1.0,0.7071067811865476,2,2,0,0
I won't be showing a pie chart.,1.0,0.408248290463863,3,3,0,0
"Tomorrow, I want to see everyone carve those frowns into smiles.",1.0,1,1,1,0,0
Don’t let the seed investment get to your head.,1.0,0.408248290463863,3,3,0,0
"Okay boys, DEI says we need to bring in the witches.",1.0,0.408248290463863,3,3,0,0
A smile is just a frown turned upside down,1.0,0.7071067811865476,2,2,0,0
Can’t you guys think of anything good to say about Halloween?,1.0,0.408248290463863,3,3,0,0
SO....you all agree...I will continue to remain President of the Pumpkin Heads!!,1.0,0.7071067811865476,2,2,0,0
"Gentleman, jack o' lantern sales are down, however, pie sales are up. I need a volunteer.",1.0,0.7071067811865476,2,2,0,0
"I'm sorry gentlemen, but this does make it easier to fire a few of you.",1.0,1,1,1,0,0
"Okay team, how do we get Santa Claus to change his entire brand?",1.0,0.408248290463863,3,3,0,0
"Come on now, turn those frowns upside down.",1.0,0.22360679774997896,5,5,0,0
"We know we’re the brightest minds in the business. However, I’m happy to say today the takeover is now complete. You’ll be escorted out the building immediately. But not to worry. We’ll mail your candles and carving knives to your patches.",1.0,1,1,1,0,0
"Smile, guys.  We just cornered the candy corn market!",1.0,0.28867513459481287,4,4,0,0
Anyone see a need for more face-saving cuts ?,1.0,0.408248290463863,3,3,0,0
"Yes, that Elon Musk...",1.0,0.28867513459481287,4,4,0,0
Okay. You can all do this. It only takes a little practice. Ready? All together now. Smile!,1.0,0.28867513459481287,4,4,0,0
"Act natural. Remember: squirrels don't eat businessmen.""",1.0,0.22360679774997896,5,5,0,0
The press is complaining about too much nepotism here.,1.0,1,1,1,0,0
I don't mean to squash your ideas but I promise I will  carve out a new plan.,1.0,0.28867513459481287,4,4,0,0
"And believe me, if heads roll around here it’s going to be really messy.",1.0,0.1543033499620919,7,7,0,0
"I want a board that, like me, is all smiles.",1.0,0.7071067811865476,2,2,0,0
"We need 3 of you for a pie, any volunteers?",1.0,1,1,1,0,0
We need to make our products less seasonal.,1.0,0.22360679774997896,5,5,0,0
The raven is freed.,1.0,0.408248290463863,3,3,0,0
I see a lot of new faces at this meeting.,1.0,0.7071067811865476,2,2,0,0
"And the good news is--ok ok, there is no good news, but still...",1.0,1,1,1,0,0
The maze is doing well and we're still good fertilizer.,1.0,0.7071067811865476,2,2,0,0
THERE WON'T BE ANY PUMPKIN PIES THIS YEAR,1.0,0.7071067811865476,2,2,0,0
We will not be doing lighted pumpkins this year.,1.0,0.7071067811865476,2,2,0,0
That's right. I want all your seeds by the morning.,1.0,0.7071067811865476,2,2,0,0
"Now if there’s no further business, I move we adjourn. Frankly,  you all look like you’re starting to rot.",1.0,0.28867513459481287,4,4,0,0
"Ok Pumpkin Heads,
I call this meeting to order.",1.0,0.28867513459481287,4,4,0,0
"That’s right, Jack, we’re all getting canned.",1.0,0.408248290463863,3,3,0,0
Let's wrap our heads together around a prize-winning new recipe for pumpkin pie!,1.0,0.408248290463863,3,3,0,0
"For this year's corporate retreat, we're going out to get smashed.",1.0,0.7071067811865476,2,2,0,0
The word in the patches is we’re out of touch.,1.0,1,1,1,0,0
I still think that “the gourd accord” is a great name for our merger.,1.0,0.7071067811865476,2,2,0,0
I regret to inform you that we're cutting your allocation of candles.,1.0,0.408248290463863,3,3,0,0
I'm glad to see we're all of like mind.,1.0,1,1,1,0,0
Congratulations everyone. You are true team players. Thank you for complying with our final request.,1.0,0.28867513459481287,4,4,0,0
"In the interest of morale, I'll explain the budget cuts without using pie charts.",1.0,0.7071067811865476,2,2,0,0
Today I am announcing another cut in administration.,1.0,0.28867513459481287,4,4,0,0
I'm happy to announce that I've determined a way for our company to alleviate the recent pumpkin shortage.,1.0,0.7071067811865476,2,2,0,0
I’ll bet you’re all wondering why I called this ‘treating’.,1.0,0.7071067811865476,2,2,0,0
We've all been hand-picked for October's marketing campaign,1.0,0.408248290463863,3,3,0,0
"And remember, under the law you can ignore use the  doorman when he directs you to the service elevator.",1.0,0.28867513459481287,4,4,0,0
My first act as the new Great Pumpkin is canning all of you.,1.0,0.28867513459481287,4,4,0,0
"Now that Twitter is opening our path to world domination, I am disconcerted to learn some of you don't even own a horse.",1.0,1,1,1,0,0
"C'mon, can't you all just smile?",1.0,0.7071067811865476,2,2,0,0
"In the interest of board diversity, we’ll be adding some new faces.",1.0,0.28867513459481287,4,4,0,0
Good News: We're all approved Emojis,1.0,0.28867513459481287,4,4,0,0
Think of this as massive job carves.,1.0,0.18257418583505536,6,6,0,0
"Yes, I’m afraid there’s more carve outs coming.",1.0,0.22360679774997896,5,5,0,0
Maybe we should sacrifice some of our employees for our fall menu,1.0,0.408248290463863,3,3,0,0
It’s time we carved out a niche in the market.,1.0,0.28867513459481287,4,4,0,0
"Halloween is going to be happy this year so you're all fired.""",1.0,0.408248290463863,3,3,0,0
"I am very happy to report to you that the ""pumpkin spice"" line is being retired.",1.0,0.7071067811865476,2,2,0,0
"I swear, I asked for coffees, not pumpkin spice lattes.",1.0,0.408248290463863,3,3,0,0
I’ve sold the firm to Peter Peter Inc.,1.0,0.408248290463863,3,3,0,0
The board think we have no guts,1.0,0.28867513459481287,4,4,0,0
soo...we're pumpkins,1.0,0.408248290463863,3,3,0,0
Once a day keeps the hippos away.,1.0,0.18257418583505536,6,6,0,0
We need to rebrand. Focus groups think Jack O’Lantern sounds too Irish.,1.0,0.28867513459481287,4,4,0,0
"After this buyout is approved, we can all begin enjoying our days hideously rotting away on our porches.",1.0,0.22360679774997896,5,5,0,0
"Yes, I was made CEO because I'm the only one of us with a smile.",1.0,0.408248290463863,3,3,0,0
"Profits are up. A slice of  pumpkin pie in Jamaica is $ 3.50 ,in Barbados it's $4.00.  We will have to learn to adjust to the pie-rates of the Carribean.",1.0,0.22360679774997896,5,5,0,0
"Hey guys, it’s not all doom and gloom….why all the sad faces?",1.0,0.408248290463863,3,3,0,0
"If  Peter Peter doesn’t reveal himself, there’s going to be trouble.",1.0,0.7071067811865476,2,2,0,0
"Finally, for dessert at the October  shareholder's meeting, we are having apple pie.",1.0,0.22360679774997896,5,5,0,0
Are we vegetables or just decorations?,1.0,0.7071067811865476,2,2,0,0
And . . . the Board has decided that only Senior Vice Presidents and above will be spared being made into pies.,1.0,0.18257418583505536,6,6,0,0
And then a candle went off in my head…,1.0,0.28867513459481287,4,4,0,0
"Fortunately, pumpkins can't talk",1.0,0.28867513459481287,4,4,0,0
Everyday is Thanksgiving at our company.,1.0,0.408248290463863,3,3,0,0
"Come on, let's carve in some smiles.",1.0,0.7071067811865476,2,2,0,0
Do you think we can carve out a position on the Board for my nephew?,1.0,0.7071067811865476,2,2,0,0
"So, we're all agreed.  No smiling faces this Halloween. . .",1.0,0.22360679774997896,5,5,0,0
As for the Holiday party I've booked The Smashing Pumpkins!,1.0,0.7071067811865476,2,2,0,0
I'm not seeing any lit up faces,1.0,0.7071067811865476,2,2,0,0
"I'm not a Botanist, John, so no,
I can't define the meaning of the word,, 'Jack-O-Lantern.""",1.0,1,1,1,0,0
I see someone turned his frown upside down.,1.0,0.7071067811865476,2,2,0,0
"It's hard to fathom, but I've been accused of nepotism.....",1.0,0.28867513459481287,4,4,0,0
"Now that we're in the gourd-room, we need to do something spooky for Halloween.  We need to give them pumpkin to talk about.",1.0,0.28867513459481287,4,4,0,0
"I say we should change ""Peter, Peter pumpkin eater had wife and couldn't keep her."" to ""Peter Peter pumpkin leader had a wife who was a keeper.""",1.0,0.7071067811865476,2,2,0,0
One of you needs to be smashed. Pick.,1.0,0.7071067811865476,2,2,0,0
"We’ve been acquired by Christmas, but I’m sure your jobs are all safe.",1.0,0.28867513459481287,4,4,0,0
I'm sure you're all wondering why I'm the only one carved with a smile.,1.0,0.408248290463863,3,3,0,0
Management says we need to cut down our workforce and increase production of pies.,1.0,1,1,1,0,0
We need to face the fact that our previous cuts were not enough.,1.0,0.408248290463863,3,3,0,0
I expect that you all carve out a business plan on Halloween because I have nothing left inside me.,1.0,0.408248290463863,3,3,0,0
"Is this a repeat of the Last Supper, Judas is missing.",1.0,0.18257418583505536,6,6,0,0
Midtown Pumpkin Spice Lovers Anonymous meeting,1.0,0.408248290463863,3,3,0,0
"I’m hoping that by spicing things up, we can all turn those frowns upside down and really begin to shine from within.",1.0,0.408248290463863,3,3,0,0
Just because I’m the boss doesn’t mean I have a bigger brain.,1.0,1,1,1,0,0
"That's all gentlemen, now if you will just leave your heads in the green bin on your way out....",1.0,0.7071067811865476,2,2,0,0
"In order for us to afford to carve out new territories, I’m afraid there will be more drastic cuts to middle management.",1.0,0.408248290463863,3,3,0,0
"I'm afraid we've got to reduce some head count here, make pumpkin pie out of some of you.",1.0,1,1,1,0,0
Great news. We have this quarter’s sales in the bag.,1.0,0.7071067811865476,2,2,0,0
Don't let Halloween get into your heads.,1.0,1,1,1,0,0
"Our outside sales manager Mr. Peter Peter has a wife, but can't keep her so I took it upon myself to suggest the members of this board would see she is kept very well while he is away.",1.0,0.408248290463863,3,3,0,0
"We’re downsizing.  It will cut our costs 50% and make five pies.
Sherry Shuman
Morgantown, WV",1.0,0.18257418583505536,6,6,0,0
This month I'm paying you in pumpkin seeds.  We have a lot of them in inventory right now.,1.0,0.7071067811865476,2,2,0,0
"The bad news is sales are their lowest in a decade. The good new is, I got a face lift.",1.0,1,1,1,0,0
Most of you did not follow directions. I said happy faces! Like me,1.0,0.18257418583505536,6,6,0,0
Welcome to the break-out session on diversity and inclusion.,1.0,0.28867513459481287,4,4,0,0
"From here forward, we look at everything with an open mind.",1.0,0.7071067811865476,2,2,0,0
"Great news, this year we've been invited to the company's Thanksgiving picnic.",1.0,0.28867513459481287,4,4,0,0
"Once again, the market has turned spooky!",1.0,0.28867513459481287,4,4,0,0
Let’s take a moment to mourn the passing of our founder Mr Jack O’Lantern. We’ll forever remember how his face lit up the room.,1.0,0.7071067811865476,2,2,0,0
"Hmmm, I had hoped for a better reaction to my announcement that the company is providing funding for ""Patch Adams II.""",1.0,0.408248290463863,3,3,0,0
I called this meeting so we could patch things up.,1.0,0.408248290463863,3,3,0,0
"Come on, guys.  You all knew when you signed on that it was seasonal work.",1.0,0.28867513459481287,4,4,0,0
"You cleaned up okay, but what  the hell happened at the p-patch?",1.0,0.28867513459481287,4,4,0,0
My head is part of a new line being released.,1.0,0.22360679774997896,5,5,0,0
I am happy to announce the smile consultant will join us in 20 minutes.,1.0,0.28867513459481287,4,4,0,0
"To recap, our new smile initiative kicks off immediately!",1.0,0.1543033499620919,7,7,0,0
We’ll have to make some additional cuts this year.,1.0,0.7071067811865476,2,2,0,0
Relax. It's just an expression. No heads are going to roll today.,1.0,0.408248290463863,3,3,0,0
Who's up for some pumpkin pie later?,1.0,0.408248290463863,3,3,0,0
Why so serious? It's trick and tweet time!,1.0,0.28867513459481287,4,4,0,0
When having a lightbulb idea going off in your culture is equivalent to catching on fire,1.0,0.22360679774997896,5,5,0,0
"Meanwhile at  O’Lantern inc. boardroom, discussions become heated  around toasted or roasted",1.0,0.18257418583505536,6,6,0,0
Trick or treat! We'll be making some more personnel cuts!,1.0,0.7071067811865476,2,2,0,0
The headless boardmen discuss proposals for the disposition of Ichabod Crane,1.0,0.28867513459481287,4,4,0,0
You're probably wondering why I've called this Gourd Meeting.,1.0,0.408248290463863,3,3,0,0
Profits are down.  One of you is pumpkin pie.,1.0,0.7071067811865476,2,2,0,0
I'm afraid we're going to be making some more cuts.,1.0,0.28867513459481287,4,4,0,0
"Hurry up and get out there, as you know Christmas gets at us earlier and earlier every year",1.0,0.28867513459481287,4,4,0,0
Next week my stepson Peter will be joining us as our new Diversity Director.,1.0,0.7071067811865476,2,2,0,0
"Gentlemen, every year at this time this company experiences a debilitating drop in headcount.  I’m convening this task force to find out why.",1.0,1,1,1,0,0
You idiots have to come up with something better or heads will smash!,1.0,0.408248290463863,3,3,0,0
"To comply with the diversity guidelines, 5 of you will be replaced by witches.",1.0,0.408248290463863,3,3,0,0
Finally! No more masks this year.,1.0,0.28867513459481287,4,4,0,0
Best quarter ever!  So let’s  turn those frowns upside dow…. Oops.  Sorry about that.,1.0,0.408248290463863,3,3,0,0
Great news--we're going to merge with spice!,1.0,1,1,1,0,0
Who said  we're incapable of getting into the Halloween spirit!,1.0,0.408248290463863,3,3,0,0
"All of you get a carving knife,and turn those frowns upside down!",1.0,0.28867513459481287,4,4,0,0
"I've just been told  that Netflix has decided to not renew its contract with 'It's the Great Pumpkin, Charlie Brown'.",1.0,0.408248290463863,3,3,0,0
"As I've said so often, imitation is the best form of flattery.",1.0,0.28867513459481287,4,4,0,0
Peter Peter pumpkin leader,1.0,0.7071067811865476,2,2,0,0
"Hey you!  You, without your stem. This is NOT casual Friday.",1.0,0.7071067811865476,2,2,0,0
Carving out the budget proposal is going to be tricky.,1.0,0.7071067811865476,2,2,0,0
I have some goods news and bad news. The good news is your not going to be laid off. The bad news is your going to be made into pumpkin pies,1.0,0.28867513459481287,4,4,0,0
"Guys, I finally tried a pumpkin spiced latte and it was pretty great.",1.0,0.7071067811865476,2,2,0,0
So this is the best we can do for Halloween? Any other idea?,1.0,0.1336306209562122,8,8,0,0
We're looking at bringing on Billy Corgan in HR.  Feedback?,1.0,1,1,1,0,0
The price of fertilizer is going up so much we have to cut down on employee meal expenses.,1.0,0.18257418583505536,6,6,0,0
The butternuts are gaining market share. Let's squash them.,1.0,0.408248290463863,3,3,0,0
"So, who's is going to provide the pumpkin cookies for our Halloween party?",1.0,0.7071067811865476,2,2,0,0
"Ok,so who are we carving next?",1.0,0.7071067811865476,2,2,0,0
Welcome to our annual Halloween survivors meeting.,1.0,1,1,1,0,0
I suggest we adjourn and  get smashed,1.0,0.408248290463863,3,3,0,0
"Cheer up, sales force,  you'll do fine if you remember it's a carve or be carved world!",1.0,0.28867513459481287,4,4,0,0
Great news...human spiced latte sales are through the roof!,1.0,0.7071067811865476,2,2,0,0
Happy Halloween,1.0,0.7071067811865476,2,2,0,0
the addition of pumpkins to the food pyramid is not good news!,1.0,0.22360679774997896,5,5,0,0
"Hate to say, but you're all about to be canned.",1.0,0.408248290463863,3,3,0,0
It always pumps me to see all the kins together!,1.0,0.408248290463863,3,3,0,0
Does anyone else have second thoughts about the new dress code?,1.0,0.408248290463863,3,3,0,0
You all look so sad--Guess the Lobotomies were on a Monday.,1.0,0.7071067811865476,2,2,0,0
"Hi. I’m your new Board President, Sam Hain.",1.0,0.7071067811865476,2,2,0,0
I'm afraid I misspoke - you will not GET a piece of the pie...,1.0,0.408248290463863,3,3,0,0
The fiscal outlook for November is looking grim.,1.0,0.408248290463863,3,3,0,0
"Empty-headed, yes, but with an inner light.",1.0,1,1,1,0,0
"I understand the interest in Cabo, but the Halloween party will be in Sleepy Hollow again this year.",1.0,0.28867513459481287,4,4,0,0
I'm pleased to announce that my daughter Jill will be joining the board next month.,1.0,0.22360679774997896,5,5,0,0
Can anyone on the Finance committee smile?,1.0,0.408248290463863,3,3,0,0
"That's right, Gourdy, the word from corporate is that black is the new orange.",1.0,0.7071067811865476,2,2,0,0
"Due to supply chain issues, you are all being transferred to our pie production facilities.",1.0,0.408248290463863,3,3,0,0
Some of you won’t be returning after the holidays.,1.0,0.7071067811865476,2,2,0,0
So much for Mr. Potatoe Head,1.0,0.408248290463863,3,3,0,0
As part of our DEI  initiative we’ve decided to hire someone who’s name isn’t Jack.,1.0,0.28867513459481287,4,4,0,0
"Happiness is what you make of it, gentlemen. You need to carve your own success",1.0,0.22360679774997896,5,5,0,0
I’m concerned about this Peter Peter fellow.,1.0,1,1,1,0,0
"Unfortunately, most of you without executive fridges won't be around in a few weeks.",1.0,0.22360679774997896,5,5,0,0
I have great news. Our next contract includes dental care.,1.0,0.7071067811865476,2,2,0,0
At first I thought the idea of wearing pumpkin-heads during meetings was ridiculous but now that I've tried it I kind of like it.,1.0,0.7071067811865476,2,2,0,0
You will all be staying for the compost meeting.,1.0,0.408248290463863,3,3,0,0
"Long term, is this a smart deal? No. But nothing puts fiduciary duty in perspective like knowing I’m days away from my rotting head collapsing in on itself.",1.0,0.408248290463863,3,3,0,0
If we miss on revenue this quarter heads will roll.,1.0,0.7071067811865476,2,2,0,0
We have to start burning the candle at both ends.,1.0,0.22360679774997896,5,5,0,0
Over the next 30 days our shareholder’s  expect us to transition into a company that makes only pie.”,1.0,0.28867513459481287,4,4,0,0
We'll draw straws to see who's this year's Jack-o'-lantern.,1.0,0.28867513459481287,4,4,0,0
"Tweet or Treat, Elon thinks I am sweet!",1.0,0.408248290463863,3,3,0,0
"I called this meeting to let you all know that because I'm the boss, I get to go by Jack.",1.0,0.28867513459481287,4,4,0,0
Well ... I guess the rest of you just weren't carved out for this type of challenge.,1.0,0.18257418583505536,6,6,0,0
Trick or treat --  We're getting closer to announcing for 2024,1.0,0.7071067811865476,2,2,0,0
Good news! We got the pumpkin spice latte account!,1.0,0.28867513459481287,4,4,0,0
How about we order some pumpkin spice lattes?,1.0,0.28867513459481287,4,4,0,0
"Now, you may be wondering why I've called all you 
country bumpkins here today.",1.0,0.28867513459481287,4,4,0,0
"Agreed. Let's abolish all horses, and even the ponies.",1.0,0.408248290463863,3,3,0,0
I guess I can’t call you all chowder heads anymore…,1.0,0.7071067811865476,2,2,0,0
"My apologies, I can only carve out time for one of you today.",1.0,0.22360679774997896,5,5,0,0
So there's a new head,1.0,0.28867513459481287,4,4,0,0
I’d like to thank everyone for carving out some time to meet this weekend.,1.0,0.1543033499620919,7,7,0,0
Elon bought the company and made me CEO. You’re all fired!,1.0,0.408248290463863,3,3,0,0
Let’s try carving  out a new market next quarter,1.0,0.408248290463863,3,3,0,0
"I hate to deliver the bad news, but they've decided to make us all into pumpkin stew.",1.0,0.7071067811865476,2,2,0,0
alrighty then: who wants to be the first orange skin foo to run for president? are you criminal enough; psychotically sociopathically narcissist enough?,1.0,1,1,1,0,0
"And lastly, some third graders will be here at ten for a “pumpkin craving contest”, whatever that is.",1.0,0.7071067811865476,2,2,0,0
There have been some budget cuts; our department is getting carved.,1.0,0.28867513459481287,4,4,0,0
"We're going to have to make some difficult cuts this quarter--starting with your frown, Jenkins.",1.0,1,1,1,0,0
Glad to see that everyone actually gets the memos.,1.0,0.408248290463863,3,3,0,0
"OK, it's settled, we meet back here in the spring.",1.0,0.22360679774997896,5,5,0,0
Season's almost over; let's go feed ourselves to the birds!,1.0,0.22360679774997896,5,5,0,0
"For whatever reason, the botox worked out differently for me. Let's just move on,shall we?",1.0,0.7071067811865476,2,2,0,0
Pumpkin talking heads finally united,1.0,1,1,1,0,0
"And let me remind you, gentlemen - this is the one day a year that we can show our faces in public, so let's not mess up out there...",1.0,0.28867513459481287,4,4,0,0
"I hate to bring you this news, but the board decided to cancel the field trip to Sleepy Hollow.",1.0,0.408248290463863,3,3,0,0
First on the agenda: The COC (Chief of Carving) has been replaced.,1.0,0.28867513459481287,4,4,0,0
This economy is really carving us up.,1.0,0.7071067811865476,2,2,0,0
We will not bow to the Chinese who don’t value the North American freedom of expression and choices dear to our society!,1.0,0.408248290463863,3,3,0,0
So HR carved out a plan I think everyone can get onboard with.,1.0,0.28867513459481287,4,4,0,0
"We're liquidating our assets, and only one of us is moving on to the next season.",1.0,0.7071067811865476,2,2,0,0
Gentlemen.....two words...........Pumpkin Spice!,1.0,0.7071067811865476,2,2,0,0
It's good to be Pumpking.,1.0,0.28867513459481287,4,4,0,0
I am pleased to announce that a new face to this company is being carved out.,1.0,0.28867513459481287,4,4,0,0
"Look at it this way, for one day a year we’re relieved from the horror of remembering each other’s name.",1.0,0.28867513459481287,4,4,0,0
"Sorry, but in our effort to downsize, most of you will be on the dessert menu today.",1.0,0.408248290463863,3,3,0,0
"Always the maverick, Kevin from accounting did not raise his stem",1.0,1,1,1,0,0
