caption,mean,precision,votes,not_funny,somewhat_funny,funny
Gentlemen. The knives are out.,1.125,0.1336306209562122,8,7,1,0
"Ok, guys and dolls, great work for that last ZOOM contract review.  Now go carve a smiley face pumpkin for the next one.",1.125,0.1336306209562122,8,7,1,0
"The score (as we gather):  Cowlicks 10, No Cowlick 1",1.125,0.1336306209562122,8,7,1,0
Any ideas about why they all want to keep working from home?,1.125,0.1336306209562122,8,7,1,0
"I guess these look better, but the masks were more comfortable.",1.125,0.1336306209562122,8,7,1,0
The meeting of the jack of all trades,1.125,0.1336306209562122,8,7,1,0
I'm guessing a round of pumpkin spice lattes might be inappropriate.,1.125,0.1336306209562122,8,7,1,0
"It’s a candle joke, lighten up!",1.125,0.1336306209562122,8,7,1,0
"Now that we've carved out our positions, we can proceed with the reorg.",1.125,0.1336306209562122,8,7,1,0
Time for the annual pumpkin promotion! Once again Peter Peter is this year’s pick for prize of the patch!,1.125,0.1336306209562122,8,7,1,0
What we’re lacking in this office is Spirit!,1.125,0.1336306209562122,8,7,1,0
Have we been able to hire a Director of Diversity Equity and Inclusion yet?,1.125,0.1336306209562122,8,7,1,0
Raise your hand if you're in favor of reinstating the mask mandate.,1.1111111111111112,0.11785113019775792,9,8,1,0
We’ll clearly need to make some adjustments when we have our first profitable quarter.,1.1111111111111112,0.11785113019775792,9,8,1,0
Let's carve out a productive agenda for today's meeting!,1.1111111111111112,0.11785113019775792,9,8,1,0
These are exciting times to be a pumpkin,1.1111111111111112,0.11785113019775792,9,8,1,0
This meeting will be a smashing success!,1.0,1,1,1,0,0
Gourd Meeting,1.0,0.7071067811865476,2,2,0,0
Is everybody ready for the Danny Elfman concert?,1.0,0.18257418583505536,6,6,0,0
"Why the long faces? It’s a board meeting, not a bored meeting.",1.0,0.7071067811865476,2,2,0,0
"And with the introduction of  pumpkin spice gefilte fish, our infiltration into cultural domination is now complete.",1.0,0.28867513459481287,4,4,0,0
"I’m sorry, it’s rotten, but we have to make cuts.",1.0,1,1,1,0,0
We've been chosen as the Starbucks seasoning of the month!,1.0,0.408248290463863,3,3,0,0
"Before you get too smug about our yearly glorious maturity, remember we must give ourselves to the causee of joy and thanksgiving.",1.0,1,1,1,0,0
So it's agreed. Next year we transition to solar.,1.0,1,1,1,0,0
I’m going to need you to carve out some time this weekend.,1.0,0.7071067811865476,2,2,0,0
"Heads won't roll, but they will get smashed.",1.0,0.22360679774997896,5,5,0,0
Our projections—let’s just say November doesn’t look good for us.,1.0,0.7071067811865476,2,2,0,0
I am very happy to announce that I will  remain Chairman of the Gourd.,1.0,0.7071067811865476,2,2,0,0
Here's  a positive trend: the use of canned squash for holiday pies is on the upswing!,1.0,1,1,1,0,0
"Jenkins, you're a brainless twit. And I'm not saying this just because your head is literally empty.",1.0,0.22360679774997896,5,5,0,0
I suppose you're all wondering why I called this meeting...so am I. My mind's blank.,1.0,1,1,1,0,0
Am I to believe that no one here knows Jack?,1.0,0.7071067811865476,2,2,0,0
I said we were needed for a 'Bakers Dozen' so what happened to the other two?,1.0,0.22360679774997896,5,5,0,0
"I know yesterday was a huge success.
But it's now November, and we're downsizing this department.",1.0,0.408248290463863,3,3,0,0
Time to weed out the patch.,1.0,0.18257418583505536,6,6,0,0
Does anyone want a Starbucks?,1.0,0.28867513459481287,4,4,0,0
You see this look?  That’s the look of a winner!  The rest of you will be out with the trash in a week!,1.0,0.28867513459481287,4,4,0,0
No. The other Jack.,1.0,0.408248290463863,3,3,0,0
Your severance begins November first.,1.0,0.408248290463863,3,3,0,0
"In keeping with our corporate image, we've eliminated the dental plan...",1.0,0.408248290463863,3,3,0,0
I know just how to put smiles on your faces.,1.0,0.408248290463863,3,3,0,0
Hmmm... I really expected a more positive reaction to the idea of a new seed-funding initiative.,1.0,1,1,1,0,0
"Ok guys…halloween. Perhaps this year, something a little less narcissistic…?",1.0,0.7071067811865476,2,2,0,0
Who's up for pie charts?,1.0,1,1,1,0,0
"During this season, it’s easy to get a swelled head.",1.0,0.28867513459481287,4,4,0,0
Once again I'm pushing for a lot more sweet potato pies!!!,1.0,0.408248290463863,3,3,0,0
"Gentlemen: Is that gleam I your eyes genuine enthusiasm for my turnaround plan, or have you just lit the candles in your heads again?",1.0,0.408248290463863,3,3,0,0
No one's job is safe. There's a glut of ambitious newcomers,1.0,0.28867513459481287,4,4,0,0
I don't need any self-tanner for my Donald Trump costume.,1.0,0.28867513459481287,4,4,0,0
Daniel the events manager is no longer with us. Mostly because it's July.,1.0,1,1,1,0,0
"I am the pumpkin head!–no, I mean as the head of the pumpkins, not–oh, shush, Fred!",1.0,0.22360679774997896,5,5,0,0
"We’re all smiling now, but we’re limited to seasonal work.",1.0,0.22360679774997896,5,5,0,0
"There'll be some changes, yes—but rest assured, corporate won't be cancelling Pumpkin-Head-Mondays!",1.0,0.22360679774997896,5,5,0,0
PSL shampoo was a big hit for us last quarter.,1.0,0.408248290463863,3,3,0,0
Gourd work everyone.,1.0,1,1,1,0,0
...and then the new Taylor Swift album played over and over again.,1.0,0.408248290463863,3,3,0,0
I have a great idea for a recipe but it'll come at a great sacrifice for us all.,1.0,0.1336306209562122,8,8,0,0
"Well, gentlemen, if there's no more new business, I propose we go get smashed.",1.0,0.28867513459481287,4,4,0,0
I just need a volunteer to make our October pie chart.,1.0,0.7071067811865476,2,2,0,0
Let´s just say the spiced lattes will have a more human touch this time.,1.0,1,1,1,0,0
I think we can all agree. Squirrels are biting into our profit.”,1.0,1,1,1,0,0
"We’re all smiles now, but pie season is coming",1.0,0.408248290463863,3,3,0,0
"The media says we're in trouble, but they don't know jack.",1.0,0.18257418583505536,6,6,0,0
Good news. No more meetings after Halloween.,1.0,1,1,1,0,0
"Cheer up, I have a plan to make the most of our time left before the big lighting!",1.0,0.7071067811865476,2,2,0,0
"Gourd head, Bill, let’s hear your idea.",1.0,0.7071067811865476,2,2,0,0
This is the best part of my job. Deciding who's getting cut.,1.0,0.408248290463863,3,3,0,0
I'm retiring Friday. The quarterly results come out Monday.,1.0,0.408248290463863,3,3,0,0
"As your new CEO, replacing Jack O. Lantern ...",1.0,0.408248290463863,3,3,0,0
That proposal is scary.,1.0,0.28867513459481287,4,4,0,0
I'm afraid everyone is getting fun size candy bars in lieu of a year end bonus this year...,1.0,0.22360679774997896,5,5,0,0
Why am I the only smiley face?,1.0,0.7071067811865476,2,2,0,0
"If we take a hard look, I think we will all agree that our competitors have totally squashed us again.",1.0,0.22360679774997896,5,5,0,0
Succeeding here takes a lot of guts.,1.0,0.408248290463863,3,3,0,0
Our Q4 numbers are looking a little hollow.,1.0,0.408248290463863,3,3,0,0
Getting ahead here takes a lot of guts.,1.0,0.408248290463863,3,3,0,0
We are going to squash the competition.,1.0,1,1,1,0,0
A union? I didn’t think you had the guts.,1.0,0.28867513459481287,4,4,0,0
"For this manifestation technique to work, we need to stop thinking about pumpkins.",1.0,0.7071067811865476,2,2,0,0
The good news Halloween will soon be over.,1.0,1,1,1,0,0
You can't make a pie without smashing a few pumpkin heads.,1.0,0.28867513459481287,4,4,0,0
We’re facing some further cuts.,1.0,0.7071067811865476,2,2,0,0
I’m thrilled to announce I will be the first astronaut on our new company rocket “Pumpkin Space.,1.0,0.28867513459481287,4,4,0,0
"Fellow gourd members, let’s squash rumors of Halloween downsizing.",1.0,0.22360679774997896,5,5,0,0
"It's that time of the year again when we make a lot of money. I'm talking, of course, about dividends day.",1.0,1,1,1,0,0
"So, gentlemen, are we all of the same mind?",1.0,0.7071067811865476,2,2,0,0
I suggest we meet with the pie industry to discuss the yam threat.,1.0,0.408248290463863,3,3,0,0
Thank you for carving out some time for me.,1.0,0.7071067811865476,2,2,0,0
I’ve decided it’s time to bring in some new faces.,1.0,0.22360679774997896,5,5,0,0
"After this terrible quarterly report, pumpkin heads will roll",1.0,0.28867513459481287,4,4,0,0
"No, it's not me wearing the pumpkin spice cologne.",1.0,0.7071067811865476,2,2,0,0
"With today's restructuring, some of you will have Halloween off after all.",1.0,0.408248290463863,3,3,0,0
Our division is not being carved out but the Board has asked for some paring back.,1.0,0.7071067811865476,2,2,0,0
"I know you all like to work from home, but we have to come in for the Gourd Meeting.",1.0,1,1,1,0,0
"That's the bad news, the good news is the candle shipment has been delayed!",1.0,0.28867513459481287,4,4,0,0
"Next week, two of us will be replaced by a female hubbard squash and a nonbinary rutabaga.",1.0,0.408248290463863,3,3,0,0
...and here's another pie chart for you.,1.0,0.28867513459481287,4,4,0,0
We need to develop a long-term sustainability plan beyond Halloween.,1.0,0.408248290463863,3,3,0,0
None of have any guts!,1.0,0.22360679774997896,5,5,0,0
"I'm just saying we proudly keep the ""KIN"" in pumpkin... Let the seasonal charges of Nepotism be damned!",1.0,0.7071067811865476,2,2,0,0
"I've decided to fire everybody named ""Jack"".",1.0,0.408248290463863,3,3,0,0
It's just like the old capital depreciation tax deferment. Only it's pumpkin spice.,1.0,1,1,1,0,0
"Due to supply chain disruptions, our pumpkin spice reserves are running low. So I'll need three volunteers.""",1.0,0.22360679774997896,5,5,0,0
"And now, for something really scary, Ichabod will present the financial report...",1.0,0.408248290463863,3,3,0,0
"Despite the start to an excellent quarter, they’ve decided to replace us with a bunch of turkeys.",1.0,0.408248290463863,3,3,0,0
"To make room for our diversity goal of 50% melon heads, some of you will be receiving a very generous severance package.",1.0,0.7071067811865476,2,2,0,0
I'm afraid many of us won't be here next month.,1.0,0.28867513459481287,4,4,0,0
No more empty headed ideas,1.0,0.28867513459481287,4,4,0,0
"It’s easy as pie, gentleman.",1.0,0.7071067811865476,2,2,0,0
Profits are down. We will increase production of Jack-O-Lanters.,1.0,0.7071067811865476,2,2,0,0
Let's not jack about. Christmas is winning.,1.0,0.7071067811865476,2,2,0,0
No bonuses this year for anyone named Jack,1.0,0.7071067811865476,2,2,0,0
I don’t think you have the guts (and seeds) to oppose my plans.,1.0,0.408248290463863,3,3,0,0
Good news. You are all being transferred to our pie division!,1.0,0.28867513459481287,4,4,0,0
Pumpkin spice chemotherapy. Who's with me?,1.0,0.28867513459481287,4,4,0,0
We are initiating legal actions to stop allegations that this firm is rotting from the head down.,1.0,0.408248290463863,3,3,0,0
"All those for my proposal, say “aye”.  All against, say “pie”.",1.0,0.28867513459481287,4,4,0,0
"Yes, the rumors are true:  In 48 hours we'll all be mulch.",1.0,0.1543033499620919,7,7,0,0
All the indications are pointing to a rotten November.,1.0,0.408248290463863,3,3,0,0
Bad news — the HOA voted for only smiley faces this year.,1.0,0.408248290463863,3,3,0,0
That film franchise can't keep up with us.,1.0,0.28867513459481287,4,4,0,0
It was a gourd way to squash the competition.,1.0,0.408248290463863,3,3,0,0
OK. Any ideas what we'll do for Christmas?,1.0,0.7071067811865476,2,2,0,0
"For the next item, I need to pick your brains.",1.0,0.408248290463863,3,3,0,0
"Jerry, you look great. You've had work done, haven't you?",1.0,1,1,1,0,0
We've carved out a very good business here.,1.0,0.408248290463863,3,3,0,0
"Actually, I hate the holiday.",1.0,0.18257418583505536,6,6,0,0
Who wants whipped cream?,1.0,1,1,1,0,0
This motherfucker…,1.0,0.408248290463863,3,3,0,0
It’s time to hollow out some departments.,1.0,0.28867513459481287,4,4,0,0
"In conclusion; that's the facts ""Jack""!",1.0,0.22360679774997896,5,5,0,0
"The pie chart says we have too many managers.
Today we decide which of you will shine, and which will be pie.",1.0,0.7071067811865476,2,2,0,0
Great news. The Spice Girls are interested in our proposal.,1.0,0.408248290463863,3,3,0,0
The salesman with the worst record this quarter will be volunteered as soup for the Christmas party.,1.0,0.408248290463863,3,3,0,0
This is what happens when you spill your guts to the newspapers.,1.0,1,1,1,0,0
"I need you to think outside the gourd""",1.0,1,1,1,0,0
". . . and so as we enter another pie and spiced latte season, I remind you your quarterly figures are due.",1.0,0.7071067811865476,2,2,0,0
...And no one is leaving until we figure out this November sales drop off.,1.0,0.18257418583505536,6,6,0,0
I propose we abolish the annual pumpkin carving contest.,1.0,0.408248290463863,3,3,0,0
"Unfortunately Jack,  you're fired!",1.0,0.408248290463863,3,3,0,0
"Due to supply chain disruptions, our pumpkin spice reserves are dangerously low. So I'll need three volunteers today.",1.0,0.22360679774997896,5,5,0,0
Our growth has now hit a rough patch!,1.0,0.28867513459481287,4,4,0,0
We're heading in a different direction. I want you to assemble the best carvers.,1.0,0.22360679774997896,5,5,0,0
"So . . . time to address who will receive golden parachutes 
 in our acquisition by Peter Peter Pumpkin Eater, Inc.",1.0,0.7071067811865476,2,2,0,0
...after the holidays more cuts will have to be made.,1.0,0.28867513459481287,4,4,0,0
Which brings me to the next item....diversity in the board room.,1.0,0.7071067811865476,2,2,0,0
Next agenda item: c-suite diversity.,1.0,1,1,1,0,0
this feels a little too far for an office prank,1.0,1,1,1,0,0
What this company needs is somebody with guts.,1.0,1,1,1,0,0
"Gentlemen, after the media circus and all the bad press, I'm announcing I will personally be taking over the Sleepy Hollow Acvount.",1.0,0.7071067811865476,2,2,0,0
Am I the only one who sees the humor in the situation?,1.0,0.7071067811865476,2,2,0,0
"I know it’s early, but I suggest you all start practicing for Easter.  Those eggs aren’t gonna lay themselves.",1.0,0.28867513459481287,4,4,0,0
Where are the happy faces?,1.0,0.7071067811865476,2,2,0,0
Our Halloween merchandise sales have never been better!,1.0,0.7071067811865476,2,2,0,0
"You're all fired, effective November 1.",1.0,0.408248290463863,3,3,0,0
You hollow heads have a seedy reputation . I'll carve a new face on the  spice biz . And you're all going into the pie division.,1.0,1,1,1,0,0
Who wants to forget about the quarterly results and just go get smashed?,1.0,0.28867513459481287,4,4,0,0
I'm happy to announce we will be entertained by Smashing Pumpkins at our annual picnic.,1.0,0.7071067811865476,2,2,0,0
I got where I am by carving out a niche for myself.,1.0,0.7071067811865476,2,2,0,0
It seems like we're going through a rough patch right now.,1.0,0.28867513459481287,4,4,0,0
First on the agenda is our new  Chief  DEI  Officer.,1.0,1,1,1,0,0
"So then I said, “Pardon me. Do you have any Grey Poupon?” You should have seen the look on that squash’s face.",1.0,0.28867513459481287,4,4,0,0
"Turn those frowns upside down, 4th quarter sales gonna turn us around.",1.0,0.28867513459481287,4,4,0,0
Our sales goal this year is to gain a bigger piece of the pie.,1.0,0.408248290463863,3,3,0,0
I warned you there were going to be some cuts,1.0,0.408248290463863,3,3,0,0
"There's to be some downsizing, gentleman. Apropos, perhaps you noticed the couple of teenaged punks waiting in the outer office.",1.0,0.22360679774997896,5,5,0,0
"Before we start todays meeting of the Illuminati, did anyone bring the candy corn?",1.0,0.22360679774997896,5,5,0,0
We project that every small town in America will have its own Headless Horseman by the end of the next fiscal year.,1.0,0.408248290463863,3,3,0,0
...So we hope our improved benefits package will help each of you resist the lure of the headhunters we always hear from this time of year.,1.0,0.28867513459481287,4,4,0,0
"You're all Jacks of your own trades, and I want to bring that to light.",1.0,0.22360679774997896,5,5,0,0
...and the winner of the most oiginal halloween costume is...,1.0,0.28867513459481287,4,4,0,0
"I'd like to welcome our newest board member, oddly also named Jack.",1.0,0.22360679774997896,5,5,0,0
"And finally, we will be disposing of the entire board effective November 1st.",1.0,0.28867513459481287,4,4,0,0
Intel chatter is up so keep your heads inside.,1.0,1,1,1,0,0
No one can hold a candle to our illumination division.,1.0,0.1543033499620919,7,7,0,0
"Sure, imminent collapse seems bad but if you're rich enough you can profit off of any failure.",1.0,0.7071067811865476,2,2,0,0
Smashing Pumpkins have agreed to play at this year's office party!,1.0,0.1543033499620919,7,7,0,0
Good news-- we squashed the competition!,1.0,0.7071067811865476,2,2,0,0
"Effectively immediately, I’m resigning my position as CEO",1.0,0.7071067811865476,2,2,0,0
"Ladies and gentleman, I’m afraid the competition is squashing us",1.0,0.7071067811865476,2,2,0,0
Am I the only one smiling?,1.0,0.28867513459481287,4,4,0,0
"Managers will not refer to anyone as ‘pumpkin,’ regardless of they identify.",1.0,0.7071067811865476,2,2,0,0
We need a bigger table.  There’s a bit of a squash in here.,1.0,1,1,1,0,0
"Apple is taking us over, so we're all fired.",1.0,0.22360679774997896,5,5,0,0
Why the gloomy faces? We had great sales in October!,1.0,0.28867513459481287,4,4,0,0
The music will be provided by Smashing Pumpkins.,1.0,0.28867513459481287,4,4,0,0
"Gentlemen, the final vote was 6 to 5 to accept the buy-out offer from the Pie-filling Company.",1.0,0.408248290463863,3,3,0,0
"Let's face it, we're all gutted about the cuts. I'm just carved this way.",1.0,0.7071067811865476,2,2,0,0
"Please, call me Gourd. Mr. Pumpkin was my father.",1.0,0.28867513459481287,4,4,0,0
Your gourds have been cut.,1.0,0.28867513459481287,4,4,0,0
"“Business has been so good, that, next season, we’ll be diversifying into squash, and other gourds.”",1.0,0.408248290463863,3,3,0,0
The news is not good. Our latest intel shows that people no longer give jack.,1.0,0.408248290463863,3,3,0,0
"Because of drought, pumpkin profits are down across the category-- we'll have to sell some of our internal inventory.",1.0,0.7071067811865476,2,2,0,0
"If sales don’t pick up this quarter, heads are gonna roll.",1.0,1,1,1,0,0
"I see a bright light in all of your minds, but the future of the company remains spooky.",1.0,1,1,1,0,0
Postponing this discussion until next month is a rotten idea.,1.0,0.408248290463863,3,3,0,0
"While our Fall Gourd Display Division is down this quarter, our Pumpkin Spice Latte numbers are through the roof!",1.0,0.28867513459481287,4,4,0,0
"You were all individually picked to be here. So let’s turn those frowns to smiles, boys.",1.0,0.7071067811865476,2,2,0,0
Next on the agenda Jack will update us on the pie distribution.,1.0,0.408248290463863,3,3,0,0
Thank you all for carving out the time.,1.0,0.7071067811865476,2,2,0,0
Glad I'm not the only one who heard this was a Gourd Meeting?,1.0,0.28867513459481287,4,4,0,0
I call this gourd-of-directors meeting to order.,1.0,0.28867513459481287,4,4,0,0
"We obviously have no board diversity requirement, but it’s concerning that we’re all named Jack.",1.0,0.18257418583505536,6,6,0,0
"How about, Chairman of the Gourd?",1.0,1,1,1,0,0
It's unanimous: the company spice of the month is pumpkin!,1.0,0.408248290463863,3,3,0,0
"Then it's settled, Charlie Brown is a honary member",1.0,0.28867513459481287,4,4,0,0
I am going to keep tossing out ideas until I see someone's face light up!,1.0,0.28867513459481287,4,4,0,0
We're going to have to let Jack go. He's been acting like a real pumpkin head lately.,1.0,1,1,1,0,0
Let's hope we all survive Thanksgiving!,1.0,0.22360679774997896,5,5,0,0
Bpkumpkin,1.0,0.7071067811865476,2,2,0,0
"And this year, we'll add real pumpkin to our pumpkin spice!",1.0,0.7071067811865476,2,2,0,0
Where do we pick-up the dry cleaning voucher?,1.0,0.7071067811865476,2,2,0,0
"Remember when I told you, we have employee stocks? Well, it's vegetable stock, and we're gonna need more of it.",1.0,1,1,1,0,0
I heard they have pie in the cafeteria today.,1.0,0.408248290463863,3,3,0,0
"You heard me right, next year I want those decorations for sale on July 5th.",1.0,0.22360679774997896,5,5,0,0
"I am sorry to say that on November 1st, we will dissolve the corporation.",1.0,0.7071067811865476,2,2,0,0
Let's try thinking outside the pumpkin patch.,1.0,0.18257418583505536,6,6,0,0
We've decided to branch out into durians.,1.0,0.7071067811865476,2,2,0,0
I've decided to take a position at another company as a stern-faced CEO.,1.0,0.28867513459481287,4,4,0,0
"That moment, Harold began to be concerned that forecasts weren't projected past October.",1.0,0.408248290463863,3,3,0,0
We need to take the accusation that we're a bunch of pumpkin heads seriously.,1.0,0.408248290463863,3,3,0,0
I know people love pumpkin pie; people are sick.,1.0,0.7071067811865476,2,2,0,0
This is funny!  Why don't any of you smile?,1.0,0.7071067811865476,2,2,0,0
"Well, it's unanimous then.",1.0,0.408248290463863,3,3,0,0
"... and so, with the nationwide shortage of pumpkin spice, we're going to need a few volunteers to take one for the team.",1.0,1,1,1,0,0
"Due to recent budget cuts, I’m going to have to smash some of you.",1.0,0.28867513459481287,4,4,0,0
"Poppycock to each of you! Steve, as the CEO, Chief Carvings Official, I'm going to need you to get me the Jack Knife.",1.0,0.18257418583505536,6,6,0,0
Guess who is Donald,1.0,0.22360679774997896,5,5,0,0
"All in favor of switching to LED lights, raise your hand.",1.0,1,1,1,0,0
"Look, just because we’re hit a bad patch doesn’t mean we can’t have a great night.",1.0,1,1,1,0,0
"Don't be mean pumpkin heads, patch up your differences.",1.0,0.18257418583505536,6,6,0,0
"The buyout is effective October 31: Poinsettia, Inc. takes over.",1.0,0.7071067811865476,2,2,0,0
Looks like I need to rethink these midnight meetings.,1.0,0.7071067811865476,2,2,0,0
"If we can rebrand it to ""gourd spice latte"", we all keep our heads.",1.0,0.7071067811865476,2,2,0,0
You guys have to find a different carver!,1.0,0.408248290463863,3,3,0,0
Smile!,1.0,0.28867513459481287,4,4,0,0
I was planning to show some pie charts but people at them.,1.0,0.28867513459481287,4,4,0,0
Don't worry. Be happy.,1.0,0.28867513459481287,4,4,0,0
The Pumpkin Spice Lattes on the table were meant to be a joke…,1.0,0.7071067811865476,2,2,0,0
"Well, I’m smiling because I am retiring before the first frost!",1.0,0.28867513459481287,4,4,0,0
"Our seed money is gone, my friends. We’re about to enter a rough patch...",1.0,0.22360679774997896,5,5,0,0
Jack -- I need you and Jack to finalize the details with Jack and Jack by the end of the week.,1.0,0.7071067811865476,2,2,0,0
Our shareholders are demanding a more diverse board.,1.0,0.7071067811865476,2,2,0,0
I anticipate a glowing report for the next quarter.,1.0,0.408248290463863,3,3,0,0
Apparently I am the only one who got a treat last night.,1.0,0.7071067811865476,2,2,0,0
It appears that our thrteenth member has left for the holidays.,1.0,0.408248290463863,3,3,0,0
Low profit earner this week gets a seasonal latté.,1.0,0.7071067811865476,2,2,0,0
"Since we’re sponsoring the Halloween Festival this year, I’ve signed you all up for the pie eating contest.",1.0,0.7071067811865476,2,2,0,0
We need to make a few more cuts.,1.0,0.28867513459481287,4,4,0,0
"Gentlemen, I'm happy to say that pumpkin sales are going way up as heads continue to fall.",1.0,0.408248290463863,3,3,0,0
Pumpkin Spice latte sales are down 40 % and heads are going to roll.,1.0,1,1,1,0,0
"I expect to see revenue growth, followed by softening, and eventual rotting.",1.0,0.408248290463863,3,3,0,0
Let’s everyone lighten up.,1.0,0.28867513459481287,4,4,0,0
We've managed to carve out a place in the market.,1.0,0.7071067811865476,2,2,0,0
We might as well be the ones that sell the carving kits.,1.0,0.408248290463863,3,3,0,0
This board has been criticized as empty-headed.,1.0,0.408248290463863,3,3,0,0
"I apologize for making you all a bit uneasy. Perhaps ""smashing success"" was a poor choice of words.",1.0,0.7071067811865476,2,2,0,0
So each of you must choose: Squash or Gourd? You can't sit on the fence!,1.0,0.7071067811865476,2,2,0,0
"As for diversity and inclusion, our optics aren't good.",1.0,0.408248290463863,3,3,0,0
A Class Action might be the way to outlaw Halloween pumpkin massacres,1.0,0.408248290463863,3,3,0,0
Heads will roll if we don’t make our numbers!,1.0,0.18257418583505536,6,6,0,0
We need better ideas. You all have mush for brains!,1.0,0.7071067811865476,2,2,0,0
"and now for the good news, our new CEO's name is Jack",1.0,0.22360679774997896,5,5,0,0
I am happy to announce that I will be your new Chairman of the Gourd!,1.0,0.408248290463863,3,3,0,0
I just love to see your faces light up.,1.0,0.7071067811865476,2,2,0,0
I’d love to carve that ridiculous smile off his face.,1.0,0.7071067811865476,2,2,0,0
"Listen up,we're cancelling Halloween this year. It's gonna save us a  bundle!",1.0,0.408248290463863,3,3,0,0
"Just a bit lower, sir, then a strong slice across.",1.0,0.28867513459481287,4,4,0,0
1929 was a once in a 100 year event but in the event it arrives early we've upgraded to safety glass 2.0...,1.0,0.408248290463863,3,3,0,0
"With our new company motto, ""smile"", it looks like some heads will roll.",1.0,1,1,1,0,0
"Okay you pumpkin heads, show your best faces for Halloween.",1.0,0.7071067811865476,2,2,0,0
And that was when a light went off in my head...,1.0,0.7071067811865476,2,2,0,0
Expect more cuts.”,1.0,0.7071067811865476,2,2,0,0
