caption,mean,precision,votes,not_funny,somewhat_funny,funny
This really helps cheer me up after that medical malpractice suit. Anyway let’s get to the cutting!,1.162162162162162,0.05100626464063543,74,64,8,2
"Look, even the dead can dance.",1.162162162162162,0.05100626464063543,74,64,8,2
Disco never dies in my O.R.,1.162162162162162,0.05100626464063543,74,64,8,2
"I flirted with a rave/glow sticks motif, but 'OR 54' lets me keep my hands free.",1.161904761904762,0.0408782018356128,105,90,13,2
"Operate, operate, lance to the music ...",1.161764705882353,0.05386833246131616,68,59,7,2
Clamp. Scalpel. Que Stayin' Alive.,1.161764705882353,0.04498704387503319,68,57,11,0
"All set Doctor, now show us your moves.",1.161764705882353,0.05386833246131616,68,59,7,2
This should calm our nerves if anything bad happens.,1.161764705882353,0.049626763740833676,68,58,9,1
"Doctors, I welcome you to the sweet sights and sounds of Disco-Robotic surgery!",1.161764705882353,0.049626763740833676,68,58,9,1
"The order form just said ""Theater lighting,"" and I asked, ""Is it Operating?"" And they said ""Of course!""",1.161764705882353,0.05779947062852091,68,60,5,3
We must remove his disco.,1.161764705882353,0.049626763740833676,68,58,9,1
"Not, not, not, not stayin' alive, stayin' alive!",1.161764705882353,0.05386833246131616,68,59,7,2
"What am I missing...I thought the song was ""Disco Duck"" 
not ""Disco Doc!",1.161764705882353,0.05779947062852091,68,60,5,3
Does he really need anesthesia for a simple discolocation?,1.161764705882353,0.049626763740833676,68,58,9,1
"Still no new ventilators, but party supplies are a steal.",1.161764705882353,0.049626763740833676,68,58,9,1
"He asked for stars and stripes, that's the closest I got.",1.161764705882353,0.05386833246131616,68,59,7,2
"Let's hurry, they have this room reserved tonight.",1.161764705882353,0.04498704387503319,68,57,11,0
"I couldn't get Taylor Swift tickets so I had maintenance put this in. Nurse, will you press play?",1.161764705882353,0.05386833246131616,68,59,7,2
Welcome to “Surgery with the Stars”,1.161764705882353,0.04498704387503319,68,57,11,0
"A new and interesting choice of anesthesia, Doctor?",1.161764705882353,0.05386833246131616,68,59,7,2
This patient ordered the disco treatment.,1.161764705882353,0.049626763740833676,68,58,9,1
And who said disco is dead?,1.161764705882353,0.049626763740833676,68,58,9,1
How'd you guys know it was my 1000th patient??,1.161764705882353,0.049626763740833676,68,58,9,1
And we have to play I Will Survive.,1.1612903225806452,0.052406641260186286,62,53,8,1
Disco fever really is deadly,1.1612903225806452,0.041281263615876675,93,79,13,1
"Oh, shit, that's probably where all those staph infections are coming from. We were doing all these TikToks early on in the pandemic....fuck. Not a word about this, OK? Not a fucking word. And let's check this guy's duodenum for glitter.",1.1612903225806452,0.051372746554081104,93,83,5,5
It was this or another head mirror.,1.1612903225806452,0.04709177548576028,62,52,10,0
"See Alan,  just because it's illegal doesn't mean it can't be fun",1.1612903225806452,0.052406641260186286,62,53,8,1
Cutting for the very first time.,1.1612903225806452,0.052406641260186286,62,53,8,1
Nice touch with 'I Will Survive.',1.1604938271604939,0.0540255715729409,81,72,5,4
I was just trying to liven up the atmosphere in here! It is so sterile!,1.1604938271604939,0.04797372648821098,81,70,9,2
Elon said what!?,1.1604938271604939,0.05108933752236682,81,71,7,3
Are we going to fix this guy up or do the hustle.,1.1604938271604939,0.04797372648821098,81,70,9,2
Is this HR's idea of having fun at work?,1.1604938271604939,0.04464119686855444,81,69,11,1
The disco light? ...Over the top. The song 'Crazy' ....Definitely gotta go!,1.1604938271604939,0.04464119686855444,81,69,11,1
"Virulent Saturday Night Fever, but he's stayin' alive.  
He will survive.",1.1604938271604939,0.04797372648821098,81,70,9,2
Is the playlist still covered by insurance?,1.1604938271604939,0.0540255715729409,81,72,5,4
Now he looks like he’s still alive.,1.1604938271604939,0.04797372648821098,81,70,9,2
"Remember, never point the laser knife at it.",1.1604938271604939,0.04464119686855444,81,69,11,1
Apparently this became more than just a Saturday Night fever.,1.1604938271604939,0.04464119686855444,81,69,11,1
"Whoa, whoa, whoa,
 whoa, stayin' alive, stayin alive...",1.1604938271604939,0.04797372648821098,81,70,9,2
"Blame it on the boogie, I guess?",1.1604938271604939,0.04797372648821098,81,70,9,2
"Hey Siri, create the mood for surgery!",1.1604938271604939,0.04103893861381398,81,68,13,0
"Siri, play 'I will Survive'.",1.16,0.05036801501882856,75,65,8,2
I haven't done a disco-ectomy since the 80s.,1.16,0.04665379487862246,75,64,10,1
Keeps me on my toes and lets me know that disco here and disco there.,1.16,0.05036801501882856,75,65,8,2
We can’t just waltz in here anymore.,1.16,0.04665379487862246,75,64,10,1
"Siri, play ""Lady Godiva's Operation"" by The Velvet Underground.",1.16,0.04261708831227467,75,63,12,0
"I'm confident we can tackle his appendicitis, but I'm not feeling good about his night fever.",1.16,0.04261708831227467,75,63,12,0
The ball drop gives the OR so much more ambiance!,1.16,0.04665379487862246,75,64,10,1
I think it’s a soul train.,1.16,0.05036801501882856,75,65,8,2
"I never cared for disco, but their balls are the best!",1.16,0.04665379487862246,75,64,10,1
did you touch anything to activate this part of his subconscious ?,1.16,0.05036801501882856,75,65,8,2
We call it the Bee Gees protocol.,1.16,0.04665379487862246,75,64,10,1
"Next, our patient performing “I Will Survive”.",1.16,0.05036801501882856,75,65,8,2
Alexi! Surgery mode!,1.16,0.053826548257317225,75,66,6,3
"Boomer humor. When I told him he had discogenic degeneration,he insisted.",1.16,0.04665379487862246,75,64,10,1
"Oh my, he has a fever and it's Saturday night.",1.16,0.04261708831227467,75,63,12,0
It appears we’ll be able to skate through this procedure.,1.16,0.04665379487862246,75,64,10,1
"He is our patient, we need to save him, he's stayin' alive, stayin' alive.",1.16,0.05036801501882856,75,65,8,2
He wanted to go to club on his last night.,1.16,0.04665379487862246,75,64,10,1
The reality show producers are trying to add some pizzazz to this gal bladder episode.,1.16,0.04665379487862246,75,64,10,1
It obscures the icky blood splatter.,1.1594202898550725,0.04895841096457367,69,59,9,1
These digital chandeliers are really something,1.1594202898550725,0.04895841096457367,69,59,9,1
"Tell the new electrician , this is not Studio 54""
'",1.1594202898550725,0.04895841096457367,69,59,9,1
It gets way better results on my Instagram page.,1.1594202898550725,0.04439221265797129,69,58,11,0
Looks like a bad case of night fever.,1.1594202898550725,0.05313363777948607,69,60,7,2
"It's called twilight sedation.""",1.1594202898550725,0.04895841096457367,69,59,9,1
"Ah, ha, ha, ha he's stayin' alive.",1.1594202898550725,0.04895841096457367,69,59,9,1
Let's hope he's ha-ha-ha-ha Stayin' Alive!,1.1594202898550725,0.04895841096457367,69,59,9,1
"Hey, turn up his heart monitor, would you?",1.1594202898550725,0.04895841096457367,69,59,9,1
Saturday Night Hysterectomy,1.1594202898550725,0.05700386761604138,69,61,5,3
"This is in case he wakes up during surgery, so he knows he's in a fun, safe environment",1.1594202898550725,0.04895841096457367,69,59,9,1
I told them to play Stayin’ Alive not Heart of Glass.,1.1594202898550725,0.04895841096457367,69,59,9,1
I still think the twenty percent increase in outpatient mortality is still worth Disco Friday.,1.1594202898550725,0.04895841096457367,69,59,9,1
Welcome to your last dance.,1.1594202898550725,0.04895841096457367,69,59,9,1
This wasn’t written in the DNR,1.1594202898550725,0.04439221265797129,69,58,11,0
I was quite clear - MRI not MRB!,1.1594202898550725,0.04895841096457367,69,59,9,1
I don’t know. Anesthesia insisted.,1.1594202898550725,0.04895841096457367,69,59,9,1
"Puts a whole new meaning on, “Death before disco.”",1.1587301587301588,0.05637245937794515,63,55,6,2
Looks like this one will be Stayin' Alive.,1.1587301587301588,0.05163159310171234,63,54,8,1
"Management is taking this work life balance thing a bit too far, don't you think?",1.1587301587301588,0.05163159310171234,63,54,8,1
Is this what the new Cheif of surgery meant when she said she wants the operating rooms to “sparkle”?,1.1587301587301588,0.04640892840955826,63,53,10,0
This is not how I ever pictured surgery robots would look.,1.1587301587301588,0.05163159310171234,63,54,8,1
"It makes me feel like dancing, especially if the patient has really good insurance.",1.1587301587301588,0.05637245937794515,63,55,6,2
They never taught me how to change a light bulb.,1.1587301587301588,0.05163159310171234,63,54,8,1
Look! I can see me !,1.1587301587301588,0.05637245937794515,63,55,6,2
I have 20 bucks that says he hand wrote the OR prep instructions for this Disc Operation..,1.1587301587301588,0.05637245937794515,63,55,6,2
"It’s not sterile, but dammit, I like it.",1.1587301587301588,0.05637245937794515,63,55,6,2
"We had it put in for Guy Lombardo but Don Rickles said ""don't take it down, you mo-mo""",1.1585365853658536,0.044136849525480595,82,70,11,1
It's the best treatment we've found for staying alive if they come down with the Saturday Night Fever Covid variant.,1.1585365853658536,0.050500393370146966,82,72,7,3
His life will be on that TV screen in just a few seconds.,1.1585365853658536,0.04742547425474257,82,71,9,2
Oh magic ball sparkly and beautiful we beseech your help for Johnny here.His dancing audition will have to wait until I reattach his leg,1.1585365853658536,0.05339853792747436,82,73,5,4
Let’s just try to connect the dots.,1.1585365853658536,0.050500393370146966,82,72,7,3
"Gimme that night, fever, night fe-ver-err, we know how to show it...""",1.1585365853658536,0.044136849525480595,82,70,11,1
"Oh God,it's gone opaque again. Now what?",1.1585365853658536,0.04742547425474257,82,71,9,2
"Mamma mia,
here I go again",1.1585365853658536,0.050500393370146966,82,72,7,3
"I think it's a sign, Doctor. Let's wing it.""",1.1585365853658536,0.044136849525480595,82,70,11,1
Neuro must have had another one of their themed surgeries,1.1585365853658536,0.044136849525480595,82,70,11,1
Why do our patients always seem to have a fever on Saturday nights?,1.1585365853658536,0.050500393370146966,82,72,7,3
I forgot about Appendectomy Appreciation Week.,1.1585365853658536,0.050500393370146966,82,72,7,3
I ‘m not sure if insurance will cover this.,1.1585365853658536,0.044136849525480595,82,70,11,1
Shouldn’t he be on his stomach for a discectomy?,1.1585365853658536,0.04742547425474257,82,71,9,2
The operating theater felt a little stale.,1.1585365853658536,0.044136849525480595,82,70,11,1
I'm coming out; I want the world to know...,1.1578947368421053,0.05635922247090881,76,68,4,4
Cue the lights,1.1578947368421053,0.046083949251100695,76,65,10,1
"This what we get when the patient is John Travolta.""",1.1578947368421053,0.0531552891492741,76,67,6,3
Apparently his favorite DJ was out-of-network.,1.1578947368421053,0.049745427644764306,76,66,8,2
"It's just a little reminder that the patient should be ""Stayin' Alive.""",1.1578947368421053,0.04210526315789474,76,64,12,0
"Now, where were we?",1.1578947368421053,0.0531552891492741,76,67,6,3
"Let's just keep him stayin' alive, stayin' alive.",1.1578947368421053,0.049745427644764306,76,66,8,2
"Fabulous forceps, stat!",1.1578947368421053,0.049745427644764306,76,66,8,2
"We need some background music…how about the Bee Gee’s
STAYIN” ALIVE",1.1578947368421053,0.049745427644764306,76,66,8,2
Ladies and gentlemen-- November's morale budget,1.1578947368421053,0.049745427644764306,76,66,8,2
"I told the electrician we do DISK surgery, not DISCO.",1.1578947368421053,0.046083949251100695,76,65,10,1
"Stayin' Alive, Stat!",1.1578947368421053,0.049745427644764306,76,66,8,2
Two units of plasma STAT! It’s Saturday Night Fever!,1.1578947368421053,0.049745427644764306,76,66,8,2
I call it laser shotgun surgery,1.1578947368421053,0.04210526315789474,76,64,12,0
I don't feel I've had enough sleep.,1.1578947368421053,0.0531552891492741,76,67,6,3
Gloria Gaynor donated it after we successfully removed her gall bladder last week.,1.1578947368421053,0.0531552891492741,76,67,6,3
"Mirror, mirror, on the ball, who’s the baddest doc of all?",1.1578947368421053,0.046083949251100695,76,65,10,1
"Really sets the mood, don't you think?",1.1578947368421053,0.049745427644764306,76,66,8,2
the vibe has been set. we may now proceed,1.1578947368421053,0.046083949251100695,76,65,10,1
We have been treating a lot of saturday night fever this year.,1.1573033707865168,0.038811757286952686,89,75,14,0
Love the new format for zoom meetings,1.1573033707865168,0.0449118885544538,89,77,10,2
And then we play 'Staying Alive' over the loud speakers when he wakes up.,1.1571428571428573,0.04830765057229997,70,60,9,1
'Stayin' Alive?'.....seriously!?,1.1571428571428573,0.0524185823803322,70,61,7,2
"The new ""Stayin' Alive"" promotion is off to a great start""",1.1571428571428573,0.04830765057229997,70,60,9,1
"This, my friends, is what happens when you vote greens.",1.1571428571428573,0.04830765057229997,70,60,9,1
"Patient is running a fever, a disco fever that is",1.1571428571428573,0.04830765057229997,70,60,9,1
Full disclosure…not really sure I ‘needed’ that third rail of blow.,1.1571428571428573,0.0524185823803322,70,61,7,2
"Please cue the Bee Gees ""Staying Alive"" for Mr. Travolta.",1.1571428571428573,0.0524185823803322,70,61,7,2
You know...supply chain issues,1.1571428571428573,0.0524185823803322,70,61,7,2
I feel like we should be staring at our phones instead.,1.1571428571428573,0.056229764837778876,70,62,5,3
The new administrator used to be an owner of Studio 54.,1.1571428571428573,0.05979853784717611,70,63,3,4
Disco never dies.,1.1571428571428573,0.04830765057229997,70,60,9,1
Now you do chest compressions to the beat of Stayin' Alive.,1.1571428571428573,0.04830765057229997,70,60,9,1
"DaVinci, remove his prostate.",1.1571428571428573,0.04830765057229997,70,60,9,1
"Well you can tell by the way his heart is blocked, he needs surgery now, no time to talk. 

Linda Klein, Santa Monica CA",1.1571428571428573,0.056229764837778876,70,62,5,3
"We got tired of hearing, ""There was this long dark tunnel...""",1.1571428571428573,0.0524185823803322,70,61,7,2
If I were an ENT this would be a boogie wonderland.,1.1571428571428573,0.056229764837778876,70,62,5,3
I say we go to lunch.,1.1571428571428573,0.04830765057229997,70,60,9,1
Your move.,1.1571428571428573,0.0524185823803322,70,61,7,2
We've been doing a lot of work for Dancing with the Stars.,1.1571428571428573,0.04830765057229997,70,60,9,1
It's recommended for severe cases of Saturday Night Fever,1.1571428571428573,0.056229764837778876,70,62,5,3
"Aw gosh, we’re going to get fired for this.",1.1571428571428573,0.056229764837778876,70,62,5,3
"We're keep, keep, keep, keep, keepin' him alive, keepin' him alive",1.1571428571428573,0.0524185823803322,70,61,7,2
The third shift wasn't kidding when they said they hustled all night.,1.1571428571428573,0.0524185823803322,70,61,7,2
"It helps me focus while I hum, 
""And we're stayin' alive, stayin' alive
Ah, ha, ha, ha, stayin' alive, stayin' alive (oh)
Ah, ha, ha, ha, stayin' alive (oh).",1.1571428571428573,0.0524185823803322,70,61,7,2
"""And we're stayin' alive, stayin' alive
Ah, ha, ha, ha, stayin' alive, stayin' alive
Ah, ha, ha, ha, stayin' alive (hey)...""",1.1571428571428573,0.04830765057229997,70,60,9,1
Wait till we close before the confetti drop.,1.1571428571428573,0.0524185823803322,70,61,7,2
A tiny malfunction.,1.1571428571428573,0.04830765057229997,70,60,9,1
Studio 54 garage sale find,1.1571428571428573,0.056229764837778876,70,62,5,3
"‘While I recognise ‘Staying alive’ is our CPR beat, THIS is ridiculous!’   @skull__zo",1.1571428571428573,0.04830765057229997,70,60,9,1
Paging Dr. Beat!,1.1571428571428573,0.04830765057229997,70,60,9,1
We were lobbying for better working conditions and the hospital administrator said this would make operations more fabulous,1.1571428571428573,0.056229764837778876,70,62,5,3
"Critical Care 54 is a great name but that never leaves this room, understood?",1.1566265060240963,0.04688951917827401,83,72,9,2
"Ah, ha, ha, ha, stayin' alive, stayin' alive! Everybody now!",1.1566265060240963,0.04688951917827401,83,72,9,2
The dance club is closing. Can't this wait; he will survive.,1.1566265060240963,0.04688951917827401,83,72,9,2
So this is why the waiting list for Saturday Night Surgeries is so long,1.1566265060240963,0.05278582886827132,83,74,5,4
"Alexa, play Body by Loud Luxury",1.1566265060240963,0.04992479713569276,83,73,7,3
"Oh no, God took us by mistake again…",1.1566265060240963,0.04013614690312246,83,70,13,0
Yet another burn victim from 'Disco Inferno.',1.15625,0.05087893153952011,64,55,8,1
He came down with a bad case of disco fever. We thought this might help break it.,1.15625,0.045745315919462494,64,54,10,0
The reflections make things appear smaller so shorter surgery times.,1.15625,0.045745315919462494,64,54,10,0
Mr Travolta requested this for his operation.,1.15625,0.05087893153952011,64,55,8,1
Yet another casualty of the Saturday Night Fever.,1.15625,0.055540052400361674,64,56,6,2
Party on dudes!,1.15625,0.045745315919462494,64,54,10,0
Dr. Smith does his best work to 'Staying Alive'.,1.15625,0.045745315919462494,64,54,10,0
Are we really sure this is as effective as the good old surgery?,1.15625,0.05087893153952011,64,55,8,1
"You see, they haven't developed a vaccine for Saturday night fever.",1.15625,0.05087893153952011,64,55,8,1
"And now, we begin the disco repairs.",1.15625,0.05087893153952011,64,55,8,1
"Doctor, Are you positive this will help get the funk out of this man?""",1.15625,0.055540052400361674,64,56,6,2
Reminds me of New York on New Years Eve.,1.15625,0.05087893153952011,64,55,8,1
Maybe we shouldn’t have dropped acid before the case.,1.15625,0.045745315919462494,64,54,10,0
This must be a serious case of disco fever.”,1.15625,0.05087893153952011,64,55,8,1
"It's kind of between ""outlook not so good"" and ""Don't count on it""",1.15625,0.05087893153952011,64,55,8,1
I love when insurance approves the party package.,1.15625,0.055540052400361674,64,56,6,2
Where are the local officials?,1.15625,0.05087893153952011,64,55,8,1
"Hey may be dying, but we will never panic at the disco",1.15625,0.05087893153952011,64,55,8,1
‘I presumed the Christmas party would be in the staff room’,1.15625,0.05087893153952011,64,55,8,1
"They say disco is dead, but I believe with all my heart that this team can perform miracles.",1.15625,0.045745315919462494,64,54,10,0
Now? But the DJ was scheduled for last night!,1.15625,0.05087893153952011,64,55,8,1
They say he always rallies for a good party.,1.15625,0.05087893153952011,64,55,8,1
It reminds me to keep the patients Stayin' Alive.,1.15625,0.055540052400361674,64,56,6,2
We have more fun on the overnight shift.,1.155844155844156,0.0525004803055042,77,68,6,3
Don't you know any other Bee Gee's songs?,1.155844155844156,0.04552772158797496,77,66,10,1
Get me the Saturday Night Fever readout. Stat!,1.155844155844156,0.04160540750111606,77,65,12,0
"Disco fever, will take about a decade to run its course.",1.155844155844156,0.04552772158797496,77,66,10,1
"Disco ball? Check. Music? Alexa, play Stayin’ Alive.",1.155844155844156,0.04552772158797496,77,66,10,1
It's supposed to distract the cancer into submission.,1.155844155844156,0.04552772158797496,77,66,10,1
This ain’t no fooling around…,1.155844155844156,0.04913793781438531,77,67,8,2
"I like to give patients a ""Staying Alive"" vibe...",1.155844155844156,0.04552772158797496,77,66,10,1
You can always tell what decade the surgeon graduated by the music they play.,1.155844155844156,0.04552772158797496,77,66,10,1
Just enjoy and relax. He won’t notice.,1.155844155844156,0.04913793781438531,77,67,8,2
Good insurance.,1.155844155844156,0.04160540750111606,77,65,12,0
Are we going to have a surgery party?,1.155844155844156,0.0525004803055042,77,68,6,3
These Click List substitutes are getting a bit out of hand.,1.155844155844156,0.04552772158797496,77,66,10,1
"Let's boogie to my favorite...""Stayin' Alive.""",1.155844155844156,0.04913793781438531,77,67,8,2
He said disco puts him to sleep.,1.155844155844156,0.04552772158797496,77,66,10,1
It adds some boogie to the bypass.,1.155844155844156,0.05566025450864261,77,69,4,4
"If he starts dancing, we’ve done something wrong.",1.155844155844156,0.04160540750111606,77,65,12,0
Its friday night and the lights are low,1.155844155844156,0.04552772158797496,77,66,10,1
Let’s try to get this done before midnight.,1.155844155844156,0.04552772158797496,77,66,10,1
"Yeah, I always thought it should have been Bee Gee Hunnicutt too.",1.155844155844156,0.04552772158797496,77,66,10,1
Time to get our surgery on WOOO!,1.155844155844156,0.0525004803055042,77,68,6,3
"Whether you're a brother or whether you're a mother,
you're stayin' alive, stayin' alive.",1.1555555555555554,0.047169868900736205,90,79,8,3
Is that his spleen in your hand ?,1.1555555555555554,0.04974620007849814,90,80,6,4
It was the patient's idea. The same with the piped in 'Stayin' alive' music in the background.,1.1555555555555554,0.04974620007849814,90,80,6,4
This is the most severe case of disco fever I've ever treated,1.1549295774647887,0.05172239521306923,71,62,7,2
He got a fever Saturday,1.1549295774647887,0.05172239521306923,71,62,7,2
Nostalgia or Gestalt? The Chief Surgeon won't say!,1.1549295774647887,0.04767380496305489,71,61,9,1
"I said YELLOW Fever, not Night Fever!",1.1549295774647887,0.04324785766640781,71,60,11,0
"Let’s - hope - he’ll - be — staying alive, staying alive!",1.1549295774647887,0.04767380496305489,71,61,9,1
This isn't what I expected when I offered 'house' calls,1.1549295774647887,0.05172239521306923,71,62,7,2
It appears to be a case of dance fever.,1.1549295774647887,0.055476307136456515,71,63,5,3
Let's party like it's 1999,1.1549295774647887,0.04324785766640781,71,62,8,1
"I thought it would add to the whole ""Stayin' Alive"" vibe.",1.1549295774647887,0.04767380496305489,71,61,9,1
We have one heck of a Grant Writer!,1.1549295774647887,0.055476307136456515,71,63,5,3
"Maybe we're taking this ""Stayin' Alive"" thing too seriously...",1.1549295774647887,0.05172239521306923,71,62,7,2
"Ah, ah, ah, ah, stayin' ali-iii-ii-yive...",1.1549295774647887,0.04767380496305489,71,61,9,1
He loves operating to “Staying Alive.”,1.1549295774647887,0.05172239521306923,71,62,7,2
I don’t know why they call us divas.,1.1549295774647887,0.04324785766640781,71,60,11,0
It's the latest in surgical discothèque-niques.,1.1549295774647887,0.05172239521306923,71,62,7,2
"I've goofed up three sets of stitches so far, but the ambience is unbeatable.",1.1549295774647887,0.05172239521306923,71,62,7,2
"now play Gloria Gaynor's ""I Will Survive"" and we're all good to go",1.1549295774647887,0.05172239521306923,71,62,7,2
"When you lose as many patients as we do, you'll be surprised at how this little baby lightens the mood.",1.1547619047619047,0.049362103046446434,84,74,7,3
"Hustle, stat!",1.1547619047619047,0.04316125289977419,84,72,11,1
Disco didn't die? Good omen.,1.1547619047619047,0.049362103046446434,84,74,7,3
"I said diskectomy, not disco.",1.1547619047619047,0.04316125289977419,84,72,11,1
"Yes, he asked for that and the Bee Gee's ""Stayin' Alive"" on the intercom.",1.1538461538461537,0.05014771080925116,65,56,8,1
"Well, I was going to blame it on the gallbladder, but the boogie could be the culprit",1.1538461538461537,0.045100151536763756,65,55,10,0
"We’re very sorry Mrs. Kissinger, the operation was unsuccessful, we tried the best we could",1.1538461538461537,0.05014771080925116,65,56,8,1
Let's dance. Stat!,1.1538461538461537,0.048545007377001494,78,68,8,2
"Ooh, ooh, ooh!  Stayin"" alive. Stayin'  alive.",1.1538461538461537,0.05186152788178788,78,69,6,3
"And he’s stayin' alive, stayin' alive
Ah, ha, ha, ha, stayin' alive, stayin' alive (oh)
Ah, ha, ha, ha, stayin' alive (oh)",1.1538461538461537,0.05186152788178788,78,69,6,3
"OK, let's boogie!",1.1538461538461537,0.05014771080925116,65,56,8,1
I’m not feeling very confident so I thought I’d show him the light at the end of the tunnel before we start.,1.1538461538461537,0.0449846352461904,78,67,10,1
Thought this would lighten the mood,1.1538461538461537,0.0547317287336835,65,57,6,2
"It worked! He’s stayin' alive, stayin' alive.",1.1538461538461537,0.05014771080925116,65,56,8,1
Seriously?  Just because Derek Hough collapsed in season 347?,1.1538461538461537,0.0547317287336835,65,57,6,2
Just because it's life-threatening doesn't mean it has to be boring.,1.1538461538461537,0.045100151536763756,65,55,10,0
"I did agree that you could choose the music this time, but this is a little much.",1.1538461538461537,0.0449846352461904,78,67,10,1
"Okay, we're ready. Jeremy, pass the scalpel.",1.1538461538461537,0.05014771080925116,65,56,8,1
Should have stopped at triple Hustle.,1.1538461538461537,0.04398655839495409,91,79,10,2
This is an experiment to make operations more humane?,1.1538461538461537,0.05014771080925116,65,56,8,1
Well that's a little premature.,1.1538461538461537,0.05186152788178788,78,69,6,3
It's my100th kidney transplant.,1.1538461538461537,0.048545007377001494,78,68,8,2
"I've set the playlist so that ""Staying Alive"" repeats itself.",1.1538461538461537,0.05014771080925116,65,56,8,1
This isnt the night fever I anticipated addressing but im not totally against it.,1.1538461538461537,0.045100151536763756,65,55,10,0
Step back and let the giant laser do its magic.”,1.1538461538461537,0.05186152788178788,78,69,6,3
Does this reflect poorly on us . . . ?,1.1538461538461537,0.0547317287336835,65,57,6,2
Uh oh!  He told me he didn’t want anything with planes.,1.1538461538461537,0.045100151536763756,65,55,10,0
