caption,mean,precision,votes,not_funny,somewhat_funny,funny
"I miss the old days, when we were only gods.",1.1129032258064515,0.046591027055115045,62,56,5,1
Not another confetti can swallower,1.1129032258064515,0.046591027055115045,62,56,5,1
really livens up the room,1.1129032258064515,0.046591027055115045,62,56,5,1
"No, it’s a dog!",1.1129032258064515,0.05681870520872221,62,58,1,3
"Is it just me, or does it feel like things are going back to the 70s?",1.1129032258064515,0.046591027055115045,62,56,5,1
It's disco night on Dancing with the Stars. He's in the finals on Monday.,1.1129032258064515,0.046591027055115045,62,56,5,1
Do we even have the rights to play the Bee Gees?,1.1129032258064515,0.051957141297641354,62,57,3,2
That was a large tumor.,1.1129032258064515,0.046591027055115045,62,56,5,1
We can't operate until his disco fever comes down.,1.1129032258064515,0.04052040316035682,62,55,7,0
Happens every time I do a breast augmentation!,1.1129032258064515,0.04052040316035682,62,55,7,0
You couldn't go to the party so we brought the party to you,1.1129032258064515,0.04052040316035682,62,55,7,0
"Don't worry, it's a Secret Service camera, they're on break so no one is watching.",1.1129032258064515,0.046591027055115045,62,56,5,1
He died late Saturday night from a fever....,1.1129032258064515,0.04052040316035682,62,55,7,0
It keeps the med school students engaged,1.1129032258064515,0.04052040316035682,62,55,7,0
"Disco may be dead, but this patient is staying alive!",1.1129032258064515,0.04052040316035682,62,55,7,0
"Your choice of disco music is fine, Doctor, but this is a bit distracting.",1.1129032258064515,0.04052040316035682,62,55,7,0
And it's only another $20k extra!,1.1129032258064515,0.046591027055115045,62,56,5,1
"Our patient is a disc jockey at a discotheque. ""
By Thomas Sievers",1.1129032258064515,0.04052040316035682,62,55,7,0
"A little on the nose for an Orchiectomy, don't you think?",1.1129032258064515,0.04052040316035682,62,55,7,0
This may be their best chance at stayin' alive.,1.1129032258064515,0.046591027055115045,62,56,5,1
"You can't call yourself ""edgy"" until you master the Disco Ball Implant.",1.1129032258064515,0.04052040316035682,62,55,7,0
"Nurse, queue 'Stayin Alive'.",1.1129032258064515,0.046591027055115045,62,56,5,1
"When I asked him for his music selection, he said he just wanted “Staying Alive”.",1.1129032258064515,0.04052040316035682,62,55,7,0
Disco music?! All because I fret over a weak pulse!,1.1129032258064515,0.04052040316035682,62,55,7,0
The patient has an acute case of Saturday night fever!,1.1129032258064515,0.046591027055115045,62,56,5,1
Not Covid.,1.1129032258064515,0.04052040316035682,62,55,7,0
231...232..233..,1.1129032258064515,0.046591027055115045,62,56,5,1
"Sh*t is getting real…drop the beat, STAT.",1.1129032258064515,0.046591027055115045,62,56,5,1
At least he’ll wake up to a fun O.R. if the anesthesia wears off,1.1129032258064515,0.046591027055115045,62,56,5,1
Patient zero for Disco Fever,1.1129032258064515,0.046591027055115045,62,56,5,1
Go with a bang!,1.1129032258064515,0.046591027055115045,62,56,5,1
"They said this new laser therapy was unorthodox, but I didn't exactly expect this.",1.1129032258064515,0.046591027055115045,62,56,5,1
Anything we can do to improve healthcare....,1.1129032258064515,0.046591027055115045,62,56,5,1
Stop dancing around and hand me the scalpel.,1.1126760563380282,0.04278670967729594,71,64,6,1
"Also, he wants us to play Begin the Beguine while we're doing the proceedure.",1.1126760563380282,0.037792698211264054,71,63,8,0
"You’re sending the wrong message, Disco is dead.",1.1126760563380282,0.04725586748680781,71,65,4,2
"Bring in 'da noise, bring in 'da funk, and bring in 250ml of 'da plasma -- stat!",1.1126760563380282,0.037792698211264054,71,63,8,0
Just for surgery on a disc? Oh.,1.1126760563380282,0.04278670967729594,71,64,6,1
"Should we dim the lights 
and turn it up?",1.1126760563380282,0.04278670967729594,71,64,6,1
"When I announced it would take everything in our power to keep this man Staying Alive, I think I may have been misunderstood.",1.1126760563380282,0.04725586748680781,71,65,4,2
"Don't you think it's interesting that those of us in Congress, who have medical degrees, have difficulty working together in Congress but are a great team in the science lab?",1.1126760563380282,0.04278670967729594,71,64,6,1
I think it’s Disco Fever.,1.1126760563380282,0.037792698211264054,71,63,8,0
"I don't mind special requests by patients... but it's the ""Stayin' Alive"" on repeat that's getting to me.",1.1126760563380282,0.04278670967729594,71,64,6,1
"First we lower the disco ball. Then we crank up ""Stayin' Alive.""",1.1126760563380282,0.04725586748680781,71,65,4,2
Daft Punk’s not dead.,1.1126760563380282,0.04278670967729594,71,64,6,1
It really helps set the mood for stayin' alive.,1.1126760563380282,0.037792698211264054,71,63,8,0
"I said it was disc surgery, not disco.",1.1126760563380282,0.04725586748680781,71,65,4,2
"Does anyone remember all the lyrics to ""Stayin' Alive""?",1.1126760563380282,0.037792698211264054,71,63,8,0
The patient requested this while Gloria Gaynor’s “I Will Survive” plays.,1.1126760563380282,0.04278670967729594,71,64,6,1
At least we've got a dance beat.,1.1126760563380282,0.037792698211264054,71,63,8,0
I thought playing Staying Alive under a disco ball would set the mood for a good outcome.,1.1126760563380282,0.037792698211264054,71,63,8,0
Surely there's a better way to boost morale,1.1126760563380282,0.037792698211264054,71,63,8,0
"In case the anesthesia fails, the patient will think he's back in a 1980s Manhattan disco, and not on the operating table.",1.1125,0.03975299526968241,80,72,7,1
"It’s a great breakthrough, but it’s going to be a tight squeeze.",1.1125,0.04355176608490089,80,73,5,2
Come on guys it’s 2022 - Disco is Dead,1.1125,0.03975299526968241,80,72,7,1
Our anesthesiologist got a bulk rate.,1.1125,0.04355176608490089,80,73,5,2
"I don’t think it’s tasteful either, but it beats the doornail decor in exam room three.",1.1125,0.04355176608490089,80,73,5,2
Who's playing 'Another One Bites The Dust' ?,1.1123595505617978,0.04054720904307208,89,81,6,2
Should we perform this surgery before midnight? It'll be New Years.,1.1123595505617978,0.04358255128025163,89,82,4,3
"I love to operate while listening to ""Stayin' Alive.""",1.1111111111111112,0.050619272401046675,54,49,4,1
They’re called breasts and we all have them.,1.1111111111111112,0.04303314829119352,81,74,5,2
"I just figured, since we've decided 'Stayin' Alive' is the perfect song for measuring chest compressions, why not fully commit to the performance.",1.1111111111111112,0.042217280000676725,72,65,6,1
We’re waiting for the reboot to finish.,1.1111111111111112,0.039283710065919304,81,73,7,1
"OK, next step is to blast some Bee Gees.",1.1111111111111112,0.045880536291546904,63,57,5,1
Every performance ends with a Snow Scene,1.1111111111111112,0.045880536291546904,63,57,5,1
"Ok Team - one, two, three - sing it!
Stayin' Alive, Stayin' Alive!",1.1111111111111112,0.039912289339283286,63,56,7,0
"If this is successful, we can do the Charleston.",1.1111111111111112,0.04662118657203829,72,66,4,2
There's nothing we can do. He's not on the guest list.,1.1111111111111112,0.039912289339283286,63,56,7,0
"It's a little early for the Bee Gees, isn't it?",1.1111111111111112,0.039912289339283286,63,56,7,0
Reminds me of year four medial school.,1.1111111111111112,0.04662118657203829,72,66,4,2
The new laser makes up in power what it lacks in precision.,1.1111111111111112,0.045880536291546904,63,57,5,1
"And God said..."" Let there be disco light.""",1.1111111111111112,0.05710624097222739,54,50,2,2
"It's called 'Auld Lang Syne' ...  
wait 'til you see Easter's!",1.1111111111111112,0.042217280000676725,72,65,6,1
We're all just tryin' to stay alive.,1.1111111111111112,0.05115717330440804,63,58,3,2
He was struck by Saturday,1.1111111111111112,0.045880536291546904,63,57,5,1
"I wish they wouldn't pipe in ""Last Dance"" every time we put the lights on rotate.",1.1111111111111112,0.042217280000676725,72,65,6,1
It's the supply chain!,1.1111111111111112,0.039912289339283286,63,56,7,0
"I don't think this is what he meant when he said his last request was ""Staying Alive"".",1.1111111111111112,0.045880536291546904,63,57,5,1
"Uh, uh, uh, uh stayin alive, stayin alive…",1.1111111111111112,0.039912289339283286,63,56,7,0
"OK, now how does that Bee Gees song go?",1.1111111111111112,0.039912289339283286,63,56,7,0
Time to dance with death,1.1111111111111112,0.045880536291546904,63,57,5,1
"I requested a discogram, not a Disco Grand!",1.1111111111111112,0.037296949257630635,72,64,8,0
The rhythm continues to be off,1.1111111111111112,0.045880536291546904,63,57,5,1
It was cheaper than getting new surgical lights.,1.1111111111111112,0.05115717330440804,63,58,3,2
Inflation Reduction Act at the Disco. IRA @ Disco,1.1111111111111112,0.045880536291546904,63,57,5,1
"It sure brightens the place up, doesn't it?",1.1111111111111112,0.045880536291546904,63,57,5,1
"I asked for artificial INTELLIGENCE, not lighting!",1.1111111111111112,0.05115717330440804,63,58,3,2
"Yes, but if we share it on Instagram we get the 'disco rate'.",1.1111111111111112,0.039912289339283286,63,56,7,0
"I said, 'Gall bladder, not glitter ball!""",1.1111111111111112,0.045880536291546904,63,57,5,1
"Well, like she said…’This ain’t no disco and it ain’t no country club either,’ but dang it! I want to have a little fun before I die!",1.1111111111111112,0.037296949257630635,72,64,8,0
This surgery is guaranteed to make him the life of the party!,1.1111111111111112,0.050619272401046675,54,49,4,1
"Disco's dead, disco death.",1.1111111111111112,0.042217280000676725,72,65,6,1
"It's the piping in ""Stayin' Alive"" that I can't stand.",1.1111111111111112,0.03513641844631533,81,72,9,0
Disco Inferno or surgurixcal place of torment,1.1111111111111112,0.037296949257630635,72,64,8,0
"I dunno, it worked really well in my Dinning Room""",1.1111111111111112,0.039912289339283286,63,56,7,0
Are you sure the hose isn't leaking?,1.1111111111111112,0.039912289339283286,63,56,7,0
I knew it would happen.  Radioactive fallout.  It happened!,1.1111111111111112,0.042217280000676725,72,65,6,1
Give him every chance to make it.,1.1111111111111112,0.042217280000676725,72,65,6,1
"If we save the patient, disco will die.",1.1111111111111112,0.042217280000676725,72,65,6,1
"When it stops twirling, the operation is done.",1.1111111111111112,0.039912289339283286,63,56,7,0
"Suddenly, a hedgehog shot out of the bush...",1.1111111111111112,0.042217280000676725,72,65,6,1
"? He will survive! 
As long as I know how to nurse I know he'll stay alive!
He's got all his life to live
And I've got all these meds to give
And he'll survive
He will survive! Hey! Hey! ?",1.1111111111111112,0.043168260549211725,54,48,6,0
Not yet! He is still awake!,1.1111111111111112,0.045880536291546904,63,57,5,1
I asked for “this guy’s ball”,1.1111111111111112,0.042217280000676725,72,65,6,1
A little atmosphere to brighten the morning.,1.1111111111111112,0.05115717330440804,63,58,3,2
It's country all day long.,1.1111111111111112,0.042217280000676725,72,65,6,1
I told them to wait... you know the patient loves to dance.,1.1111111111111112,0.042217280000676725,72,65,6,1
"Well, you can tell by the way I use my knife I’m a patient’s Doc, no time to talk” 🎤🎼",1.1111111111111112,0.037296949257630635,72,64,8,0
"I’m calling it, time of parking on the dance floor- 12:31am",1.1111111111111112,0.037296949257630635,72,64,8,0
"They said they still wanted something contagious and unremovable, yet healthy, thus GLITTER",1.1111111111111112,0.045880536291546904,63,57,5,1
"Ah, ha, ha, ha, stayin' alive, stayin’ al—what? Everyone’s got their pregame rituals”",1.1111111111111112,0.04662118657203829,72,66,4,2
"For today's CPR we'll try ""Staying alive"", because ""Massachusetts' didn't work that well""",1.1111111111111112,0.04662118657203829,72,66,4,2
"he wanted to be sure the BTS reel for his vasectomy was ""instagrammable""",1.1111111111111112,0.039912289339283286,63,56,7,0
"'Since you said ...'Work hard, party harder'",1.1111111111111112,0.039912289339283286,63,56,7,0
This anesthesia is strong!,1.1111111111111112,0.04662118657203829,72,66,4,2
Did you drop the beat?” “No that was the scalpel,1.1111111111111112,0.04662118657203829,72,66,4,2
I thought the room needed some pizzazz,1.1111111111111112,0.045880536291546904,63,57,5,1
"We're performing in the ""Staying Alive"" operating room",1.1095890410958904,0.036813962320997935,73,65,8,0
Disco music yes; disco ball no.,1.1095890410958904,0.04166275705683711,73,66,6,1
It’s Disco Tuesday!,1.1095890410958904,0.04166275705683711,73,66,6,1
I think there is a disco-nnect here.,1.1095890410958904,0.04166275705683711,73,66,6,1
Are you sure this will help you concentrate doc?,1.1095890410958904,0.04996819321515819,73,68,2,3
Does submitting a patient’s hospital rider request to DeuxMoi break HIPAA?,1.1095890410958904,0.036813962320997935,73,65,8,0
"Well how would YOU suggest celebrating my 1,000th surgery?",1.109375,0.039322054350368486,64,57,7,0
"The good news is, though the patient may be dead, disco never dies. is not dead.",1.109375,0.045191323330536354,64,58,5,1
Disco Surgery,1.109375,0.045191323330536354,64,58,5,1
"It ties in with the hospital's new slogan, ""Stayin' Alive!""",1.109375,0.045191323330536354,64,58,5,1
"That, plus the loud disco music, makes operating fun again!”",1.109375,0.039322054350368486,64,57,7,0
This adds a whole new meaning to cutting loose on the dance floor.,1.109375,0.050381419694137494,64,59,3,2
Doctor! Seventies retro this week?,1.109375,0.039322054350368486,64,57,7,0
It was his final request if he doesn't make it. Either a mirror ball or Donna Summers playing background music.,1.109375,0.050381419694137494,64,59,3,2
And this is how we treat Night Fever.,1.109375,0.045191323330536354,64,58,5,1
"He said he wants to disco through the entire operation, it makes him feel young.",1.109375,0.039322054350368486,64,57,7,0
"Shall we dance? ..,
Shall we then say goodnight but mean goodbye?",1.109375,0.045191323330536354,64,58,5,1
I think “Stayin’ Alive” really sets the mood!,1.109375,0.050381419694137494,64,59,3,2
"Does it really have healing powers?  Or should we, uh ... pray?",1.109375,0.045191323330536354,64,58,5,1
"We’ll keep you “stayin’ alive, stayin’ alive, ab ha ha ha stayin’ alive ….”",1.109375,0.045191323330536354,64,58,5,1
"You are right doc, this AKG beat DOES sound better on molly.",1.109375,0.039322054350368486,64,57,7,0
"Now when we tell the family, ""We did all we could,"" we'll really mean it.",1.109375,0.050381419694137494,64,59,3,2
The patient also insisted we only play “I Will Survive” and “Staying Alive.”,1.109375,0.045191323330536354,64,58,5,1
Alexa — turn OFF the covid — & remind someone to feed my kids.,1.109375,0.045191323330536354,64,58,5,1
Doin the ER rock !,1.109375,0.039322054350368486,64,57,7,0
"Ok. Crank up Don't Leave Me This Way, and let's get this party going",1.109375,0.045191323330536354,64,58,5,1
He said he felt a tightness in his Gibb,1.109375,0.045191323330536354,64,58,5,1
"..whether you’re a brother or whether you’re a mother , you’re stayin alive, stayin alive",1.109375,0.039322054350368486,64,57,7,0
We installed it for when the heart drops a beat,1.109375,0.045191323330536354,64,58,5,1
„Last night a D.J. Saved His Life“,1.109375,0.039322054350368486,64,57,7,0
"Hey, before we continue with this surgery, will one of You help Me put my glove on? I’m having trouble focusing. I think it might be due to this disco ball....",1.109375,0.039322054350368486,64,57,7,0
We thought we'd add a little drama.,1.1090909090909091,0.04242424242424242,55,49,6,0
Didn’t know a Saturday night fever could lead to this,1.1090909090909091,0.04973144899026735,55,50,4,1
Stayin’ Alive and I Will Survive typically yield the best results.,1.1090909090909091,0.04973144899026735,55,50,4,1
Is “Staying Alive” too on the nose?,1.1090909090909091,0.04242424242424242,55,49,6,0
This helps cure Disco Fever.,1.1090909090909091,0.04242424242424242,55,49,6,0
The discography was a success. We’ll just have to another one next week.,1.1090909090909091,0.04973144899026735,55,50,4,1
This looks like a classic case of night fever.,1.1090909090909091,0.04973144899026735,55,50,4,1
Problems in the supply chain again. But the anesthesiologist did manage to score us some Quaaludes.,1.1090909090909091,0.056094720714807346,55,51,2,2
"I think they heard MOOD lighting, not NEW lighting",1.1090909090909091,0.04242424242424242,55,49,6,0
They wanted to show appreciation to essential workers,1.1090909090909091,0.04242424242424242,55,49,6,0
It's a supply chain compromise.,1.108433734939759,0.03837749683764797,83,75,7,1
"He's Ah, ha, ha, ha Stayin' Alive....",1.1081081081081081,0.045401526605714705,74,68,4,2
"I really wish you'd stop playing ""I Will Survive"" when you administer anesthesia.",1.1081081081081081,0.04112256523107289,74,67,6,1
"The disco ball, and disco music may help the patient,  but it's getting on my nerves.",1.1081081081081081,0.045401526605714705,74,68,4,2
Guess this is how it is when one of The Bee Gees has surgery!,1.1081081081081081,0.03634325417788381,74,66,8,0
David Byrne made another donation.,1.1081081081081081,0.045401526605714705,74,68,4,2
This does not change the prognosis; he will not dance out of here!,1.1081081081081081,0.03634325417788381,74,66,8,0
The fact that it plays 'I Will Survive' is a nice touch.,1.1081081081081081,0.04112256523107289,74,67,6,1
"Ah, Ah, Ah, Ah my patient is “Staying Alive, Staying Alive”.",1.1081081081081081,0.04112256523107289,74,67,6,1
"Patient came in late Saturday with a classic case of Night Fever, doc. The oxygen tube has kept him Stayin’ Alive.",1.1081081081081081,0.04931056545077329,74,69,2,3
"Yeah, the work-life balance is horrendous, but at least we get… well, whatever this is.",1.1081081081081081,0.04112256523107289,74,67,6,1
"Nie to miałem na myśli mówiąc ""izba przyjęć""",1.1081081081081081,0.04112256523107289,74,67,6,1
Welcome to the aaaaaappend-ec-ec-ec-tomyyyyyyyyyyyyyyy,1.1081081081081081,0.03634325417788381,74,66,8,0
We heard it worked for the chickens.,1.1081081081081081,0.04112256523107289,74,67,6,1
"I know I mumble, but you should have inferred I asked for ""this scalpel"" not ""disco ball"" from several available context clues.",1.1076923076923078,0.04452244962611625,65,59,5,1
Turn him over. Apparently it’s a disc issue.,1.1076923076923078,0.04452244962611625,65,59,5,1
"Our new light makes me want to sing, 'You should be dancing, yeah' from Saturday Night Fever.",1.1076923076923078,0.04452244962611625,65,59,5,1
Achievement unlocked,1.1076923076923078,0.038748926306942086,65,58,7,0
"The mysteries of science, eh?",1.1076923076923078,0.038748926306942086,65,58,7,0
"Subconsciously, he'll never miss his prostate now.",1.1076923076923078,0.04452244962611625,65,59,5,1
At this rate we're all gonna catch the fever!,1.1076923076923078,0.038748926306942086,65,58,7,0
The surgery went stellar!,1.1076923076923078,0.04452244962611625,65,59,5,1
This must be a sign from Gloria Gaynor. He will survive.,1.1076923076923078,0.049628799617553614,65,60,3,2
"Is that a piñata or should I say, ""Happy New Year?""",1.1076923076923078,0.04452244962611625,65,59,5,1
Botox parties are so 2019!,1.1076923076923078,0.038748926306942086,65,58,7,0
"At first I was afraid, I was petrified
Kept thinking I could never operate without you by my side…”",1.1076923076923078,0.04452244962611625,65,59,5,1
The Studio 54 themed operating room seems to be a bit much.,1.1076923076923078,0.038748926306942086,65,58,7,0
TGIF.,1.1076923076923078,0.04452244962611625,65,59,5,1
I’m not sure “Stayin’ Alive” is appropriate either.”,1.1076923076923078,0.038748926306942086,65,58,7,0
??SOMEWHERE OVER THE RAINBOW!!!??,1.1076923076923078,0.04452244962611625,65,59,5,1
He'll have free admission at the Angels' Disco.,1.1076923076923078,0.038748926306942086,65,58,7,0
"If he goes out, he goes out with a banger.",1.1076923076923078,0.038748926306942086,65,58,7,0
Isn't it supposed to turn the other way?,1.1076923076923078,0.038748926306942086,65,58,7,0
"Don't look at me! All I know is that it's Saturday night, and this guy's got a fever.",1.1076923076923078,0.038748926306942086,65,58,7,0
I asked for an operating theater.,1.1076923076923078,0.038748926306942086,65,58,7,0
"Turn his anesthetic up and hand me some shades, it looks like it's time for our jitterbug break",1.1076923076923078,0.038748926306942086,65,58,7,0
Why do all the operating rooms have these anyways?,1.1076923076923078,0.04452244962611625,65,59,5,1
way to go paul,1.1076923076923078,0.038748926306942086,65,58,7,0
My diagnosis: severe case of Saturday Night fever,1.1076923076923078,0.04452244962611625,65,59,5,1
I should’ve had my disco nap with a double espresso,1.1076923076923078,0.038748926306942086,65,58,7,0
"Waiting for THE PARTAY PoOper. I mean, fake science is pseudo interesting and super popular! Ivermectin confetti!",1.1076923076923078,0.038748926306942086,65,58,7,0
Thought this would really liven up the place,1.1076923076923078,0.038748926306942086,65,58,7,0
He'll wake up staying alive,1.1076923076923078,0.038748926306942086,65,58,7,0
These tik tok crazes are getting out of hand. Do we really need a fever challenge?,1.1076923076923078,0.038748926306942086,65,58,7,0
he pulled through! I told you Taylor Swift was magic,1.1076923076923078,0.04452244962611625,65,59,5,1
last night the surgery saved my life,1.1076923076923078,0.04452244962611625,65,59,5,1
"Let's get down tonight, give this a spin, and boogie out his appendix.",1.1071428571428572,0.041705300580081546,56,50,6,0
He has a case of the Saturday night fever.”,1.1071428571428572,0.041705300580081546,56,50,6,0
"After I had this installed, patients started stayin' alive, stayin' alive. I'm only joking of course; many still die on this table.",1.1071428571428572,0.048874152123853765,56,51,4,1
"Aren't you carrying this ""Disco Doc"" thing a bit far?",1.1071428571428572,0.041705300580081546,56,50,6,0
Let's make this one a quick step. I have a tee time in 30 minutes.,1.1071428571428572,0.041705300580081546,56,50,6,0
As long as it keeps spinning he’s Stayin’ Alive,1.1071428571428572,0.041705300580081546,56,50,6,0
"Oo Oo Oo stayin' alive, stayin' alive",1.1071428571428572,0.041705300580081546,56,50,6,0
Best believe I’m still bejewelled when I walk in the room I can still make the whole place shimmer,1.1071428571428572,0.041705300580081546,56,50,6,0
"The disco ball is fine, I just can't listen to ""Staying Alive"" for three hours. """,1.1066666666666667,0.03588436550487812,75,67,8,0
Huh huh huh staying alive staying alive huh huh huh,1.1066666666666667,0.03588436550487812,75,67,8,0
Please play Stayin' Alive!,1.1066666666666667,0.03588436550487812,75,67,8,0
Good. The disco ball's working ... Now let's blast 'Stayin' Alive' at 95 decibels before Mr. Jones flatlines,1.1066666666666667,0.04059615804541172,75,68,6,1
Who said disco lasik was dead?,1.1066666666666667,0.03588436550487812,75,67,8,0
Could I have the next lance?,1.1066666666666667,0.03588436550487812,75,67,8,0
"It's to go with the '70s Bee Gees' song he's having played over and over to remind us of our objective.""",1.1066666666666667,0.04059615804541172,75,68,6,1
"Staying alive, staying alive..ah, ah, ah!",1.1066666666666667,0.044815269812960044,75,69,4,2
"Oh right, I’m a Healthcare Hero.",1.1066666666666667,0.03588436550487812,75,67,8,0
They rent this place out to nightclubs when business is slow,1.1066666666666667,0.04059615804541172,75,68,6,1
"Through the mirrors of this ball 🔮, I swear I could have seen his future crystal clear before we started. If only they had fixed the air-conditioning filter!"" - Mirror-mirror on the bal",1.1066666666666667,0.04059615804541172,75,68,6,1
"Dude, that's not the PA, it's the respirator.",1.106060606060606,0.03819217678704997,66,59,7,0
It came with the “Music for Medicine” package.,1.106060606060606,0.043873030826850165,66,60,5,1
"Well, they did say to ensure the patient is Staying Alive.",1.106060606060606,0.043873030826850165,66,60,5,1
"I've found it really helps to liven up these life threatening procedures.  Well, at least for us anyway.""",1.106060606060606,0.043873030826850165,66,60,5,1
Astronomical ! What this new lighting system cost!,1.106060606060606,0.03819217678704997,66,59,7,0
It goes better with my Stayin' Alive music.,1.106060606060606,0.043873030826850165,66,60,5,1
My furst time in this theater. Let's see how disco.,1.106060606060606,0.03819217678704997,66,59,7,0
"It’s our only chance to save him, so everybody now, 1-2-3…
“stayin alive, stayin alive…”",1.106060606060606,0.043873030826850165,66,60,5,1
Choose your partner for the next dance,1.106060606060606,0.03819217678704997,66,59,7,0
I think he has Night Fever,1.106060606060606,0.043873030826850165,66,60,5,1
Last time I ask for more difficult cases.,1.106060606060606,0.04889829547268709,66,61,3,2
"Great job doctors, the patient appears to be staying alive. Staying alive.",1.106060606060606,0.03819217678704997,66,59,7,0
Hornets,1.106060606060606,0.03819217678704997,66,59,7,0
Are we certain he suffers from Boogie Fever??,1.106060606060606,0.03819217678704997,66,59,7,0
"Look,the 21st of September comes but once a year.",1.106060606060606,0.04889829547268709,66,61,3,2
"okay, now cue the playlist “Staying Alive.”",1.106060606060606,0.03819217678704997,66,59,7,0
Part of HRs incentive plan to return to work,1.106060606060606,0.043873030826850165,66,60,5,1
"We know we can replace the arterial valve, but we wanted to see if we could make it <I> sing <I>",1.106060606060606,0.043873030826850165,66,60,5,1
"Well, as long as there’s a rhythm to it….",1.106060606060606,0.043873030826850165,66,60,5,1
