caption,mean,precision,votes,not_funny,somewhat_funny,funny
"It’s a win-win. He was delicious, and now we’ve got a flashlight.",1.6697080291970803,0.0244670266263651,1096,600,258,238
And all that was left was a giant carbon footprint,1.6694829334234538,0.012578092817374775,2959,1343,1251,365
And then he saw something that made his blood run warm.,1.6613055818353832,0.012354330325769373,3171,1486,1273,412
Why not just exhale and save the batteries?,1.6241766757070903,0.013565761784056177,2581,1280,991,310
And then you wake up in a museum naked.,1.6036834924965893,0.020135317286100064,1466,841,365,260
I always get the damn merit badges stuck in my teeth.,1.5905482041587902,0.013610868021155766,2645,1411,906,328
"Suddenly she heard an asteroid snap. She lay there, petrified.",1.5789049919484701,0.01262788652302105,2484,1235,1060,189
Do I have anyone stuck in my teeth?,1.5768361581920904,0.018031591696462908,1770,1042,435,293
"Dad, that joke is 100 million years old!",1.5756906077348067,0.017771704317631434,1810,1064,450,296
Stop already! You’re making me a nervous rex.,1.5717821782178218,0.0274083684048742,808,492,170,146
And his caption was lost forever.,1.5713196033562167,0.014068430893599446,2622,1483,780,359
Is there someone in my teeth?,1.5683743444937475,0.015689533733819278,2479,1522,505,452
"Oooh, your stories make my blood run warm.",1.5636844424856766,0.014051356538914702,2269,1219,821,229
Stop it! It makes you look like a monster!,1.5553977272727273,0.019659613948917732,1408,835,364,209
Then they strung his bones together with wire and hung them from the ceiling!,1.5542740841248304,0.018488347393139797,1474,846,439,189
Is anyone stuck in my teeth?,1.5532150776053215,0.01753316323993184,1804,1083,444,277
Wait: You have thumbs?!,1.553072625698324,0.018546988065896556,1611,967,397,247
I can't tell if I'm still hungry or if he has his phone on vibrate.,1.5447870778267254,0.020614914980189986,1362,845,292,225
"…and there, in the museum lobby, missing 
half his bones, was Uncle Herman!",1.5442546583850931,0.02077546632586003,1288,785,305,198
"It’s a tale as old as, well, us.",1.543647363872083,0.019813125991957916,1157,647,391,119
And then they wired his bones together and put him in a museum.,1.5391246684350133,0.018077858057027787,1508,879,445,184
"Please,not the one about the asteroid.",1.5358581788879935,0.020688644451809516,1241,751,315,175
Legend says that the meteor is still out there...,1.53027950310559,0.019935901790931305,1288,774,345,169
And then they turned Godzilla… INTO A MUSICAL.,1.5257383966244726,0.02138215379936553,1185,735,277,173
"Yeah, yeah...In a certain kind of light you look just like Godzilla.",1.5220397579948142,0.02069252267524401,1157,695,320,142
Don't do that.  It makes you look scary.,1.5215146299483648,0.021298209830291584,1162,717,284,161
The big ones were forcing the little ones to eat vegetables,1.521472392638037,0.022882727757634006,815,462,281,72
Then they hang your bones and use your corpse for fuel,1.5155778894472363,0.019972088111242087,995,555,367,73
You look like Marjorie Taylor Greene,1.5146919431279622,0.023565669287736006,1055,689,189,177
"I dunno, this is what those campers were doing before we ate them",1.5113378684807257,0.02439385191639099,882,552,209,121
"And then, they used our remains to power their cars!",1.5083507306889352,0.023057850934368355,958,595,239,124
And all this time I didn't think our front legs were good for anything!,1.5082474226804123,0.022888971003151126,970,602,243,125
Quoth the Raptor ‘Carnivore.’,1.5077559462254395,0.024954259208423854,967,646,151,170
"You think this is scary, you should have seen the look on the face of the guy I took this from",1.5069817400644467,0.023709173732606947,931,586,218,127
You've got someone in your teeth.,1.506423982869379,0.023358416502015963,934,582,231,121
It'd probably be more chilling if we weren't already cold-blooded.,1.5058324496288442,0.02006730500338009,943,527,355,61
"Then suddenly, they heard a big BANG. The end.”",1.503867403314917,0.0256017508314729,905,604,146,155
So I guess this means you forgot the marshmallows.,1.5038251366120219,0.023471601186367028,915,570,229,116
Is this going to be the asteroid one again?,1.497055359246172,0.023400763371718054,849,518,240,91
Are we dinosaurs or dragons? I’m so high right now.,1.496617050067659,0.027443147182511795,739,485,141,113
...and they'll use our liquified bones to fuel mid-size sedans,1.4963503649635037,0.024812601723439787,822,519,198,105
And in millions of years we’ll just be birds.,1.4945054945054945,0.02313994837529238,819,491,251,77
Something about this sudden cold snap is really bothering me.,1.4937655860349128,0.02162699945319822,802,456,296,50
"I do like your karaoke, Dino. But ""I Will Survive"" just makes me uncomfortable..",1.4937655860349128,0.025030105625137515,802,507,194,101
It's true! Long ago Humans used to roam the Earth!,1.4933862433862435,0.02563079698293436,756,476,187,93
And they’ll use your decayed bones as fuel to travel all around Earth!,1.4918032786885247,0.025116334257310562,793,502,192,99
You have a bit of pterodactyl in your teeth.,1.491025641025641,0.02232853649838853,780,451,275,54
Do I have someone between my teeth?,1.4901960784313726,0.02606839897705856,765,493,169,103
Can't we just have a nice evening by the fire without all the drama?,1.4888010540184453,0.02196833330797663,759,432,283,44
"Then, the Asteroid Deniers got elected.",1.488771466314399,0.02667293537350121,757,496,152,109
I got my braces off!!,1.4873501997336884,0.026233606108886382,751,485,166,100
And their young are born . . . alive!,1.485557083906465,0.026101972573981575,727,463,175,89
"They all have smooth, near hair-less skin, ten toes, and a scream that can turn you into pudding. They call them toddlers.",1.4855172413793103,0.026732159760644632,725,470,158,97
"And then all of Earth became a graveyard where, to this day, they are still digging up our bones…",1.4850136239782017,0.026831406427340828,734,480,152,102
"You always ruin your campfire stories by going too over-the-top.  Extinction, Roy?  I mean, really?",1.4840499306518724,0.02691525423234225,721,470,153,98
You're scaring the coprolite out of me.,1.4840055632823366,0.022680865391716525,719,414,262,43
I found it when digging through the remains of the previous civilization!”,1.4824324324324325,0.02652549137361411,740,483,157,100
"Call me old school,   but breathing fire is a lot scarier!",1.4798270893371759,0.026946458568174948,694,449,157,88
Tell me that one about civilization again.,1.4795321637426901,0.024072240535615696,684,406,228,50
…then Puff heard the eeriest noise coming from the autumn mist…,1.4793510324483776,0.02694327773821952,678,435,161,82
"And then he said 'I just need to find 11,780 votes'...",1.4790419161676647,0.02821522243961956,668,442,132,94
Do Trump again!,1.4764079147640792,0.028410758233576812,657,436,129,92
Any campers stuck in my teeth?,1.4764079147640792,0.02698672651930261,657,419,163,75
And then they put your bones on display for all to see.,1.4760432766615146,0.027729377857808837,647,419,148,80
"At night, they carry these. They are easy to spot. And, they are delicious.",1.4751552795031055,0.027299286031364386,644,412,158,74
Does this face look extinct to you?,1.474497681607419,0.027116493034899544,647,413,161,73
Legend has it the meteor is still out there....,1.4725274725274726,0.0280504558385367,637,416,141,80
No more Marjorie Taylor Greene impressions.  I didn't sleep at all last night.,1.4725085910652922,0.030621133525509502,582,393,103,86
You should have asked the guy how to turn it off before you ate him.,1.4712460063897763,0.027873856800696383,626,405,147,74
I learned the flashlight trick from a cub scout I ate.,1.4706814580031695,0.026972419252445316,631,400,165,66
"Either turn it off, or go floss.",1.4693548387096773,0.02834839707821546,620,406,137,77
It was a dark and stormy triassic period...,1.4692556634304208,0.02719085933232899,618,392,162,64
"Christamighty, stop it, Griff. It makes you look like Trump.",1.4664429530201342,0.03005497843588044,596,404,106,86
"...so George slew him with his lance .  In gratitude, the Catholic Church made him a saint and we've been Protestants ever since.""",1.4648370497427101,0.030663337288910616,583,399,97,87
"This isn't going to be another meteor story, is it?",1.4640151515151516,0.030645094945140356,528,348,115,65
And just like that we were all gone…! Except for Alligators,1.462837837837838,0.027322308285892955,592,375,160,57
Is there something in my teeth?,1.46028880866426,0.029334383370318146,554,362,129,63
Stop it! You look like some kind of monster!,1.4598540145985401,0.029683428495116636,548,360,124,64
So the dinosaurs were wiped out but the dragons survived?,1.458955223880597,0.02594947012445069,536,320,186,30
"Is that a true story, dad?""

""Ha ha! Of course not, son. There's no such thing as asteroids.",1.4575645756457565,0.02969286783619607,542,356,124,62
I'm so glad we saw those hikers.  We got dinner and a show.,1.4567307692307692,0.03328106792797895,416,270,102,44
Does this light make my face look extinct?,1.45489443378119,0.030206119218577698,521,343,119,59
Then the humans burned our gooey remains in their cars.,1.4536679536679538,0.025953366968460668,518,309,183,26
The only scary part of this story is wondering where you got the flashlight.,1.4526112185686655,0.030740208137705217,517,345,110,62
And his bones were displayed in a museum!,1.4524271844660195,0.03020990285634444,515,339,119,57
"And the big, bad space rock came closer... and closer...",1.4518664047151277,0.02917362469602455,509,326,136,47
I bet the 2-leggeds will claim to have discovered this too.,1.450199203187251,0.030907613859806896,502,334,110,58
And they all became... OIL!,1.4497991967871486,0.03096033491490413,498,331,110,57
Is there any Boy Scout stuck in my teeth?,1.448692152917505,0.030740047977622503,497,329,113,55
"...and then the dragon slayer said ""remember me, my name is George Santos.""",1.448207171314741,0.03228546267913,502,346,87,69
Tell the one about the little girl who lives over the bed.,1.4476885644768855,0.029194607534795768,411,248,142,21
"Yeah, yeah, burning ball from the sky blah blah blah - say something scary!",1.447674418604651,0.030151470881050423,516,342,117,57
And all they found were his bones.,1.4472049689440993,0.031253719087170805,483,321,108,54
"So the meteor gets closer, and closer.",1.446985446985447,0.030366362029488538,481,313,121,47
Stupid story--no big rock can kill us all!,1.4451219512195121,0.030553965932128002,492,325,115,52
They say Saint George still walks this forest.,1.4449064449064448,0.03078368439907743,481,317,114,50
So what happened AFTER he announced he was running for president again in 2024?,1.443254817987152,0.03259762454157027,467,318,91,58
"And then the terrified hiker screamed, ""Here, take the damned flashlight!""",1.4430107526881721,0.030653779142008626,465,303,118,44
... and the terrible monsters turned their victims into a gooey brown liquid to fuel their terrible machines.,1.441304347826087,0.031191125644786266,460,303,111,46
But the real killer was diabetes.,1.4407894736842106,0.029650079610116117,456,290,131,35
And they'll dig up your bones and wire them together and put them on display.,1.44,0.03184346768257153,450,299,104,47
"The itch kept getting worse, but his arms still couldn't reach it.",1.4398249452954048,0.030714674567827564,457,298,117,42
Your Great Uncle Puff was last seen touring with The Grateful Dead in the  early 90s.,1.4394618834080717,0.032826373096271316,446,302,92,52
"Yes, I see it  I warned you to eat only Republicans. They have no fiber.",1.4387527839643652,0.03385596320629579,449,312,77,60
Is that hiker still stuck in my teeth?,1.4384787472035794,0.0319930612991146,447,298,102,47
"And eventually, there were humans swarming everywhere",1.437923250564334,0.03188308492300948,443,294,104,45
"You know what’s scary?
That you can work a flashlight.",1.4377880184331797,0.03269000352533727,434,291,96,47
It was a dark and scary night in a land called Honalee…,1.4373626373626374,0.03203304944566889,455,306,99,50
You didn’t have to eat them. They would have let you play with the flashlight if you just asked.,1.4373576309794989,0.03257428283231084,439,295,96,48
He was Purple. And his name was Barney.,1.435483870967742,0.03348395932880516,434,297,85,52
Just turn it off your gonna attract Monthras,1.4351851851851851,0.03246030497909855,432,289,98,45
And in millions of years you are turned into...OIL,1.4351851851851851,0.03179158692266092,432,285,106,41
Do any of these stories end with us winning?,1.4345794392523366,0.03217275646758247,428,284,102,42
"Tell me, do I look like I'm extinct!?",1.4333333333333333,0.03329922109516331,420,284,90,46
"And then we all became extinct, without getting credit for discovering fire or inventing the flashlight.",1.4323040380047507,0.033065374596244895,421,284,92,45
"Where did you find batteries?""",1.4312796208530805,0.03248714864462224,422,282,98,42
The scary part is when the little monkeys lose their hair and take over the world.,1.4312354312354312,0.034077279061025076,429,298,77,54
Then the evil knight in shining armor slayed the poor dragon and escaped with the  wicked princess.,1.429951690821256,0.03275711730626741,414,277,96,41
"Forget it, Eddie, you'll never look like Godzilla.",1.429951690821256,0.03516800622955751,414,291,68,55
Do I have any Boy Scout in my teeth?,1.428921568627451,0.03291812074125048,408,273,95,40
Good try Dave but Tucker Carlson is still scarier.,1.4282238442822384,0.03433305332861302,411,284,78,49
The phonecall is coming from inside your stomach!,1.427860696517413,0.034005331602282675,402,274,84,44
"… and then the last human looked at me and said: I thought you didn’t exist! And I said: welcome to extinction, pal!",1.427860696517413,0.036128162213233006,402,286,60,56
…and then they forgot to cancel the free trial.,1.4275362318840579,0.03309969060188648,414,280,91,43
"... Then they took this old stuff out of the ground and burned it, and the planet got hot, and the water rose, and they became extinct.
The end",1.4275184275184276,0.03458168962375312,407,282,76,49
It’s not scary and you’re wasting batteries.,1.4267015706806283,0.03432192132286872,382,258,85,39
"I call it ""fire to go.""",1.4260651629072683,0.034184138461973886,399,273,82,44
You've still got camper stuck between your teeth.,1.4253164556962026,0.03424841643667944,395,270,82,43
"And then someone yelled,
“IT’S AN ASTEROID!”",1.424936386768448,0.033803445775011536,393,266,87,40
"Yes, I see it now--I'll get the tweezers",1.4246913580246914,0.033438876402734165,405,275,88,42
"And then the humans searched for the dead dinosaurs’ bones, put them together like a puzzle, and displayed them for other humans’ ENJOYMENT!",1.424164524421594,0.03346333364656606,389,261,91,37
Quit trying to scare me with extinction stories!,1.4235588972431077,0.03342500835110912,399,270,89,40
...And the birds were US the whole time!,1.4230769230769231,0.03319716843207621,390,261,93,36
Long ago humans roamed the land.,1.422279792746114,0.03443023446872703,386,264,81,41
Do that one where Kari Lake hears she lost.,1.421994884910486,0.03633938833098661,391,279,59,53
You said to pack light.”,1.421875,0.03533766562671012,384,267,72,45
You still have a piece of camper stuck between your teeth.,1.4206349206349207,0.03455094230449962,378,258,81,39
So … do I look extinct now?,1.4202127659574468,0.03385475683168896,376,253,88,35
Chicken... they tasted like chicken.,1.4199475065616798,0.035143067859941444,381,264,74,43
"Got it on Amazon, free delivery, and the
delivery person was delicious",1.4197860962566844,0.03662176141561122,374,265,61,48
"And an asteroid hit the earth and turned us all into petro-chemicals. The end. Hahahah, I got you!",1.4197860962566844,0.03522494038394801,374,258,75,41
Stop it!  It makes you look like Ted Cruz.,1.4191176470588236,0.03429716081363812,408,285,75,48
Here's a trick to scare off predators at night.,1.418230563002681,0.032742467644237286,373,246,98,29
"Then he said, ""I'm a paleontologist.""",1.4180790960451977,0.03489074990694415,354,239,82,33
Then I told them I was going to run for a third time in 2024.,1.417989417989418,0.03612355430149102,378,267,64,47
"See, from below, it makes even a face like mine look scary.",1.417789757412399,0.035009036038774796,371,255,77,39
And then we return as gas!,1.4173441734417345,0.03408149827804056,369,249,86,34
Noah’s yacht party was today?!,1.4168937329700273,0.034858348239404785,367,251,79,37
And then the foolish human walked right up to me and said 'nice Halloween costume!',1.415977961432507,0.03491455254198633,363,248,79,36
"Oooh, you scared me!  I can't wait to get home under Billy's bed!",1.415977961432507,0.03598785913445162,363,253,69,41
And no one - I mean no one- had a plan to knock it off course!,1.4134078212290502,0.035692128037351924,358,248,72,38
"Don't know what's scarier, the flashlight trick or you starting this campfire with your breath.",1.4129213483146068,0.0358361079410245,356,247,71,38
And when you do this they run away screaming!,1.411764705882353,0.03371671587601941,374,254,86,34
"Any idea how they got the fire
inside this thing?""",1.4114285714285715,0.03394564600414083,350,234,88,28
"And after they turned him purple, they named him Barney!",1.4103260869565217,0.03366251939446779,368,249,87,32
"And then a giant ball of fire fell from the sky and BOO, everyone died.",1.4098837209302326,0.03459400963535945,344,232,83,29
"Relax, it's just a scary story! Like extinction could ever really happen!",1.4094955489614243,0.035098321476112526,337,228,80,29
Do you see this face?  It's not a happy one.  You were supposed to bring the marshmallows.,1.409356725146199,0.036420085356035525,342,238,68,36
Does this make me look scary?,1.4092219020172911,0.03509678514304495,347,237,78,32
"When Fred didn't laugh at his jokes, Bob realized just how cold blooded his friend really was.",1.4092140921409213,0.03445538506823444,369,254,79,36
Do I have anyone in my teeth?,1.4092140921409213,0.035920362154018434,369,261,65,43
"You know you can beathe fire, right?",1.4082840236686391,0.03696670612598197,338,237,64,37
"'""We might be scary and ugly now but in a million years, kids will love us.""",1.4078212290502794,0.03652020451859563,358,254,62,42
I camp out here to recharge my batteries.”,1.407514450867052,0.03834785019232943,346,251,49,46
"But its just a theory though, right?",1.4074074074074074,0.03192679602030789,378,251,100,27
Turn that off! We're gonna need those batteries when we reach Tokyo tomorrow night.,1.4064327485380117,0.03616204698724572,342,238,69,35
"So, my Mom the astronomer says we're in for a big surprise.",1.4064327485380117,0.0363983937177135,342,239,67,36
Matt Gratz?   Lauren Boebert?   No - wait - I got it!  Marjorie Taylor Greene!!!,1.4054054054054055,0.03759646592040205,333,236,59,38
Not the one about the meteor again.,1.405099150141643,0.03555404953768389,353,246,71,36
Is there anyone in my teeth?,1.404833836858006,0.03473026360299354,331,223,82,26
"The great fireball struck, then there was darkness… just kidding!",1.404191616766467,0.03628488976956669,334,232,69,33
And then they crawl up your leg and suck your blood.   They’re called ‘ticks’.,1.404191616766467,0.03845037985223792,334,241,51,42
Look! I’m a lounge lizard!,1.4036144578313252,0.03516832746900061,332,226,78,28
"Oh no, not that meteorite story again.",1.403361344537815,0.03547209234727516,357,250,70,37
"Finally, illumination without incineration.",1.403076923076923,0.0367477636038618,325,226,67,32
"No, honestly, you're scarier in daylight.",1.4029411764705881,0.034576471066465296,340,231,81,28
Enough with the giant stone that will fall from the sky and wipe us all out. Tell me something scary!,1.401840490797546,0.03398343650420612,326,217,87,22
Nope.  You're still not scary.,1.4012345679012346,0.03576171983501135,324,222,74,28
And then....BOO!  Extinction!,1.4011461318051577,0.03344342655774933,349,235,88,26
And to this day humans are credited with inventing fire.,1.4006309148264984,0.03631707832774732,317,218,71,28
Nope still there. Let me get you some Dino-Floss.,1.4006211180124224,0.037236834923531845,322,226,63,33
I did the monster mash. It was a campground smash.,1.4005847953216375,0.03416414379397727,342,232,83,27
"The child said ""Mommy there is a monster in the closet""  and the Mom said ""No there isn't let me show you""  She opens the door.  Oh the look on her face was priceless. Thats why I do this work.",1.4,0.03792212776591883,320,227,58,35
And then the little boy crept up very quietly and pushed him into the tar pit...,1.4,0.035521197697901706,320,218,76,26
"Cool it, Bill. Those batteries have to last for at least 66 million years.",1.4,0.04383374704394623,230,161,46,23
Using a flashlight instead of your phone?  That’s prehistoric.,1.398753894080997,0.037044153261544546,321,225,64,32
Do I have any princess in my teeth?,1.3987341772151898,0.038266576259951605,316,225,56,35
Calm down. We can just lay back and watch meteors.,1.3968253968253967,0.03264327051423909,315,205,95,15
Scaredy cat! There's no such thing as meteors!,1.3968253968253967,0.03616943375970767,315,217,71,27
"Yes, you mentioned that you got your teeth whitened.",1.3968253968253967,0.037270759960616726,315,221,63,31
"You need a cell phone for a selfie, you idiot!",1.396774193548387,0.03852873813285778,310,221,55,34
"And it all happened 25 million years ago, on a night…just…like…tonight…",1.396103896103896,0.03731707994635694,308,215,64,29
"To be honest, under-lighting is really not flattering to your facial structure.",1.396103896103896,0.03645696085625073,308,212,70,26
"If I let you use the flashlight, can we go hide under the bed before it's Timmy's bedtime?",1.3941368078175895,0.037951955435214305,307,217,59,31
How about we reduce our carbon footprint and just go bump in the night.,1.3940397350993377,0.03285249109392333,302,196,93,13
And then he digs your bones from the ground and puts you back together for everyone to see!,1.3929618768328447,0.035161853578551755,341,238,72,31
Read my lips. There's no way we'll ever go extinct.,1.3926174496644295,0.03759061068985233,298,208,63,27
Do I still have Boy Scout in my teeth?,1.391304347826087,0.03778587788372089,299,210,61,28
"Come on, man, this story  about climate change is a hoax.
Tell us the one about the asteroid!",1.3911564625850341,0.03855017544780739,294,208,57,29
You do realize that you're speaking into a flashlight.,1.3902439024390243,0.03828209006457658,287,201,60,26
Do I have any s’more stuck in my teeth?,1.3901639344262295,0.03837882949660858,305,218,55,32
…and their entire economy will be fueled by our decomposing bones,1.3901639344262295,0.0372377936586857,305,214,63,28
"Please, no more people stories!",1.389655172413793,0.038614744629105684,290,205,57,28
It's just not scary since you had botox.,1.389261744966443,0.039033014582765646,298,214,52,32
"I hate online dating and no, you still don't look like your picture!",1.3890784982935154,0.03770700051231148,293,205,62,26
Don’t try to make a joke out of this.  YOU forgot the marshmallows.,1.388704318936877,0.035767428076862104,301,206,73,22
And then there was ice everywhere! For ages!,1.3875432525951557,0.03774751006256538,289,202,62,25
You really need to floss more often.,1.386759581881533,0.038246590263210326,287,202,59,26
And then they glued his skeleton back together and charged humans money to see him,1.3864406779661016,0.03718842469509141,295,206,64,25
Any of that tent still stuck in my teeth?,1.3859060402684564,0.036609523602074055,298,207,67,24
Have you ever heard the story of the hairless biped?,1.3843416370106763,0.03713341464241031,281,194,66,21
"Then the asteroid hit, and wiped out all the humans.",1.3835125448028673,0.04029943839079538,279,202,47,30
"Ummm…I don’t know. Are you “Barney”? Dammit Carl, I give up.",1.3825503355704698,0.03896690631634888,298,216,50,32
"Geez, do you have to tell the one about the asteroid again?",1.382198952879581,0.047852613242092515,191,137,35,19
Stop it! There is no such thing as monsters!,1.3818181818181818,0.03905130630774026,275,195,55,25
But the asteroid was coming much closer to Earth than astronomers had projected!,1.3818181818181818,0.03836559557481283,275,193,59,23
Do I look extinct to you?,1.380952380952381,0.03820416446210096,273,191,60,22
And they loved fossil fuels.,1.380952380952381,0.03820416446210096,273,191,60,22
These campfire stories would be scarier if we weren't at the top of the food chain,1.38013698630137,0.03739203172642906,292,206,61,25
"My name is Larry, and my pronoun is 'it'.",1.3800738007380073,0.04080848890229576,271,197,45,29
And the giant rock in the sky just kept getting bigger and bigger...,1.38,0.03874853900939132,300,218,50,32
And then they put your bones back together piece by piece to display for their little ones.,1.3797909407665505,0.03911791276825897,287,207,51,29
"...and when he turned around, he saw the meteor was right behind him!",1.3787375415282392,0.035968473993724256,301,210,68,23
This is my 'come hither' look.,1.3786764705882353,0.03756123780918629,272,189,63,20
It's a souvenir from the guy I had for lunch.,1.3782771535580525,0.03877724878199073,267,188,57,22
"Dad, what's an asteroid?",1.3781818181818182,0.038668806395383795,275,195,56,24
"But we're rechargeable, right?”",1.3772893772893773,0.042184222733630115,273,204,35,34
And then they'll display our bones in museums!,1.3771626297577855,0.03600343757556773,289,200,69,20
Now do a bunny.,1.376865671641791,0.038294852290463165,268,188,59,21
I'm not sure. It's either spinach or someone green that you ate.,1.376865671641791,0.039727776929637984,268,192,51,25
That's nothing. I saw a mammal yesterday!,1.3767605633802817,0.036433642264213896,284,197,67,20
"And then, they used us for fuel",1.3763837638376384,0.03762980015752937,271,189,62,20
