caption,mean,precision,votes,not_funny,somewhat_funny,funny
"…and you, and I, and everyone you’ve ever known, will be extinct!",1.1481481481481481,0.046848557928420444,81,71,8,2
And that's how s'mores were invented.,1.1481481481481481,0.0500342818003937,81,72,6,3
Battery power! It will never work.,1.1481481481481481,0.043429775553920656,81,70,10,1
And then the apes began to walk upright...,1.1481481481481481,0.046848557928420444,81,71,8,2
I might have misunderstood what kinda knight this would be.,1.1481481481481481,0.046848557928420444,81,71,8,2
Smokey the Bear! Am I right?,1.1481481481481481,0.046848557928420444,81,71,8,2
"Once, there was a sword.",1.1481481481481481,0.043429775553920656,81,70,10,1
And they all looked up to see the meteor hurtling towards us...,1.1477272727272727,0.04438059934877056,88,77,9,2
So you're telling me you used to be George Santos?,1.1477272727272727,0.041332851083640286,88,76,11,1
...and then Sir Lancelot jumped out and slayed the poor dragon.,1.1477272727272727,0.04438059934877056,88,77,9,2
And then this giant asteroid…,1.1477272727272727,0.03804170814840831,88,75,13,0
...and then they evolve and invent artificial intelligence.,1.1477272727272727,0.04723209309791176,88,78,7,3
And suddenly little Rex was surrounded by humans!,1.1477272727272727,0.04438059934877056,88,77,9,2
And on the hilt of Excalibur clung a bloody hook...,1.1477272727272727,0.041332851083640286,88,76,11,1
Eating it would be more scary,1.1477272727272727,0.04723209309791176,88,78,7,3
"I know what you're thinking. 'Are there batteries?' Well to tell you the truth I kinda lost track myself. If I drop it in the fire, it would blow your head clean off. So, you've gotta ask yourself one question: 'Do I feel lucky?' Well, do ya, punk?",1.1477272727272727,0.04438059934877056,88,77,9,2
Hollywood ?.... I want to go to Hollywood. ?,1.1477272727272727,0.04723209309791176,88,78,7,3
"Ah saw a balloon. Ah was scared. Ah Cwied.""",1.1477272727272727,0.04723209309791176,88,78,7,3
Freakin Family Fun!,1.1477272727272727,0.04438059934877056,88,77,9,2
Did you see that big shooting star?,1.1473684210526316,0.03656107823627177,95,81,14,0
"And then he said ""monsters aren't real!""",1.1473684210526316,0.03950539972626867,95,82,12,1
'I stick my head in the tent; turn this baby on and the rest is gravy.',1.1473684210526316,0.0472500698912998,95,85,6,4
This is about the two dragons on lovers lane and the Cropsey Maniac.,1.1473684210526316,0.04224500885626314,95,83,10,2
"Kind of scary, I guess.",1.1473684210526316,0.03950539972626867,95,82,12,1
It is believed that unsuccessful courtship vocalizations by the males of the rare Karaokasaurus contributed to its extinction.,1.1473684210526316,0.04224500885626314,95,83,10,2
And then an asteroid hurtled toward Earth!',1.1473684210526316,0.03950539972626867,95,82,12,1
"We are a perfect match, your yin and my yang!",1.1473684210526316,0.0472500698912998,95,85,6,4
These fireballs from heaven are an absolute godsend!,1.1473684210526316,0.04481746243373484,95,84,8,3
I thought we were just going to eat marshmallows.,1.1473684210526316,0.04481746243373484,95,84,8,3
And one day our deafening roars will be gone and replaced by cute little chirps.,1.1473684210526316,0.04481746243373484,95,84,8,3
And then they made a fifth sequel,1.1466666666666667,0.0452951614596046,75,65,9,1
I see you didn't floss after the smores.,1.1466666666666667,0.04911223892281852,75,66,7,2
"And then, she lets her long hair down from the tower and you can just tell  she hasn't conditioned. The split ends are three inches long!",1.1466666666666667,0.0452951614596046,75,65,9,1
"Dude, what was in those marshmallows?!",1.1466666666666667,0.04911223892281852,75,66,7,2
"And then, out of the darkness, came a cry “meow”.",1.1466666666666667,0.05265332251978379,75,67,5,3
Hell. I was impressed with the fire.,1.1466666666666667,0.05265332251978379,75,67,5,3
"…and the old recluse opened his mouth, and instead of breathing fire on the hideous campers, he exhaled only smoke, and they rolled over laughing at him. So he had to eat them RAW!",1.1466666666666667,0.0452951614596046,75,65,9,1
Then a gigantic meteor appeared in the sky.,1.146341463414634,0.049453353904863606,82,73,6,3
And then the meteor headed o earth.,1.146341463414634,0.03927202370241044,82,70,12,0
And a human said WOOO,1.146341463414634,0.04293490384215413,82,71,10,1
"You’re already ghoulish, you need more incisor blood staining.",1.146341463414634,0.04630896338925494,82,72,8,2
Not a theme park!,1.146341463414634,0.04293490384215413,82,71,10,1
Heeeere’s Johnny!,1.146341463414634,0.03927202370241044,82,70,12,0
"Then the asteroid said, ""You scaly monsters are doomed. You'll all be dead within the next 33,000 years!""",1.146341463414634,0.049453353904863606,82,73,6,3
Where is the matchbox?,1.146341463414634,0.03927202370241044,82,70,12,0
…And this is how I look up-lit. Still wanna smash?,1.146341463414634,0.04293490384215413,82,71,10,1
"Oh, that's a flashlight?",1.146341463414634,0.04293490384215413,82,71,10,1
I was calling from inside the house.,1.146341463414634,0.04293490384215413,82,71,10,1
Fear forces us to improvise and light up our next experiences,1.146341463414634,0.04293490384215413,82,71,10,1
And then Homo sapiens took over the world.,1.146341463414634,0.049453353904863606,82,73,6,3
Does this lighting make me look ferocious?,1.146341463414634,0.049453353904863606,82,73,6,3
And for my next trick....,1.146341463414634,0.04293490384215413,82,71,10,1
"It was the Dawn of Man, when suddenly...",1.146341463414634,0.05240942982605346,82,74,4,4
"An alien gave this to me. Pretty cool, huh?",1.146341463414634,0.04630896338925494,82,72,8,2
Chinese spy balloons crash yet?,1.146067415730337,0.04672786983857571,89,79,7,3
"And this is my, “ I’m gonna eat you” disguise.",1.146067415730337,0.040899493760002945,89,77,11,1
"No, little Bobosaurus, the asteroid isn't under your bed. Not yet anyway.",1.146067415730337,0.040899493760002945,89,77,11,1
And then the little blond-haired girl stroked the kitten's head and went to sleep.,1.146067415730337,0.04672786983857571,89,79,7,3
"They say this is supposed to be scary, but I don’t get it.",1.146067415730337,0.04391049082779304,89,78,9,2
"And just before George R.R. Martin could finish his manuscript, HBO pitched ANOTHER series!",1.146067415730337,0.04391049082779304,89,78,9,2
Then the broker said basic index funds were outpacing his treasure hoard by 20 percent!,1.146067415730337,0.040899493760002945,89,77,11,1
And then all of us disappear—forever!,1.146067415730337,0.04391049082779304,89,78,9,2
Stop it! You look like a  B monster!!!,1.146067415730337,0.03764845249025972,89,76,13,0
"Really, Carl?  An asteroid?  Get real.",1.146067415730337,0.04391049082779304,89,78,9,2
"Make that your last selfie,the batteries will soon run out.",1.146067415730337,0.04672786983857571,89,79,7,3
Clever girl.,1.146067415730337,0.040899493760002945,89,77,11,1
"Ok, you got implants",1.146067415730337,0.040899493760002945,89,77,11,1
"He wasn't a dinosaur at all, but a bird!",1.146067415730337,0.04672786983857571,89,79,7,3
Now this is real progress.  Let’s transcend to the future!,1.146067415730337,0.040899493760002945,89,77,11,1
And then a giant meteor lands and kills us all!,1.146067415730337,0.049384779381546805,89,80,5,4
"Goodness, Herman.  You are scaring the monster out of me.",1.146067415730337,0.04391049082779304,89,78,9,2
It avoids dragon fire breath and is still scary,1.146067415730337,0.04391049082779304,89,78,9,2
Are there any humans in my teeth?,1.146067415730337,0.040899493760002945,89,77,11,1
"and then, the boy's daddy looked under the bed ...",1.1458333333333333,0.04437471686755899,96,85,8,3
And they say he still roams the forst late at night seeking unwary little dragons to slay!,1.1458333333333333,0.04183081700686695,96,84,10,2
"Someday they will dig up your bones, put them on display and charge admission",1.1458333333333333,0.03912184819059491,96,83,12,1
"...and when the procedure was complete, I looked twenty years younger!",1.1458333333333333,0.04183081700686695,96,84,10,2
"If this burns out again, we’re extinct. You know that, right?",1.1458333333333333,0.04183081700686695,96,84,10,2
"No, it doesn't put you in a better light, dear.",1.145631067961165,0.0375525952386118,103,89,13,1
Their vegan diets had made them all flavourless.,1.145631067961165,0.0375525952386118,103,89,13,1
After the asteroid hit we became oil and bones!,1.145631067961165,0.0423194072188415,103,91,9,3
It’s giving camp,1.145631067961165,0.0423194072188415,103,91,9,3
Anything caught in my teeth?,1.144927536231884,0.05171962876419153,69,61,6,2
And the call was coming from INSIDE THE LAIR.,1.144736842105263,0.04850012612904946,76,67,7,2
The meteor is coming from inside the house!,1.144736842105263,0.04850012612904946,76,67,7,2
And what kind of cookies would they sell—-Girl Scout cookies!”,1.144736842105263,0.04473684210526319,76,66,9,1
Really! It doesn't burn!,1.144736842105263,0.04473684210526319,76,66,9,1
"…and then, man began emitting carbon dioxide!",1.144736842105263,0.04473684210526319,76,66,9,1
And then the knight is shining armor says let's make a deal,1.144736842105263,0.05199172460609632,76,68,5,3
We came here to discuss our part in reducing global warming and now you’re just making light of the situation,1.144736842105263,0.04850012612904946,76,67,7,2
I found this in the pile of rubble the humans left behind,1.144736842105263,0.04850012612904946,76,67,7,2
This will ward off raptors for as long as the batteries last.,1.144736842105263,0.04473684210526319,76,66,9,1
"Then, something even worst than the meteorite came by,…capitalism they call it",1.144736842105263,0.04473684210526319,76,66,9,1
Even scarier was the Chinese spy balloon high overhead.,1.144578313253012,0.048885703084378854,83,74,6,3
"Now you say, ""Yes, and..."" to keep the story going.",1.144578313253012,0.04245109239481769,83,72,10,1
"Scary, Huh!?",1.144578313253012,0.048885703084378854,83,74,6,3
RedBull gives you wings.,1.144578313253012,0.04245109239481769,83,72,10,1
Let's be Lounge Lizards,1.144578313253012,0.04578158588104717,83,73,8,2
And then a gigantic asteroid hit us and killed our entire species!,1.144578313253012,0.03883602561080367,83,71,12,0
And then the landlord raised his monthly rent by 1200 dollars,1.144578313253012,0.048885703084378854,83,74,6,3
Bright enough for a selfie?,1.144578313253012,0.04578158588104717,83,73,8,2
"Stop, you are scaring me. You almost look human!",1.144578313253012,0.03883602561080367,83,71,12,0
"Then the police called back to say, ""Run outside!  The meteor's phone call is coming from your upstairs bedroom.""",1.144578313253012,0.04245109239481769,83,72,10,1
THE KID RAN OFF TO TELL HIS DIRECTOR HE FOUND ONE WITH THE RIGHT SMILE AND TEETH.,1.144578313253012,0.04578158588104717,83,73,8,2
Is there anything between my teeth?,1.144578313253012,0.04245109239481769,83,72,10,1
Don't!  You  really scare me when you do that.,1.144578313253012,0.04245109239481769,83,72,10,1
"No, you're not any scarier!",1.144578313253012,0.04578158588104717,83,73,8,2
I have traveled to te future and got this. It does not burn.,1.144578313253012,0.048885703084378854,83,74,6,3
"And the Triceratops was just trying to take an innocent poop, when round the corner came Jeff Goldblum, with his mocking eyes",1.144578313253012,0.04245109239481769,83,72,10,1
"Their bodies were turned into fuel for the human's cars , and their bones turned to stone...displayed for the human's children to see.",1.1444444444444444,0.040475053925719685,90,78,11,1
"And just as I was leaving the meeting, my boss turned to me and said 'I'm promoting you to middle management!'",1.1444444444444444,0.040475053925719685,90,78,11,1
"I don't know Steve, maybe we should just go back to scaring tourists at the Loch.",1.1444444444444444,0.040475053925719685,90,78,11,1
Many years ago the two-legged monster named Galahad planned to  come after our family.,1.1444444444444444,0.037263146675402876,90,77,13,0
You'd look scarier without all those gold crowns.,1.1444444444444444,0.04345017698959632,90,79,9,2
2 creatures having a campfire and telling storys about other monsters trying to catch them chad is scaring kyle about the story,1.1444444444444444,0.04345017698959632,90,79,9,2
This reminds me of that scene from blazing saddles,1.1444444444444444,0.040475053925719685,90,78,11,1
You wanna hear the asteroid story again?,1.1444444444444444,0.04345017698959632,90,79,9,2
It was a bright and clear morning...,1.1444444444444444,0.037263146675402876,90,77,13,0
Our species will be replaced by humans. Now that's scary!,1.1444444444444444,0.040475053925719685,90,78,11,1
"This is a tale of creatures that lived long ago, humans...",1.1444444444444444,0.04345017698959632,90,79,9,2
"And then, the human child threw a giant tantrum and charged!""",1.1444444444444444,0.04345017698959632,90,79,9,2
"I tell you, it works every time.",1.1444444444444444,0.04623424889153682,90,80,7,3
And then she showed up to the State of the Union address in WHITE FUR,1.1444444444444444,0.04623424889153682,90,80,7,3
There's no one left,1.1443298969072164,0.043940590558571906,97,86,8,3
Is this the story you always tell where they all end up dead?,1.1443298969072164,0.04632010504023565,97,87,6,4
…and then they put 6 loaded plastic bags  in their SUV!,1.1442307692307692,0.03964524640016984,104,91,11,2
"Oh no,NO! Not a meteorite?!!",1.1442307692307692,0.041933901076769475,104,92,9,3
‘And then I saw the light.’,1.1442307692307692,0.041933901076769475,104,92,9,3
'...and then this fiery ball comes plummeting down from the sky...',1.1441441441441442,0.042151100700086125,111,99,8,4
"Yes, yes I know who your mimicking for Pete's sake; it's Puff the magic dragon and you're frolicking by the fire with the flashlight, right?",1.1428571428571428,0.04197797807648538,84,73,10,1
And all that remained was a deep dark crater!,1.1428571428571428,0.04197797807648538,84,73,10,1
What's really scary is me finding out you forgot the smores.,1.1428571428571428,0.04013939192492975,77,66,11,0
"Last night I scared that mean old man, and he threw our family off his boat.",1.1428571428571428,0.05121265313693953,84,76,4,4
"And the big bad comet came closer.
Closer.
Closer...!",1.1428571428571428,0.04790300390810151,77,68,7,2
"And because he wouldn't go to sleep, the dinosaur's son ended up in a museum!",1.1428571428571428,0.045266017894605576,84,74,8,2
"They had HAIR and BREASTS‽
How scary!",1.1428571428571428,0.04013939192492975,77,66,11,0
My agent suggests I get veneers.,1.1428571428571428,0.045266017894605576,84,74,8,2
"Stop ,you’re scaring me!",1.1428571428571428,0.04005926187397017,91,79,11,1
"Kiss me, I am Irish.",1.1428571428571428,0.04575090108716776,91,81,7,3
Then he threw it at me. Can you believe it?”,1.1428571428571428,0.04790300390810151,77,68,7,2
Do I scare you ?,1.1428571428571428,0.045266017894605576,84,74,8,2
"One day in the future your bones will be displayed in a museum for everybody to see.""",1.1428571428571428,0.04013939192492975,77,66,11,0
You know I hate your making that seductive Ernest Borgnine face.,1.1428571428571428,0.04005926187397017,91,79,11,1
And they say Saint George still walks these woods....,1.1428571428571428,0.048330881521855336,84,75,6,3
"No, I don’t know the lyrics to Ring of Fire, we just invented fire five minutes ago.",1.1428571428571428,0.04790300390810151,77,68,7,2
"Now if you could breathe fire, you might have something.",1.1428571428571428,0.050808911016555915,91,83,3,5
"Augh, stop it! It makes you look like a scary monster.",1.1428571428571428,0.04197797807648538,84,73,10,1
You got the look of 'The Abominable Mammal!',1.1428571428571428,0.045266017894605576,84,74,8,2
"Her final attempt was incorrect and just like that, she was locked out of her phone for 90 DAYS!",1.1428571428571428,0.04790300390810151,77,68,7,2
"Soon after the ice,humans arrived and.....",1.1428571428571428,0.04005926187397017,91,79,11,1
And then a giant meteor came.,1.1428571428571428,0.04005926187397017,91,79,11,1
Then a giant rock started falling from the sky....,1.1428571428571428,0.045266017894605576,84,74,8,2
Then they invested it all into WeWork.,1.1428571428571428,0.04102618049244218,98,86,10,2
"Why do birds, gradually appear…",1.1428571428571428,0.04678356086900139,70,61,8,1
It would be scary if you weren't smiling,1.1428571428571428,0.0483460980275353,91,82,5,4
"Pretty scary, huh?",1.1428571428571428,0.04299935704272291,91,80,9,2
Whoa! That’s way scarier than that lame-o meteor story,1.1428571428571428,0.03837647782266681,98,85,12,1
I found my flashlight!,1.1428571428571428,0.04013939192492975,77,66,11,0
...and this is how dinosaurs go extinct.,1.1428571428571428,0.04419201606355329,77,67,9,1
Imagine I'm Tucker Carlson.,1.1428571428571428,0.04678356086900139,70,61,8,1
This is only our first date.,1.1428571428571428,0.03837647782266681,98,85,12,1
"Ok , Jed, I’m scared already.  But you’re way scarier to the bipeds without the schtick.",1.1428571428571428,0.045266017894605576,84,74,8,2
You look like Jack Nickleson.,1.1428571428571428,0.04790300390810151,77,68,7,2
"And then, POOF, we’re extinct!",1.1428571428571428,0.04419201606355329,77,67,9,1
And on his car door... was St George's gauntlet!,1.1428571428571428,0.04197797807648538,84,73,10,1
And then I ate the guy who left his hook in the door.,1.1428571428571428,0.04586866421913825,98,88,6,4
You looked better without it.,1.1428571428571428,0.04790300390810151,77,68,7,2
"Oh, hon, the story is scary enough without that.",1.1428571428571428,0.05134648267484176,77,69,5,3
"Listen Harold, you’ve got to stop eating the ones around the dispensaries.",1.1428571428571428,0.04419201606355329,77,67,9,1
The rest was fully biodegradable- uh. digestible!,1.1428571428571428,0.04013939192492975,77,66,11,0
"You know, you really don’t have to show me how bright you are.",1.1428571428571428,0.04005926187397017,91,79,11,1
"It was a bright, calm day",1.1428571428571428,0.04197797807648538,84,73,10,1
"This is my audition for Jurassic Park, XX.",1.1428571428571428,0.045266017894605576,84,74,8,2
"Go ahead, just wing it.",1.1428571428571428,0.04419201606355329,77,67,9,1
"Fire breathing is so pre pandemic, I’m all about flash lighting.",1.1428571428571428,0.04197797807648538,84,73,10,1
The Boy Scouts thought it was scary before I ate them.,1.1428571428571428,0.04299935704272291,91,80,9,2
And then there was a blinding flash...,1.1428571428571428,0.04197797807648538,84,73,10,1
What's YOUR sign?,1.1428571428571428,0.04005926187397017,91,79,11,1
You think that's fire you're breathing?,1.1428571428571428,0.04197797807648538,84,73,10,1
Let's tell things from the sky stories!,1.1428571428571428,0.05492594029673081,70,63,4,3
"Ooh!, Ooh!, I think got it...Peter, Paul and Mary?",1.1428571428571428,0.04575090108716776,91,81,7,3
"Keep your day job, Spike.",1.1428571428571428,0.04197797807648538,84,73,10,1
"Now, do I look really scary!?",1.1428571428571428,0.04013939192492975,77,66,11,0
"Next time we want a romamtic night, I'll scare the kids with this.  They'll go running to their beds!",1.1428571428571428,0.04102618049244218,98,86,10,2
For a horrific monster you’re not as scary as Twitter.,1.1428571428571428,0.04013939192492975,77,66,11,0
"Maybe you're being funny, but who were those guys with the 'fire""?",1.1428571428571428,0.04197797807648538,84,73,10,1
Do I have any food stuck in my teeth?,1.1428571428571428,0.04005926187397017,91,79,11,1
...and then there was this big asteroid ...,1.1428571428571428,0.043514835648583675,98,87,8,3
Soylent Green isn't people!!,1.1428571428571428,0.04678356086900139,70,61,8,1
"And then a woman with an asymetrical haircut asked to speak with the manager.""",1.1428571428571428,0.045266017894605576,84,74,8,2
I bought it on Tyrannozon.,1.1428571428571428,0.04013939192492975,77,66,11,0
So do I look like mating material or what ?,1.1428571428571428,0.043514835648583675,98,87,8,3
Eh - it's not nearly as scary as when you stuck it in that hiker's skull.,1.1428571428571428,0.03688555567816589,91,78,13,0
You know what’s scary? That nose hair.,1.1428571428571428,0.045266017894605576,84,74,8,2
"And if you ever read ‘On the Road’ by Jack Kerouac, you’ll find out The Great Valley isn’t even real, Sara.",1.1428571428571428,0.04575090108716776,91,81,7,3
"No, your breath's not bad for a dragon, but you might consider some dental implants.",1.1414141414141414,0.03801425648577053,99,86,12,1
… and then this bright flash streaked cross the sky.,1.1414141414141414,0.03801425648577053,99,86,12,1
This was the only non-edible part,1.1414141414141414,0.04063528958247828,99,87,10,2
Tell me I don't look scarier,1.141304347826087,0.04255774228461488,92,81,9,2
Do you like my smile? I tried some new teeth whitener today.,1.141304347826087,0.04255774228461488,92,81,9,2
"Did you know that in Gondwana they call it a ""torch""!",1.141304347826087,0.039651858533041394,92,80,11,1
"""This is even better than the Walkman!""",1.141304347826087,0.039651858533041394,92,80,11,1
Turn off your torch Darling or Dick Cheney might think you are a Chinese New Year lantern (that’s gone off course) and shoot you down.,1.141304347826087,0.04255774228461488,92,81,9,2
Fire breathing is more scary.,1.141304347826087,0.039651858533041394,92,80,11,1
"So, eat a couple of them and we get a big movie deal.",1.141304347826087,0.039651858533041394,92,80,11,1
"Light my fire...light my fire
baby...ya gonna light my fire!",1.141304347826087,0.039651858533041394,92,80,11,1
Wait. Flashlights haven't been invented yet. How did you. . . ?,1.141304347826087,0.039651858533041394,92,80,11,1
"I know you're there, I can hear you seething.",1.141304347826087,0.04255774228461488,92,81,9,2
"I always thought you were the smart one, and I was the scary one.",1.141304347826087,0.04255774228461488,92,81,9,2
"Hey, why do you think our hands are so small?",1.141304347826087,0.036515453466785246,92,79,13,0
Dinotales,1.141304347826087,0.04527751066040476,92,82,7,3
It was a dark and stormy knight...,1.1411764705882352,0.04151521329086001,85,74,10,1
Did you get Botox?,1.1411764705882352,0.04476186970406316,85,75,8,2
And then the meteor came!,1.1411764705882352,0.04151521329086001,85,74,10,1
"Save the batteries; I foresee a long dark winter coming.""",1.1411764705882352,0.04151521329086001,85,74,10,1
"Don’t worry, I bet they blame the missing campers on Sasquatch!",1.1411764705882352,0.04476186970406316,85,75,8,2
It was a dark and Stormy Daniels…,1.1411764705882352,0.04476186970406316,85,75,8,2
I think think you are on  to something with this global warming idea!,1.1411764705882352,0.03799211615279771,85,73,12,0
Does my scary flashlight face frighten you Edna?,1.1411764705882352,0.04778846120374095,85,76,6,3
"And then, the human ROARED and raced after me...",1.1411764705882352,0.04476186970406316,85,75,8,2
"When the monster crawled from under the bed, it was empty!",1.1411764705882352,0.04476186970406316,85,75,8,2
… and he had GREAT BIG TEETH!,1.1411764705882352,0.04151521329086001,85,74,10,1
…and THE METEOR KILLED EVERYONE!!,1.1411764705882352,0.04151521329086001,85,74,10,1
"Do I have any ferns in my teeth, Agnes?",1.1411764705882352,0.04476186970406316,85,75,8,2
And then they gathered our bones and put them in a large room with other bones for strange creatures to pay $30 to gawk at...,1.1411764705882352,0.04151521329086001,85,74,10,1
I told you that dental alignment really works. See?,1.1411764705882352,0.04778846120374095,85,76,6,3
Am I scary now?,1.1411764705882352,0.04476186970406316,85,75,8,2
"And suddenly, a comet...",1.1411764705882352,0.04151521329086001,85,74,10,1
"...and they made sequel; after sequel, after sequel.",1.1411764705882352,0.04151521329086001,85,74,10,1
Stego.... ste  eh  eh  go.   Stego.,1.1411764705882352,0.03799211615279771,85,73,12,0
Do I have any Triceratops stuck in my teeth?,1.1411764705882352,0.04476186970406316,85,75,8,2
And then two legged mammals took over the planet.,1.1411764705882352,0.04476186970406316,85,75,8,2
"You can't tell it's an implant,",1.141025641025641,0.04366020435906118,78,68,9,1
"Stop Bernie, you're scaring me!",1.141025641025641,0.047320331546548966,78,69,7,2
"Nah, no change, you're actually scarier than your shadow.",1.141025641025641,0.04366020435906118,78,68,9,1
"Raindrops turned into hail, rivers froze over and icicles formed on the end of their noses...",1.141025641025641,0.03966375060019729,78,67,11,0
Hey!  Are those batteries LITHIUM???,1.141025641025641,0.03966375060019729,78,67,11,0
And then … he looked under the bed … and there was … a LITTLE GIRL!!!,1.141025641025641,0.047320331546548966,78,69,7,2
"And then, Tommy, we all die, get called goofy names, and have schoolchildren staring at our bones.",1.141025641025641,0.04366020435906118,78,68,9,1
Not another scary dinosaur story…,1.141025641025641,0.04366020435906118,78,68,9,1
"But Steggie you promised me that as long as we needed fires for light, we wouldn't become extinct!",1.141025641025641,0.04366020435906118,78,68,9,1
And behind the driver’s seat….an image appeared in the rear view mirror…..Marjorie Taylor Greene!!!,1.141025641025641,0.047320331546548966,78,69,7,2
"Honey, you are the light of my life.",1.141025641025641,0.04366020435906118,78,68,9,1
"""This is fun and all but remember we only have a few more hours of battery left""

- Benjamin Canales",1.141025641025641,0.047320331546548966,78,69,7,2
"If you would rather we can make this off the record""",1.141025641025641,0.04366020435906118,78,68,9,1
"And when he turned around, there it was, an Accountant!",1.141025641025641,0.04366020435906118,78,68,9,1
"And then, the human jumped out from under the bed!""",1.141025641025641,0.04366020435906118,78,68,9,1
And this is how I look in daylight,1.141025641025641,0.04366020435906118,78,68,9,1
Do I have any food on my teeth?,1.1408450704225352,0.04157742116654289,71,61,10,0
