caption,mean,precision,votes,not_funny,somewhat_funny,funny
No more scary stories of being skinned alive and turned into boots.,1.1029411764705883,0.0426292687910726,68,62,5,1
... and they'll never even know we told ghost stories.,1.1029411764705883,0.0426292687910726,68,62,5,1
I knew there was an advantage to having an opposable thumb.  I wonder what else we can achieve...like destroying the planet.,1.1029411764705883,0.047499853899100365,68,63,3,2
"Here, take this torch.  It will prove to you that there's no human hiding under your bed.",1.1029411764705883,0.0426292687910726,68,62,5,1
...and then they all joined an apocalyptic cult and committed mass suicide.,1.1029411764705883,0.0426292687910726,68,62,5,1
Gotcha!,1.1029411764705883,0.0426292687910726,68,62,5,1
Does this flashlight make my eyes look big?,1.1029411764705883,0.03712509925760675,68,61,7,0
"Everybody’s got a little light under the sun, under the sun",1.1029411764705883,0.0426292687910726,68,62,5,1
"...and then the operator said, ""Get out! The dragon slayer is calling from inside the cave!""",1.1025641025641026,0.034574351921191876,78,70,8,0
"Yes, I found it at the end of the tunnel...what do you think?",1.1025641025641026,0.03909457946788477,78,71,6,1
After stop-motion we were totally replaced by CGI and lost our SAG cards!,1.1025641025641026,0.03909457946788477,78,71,6,1
"A dumb knight with a little sword doesn't scare me.
It is the N.Y.F.D. with the big hose that is horrifying.",1.1025641025641026,0.03909457946788477,78,71,6,1
... I turn around and see ... King Ghidorah with a hook for a hand!!!,1.1025641025641026,0.034574351921191876,78,70,8,0
"And when they took off their masks, she realized they weren’t lizard people!",1.1025641025641026,0.034574351921191876,78,70,8,0
Time for bed. We hike the tar sands bright and early,1.1025641025641026,0.04314378839150649,78,72,4,2
Don't worry.  I don't see any evidence.,1.1025641025641026,0.034574351921191876,78,70,8,0
But they were all vegans and nobody left the feast satisfied....,1.1025641025641026,0.03909457946788477,78,71,6,1
You’ve still got a bit of those campers between your teeth.,1.1025641025641026,0.03909457946788477,78,71,6,1
Wanna hear a new ghost story?,1.1025641025641026,0.03909457946788477,78,71,6,1
I'm in love!,1.1025641025641026,0.034574351921191876,78,70,8,0
"The sound came again, against the car door: Scrape, scrape, scrape. And I suddenly thought: That hook could really improve my dental hygiene.",1.1025641025641026,0.03909457946788477,78,71,6,1
And then the asteroid struck”,1.1025641025641026,0.04314378839150649,78,72,4,2
This talk of Global Cooling is Totall Rubbish. This Cloudy period will pass any day now.,1.1025641025641026,0.03909457946788477,78,71,6,1
"Okay, Okay. Let me see. King Kong meets Fay Wray. Right?",1.1025641025641026,0.04314378839150649,78,72,4,2
And then... the human jumped from under the bed!,1.1025641025641026,0.034574351921191876,78,70,8,0
We get it- you have dental insurance Fred.,1.1025641025641026,0.04314378839150649,78,72,4,2
"… and in the future, there will be millions of tiny fat little dinos, flightless and defenceless, running around from them humans, trying to survive in prison cells called coops… Pooping out eggs, trying to make a living… Their voices will become trivial toys that squeaks, just for a laugh… and even the ones with liberty will be entitled ‘free range’, but their destiny is the same Martin… Ending up as an appetiser on a Sunday afternoon..",1.1025641025641026,0.034574351921191876,78,70,8,0
"And someday, our bones will fuel boxes on wheels!",1.1025641025641026,0.03909457946788477,78,71,6,1
Take one to know one.,1.1022727272727273,0.03628436369735344,88,80,7,1
Wait! Have you ever heard of floss?,1.1022727272727273,0.0324857203870887,88,79,9,0
"And then, in the sky, came a bright burning flame ...",1.1022727272727273,0.039721380499367465,88,81,5,2
But this particular triceratops had hooks for horns.,1.1022727272727273,0.0324857203870887,88,79,9,0
You know I don't scare that easily.,1.1022727272727273,0.03628436369735344,88,80,7,1
"And when they found the meteor, it is as wearing the girl's sweater.",1.1022727272727273,0.0324857203870887,88,79,9,0
That was a great meal Dina. Boots giving you a little indigestion? I'll toss you for his flashlight.,1.1022727272727273,0.0324857203870887,88,79,9,0
And then the tiny two-legged ants go on to rule the Earth.,1.1022727272727273,0.03628436369735344,88,80,7,1
"..and then an Ice Age comes and we all die off because of Global Cooling! It's true, this 13 year old girl told me!",1.1016949152542372,0.0464704883270233,59,54,4,1
"And after the apocalypse, the small, furry creature gleefully ate the last of the dinosaur eggs while declaring, ""Now it's our turn!""",1.1014492753623188,0.03661350600424963,69,62,7,0
"The lithium-ion flavor, whatever that is, tastes REALLY good once the case pops open.",1.1014492753623188,0.03661350600424963,69,62,7,0
And then the scout leader took out his... guitar!,1.1014492753623188,0.042033394835877404,69,63,5,1
"And then these furless creatures turned  us into a liquid substance called ""fossil fuel!""",1.1014492753623188,0.042033394835877404,69,63,5,1
"To this day, he is imprisoned, in the depths of Hollywood. 
And if you listen carefully, you can still hear his roars of agony.",1.1014492753623188,0.03661350600424963,69,62,7,0
I’d like you to attend the premiere with me.,1.1014492753623188,0.042033394835877404,69,63,5,1
“I hope I don’t scare a species into extinction”,1.1014492753623188,0.03661350600424963,69,62,7,0
And then the cartoonist chopped off one of my arms!,1.1014492753623188,0.042033394835877404,69,63,5,1
Do you think THIS will scare the Liberals even more than my Trump mask???,1.1014492753623188,0.042033394835877404,69,63,5,1
"Guess who I am, Linda?",1.1014492753623188,0.03661350600424963,69,62,7,0
And they said it granted wishes?,1.1014492753623188,0.042033394835877404,69,63,5,1
You light up my life - til we are extinct.,1.1014492753623188,0.042033394835877404,69,63,5,1
and then...her nose started to itch,1.1014492753623188,0.042033394835877404,69,63,5,1
...and then the asteroid came shooting towards Earth.,1.1012658227848102,0.03415857738895905,79,71,8,0
"And from the murky shadows of the Prius,emerged the balding, middle-aged man with a dad bod.",1.1012658227848102,0.038618368091629836,79,72,6,1
The balloon just kept floating across the sky.,1.1012658227848102,0.04261394488760367,79,73,4,2
And they had to start their own fires with sticks.,1.1012658227848102,0.03415857738895905,79,71,8,0
They keep promising “the ice age is almost over”,1.1012658227848102,0.038618368091629836,79,72,6,1
I can be a better Trump than you!,1.1012658227848102,0.038618368091629836,79,72,6,1
And then she said a large comet would appear in the sky .,1.1012658227848102,0.038618368091629836,79,72,6,1
"Look what I found and watch this... ""Cheese""",1.1012658227848102,0.038618368091629836,79,72,6,1
"Wendy, darling, Light of my Life! I'm not gonna hurt ya. I'm just going to bash your brains in.",1.1012658227848102,0.038618368091629836,79,72,6,1
"Yes, the braces did make your teeth straighter!”",1.1012658227848102,0.038618368091629836,79,72,6,1
You actually look better under that light.,1.1012658227848102,0.03415857738895905,79,71,8,0
Does that meteor look closer to you?,1.1012658227848102,0.03415857738895905,79,71,8,0
Here's a scary story: dragons don't exist.,1.1012658227848102,0.038618368091629836,79,72,6,1
This is my new nighttime beauty regime to enhance my terror-ific features,1.1012658227848102,0.03415857738895905,79,71,8,0
A chin lift would tighten your turkey wattle,1.1012658227848102,0.038618368091629836,79,72,6,1
Some say when the night is still and the moon shines an eerie purple you can hear his awful cry: 'Super-Dee-Duper! Tee-rific!,1.101123595505618,0.04241480019815027,89,83,3,3
Better be nice to me or I won’t pluck those chin hairs anymore,1.101123595505618,0.039289345386959953,89,82,5,2
And her BONES are on display.,1.101123595505618,0.03213918840153681,89,80,9,0
No more rehearsing and nursing a part!,1.101123595505618,0.03213918840153681,89,80,9,0
"Tell me the spooky matrix story where they use DNA technology to grow, harvest, and liquify us to create the sustainable energy of the future!",1.101123595505618,0.03213918840153681,89,80,9,0
You have your persona; I have mine.,1.101123595505618,0.039289345386959953,89,82,5,2
"Then he felt something brush against his tail…He turned around to find…an Enormous MAMMAL, THREE INCHES HIGH!  Poised to take over life on Earth!",1.101123595505618,0.03589275757061102,89,81,7,1
But all the gold was gone!,1.1,0.04145390815152651,70,64,5,1
More like 'big goofy lizard' if you ask me.,1.1,0.04145390815152651,70,64,5,1
And then they looked up...and they saw something massive falling from the sky...and then BOOM!!! They all died.,1.1,0.04145390815152651,70,64,5,1
"And suddenly, there's an orange glow in the night sky!",1.1,0.04617905559865247,70,65,3,2
"And on moonlit nights, if it's very quiet, you can still hear the screams of Little Jackie Paper.",1.1,0.038866588933566495,90,83,5,2
And then this giant meteoroid crashed into earth and destroyed all of us.  The end.,1.1,0.035509489509052444,90,82,7,1
"Wait, buy just three tubes whitening toothpaste and get a free moth collector?",1.1,0.03375263702778069,80,72,8,0
You had me at 'Roar!',1.1,0.04145390815152651,70,64,5,1
I AM SAINT GEORGE!!!,1.1,0.03815358702051019,80,73,6,1
Then they used those opposable thumbs to elect a cantankerous orange vulgarian.,1.1,0.04209693455269844,80,74,4,2
No.  I don't see any bloody flesh stuck between your teeth.,1.1,0.036115755925730755,70,63,7,0
Does this scare the scales off ya' or what?,1.1,0.036115755925730755,70,63,7,0
And then they all looked and saw ... BEAVER CLEAVER'S GOOFY FACE!,1.1,0.03375263702778069,80,72,8,0
...And THAT'S how I got this flashlight,1.1,0.03815358702051019,80,73,6,1
This tale is called 'Things That Bump into the Knight.',1.1,0.03375263702778069,80,72,8,0
"This, my dear, is what you call Firepower!",1.1,0.04145390815152651,70,64,5,1
"Whoa, scary like one of those TV pundits.""",1.1,0.036115755925730755,70,63,7,0
And NO ONE was scared of him!,1.1,0.04209693455269844,80,74,4,2
... and after the egg cracked you could see the beak...,1.1,0.03375263702778069,80,72,8,0
You’re no Boris Karloff. Keep trying.,1.1,0.036115755925730755,70,63,7,0
But asteroids aren't real?,1.1,0.036115755925730755,70,63,7,0
"The knight said “I’m here to slay you!” So I said “What are you, some kind of comedian?”",1.1,0.03375263702778069,80,72,8,0
Bam..! I'm facing a group of humanoids called filmmakers.,1.1,0.04145390815152651,70,64,5,1
And then the huge rock fell from the sky and destroyed us all.,1.1,0.03815358702051019,80,73,6,1
"And then the human tucked his daughter in for the night, read her a bedtime story and gently KISSED HER ON THE CHEEK!",1.1,0.03375263702778069,80,72,8,0
"It was a dark and stormy night 66 million years ago.""",1.1,0.03815358702051019,80,73,6,1
"… then the IRS got him, even though he burned his paper trail…",1.1,0.04617905559865247,70,65,3,2
And then they pumped us up and we oozed through pipelines and lubricated fire-breathing machines and...,1.1,0.036115755925730755,70,63,7,0
Flashlight? Neat.  Fire?  Better!,1.1,0.036115755925730755,70,63,7,0
It produces face value!,1.1,0.04617905559865247,70,65,3,2
"Then, after her cucumber scrub, the model was just radiant",1.1,0.036115755925730755,70,63,7,0
T-Rex on a rock! Whadda ya think?,1.1,0.03375263702778069,80,72,8,0
How did you get the fire inside that tube?,1.1,0.03815358702051019,80,73,6,1
And then Trump became President!,1.1,0.04209693455269844,80,74,4,2
"This light stick is really cool but gives no heat no warmth, and cannot cook anything, therefore isn't very useful. All we have to do is wait for the animals using it to go extinct when the cold comes. Then we won't be bothered by them anymore.",1.1,0.04145390815152651,70,64,5,1
"Oooh! That's a scary story! Do they breathe fire, too?""",1.1,0.03375263702778069,80,72,8,0
"And then, the meteorite came, and it destroyed everything!""

- Isabelle Sherlock, age",1.1,0.04209693455269844,80,74,4,2
And then they ate s'mores right before bed and DIDN'T BRUSH THEIR TEETH!,1.1,0.04209693455269844,80,74,4,2
See how scary I can look?,1.1,0.036115755925730755,70,63,7,0
"Be careful, you know that fire cannot kill a dragon but that thing could.",1.1,0.03815358702051019,80,73,6,1
"And when they looked back, the asteroid was gone - or was it?",1.1,0.04209693455269844,80,74,4,2
And then a firefighter appeared in the distance,1.1,0.04572084295183091,60,55,4,1
"Then one night, Dino teased the asteroid with a moon joke.",1.098901098901099,0.03146773860060733,91,82,9,0
"And then I said, “I’d like to speak to your manager!”",1.098901098901099,0.03146773860060733,91,82,9,0
"And behind him, the Creature appeared like magic, all dressed in silver with a shiny toothpick...",1.098901098901099,0.03513429687408582,91,83,7,1
"Jerry, you’ve already told me this one.",1.098901098901099,0.03845281603519619,91,84,5,2
". . . and when I do this, I look like Elon Musk.",1.0987654320987654,0.03335618786692912,81,73,8,0
"And then he realized someone else was IN the house, whatever that is.",1.0987654320987654,0.037699830826178934,81,74,6,1
And then along came this monstrosity called …nyah-ah-ahh... ‘global warming.’  And it wiped out all the humans…But don’t worry… it won’t mess with us!,1.0987654320987654,0.037699830826178934,81,74,6,1
"Your freaking me out man, your freaking me out!",1.0987654320987654,0.03335618786692912,81,73,8,0
"Look, I shaved my beard!
:sigh: you look hideous...",1.0987654320987654,0.037699830826178934,81,74,6,1
He thought that this was really scary and then he saw me.,1.0987654320987654,0.03335618786692912,81,73,8,0
"Have a light, Bud.",1.0987654320987654,0.03335618786692912,81,73,8,0
"Hey, look at me -I'm a Duracell -a-Saurus!",1.0987654320987654,0.037699830826178934,81,74,6,1
"...and they lived happily ever after...or they thought. The princess had to get a part time job and the knight had to go back to slaying dragons AGAIN!""",1.0987654320987654,0.037699830826178934,81,74,6,1
"It's no use, my teeth are still chattering",1.0987654320987654,0.037699830826178934,81,74,6,1
"This is called ""Mother Earth,"" because it smells, feels, and looks like mom's breath.",1.0987654320987654,0.037699830826178934,81,74,6,1
There was a time when humans roamed the earth and flew the skies in big metal tubes with wings.,1.0987654320987654,0.03335618786692912,81,73,8,0
... and it was called the Chicxulub impactor.,1.0987654320987654,0.04159229759980991,81,75,4,2
And boom!  This giant gorilla appears out of nowhere.,1.0987654320987654,0.03335618786692912,81,73,8,0
This will totally scare away any bears that are attracted to our s’mores.,1.0987654320987654,0.037699830826178934,81,74,6,1
"Well,thanks so much for shining a light on the situation.",1.0987654320987654,0.037699830826178934,81,74,6,1
This is how my idol scare human in Jurassic World.,1.0987654320987654,0.037699830826178934,81,74,6,1
Another relic from the Anthropocene age?,1.0987654320987654,0.03335618786692912,81,73,8,0
That camper guy WAS pretty tastey!! And look at some of the cool stuff he had...,1.0987654320987654,0.03335618786692912,81,73,8,0
"And the humans were never seen again after that asteroid. But, legend says the humans still lurk in the abandoned cities...",1.0987654320987654,0.04159229759980991,81,75,4,2
You are the Queen of Dragons doppelgänger!,1.0987654320987654,0.037699830826178934,81,74,6,1
"And out of the dark cave came Beowulf, St. George, and Little Johnny Papers.",1.0987654320987654,0.04159229759980991,81,75,4,2
"Once upon a time, a long, long time ago, there was a big bang!",1.0985915492957747,0.040890143728172165,71,65,5,1
"And then, all of a sudden, a gigantic meteor appeared!",1.0985915492957747,0.040890143728172165,71,65,5,1
They look great. You'll be a big hit with the Pterodactyls.,1.0985915492957747,0.040890143728172165,71,65,5,1
How could this smile scare anyone?,1.0985915492957747,0.045545782911616595,71,66,3,2
"Say Puff,I mean Dude,what did you put in those marshmallows?",1.0985915492957747,0.040890143728172165,71,65,5,1
And then they opened a park and locked ussss allll inn ittt,1.0985915492957747,0.040890143728172165,71,65,5,1
"Kinda gilding the lily, don't you think?",1.0985915492957747,0.040890143728172165,71,65,5,1
"Sorry, but scary human stories just make me hungry.",1.0985915492957747,0.040890143728172165,71,65,5,1
And that’s when they realized that the hitchhiker was actually a mass extinction asteroid.,1.0985915492957747,0.040890143728172165,71,65,5,1
"IT! WAS! AAA!  => DARK!!, and… s-t-o-r-r-r-m-y Night !!!",1.0985915492957747,0.040890143728172165,71,65,5,1
And then the evil asteroid hit and they were goners!,1.0985915492957747,0.040890143728172165,71,65,5,1
We'll get back on the balloon as soon as it's recharged,1.0985915492957747,0.040890143728172165,71,65,5,1
"Charming, but you were supposed to drop the flashlight and take the marshmallows.",1.0985915492957747,0.035631297579361995,71,64,7,0
Hmm - what's even more scary is you having opposable thumbs; take that Darwin.,1.0985915492957747,0.040890143728172165,71,65,5,1
They say if we use these we won't go extinct.,1.0985915492957747,0.035631297579361995,71,64,7,0
...and then a giant asteroid crashed into the planet; killing everyone,1.0985915492957747,0.035631297579361995,71,64,7,0
They say you can’t know the true nature of someone until you see … their TEETH!,1.0985915492957747,0.035631297579361995,71,64,7,0
"Well yes, it's my name, but we can't call the band 'Marc Bolan'",1.0985915492957747,0.035631297579361995,71,64,7,0
"And then Saint George comes riding, riding riding up through the woods...",1.098360655737705,0.03844603081822478,61,55,6,0
"And as he burned he cried out, ""only you can prevent forest fires.""",1.098360655737705,0.03844603081822478,61,55,6,0
Chicxulub,1.0980392156862746,0.03270561326017676,102,93,8,1
...and then a GIANT ASTEROID came from outer space!,1.0978260869565217,0.03114237840319294,92,83,9,0
"One-two, one-two, and through and through, his vorpal blade went snicker-snack...",1.0978260869565217,0.038047743942136655,92,85,5,2
"Definitely, not a scary campfire story.",1.0975609756097562,0.03725671296712065,82,75,6,1
I thought id never see you again,1.0975609756097562,0.03725671296712065,82,75,6,1
The knights are out at night.,1.0975609756097562,0.03296890260324238,82,74,8,0
"...and when he woke, the forest was filled with HUMANS!!",1.0975609756097562,0.03296890260324238,82,74,8,0
And only our bones will remain.,1.0975609756097562,0.03296890260324238,82,74,8,0
Just wait!  A million years from now some two-legged creature will try to take credit for this.,1.0975609756097562,0.03725671296712065,82,75,6,1
"And who should appear, but a knight in shining armor!",1.0975609756097562,0.03296890260324238,82,74,8,0
After we die our bodies will turn into this sludge which an advance species will use to put in their travelling machines,1.0975609756097562,0.03296890260324238,82,74,8,0
And then it appeared -- AND IT HAD FLESH AND HAIR ALL OVER ITS BODY!,1.0975609756097562,0.04109959590271843,82,76,4,2
And then I saw a meteor,1.0975609756097562,0.03296890260324238,82,74,8,0
"The karaoke age came after the big bang, the bronze age, and the bildesung.",1.0975609756097562,0.03725671296712065,82,75,6,1
…and then a large fiery ball came screaming out of the sky,1.0975609756097562,0.03296890260324238,82,74,8,0
How very human of you.,1.0975609756097562,0.03296890260324238,82,74,8,0
But then all the humans in the park escaped!,1.0975609756097562,0.03725671296712065,82,75,6,1
"Then, a giant asteroid comes flying toward Earth...",1.0975609756097562,0.04109959590271843,82,76,4,2
"...But it turned out...
She wasn't a virgin at all!",1.0975609756097562,0.03725671296712065,82,75,6,1
"You are scaring me, STOP!",1.0975609756097562,0.03296890260324238,82,74,8,0
...then the monster on two feet arrived and said I'm the Hu-man. Nothing is safe since,1.0975609756097562,0.04461267651261335,82,77,2,3
But where do you go when the batteries run out ?,1.0972222222222223,0.035159608253116335,72,65,7,0
...and then the giant meteor lit up the sky!,1.0972222222222223,0.035159608253116335,72,65,7,0
And then humans moved in and our world turned upside down.,1.0972222222222223,0.04034147195184963,72,66,5,1
And then what happened?,1.0972222222222223,0.035159608253116335,72,65,7,0
"I agree, he needs salt.",1.0972222222222223,0.035159608253116335,72,65,7,0
I am the asteroid of your nightmares.,1.0972222222222223,0.035159608253116335,72,65,7,0
"And sometimes, late at night, you can still hear them… living happily ever after. Mwahahahahah!",1.0972222222222223,0.035159608253116335,72,65,7,0
I feel warmth -- I will call it a torch.,1.0972222222222223,0.035159608253116335,72,65,7,0
Why so scaled?,1.0972222222222223,0.035159608253116335,72,65,7,0
The light brings out your best features.,1.0972222222222223,0.04034147195184963,72,66,5,1
"And so just when the Princess was done whining about the tower, she broke a nail.",1.0972222222222223,0.04034147195184963,72,66,5,1
Just another night at the Dinosaur-LARPing-Ghost-Story Retreat.,1.0972222222222223,0.035159608253116335,72,65,7,0
This is the next level honey...,1.0972222222222223,0.035159608253116335,72,65,7,0
And this animal burns our liquified bodies to keep warm.,1.0972222222222223,0.04034147195184963,72,66,5,1
"And then, I said: ‘My, what big teeth I have’",1.0972222222222223,0.035159608253116335,72,65,7,0
"Do I have cartilage stuck in my teeth?""",1.0972222222222223,0.035159608253116335,72,65,7,0
"Then human say, ""No worry, Larry, this species is peaceful herbivore.""",1.0972222222222223,0.035159608253116335,72,65,7,0
"Sorry. Just not seeing scary. 
More...wry bemusement with a hint of doleful ennui.",1.0972222222222223,0.04034147195184963,72,66,5,1
You look scary enough already!,1.0972222222222223,0.04034147195184963,72,66,5,1
". . . But inside the castle, guarding the room where the princess slept was a huge, fire-breathing man.",1.0972222222222223,0.035159608253116335,72,65,7,0
And then the human blew out the dragon's flame... and he could never get it to light again!  Mwahahaha!,1.0972222222222223,0.035159608253116335,72,65,7,0
"Just a balloon"", they said. ""Yeah.",1.0972222222222223,0.035159608253116335,72,65,7,0
Fine! You lit your face up and now the asteroid will find us. I’m not ready for this extinction stuff.”,1.0972222222222223,0.035159608253116335,72,65,7,0
... And finally the last survivors were replaced by AI ...,1.096774193548387,0.03785410929280441,62,56,6,0
"It was a bright and sunny day, the kind of day that makes humans want to sing!",1.096774193548387,0.044291695837077504,62,57,4,1
Roar! I’m almost as scary as man!,1.096774193548387,0.03440714115645382,93,85,7,1
Always use decent lighting or you'll look washed out and wrinkly on Zoom.,1.096774193548387,0.03785410929280441,62,56,6,0
"No, it's not a mirror",1.096774193548387,0.03440714115645382,93,85,7,1
Ok. Now you’re really scaring me.,1.096774193548387,0.03785410929280441,62,56,6,0
"Oh Harold, stop with the monster tails!",1.096774193548387,0.03440714115645382,93,85,7,1
"Yeah, I think the technical term for it is 'LED Light Therapy'. 
It really gives the ol' scales a youthful glow.",1.096774193548387,0.044291695837077504,62,57,4,1
…then the chilli peppers disappeared!,1.096774193548387,0.03785410929280441,62,56,6,0
"And there, hanging off the door handle of the car, was the tail of the comet!",1.0963855421686748,0.03259046872291919,83,75,8,0
That’s not scary,1.0963855421686748,0.03259046872291919,83,75,8,0
This setting scares away aliens; the other cone can shoot down asteroids!,1.0963855421686748,0.03259046872291919,83,75,8,0
"Ivan, is that really supposed to be scarier than snarling and breathing fire?",1.0963855421686748,0.036823864705512965,83,76,6,1
"It doesn't make me less hungry, man.",1.0963855421686748,0.03259046872291919,83,75,8,0
"This is what humans did eons ago, but they still couldn't see the way.",1.0963855421686748,0.036823864705512965,83,76,6,1
They don't call it Dragon's Milk Scaly Peanut Butter Coffee Stout for nothing!,1.0963855421686748,0.036823864705512965,83,76,6,1
"...and it suddenly turned and stared at me with horrible round blue eyes in a naked pink face, peeled of its scales causing it to make this terrible noise that made my own skin feel as if it could be torn off if I wandered alone in the dark.",1.0963855421686748,0.036823864705512965,83,76,6,1
Somehow  “me want cookie” doesn’t really scare me.,1.0963855421686748,0.03259046872291919,83,75,8,0
Guess who?,1.0963855421686748,0.03259046872291919,83,75,8,0
And that's why you should never eat a haunted house.,1.0961538461538463,0.03210103183993801,104,95,8,1
"You're not scary, T.R. What is scary is that someday the flashlight will be extinct!",1.095890410958904,0.034700192131439885,73,66,7,0
Prehistoric scary campfire stories !,1.095890410958904,0.03980729628804269,73,67,5,1
And then they realized.... It was an asteroid!,1.095890410958904,0.034700192131439885,73,66,7,0
But then after Godzilla fought with King Kong they teamed up to fight MechaGodzilla who was the villain of them both! Boo!!!!!!,1.095890410958904,0.034700192131439885,73,66,7,0
"No, no, I’m not a Spinosaurus; I’m an asteroid.",1.095890410958904,0.034700192131439885,73,66,7,0
"Knock it off Jerry, it makes you look like Biden!",1.095890410958904,0.034700192131439885,73,66,7,0
Jeez Frank....that never gets old!,1.095890410958904,0.04432988091083928,73,68,3,2
Next time don't forget to bring the marshmallows,1.095890410958904,0.034700192131439885,73,66,7,0
