caption,mean,precision,votes,not_funny,somewhat_funny,funny
"Sure, Man discovered fire, but I invented the flashlight.",1.2131147540983607,0.048314650007294575,122,103,12,7
And to this day...no one knows where he's buried,1.2131147540983607,0.048314650007294575,122,103,12,7
"For God’s sake, Frank, put that thing away. You’re ugly enough as it is.",1.212962962962963,0.049313258815131475,108,90,13,5
...and then the human jumped up behind me and screamed 'SELFIE!!!!!!!!!!!!!',1.212962962962963,0.049313258815131475,108,90,13,5
"And then he ripped off his own face, and inside was a human the whole time!",1.212962962962963,0.0437331304091476,108,87,19,2
And the meteor came closer and CLOSER!!,1.212962962962963,0.047526068935268895,108,89,15,4
"You keep that up,  your face will stay that way.",1.2127659574468086,0.05426731758895584,94,79,10,5
Stop clowning and get the marshmallows.,1.2127659574468086,0.05211680303793994,94,78,12,4
"... and the police sergeant said, 'We traced the lizard skin handbags - they're made inside the house. Get out!'",1.2125984251968505,0.04694107715412767,127,107,13,7
Legend has it that our days here are numbered!,1.2125984251968505,0.04559035366650368,127,106,15,6
So we died too?,1.2125984251968505,0.041273807875918625,127,103,21,3
This IS my scary face.,1.2123893805309736,0.04610513913732101,113,93,16,4
So there was this T-Rex with a hook for a hand...,1.2123893805309736,0.047788195904080746,113,94,14,5
"And stealthily, the cowardly Saint George crrreppppt up on the sweetly sleeping innocent dragon . . .",1.2123893805309736,0.04610513913732101,113,93,16,4
And someday your bones will be on display in a museum.,1.2123893805309736,0.047788195904080746,113,94,14,5
"You'll perish in a firey BANG. And at the Smithsonian, they won't even charge people to see your bones.",1.2123893805309736,0.044358269149919055,113,92,18,3
That last paleontologist gave me heartburn,1.2123893805309736,0.047788195904080746,113,94,14,5
"And.....
Then they said no more social security !",1.2121212121212122,0.050298485015680724,99,82,13,4
…And now a word from our sponsor.,1.2121212121212122,0.046017947241275524,99,80,17,2
Am I scary or what !,1.2121212121212122,0.050298485015680724,99,82,13,4
OMG!  How scary!  I thought you looked like a human!,1.2118644067796611,0.04314805930475334,118,96,19,3
"Yes, I said you're not very bright but that doesn't help.",1.2115384615384615,0.04668446536082761,104,85,16,3
When is it my turn to use the flashlight and show off my teeth?,1.2115384615384615,0.048643044758859645,104,86,14,4
I am telling a joke!,1.2115384615384615,0.05052575878498542,104,87,12,5
Still carrying a torch for me “,1.2115384615384615,0.04668446536082761,104,85,16,3
"Yes, your dentist did a great job, but how much did you pay?",1.2115384615384615,0.044640035939055925,104,84,18,2
"Egad! Then what did St.
 George do?",1.2115384615384615,0.048643044758859645,104,86,14,4
…and then the human crawled out from under the bed. What happens next will blow your mind…,1.2115384615384615,0.05234079477983345,104,88,10,6
Hunting humans is easy...I do this and they just drop dead!!,1.2113821138211383,0.043583382133913544,123,101,18,4
Were batteries included?,1.2110091743119267,0.04337407810681607,109,88,19,2
"They checked the nest, and... the horror!  There, newly hatched before them, a purple vegan singing dinosaur, immaculately conceived by the imagination of children!",1.2110091743119267,0.04529023423348228,109,89,17,3
Arrrggggh...I'm a Person!,1.2110091743119267,0.04529023423348228,109,89,17,3
"Suddenly, everyone got obsessed with a show about wealthy people in luxury resorts with a hefty dose of betrayal, sex, drugs, and murder. That’s how we became irrelevant on tv shows…",1.2110091743119267,0.04712854742331021,109,90,15,4
Never have I ever drunk a craft beer.,1.2105263157894737,0.04463297341944604,95,76,18,1
"That works on the kids, Karl, but you don’t frighten me.",1.2105263157894737,0.04032488041543996,114,91,22,1
"Being a Republican, I am only trying to keep you in fear",1.2105263157894737,0.04740377159065991,114,95,14,5
"...suddenly this huge flaming rock pierces our atmosphere and click, lights out.",1.2105263157894737,0.04032488041543996,114,91,22,1
I assure you. There's nothing in your teeth.,1.2105263157894737,0.04740377159065991,114,95,14,5
I don't think we can cook with it but I love how flattering it is on my face.,1.2105263157894737,0.04707511531578504,95,77,16,2
And then—the latest ‘Jurassic Park’ sequel went straight-to-streaming!,1.2105263157894737,0.049396666362498,95,78,14,3
"And just when you thought it was finally over, they started a whole new franchise called Jurassic WORLD!",1.210144927536232,0.04418221331267686,138,116,15,7
"I know you're trying, Roger, but I'm just not terrified.",1.2100840336134453,0.04445294819591747,119,98,17,4
"Phil, are there any campers stuck in my teeth?",1.2100840336134453,0.04602710567270305,119,99,15,5
I think you've just invented the selfie.,1.21,0.049838121792844324,100,83,13,4
"And when he turned around, there was a giant robot copy of himself!!!",1.21,0.049838121792844324,100,83,13,4
Check this! Do I look like Godzilla?,1.21,0.047768380565162374,100,82,15,3
…and there’s a bunny that just keeps going and going.,1.2096774193548387,0.04172109251328215,124,101,20,3
"And then, hurtling out of the night ski was a fire ball like no one has ever seen!
What happened next?",1.2096774193548387,0.04172109251328215,124,101,20,3
And in the morning... I'm making waffles!,1.2096774193548387,0.04326407174623475,124,102,18,4
"Gerald, I think we need to talk about our divorce.",1.2095238095238094,0.04425872587386216,105,85,18,2
"Isn't this more fun than
Dungeons and Dragons?",1.2095238095238094,0.046281583800987826,105,86,16,3
"If man is a monster, I have a monster inside of me.",1.2095238095238094,0.04425872587386216,105,85,18,2
and a giant rock headed this way.,1.2095238095238094,0.04821965555951268,105,87,14,4
"Stop shaking, climate change is a just a myth.",1.2095238095238094,0.05008278512052046,105,88,12,5
And then they put your bones into a museum for groups of children to fart on,1.2095238095238094,0.046281583800987826,105,86,16,3
How have you been affected by cancelation?,1.2093023255813953,0.04494076986552415,129,108,15,6
"Crap, marshmallows are still a million years away...",1.209090909090909,0.04491759584234193,110,90,17,3
Asteroid stories again?,1.209090909090909,0.04673752333670239,110,91,15,4
"'""So then he ghosted me.""",1.209090909090909,0.04848919218796729,110,92,13,5
Do I have a survival skills badge stuck in my teeth?,1.209090909090909,0.04848919218796729,110,92,13,5
"By the time I sing 'Don't Rain on My Parade,' they'll have forgotten Barbra completely.",1.209090909090909,0.04491759584234193,110,90,17,3
With those looks we'll never survive.,1.209090909090909,0.04302074784174661,110,89,19,2
"And that, dear boy, is why the first Tyrannosauruses became rextinct.",1.209090909090909,0.04491759584234193,110,90,17,3
"Oh, dear. Go for back lighting.",1.209090909090909,0.050179751199407666,110,93,11,6
"Maybe man invented fire, but look at what I invented!",1.208695652173913,0.04537436813430066,115,95,16,4
And the whole park was full of HUMANS,1.208695652173913,0.04537436813430066,115,95,16,4
"And then, after thousands of years, they'll dig up your body and turn it into single-use toothpicks!",1.208695652173913,0.04537436813430066,115,95,16,4
And then the spooky comet made the Chicxulub crater,1.208695652173913,0.04862040606762226,115,97,12,6
"Like usual, his short arms were of no use.",1.208695652173913,0.04702540361213032,115,96,14,5
"And I see Sasquatch and I go like ""Boo""!",1.208695652173913,0.043660943442513006,115,94,18,3
It was a bright and balmy day...,1.208695652173913,0.04862040606762226,115,97,12,6
It's from the future!,1.208695652173913,0.043660943442513006,115,94,18,3
This motherfucker.,1.2083333333333333,0.04864527944160099,120,102,11,7
"... and then, out of the woods, came a pack of  Cub Scouts.",1.2083333333333333,0.047183759807188794,120,101,13,6
One of their better inventions.,1.2083333333333333,0.042498695536634934,120,98,19,3
And when the light shines in the dragon’s face you could see little bits of Boy Scout in its teeth!,1.2083333333333333,0.04567549854280215,120,100,15,5
Check this out.  We can stop breathing fire,1.2083333333333333,0.053222197804875436,96,81,10,5
"Stop it, Keith, you’re freaking me it.",1.2079207920792079,0.04938599569639575,101,84,13,4
I'd look a lot scarier with music.,1.2079207920792079,0.04733874490250266,101,83,15,3
Where do you find batteries for that thing?,1.2079207920792079,0.04938599569639575,101,84,13,4
…his heart sank… but then he remembered that he was an apex predator and he lived happily ever after.,1.2079207920792079,0.04733874490250266,101,83,15,3
"Okay, but apart from the ability to make fire, the dexterity to make tools and the invention of electricity, what have opposable thumbs ever really given you?”",1.2079207920792079,0.05135169298966313,101,85,11,5
"Well, I can say this. You need to floss more.",1.2079207920792079,0.04733874490250266,101,83,15,3
And that's how the Jurassic Park came to an end,1.2079207920792079,0.04938599569639575,101,84,13,4
And this is how you look scary with a flashlight.,1.2079207920792079,0.05135169298966313,101,85,11,5
"""Tell me another scary story about the mammals.",1.2079207920792079,0.04733874490250266,101,83,15,3
"No Frank, I am not scared.  You should know by now I have thicker skin than that!",1.2079207920792079,0.05135169298966313,101,85,11,5
"…and then the big, scary, fiery rock fell from the sky…",1.2079207920792079,0.05135169298966313,101,85,11,5
"And then the wretched creature said, “I’m all out of Thin Mints!”",1.2079207920792079,0.04938599569639575,101,84,13,4
Oh sure. A giant asteroid will kill us all. Right.,1.2075471698113207,0.04964742018484815,106,89,12,5
You forgot the bear repellent spray?,1.2075471698113207,0.04388374155720299,106,86,18,2
"You know, ‘Brontosaurus’ is considered racially offensive today.",1.2075471698113207,0.04964742018484815,106,89,12,5
You are really freaking me out Bret.,1.2075471698113207,0.04780347070761396,106,88,14,4
Just shine the light under you chin like this. And it scares the hell out of the monsters.,1.2075471698113207,0.04588548019119496,106,87,16,3
And they were made into chicken nuggets!,1.2072072072072073,0.04455093454204469,111,91,17,3
And the only thing left of that whole family was a thin silvery trace of iridium.,1.2072072072072073,0.04635284168602518,111,92,15,4
"And then the politicians said, “I’m not a scientist, but rocks don’t just fall from space.”",1.2072072072072073,0.04976129278837159,111,94,11,6
"And then, where the tail was supposed to be, was another tiny arm!!!",1.2072072072072073,0.048087275823962806,111,93,13,5
"It's nice to warm up my face with the light,don't you agree?",1.2072072072072073,0.042673007917996435,111,90,19,2
Those weren’t functional mushrooms.,1.2072072072072073,0.042673007917996435,111,90,19,2
STOP!!!  It's cold and dark and you're scaring me.,1.206896551724138,0.043320294123598405,116,95,18,3
Nothing scarier than the extinction.,1.2066115702479339,0.04378345689935829,121,100,17,4
Whoa!  That meteor hitting the earth story is your scariest one yet.,1.2066115702479339,0.04051554028263788,121,98,21,2
We need to invent marshmallows for nights like this,1.2066115702479339,0.046823852807323284,121,102,13,6
Get it? This is the last face you'll see.,1.2066115702479339,0.046823852807323284,121,102,13,6
And this is the story of Humannosaurus Wrecks.,1.2066115702479339,0.04827229265897605,121,103,11,7
"Then the human said, ""Mumm it tastes just like chicken"".",1.2065217391304348,0.050174191266479935,92,76,13,3
And then I saw a human!,1.2065217391304348,0.04773424269856957,92,75,15,2
Check out my Donald Trump impersonation.,1.2065217391304348,0.052500866778413105,92,77,11,4
Found this new teeth whitening cream made 'specially for dragons.,1.2065217391304348,0.050174191266479935,92,76,13,3
"Yeah,but no, wait…
Can you hear me now?",1.2065217391304348,0.052500866778413105,92,77,11,4
"Suddenly, a human child’s face appears from ABOVE the bed!",1.2065217391304348,0.05472871783373013,92,78,9,5
But greater than the fear that made their blood run hot was the fear they would be shamed on social media.,1.2065217391304348,0.050174191266479935,92,76,13,3
Told you not to eat the dermatologist!,1.2065217391304348,0.04773424269856957,92,75,15,2
This is one of the reasons she broke up with you.,1.2065217391304348,0.05686935993101575,92,79,7,6
Oh puh-lease! That gag is prehistoric…,1.2061855670103092,0.048469142790159916,97,80,14,3
Tell me more terrifying human stories dad!,1.2061855670103092,0.05271442940426959,97,82,10,5
Helen! It’s me—Murray.,1.2061855670103092,0.05063629562986729,97,81,12,4
I think we've finally found a way to look scary.,1.2061855670103092,0.048469142790159916,97,80,14,3
"Yes yes, the Invisalign works so well, it IS scary.",1.2061068702290076,0.045615201352943426,131,111,13,7
George was no saint.,1.2058823529411764,0.046916646025273935,102,84,15,3
And then they put me in Jurassic Park.,1.2058823529411764,0.048941891412426566,102,85,13,4
Don't worry. We can roast marshmallows even if the fire goes out.,1.2058823529411764,0.052759670739643105,102,87,9,6
…ad then we were all transformed into oil that bipedal monkeys used to cook the planet!,1.2058823529411764,0.046916646025273935,102,84,15,3
"We're BOTH dragons, remember?",1.2058823529411764,0.048941891412426566,102,85,13,4
And then out of nowhere came this meteor.,1.2058823529411764,0.04479993988272699,102,83,17,2
"Then, after the meteor struck the world was taken over by two legged mammals who tried to destroy what was left!""",1.2058823529411764,0.048941891412426566,102,85,13,4
And then KaaaaPOW! We were all replaced by little bipeds with hideous loooong arms.,1.205607476635514,0.04739431115126178,107,89,14,4
"We should probably put out the fire as we are the last of our kind, don't ya think ??",1.205607476635514,0.04739431115126178,107,89,14,4
"Not to be rude, but can you see if I have some of that ichthyologist stuck between my teeth?",1.205607476635514,0.04739431115126178,107,89,14,4
Don't kid yourself. It gives a fiercely brighter smile.,1.205607476635514,0.04549598868304171,107,88,16,3
"He was a hardworking immigrant — they took one look and ran screaming, ‘Ahhhh, it’s Godzilla!’",1.2053571428571428,0.044190110926074416,112,92,17,3
...and then the meteors rained down everywhere!,1.2053571428571428,0.044190110926074416,112,92,17,3
"Once upon a time,there was a meteor",1.205128205128205,0.04298482850550572,117,96,18,3
Aging feet are a bitch.,1.205128205128205,0.04298482850550572,117,96,18,3
Quit goofing off!  If those batteries go dead we'll see who's scared!,1.205128205128205,0.04298482850550572,117,96,18,3
"Why did you name it, “Flashlight?”",1.205128205128205,0.04628628213956274,117,98,14,5
…George Martin quit writing and nobody ever worked again,1.205128205128205,0.04628628213956274,117,98,14,5
"As the smoke cleared, the terrible face appeared. It was the Master Dragon Slayer- GEORGE SANTOS!",1.2049180327868851,0.043456105251336315,122,101,17,4
It was a knight a lot like this knight...,1.2049180327868851,0.044987954837924234,122,102,15,5
"No, you're thinking of  The Blair Witch Project. Bruce Willis was in the The Sixth Sense.",1.204724409448819,0.045189241819249895,127,107,14,6
Be honest.  Do I look scary or just silly?,1.204724409448819,0.042333188189562124,127,105,18,4
I thought we discovered light until I found this thing.,1.2043010752688172,0.0519807292144392,93,78,11,4
You mean you prefer our old mating ritual?,1.2043010752688172,0.05418256454212406,93,79,9,5
So is this the glamping part of the trip?,1.2043010752688172,0.04727037156900375,93,76,15,2
"Fred, you don’t need the flashlight to look scary: You’re a dragon.",1.2043010752688172,0.04968140616939365,93,77,13,3
"Don't, please. You look too much like yourself.",1.2040816326530612,0.05221615820079095,98,83,10,5
He did the mash. He did the...,1.2040816326530612,0.048018124763472565,98,81,14,3
I think you had one too many roasted peasants.,1.2040816326530612,0.045774958984969194,98,80,16,2
Hunter-Gatherer Stories!,1.2040816326530612,0.048018124763472565,98,81,14,3
What are batteries ?,1.2040816326530612,0.05221615820079095,98,83,10,5
"Oh relax, it's just a helicopter.",1.203883495145631,0.04850560089606936,103,86,13,4
"I don’t know the end of the story.
This is when I ate him.",1.203883495145631,0.0444078652953465,103,84,17,2
"Bad lighting, the scariest thing of all.",1.203883495145631,0.0444078652953465,103,84,17,2
Hands on the wheel!” yelled the police officer.,1.203883495145631,0.04650189145818912,103,85,15,3
THAT vegetarian meal was delish! Any bones stuck in my teeth?,1.203883495145631,0.05407305748325548,103,89,7,7
"This story's called ""The very scary meteorite"".",1.203883495145631,0.04850560089606936,103,86,13,4
And then a big rock hit the planet and wiped us all out.,1.203883495145631,0.0444078652953465,103,84,17,2
"Fire, schmire, I still think they taste better raw.",1.203883495145631,0.052283153467325295,103,88,9,6
"Stop joking around, there's an asteroid coming!",1.203883495145631,0.050429760334432756,103,87,11,5
"""Am I the light of your life?",1.203883495145631,0.0444078652953465,103,84,17,2
And then they chose an orange to be their leader.,1.203883495145631,0.050429760334432756,103,87,11,5
"You just farted, didn't you.",1.2037037037037037,0.04699200358255153,108,90,14,4
"And then, the monster turned out to be a... meteor!",1.2037037037037037,0.04699200358255153,108,90,14,4
"And when they do this, that's when you jump out of the bushes!",1.2037037037037037,0.045112948630901144,108,89,16,3
"But Democrats, upon learning the Republicans had nominated Trump once again, realized they no choice but to vote for Biden.",1.2037037037037037,0.04879875682054561,108,91,12,5
"The next day, they found the Tokyo Tower hanging on the car door!",1.2037037037037037,0.045112948630901144,108,89,16,3
Whoa! That's even scarier than your Madonna impression.,1.2035398230088497,0.04199379137219394,113,92,19,2
It is just not quite the same as when we breathed fire to scare them.,1.2035398230088497,0.04730287467476536,113,95,13,5
But this move had that gorilla climbing the wall.,1.2035398230088497,0.04560190938547957,113,94,15,4
…and one day…they will use our dead bodies… as fuel,1.2035398230088497,0.04730287467476536,113,95,13,5
"And they say that if  you listen closely on a night just like tonight, you can still hear the sobs of parents who named their children Daenerys.",1.2035398230088497,0.04560190938547957,113,94,15,4
This is what that scary kid looked like before I ate him.,1.2033898305084745,0.04432003053970261,118,98,16,4
"And after taking a bite of the human, he realized it was... a VEGAN!",1.2033898305084745,0.04432003053970261,118,98,16,4
Your fossil fuel got nothin' on my long-lasting battery-powered flashlight.,1.2033898305084745,0.045925261661577774,118,99,14,5
And then she found out the calls were coming from inside the house!,1.2032520325203253,0.04313354160628968,123,102,17,4
"Tell  me another story, Puff!",1.202247191011236,0.050985625768042275,89,74,12,3
"And then, they won’t even catch their food. They get groceries.",1.202127659574468,0.05573860298930121,94,81,7,6
Suddenly he realized his arms were too short to lift the carcass!,1.202127659574468,0.046815269577118276,94,77,15,2
Just relax you are adorable.”,1.202127659574468,0.046815269577118276,94,77,15,2
"I don't know what was scarier, your ghost story or your people story.",1.202127659574468,0.04919806972822639,94,78,13,3
"And then, Karen demanded to speak to ... a manager!",1.202020202020202,0.04757530020731468,99,82,14,3
"Eh, I don’t know if I believe that asteroid dust would change the global climate.",1.202020202020202,0.04757530020731468,99,82,14,3
"For starters, there are these things called humans …",1.202020202020202,0.051727123604429784,99,84,10,5
"Do you know the origin story of that aggressive T-Rex in Jurassic Park? Well, I’ll tell you the tea.",1.202020202020202,0.045357095658013595,99,81,16,2
"Where did you get that thing?  You know, it doesn't make you look any better.",1.2019230769230769,0.04402246628452523,104,85,17,2
No more puffing the magic dragon.,1.2019230769230769,0.04609429503917236,104,86,15,3
Save your breath!,1.2019230769230769,0.04807692307692308,104,87,13,4
...and then the meteors came down.,1.2019230769230769,0.04184819040754393,104,84,19,1
And then they smile and laugh... LIKE THIS!,1.2019230769230769,0.04807692307692308,104,87,13,4
"Three Mesozoics walk into a bar""..",1.2019230769230769,0.04609429503917236,104,86,15,3
"It’s funny but I don’t think this will be a successful invention because it’s just light, it doesn’t get warm and you can’t use it for barbecue…",1.2019230769230769,0.0499809666766309,104,88,11,5
"And then, an asteroid hit Earth.",1.201834862385321,0.03862180715692689,109,87,22,0
Don’t you think it’s time we evolve into something better.,1.201834862385321,0.046596380216674414,109,91,14,4
Now that’s scary!,1.201834862385321,0.046596380216674414,109,91,14,4
"It was a dark and stormy night. High above, a giant asteroid silently approached the Earth...",1.201834862385321,0.04838509392989122,109,92,12,5
It's a gimmick Reg. Had it on for three hours last night and my Pterodactyl was still raw.,1.201834862385321,0.0427952487863065,109,89,18,2
And then Britain was taken over by inbred humans! WoooooOooooh!,1.201834862385321,0.0427952487863065,109,89,18,2
Let me know if you've heard this one before.  Once there was a spoiled despot named Vladimir Putin . . .,1.201834862385321,0.04838509392989122,109,92,12,5
"What's really scary, is you always burning the Smores.",1.201834862385321,0.044736204398555954,109,90,16,3
Wanna hear the one about the little boy under the bed?,1.201834862385321,0.04838509392989122,109,92,12,5
And then they were caught between a rock and a hard place…,1.201834862385321,0.046596380216674414,109,91,14,4
I still think we need bear spray.,1.201834862385321,0.04076197558232867,109,88,20,1
I call it a ‘Chin Illuminator’.,1.2017543859649122,0.046920083813689055,114,96,13,5
"In the year 65,000,000",1.2017543859649122,0.041662070036289175,114,93,19,2
"And then the wild things roared their multi-syllabic roars, and gnashed their pale teeth and rolled their bespectacled eyes and showed their opposable thumbs",1.2016806722689075,0.045569763256829106,119,100,14,5
"And then, the humans had to RETURN TO THE OFFICE!!",1.2016129032258065,0.04125591726495555,124,102,19,3
That's it? A big rock out of the Sky?,1.2016129032258065,0.03794456512136958,124,100,23,1
I can’t believe you forgot the marshmallows!,1.2014925373134329,0.042081210458167456,134,112,17,5
And they called him… Donald Trump! Bwaahahaha….,1.2,0.04043136875805354,110,89,20,1
Here's a story about global warming.,1.2,0.05124707431905383,100,85,10,5
"So, next time you look up at the night sky, don't wish for       shooting stars -- you might get something far more dangerous!",1.2,0.045248654113974406,90,73,16,1
"Look, I'm a shadow puppet.",1.2,0.044946657497549475,100,82,16,2
"… and he had a powerful roar and terrifying teeth, but oddly, tiny  hands on short little arms.",1.2,0.04923659639173309,100,84,12,4
"Before I grabbed him, they thought this was scary!",1.2,0.050970425959652337,95,80,11,4
A chill ran up my tail: it was Smokey the Bear himself.,1.2,0.044874602807341984,115,96,15,4
And then something moved ON TOP OF THE BED.,1.2,0.046207278580632616,110,92,14,4
Do I have anything in my teeth?,1.2,0.044874602807341984,115,96,15,4
"Put out that damn light, you'll draw attention to us!",1.2,0.04923659639173309,100,84,12,4
"But then, Tokyo launched their fighter jets and drove Godzilla back into the sea!",1.2,0.046207278580632616,110,92,14,4
And then this horrible monster with orange skin and yellow hair emerged from the woods...,1.2,0.05124707431905383,100,85,10,5
"Yup, your lipstick is smudged, I'll call make-up.",1.2,0.044946657497549475,100,82,16,2
"Suddenly, there was a huge explosion... and the designated survivor was all alone",1.2,0.046207278580632616,110,92,14,4
It’s just me. There are no monsters here!,1.2,0.04569367667316878,105,87,15,3
How many chins do I have?,1.2,0.05046599329648382,90,75,12,3
…and then the Human smiled an evil smile.,1.2,0.046207278580632616,110,92,14,4
And then this God told the new hairy-creatures that they could rule over all the earth and its creatures!,1.2,0.04388726267731849,95,77,17,1
This is my Geroge Santos face!,1.2,0.04872391770757887,95,79,13,3
"So, millions of years after the asteroid kills all of us, using us as fossil fuels, kills all living things once again, the circle of death.",1.2,0.05124707431905383,100,85,10,5
...and then suddenly this big rock from the sky came crashing down!,1.2,0.04388726267731849,95,77,17,1
"You have a cavity, upper right.",1.2,0.050970425959652337,95,80,11,4
"You eat the campers and all their stuff but keep their flashlight,every time.....I just don't get it is all.",1.2,0.046368696240474946,95,78,15,2
"Well, this is SCARRYOKE !",1.2,0.04923659639173309,100,84,12,4
"And then, they rebooted Jurassic Park with Chris PRATT!",1.2,0.05480568404520652,105,92,5,8
"''Suddenly, a huge ball of fire appeared in the sky, and
started plummeting toward earth...''",1.2,0.04714045207910317,100,83,14,3
Why do you do that when you know it scares the crap out of me.,1.2,0.04314133372787616,115,95,17,3
"Well, if you can get that thing to also give us some heat, I’ll consider going green.",1.2,0.0394469779986572,115,93,21,1
Which way is it to Yellowstone?,1.2,0.045219663059015265,120,101,14,5
You’re a shoo in for Pitch Perfect the Prehistoric version!,1.2,0.04714045207910317,100,83,14,3
